haditsId,kitabId,indo,arab,label
3206,30,"Telah menceritakan kepadaku [Muhammad bin Al Mutsanna] telah menceritakan kepadaku [Abdul A'la] telah menceritakan kepada kami [Daud] dari [Abu Nadlrah] dari [Abu Sa'id], bahwa seorang laki-laki dari Bani Aslam yang bernama Ma'iz bin Malik mendatangi Rasulullah shallallahu 'alaihi wasallam sambil berkata, ""Sesungguhnya aku telah berbuat keji, oleh karena itu luruskanlah daku!"" Namun Nabi shallallahu 'alaihi wasallam berpaling darinya, hal itu terjadi sampai berkali-kali."" Abu Sa'id berkata, ""Kemudian beliau bertanya kepada kaumnya, mereka menjawab, ""Kami tidak melihatnya berbuat keji melainkan dia telah melakukan sesuatu, dan dia tidak bisa keluar dari permasalahan itu kecuali jika telah ditegakkan had atasnya."" Abu Sa'id melanjutkan, ""Lalu dia kembali kepada Nabi shallallahu 'alaihi wasallam, lantas beliau memerintahkan kami untuk merajamnya."" Abu Sa'id melanjutkan, ""Setelah itu kami pergi ke Baqi' Gharqad, kami tidak mengikatnya dan tidak pula memendamnya."" Abu Sa'id melanjutkan, ""Lalu kami melemparinya dengan tulang belulang dan tanah liat yang keras."" Abu Sa'id berkata, ""Ma'iz berusaha lari hingga sampai dekat Hurrah, namun kami mengejarnya dan mendapatkannya kembali, lalu kami melemparinya dengan bebatuan yang besar hingga dia diam (mati)."" Di sore harinya Rasulullah shallallahu 'alaihi wasallam berdiri dan berkhutbah, sabdanya: ""Kenapa ketika kami berangkat perang untuk berjihad di jalan Allah, salah seorang dari kalian ada yang tidak ikut berangkat dan bersama keluarga kami, ia memiliki desahan seperti kambing jantan (saat kawin). Maka tidaklah kalian menghadapkan kepadaku orang yang melakukan perbuatan itu melainkan aku akan memberinya sanksi."" Abu Sa'id berkata, ""Maka beliau tidak memintakan ampun untuknya dan tidak pula mencacinya."" Dan telah menceritakan kepadaku [Muhammad bin Hatim] telah menceritakan kepada kami [Bahz] telah menceritakan kepada kami [Yazid bin Zurai'] telah menceritakan kepada kami [Daud] dengan sanad ini, seperti makna hadits tersebut. Dalam hadits tersebut ia menyebutkan, ""Di sore harinya, Nabi shallallahu 'alaihi wasallam berdiri dan memuji Allah dan mengagungkan-Nya, lalu bersabda: ""Amma Ba'du. Kenapa sekelompok orang ketika kami berangkat perang lalu salah seorang dari mereka mundur (tidak ikut) bersama kami, ia memiliki desahan seperti desahan kambing jantan (saat kawin) '. dan ia tidak menyebutkan, 'bersama keluarga kami'."" Dan telah menceritakan kepada kami [Suraij bin Yunus] telah menceritakan kepada kami [Yahya bin Zakaria bin Abu Zaidah]. (dalam jalur lain disebutkan) Telah menceritakan kepada kami [Abu Bakar bin Abu Syaibah] telah menceritakan kepada kami [Mu'awiyah bin Hisyam] telah menceritakan kepada kami [Sufyan] keduanya dari [Daud] dengan isnad sebagian hadits ini, namun dalam hadits Sufyan disebutkan, 'Jika ia mengakui telah berzina sebanyak tiga kali'.""","حَدَّثَنِي مُحَمَّدُ بْنُ الْمُثَنَّى حَدَّثَنِي عَبْدُ الْأَعْلَى حَدَّثَنَا دَاوُدُ عَنْ أَبِي نَضْرَةَ عَنْ أَبِي سَعِيدٍ
أَنَّ رَجُلًا مِنْ أَسْلَمَ يُقَالُ لَهُ مَاعِزُ بْنُ مَالِكٍ أَتَى رَسُولَ اللَّهِ صَلَّى اللَّهُ عَلَيْهِ وَسَلَّمَ فَقَالَ إِنِّي أَصَبْتُ فَاحِشَةً فَأَقِمْهُ عَلَيَّ فَرَدَّهُ النَّبِيُّ صَلَّى اللَّهُ عَلَيْهِ وَسَلَّمَ مِرَارًا قَالَ ثُمَّ سَأَلَ قَوْمَهُ فَقَالُوا مَا نَعْلَمُ بِهِ بَأْسًا إِلَّا أَنَّهُ أَصَابَ شَيْئًا يَرَى أَنَّهُ لَا يُخْرِجُهُ مِنْهُ إِلَّا أَنْ يُقَامَ فِيهِ الْحَدُّ قَالَ فَرَجَعَ إِلَى النَّبِيِّ صَلَّى اللَّهُ عَلَيْهِ وَسَلَّمَ فَأَمَرَنَا أَنْ نَرْجُمَهُ قَالَ فَانْطَلَقْنَا بِهِ إِلَى بَقِيعِ الْغَرْقَدِ قَالَ فَمَا أَوْثَقْنَاهُ وَلَا حَفَرْنَا لَهُ قَالَ فَرَمَيْنَاهُ بِالْعَظْمِ وَالْمَدَرِ وَالْخَزَفِ قَالَ فَاشْتَدَّ وَاشْتَدَدْنَا خَلْفَهُ حَتَّى أَتَى عُرْضَ الْحَرَّةِ فَانْتَصَبَ لَنَا فَرَمَيْنَاهُ بِجَلَامِيدِ الْحَرَّةِ يَعْنِي الْحِجَارَةَ حَتَّى سَكَتَ قَالَ ثُمَّ قَامَ رَسُولُ اللَّهِ صَلَّى اللَّهُ عَلَيْهِ وَسَلَّمَ خَطِيبًا مِنْ الْعَشِيِّ فَقَالَ أَوَ كُلَّمَا انْطَلَقْنَا غُزَاةً فِي سَبِيلِ اللَّهِ تَخَلَّفَ رَجُلٌ فِي عِيَالِنَا لَهُ نَبِيبٌ كَنَبِيبِ التَّيْسِ عَلَيَّ أَنْ لَا أُوتَى بِرَجُلٍ فَعَلَ ذَلِكَ إِلَّا نَكَّلْتُ بِهِ قَالَ فَمَا اسْتَغْفَرَ لَهُ وَلَا سَبَّهُ
حَدَّثَنِي مُحَمَّدُ بْنُ حَاتِمٍ حَدَّثَنَا بَهْزٌ حَدَّثَنَا يَزِيدُ بْنُ زُرَيْعٍ حَدَّثَنَا دَاوُدُ بِهَذَا الْإِسْنَادِ مِثْلَ مَعْنَاهُ وَقَالَ فِي الْحَدِيثِ فَقَامَ النَّبِيُّ صَلَّى اللَّهُ عَلَيْهِ وَسَلَّمَ مِنْ الْعَشِيِّ فَحَمِدَ اللَّهَ وَأَثْنَى عَلَيْهِ ثُمَّ قَالَ أَمَّا بَعْدُ فَمَا بَالُ أَقْوَامٍ إِذَا غَزَوْنَا يَتَخَلَّفُ أَحَدُهُمْ عَنَّا لَهُ نَبِيبٌ كَنَبِيبِ التَّيْسِ وَلَمْ يَقُلْ فِي عِيَالِنَا و حَدَّثَنَا سُرَيْجُ بْنُ يُونُسَ حَدَّثَنَا يَحْيَى بْنُ زَكَرِيَّاءَ بْنِ أَبِي زَائِدَةَ ح و حَدَّثَنَا أَبُو بَكْرِ بْنُ أَبِي شَيْبَةَ حَدَّثَنَا مُعَاوِيَةُ بْنُ هِشَامٍ حَدَّثَنَا سُفْيَانُ كِلَاهُمَا عَنْ دَاوُدَ بِهَذَا الْإِسْنَادِ بَعْضَ هَذَا الْحَدِيثِ غَيْرَ أَنَّ فِي حَدِيثِ سُفْيَانَ فَاعْتَرَفَ بِالزِّنَى ثَلَاثَ مَرَّاتٍ",47
3216,30,"Telah menceritakan kepada kami [Abdullah bin Maslamah Al Qa'nabi] telah menceritakan kepada kami [Malik]. (dalam jalur lain disebutkan) Telah menceritakan kepada kami [Yahya bin Yahya] sedangkan lafadz darinya, dia berkata; aku bacakan di hadapan [Malik]; dari [Ibnu Syihab] dari [Ubaidullah bin Abdullah] dari [Abu Hurairah], bahwa Rasulullah shallallahu 'alaihi wasallam pernah ditanya tentang sahaya perempuan yang berzina, sedangkan dia belum menikah. Beliau bersabda: ""Jika dia berzina maka deralah dia, kemudian jika dia berzina maka deralah dia, kemudian jika dia berzina deralah dia, kemudian juallah dia walaupun seharga seutas tali rambut."" [Ibnu Syihab] berkata, ""Aku tidak tahu, apakah setelah tiga kali (berzina) ataukah sampai empat kali."" Sedangkan dalam riwayatnya Al Qa'nabi menyebutkan, ""Ibnu Syihab mengatakan, ""Maksud Dlafir adalah seutas tali."" Dan telah menceritakan kepada kami [Abu At Thahir] telah mengabarkan kepada kami [Ibnu Wahb] dia berkata; aku pernah mendengar [Malik] berkata; telah menceritakan kepadaku [Ibnu Syihab] dari [Ubaidullah bin Abdullah bin 'Utbah] dari [Abu Hurairah] dan [Zaid bin Khalid Al Juhani], bahwa Rasulullah shallallahu 'alaihi wasallam pernah ditanya mengenai sahaya perempuan yang berzina seperti hadits keduanya, dan tidak menyebutkan perkataannya Ibnu Syihab 'maksud Dlafir adalah seutas tali'."" Telah menceritakan kepadaku ['Amru An Naqid] telah menceritakan kepada kami [Ya'qub bin Ibrahim bin Sa'd] telah menceritakan kepadaku [ayahku] dari [Shalih]. (dalam jalur lain disebutkan) Telah menceritakan kepada kami [Abd bin Humaid] telah mengabarkan kepada kami [Abdurrazaq] telah mengabarkan kepada kami [Ma'mar] keduanya dari [Az Zuhri] dari ['Ubaidullah] dari [Abu Hurairah] dan [Zaid bin Khalid Al Juhani] dari Nabi shallallahu 'alaihi wasallam seperti hadits riwayat Malik, ternyata riwayat mereka semua juga terdapat keraguan supaya menjualnya, apakah dikali ke tiga atau ke empat.""","حَدَّثَنَا عَبْدُ اللَّهِ بْنُ مَسْلَمَةَ الْقَعْنَبِيُّ حَدَّثَنَا مَالِكٌ ح و حَدَّثَنَا يَحْيَى بْنُ يَحْيَى وَاللَّفْظُ لَهُ قَالَ قَرَأْتُ عَلَى مَالِكٍ عَنْ ابْنِ شِهَابٍ عَنْ عُبَيْدِ اللَّهِ بْنِ عَبْدِ اللَّهِ عَنْ أَبِي هُرَيْرَةَ
أَنَّ رَسُولَ اللَّهِ صَلَّى اللَّهُ عَلَيْهِ وَسَلَّمَ سُئِلَ عَنْ الْأَمَةِ إِذَا زَنَتْ وَلَمْ تُحْصِنْ قَالَ إِنْ زَنَتْ فَاجْلِدُوهَا ثُمَّ إِنْ زَنَتْ فَاجْلِدُوهَا ثُمَّ إِنْ زَنَتْ فَاجْلِدُوهَا ثُمَّ بِيعُوهَا وَلَوْ بِضَفِيرٍ
قَالَ ابْنُ شِهَابٍ لَا أَدْرِي أَبَعْدَ الثَّالِثَةِ أَوْ الرَّابِعَةِ وَقَالَ الْقَعْنَبِيُّ فِي رِوَايَتِهِ قَالَ ابْنُ شِهَابٍ وَالضَّفِيرُ الْحَبْلُ و حَدَّثَنَا أَبُو الطَّاهِرِ أَخْبَرَنَا ابْنُ وَهْبٍ قَالَ سَمِعْتُ مَالِكًا يَقُولُ حَدَّثَنِي ابْنُ شِهَابٍ عَنْ عُبَيْدِ اللَّهِ بْنِ عَبْدِ اللَّهِ بْنِ عُتْبَةَ عَنْ أَبِي هُرَيْرَةَ وَزَيْدِ بْنِ خَالِدٍ الْجُهَنِيِّ أَنَّ رَسُولَ اللَّهِ صَلَّى اللَّهُ عَلَيْهِ وَسَلَّمَ سُئِلَ عَنْ الْأَمَةِ بِمِثْلِ حَدِيثِهِمَا وَلَمْ يَذْكُرْ قَوْلَ ابْنِ شِهَابٍ وَالضَّفِيرُ الْحَبْلُ حَدَّثَنِي عَمْرٌو النَّاقِدُ حَدَّثَنَا يَعْقُوبُ بْنُ إِبْرَاهِيمَ بْنِ سَعْدٍ حَدَّثَنِي أَبِي عَنْ صَالِحٍ ح و حَدَّثَنَا عَبْدُ بْنُ حُمَيْدٍ أَخْبَرَنَا عَبْدُ الرَّزَّاقِ أَخْبَرَنَا مَعْمَرٌ كِلَاهُمَا عَنْ الزُّهْرِيِّ عَنْ عُبَيْدِ اللَّهِ عَنْ أَبِي هُرَيْرَةَ وَزَيْدِ بْنِ خَالِدٍ الْجُهَنِيِّ عَنْ النَّبِيِّ صَلَّى اللَّهُ عَلَيْهِ وَسَلَّمَ بِمِثْلِ حَدِيثِ مَالِكٍ وَالشَّكُّ فِي حَدِيثِهِمَا جَمِيعًا فِي بَيْعِهَا فِي الثَّالِثَةِ أَوْ الرَّابِعَةِ",47
3513,34,"Dan telah menceritakan kepada kami [Zuhair bin Harb] telah menceritakan kepada kami [Isma'il bin 'Ulayyah] dari [Ali bin Mubarak] telah menceritakan kepada kami [Yahya bin Abu Katsir] telah menceritakan kepadaku [Abu Sa'id] bekas budak Al Mahri, dari [Abu Sa'id Al Khudri], bahwa Rasulullah shallallahu 'alaihi wasallam pernah mengirim utusan Bani Lahyan dari suku Hudzail, lalu beliau bersabda: ""Hendaknya setiap dua orang (dalam keluarga) keluar salah satunya, sedangkan pahala antara keduanya sama."" Dan telah menceritakan kepadaku [Ishaq bin Manshur] telah mengabarkan kepada kami [Abdush Shamad] -yaitu Ibnu Abdul Warits- dia berkata; saya pernah mendengar [ayahku] berkata; telah menceritakan kepada kami [Al Husain] dari [Yahya] telah menceritakan kepadaku [Abu Sa'id] bekas budak Al Mahri, telah menceritakan kepadaku [Abu Sa'id Al Khudri], bahwa Rasulullah pernah mengirim suatu pasukan…, seperti makna hadits di atas."" Dan telah menceritakan kepadaku [Ishaq bin Manshur] telah mengabarkan kepada kami ['Ubaidullah] -yaitu Ibnu Musa- dari [Syaiban] dari [Yahya] dengan sanad seperti ini.""","و حَدَّثَنَا زُهَيْرُ بْنُ حَرْبٍ حَدَّثَنَا إِسْمَعِيلُ ابْنُ عُلَيَّةَ عَنْ عَلِيِّ بْنِ الْمُبَارَكِ حَدَّثَنَا يَحْيَى بْنُ أَبِي كَثِيرٍ حَدَّثَنِي أَبُو سَعِيدٍ مَوْلَى الْمَهْرِيِّ عَنْ أَبِي سَعِيدٍ الْخُدْرِيِّ
أَنَّ رَسُولَ اللَّهِ صَلَّى اللَّهُ عَلَيْهِ وَسَلَّمَ بَعَثَ بَعْثًا إِلَى بَنِي لَحْيَانَ مِنْ هُذَيْلٍ فَقَالَ لِيَنْبَعِثْ مِنْ كُلِّ رَجُلَيْنِ أَحَدُهُمَا وَالْأَجْرُ بَيْنَهُمَا
و حَدَّثَنِيهِ إِسْحَقُ بْنُ مَنْصُورٍ أَخْبَرَنَا عَبْدُ الصَّمَدِ يَعْنِي ابْنَ عَبْدِ الْوَارِثِ قَالَ سَمِعْتُ أَبِي يُحَدِّثُ حَدَّثَنَا الْحُسَيْنُ عَنْ يَحْيَى حَدَّثَنِي أَبُو سَعِيدٍ مَوْلَى الْمَهْرِيِّ حَدَّثَنِي أَبُو سَعِيدٍ الْخُدْرِيُّ أَنَّ رَسُولَ اللَّهِ بَعَثَ بَعْثًا بِمَعْنَاهُ و حَدَّثَنِي إِسْحَقُ بْنُ مَنْصُورٍ أَخْبَرَنَا عُبَيْدُ اللَّهِ يَعْنِي ابْنَ مُوسَى عَنْ شَيْبَانَ عَنْ يَحْيَى بِهَذَا الْإِسْنَادِ مِثْلَهُ",47
3799,37,"Telah menceritakan kepada kami [Abu Bakr bin Abu Syaibah]; Telah menceritakan kepada kami [Khalaf bin Khalifah] dari [Yazid bin Kaisan] dari [Abu Hazim] dari [Abu Hurairah] ia berkata; Pada suatu hari atau suatu malam Rasulullah shallallahu 'alaihi wasallam pergi keluar rumah, tiba-tiba beliau bertemu dengan Abu Bakar dan 'Umar. Lalu beliau bertanya: ""Mengapa kalian keluar rumah malam-malam begini?"" Mereka menjawab; 'Kami lapar, ya Rasulullah! ' Rasulullah shallallahu 'alaihi wasallam bersabda: ""Demi Allah yang jiwaku dalam Tangan-Nya, aku juga keluar karena lapar seperti kalian. Marilah!"" Mereka pergi mengikuti beliau ke rumah shahabat Anshar (Abu Haitsam bin At Taihan). Namun sayang dia sedang tidak di rumah. Tetapi tatkala istrinya melihat Rasulullah shallallahu 'alaihi wasallam datang, dia mengucapkan; ""Marhaban wa Ahlan (selamat datang)."" Maka Rasulullah shallallahu 'alaihi wasallam bertanya: ""Kemana si Fulan (Abu Haitsam)?""' Isterinya menjawab; 'Dia sedang mengambil air tawar untuk kami.' Tiba-tiba suaminya datang dan melihat Rasulullah shallallahu 'alaihi wasallam beserta dua sahabat beliau, maka dia berkata; 'Alhamdulillah, tidak ada orang yang lebih bahagia dariku hari ini, karena kedatangan tamu yang mulia.' Lalu dia mengambil setandan kurma, di antaranya ada yang masih muda, yang mulai masak, dan yang sudah masak betul. Katanya; 'Silakan dimakan ini.' Sambil dia mengambil pisau. Nabi shallallahu 'alaihi wasallam bersabda: 'Jangan disembelih yang lagi mempunyai susu.' Maka dipotongnya seekor kambing, lalu mereka makan kambing, makan kurma setandan, dan minum. Setelah semuanya kenyang dan puas makan dan minum, Rasulullah shallallahu 'alaihi wasallam bersabda kepada Abu Bakar dan 'Umar: 'Demi Allah yang jiwaku berada dalam Tangan-Nya, kalian akan ditanya pada hari kiamat tentang nikmat yang kalian peroleh ini. Kalian keluar dari rumah karena lapar dan pulang sesudah memperoleh nikmat ini.' Telah menceritakan kepadaku [Ishaq bin Manshur]; Telah mengabarkan kepada kami [Abu Hisyam] yaitu Al Mughirah bin Salamah; Telah menceritakan kepada kami ['Abdul Wahid bin Ziyad]; Telah menceritakan kepada kami [Yazid]; Telah menceritakan kepada kami [Abu Hazim] ia berkata; Aku mendengar [Abu Hurairah] berkata; Tatkala Abu Bakr dan Umar sedang duduk-duduk, tiba-tiba Rasulullah shallallahu 'alaihi wasallam datang kepada mereka, beliau bertanya: ""Kenapa kalian duduk-duduk di sini?"" Mereka menjawab; 'Kami lapar hingga kami keluar rumah.' Rasulullah shallallahu 'alaihi wasallam bersabda: 'Demi Allah yang jiwaku dalam Tangan-Nya, …"" kemudian dia menyebutkan Hadits yang serupa dengan Hadits Khalfa bin Khalifah.","حَدَّثَنَا أَبُو بَكْرِ بْنُ أَبِي شَيْبَةَ حَدَّثَنَا خَلَفُ بْنُ خَلِيفَةَ عَنْ يَزِيدَ بْنِ كَيْسَانَ عَنْ أَبِي حَازِمٍ عَنْ أَبِي هُرَيْرَةَ قَالَ
خَرَجَ رَسُولُ اللَّهِ صَلَّى اللَّهُ عَلَيْهِ وَسَلَّمَ ذَاتَ يَوْمٍ أَوْ لَيْلَةٍ فَإِذَا هُوَ بِأَبِي بَكْرٍ وَعُمَرَ فَقَالَ مَا أَخْرَجَكُمَا مِنْ بُيُوتِكُمَا هَذِهِ السَّاعَةَ قَالَا الْجُوعُ يَا رَسُولَ اللَّهِ قَالَ وَأَنَا وَالَّذِي نَفْسِي بِيَدِهِ لَأَخْرَجَنِي الَّذِي أَخْرَجَكُمَا قُومُوا فَقَامُوا مَعَهُ فَأَتَى رَجُلًا مِنْ الْأَنْصَارِ فَإِذَا هُوَ لَيْسَ فِي بَيْتِهِ فَلَمَّا رَأَتْهُ الْمَرْأَةُ قَالَتْ مَرْحَبًا وَأَهْلًا فَقَالَ لَهَا رَسُولُ اللَّهِ صَلَّى اللَّهُ عَلَيْهِ وَسَلَّمَ أَيْنَ فُلَانٌ قَالَتْ ذَهَبَ يَسْتَعْذِبُ لَنَا مِنْ الْمَاءِ إِذْ جَاءَ الْأَنْصَارِيُّ فَنَظَرَ إِلَى رَسُولِ اللَّهِ صَلَّى اللَّهُ عَلَيْهِ وَسَلَّمَ وَصَاحِبَيْهِ ثُمَّ قَالَ الْحَمْدُ لِلَّهِ مَا أَحَدٌ الْيَوْمَ أَكْرَمَ أَضْيَافًا مِنِّي قَالَ فَانْطَلَقَ فَجَاءَهُمْ بِعِذْقٍ فِيهِ بُسْرٌ وَتَمْرٌ وَرُطَبٌ فَقَالَ كُلُوا مِنْ هَذِهِ وَأَخَذَ الْمُدْيَةَ فَقَالَ لَهُ رَسُولُ اللَّهِ صَلَّى اللَّهُ عَلَيْهِ وَسَلَّمَ إِيَّاكَ وَالْحَلُوبَ فَذَبَحَ لَهُمْ فَأَكَلُوا مِنْ الشَّاةِ وَمِنْ ذَلِكَ الْعِذْقِ وَشَرِبُوا فَلَمَّا أَنْ شَبِعُوا وَرَوُوا قَالَ رَسُولُ اللَّهِ صَلَّى اللَّهُ عَلَيْهِ وَسَلَّمَ لِأَبِي بَكْرٍ وَعُمَرَ وَالَّذِي نَفْسِي بِيَدِهِ لَتُسْأَلُنَّ عَنْ هَذَا النَّعِيمِ يَوْمَ الْقِيَامَةِ أَخْرَجَكُمْ مِنْ بُيُوتِكُمْ الْجُوعُ ثُمَّ لَمْ تَرْجِعُوا حَتَّى أَصَابَكُمْ هَذَا النَّعِيمُ
و حَدَّثَنِي إِسْحَقُ بْنُ مَنْصُورٍ أَخْبَرَنَا أَبُو هِشَامٍ يَعْنِي المُغِيرَةَ بْنَ سَلَمَةَ حَدَّثَنَا عَبْدُ الْوَاحِدِ بْنُ زِيَادٍ حَدَّثَنَا يَزِيدُ حَدَّثَنَا أَبُو حَازِمٍ قَالَ سَمِعْتُ أَبَا هُرَيْرَةَ يَقُولُا بَيْنَا أَبُو بَكْرٍ قَاعِدٌ وَعُمَرُ مَعَهُ إِذْ أَتَاهُمَا رَسُولُ اللَّهِ صَلَّى اللَّهُ عَلَيْهِ وَسَلَّمَ فَقَالَ مَا أَقْعَدَكُمَا هَاهُنَا قَالَا أَخْرَجَنَا الْجُوعُ مِنْ بُيُوتِنَا وَالَّذِي بَعَثَكَ بِالْحَقِّ ثُمَّ ذَكَرَ نَحْوَ حَدِيثِ خَلَفِ بْنِ خَلِيفَةَ",47
