haditsId,kitabId,indo,arab,label
4410,45,"Telah menceritakan kepada kami [Manshur bin Abu Muzahim]; Telah menceritakan kepada kami [Ibrahim] yaitu Ibnu Sa'ad; Demikian juga diriwayatkan dari jalur lainnya, Dan telah menceritakan kepada kami [Hasan Al Hulwani] dan ['Abad bin Humaid] keduanya berkata; ['Abad] berkata; Telah mengabarkan kepadaku; dan berkata [Hasan]; Telah menceritakan kepada kami [Ya'qub] yaitu Ibnu Ibrahim bin Sa'ad; Telah menceritakan kepada kami [Bapakku] dari [Shalih] dari [Ibnu Syihab]; Telah mengabarkan kepadaku ['Abdul Hamid bin 'Abdur Rahman bin Zaid], [Muhammad bin Sa'ad bin Abi Waqqash] Telah menceritakan kepadanya bahwa bapaknya yaitu [Sa'ad] berkata; ""Pada suatu ketika Umar bin Khaththab pernah meminta izin kepada Rasulullah shallallahu 'alaihi wasallam untuk bertamu kepada beliau yang saat itu ada beberapa wanita Quraisy yang sedang berbicara dengan beliau secara panjang lebar dan dengan suara yang lantang. Setelah Umar meminta izin untuk masuk, maka kaum wanita itu segera berdiri dan bersembunyi di balik tirai (hijab). Kemudian Rasulullah shallallahu 'alaihi wasallam mempersilahkan Umar masuk sambil tersenyum-senyum simpul. Umar berkata; ""Apa yang membuat anda tersenyum ya Rasulullah!"" Rasulullah shallallahu 'alaihi wasallam menjawab: ""Hai Umar, sebenarnya aku sendiri merasa heran dengan kaum wanita yang berada bersamaku tadi. Karena, ketika mereka mendengar suaramu, maka mereka segera bersembunyi."" Lalu Umar berkata, Sebenarnya engkaulah yang lebih berhak mereka segani."" Kemudian Umar menoleh ke tabir tempat kaum wanita dan berkata; ""Hai orang-orang yang menjadi musuhnya sendiri, apakah kalian merasa segan kepadaku dan tidak segan kepada Rasulullah?"" Kaum wanita Quraisy itu pun menjawab; ""Ya, karena engkau lebih keras dari Rasulullah!"" Maka Rasulullah shallallahu 'alaihi wasallam pun bersabda; ""Demi jiwaku yang berada di tangan-Nya, sungguh tak ada syetan yang berpapasan denganmu di suatu jalan ya Umar, melainkan syetan tersebut akan berpaling ke jalan lain untuk menghindar dari jalanmu."" Telah menceritakan kepada kami [Harun bin Ma'ruf]; Telah menceritakan kepada kami dengannya ['Abdul 'Aziz bin Muhammad]; Telah mengabarkan kepadaku [Suhail] dari [Bapaknya] dari [Abu Hurairah] bahwa 'Umar bin Al Khaththab datang kepada Rasulullah shallallahu 'alaihi wasallam yang di saat itu ada beberapa wanita Quraisy sedang berbicara dengan beliau dengan suara yang lantang. Setelah Umar meminta izin untuk masuk, maka kaum wanita itu segera berdiri dan bersembunyi di balik tirai (hijab) -sebagaimana Hadits Az Zuhri.","حَدَّثَنَا مَنْصُورُ بْنُ أَبِي مُزَاحِمٍ حَدَّثَنَا إِبْرَاهِيمُ يَعْنِي ابْنَ سَعْدٍ ح و حَدَّثَنَا حَسَنٌ الْحُلْوَانِيُّ وَعَبْدُ بْنُ حُمَيْدٍ قَالَ عَبْدٌ أَخْبَرَنِي و قَالَ حَسَنٌ حَدَّثَنَا يَعْقُوبُ وَهُوَ ابْنُ إِبْرَاهِيمَ بْنِ سَعْدٍ حَدَّثَنَا أَبِي عَنْ صَالِحٍ عَنْ ابْنِ شِهَابٍ أَخْبَرَنِي عَبْدُ الْحَمِيدِ بْنُ عَبْدِ الرَّحْمَنِ بْنِ زَيْدٍ أَنَّ مُحَمَّدَ بْنَ سَعْدِ بْنِ أَبِي وَقَّاصٍ أَخْبَرَهُ أَنَّ أَبَاهُ سَعْدًا قَالَ
اسْتَأْذَنَ عُمَرُ عَلَى رَسُولِ اللَّهِ صَلَّى اللَّهُ عَلَيْهِ وَسَلَّمَ وَعِنْدَهُ نِسَاءٌ مِنْ قُرَيْشٍ يُكَلِّمْنَهُ وَيَسْتَكْثِرْنَهُ عَالِيَةً أَصْوَاتُهُنَّ فَلَمَّا اسْتَأْذَنَ عُمَرُ قُمْنَ يَبْتَدِرْنَ الْحِجَابَ فَأَذِنَ لَهُ رَسُولُ اللَّهِ صَلَّى اللَّهُ عَلَيْهِ وَسَلَّمَ وَرَسُولُ اللَّهِ صَلَّى اللَّهُ عَلَيْهِ وَسَلَّمَ يَضْحَكُ فَقَالَ عُمَرُ أَضْحَكَ اللَّهُ سِنَّكَ يَا رَسُولَ اللَّهِ فَقَالَ رَسُولُ اللَّهِ صَلَّى اللَّهُ عَلَيْهِ وَسَلَّمَ عَجِبْتُ مِنْ هَؤُلَاءِ اللَّاتِي كُنَّ عِنْدِي فَلَمَّا سَمِعْنَ صَوْتَكَ ابْتَدَرْنَ الْحِجَابَ قَالَ عُمَرُ فَأَنْتَ يَا رَسُولَ اللَّهِ أَحَقُّ أَنْ يَهَبْنَ ثُمَّ قَالَ عُمَرُ أَيْ عَدُوَّاتِ أَنْفُسِهِنَّ أَتَهَبْنَنِي وَلَا تَهَبْنَ رَسُولَ اللَّهِ صَلَّى اللَّهُ عَلَيْهِ وَسَلَّمَ قُلْنَ نَعَمْ أَنْتَ أَغْلَظُ وَأَفَظُّ مِنْ رَسُولِ اللَّهِ صَلَّى اللَّهُ عَلَيْهِ وَسَلَّمَ قَالَ رَسُولُ اللَّهِ صَلَّى اللَّهُ عَلَيْهِ وَسَلَّمَ وَالَّذِي نَفْسِي بِيَدِهِ مَا لَقِيَكَ الشَّيْطَانُ قَطُّ سَالِكًا فَجًّا إِلَّا سَلَكَ فَجًّا غَيْرَ فَجِّكَ
حَدَّثَنَا هَارُونُ بْنُ مَعْرُوفٍ حَدَّثَنَا بِهِ عَبْدُ الْعَزِيزِ بْنُ مُحَمَّدٍ أَخْبَرَنِي سُهَيْلٌ عَنْ أَبِيهِ عَنْ أَبِي هُرَيْرَةَ أَنَّ عُمَرَ بْنَ الْخَطَّابِ جَاءَ إِلَى رَسُولِ اللَّهِ صَلَّى اللَّهُ عَلَيْهِ وَسَلَّمَ وَعِنْدَهُ نِسْوَةٌ قَدْ رَفَعْنَ أَصْوَاتَهُنَّ عَلَى رَسُولِ اللَّهِ صَلَّى اللَّهُ عَلَيْهِ وَسَلَّمَ فَلَمَّا اسْتَأْذَنَ عُمَرُ ابْتَدَرْنَ الْحِجَابَ فَذَكَرَ نَحْوَ حَدِيثِ الزُّهْرِيِّ",58
4414,45,"Telah menceritakan kepada kami [Yahya bin Yahya] dan [Yahya bin Ayyub] dan [Qutaibah] dan [Ibnu Hujr]. [Yahya bin Yahya] berkata; Telah mengabarkan kepada kami Sedangkan yang lainnya berkata; Telah menceritakan kepada kami [Isma'il] yaitu Ibnu Ja'far dari [Muhammad bin Abu Harmalah] dari ['Atha] dan [Sulaiman] -kedua anak Yasar dan [Abu Salamah bin 'Abdur Rahman] bahwa ['Aisyah] berkata; 'Pada suatu ketika, Rasulullah shallallahu 'alaihi wasallam sedang berbaring di rumah saya dengan membiarkan kedua pahanya atau kedua betisnya terbuka. Tak lama kemudian, Abu Bakar minta izin kepada Rasulullah untuk masuk ke dalam rumah beliau. Maka Rasulullah pun mempersilahkannya untuk masuk dalam kondisi beliau tetap seperti itu dan terus berbincang-bincang (tentang suatu hal). Lalu Umar bin Khaththab datang dan meminta izin kepada Rasulullah untuk masuk ke dalam rumah beliau. Maka Rasulullah pun mempersilahkannya untuk masuk dalam kondisi beliau tetap seperti itu dan terus berbincang-bincang (tentang suatu hal). Kemudian Utsman bin Affan datang dan meminta izin kepada beliau untuk masuk ke dalam rumah beliau. Maka Rasulullah pun mempersilahkannya untuk masuk seraya mengambil posisi duduk dan membetulkan pakaiannya. Muhammad berkata; Saya tidak mengatakan hal itu pada hari yang sama. Lalu Utsman masuk dan langsung bercakap-cakap dengan beliau tentang berbagai hal. Setelah Utsman keluar dari rumah, Aisyah bertanva; ""Ya Rasulullah, tadi ketika Abu Bakar masuk ke rumah engkau tidak terlihat tergesa-gesa untuk menyambutnya. Kemudian ketika Umar datang dan masuk, engkaupun menyambutnya dengan biasa-biasa saja. Akan tetapi ketika Utsman bin Affan datang dan masuk ke rumah maka engkau segera bangkit dari pembaringan dan langsung mengambil posisi duduk sambil membetulkan pakaian engkau. Sebenarnya ada apa dengan hal ini semua ya Rasulullah'?"" Rasulullah shallallahu 'alaihi wasallam menjawab: ""Hai Aisyah, bagaimana mungkin aku tidak merasa malu kepada seseorang yang para malaikat saja merasa malu kepadanya?.""","حَدَّثَنَا يَحْيَى بْنُ يَحْيَى وَيَحْيَى بْنُ أَيُّوبَ وَقُتَيْبَةُ وَابْنُ حُجْرٍ قَالَ يَحْيَى بْنُ يَحْيَى أَخْبَرَنَا و قَالَ الْآخَرُونَ حَدَّثَنَا إِسْمَعِيلُ يَعْنُونَ ابْنَ جَعْفَرٍ عَنْ مُحَمَّدِ بْنِ أَبِي حَرْمَلَةَ عَنْ عَطَاءٍ وَسُلَيْمَانَ ابْنَيْ يَسَارٍ وَأَبِي سَلَمَةَ بْنِ عَبْدِ الرَّحْمَنِ أَنَّ عَائِشَةَ قَالَتْ
كَانَ رَسُولُ اللَّهِ صَلَّى اللَّهُ عَلَيْهِ وَسَلَّمَ مُضْطَجِعًا فِي بَيْتِي كَاشِفًا عَنْ فَخِذَيْهِ أَوْ سَاقَيْهِ فَاسْتَأْذَنَ أَبُو بَكْرٍ فَأَذِنَ لَهُ وَهُوَ عَلَى تِلْكَ الْحَالِ فَتَحَدَّثَ ثُمَّ اسْتَأْذَنَ عُمَرُ فَأَذِنَ لَهُ وَهُوَ كَذَلِكَ فَتَحَدَّثَ ثُمَّ اسْتَأْذَنَ عُثْمَانُ فَجَلَسَ رَسُولُ اللَّهِ صَلَّى اللَّهُ عَلَيْهِ وَسَلَّمَ وَسَوَّى ثِيَابَهُ قَالَ مُحَمَّدٌ وَلَا أَقُولُ ذَلِكَ فِي يَوْمٍ وَاحِدٍ فَدَخَلَ فَتَحَدَّثَ فَلَمَّا خَرَجَ قَالَتْ عَائِشَةُ دَخَلَ أَبُو بَكْرٍ فَلَمْ تَهْتَشَّ لَهُ وَلَمْ تُبَالِهِ ثُمَّ دَخَلَ عُمَرُ فَلَمْ تَهْتَشَّ لَهُ وَلَمْ تُبَالِهِ ثُمَّ دَخَلَ عُثْمَانُ فَجَلَسْتَ وَسَوَّيْتَ ثِيَابَكَ فَقَالَ أَلَا أَسْتَحِي مِنْ رَجُلٍ تَسْتَحِي مِنْهُ الْمَلَائِكَةُ",58
4415,45,"Telah menceritakan kepada kami ['Abdul Malik bin Syu'aib bin Al Laits bin Sa'ad]; Telah menceritakan kepadaku [Bapakku] dari [Kakekku]; Telah menceritakan kepadaku ['Uqail bin Khalid] dari [Ibnu Syihab] dari [Yahya bin Sa'id bin Al 'Ash] bahwa [Sa'id bin Al 'Ash] Telah mengabarkan kepadanya, ['Aisyah] istri Nabi shallallahu 'alaihi wasallam dan [Utsman] telah menceritakan kepadanya; Abu Bakar meminta izin untuk menemui Rasulullah shallallahu 'alaihi wasallam sedang saya bersama beliau dalam satu selimut, kemudian beliau mengizinkannya dan dia menyampaikan keperluannya kepada beliau sedang beliau masih bersamaku dalam selimut. Setelah itu Abu Bakar keluar. Kemudian Umar meminta izin kepada beliau dalam keadaan yang sama. lalu beliau mengizinkannya dan dia menyampaikan keperluannya kepada beliau, setelah itu Umar keluar. Utsman berkata; Kemudian aku meminta izin kepada beliau, lalu beliau segera duduk seraya berkata kepada Aisyah; 'Betulkan pakaianmu wahai Aisyah! Lalu aku menyampaikan keperluanku kepada beliau setelah itu aku keluar. Aisyah berkata; wahai Rasulullah! aku melihat sikapmu kepada Abu Bakar dan Umar ketika mereka meminta izin (menemuimu) tidak sama dengan sikapmu kepada Utsman ketika dia datang, kenapa demikian? Beliau bersabda: ""Sesungguhnya Ustman adalah orang yang sangat pemalu dan jika aku mengizinkannya dalam keadaanku yang seperti itu, aku khawatir dia tidak mau menyampaikan keperluannya kepadaku."" Dan telah menceritakannya kepada kami ['Amru An Naqid] dan [Al Hasan bin 'Ali Al Hulwani] dan ['Abad bin Humaid] seluruhnya dari [Ya'qub bin Ibrahim bin Sa'ad]; Telah menceritakan kepada kami [Bapakku] dari [Shalih bin Kaisan] dari [Ibnu Syihab] dia berkata; Telah mengabarkan kepadaku [Yahya bin Sa'd bin Al 'Ash] bahwa [Sa'd bin Al 'Ash] telah mengabarkan kepadanya; bahwanya ['Utsman] dan ['Aisyah] telah menceritakannya kepada kami; Abu Bakr Ash Shiddiq meminta izin untuk menemui Rasulullah shallallahu 'alaihi wasallam. -lalu perawi menyebutkan Hadits yang sama dengan Hadits Uqail dari Az Zuhri.","حَدَّثَنَا عَبْدُ الْمَلِكِ بْنُ شُعَيْبِ بْنِ اللَّيْثِ بْنِ سَعْدٍ حَدَّثَنِي أَبِي عَنْ جَدِّي حَدَّثَنِي عُقَيْلُ بْنُ خَالِدٍ عَنْ ابْنِ شِهَابٍ عَنْ يَحْيَى بْنِ سَعِيدِ بْنِ الْعَاصِ أَنَّ سَعِيدَ بْنَ الْعَاصِ أَخْبَرَهُ أَنَّ عَائِشَةَ زَوْجَ النَّبِيِّ صَلَّى اللَّهُ عَلَيْهِ وَسَلَّمَ وَعُثْمَانَ حَدَّثَاهُ
أَنَّ أَبَا بَكْرٍ اسْتَأْذَنَ عَلَى رَسُولِ اللَّهِ صَلَّى اللَّهُ عَلَيْهِ وَسَلَّمَ وَهُوَ مُضْطَجِعٌ عَلَى فِرَاشِهِ لَابِسٌ مِرْطَ عَائِشَةَ فَأَذِنَ لِأَبِي بَكْرٍ وَهُوَ كَذَلِكَ فَقَضَى إِلَيْهِ حَاجَتَهُ ثُمَّ انْصَرَفَ ثُمَّ اسْتَأْذَنَ عُمَرُ فَأَذِنَ لَهُ وَهُوَ عَلَى تِلْكَ الْحَالِ فَقَضَى إِلَيْهِ حَاجَتَهُ ثُمَّ انْصَرَفَ قَالَ عُثْمَانُ ثُمَّ اسْتَأْذَنْتُ عَلَيْهِ فَجَلَسَ وَقَالَ لِعَائِشَةَ اجْمَعِي عَلَيْكِ ثِيَابَكِ فَقَضَيْتُ إِلَيْهِ حَاجَتِي ثُمَّ انْصَرَفْتُ فَقَالَتْ عَائِشَةُ يَا رَسُولَ اللَّهِ مَالِي لَمْ أَرَكَ فَزِعْتَ لِأَبِي بَكْرٍ وَعُمَرَ رَضِيَ اللَّهُ عَنْهُمَا كَمَا فَزِعْتَ لِعُثْمَانَ قَالَ رَسُولُ اللَّهِ صَلَّى اللَّهُ عَلَيْهِ وَسَلَّمَ إِنَّ عُثْمَانَ رَجُلٌ حَيِيٌّ وَإِنِّي خَشِيتُ إِنْ أَذِنْتُ لَهُ عَلَى تِلْكَ الْحَالِ أَنْ لَا يَبْلُغَ إِلَيَّ فِي حَاجَتِهِ
و حَدَّثَنَاه عَمْرٌو النَّاقِدُ وَالْحَسَنُ بْنُ عَلِيٍّ الْحُلْوَانِيُّ وَعَبْدُ بْنُ حُمَيْدٍ كُلُّهُمْ عَنْ يَعْقُوبَ بْنِ إِبْرَاهِيمَ بْنِ سَعْدٍ حَدَّثَنَا أَبِي عَنْ صَالِحِ بْنِ كَيْسَانَ عَنْ ابْنِ شِهَابٍ قَالَ أَخْبَرَنِي يَحْيَى بْنُ سَعِيدِ بْنِ الْعَاصِ أَنَّ سَعِيدَ بْنَ الْعَاصِ أَخْبَرَهُ أَنَّ عُثْمَانَ وَعَائِشَةَ حَدَّثَاهُ أَنَّ أَبَا بَكْرٍ الصِّدِّيقَ اسْتَأْذَنَ عَلَى رَسُولِ اللَّهِ صَلَّى اللَّهُ عَلَيْهِ وَسَلَّمَ فَذَكَرَ بِمِثْلِ حَدِيثِ عُقَيْلٍ عَنْ الزُّهْرِيِّ",58
