haditsId,kitabId,indo,arab,label
4,1,"Telah menceritakan kepada kami [Muhammad bin Ubaid al-Ghubari] telah menceritakan kepada kami [Abu Awanah] dari [Abu Hashin] dari [Abu Shalih] dari [Abu Hurairah] dia berkata, ""Rasulullah shallallahu 'alaihi wasallam bersabda: ""Barangsiapa berdusta atas namaku maka hendaklah dia menempati tempat duduknya dari neraka.""","و حَدَّثَنَا مُحَمَّدُ بْنُ عُبَيْدٍ الْغُبَرِيُّ حَدَّثَنَا أَبُو عَوَانَةَ عَنْ أَبِي حَصِينٍ عَنْ أَبِي صَالِحٍ عَنْ أَبِي هُرَيْرَةَ قَالَ
قَالَ رَسُولُ اللَّهِ صَلَّى اللَّهُ عَلَيْهِ وَسَلَّمَ مَنْ كَذَبَ عَلَيَّ مُتَعَمِّدًا فَلْيَتَبَوَّأْ مَقْعَدَهُ مِنْ النَّارِ",58
5,1,"Telah menceritakan kepada kami [Muhammad bin Abdullah bin Numair] telah menceritakan kepada kami [Bapakku] telah menceritakan kepada kami [Sa'id bin 'Ubaid] telah menceritakan kepada kami [Ali bin Rabi'ah] dia berkata, ""Aku mendatangi masjid sedangkan al-Mughirah, gubernur Kufah. Ia berkata, ""Lalu [al-Mughirah] berkata, 'Saya mendengar Rasulullah shallallahu 'alaihi wasallam bersabda: ""Sesungguhnya berdusta atas namaku tidaklah sama dengan berdusta atas nama seseorang, barangsiapa berdusta atas namaku secara sengaja maka hendaklah dia menempati tempat duduknya dari neraka."" Dan telah menceritakan kepadaku [Ali bin Hujr as Sa'di] telah menceritakan kepada kami [Ali bin Mushir] telah mengabarkan kepada kami [Muhammad bin Qais al Asdi] dari [Ali bin Rabi'ah al Asdi] dari [al-Mughirah bin Syu'bah] dari Nabi shallallahu 'alaihi wasallam dengan semisal hadits tersebut, hanya saja dia tidak menyebut, ""Sesungguhnya berdusta atas namaku tidaklah sama dengan berdusta atas nama seseorang.""","و حَدَّثَنَا مُحَمَّدُ بْنُ عَبْدِ اللَّهِ بْنِ نُمَيْرٍ حَدَّثَنَا أَبِي حَدَّثَنَا سَعِيدُ بْنُ عُبَيْدٍ حَدَّثَنَا عَلِيُّ بْنُ رَبِيعَةَ قَالَ أَتَيْتُ الْمَسْجِدَ وَالْمُغِيرَةُ أَمِيرُ الْكُوفَةِ قَالَ فَقَالَ الْمُغِيرَةُ
سَمِعْتُ رَسُولَ اللَّهِ صَلَّى اللَّهُ عَلَيْهِ وَسَلَّمَ يَقُولُ إِنَّ كَذِبًا عَلَيَّ لَيْسَ كَكَذِبٍ عَلَى أَحَدٍ فَمَنْ كَذَبَ عَلَيَّ مُتَعَمِّدًا فَلْيَتَبَوَّأْ مَقْعَدَهُ مِنْ النَّارِ
و حَدَّثَنِي عَلِيُّ بْنُ حُجْرٍ السَّعْدِيُّ حَدَّثَنَا عَلِيُّ بْنُ مُسْهِرٍ أَخْبَرَنَا مُحَمَّدُ بْنُ قَيْسٍ الْأَسْدِيُّ عَنْ عَلِيِّ بْنِ رَبِيعَةَ الْأَسَدِيِّ عَنْ الْمُغِيرَةِ بْنِ شُعْبَةَ عَنْ النَّبِيِّ صَلَّى اللَّهُ عَلَيْهِ وَسَلَّمَ بِمِثْلِهِ وَلَمْ يَذْكُرْ إِنَّ كَذِبًا عَلَيَّ لَيْسَ كَكَذِبٍ عَلَى أَحَدٍ",58
23,2,"Telah menceritakan kepada kami [Khalaf bin Hisyam] telah menceritakan kepada kami [Hammad bin Zaid] dari [Abu Jamrah] dia berkata, Saya mendengar [Ibnu Abbas]. (dalam riwayat lain disebutkan) Dan telah menceritakan kepada kami [Yahya bin Yahya] dan lafazh ini adalah miliknya, telah mengabarkan kepada kami [Abbad bin Abbad] dari [Abu Jamrah] dari [Ibnu Abbas] dia berkata, ""Utusan Abdul Qais menghadap Rasulullah shallallahu 'alaihi wasallam seraya mereka berkata, 'Wahai Rasulullah, sesungguhnya desa ini adalah termasuk kabilah Rabi'ah, dan sungguh para kafir Mudlar telah menghalangi antara kami dan kamu, sehingga kita tidak bisa selamat menujumu kecuali pada bulan Haram, maka perintahkanlah kepada kami untuk mengamalkan suatu perintah dan kami akan mendakwahkannya kepada orang-orang yang ada di belakang kami.' Beliau bersabda: ""Saya memerintahkan kepada kalian dengan empat perkara dan melarang kalian dari empat perkara: Yaitu iman kepada Allah, "" kemudian beliau menafsirkannya untuk mereka seraya bersabda: ""Persaksian bahwa tidak ada tuhan (yang berhak disembah) selain Allah dan bahwa Muhammad adalah utusan Allah, mendirikan shalat, menunaikan zakat, dan mengeluarkan seperlima dari harta rampasan perang. Dan aku melarang kamu agar tidak membuat arak perasan dalam ad-Duba`, al-Hantam, an Naqir dan al-Muqayyar."" Khalaf menambahkan dalam riwayatnya, ""Persaksian bahwa tidak ada tuhan (yang berhak disembah) selain Allah. Dan mengikatkan sekali.""","حَدَّثَنَا خَلَفُ بْنُ هِشَامٍ حَدَّثَنَا حَمَّادُ بْنُ زَيْدٍ عَنْ أَبِي جَمْرَةَ قَالَ سَمِعْتُ ابْنَ عَبَّاسٍ ح و حَدَّثَنَا يَحْيَى بْنُ يَحْيَى وَاللَّفْظُ لَهُ أَخْبَرَنَا عَبَّادُ بْنُ عَبَّادٍ عَنْ أَبِي جَمْرَةَ عَنْ ابْنِ عَبَّاسٍ قَالَ
قَدِمَ وَفْدُ عَبْدِ الْقَيْسِ عَلَى رَسُولِ اللَّهِ صَلَّى اللَّهُ عَلَيْهِ وَسَلَّمَ فَقَالُوا يَا رَسُولَ اللَّهِ إِنَّا هَذَا الْحَيَّ مِنْ رَبِيعَةَ وَقَدْ حَالَتْ بَيْنَنَا وَبَيْنَكَ كُفَّارُ مُضَرَ فَلَا نَخْلُصُ إِلَيْكَ إِلَّا فِي شَهْرِ الْحَرَامِ فَمُرْنَا بِأَمْرٍ نَعْمَلُ بِهِ وَنَدْعُو إِلَيْهِ مَنْ وَرَاءَنَا قَالَ آمُرُكُمْ بِأَرْبَعٍ وَأَنْهَاكُمْ عَنْ أَرْبَعٍ الْإِيمَانِ بِاللَّهِ ثُمَّ فَسَّرَهَا لَهُمْ فَقَالَ شَهَادَةِ أَنْ لَا إِلَهَ إِلَّا اللَّهُ وَأَنَّ مُحَمَّدًا رَسُولُ اللَّهِ وَإِقَامِ الصَّلَاةِ وَإِيتَاءِ الزَّكَاةِ وَأَنْ تُؤَدُّوا خُمُسَ مَا غَنِمْتُمْ وَأَنْهَاكُمْ عَنْ الدُّبَّاءِ وَالْحَنْتَمِ وَالنَّقِيرِ وَالْمُقَيَّرِ
زَادَ خَلَفٌ فِي رِوَايَتِهِ شَهَادَةِ أَنْ لَا إِلَهَ إِلَّا اللَّهُ وَعَقَدَ وَاحِدَةً",58
27,2,"Telah menceritakan kepada kami [Abu Bakr bin Abu Syaibah] dan [Abu Kuraib], dan [Ishaq bin Ibrahim] semuanya dari [Waki'], [Abu Bakar] berkata, telah menceritakan kepada kami [Waki'] dari [Zakariya bin Ishaq] dia berkata, telah menceritakan kepadaku [Yahya bin Abdullah bin Shaifi] dari [Abu Ma'bad] dari [Ibnu Abbas] dari [Mu'adz bin Jabal], Abu Bakar berkata, ""Barangkali, "" Waki' berkata, dari Ibnu Abbas, bahwa Mu'adz berkata, ""Rasulullah shallallahu 'alaihi wasallam mengutusku. Beliau bersabda: ""Sesungguhnya kamu akan mendatangi suatu kaum dari Ahli Kitab, maka ajaklah mereka kepada persaksian bahwa tidak ada tuhan (yang berhak disembah) selain Allah, dan bahwa aku adalah utusan Allah. Jika mereka mentaatimu untuk hal tersebut, maka beritahukanlah kepada mereka bahwa Allah telah mewajibkan kepada mereka shalat lima waktu pada setiap siang dan malam. Jika mereka mentaatimu untuk hal tersebut maka beritahukanlah kepada mereka bahwa Allah telah mewajibkan kepada mereka sedekah yang diambil dari orang kaya mereka lalu dibagikan kepada orang-orang fakir di antara mereka. Jika mereka mentaatimu untuk hal tersebut maka kamu jauhilah harta mulia mereka. Takutlah kamu terhadap doa orang yang terzhalimi, karena tidak ada penghalang antara dia dan Allah'."" Telah menceritakan kepada kami [Ibnu Abu Umar] telah menceritakan kepada kami [Bisyr bin as-Sari] telah menceritakan kepada kami [Zakariya' bin Ishaq]. (dalam riwayat lain disebutkan) Dan telah menceritakan kepada kami [Abd bin Humaid] telah menceritakan kepada kami [Abu Ashim] dari [Zakariya' bin Ishaq] dari [Yahya bin Abdullah bin Shaifi] dari [Abu Ma'bad] dari [Ibnu Abbas], bahwa Nabi shallallahu 'alaihi wasallam mengutus Mu'adz ke Yaman, maka beliau bersabda: ""Sesungguhnya kamu akan mendatangi suatu kaum."" Sebagaimana hadits Waki'.","حَدَّثَنَا أَبُو بَكْرِ بْنُ أَبِي شَيْبَةَ وَأَبُو كُرَيْبٍ وَإِسْحَقُ بْنُ إِبْرَاهِيمَ جَمِيعًا عَنْ وَكِيعٍ قَالَ أَبُو بَكْرٍ حَدَّثَنَا وَكِيعٌ عَنْ زَكَرِيَّاءَ بْنِ إِسْحَقَ قَالَ حَدَّثَنِي يَحْيَى بْنُ عَبْدِ اللَّهِ بْنِ صَيْفِيٍّ عَنْ أَبِي مَعْبَدٍ عَنْ ابْنِ عَبَّاسٍ عَنْ مُعَاذِ بْنِ جَبَلٍ قَالَ أَبُو بَكْرٍ رُبَّمَا قَالَ وَكِيعٌ عَنْ ابْنِ عَبَّاسٍ أَنَّ مُعَاذًا قَالَ
بَعَثَنِي رَسُولُ اللَّهِ صَلَّى اللَّهُ عَلَيْهِ وَسَلَّمَ قَالَ إِنَّكَ تَأْتِي قَوْمًا مِنْ أَهْلِ الْكِتَابِ فَادْعُهُمْ إِلَى شَهَادَةِ أَنْ لَا إِلَهَ إِلَّا اللَّهُ وَأَنِّي رَسُولُ اللَّهِ فَإِنْ هُمْ أَطَاعُوا لِذَلِكَ فَأَعْلِمْهُمْ أَنَّ اللَّهَ افْتَرَضَ عَلَيْهِمْ خَمْسَ صَلَوَاتٍ فِي كُلِّ يَوْمٍ وَلَيْلَةٍ فَإِنْ هُمْ أَطَاعُوا لِذَلِكَ فَأَعْلِمْهُمْ أَنَّ اللَّهَ افْتَرَضَ عَلَيْهِمْ صَدَقَةً تُؤْخَذُ مِنْ أَغْنِيَائِهِمْ فَتُرَدُّ فِي فُقَرَائِهِمْ فَإِنْ هُمْ أَطَاعُوا لِذَلِكَ فَإِيَّاكَ وَكَرَائِمَ أَمْوَالِهِمْ وَاتَّقِ دَعْوَةَ الْمَظْلُومِ فَإِنَّهُ لَيْسَ بَيْنَهَا وَبَيْنَ اللَّهِ حِجَابٌ
حَدَّثَنَا ابْنُ أَبِي عُمَرَ حَدَّثَنَا بِشْرُ بْنُ السَّرِيِّ حَدَّثَنَا زَكَرِيَّاءُ بْنُ إِسْحَقَ ح و حَدَّثَنَا عَبْدُ بْنُ حُمَيْدٍ حَدَّثَنَا أَبُو عَاصِمٍ عَنْ زَكَرِيَّاءَ بْنِ إِسْحَقَ عَنْ يَحْيَى بْنِ عَبْدِ اللَّهِ بْنِ صَيْفِيٍّ عَنْ أَبِي مَعْبَدٍ عَنْ ابْنِ عَبَّاسٍ أَنَّ النَّبِيَّ صَلَّى اللَّهُ عَلَيْهِ وَسَلَّمَ بَعَثَ مُعَاذًا إِلَى الْيَمَنِ فَقَالَ إِنَّكَ سَتَأْتِي قَوْمًا بِمِثْلِ حَدِيثِ وَكِيعٍ",58
43,2,"Telah menceritakan kepada kami [Haddab bin Khalid al-Azdi] telah menceritakan kepada kami [Hammam] telah menceritakan kepada kami [Qatadah] telah menceritakan kepada kami [Anas bin Malik] dari [Mu'adz bin Jabal] dia berkata, ""Pernah aku dibonceng Nabi shallallahu 'alaihi wasallam dalam satu perjalanan, tidak ada pemisah antara aku dan beliau kecuali pelana hewan kendaraan. Beliau memanggil: ""Wahai Mu'adz bin Jabal!"" Aku terus menyahut, ""Aku penuhi panggilanmu wahai Rasulullah."" Kami meneruskan lagi perjalanan. Kemudian beliau memanggil lagi: ""Wahai Mu'adz bin Jabal!"" Aku menyahut, ""Aku penuhi panggilanmu wahai Rasulullah."" Kami meneruskan lagi perjalanan kemudian beliau memanggil lagi: ""Wahai Mu'adz bin Jabal!"" Aku menyahut lagi, ""Telah kuterima panggilanmu itu wahai Rasulullah."" Beliau bersabda: ""Tahukah kamu Kewajiban manusia terhadap Allah?"" Aku menjawab, ""Allah dan Rasul-Nyalah yang lebih mengetahui."" Beliau bersabda: ""Yaitu menyembah-Nya dan tidak menyekutukan-Nya."" Kami meneruskan lagi perjalanan beberapa waktu ketika kemudian beliau memanggil lagi: ""Wahai Mu'adz bin Jabal!"" Aku menyahut, ""Aku penuhi panggilanmu wahai Rasulullah."" Rasulullah shallallahu 'alaihi wasallam bersabda: ""Tahukah kamu apakah Kewajiban Allah terhadap manusia apabila mereka melakukan perkara-perkara yang aku nyatakan tadi?"" Aku menjawab, ""Allah dan Rasul-Nyalah yang lebih mengetahui."" Akhirnya beliau bersabda: ""Allah tidak akan menyiksa mereka.""","حَدَّثَنَا هَدَّابُ بْنُ خَالِدٍ الْأَزْدِيُّ حَدَّثَنَا هَمَّامٌ حَدَّثَنَا قَتَادَةُ حَدَّثَنَا أَنَسُ بْنُ مَالِكٍ عَنْ مُعَاذِ بْنِ جَبَلٍ قَالَ
كُنْتُ رِدْفَ النَّبِيِّ صَلَّى اللَّهُ عَلَيْهِ وَسَلَّمَ لَيْسَ بَيْنِي وَبَيْنَهُ إِلَّا مُؤْخِرَةُ الرَّحْلِ فَقَالَ يَا مُعَاذَ بْنَ جَبَلٍ قُلْتُ لَبَّيْكَ رَسُولَ اللَّهِ وَسَعْدَيْكَ ثُمَّ سَارَ سَاعَةً ثُمَّ قَالَ يَا مُعَاذَ بْنَ جَبَلٍ قُلْتُ لَبَّيْكَ رَسُولَ اللَّهِ وَسَعْدَيْكَ ثُمَّ سَارَ سَاعَةً ثُمَّ قَالَ يَا مُعَاذَ بْنَ جَبَلٍ قُلْتُ لَبَّيْكَ رَسُولَ اللَّهِ وَسَعْدَيْكَ قَالَ هَلْ تَدْرِي مَا حَقُّ اللَّهِ عَلَى الْعِبَادِ قَالَ قُلْتُ اللَّهُ وَرَسُولُهُ أَعْلَمُ قَالَ فَإِنَّ حَقَّ اللَّهِ عَلَى الْعِبَادِ أَنْ يَعْبُدُوهُ وَلَا يُشْرِكُوا بِهِ شَيْئًا ثُمَّ سَارَ سَاعَةً قَالَ يَا مُعَاذَ بْنَ جَبَلٍ قُلْتُ لَبَّيْكَ رَسُولَ اللَّهِ وَسَعْدَيْكَ قَالَ هَلْ تَدْرِي مَا حَقُّ الْعِبَادِ عَلَى اللَّهِ إِذَا فَعَلُوا ذَلِكَ قَالَ قُلْتُ اللَّهُ وَرَسُولُهُ أَعْلَمُ قَالَ أَنْ لَا يُعَذِّبَهُمْ",58
44,2,"Telah menceritakan kepada kami [Abu Bakar bin Abu Syaibah] telah menceritakan kepada kami [Abu al-Ahwash Sallam bin Sulaim] dari [Abu Ishaq] dari [Amru bin Maimun] dari [Mu'adz bin Jabal] dia berkata, ""Saya berada di boncengan Rasulullah di atas keledai yang dinamakan Ufair."" Beliau lalu bersabda: ""Wahai Mu'adz apakah kamu mengetahui apa hak Allah atas hamba dan hak hamba atas Allah.' Mu'adz berkata, 'Aku lalu menjawab, 'Allah dan Rasul-Nya lebih mengetahui.' Beliau bersabda: ""Sesungguhnya hak Allah atas hamba adalah kalian menyembah Allah dan tidak mensyirikkan-Nya dengan sesuatu apa pun, dan hak hamba atas Allah adalah agar tidak disiksa orang yang tidak mensyirikkan-Nya dengan sesuatu apa pun.' Mu'adz berkata, 'Saya lalu berkata, 'Wahai Rasulullah, tidakkah boleh aku memberitakannya kepada manusia? ' Beliau menjawab: 'Jangan kamu memberitahukannya kepada mereka sehingga mereka bersandar kepadanya'.""","حَدَّثَنَا أَبُو بَكْرِ بْنُ أَبِي شَيْبَةَ حَدَّثَنَا أَبُو الْأَحْوَصِ سَلَّامُ بْنُ سُلَيْمٍ عَنْ أَبِي إِسْحَقَ عَنْ عَمْرِو بْنِ مَيْمُونٍ عَنْ مُعَاذِ بْنِ جَبَلٍ قَالَ
كُنْتُ رِدْفَ رَسُولِ اللَّهِ صَلَّى اللَّهُ عَلَيْهِ وَسَلَّمَ عَلَى حِمَارٍ يُقَالُ لَهُ عُفَيْرٌ قَالَ فَقَالَ يَا مُعَاذُ تَدْرِي مَا حَقُّ اللَّهِ عَلَى الْعِبَادِ وَمَا حَقُّ الْعِبَادِ عَلَى اللَّهِ قَالَ قُلْتُ اللَّهُ وَرَسُولُهُ أَعْلَمُ قَالَ فَإِنَّ حَقَّ اللَّهِ عَلَى الْعِبَادِ أَنْ يَعْبُدُوا اللَّهَ وَلَا يُشْرِكُوا بِهِ شَيْئًا وَحَقُّ الْعِبَادِ عَلَى اللَّهِ عَزَّ وَجَلَّ أَنْ لَا يُعَذِّبَ مَنْ لَا يُشْرِكُ بِهِ شَيْئًا قَالَ قُلْتُ يَا رَسُولَ اللَّهِ أَفَلَا أُبَشِّرُ النَّاسَ قَالَ لَا تُبَشِّرْهُمْ فَيَتَّكِلُوا",58
46,2,"Telah menceritakan kepada kami [Zuhair bin Harb] telah menceritakan kepada kami [Umar bin Yunus al-Hanafi] telah menceritakan kepada kami [Ikrimah bin Ammar] dia berkata, telah menceritakan kepada kami [Abu Katsir] dia berkata, telah menceritakan kepada kami [Abu Hurairah] dia berkata, ""Dalam sebuah peperangan kami pernah duduk-duduk mengitari Rasulullah shallallahu 'alaihi wasallam, dan bersama kami ada Abu Bakar dan Umar. Lalu beliau beranjak pergi dari sekeliling kami dan terlambat untuk kembali sampai-sampai kami khawatir kalau beliau tertangkap oleh musuh atau tertimpa musibah. Kami semua sangat khawatir, dan orang yang paling mengkhawatirkan keadaan beliau adalah aku. Maka aku pun berdiri dan keluar untuk mencari Rasulullah shallallahu 'alaihi wasallam hingga sampai pada sebuah kebun milik kaum anshar dari bani Najjar. Akupun mengitarinya dengan harapan akan mendapatkan sebuah pintu masuk, namun aku tidak mendapatkannya. Dan ternyata ada sebuah aliran sungai dari luar kebun yang masuk dari sebuah pojok kebun. Maka akupun berusaha masuk sebagaimana seekor musang berusaha masuk melalui sebuah lobang sempit. Dan aku pun menemukan Rasulullah shallallahu 'alaihi wasallam. Beliau berseru: 'Abu Hurairah! ' Akupun menjawab, 'Ya, wahai Rasulullah.""Ada apa?"", tanya beliau. Aku menjawab, ""Begini wahai Rasul, engkau tadi sedang bersama-sama dengan kami, lalu tiba-tiba engkau pergi meninggalkan kami dan lama tidak kembali hingga kami pun sangat khawatir akan keselamatanmu, terutama aku wahai Rasul. Maka akupun berusaha memasuki kebun ini dari sebuah lobang yang sangat sempit sebagaimana seekor musang, dan mereka (para sahabat yang lain) ada di belakangku. Sambil berkata beliau memberikan kedua sandalnya kepadaku: 'Wahai Abu Hurairah, bawalah kedua sandalku ini, dan siapapun yang kau temui di balik kebun ini ia bersaksi bahwa tidak tuhan (yang berhak disembah) selain Allah dan ia menancapkan keyakinan ini dalam hatinya, maka berilah kabar gembira kepadanya dengan surga.' Dan kebetulan orang yang pertama kali bertemu denganku ialah Umar, maka iapun bertanya, 'Ada apa dengan kedua sandal itu wahai Abu Hurairah? ' Aku menjawab, 'Ini adalah kedua sandal Rasulullah shallallahu 'alaihi wasallam, beliau menyuruhku untuk membawanya dan menyampaikan kabar gembira surga kepada orang yang pertama kali bertemu denganku sedang ia bersaksi bahwa tiada tuhan (yang berhak disembah) selain Allah, dan ia menyakininya dengan hatinya.' Maka Umar pun memukulku dengan tangannya tepat di tengah-tengah dadaku (ulu hati-pent) hingga aku jatuh duduk, lalu berkata, 'Kembalilah wahai Abu Hurairah! ' Maka akupun kembali menemui Rasulullah dengan wajah menahan tangis, dan ternyata Umar saat itu juga mengikutiku. Seketika itu Rasulullah shallallahu 'alaihi wasallam bertanya: 'Ada apa denganmu wahai Abu Hurairah? ' Aku menjawab, 'Aku telah bertemu dengan Umar, lalu aku kabarkan kepadanya mengenai apa yang telah engkau perintahkan kepadaku namun tiba-tiba ia memukulku dengan keras tepat di ulu hatiku hingga aku jatuh lunglai, setelah itu dia berkata, 'Kembalilah! ' Maka Rasul pun berkata: 'Wahai Umar, kenapa kamu berbuat demikian? ' Umar menjawab, 'Wahai Rasulullah, apa benar engkau telah mengutus Abu Hurairah dengan kedua sandalmu itu dan menyuruhnya memberi kabar gembira dengan surga bagi orang yang pertama kali ditemuinya sedang ia bersaksi bahwa tiada tuhan (yang berhak disembah) selain Allah dengan keyakinan yang mantap dalam hatinya? ' Beliau menjawab: 'Ya, benar.' Umar berkata, 'Sebaiknya engkau tidak berbuat demikian wahai Rasulullah, karena sesungguhnya aku sangat khawatir kalau-kalau manusia akan bergantung padanya, dan biarkanlah mereka melaksanakan amalan-amalan yang baik.' Rasulullah shallallahu 'alaihi wasallam berkata (kepada Abu Hurairah-pent): 'Biarkanlah mereka (tidak mengetahui hadits ini) '.""","حَدَّثَنِي زُهَيْرُ بْنُ حَرْبٍ حَدَّثَنَا عُمَرُ بْنُ يُونُسَ الْحَنَفِيُّ حَدَّثَنَا عِكْرِمَةُ بْنُ عَمَّارٍ قَالَ حَدَّثَنِي أَبُو كَثِيرٍ قَالَ حَدَّثَنِي أَبُو هُرَيْرَةَ قَالَ
كُنَّا قُعُودًا حَوْلَ رَسُولِ اللَّهِ صَلَّى اللَّهُ عَلَيْهِ وَسَلَّمَ مَعَنَا أَبُو بَكْرٍ وَعُمَرُ فِي نَفَرٍ فَقَامَ رَسُولُ اللَّهِ صَلَّى اللَّهُ عَلَيْهِ وَسَلَّمَ مِنْ بَيْنِ أَظْهُرِنَا فَأَبْطَأَ عَلَيْنَا وَخَشِينَا أَنْ يُقْتَطَعَ دُونَنَا وَفَزِعْنَا فَقُمْنَا فَكُنْتُ أَوَّلَ مَنْ فَزِعَ فَخَرَجْتُ أَبْتَغِي رَسُولَ اللَّهِ صَلَّى اللَّهُ عَلَيْهِ وَسَلَّمَ حَتَّى أَتَيْتُ حَائِطًا لِلْأَنْصَارِ لِبَنِي النَّجَّارِ فَدُرْتُ بِهِ هَلْ أَجِدُ لَهُ بَابًا فَلَمْ أَجِدْ فَإِذَا رَبِيعٌ يَدْخُلُ فِي جَوْفِ حَائِطٍ مِنْ بِئْرٍ خَارِجَةٍ وَالرَّبِيعُ الْجَدْوَلُ فَاحْتَفَزْتُ كَمَا يَحْتَفِزُ الثَّعْلَبُ فَدَخَلْتُ عَلَى رَسُولِ اللَّهِ صَلَّى اللَّهُ عَلَيْهِ وَسَلَّمَ فَقَالَ أَبُو هُرَيْرَةَ فَقُلْتُ نَعَمْ يَا رَسُولَ اللَّهِ قَالَ مَا شَأْنُكَ قُلْتُ كُنْتَ بَيْنَ أَظْهُرِنَا فَقُمْتَ فَأَبْطَأْتَ عَلَيْنَا فَخَشِينَا أَنْ تُقْتَطَعَ دُونَنَا فَفَزِعْنَا فَكُنْتُ أَوَّلَ مِنْ فَزِعَ فَأَتَيْتُ هَذَا الْحَائِطَ فَاحْتَفَزْتُ كَمَا يَحْتَفِزُ الثَّعْلَبُ وَهَؤُلَاءِ النَّاسُ وَرَائِي فَقَالَ يَا أَبَا هُرَيْرَةَ وَأَعْطَانِي نَعْلَيْهِ قَالَ اذْهَبْ بِنَعْلَيَّ هَاتَيْنِ فَمَنْ لَقِيتَ مِنْ وَرَاءِ هَذَا الْحَائِطِ يَشْهَدُ أَنْ لَا إِلَهَ إِلَّا اللَّهُ مُسْتَيْقِنًا بِهَا قَلْبُهُ فَبَشِّرْهُ بِالْجَنَّةِ فَكَانَ أَوَّلَ مَنْ لَقِيتُ عُمَرُ فَقَالَ مَا هَاتَانِ النَّعْلَانِ يَا أَبَا هُرَيْرَةَ فَقُلْتُ هَاتَانِ نَعْلَا رَسُولِ اللَّهِ صَلَّى اللَّهُ عَلَيْهِ وَسَلَّمَ بَعَثَنِي بِهِمَا مَنْ لَقِيتُ يَشْهَدُ أَنْ لَا إِلَهَ إِلَّا اللَّهُ مُسْتَيْقِنًا بِهَا قَلْبُهُ بَشَّرْتُهُ بِالْجَنَّةِ فَضَرَبَ عُمَرُ بِيَدِهِ بَيْنَ ثَدْيَيَّ فَخَرَرْتُ لِاسْتِي فَقَالَ ارْجِعْ يَا أَبَا هُرَيْرَةَ فَرَجَعْتُ إِلَى رَسُولِ اللَّهِ صَلَّى اللَّهُ عَلَيْهِ وَسَلَّمَ فَأَجْهَشْتُ بُكَاءً وَرَكِبَنِي عُمَرُ فَإِذَا هُوَ عَلَى أَثَرِي فَقَالَ لِي رَسُولُ اللَّهِ صَلَّى اللَّهُ عَلَيْهِ وَسَلَّمَ مَا لَكَ يَا أَبَا هُرَيْرَةَ قُلْتُ لَقِيتُ عُمَرَ فَأَخْبَرْتُهُ بِالَّذِي بَعَثْتَنِي بِهِ فَضَرَبَ بَيْنَ ثَدْيَيَّ ضَرْبَةً خَرَرْتُ لِاسْتِي قَالَ ارْجِعْ فَقَالَ لَهُ رَسُولُ اللَّهِ يَا عُمَرُ مَا حَمَلَكَ عَلَى مَا فَعَلْتَ قَالَ يَا رَسُولَ اللَّهِ بِأَبِي أَنْتَ وَأُمِّي أَبَعَثْتَ أَبَا هُرَيْرَةَ بِنَعْلَيْكَ مَنْ لَقِيَ يَشْهَدُ أَنْ لَا إِلَهَ إِلَّا اللَّهُ مُسْتَيْقِنًا بِهَا قَلْبُهُ بَشَّرَهُ بِالْجَنَّةِ قَالَ نَعَمْ قَالَ فَلَا تَفْعَلْ فَإِنِّي أَخْشَى أَنْ يَتَّكِلَ النَّاسُ عَلَيْهَا فَخَلِّهِمْ يَعْمَلُونَ قَالَ رَسُولُ اللَّهِ صَلَّى اللَّهُ عَلَيْهِ وَسَلَّمَ فَخَلِّهِمْ",58
