haditsId,kitabId,indo,arab,label
2719,19,"Dan telah menceritakan kepada kami [Muhammad bin Amru bin Jabalah] telah menceritakan kepada kami [Abu Ahmad] telah menceritakan kepada kami [Ammar bin Ruzaiq] dari [Abu Ishaq] dia berkata; Saya pernah duduk di Masjid Jami' bersama Al Aswad bin Yazid dan juga As Sya'bi, lalu [As Sya'bi] menceritakan hadits [Fathimah binti Qais], bahwa Rasulullah shallallahu 'alaihi wasallam tidak menjadikan hak tempat tinggal dan nafkah untuknya. Kemudian Al Aswad mengambil segenggam kerikil dan melemparnya sambil berkata; Celaka kamu, kenapa kamu menceritakan seperti ini? Umar telah berkata; Saya tidak akan meninggalkan Kitabullah dan Sunnah Nabi shallallahu 'alaihi wasallam karena perkataan seorang wanita, kita tidak tahu, bisa saja dia benar-benar hafal atau memang dia itu lupa, sebenarnya dia masih berhak mendapatkan nafkah dan tempat tinggal, kerena Allah Azza Wa Jalla telah berfirman: ""Janganlah kamu keluarkan mereka dari rumah mereka dan janganlah mereka (diizinkan) keluar kecuali kalau mereka mengerjakan perbuatan keji yang terang."" Dan telah menceritakan kepada kami [Ahmad bin Abdah Ad Dlabi] telah menceritakan kepada kami [Abu Daud] telah menceritakan kepada kami [Sulaiman bin Ma'adz] dari [Abu Ishaq] dengan isnad ini sebagaimana hadits Abu Ahmad dari 'Ammar bin Zuraiq dengan alur ceritanya.","و حَدَّثَنَاه مُحَمَّدُ بْنُ عَمْرِو بْنِ جَبَلَةَ حَدَّثَنَا أَبُو أَحْمَدَ حَدَّثَنَا عَمَّارُ بْنُ رُزَيْقٍ عَنْ أَبِي إِسْحَقَ قَالَ كُنْتُ مَعَ الْأَسْوَدِ بْنِ يَزِيدَ جَالِسًا فِي الْمَسْجِدِ الْأَعْظَمِ وَمَعَنَا الشَّعْبِيُّ فَحَدَّثَ الشَّعْبِيُّ بِحَدِيثِ فَاطِمَةَ بِنْتِ قَيْسٍ
أَنَّ رَسُولَ اللَّهِ صَلَّى اللَّهُ عَلَيْهِ وَسَلَّمَ لَمْ يَجْعَلْ لَهَا سُكْنَى وَلَا نَفَقَةً ثُمَّ أَخَذَ الْأَسْوَدُ كَفًّا مِنْ حَصًى فَحَصَبَهُ بِهِ فَقَالَ وَيْلَكَ تُحَدِّثُ بِمِثْلِ هَذَا قَالَ عُمَرُ لَا نَتْرُكُ كِتَابَ اللَّهِ وَسُنَّةَ نَبِيِّنَا صَلَّى اللَّهُ عَلَيْهِ وَسَلَّمَ لِقَوْلِ امْرَأَةٍ لَا نَدْرِي لَعَلَّهَا حَفِظَتْ أَوْ نَسِيَتْ لَهَا السُّكْنَى وَالنَّفَقَةُ قَالَ اللَّهُ عَزَّ وَجَلَّ
{ لَا تُخْرِجُوهُنَّ مِنْ بُيُوتِهِنَّ وَلَا يَخْرُجْنَ إِلَّا أَنْ يَأْتِينَ بِفَاحِشَةٍ مُبَيِّنَةٍ }
و حَدَّثَنَا أَحْمَدُ بْنُ عَبْدَةَ الضَّبِّيُّ حَدَّثَنَا أَبُو دَاوُدَ حَدَّثَنَا سُلَيْمَانُ بْنُ مُعَاذٍ عَنْ أَبِي إِسْحَقَ بِهَذَا الْإِسْنَادِ نَحْوَ حَدِيثِ أَبِي أَحْمَدَ عَنْ عَمَّارِ بْنِ رُزَيْقٍ بِقِصَّتِهِ",58
2774,21,"Telah menceritakan kepada kami [Abu Kuraib] telah menceritakan kepada kami [Abu Mu'awiyah] telah menceritakan kepada kami [Al A'masy] dari [Ibrahim At Taimi] dari [ayahnya] dia berkata; "" [Ali bin Abi Thalib] berkhutbah, seraya mengatakan; ""Barangsiapa yang mengira bahwa di sisi kami ada sesuatu yang kami baca selain Kitabullah dan lembaran ini -ayah Ibrahim berkata; saat itu lembaran tesebut menggantung di sarungnya- sungguh dia telah berdusta, di dalamnya terdapat penjelasan tentang umur-rumu unta dan hukum-hukum melukai, dan di dalamnya juga tertulis bahwa Rasulullah shallallahu 'alaihi wasallam bersabda: ""Kota Madinah dijadikan kota Haram (suci) yaitu antara 'Air hingga Tsaur. Barangsiapa yang berbuat kejahatan padanya atau melindungi pelaku kejahatan, maka ia berhak mendapat laknat Allah, Maliakat dan seluruh manusia, tidak diterima amalan fardhu maupun amalan sunnahnya. Jaminan (perlindungan) kaum Muslimin adalah satu, di mana bisa diusahakan oleh orang yang paling rendah dari mereka sekalipun. Barangsiapa yang menisbatkan diri kepada selain ayahnya, atau kepada selain walinya, maka ia berhak mendapatkan laknat dari Allah, para Malaikat dan manusia seluruhnya, Allah tidak akan menerima amalan fardhunya maupun amalam sunnahnya kelak di Hari Kiamat."" ","و حَدَّثَنَا أَبُو كُرَيْبٍ حَدَّثَنَا أَبُو مُعَاوِيَةَ حَدَّثَنَا الْأَعْمَشُ عَنْ إِبْرَاهِيمَ التَّيْمِيِّ عَنْ أَبِيهِ قَالَ
خَطَبَنَا عَلِيُّ بْنُ أَبِي طَالِبٍ فَقَالَ مَنْ زَعَمَ أَنَّ عِنْدَنَا شَيْئًا نَقْرَؤُهُ إِلَّا كِتَابَ اللَّهِ وَهَذِهِ الصَّحِيفَةَ قَالَ وَصَحِيفَةٌ مُعَلَّقَةٌ فِي قِرَابِ سَيْفِهِ فَقَدْ كَذَبَ فِيهَا أَسْنَانُ الْإِبِلِ وَأَشْيَاءُ مِنْ الْجِرَاحَاتِ وَفِيهَا قَالَ النَّبِيُّ صَلَّى اللَّهُ عَلَيْهِ وَسَلَّمَ الْمَدِينَةُ حَرَمٌ مَا بَيْنَ عَيْرٍ إِلَى ثَوْرٍ فَمَنْ أَحْدَثَ فِيهَا حَدَثًا أَوْ آوَى مُحْدِثًا فَعَلَيْهِ لَعْنَةُ اللَّهِ وَالْمَلَائِكَةِ وَالنَّاسِ أَجْمَعِينَ لَا يَقْبَلُ اللَّهُ مِنْهُ يَوْمَ الْقِيَامَةِ صَرْفًا وَلَا عَدْلًا وَذِمَّةُ الْمُسْلِمِينَ وَاحِدَةٌ يَسْعَى بِهَا أَدْنَاهُمْ وَمَنْ ادَّعَى إِلَى غَيْرِ أَبِيهِ أَوْ انْتَمَى إِلَى غَيْرِ مَوَالِيهِ فَعَلَيْهِ لَعْنَةُ اللَّهِ وَالْمَلَائِكَةِ وَالنَّاسِ أَجْمَعِينَ لَا يَقْبَلُ اللَّهُ مِنْهُ يَوْمَ الْقِيَامَةِ صَرْفًا وَلَا عَدْلًا",58
3019,23,"Telah menceritakan kepada kami [Yahya bin Yahya] dia berkata; saya bacakan di hadapan [Malik]; dari [Ibnu Syihab] dari [Al A'raj] dari [Abu Hurairah], bahwa Rasulullah shallallahu 'alaihi wasallam bersabda: ""Janganlah salah seorang dari kalian melarang tetangganya menyandarkan papan kayu di temboknya."" Al A'raj berkata, ""Lalu Abu Hurairah berkata, ""Kenapa aku lihat kalian berpaling dari permasalahan ini? Demi Allah, saya akan melemparkannya di antara pundak-pundak kalian."" Telah menceritakan kepada kami [Zuhair bin Harb] telah menceritakan kepada kami [Sufyan bin 'Uyainah]. (dalam jalur lain disebutkan) Telah menceritakan kepadaku [Abu Thahir] dan [Harmalah bin Yahya] keduanya berkata; telah mengabarkan kepada kami [Ibnu Wahb] telah mengabarkan kepadaku [Yunus]. (dalam jalur lain disebutkan) Telah menceritakan kepada kami [Abd bin Humaid] telah mengabarkan kepada kami [Abdurrazaq] telah mengabarkan kepada kami [Ma'mar] semuanya dari [Az Zuhri] dengan isnad seperti ini.""","حَدَّثَنَا يَحْيَى بْنُ يَحْيَى قَالَ قَرَأْتُ عَلَى مَالِكٍ عَنْ ابْنِ شِهَابٍ عَنْ الْأَعْرَجِ عَنْ أَبِي هُرَيْرَةَ
أَنَّ رَسُولَ اللَّهِ صَلَّى اللَّهُ عَلَيْهِ وَسَلَّمَ قَالَ لَا يَمْنَعْ أَحَدُكُمْ جَارَهُ أَنْ يَغْرِزَ خَشَبَةً فِي جِدَارِهِ
قَالَ ثُمَّ يَقُولُا أَبُو هُرَيْرَةَ مَا لِي أَرَاكُمْ عَنْهَا مُعْرِضِينَ وَاللَّهِ لَأَرْمِيَنَّ بِهَا بَيْنَ أَكْتَافِكُمْ حَدَّثَنَا زُهَيْرُ بْنُ حَرْبٍ حَدَّثَنَا سُفْيَانُ بْنُ عُيَيْنَةَ ح و حَدَّثَنِي أَبُو الطَّاهِرِ وَحَرْمَلَةُ بْنُ يَحْيَى قَالَا أَخْبَرَنَا ابْنُ وَهْبٍ أَخْبَرَنِي يُونُسُ ح و حَدَّثَنَا عَبْدُ بْنُ حُمَيْدٍ أَخْبَرَنَا عَبْدُ الرَّزَّاقِ أَخْبَرَنَا مَعْمَرٌ كُلُّهُمْ عَنْ الزُّهْرِيِّ بِهَذَا الْإِسْنَادِ نَحْوَهُ",58
3200,30,"Telah menceritakan kepada kami [Muhammad bin Al Mutsanna] dan [Ibnu Basyar] semuanya dari [Abdul A'la], [Ibnu Mutsanna] berkata; telah menceritakan kepada kami [Abdul A'la] telah menceritakan kepada kami [Sa'id] dari [Qatadah] dari [Al Hasan] dari [Hitthan bin Abdullah Ar Raqasyi] dari ['Ubadah bin Shamit] dia berkata, ""Setiap kali turun wahyu kepada Nabi Allah Shallallahu 'Alaihi Wasalam, maka beliau terlihat sangat susah dan wajahnya berubah menjadi pucat."" 'Ubadah bin Shamit berkata, ""Pada suatu ketika wahyu turun kepada beliau, maka beliau terlihat sangat kepayahan, setelah kondisinya tenang kembali, beliau bersabda: ""Ikutilah semua ajaranku, sungguh Allah telah menetapkan hukum buat mereka. Allah telah menetapkan hukuman bagi mereka (kaum wanita); laki-laki dan wanita yang sudah menikah, dan perjaka dengan perawan. Bagi yang sudah menikah adalah hukuman cambuk seratus kali dan rajam dengan batu, sedangkan bagi yang belum menikah adalah cambuk seratus kali lalu diasingkan selama satu tahun."" Dan telah menceritakan kepada kami [Muhammad bin Al Mutsanna] dan [Ibnu Basyar] keduanya berkata; telah menceritakan kepada kami [Muhammad bin Ja'far] telah menceritakan kepada kami [Syu'bah]. (dalam jalur lain disebutkan) Telah menceritakan kepada kami [Muhammad bin Ja'far] telah menceritakan kepada kami [Mu'adz bin Hisyam] telah menceritakan kepadaku [Ayahku] keduanya dari [Qatadah] dengan isnad ini, namun dalam hadits keduanya disebutkan, ""Hukuman bagi seorang yang belum menikah adalah dera dan diasingkan, sedangkan bagi orang yang telah menikah adalah dera dan dirajam."" Dan tidak disebutkan, ""Selama setahun, dan tidak seratus kali.""","حَدَّثَنَا مُحَمَّدُ بْنُ الْمُثَنَّى وَابْنُ بَشَّارٍ جَمِيعًا عَنْ عَبْدِ الْأَعْلَى قَالَ ابْنُ الْمُثَنَّى حَدَّثَنَا عَبْدُ الْأَعْلَى حَدَّثَنَا سَعِيدٌ عَنْ قَتَادَةَ عَنْ الْحَسَنِ عَنْ حِطَّانَ بْنِ عَبْدِ اللَّهِ الرَّقَاشِيِّ عَنْ عُبَادَةَ بْنِ الصَّامِتِ قَالَ
كَانَ نَبِيُّ اللَّهِ صَلَّى اللَّهُ عَلَيْهِ وَسَلَّمَ إِذَا أُنْزِلَ عَلَيْهِ كُرِبَ لِذَلِكَ وَتَرَبَّدَ لَهُ وَجْهُهُ قَالَ فَأُنْزِلَ عَلَيْهِ ذَاتَ يَوْمٍ فَلُقِيَ كَذَلِكَ فَلَمَّا سُرِّيَ عَنْهُ قَالَ خُذُوا عَنِّي فَقَدْ جَعَلَ اللَّهُ لَهُنَّ سَبِيلًا الثَّيِّبُ بِالثَّيِّبِ وَالْبِكْرُ بِالْبِكْرِ الثَّيِّبُ جَلْدُ مِائَةٍ ثُمَّ رَجْمٌ بِالْحِجَارَةِ وَالْبِكْرُ جَلْدُ مِائَةٍ ثُمَّ نَفْيُ سَنَةٍ
و حَدَّثَنَا مُحَمَّدُ بْنُ الْمُثَنَّى وَابْنُ بَشَّارٍ قَالَا حَدَّثَنَا مُحَمَّدُ بْنُ جَعْفَرٍ حَدَّثَنَا شُعْبَةُ ح و حَدَّثَنَا مُحَمَّدُ بْنُ بَشَّارٍ حَدَّثَنَا مُعَاذُ بْنُ هِشَامٍ حَدَّثَنِي أَبِي كِلَاهُمَا عَنْ قَتَادَةَ بِهَذَا الْإِسْنَادِ غَيْرَ أَنَّ فِي حَدِيثِهِمَا الْبِكْرُ يُجْلَدُ وَيُنْفَى وَالثَّيِّبُ يُجْلَدُ وَيُرْجَمُ لَا يَذْكُرَانِ سَنَةً وَلَا مِائَةً",58
3217,30,"Telah menceritakan kepada kami [Muhammad bin Abu Bakar Al Muqaddami] telah menceritakan kepada kami [Sulaiman Abu Daud] telah menceritakan kepada kami [Zaidah] dari [As Suddi] dari [Sa'd bin Ubaidah] dari [Abu Abdurrahman] dia berkata, "" [Ali] pernah berkata dalam khutbahnya; ""Wahai sekalian manusia, tegakkanlah hukum kepada sahaya kalian, baik yang sudah menikah atau yang belum menikah, sesungguhnya hal ini pernah dialami oleh sahaya perempuan Rasulullah shallallahu 'alaihi wasallam yang berzina, beliau menyuruhku untuk menderanya. Dia (wanita itu) baru saja melahirkan, maka aku khawatir jika menderanya maka ia akan meninggal. Lantas kuberitahukan hal itu kepada Nabi shallallahu 'alaihi wasallam, maka beliau bersabda: ""Kamu telah berbuat baik (menangguhkan pelaksana had sampai waktu yang sesuai)."" Dan telah menceritakan kepada kami [Ishaq bin Ibrahim] telah mengabarkan kepada kami [Yahya bin Adam] telah menceritakan kepada kami [Israil] dari [As Suddi] dengan isnad ini, namun dihaditsnya tidak disebutkan, ""Baik yang sudah menikah ataupun belum."" Dan dalam haditsnya juga disebutkan, ""Tangguhkanlah sampai waktunya sesuai.""","حَدَّثَنَا مُحَمَّدُ بْنُ أَبِي بَكْرٍ الْمُقَدَّمِيُّ حَدَّثَنَا سُلَيْمَانُ أَبُو دَاوُدَ حَدَّثَنَا زَائِدَةُ عَنْ السُّدِّيِّ عَنْ سَعْدِ بْنِ عُبَيْدَةَ عَنْ أَبِي عَبْدِ الرَّحْمَنِ قَالَ خَطَبَ عَلِيٌّ فَقَالَ يَا أَيُّهَا النَّاسُ أَقِيمُوا عَلَى أَرِقَّائِكُمْ الْحَدَّ مَنْ أَحْصَنَ مِنْهُمْ وَمَنْ لَمْ يُحْصِنْ
فَإِنَّ أَمَةً لِرَسُولِ اللَّهِ صَلَّى اللَّهُ عَلَيْهِ وَسَلَّمَ زَنَتْ فَأَمَرَنِي أَنْ أَجْلِدَهَا فَإِذَا هِيَ حَدِيثُ عَهْدٍ بِنِفَاسٍ فَخَشِيتُ إِنْ أَنَا جَلَدْتُهَا أَنْ أَقْتُلَهَا فَذَكَرْتُ ذَلِكَ لِلنَّبِيِّ صَلَّى اللَّهُ عَلَيْهِ وَسَلَّمَ فَقَالَ أَحْسَنْتَ
و حَدَّثَنَاه إِسْحَقُ بْنُ إِبْرَاهِيمَ أَخْبَرَنَا يَحْيَى بْنُ آدَمَ حَدَّثَنَا إِسْرَائِيلُ عَنْ السُّدِّيِّ بِهَذَا الْإِسْنَادِ وَلَمْ يَذْكُرْ مَنْ أَحْصَنَ مِنْهُمْ وَمَنْ لَمْ يُحْصِنْ وَزَادَ فِي الْحَدِيثِ اتْرُكْهَا حَتَّى تَمَاثَلَ",58
3223,30,"Telah menceritakan kepada kami [Yahya bin Yahya At Tamimi] dan [Abu Bakar bin Abu Syaibah] dan [Amru An Naqid] dan [Ishaq bin Ibrahim] dan [Ibnu Numair] mereka semua dari [Ibnu 'Uyainah], sedangkan lafadznya dari 'Amru, dia berkata; telah menceritakan kepada kami [Ibnu 'Uyainah] dari [Az Zuhri] dari [Abu Idris] dari ['Ubadah bin Shamit] dia berkata, ""Ketika kami bersama Rasulullah shallallahu 'alaihi wasallam di suatu majlis, beliau bersabda: ""Berbaiatlah kalian kepadaku bahwa kalian tidak akan menyekutukan Allah dengan sesuatu apapun, tidak berzina, tidak mencuri dan tidak membunuh jiwa yang Allah haramkan kecuali dengan hak. Barangsiapa di antara kalian yang memenuhi janji tersebut maka pahalanya ada pada Allah. Barangsiapa melanggar janji tersebut, namun Allah menutupi kesalahannya (tidak diketahui orang lain), maka urusannya terserah Allah; jika Dia menghendaki maka akan diampuni, namun jika Dia menghendaki maka akan disiksa-Nya (di akhirat kelak)."" Telah menceritakan kepada kami [Abd bin Humaid] telah mengabarkan kepada kami [Abdurrazaq] telah mengabarkan kepada kami [Ma'mar] dari [Az Zuhri] dengan isnad seperti ini, dan dalam haditsnya dia menambahkan, ""Kemudian dia membacakan kepada kami ayat (dalam surat) An Nisa': '(Hendaknya kalian tidak menyekutukan Allah dengan sesuatu apapun) ' (Qs. Al Mumtahanah: 12).","حَدَّثَنَا يَحْيَى بْنُ يَحْيَى التَّمِيمِيُّ وَأَبُو بَكْرِ بْنُ أَبِي شَيْبَةَ وَعَمْرٌو النَّاقِدُ وَإِسْحَقُ بْنُ إِبْرَاهِيمَ وَابْنُ نُمَيْرٍ كُلُّهُمْ عَنْ ابْنِ عُيَيْنَةَ وَاللَّفْظُ لِعَمْرٍو قَالَ حَدَّثَنَا سُفْيَانُ بْنُ عُيَيْنَةَ عَنْ الزُّهْرِيِّ عَنْ أَبِي إِدْرِيسَ عَنْ عُبَادَةَ بْنِ الصَّامِتِ قَالَ
كُنَّا مَعَ رَسُولِ اللَّهِ صَلَّى اللَّهُ عَلَيْهِ وَسَلَّمَ فِي مَجْلِسٍ فَقَالَ تُبَايِعُونِي عَلَى أَنْ لَا تُشْرِكُوا بِاللَّهِ شَيْئًا وَلَا تَزْنُوا وَلَا تَسْرِقُوا وَلَا تَقْتُلُوا النَّفْسَ الَّتِي حَرَّمَ اللَّهُ إِلَّا بِالْحَقِّ فَمَنْ وَفَى مِنْكُمْ فَأَجْرُهُ عَلَى اللَّهِ وَمَنْ أَصَابَ شَيْئًا مِنْ ذَلِكَ فَعُوقِبَ بِهِ فَهُوَ كَفَّارَةٌ لَهُ وَمَنْ أَصَابَ شَيْئًا مِنْ ذَلِكَ فَسَتَرَهُ اللَّهُ عَلَيْهِ فَأَمْرُهُ إِلَى اللَّهِ إِنْ شَاءَ عَفَا عَنْهُ وَإِنْ شَاءَ عَذَّبَهُ
حَدَّثَنَا عَبْدُ بْنُ حُمَيْدٍ أَخْبَرَنَا عَبْدُ الرَّزَّاقِ أَخْبَرَنَا مَعْمَرٌ عَنْ الزُّهْرِيِّ بِهَذَا الْإِسْنَادِ وَزَادَ فِي الْحَدِيثِ فَتَلَا عَلَيْنَا آيَةَ النِّسَاءِ
{ أَنْ لَا يُشْرِكْنَ بِاللَّهِ شَيْئًا }
الْآيَةَ",58
3256,32,"Telah menceritakan kepada kami [Abu Kuraib Muhammad bin Al 'Ala] telah menceritakan kepada kami [Waki'] telah menceritakan kepada kami [Abdul Hamid bin Ja'far] dari [Sa'id bin Abu Sa'id Al Maqburi] dari [Abu Syuraih Al Khuza'i] dia berkata, ""Rasulullah shallallahu 'alaihi wasallam bersabda: ""Bertamu itu selama tiga hari, dan pelayanannya selama siang atau malam hari. Tidak halal bagi seorang muslim bermukim di rumah saudaranya sampai saudaranya berdosa karenanya."" Para sahabat bertanya, ""Wahai Rasulullah, bagaimana dia bisa berdosa?"" beliau menjawab: ""Dia bermukim di rumah saudaranya hingga saudaranya tidak punya apa-apa lagi untuk menjamunya."" Dan telah menceritakan kepada kami [Muhammad bin Al Mutsanna] telah menceritakan kepada kami [Abu Bakar] -yaitu Al Hanafi- telah menceritakan kepada kami [Abdul Hamid bin Ja'far] telah menceritakan kepada kami [Sa'id Al Maqbury] bahwa dia mendengar [Abu Syuraih Al Khuza'i] berkata, ""Aku mendengar sendiri dengan kedua telingaku, melihat dengan kedua mataku dan hatiku ketika Rasulullah shallallahu 'alaihi wasallam mengucapkan sabdanya…kemudian dia menyebutkan seperti haditsnya Laits, dan dalam hadits tersebut ia menyebutkan, ""Dan tidak dihalalkan salah seorang dari kalian bermukim di tempat saudaranya hingga saudaranya berdosa karenanya…seperti hadits riwayat Waki'.""","حَدَّثَنَا أَبُو كُرَيْبٍ مُحَمَّدُ بْنُ الْعَلَاءِ حَدَّثَنَا وَكِيعٌ حَدَّثَنَا عَبْدُ الْحَمِيدِ بْنُ جَعْفَرٍ عَنْ سَعِيدِ بْنِ أَبِي سَعِيدٍ الْمَقْبُرِيِّ عَنْ أَبِي شُرَيْحٍ الْخُزَاعِيِّ قَالَ
قَالَ رَسُولُ اللَّهِ صَلَّى اللَّهُ عَلَيْهِ وَسَلَّمَ الضِّيَافَةُ ثَلَاثَةُ أَيَّامٍ وَجَائِزَتُهُ يَوْمٌ وَلَيْلَةٌ وَلَا يَحِلُّ لِرَجُلٍ مُسْلِمٍ أَنْ يُقِيمَ عِنْدَ أَخِيهِ حَتَّى يُؤْثِمَهُ قَالُوا يَا رَسُولَ اللَّهِ وَكَيْفَ يُؤْثِمُهُ قَالَ يُقِيمُ عِنْدَهُ وَلَا شَيْءَ لَهُ يَقْرِيهِ بِهِ
و حَدَّثَنَاه مُحَمَّدُ بْنُ الْمُثَنَّى حَدَّثَنَا أَبُو بَكْرٍ يَعْنِي الْحَنَفِيَّ حَدَّثَنَا عَبْدُ الْحَمِيدِ بْنُ جَعْفَرٍ حَدَّثَنَا سَعِيدٌ الْمَقْبُرِيُّ أَنَّهُ سَمِعَ أَبَا شُرَيْحٍ الْخُزَاعِيَّ يَقُولُا سَمِعَتْ أُذُنَايَ وَبَصُرَ عَيْنِي وَوَعَاهُ قَلْبِي حِينَ تَكَلَّمَ بِهِ رَسُولُ اللَّهِ صَلَّى اللَّهُ عَلَيْهِ وَسَلَّمَ فَذَكَرَ بِمِثْلِ حَدِيثِ اللَّيْثِ وَذَكَرَ فِيهِ وَلَا يَحِلُّ لِأَحَدِكُمْ أَنْ يُقِيمَ عِنْدَ أَخِيهِ حَتَّى يُؤْثِمَهُ بِمِثْلِ مَا فِي حَدِيثِ وَكِيعٍ",58
3262,33,"Telah menceritakan kepada kami [Abu Bakar bin Abu Syaibah] dan [Abu Kuraib] sedangkan lafadznya dari Abu Bakar, keduanya berkata; telah menceritakan kepada kami [Abu Usamah] dari [Buraid bin Abdullah] dari [Abu Burdah] dari [Abu Musa] dia berkata, ""Apabila Rasulullah shallallahu 'alaihi wasallam mengangkat seseorang dari sahabatnya untuk melaksanakan perintahnya, beliau bersabda: ""Berilah mereka kabar gembira dan janganlah menakut-nakuti, mudahkan urusan mereka jangan kamu persulit.""","حَدَّثَنَا أَبُو بَكْرِ بْنُ أَبِي شَيْبَةَ وَأَبُو كُرَيْبٍ وَاللَّفْظُ لِأَبِي بَكْرٍ قَالَا حَدَّثَنَا أَبُو أُسَامَةَ عَنْ بُرَيْدِ بْنِ عَبْدِ اللَّهِ عَنْ أَبِي بُرْدَةَ عَنْ أَبِي مُوسَى قَالَ
كَانَ رَسُولُ اللَّهِ صَلَّى اللَّهُ عَلَيْهِ وَسَلَّمَ إِذَا بَعَثَ أَحَدًا مِنْ أَصْحَابِهِ فِي بَعْضِ أَمْرِهِ قَالَ بَشِّرُوا وَلَا تُنَفِّرُوا وَيَسِّرُوا وَلَا تُعَسِّرُوا",58
