haditsId,kitabId,indo,arab,label
949,6,"Dan Telah menceritakan kepadaku [Muhammad bin Hatim] dan ['Ubaidullah bin Sa'id] dia berkata; telah menceritakan kepada kami [Yahya bin Sa'id] dari [Hajjaj Ash Shawaf] telah menceritakan kepada kami [Yahya bin Abu Katsir] dari [Abu Salamah] dan [Abdullah bin Abu Qatadah] dari [Abu Qatadah], dia berkata; ""Rasulullah shallallahu 'alaihi wasallam bersabda: ""Jika iqamat telah dikumandangkan, janganlah kalian berdiri hingga kalian melihatku."" [Ibn Hatim] mengatakan dengan redaksi; ""Jika iqamat telah dikumandangkan atau diserukan."" Dan telah menceritakan kepada kami [Abu Bakr bin Abu Syaibah] telah menceritakan kepada kami [Sufyan bin 'Uyainah] dari [Ma'mar], [Abu Bakr] mengatakan; ""Dan telah menceritakan kepada kami [Ibn 'Ulayyah] dari [Hajjaj bin Abu Utsman] katanya (dan diriwayatkan dari jalur lain) telah menceritakan kepada kami [Ishaq bin Ibrahim] telah mengabarkan kepada kami [Isa bin Yunus] dan [Abdurrazaq] dari [Ma'mar]. [Ishaq] mengatakan; telah mengabarkan kepada kami [Al Walid bin Muslim] dari [Syaiban] semuanya dari [Yahya bin Abu Katsir] dari [Abdullah bin Abu Qatadah] dari [Ayahnya] dari Nabi shallallahu 'alaihi wasallam, sedangkan dalam periwayatannya, Ishaq menambahkan hadis Ma'mar dan Syaiban; ""Hingga kalian melihatku telah keluar (rumah).""","و حَدَّثَنِي مُحَمَّدُ بْنُ حَاتِمٍ وَعُبَيْدُ اللَّهِ بْنُ سَعِيدٍ قَالَا حَدَّثَنَا يَحْيَى بْنُ سَعِيدٍ عَنْ حَجَّاجٍ الصَّوَّافِ حَدَّثَنَا يَحْيَى بْنُ أَبِي كَثِيرٍ عَنْ أَبِي سَلَمَةَ وَعَبْدِ اللَّهِ بْنِ أَبِي قَتَادَةَ عَنْ أَبِي قَتَادَةَ قَالَ
قَالَ رَسُولُ اللَّهِ صَلَّى اللَّهُ عَلَيْهِ وَسَلَّمَ إِذَا أُقِيمَتْ الصَّلَاةُ فَلَا تَقُومُوا حَتَّى تَرَوْنِي
و قَالَ ابْنُ حَاتِمٍ إِذَا أُقِيمَتْ أَوْ نُودِيَ و حَدَّثَنَا أَبُو بَكْرِ بْنُ أَبِي شَيْبَةَ حَدَّثَنَا سُفْيَانُ بْنُ عُيَيْنَةَ عَنْ مَعْمَرٍ قَالَ أَبُو بَكْرٍ وَحَدَّثَنَا ابْنُ عُلَيَّةَ عَنْ حَجَّاجِ بْنِ أَبِي عُثْمَانَ قَالَ ح و حَدَّثَنَا إِسْحَقُ بْنُ إِبْرَاهِيمَ أَخْبَرَنَا عِيسَى بْنُ يُونُسَ وَعَبْدُ الرَّزَّاقِ عَنْ مَعْمَرٍ وَقَالَ إِسْحَقُ أَخْبَرَنَا الْوَلِيدُ بْنُ مُسْلِمٍ عَنْ شَيْبَانَ كُلُّهُمْ عَنْ يَحْيَى بْنِ أَبِي كَثِيرٍ عَنْ عَبْدِ اللَّهِ بْنِ أَبِي قَتَادَةَ عَنْ أَبِيهِ عَنْ النَّبِيِّ صَلَّى اللَّهُ عَلَيْهِ وَسَلَّمَ وَزَادَ إِسْحَقُ فِي رِوَايَتِهِ حَدِيثَ مَعْمَرٍ وَشَيْبَانَ حَتَّى تَرَوْنِي قَدْ خَرَجْتُ",58
951,6,"Telah menceritakan kepadaku [Zuhair bin Harb] telah menceritakan kepada kami [Walid bin Muslim] telah menceritakan kepada kami [Abu 'Amru yaitu Auza'i] telah menceritakan kepada kami [Az Zuhri] dari [Abu Salamah] dari [Abu Hurairah] dia berkata; ""Ketika iqamat dikumandangkan, para sahabat pun bersegera membentuk barisan. Setelah itu Rasulullah shallallahu 'alaihi wasallam muncul dan berdiri di tempat yang biasa beliau gunakan untuk berdiri, lalu beliau memberi isyarat kepada para sahabat supaya mereka tetap berada di tempat. Sesaat kemudian beliau kembali sementara kepalanya meneteskan air karena mandi, beliau kemudian mengimami mereka.","و حَدَّثَنِي زُهَيْرُ بْنُ حَرْبٍ حَدَّثَنَا الْوَلِيدُ بْنُ مُسْلِمٍ حَدَّثَنَا أَبُو عَمْرٍو يَعْنِي الْأَوْزَاعِيَّ حَدَّثَنَا الزُّهْرِيُّ عَنْ أَبِي سَلَمَةَ عَنْ أَبِي هُرَيْرَةَ قَالَ
أُقِيمَتْ الصَّلَاةُ وَصَفَّ النَّاسُ صُفُوفَهُمْ وَخَرَجَ رَسُولُ اللَّهِ صَلَّى اللَّهُ عَلَيْهِ وَسَلَّمَ فَقَامَ مَقَامَهُ فَأَوْمَأَ إِلَيْهِمْ بِيَدِهِ أَنْ مَكَانَكُمْ فَخَرَجَ وَقَدْ اغْتَسَلَ وَرَأْسُهُ يَنْطُفُ الْمَاءَ فَصَلَّى بِهِمْ",58
952,6,"Dan telah menceritakan kepadaku [Ibrahim bin Musa] telah mengabarkan kepada kami [Walid bin Muslim] dari [Auza'i] dari [Az Zuhri] dia berkata; telah menceritakan kepadaku [Abu Salamah] dari [Abu Hurairah]; ""Tatkala iqamat dikumandangkan tanda shalat akan dilaksanakan bersama Rasulullah shallallahu 'alaihi wasallam, lantas para sahabat bersegera membentuk barisan (shaff) sebelum Nabi shallallahu 'alaihi wasallam berdiri di tempat yang biasa beliau gunakan untuk berdiri (menjadi imam).","و حَدَّثَنِي إِبْرَاهِيمُ بْنُ مُوسَى أَخْبَرَنَا الْوَلِيدُ بْنُ مُسْلِمٍ عَنْ الْأَوْزَاعِيِّ عَنْ الزُّهْرِيِّ قَالَ حَدَّثَنِي أَبُو سَلَمَةَ عَنْ أَبِي هُرَيْرَةَ
أَنَّ الصَّلَاةَ كَانَتْ تُقَامُ لِرَسُولِ اللَّهِ صَلَّى اللَّهُ عَلَيْهِ وَسَلَّمَ فَيَأْخُذُ النَّاسُ مَصَافَّهُمْ قَبْلَ أَنْ يَقُومَ النَّبِيُّ صَلَّى اللَّهُ عَلَيْهِ وَسَلَّمَ مَقَامَهُ",58
953,6,"Telah menceritakan kepadaku [Salamah bin Syabib] telah menceritakan kepada kami [Al Hasan bin A'yan] telah menceritakan kepada kami [Zuhair] telah menceritakan kepada kami [Simak bin Harb] dari [Jabir bin Samurah] dia berkata; ""Bilal pernah mengumandangkan adzan ketika matahari condong ke sebelah barat, sementara ia tidak mengumandangkan iqamat hingga Nabi shallallahu 'alaihi wasallam muncul. Ketika beliau muncul, maka Bilal mengumandangkan iqamat yaitu ketika ia melihat beliau.""","و حَدَّثَنِي سَلَمَةُ بْنُ شَبِيبٍ حَدَّثَنَا الْحَسَنُ بْنُ أَعْيَنَ حَدَّثَنَا زُهَيْرٌ حَدَّثَنَا سِمَاكُ بْنُ حَرْبٍ عَنْ جَابِرِ بْنِ سَمُرَةَ قَالَ
كَانَ بِلَالٌ يُؤَذِّنُ إِذَا دَحَضَتْ فَلَا يُقِيمُ حَتَّى يَخْرُجَ النَّبِيُّ صَلَّى اللَّهُ عَلَيْهِ وَسَلَّمَ فَإِذَا خَرَجَ أَقَامَ الصَّلَاةَ حِينَ يَرَاهُ",58
962,6,"Dan telah menceritakan kepadaku [Harmalah bin Yahya] telah mengabarkan kepada kami [Ibnu Wahb] telah mengabarkan kepadaku [Yunus] dari [Ibnu Syihab] dia berkata, [Urwah bin Zubair] telah menceritakan kepadaku bahwa ['Aisyah] isteri Nabi shallallahu 'alaihi wasallam mengabarinya, bahwa Rasulullah shallallahu 'alaihi wasallam pernah shalat ashar ketika sinar matahari telah menerobos kamarnya sementara bayangan belum jelas di kamarnya.""","و حَدَّثَنِي حَرْمَلَةُ بْنُ يَحْيَى أَخْبَرَنَا ابْنُ وَهْبٍ أَخْبَرَنِي يُونُسُ عَنْ ابْنِ شِهَابٍ قَالَ أَخْبَرَنِي عُرْوَةُ بْنُ الزُّبَيْرِ أَنَّ عَائِشَةَ زَوْجَ النَّبِيِّ صَلَّى اللَّهُ عَلَيْهِ وَسَلَّمَ أَخْبَرَتْهُ
أَنَّ رَسُولَ اللَّهِ صَلَّى اللَّهُ عَلَيْهِ وَسَلَّمَ كَانَ يُصَلِّي الْعَصْرَ وَالشَّمْسُ فِي حُجْرَتِهَا لَمْ يَظْهَرْ الْفَيْءُ فِي حُجْرَتِهَا",58
963,6,"Telah menceritakan kepada kami [Abu Bakr bin Abu Syaibah] dan [Ibnu Numair] keduanya berkata; telah menceritakan kepada kami [Waki'] dari [Hisyam] dari [Ayahnya] dari ['Aisyah] dia berkata; Rasulullah shallallahu 'alaihi wasallam pernah shalat ashar ketika sinar matahari (menerobos) ke kamarku.""","حَدَّثَنَا أَبُو بَكْرِ بْنُ أَبِي شَيْبَةَ وَابْنُ نُمَيْرٍ قَالَا حَدَّثَنَا وَكِيعٌ عَنْ هِشَامٍ عَنْ أَبِيهِ عَنْ عَائِشَةَ قَالَتْ
كَانَ رَسُولُ اللَّهِ صَلَّى اللَّهُ عَلَيْهِ وَسَلَّمَ يُصَلِّي الْعَصْرَ وَالشَّمْسُ وَاقِعَةٌ فِي حُجْرَتِي",58
975,6,"Telah menceritakan kepada kami [Ibn Rafi'] telah menceritakan kepada kami [Abdurrazaq] telah menceritakan kepada kami [Ma'mar] dari [Hammam bin Munabbih] dia berkata; inilah yang diceritakan kepada kami oleh [Abu Hurairah] dari Rasulullah shallallahu 'alaihi wasallam, -lalu Abu Hurairah menyebutkan beberapa hadis diantaranya- Rasulullah shallallahu 'alaihi wasallam bersabda: ""Tangguhkankanlah shalat sampai suhu agak dingin, sebab panas yang menyengat berasal dari uap neraka jahannam.""","حَدَّثَنَا ابْنُ رَافِعٍ حَدَّثَنَا عَبْدُ الرَّزَّاقِ حَدَّثَنَا مَعْمَرٌ عَنْ هَمَّامِ بْنِ مُنَبِّهٍ قَالَ هَذَا مَا حَدَّثَنَا أَبُو هُرَيْرَةَ عَنْ رَسُولِ اللَّهِ صَلَّى اللَّهُ عَلَيْهِ وَسَلَّمَ فَذَكَرَ أَحَادِيثَ مِنْهَا
وَقَالَ رَسُولُ اللَّهِ صَلَّى اللَّهُ عَلَيْهِ وَسَلَّمَ أَبْرِدُوا عَنْ الْحَرِّ فِي الصَّلَاةِ فَإِنَّ شِدَّةَ الْحَرِّ مِنْ فَيْحِ جَهَنَّمَ",58
983,6,"Dan telah menceritakan kepada kami [Yahya bin Yahya] telah menceritakan kepada kami [Bisyr bin Mufadlal] dari [Ghalib Al Qaththan] dari [Bakr bin Abdullah] dari [Anas bin Malik] dia berkata; ""Kami pernah shalat bersama Rasululah shallallahu 'alaihi wasallam ketika hari sangat panas, jika salah seorang diantara kami tidak dapat menempatkan keningnya di tanah dengan baik (karena panasnya), maka ia menghamparkan kain lalu sujud di atasnya.""","حَدَّثَنَا يَحْيَى بْنُ يَحْيَى حَدَّثَنَا بِشْرُ بْنُ الْمُفَضَّلِ عَنْ غَالِبٍ الْقَطَّانِ عَنْ بَكْرِ بْنِ عَبْدِ اللَّهِ عَنْ أَنَسِ بْنِ مَالِكٍ قَالَ
كُنَّا نُصَلِّي مَعَ رَسُولِ اللَّهِ صَلَّى اللَّهُ عَلَيْهِ وَسَلَّمَ فِي شِدَّةِ الْحَرِّ فَإِذَا لَمْ يَسْتَطِعْ أَحَدُنَا أَنْ يُمَكِّنَ جَبْهَتَهُ مِنْ الْأَرْضِ بَسَطَ ثَوْبَهُ فَسَجَدَ عَلَيْهِ",58
996,6,"Dan telah menceritakan kepada kami [Abu Bakr bin Abu Syaibah] dan [Zuhair bin Harb] dan [Abu Kuraib] mereka berkata; telah menceritakan kepada kami [Abu Muawiyah] dari [Al A'masy] dari [Muslim bin Shubaih] dari [Syutair bin Syakal] dari [Ali] dia berkata; Rasulullah shallallahu 'alaihi wasallam bersabda pada perang Ahzab; ""Pasukan musuh benar-benar telah menyibukkan kita dari shalat wustha (ashar), semoga Allah memenuhi rumah dan kuburan mereka dengan api."" Kemudian Rasulullah shallallahu 'alaihi wasallam melakukan dua shalat malam, yaitu maghrib dan isya.","و حَدَّثَنَا أَبُو بَكْرِ بْنُ أَبِي شَيْبَةَ وَزُهَيْرُ بْنُ حَرْبٍ وَأَبُو كُرَيْبٍ قَالُوا حَدَّثَنَا أَبُو مُعَاوِيَةَ عَنْ الْأَعْمَشِ عَنْ مُسْلِمِ بْنِ صُبَيْحٍ عَنْ شُتَيْرِ بْنِ شَكَلٍ عَنْ عَلِيٍّ قَالَ
قَالَ رَسُولُ اللَّهِ صَلَّى اللَّهُ عَلَيْهِ وَسَلَّمَ يَوْمَ الْأَحْزَابِ شَغَلُونَا عَنْ الصَّلَاةِ الْوُسْطَى صَلَاةِ الْعَصْرِ مَلَأَ اللَّهُ بُيُوتَهُمْ وَقُبُورَهُمْ نَارًا ثُمَّ صَلَّاهَا بَيْنَ الْعِشَاءَيْنِ بَيْنَ الْمَغْرِبِ وَالْعِشَاءِ",58
1008,6,"Dan telah menceritakan kepada kami ['Amru bin Sawwad Al 'Amiri] dan [Harmalah bin Yahya], keduanya berkata; telah mengabarkan kepada kami [Ibnu Wahb] telah mengabarkan kepadaku [Yunus], bahwa [Ibn Syihab] telah mengabarkan kepadanya, dia berkata; telah mengabarkan kepadaku ['Urwah bin Zubair] bahwa ['Aisyah] isteri Nabi shallallahu 'alaihi wasallam berkata; ""Suatu malam Rasulullah shallallahu 'alaihi wasallam mendirikan shalat isya' yang sering diistilahkan dengan 'shalat atamah. Rupanya beliau tak kunjung datang hingga Umar bin Khattab berkata; ""Anak-anak kecil dan kaum wanita telah telanjur tidur."" Tidak lama kemudian Rasulullah shallallahu 'alaihi wasallam datang dan berkata kepada penghuni masjid, yaitu ketika beliau menemui mereka: ""Tak seorang pun dari penduduk bumi yang menunggu shalat isya` selain kalian. Dan itu terjadi ketika Islam belum tersosialisasi ke tenghah-tengah masyaraakat."" [Harmalah] menambahkan dalam periwayatannya, [Ibn Syihab] berkata; Dan disebutkan kepadaku bahwa Rasulullah shallallahu 'alaihi wasallam bersabda; ""Tidakkah kalian sebaiknya mengunjungi Rasulullah shallallahu 'alaihi wasallam untuk mengimami shalat? dan itu terjadi ketika Umar berteriak-teriak menyerukan panggilan shalat."" Telah menceritakan kepadaku [Abdul Malik bin Syu'aib bin Al Laits] telah menceritakan kepadaku [Ayahku] dari [Kakekku] dari ['Uqail] dari [Ibnu Syihab] dengan sanad seperti ini, namun ia tidak menyebutkan ucapan Az Zuhri, dan disebutkan kepadaku redaksi sesudahnya.","و حَدَّثَنَا عَمْرُو بْنُ سَوَّادٍ الْعَامِرِيُّ وَحَرْمَلَةُ بْنُ يَحْيَى قَالَا أَخْبَرَنَا ابْنُ وَهْبٍ أَخْبَرَنِي يُونُسُ أَنَّ ابْنَ شِهَابٍ أَخْبَرَهُ قَالَ أَخْبَرَنِي عُرْوَةُ بْنُ الزُّبَيْرِ
أَنَّ عَائِشَةَ زَوْجَ النَّبِيِّ صَلَّى اللَّهُ عَلَيْهِ وَسَلَّمَ قَالَتْ أَعْتَمَ رَسُولُ اللَّهِ صَلَّى اللَّهُ عَلَيْهِ وَسَلَّمَ لَيْلَةً مِنْ اللَّيَالِي بِصَلَاةِ الْعِشَاءِ وَهِيَ الَّتِي تُدْعَى الْعَتَمَةَ فَلَمْ يَخْرُجْ رَسُولُ اللَّهِ صَلَّى اللَّهُ عَلَيْهِ وَسَلَّمَ حَتَّى قَالَ عُمَرُ بْنُ الْخَطَّابِ نَامَ النِّسَاءُ وَالصِّبْيَانُ فَخَرَجَ رَسُولُ اللَّهِ صَلَّى اللَّهُ عَلَيْهِ وَسَلَّمَ فَقَالَ لِأَهْلِ الْمَسْجِدِ حِينَ خَرَجَ عَلَيْهِمْ مَا يَنْتَظِرُهَا أَحَدٌ مِنْ أَهْلِ الْأَرْضِ غَيْرُكُمْ وَذَلِكَ قَبْلَ أَنْ يَفْشُوَ الْإِسْلَامُ فِي النَّاسِ زَادَ حَرْمَلَةُ فِي رِوَايَتِهِ قَالَ ابْنُ شِهَابٍ وَذُكِرَ لِي أَنَّ رَسُولَ اللَّهِ صَلَّى اللَّهُ عَلَيْهِ وَسَلَّمَ قَالَ وَمَا كَانَ لَكُمْ أَنْ تَنْزُرُوا رَسُولَ اللَّهِ صَلَّى اللَّهُ عَلَيْهِ وَسَلَّمَ عَلَى الصَّلَاةِ وَذَاكَ حِينَ صَاحَ عُمَرُ بْنُ الْخَطَّابِ
و حَدَّثَنِي عَبْدُ الْمَلِكِ بْنُ شُعَيْبِ بْنِ اللَّيْثِ حَدَّثَنِي أَبِي عَنْ جَدِّي عَنْ عُقَيْلٍ عَنْ ابْنِ شِهَابٍ بِهَذَا الْإِسْنَادِ مِثْلَهُ وَلَمْ يَذْكُرْ قَوْلَ الزُّهْرِيِّ وَذُكِرَ لِي وَمَا بَعْدَهُ",58
1014,6,"Dan telah menceritakan kepada kami [Abu 'Amir Al Asy'ary] dan [Abu Kuraib] keduanya berkata; telah menceritakan kepada kami [Abu Usamah] dari [Buraid] dari [Abu Burdah] dari [Abu Musa] dia berkata; ""Aku dan para sahabatku yang bersamaku di perahu singgah di Baqi' But-han, ketika itu Rasulullah shallallahu 'alaihi wasallam berada di Madinah. Setiap malam, beberapa orang diantara mereka secara bergantian mengunjungi Rasulullah shallallahu 'alaihi wasallam."" Abu Musa berkata; ""Kebetulan aku bersama kawan-kawanku menemui Rasulullah shallallahu 'alaihi wasallam yang saat itu beliau tengah sibuk terhadap urusannya, hingga beliau mengakhirkan shalat isya` padahal telah berlalu separah malam, kemudian Rasulullah shallallahu 'alaihi wasallam datang dan mengimami mereka, Setelah beliau tunaikan shalatnya, beliau bersabda kepada hadirin; ""Tunggu sebentar, saya akan menyampaikan sesuatu untuk kalian, bergembiralah, diantara nikmat Allah yang diberikan-Nya untuk kalian, tidak ada seseorang pun yang mengikuti shalat ini selain kalian, -atau beliau bersabda dengan redaksi- ""Tak ada seorang pun selain kalian yang mengikuti shalat waktu ini, "" saya tidak ingat lagi mana yang benar dari keduanya. Abu Burdah berkata; Abu Musa berkata; ""Maka kami pulang dengan kegembiraan atas segala yang kami dengar dari Rasulullah shallallahu 'alaihi wasallam.""","و حَدَّثَنَا أَبُو عَامِرٍ الْأَشْعَرِيُّ وَأَبُو كُرَيْبٍ قَالَا حَدَّثَنَا أَبُو أُسَامَةَ عَنْ بُرَيْدٍ عَنْ أَبِي بُرْدَةَ عَنْ أَبِي مُوسَى قَالَ
كُنْتُ أَنَا وَأَصْحَابِي الَّذِينَ قَدِمُوا مَعِي فِي السَّفِينَةِ نُزُولًا فِي بَقِيعِ بُطْحَانَ وَرَسُولُ اللَّهِ صَلَّى اللَّهُ عَلَيْهِ وَسَلَّمَ بِالْمَدِينَةِ فَكَانَ يَتَنَاوَبُ رَسُولَ اللَّهِ صَلَّى اللَّهُ عَلَيْهِ وَسَلَّمَ عِنْدَ صَلَاةِ الْعِشَاءِ كُلَّ لَيْلَةٍ نَفَرٌ مِنْهُمْ قَالَ أَبُو مُوسَى فَوَافَقْنَا رَسُولَ اللَّهِ صَلَّى اللَّهُ عَلَيْهِ وَسَلَّمَ أَنَا وَأَصْحَابِي وَلَهُ بَعْضُ الشُّغْلِ فِي أَمْرِهِ حَتَّى أَعْتَمَ بِالصَّلَاةِ حَتَّى ابْهَارَّ اللَّيْلُ ثُمَّ خَرَجَ رَسُولُ اللَّهِ صَلَّى اللَّهُ عَلَيْهِ وَسَلَّمَ فَصَلَّى بِهِمْ فَلَمَّا قَضَى صَلَاتَهُ قَالَ لِمَنْ حَضَرَهُ عَلَى رِسْلِكُمْ أُعْلِمُكُمْ وَأَبْشِرُوا أَنَّ مِنْ نِعْمَةِ اللَّهِ عَلَيْكُمْ أَنَّهُ لَيْسَ مِنْ النَّاسِ أَحَدٌ يُصَلِّي هَذِهِ السَّاعَةَ غَيْرُكُمْ أَوْ قَالَ مَا صَلَّى هَذِهِ السَّاعَةَ أَحَدٌ غَيْرُكُمْ لَا نَدْرِي أَيَّ الْكَلِمَتَيْنِ قَالَ قَالَ أَبُو مُوسَى فَرَجَعْنَا فَرِحِينَ بِمَا سَمِعْنَا مِنْ رَسُولِ اللَّهِ صَلَّى اللَّهُ عَلَيْهِ وَسَلَّمَ",58
1021,6,"Dan telah menceritakan kepadaku [Harmalah bin Yahya] telah mengabarkan kepada kami [Ibnu Wahb] telah mengabarkan kepadaku [Yunus] bahwa [Ibnu Syihab] mengabarkan kepadanya, dia berkata; telah menceritakan kepadaku ['Urwah biun Zubair], bahwa ['Aisyah] isteri Nabi shallallahu 'alaihi wasallam berkata; ""Dahulu para wanita mukminat menghadiri shalat fajar (subuh) bersama Rasulullah shallallahu 'alaihi wasallam dengan mengerudungi kepala dengan kain, kemudian mereka kembali ke rumah masing-masing, mereka tidak dikenal karena Rasulullah shallallahu 'alaihi wasallam mendirikan shalat subuh ketika keadaan masih pagi buta.""","و حَدَّثَنِي حَرْمَلَةُ بْنُ يَحْيَى أَخْبَرَنَا ابْنُ وَهْبٍ أَخْبَرَنِي يُونُسُ أَنَّ ابْنَ شِهَابٍ أَخْبَرَهُ قَالَ أَخْبَرَنِي عُرْوَةُ بْنُ الزُّبَيْرِ أَنَّ عَائِشَةَ زَوْجَ النَّبِيِّ صَلَّى اللَّهُ عَلَيْهِ وَسَلَّمَ قَالَتْ
لَقَدْ كَانَ نِسَاءٌ مِنْ الْمُؤْمِنَاتِ يَشْهَدْنَ الْفَجْرَ مَعَ رَسُولِ اللَّهِ صَلَّى اللَّهُ عَلَيْهِ وَسَلَّمَ مُتَلَفِّعَاتٍ بِمُرُوطِهِنَّ ثُمَّ يَنْقَلِبْنَ إِلَى بُيُوتِهِنَّ وَمَا يُعْرَفْنَ مِنْ تَغْلِيسِ رَسُولِ اللَّهِ صَلَّى اللَّهُ عَلَيْهِ وَسَلَّمَ بِالصَّلَاةِ",58
1030,6,"Dan telah menceritakan kepadaku [Yahya bin Hubaib Al Haritsi], telah menceritakan kepada kami [Khalid bin Al Harits] telah menceritakan kepada kami [Syu'bah] dari [Budail] dia berkata; aku mendengar [Abu Aliyah] menceritakan dari [Abdullah bin Shamit] dari [Abu Dzar] dia berkata; Rasulullah shallallahu 'alaihi wasallam bersabda -sambil menepuk pahanya- ""Bagaimana jika engkau masih hidup ditengah suatu kaum yang suka menunda-nunda shalat dari waktunya?"" Abu Dzar justeru bertanya; ""Menurut engkau, apa yang engkau perintahkan kepada kami?"" Beliau menjawab; ""Tunaikanlah shalat tepat pada waktunya, kemudian tunaikan keperluanmu, jika shalat diiqamati sedang kamu berada di masjid, ikutlah shalat bersama.""","و حَدَّثَنِي يَحْيَى بْنُ حَبِيبٍ الْحَارِثِيُّ حَدَّثَنَا خَالِدُ بْنُ الْحَارِثِ حَدَّثَنَا شُعْبَةُ عَنْ بُدَيْلٍ قَالَ سَمِعْتُ أَبَا الْعَالِيَةِ يُحَدِّثُ عَنْ عَبْدِ اللَّهِ بْنِ الصَّامِتِ عَنْ أَبِي ذَرٍّ قَالَ
قَالَ رَسُولُ اللَّهِ صَلَّى اللَّهُ عَلَيْهِ وَسَلَّمَ وَضَرَبَ فَخِذِي كَيْفَ أَنْتَ إِذَا بَقِيتَ فِي قَوْمٍ يُؤَخِّرُونَ الصَّلَاةَ عَنْ وَقْتِهَا قَالَ قَالَ مَا تَأْمُرُ قَالَ صَلِّ الصَّلَاةَ لِوَقْتِهَا ثُمَّ اذْهَبْ لِحَاجَتِكَ فَإِنْ أُقِيمَتْ الصَّلَاةُ وَأَنْتَ فِي الْمَسْجِدِ فَصَلِّ",58
1031,6,"Telah menceritakan kepadaku [Zuhair bin Harb] telah menceritakan kepada kami [Ismail bin Ibrahim] dari [Ayyub] dari [Abu Aliyah Al Barra`] dia berkata; Ibnu Ziyad pernah mengakhirkan shalat, lantas [Abdullah bin Shamit] datang menemuiku, lalu aku berikan kursi untuknya, setelah duduk, aku menceritakan kepadanya apa yang dilakukan oleh Ibnu Ziyad, Abdullah lalu menggigit bibirnya dan beliau tepuk pahaku sambil berkata; ""Aku pernah bertanya kepada [Abu Dzar] sebagaimana engkau bertanya kepadaku, Abu Dzar menepuk pahaku sebagaimana aku menepuk pahamu, lalu dia berkata; ""Aku bertanya kepada Rasulullah shallallahu 'alaihi wasallam sebagaimana engkau bertanya kepadaku, lalu beliau menepuk pahaku sebagaimana aku menepuk pahamu, dan beliau berpesan; ""Tunaikanlah shalat tepat pada waktunya, jika kamu mendapati shalat bersama mereka, maka shalatlah (bersama mereka), jangan kamu katakan ""Maaf, aku telah melakukan shalat, maka aku tak akan shalat lagi.""","و حَدَّثَنِي زُهَيْرُ بْنُ حَرْبٍ حَدَّثَنَا إِسْمَعِيلُ بْنُ إِبْرَاهِيمَ عَنْ أَيُّوبَ عَنْ أَبِي الْعَالِيَةِ الْبَرَّاءِ قَالَ أَخَّرَ ابْنُ زِيَادٍ الصَّلَاةَ فَجَاءَنِي عَبْدُ اللَّهِ بْنُ الصَّامِتِ فَأَلْقَيْتُ لَهُ كُرْسِيًّا فَجَلَسَ عَلَيْهِ فَذَكَرْتُ لَهُ صَنِيعَ ابْنِ زِيَادٍ فَعَضَّ عَلَى شَفَتِهِ وَضَرَبَ فَخِذِي وَقَالَ
إِنِّي سَأَلْتُ أَبَا ذَرٍّ كَمَا سَأَلْتَنِي فَضَرَبَ فَخِذِي كَمَا ضَرَبْتُ فَخِذَكَ وَقَالَ إِنِّي سَأَلْتُ رَسُولَ اللَّهِ صَلَّى اللَّهُ عَلَيْهِ وَسَلَّمَ كَمَا سَأَلْتَنِي فَضَرَبَ فَخِذِي كَمَا ضَرَبْتُ فَخِذَكَ وَقَالَ صَلِّ الصَّلَاةَ لِوَقْتِهَا فَإِنْ أَدْرَكَتْكَ الصَّلَاةُ مَعَهُمْ فَصَلِّ وَلَا تَقُلْ إِنِّي قَدْ صَلَّيْتُ فَلَا أُصَلِّي",58
