haditsId,kitabId,indo,arab,label
605,7,"telah menceritakan kepadaku Yahya dari Malik dari [Ibnu Syihab] dari ['Urwah bin Zubair] dari ['Amrah binti Abdurrahman] dari [Aisyah] isteri Nabi shallallahu 'alaihi wasallam, berkata, ""Jika Rasulullah shallallahu 'alaihi wasallam sedang beri'tikaf, beliau mengeluarkan kepalanya padaku, dan aku menyisir rambutnya. Dan beliau tidak masuk rumah kecuali untuk memenuhi hajat manusiawi saja.""","حَدَّثَنِي يَحْيَى عَنْ مَالِك عَنْ ابْنِ شِهَابٍ عَنْ عُرْوَةَ بْنِ الزُّبَيْرِ عَنْ عَمْرَةَ بِنْتِ عَبْدِ الرَّحْمَنِ عَنْ عَائِشَةَ زَوْجِ النَّبِيِّ صَلَّى اللَّهُ عَلَيْهِ وَسَلَّمَ أَنَّهَا قَالَتْ
كَانَ رَسُولُ اللَّهِ صَلَّى اللَّهُ عَلَيْهِ وَسَلَّمَ إِذَا اعْتَكَفَ يُدْنِي إِلَيَّ رَأْسَهُ فَأُرَجِّلُهُ وَكَانَ لَا يَدْخُلُ الْبَيْتَ إِلَّا لِحَاجَةِ الْإِنْسَانِ",16
606,7,"telah menceritakan kepadaku Yahya dari Malik dari [Ibnu Syihab] dari ['Amrah binti Abdurrahman], bahwa jika [Aisyah] sedang I'tikaf, maka dia tidak menanyakan orang yang sakit kecuali sambil berjalan, tanpa berhenti.","و حَدَّثَنِي عَنْ مَالِك عَنْ ابْنِ شِهَابٍ عَنْ عَمْرَةَ بِنْتِ عَبْدِ الرَّحْمَنِ أَنَّ عَائِشَةَ
كَانَتْ إِذَا اعْتَكَفَتْ لَا تَسْأَلُ عَنْ الْمَرِيضِ إِلَّا وَهِيَ تَمْشِي لَا تَقِفُ",16
607,7,"telah menceritakan kepadaku dari Malik bertanya kepada [Ibnu Syihab] tentang seseorang yang sedang beri'tikaf, apakah dia harus melakukan semua hajatnya di bawah tempat yang beratap. Dia menjawab, ""Ya. Tidak mengapa.""","و حَدَّثَنِي عَنْ مَالِك أَنَّهُ سَأَلَ ابْنَ شِهَابٍ
عَنْ الرَّجُلِ يَعْتَكِفُ هَلْ يَدْخُلُ لِحَاجَتِهِ تَحْتَ سَقْفٍ فَقَالَ نَعَمْ لَا بَأْسَ بِذَلِكَ",16
608,7,"telah menceritakan kepadaku dari Yahya dari Ziyad bin Abdurrahman berkata, telah menceritakan kepada kami Malik dari [Sumayya] mantan budak Abu Bakar bin Abdurrahman, bahwa [Abu Bakar bin Abdurrahman] sedang beri'tikaf, lalu dia pergi untuk memenuhi hajatnya di bawah tempat yang beratap pada sebuah kamar yang tertutup, di rumah Khalid bin Walid. Kemudian dia tidak kembali hingga mendatangi hari raya bersama kaum muslimin.""","حَدَّثَنِي يَحْيَى عَنْ زِيَاد بْن عَبْد الرَّحْمَنِ قَالَ حَدَّثَنَا مَالِك عَنْ سُمَيٍّ مَوْلَى أَبِي بَكْرِ بْنِ عَبْدِ الرَّحْمَنِ أَنَّ أَبَا بَكْرِ بْنَ عَبْدِ الرَّحْمَنِ
اعْتَكَفَ فَكَانَ يَذْهَبُ لِحَاجَتِهِ تَحْتَ سَقِيفَةٍ فِي حُجْرَةٍ مُغْلَقَةٍ فِي دَارِ خَالِدِ بْنِ الْوَلِيدِ ثُمَّ لَا يَرْجِعُ حَتَّى يَشْهَدَ الْعِيدَ مَعَ الْمُسْلِمِينَ",16
609,7,"telah menceritakan kepadaku Ziyad dari Malik dari [Ibnu Syihab] dari ['Amrah binti Abdurrahman] dari [Aisyah], bahwa Rasulullah shallallahu 'alaihi wasallam hendak beri'tikaf. Tatkala beliau beranjak menuju tempat yang beliau ingin beri'tikaf di dalamnya, beliau mendapatkan di dalamnya ada banyak tenda; tenda Aisyah, tenda Hafshah dan tenda Zainab. Tatkala melihat hal itu, beliau pun bertanya. Lalu ada yang menjawab bahwa itu adalah tenda Aisyah, Hafshah dan Zainab. Rasulullah shallallahu 'alaihi wasallam kemudian bersabda: ""Apakah kalian akan mengatakan bahwa yang mereka lakukan adalah kebaikan?"" Beliau pergi dan tidak melakukan i'tikaf, lalu beliau menggantinya selama sepuluh hari pada bulan Syawal.""","حَدَّثَنِي زِيَاد عَنْ مَالِك عَنْ ابْنِ شِهَابٍ عَنْ عَمْرَةَ بِنْتِ عَبْدِ الرَّحْمَنِ عَنْ عَائِشَةَ
أَنَّ رَسُولَ اللَّهِ صَلَّى اللَّهُ عَلَيْهِ وَسَلَّمَ أَرَادَ أَنْ يَعْتَكِفَ فَلَمَّا انْصَرَفَ إِلَى الْمَكَانِ الَّذِي أَرَادَ أَنْ يَعْتَكِفَ فِيهِ وَجَدَ أَخْبِيَةً خِبَاءَ عَائِشَةَ وَخِبَاءَ حَفْصَةَ وَخِبَاءَ زَيْنَبَ فَلَمَّا رَآهَا سَأَلَ عَنْهَا فَقِيلَ لَهُ هَذَا خِبَاءُ عَائِشَةَ وَحَفْصَةَ وَزَيْنَبَ فَقَالَ رَسُولُ اللَّهِ صَلَّى اللَّهُ عَلَيْهِ وَسَلَّمَ آلْبِرَّ تَقُولُونَ بِهِنَّ ثُمَّ انْصَرَفَ فَلَمْ يَعْتَكِفْ حَتَّى اعْتَكَفَ عَشْرًا مِنْ شَوَّالٍ",16
611,7,"Telah menceritakan kepadaku Ziyad dari Malik dari [Yazid bin Abdullah bin Al Had] dari [Muhammad bin Ibrahim bin Al Harits At Taimi] dari [Abu Salamah bin Abdurrahman] dari [Abu Sa'id al Khudri] berkata, ""Rasulullah shallallahu 'alaihi wasallam memulai beri'tikaf pada sepuluh kedua pada bulan Ramadan. Beliau beri'tikaf pada tahun itu, hingga ketika tiba malam kedua puluh satu, yaitu hari di mana beliau keluar dari I'tikafnya setelah waktu subuh, beliau bersabda: 'Barangsiapa ingin melaksanakan I'tikaf bersamaku, hendaklah dia mengerjakannya pada sepuluh hari yang terakhir ini. Aku telah melihat dalam mimpiku, namun aku lupa. Aku mimpi pada waktu paginya aku bersujud pada air dan tanah. Carilah pada sepuluh hari yang terakhir, serta pada malam yang ganjil.' Abu Sa'id berkata; ""Pada malam itu terjadi hujan, dan masjidnya berada pada bangsal, sehingga masjidnya bocor."" Dia menambahkan; ""Dengan kedua mataku, aku melihat Rasulullah shallallahu 'alaihi wasallam pergi, sementara pada dahi dan hidungnya ada bekas tanah dan air. Itu terjadi pada pagi hari malam ke dua puluh satu.""","حَدَّثَنِي زِيَاد عَنْ مَالِك عَنْ يَزِيدَ بْنِ عَبْدِ اللَّهِ بْنِ الْهَادِ عَنْ مُحَمَّدِ بْنِ إِبْرَاهِيمَ بْنِ الْحَارِثِ التَّيْمِيِّ عَنْ أَبِي سَلَمَةَ بْنِ عَبْدِ الرَّحْمَنِ عَنْ أَبِي سَعِيدٍ الْخُدْرِيِّ أَنَّهُ قَالَ
كَانَ رَسُولُ اللَّهِ صَلَّى اللَّهُ عَلَيْهِ وَسَلَّمَ يَعْتَكِفُ الْعَشْرَ الْوُسُطَ مِنْ رَمَضَانَ فَاعْتَكَفَ عَامًا حَتَّى إِذَا كَانَ لَيْلَةَ إِحْدَى وَعِشْرِينَ وَهِيَ اللَّيْلَةُ الَّتِي يَخْرُجُ فِيهَا مِنْ صُبْحِهَا مِنْ اعْتِكَافِهِ قَالَ مَنْ اعْتَكَفَ مَعِيَ فَلْيَعْتَكِفْ الْعَشْرَ الْأَوَاخِرَ وَقَدْ رَأَيْتُ هَذِهِ اللَّيْلَةَ ثُمَّ أُنْسِيتُهَا وَقَدْ رَأَيْتُنِي أَسْجُدُ مِنْ صُبْحِهَا فِي مَاءٍ وَطِينٍ فَالْتَمِسُوهَا فِي الْعَشْرِ الْأَوَاخِرِ وَالْتَمِسُوهَا فِي كُلِّ وِتْرٍ قَالَ أَبُو سَعِيدٍ فَأُمْطِرَتْ السَّمَاءُ تِلْكَ اللَّيْلَةَ وَكَانَ الْمَسْجِدُ عَلَى عَرِيشٍ فَوَكَفَ الْمَسْجِدُ قَالَ أَبُو سَعِيدٍ فَأَبْصَرَتْ عَيْنَايَ رَسُولَ اللَّهِ صَلَّى اللَّهُ عَلَيْهِ وَسَلَّمَ انْصَرَفَ وَعَلَى جَبْهَتِهِ وَأَنْفِهِ أَثَرُ الْمَاءِ وَالطِّينِ مِنْ صُبْحِ لَيْلَةِ إِحْدَى وَعِشْرِينَ",16
