haditsId,kitabId,indo,arab,label
547,5,"Telah menceritakan kepadaku Yahya dari Malik dari [Ibnu Syihab] dari [Salim bin Abdullah] dari [Bapaknya], bahwa [Umar bin Khatthab] mengambil pajak dari petani non Arab yang berupa gandum dan minyak sebesar seperdua puluh. Hal itu dimaksudkan agar hasil yang dibawa ke Madinah jumlahnya menjadi banyak. Lalu ia mengambil dari biji-bijian sebesar sepersepuluh.""","حَدَّثَنِي يَحْيَى عَنْ مَالِك عَنْ ابْنِ شِهَابٍ عَنْ سَالِمِ بْنِ عَبْدِ اللَّهِ عَنْ أَبِيهِ أَنَّ عُمَرَ بْنَ الْخَطَّابِ
كَانَ يَأْخُذُ مِنْ النَّبَطِ مِنْ الْحِنْطَةِ وَالزَّيْتِ نِصْفَ الْعُشْرِ يُرِيدُ بِذَلِكَ أَنْ يَكْثُرَ الْحَمْلُ إِلَى الْمَدِينَةِ وَيَأْخُذُ مِنْ الْقِطْنِيَّةِ الْعُشْرَ",20
548,5,"Telah menceritakan kepadaku dari Malik dari [Ibnu Syihab] dari [As Sa`ib bin Yazid] ia berkata, ""Saat aku masih kecil, aku dan Abdullah bin Utbah bin Mas'ud bekerja di pasar Madinah, yakni pada masa pemerintahan Umar bin Al Khatthab. Saat itu kami memungut sepersepuluh dari para petani non Arab.""","و حَدَّثَنِي عَنْ مَالِك عَنْ ابْنِ شِهَابٍ عَنْ السَّائِبِ بْنِ يَزِيدَ أَنَّهُ قَالَ
كُنْتُ غُلَامًا عَامِلًا مَعَ عَبْدِ اللَّهِ بْنِ عُتْبَةَ بْنِ مَسْعُودٍ عَلَى سُوقِ الْمَدِينَةِ فِي زَمَانِ عُمَرَ بْنِ الْخَطَّابِ فَكُنَّا نَأْخُذُ مِنْ النَّبَطِ الْعُشْرَ",20
1158,19,"Telah menceritakan kepadaku dari Malik dari [Yahya bin Sa'id] bahwa dia telah mendengar Jamil bin Abdurrahman Al muadzin berkata kepada [Sa'id bin Musayyab]; ""Saya adalah orang yang membeli rezeki-rezeki yang diberikan kepada orang-orang di Al Jar berkat kehendak Allah. Saya hendak menjual makanan yang dititipkan kepadaku dengan penangguhan."" Sa'id pun bertanya kepadanya; ""Apakah kamu akan memberi (harga) penuh dari barang yang telah engkau beli?"" dia menjawab; ""Ya."" Maka Sa'id melarangnya.","و حَدَّثَنِي عَنْ مَالِك عَنْ يَحْيَى بْنِ سَعِيدٍ أَنَّهُ سَمِعَ جَمِيلَ بْنَ عَبْدِ الرَّحْمَنِ الْمُؤَذِّنَ يَقُولُ لِسَعِيدِ بْنِ الْمُسَيَّبِ
إِنِّي رَجُلٌ أَبْتَاعُ مِنْ الْأَرْزَاقِ الَّتِي تُعْطَى النَّاسُ بِالْجَارِ مَا شَاءَ اللَّهُ ثُمَّ أُرِيدُ أَنْ أَبِيعَ الطَّعَامَ الْمَضْمُونَ عَلَيَّ إِلَى أَجَلٍ فَقَالَ لَهُ سَعِيدٌ أَتُرِيدُ أَنْ تُوَفِّيَهُمْ مِنْ تِلْكَ الْأَرْزَاقِ الَّتِي ابْتَعْتَ فَقَالَ نَعَمْ فَنَهَاهُ عَنْ ذَلِكَ",20
1173,19,"Telah menceritakan kepadaku Yahya dari Malik dari [Ibnu Syihab] dari [Abu Bakar bin Abdurrahman bin Al Harits bin Hisyam] dari [Abu Mas'ud Al Anshari] berkata, ""Rasulullah Shalla Allahu 'alaihi wa sallam melarang memakan harta hasil penjualan anjing, upah pelacur dan upah dukun. Yang dimaksud dengan upah pelacur ialah harta yang diterima oleh seorang wanita dari hasil zina. Upah dukun adalah uang sogokan yang diberikan kepadanya atas jasa pelayanannya.""","حَدَّثَنِي يَحْيَى عَنْ مَالِك عَنْ ابْنِ شِهَابٍ عَنْ أَبِي بَكْرِ بْنِ عَبْدِ الرَّحْمَنِ بْنِ الْحَارِثِ بْنِ هِشَامٍ عَنْ أَبِي مَسْعُودٍ الْأَنْصَارِيِّ
أَنَّ رَسُولَ اللَّهِ صَلَّى اللَّهُ عَلَيْهِ وَسَلَّمَ نَهَى عَنْ ثَمَنِ الْكَلْبِ وَمَهْرِ الْبَغِيِّ وَحُلْوَانِ الْكَاهِنِ
يَعْنِي بِمَهْرِ الْبَغِيِّ مَا تُعْطَاهُ الْمَرْأَةُ عَلَى الزِّنَا وَحُلْوَانُ الْكَاهِنِ رَشْوَتُهُ وَمَا يُعْطَى عَلَى أَنْ يَتَكَهَّنَ",20
1275,25,"Telah menceritakan kepadaku Malik dari [Hisyam bin 'Urwah] dari [Bapaknya] dari [Aisyah] isteri Nabi shallallahu 'alaihi wasallam berkata; ""Barirah datang dan berkata; ""Saya telah memerdekakan diriku dari majikanku secara mukatabah dan membayar sembilan uqiyah, dengan cicilan setiap satu tahun satu uqiyah. Maka bantulah aku."" Aisyah berkata; ""Jika keluarga (majikan) mu setuju, maka saya akan membayarkannya kepada mereka atas nama kamu, tetapi perwalianmu harus kepadaku."" Barirah lantas pergi menemui keluarganya dan menyampaikan hal itu kepada mereka, namun mereka menolaknya. Tidak lama kemudian dia datang dari keluarganya, sementara Rasulullah shallallahu 'alaihi wasallam duduk mendengarkan. Barirah berkata kepada Aisyah; ""Saya telah tawarkan kepada mereka tapi mereka menolaknya, kecuali jika hak perwalian tetap pada mereka."" Rasulullah shallallahu 'alaihi wasallam yang mendengar percakapan tersebut langsung bertanya, lalu 'Aisyah memberitahukan kepada beliau. Maka Rasulullah shallallahu 'alaihi wasallam pun bersabda: ""Ambillah dia dan tetapkanlah persyaratan kepada mereka, karena perwalian adalah hak bagi orang yang membebaskannya."" Aisyah kemudian melakukan saran beliau, setelah itu Rasulullah shallallahu 'alaihi wasallam berdiri di hadapan orang banyak lalu bertahmid dan memuji Allah. Beliau lantas bersabda: ""Amma ba'du, kenapa orang-orang memberi persyaratan yang tidak berdasarkan kitab Allah. Syarat apapun yang tidak terdapat pada kitab Allah adalah itu adalah batil, meskipun itu seratus syarat. Ketetapan Allah-lah yang lebih berhak dan syarat Allah adalah lebih kuat. Perwalian itu bagi orang yang membebaskan."" ","حَدَّثَنِي مَالِك عَنْ هِشَامِ بْنِ عُرْوَةَ عَنْ أَبِيهِ عَنْ عَائِشَةَ زَوْجِ النَّبِيِّ صَلَّى اللَّهُ عَلَيْهِ وَسَلَّمَ أَنَّهَا قَالَتْ
جَاءَتْ بَرِيرَةُ فَقَالَتْ إِنِّي كَاتَبْتُ أَهْلِي عَلَى تِسْعِ أَوَاقٍ فِي كُلِّ عَامٍ أُوقِيَّةٌ فَأَعِينِينِي فَقَالَتْ عَائِشَةُ إِنْ أَحَبَّ أَهْلُكِ أَنْ أَعُدَّهَا لَهُمْ عَنْكِ عَدَدْتُهَا وَيَكُونَ لِي وَلَاؤُكِ فَعَلْتُ فَذَهَبَتْ بَرِيرَةُ إِلَى أَهْلِهَا فَقَالَتْ لَهُمْ ذَلِكَ فَأَبَوْا عَلَيْهَا فَجَاءَتْ مِنْ عِنْدِ أَهْلِهَا وَرَسُولُ اللَّهِ صَلَّى اللَّهُ عَلَيْهِ وَسَلَّمَ جَالِسٌ فَقَالَتْ لِعَائِشَةَ إِنِّي قَدْ عَرَضْتُ عَلَيْهِمْ ذَلِكَ فَأَبَوْا عَلَيَّ إِلَّا أَنْ يَكُونَ الْوَلَاءُ لَهُمْ فَسَمِعَ ذَلِكَ رَسُولُ اللَّهِ صَلَّى اللَّهُ عَلَيْهِ وَسَلَّمَ فَسَأَلَهَا فَأَخْبَرَتْهُ عَائِشَةُ فَقَالَ رَسُولُ اللَّهِ صَلَّى اللَّهُ عَلَيْهِ وَسَلَّمَ خُذِيهَا وَاشْتَرِطِي لَهُمْ الْوَلَاءَ فَإِنَّمَا الْوَلَاءُ لِمَنْ أَعْتَقَ فَفَعَلَتْ عَائِشَةُ ثُمَّ قَامَ رَسُولُ اللَّهِ صَلَّى اللَّهُ عَلَيْهِ وَسَلَّمَ فِي النَّاسِ فَحَمِدَ اللَّهَ وَأَثْنَى عَلَيْهِ ثُمَّ قَالَ أَمَّا بَعْدُ فَمَا بَالُ رِجَالٍ يَشْتَرِطُونَ شُرُوطًا لَيْسَتْ فِي كِتَابِ اللَّهِ مَا كَانَ مِنْ شَرْطٍ لَيْسَ فِي كِتَابِ اللَّهِ فَهُوَ بَاطِلٌ وَإِنْ كَانَ مِائَةَ شَرْطٍ قَضَاءُ اللَّهِ أَحَقُّ وَشَرْطُ اللَّهِ أَوْثَقُ وَإِنَّمَا الْوَلَاءُ لِمَنْ أَعْتَقَ",20
1293,28,"Telah menceritakan kepadaku Malik dari [Ibnu Syihab] dari ['Ubaidullah bin Abdullah bin Utbah bin Mas'ud] dari [Abu Hurairah] dan [Zaid bin Khalid Al Juhani] mereka berdua mengabarkan, bahwa ada dua orang yang mengadukan perkaranya kepada Rasulullah Shalla Allahu 'alaihi wa sallam. Salah seorang dari mereka berkata; ""Wahai Rasulullah, putuskanlah perkara kami sesuai kitab Allah, "" sedang yang lainnya -dan dia lebih fakih- berkata; ""Benar, ya Rasulullah! Putuskanlah perkara kami ini sesuai dengan kitabullah, namun ijinkan saya untuk berbicara."" Beliau bersabda: ""Bicaralah."" Laki-laki itu lantas berkata; ""Sesungguhnya anakku adalah buruh yang bekerja kepada orang ini, lalu dia berzina dengan isterinya. Lalu ia mengabarkan kepadaku bahwa anakku harus dirajam. Maka aku segera menebusnya dengan membayar seratus ekor kambing, dan membebaskan budakku. Setelah itu aku bertanya beberapa ahli ilmu mengenai hal itu, mereka mengatakan bahwa seharusnya anakku didera seratus kali dan diasingkan selama setahun, sedangkan wanita itu harus dirajam."" Rasulullah shallallahu 'alaihi wasallam bersabda: ""Demi yang jiwaku berada ditangan-Nya, sungguh akan saya putuskan perkara kalian dengan kitabullah. Kambing dan budakmu, maka akan dikembalikan."" Beliau kemudian mendera anak orang itu seratus kali dan diasingkan selama satu tahu. Kemudian beliau menyuruh Unais Al Aslami agar mendatangkan isteri tersebut, jika mengakuinya maka ia akan dirajam. Wanita itu lalu mengakuinya, maka Unais pun merajamnya. Malik berkata; ""'Asif adalah pekerja.""","حَدَّثَنِي مَالِك عَنْ ابْنِ شِهَابٍ عَنْ عُبَيْدِ اللَّهِ بْنِ عَبْدِ اللَّهِ بْنِ عُتْبَةَ بْنِ مَسْعُودٍ عَنْ أَبِي هُرَيْرَةَ وَزَيْدِ بْنِ خَالِدٍ الْجُهَنِيِّ أَنَّهُمَا أَخْبَرَاهُ
أَنَّ رَجُلَيْنِ اخْتَصَمَا إِلَى رَسُولِ اللَّهِ صَلَّى اللَّهُ عَلَيْهِ وَسَلَّمَ فَقَالَ أَحَدُهُمَا يَا رَسُولَ اللَّهِ اقْضِ بَيْنَنَا بِكِتَابِ اللَّهِ وَقَالَ الْآخَرُ وَهُوَ أَفْقَهُهُمَا أَجَلْ يَا رَسُولَ اللَّهِ فَاقْضِ بَيْنَنَا بِكِتَابِ اللَّهِ وَأْذَنْ لِي فِي أَنْ أَتَكَلَّمَ قَالَ تَكَلَّمْ فَقَالَ إِنَّ ابْنِي كَانَ عَسِيفًا عَلَى هَذَا فَزَنَى بِامْرَأَتِهِ فَأَخْبَرَنِي أَنَّ عَلَى ابْنِي الرَّجْمَ فَافْتَدَيْتُ مِنْهُ بِمِائَةِ شَاةٍ وَبِجَارِيَةٍ لِي ثُمَّ إِنِّي سَأَلْتُ أَهْلَ الْعِلْمِ فَأَخْبَرُونِي أَنَّ مَا عَلَى ابْنِي جَلْدُ مِائَةٍ وَتَغْرِيبُ عَامٍ وَأَخْبَرُونِي أَنَّمَا الرَّجْمُ عَلَى امْرَأَتِهِ فَقَالَ رَسُولُ اللَّهِ صَلَّى اللَّهُ عَلَيْهِ وَسَلَّمَ أَمَا وَالَّذِي نَفْسِي بِيَدِهِ لَأَقْضِيَنَّ بَيْنَكُمَا بِكِتَابِ اللَّهِ أَمَّا غَنَمُكَ وَجَارِيَتُكَ فَرَدٌّ عَلَيْكَ وَجَلَدَ ابْنَهُ مِائَةً وَغَرَّبَهُ عَامًا وَأَمَرَ أُنَيْسًا الْأَسْلَمِيَّ أَنْ يَأْتِيَ امْرَأَةَ الْآخَرِ فَإِنْ اعْتَرَفَتْ رَجَمَهَا فَاعْتَرَفَتْ فَرَجَمَهَا
قَالَ مَالِك وَالْعَسِيفُ الْأَجِيرُ",20
1543,32,"Telah menceritakan kepadaku Malik dari [Ibnu Syihab] dari [Ibnu Muhaishah Al Anshari] seorang dari Bani Harisah, dia meminta izin kepada Rasulullah shallallahu 'alaihi wasallam tetang upah tukang bekam, lalu beliau melarangnya. Maka dia terus menanyakannya dan meminta izin beliau hingga beliau bersabda: ""Berikanlah pada budakmu.""","و حَدَّثَنِي مَالِك عَنْ ابْنِ شِهَابٍ عَنْ ابْنِ مُحَيِّصَةَ الْأَنْصَارِيِّ أَحَدِ بَنِي حَارِثَةَ
أَنَّهُ اسْتَأْذَنَ رَسُولَ اللَّهِ صَلَّى اللَّهُ عَلَيْهِ وَسَلَّمَ فِي إِجَارَةِ الْحَجَّامِ فَنَهَاهُ عَنْهَا فَلَمْ يَزَلْ يَسْأَلُهُ وَيَسْتَأْذِنُهُ حَتَّى قَالَ اعْلِفْهُ نُضَّاحَكَ يَعْنِي رَقِيقَكَ",20
1578,32,"Telah menceritakan kepadaku Malik dari [Abu Az Zinad] dari [Al A'raj] dari [Abu Hurairah] bahwa Rasulullah shallallahu 'alaihi wasallam bersabda: ""Ahli warisku tidak memperoleh warisan Dinar. Apa yang telah aku tinggalkan setelah nafkah isteri-isteriku dan upah pekerjaku adalah sedekah.""","و حَدَّثَنِي مَالِك عَنْ أَبِي الزِّنَادِ عَنْ الْأَعْرَجِ عَنْ أَبِي هُرَيْرَةَ
أَنَّ رَسُولَ اللَّهِ صَلَّى اللَّهُ عَلَيْهِ وَسَلَّمَ قَالَ لَا يَقْتَسِمُ وَرَثَتِي دَنَانِيرَ مَا تَرَكْتُ بَعْدَ نَفَقَةِ نِسَائِي وَمَئُونَةِ عَامِلِي فَهُوَ صَدَقَةٌ",20
