haditsId,kitabId,indo,arab
3765,44,"Telah menceritakan kepada kami [Ishaq bin Nashr] telah menceritakan kepada kami [Abdurrazaq] dari [Ma'mar] dari [Hammam] dia mendengar [Abu Hurairah] radliallahu 'anhu, dia berkata, ""Rasulullah Shallallahu 'alahi wasallam bersabda: ""Allah sangat murka kepada suatu kaum yang telah memperlakukan Nabi-Nya seperti ini -seraya menunjuk ke gigi serinya-, Allah sangat murka kepada seseorang yang telah diperangi oleh Rasulullah dijalan Allah.""","حَدَّثَنَا إِسْحَاقُ بْنُ نَصْرٍ حَدَّثَنَا عَبْدُ الرَّزَّاقِ عَنْ مَعْمَرٍ عَنْ هَمَّامٍ سَمِعَ أَبَا هُرَيْرَةَ رَضِيَ اللَّهُ عَنْهُ قَالَ
قَالَ رَسُولُ اللَّهِ صَلَّى اللَّهُ عَلَيْهِ وَسَلَّمَ اشْتَدَّ غَضَبُ اللَّهِ عَلَى قَوْمٍ فَعَلُوا بِنَبِيِّهِ يُشِيرُ إِلَى رَبَاعِيَتِهِ اشْتَدَّ غَضَبُ اللَّهِ عَلَى رَجُلٍ يَقْتُلُهُ رَسُولُ اللَّهِ فِي سَبِيلِ اللَّهِ"
3766,44,"Telah menceritakan kepadaku [Makhlad bin Malik] telah menceritakan kepada kami [Yahya bin Sa'id Al Amawy] telah menceritakan kepada kami [Ibnu Juraij] dari ['Amru bin Dinar] dari [Ikrimah] dari [Ibnu Abbas] radliallahu 'anhuma, dia berkata, ""Allah sangat murka kepada seseorang yang telah dibunuh oleh Nabi Shallallahu 'alahi wasallam (yang berperang) di jalan Allah, Allah sangat murka kepada suatu kaum yang telah membuat wajah Nabiyullah Shallallahu 'alahi wasallam berdarah.""","حَدَّثَنِي مَخْلَدُ بْنُ مَالِكٍ حَدَّثَنَا يَحْيَى بْنُ سَعِيدٍ الْأُمَوِيُّ حَدَّثَنَا ابْنُ جُرَيْجٍ عَنْ عَمْرِو بْنِ دِينَارٍ عَنْ عِكْرِمَةَ عَنْ ابْنِ عَبَّاسٍ رَضِيَ اللَّهُ عَنْهُمَا قَالَ
اشْتَدَّ غَضَبُ اللَّهِ عَلَى مَنْ قَتَلَهُ النَّبِيُّ صَلَّى اللَّهُ عَلَيْهِ وَسَلَّمَ فِي سَبِيلِ اللَّهِ اشْتَدَّ غَضَبُ اللَّهِ عَلَى قَوْمٍ دَمَّوْا وَجْهَ نَبِيِّ اللَّهِ صَلَّى اللَّهُ عَلَيْهِ وَسَلَّمَ"
3767,44,"Bab telah menceritakan kepada kami [Qutaibah bin Sa'id] telah menceritakan kepada kami [Ya'qub] dari [Abu Hazim] bahwa dia mendengar [Sahl bin Sa'd] bertanya tentang luka Rasulullah Shallallahu 'alahi wasallam, dia berkata, ""Demi Allah, sungguh aku telah mengetahui orang yang telah mengobati luka Rasulullah Shallallahu 'alahi wasallam, orang yang menuangkan air, dan dengan apa beliau diobati."" Dia melanjutkan, ""Fatimah, putri Rasulullah Shallallahu 'alahi wasallam lah yang telah mencuci (luka beliau), sementara Ali bin Abu Thalib menuangkan air dengan menggunakan perisai, ketika Fatimah melihat darah semakin mengalir deras, dia langsung mengambil potongan tikar dan membakarnya, setelah itu dia menempelkan (bekas pembakaran tersebut) pada luka beliau hingga darahnya terhenti, pada waktu itu gigi seri beliau tanggal, wajah beliau terluka dan topi baja beliau pecah.""","بَاب حَدَّثَنَا قُتَيْبَةُ بْنُ سَعِيدٍ حَدَّثَنَا يَعْقُوبُ عَنْ أَبِي حَازِمٍ أَنَّهُ سَمِعَ سَهْلَ بْنَ سَعْدٍ
وَهُوَ يُسْأَلُ عَنْ جُرْحِ رَسُولِ اللَّهِ صَلَّى اللَّهُ عَلَيْهِ وَسَلَّمَ فَقَالَ أَمَا وَاللَّهِ إِنِّي لَأَعْرِفُ مَنْ كَانَ يَغْسِلُ جُرْحَ رَسُولِ اللَّهِ صَلَّى اللَّهُ عَلَيْهِ وَسَلَّمَ وَمَنْ كَانَ يَسْكُبُ الْمَاءَ وَبِمَا دُووِيَ قَالَ كَانَتْ فَاطِمَةُ عَلَيْهَا السَّلَام بِنْتُ رَسُولِ اللَّهِ صَلَّى اللَّهُ عَلَيْهِ وَسَلَّمَ تَغْسِلُهُ وَعَلِيُّ بْنُ أَبِي طَالِبٍ يَسْكُبُ الْمَاءَ بِالْمِجَنِّ فَلَمَّا رَأَتْ فَاطِمَةُ أَنَّ الْمَاءَ لَا يَزِيدُ الدَّمَ إِلَّا كَثْرَةً أَخَذَتْ قِطْعَةً مِنْ حَصِيرٍ فَأَحْرَقَتْهَا وَأَلْصَقَتْهَا فَاسْتَمْسَكَ الدَّمُ وَكُسِرَتْ رَبَاعِيَتُهُ يَوْمَئِذٍ وَجُرِحَ وَجْهُهُ وَكُسِرَتْ الْبَيْضَةُ عَلَى رَأْسِهِ"
3768,44,"Telah menceritakan kepadaku ['Amru bin Ali] telah menceritakan kepada kami [Abu 'Ashim] telah menceritakan kepada kami [Ibnu Juraij] dari ['Amru bin Dinar] dari [Ikrimah] dari [Ibnu Abbas] dia berkata, ""Allah sangat murka terhadap orang yang telah dibunuh Nabi, dan Allah sangat murka kepada seseorang yang membuat wajah Rasulullah Shallallahu 'alahi wasallam terluka.""","حَدَّثَنِي عَمْرُو بْنُ عَلِيٍّ حَدَّثَنَا أَبُو عَاصِمٍ حَدَّثَنَا ابْنُ جُرَيْجٍ عَنْ عَمْرِو بْنِ دِينَارٍ عَنْ عِكْرِمَةَ عَنْ ابْنِ عَبَّاسٍ قَالَ
اشْتَدَّ غَضَبُ اللَّهِ عَلَى مَنْ قَتَلَهُ نَبِيٌّ وَاشْتَدَّ غَضَبُ اللَّهِ عَلَى مَنْ دَمَّى وَجْهَ رَسُولِ اللَّهِ صَلَّى اللَّهُ عَلَيْهِ وَسَلَّمَ"
3769,44,"Telah menceritakan kepada kami [Muhammad] telah menceritakan kepada kami [Abu Mu'awiyah] dari [Hisyam] dari [Ayahnya] dari ['Aisyah] radliallahu 'anha mengenai ayat: '((yaitu) orang-orang yang mentaati perintah Allah dan rasul-Nya sesudah mereka mendapat luka (dalam peperangan Uhud). bagi orang-orang yang berbuat kebaikan diantara mereka dan yang bertakwa ada pahala yang besar) ' (Qs. Ali Imran: 172). Aisyah berkata kepada 'Urwah, ""Wahai keponakanku, sesungguhnya ayahmu termasuk dari mereka (yang diterangkan dalam ayat), yaitu Az Zubair dan Abu Bakr. Ketika Rasulullah Shallallahu 'alahi wasallam terluka pada perang Uhud, disaat beliau khawatir kaum Musyrikin yang telah pergi akan kembali, beliau bersabda: ""Siapakah yang akan mengintai mereka?"", lalu beliau memilih tujuh puluh orang."" Perawi berkata, ""Termasuk diantara mereka adalah Abu Bakr dan Az Zubair.""","حَدَّثَنَا مُحَمَّدٌ حَدَّثَنَا أَبُو مُعَاوِيَةَ عَنْ هِشَامٍ عَنْ أَبِيهِ عَنْ عَائِشَةَ رَضِيَ اللَّهُ عَنْهَا
{ الَّذِينَ اسْتَجَابُوا لِلَّهِ وَالرَّسُولِ مِنْ بَعْدِ مَا أَصَابَهُمْ الْقَرْحُ لِلَّذِينَ أَحْسَنُوا مِنْهُمْ وَاتَّقَوْا أَجْرٌ عَظِيمٌ }
قَالَتْ لِعُرْوَةَ يَا ابْنَ أُخْتِي كَانَ أَبَوَاكَ مِنْهُمْ الزُّبَيْرُ وَأَبُو بَكْرٍ لَمَّا أَصَابَ رَسُولَ اللَّهِ صَلَّى اللَّهُ عَلَيْهِ وَسَلَّمَ مَا أَصَابَ يَوْمَ أُحُدٍ وَانْصَرَفَ عَنْهُ الْمُشْرِكُونَ خَافَ أَنْ يَرْجِعُوا قَالَ مَنْ يَذْهَبُ فِي إِثْرِهِمْ فَانْتَدَبَ مِنْهُمْ سَبْعُونَ رَجُلًا قَالَ كَانَ فِيهِمْ أَبُو بَكْرٍ وَالزُّبَيْرُ"
3770,44,"Telah menceritakan kepada kami ['Amru bin Ali] telah menceritakan kepada kami [Mu'adz bin Hisyam] dia berkata, telah menceritakan kepadaku [Ayahku] dari [Qatadah] dia berkata, ""Aku belum pernah mendapati diperkampungan orang Arab yang penduduknya lebih banyak mati syahid dan lebih mulia (kedudukannya) pada hari Kiamat daripada orang-orang Anshar."" [Qatadah] berkata; telah menceritakan kepada kami [Anas bin Malik] bahwa di antara mereka yang gugur pada perang Uhud sejumlah tujuh puluh orang, pada peristiwa Bi'rul Ma'unah sejumlah tujuh puluh orang, dan pada perang Yamamah berjumlah tujuh puluh orang."" Anas melanjutkan, ""Peristiwa Bi'rul Ma'unah terjadi pada masa Rasulullah Shallallahu 'alahi wasallam, sementara perang Yamamah terjadi pada masa Abu Bakr, yaitu peristiwa (pembangkangan) Musailamah Al Kaddzab.""","حَدَّثَنِي عَمْرُو بْنُ عَلِيٍّ حَدَّثَنَا مُعَاذُ بْنُ هِشَامٍ قَالَ حَدَّثَنِي أَبِي عَنْ قَتَادَةَ قَالَ مَا نَعْلَمُ حَيًّا مِنْ أَحْيَاءِ الْعَرَبِ أَكْثَرَ شَهِيدًا أَعَزَّ يَوْمَ الْقِيَامَةِ مِنْ الْأَنْصَارِ قَالَ قَتَادَةُ وَحَدَّثَنَا أَنَسُ بْنُ مَالِكٍ
أَنَّهُ قُتِلَ مِنْهُمْ يَوْمَ أُحُدٍ سَبْعُونَ وَيَوْمَ بِئْرِ مَعُونَةَ سَبْعُونَ وَيَوْمَ الْيَمَامَةِ سَبْعُونَ قَالَ وَكَانَ بِئْرُ مَعُونَةَ عَلَى عَهْدِ رَسُولِ اللَّهِ صَلَّى اللَّهُ عَلَيْهِ وَسَلَّمَ وَيَوْمُ الْيَمَامَةِ عَلَى عَهْدِ أَبِي بَكْرٍ يَوْمَ مُسَيْلِمَةَ الْكَذَّابِ"
3771,44,"Telah menceritakan kepada kami [Qutaibah bin Sa'id] telah menceritakan kepada kami [Al Laits] dari [Ibnu Syihab] dari [Abdurrahman bin Ka'b bin Malik] bahwa [Jabir bin Abdullah] radliallahu 'anhuma telah mengabarkan kepadanya, bahwa Rasulullah shallallahu 'alaihi wasallam menggabungkan (menghimpun) dua orang yang gugur pada perang Uhud dalam satu kain, kemudian beliau bersabda: ""Manakah diantara keduanya yang paling banyak hapalan Al Qur'an?"" ketika diisyaratkan kepada salah satu dari keduanya, beliau mendahulukannya ketika memasukkan kedalam lahd, beliau bersabda: ""Aku adalah saksi atas mereka."" Dan beliau menyuruh mereka untuk menguburkan mereka dengan darah yang ada pada diri mereka, mereka tidak dishalatkan dan tidak dimandikan. [Abu Al Walid] mengatakan dari [Syu'bah] dari [Ibnu Al Munkadir] dia berkata, aku mendengar [Jabir bin Abdullah] dia berkata, ""Dihari dibunuhnya ayahku, aku pun menangis sambil menyingkap kain diwajahnya, sementara para sahabat Nabi shallallahu 'alaihi wasallam melarangku, namun Nabi shallallahu 'alaihi wasallam tidak melarangku, Nabi shallallahu 'alaihi wasallam bersabda: ""Janganlah kamu menangisinya -atau kenapa kamu menangisinya? - Para malaikat senantiasa menaungi dengan sayapnya hingga (ruhnya) diangkat.""","حَدَّثَنَا قُتَيْبَةُ بْنُ سَعِيدٍ حَدَّثَنَا اللَّيْثُ عَنْ ابْنِ شِهَابٍ عَنْ عَبْدِ الرَّحْمَنِ بْنِ كَعْبِ بْنِ مَالِكٍ أَنَّ جَابِرَ بْنَ عَبْدِ اللَّهِ رَضِيَ اللَّهُ عَنْهُمَا أَخْبَرَهُ
أَنَّ رَسُولَ اللَّهِ صَلَّى اللَّهُ عَلَيْهِ وَسَلَّمَ كَانَ يَجْمَعُ بَيْنَ الرَّجُلَيْنِ مِنْ قَتْلَى أُحُدٍ فِي ثَوْبٍ وَاحِدٍ ثُمَّ يَقُولُ أَيُّهُمْ أَكْثَرُ أَخْذًا لِلْقُرْآنِ فَإِذَا أُشِيرَ لَهُ إِلَى أَحَدٍ قَدَّمَهُ فِي اللَّحْدِ وَقَالَ أَنَا شَهِيدٌ عَلَى هَؤُلَاءِ يَوْمَ الْقِيَامَةِ وَأَمَرَ بِدَفْنِهِمْ بِدِمَائِهِمْ وَلَمْ يُصَلِّ عَلَيْهِمْ وَلَمْ يُغَسَّلُوا
وَقَالَ أَبُو الْوَلِيدِ عَنْ شُعْبَةَ عَنْ ابْنِ الْمُنْكَدِرِ قَالَ سَمِعْتُ جَابِرَ بْنَ عَبْدِ اللَّهِ قَالَ لَمَّا قُتِلَ أَبِي جَعَلْتُ أَبْكِي وَأَكْشِفُ الثَّوْبَ عَنْ وَجْهِهِ فَجَعَلَ أَصْحَابُ النَّبِيِّ صَلَّى اللَّهُ عَلَيْهِ وَسَلَّمَ يَنْهَوْنِي وَالنَّبِيُّ صَلَّى اللَّهُ عَلَيْهِ وَسَلَّمَ لَمْ يَنْهَ وَقَالَ النَّبِيُّ صَلَّى اللَّهُ عَلَيْهِ وَسَلَّمَ لَا تَبْكِيهِ أَوْ مَا تَبْكِيهِ مَا زَالَتْ الْمَلَائِكَةُ تُظِلُّهُ بِأَجْنِحَتِهَا حَتَّى رُفِعَ"
3772,44,"Telah menceritakan kepada kami [Muhammad bin Al 'Ala`] telah menceritakan kepada kami [Abu Usamah] dari [Buraid bin Abdullah bin Abu Burdah] dari kakeknya yaitu [Abu Burdah] dari [Abu Musa] radliallahu 'anhu, seingatku dari Nabi shallallahu 'alaihi wasallam beliau bersabda: ""Aku melihat dalam mimpiku bahwa diriku terlihat menghunus pedang, tiba-tiba bagian tengah pedang itu patah dan ternyata itu adalah musibah yang menimpa orang-orang mukmin pada perang Uhud. Setelah itu aku pun terlihat menghunus pedang lagi dan ternyata pedang itu lebih baik dari yang pertama. Itulah kemenangan yang diberikan Allah dan bersatunya orang-orang Mukmin. Dan dalam mimpiku juga, aku melihat sapi -dan Allah Maha Baik- ternyata tafsiran mimpi itu adalah orang-orang mukmin yang mati syahid dalam perang Uhud.""","حَدَّثَنَا مُحَمَّدُ بْنُ الْعَلَاءِ حَدَّثَنَا أَبُو أُسَامَةَ عَنْ بُرَيْدِ بْنِ عَبْدِ اللَّهِ بْنِ أَبِي بُرْدَةَ عَنْ جَدِّهِ أَبِي بُرْدَةَ عَنْ أَبِي مُوسَى رَضِيَ اللَّهُ عَنْهُ أُرَى
عَنْ النَّبِيِّ صَلَّى اللَّهُ عَلَيْهِ وَسَلَّمَ قَالَ رَأَيْتُ فِي رُؤْيَايَ أَنِّي هَزَزْتُ سَيْفًا فَانْقَطَعَ صَدْرُهُ فَإِذَا هُوَ مَا أُصِيبَ مِنْ الْمُؤْمِنِينَ يَوْمَ أُحُدٍ ثُمَّ هَزَزْتُهُ أُخْرَى فَعَادَ أَحْسَنَ مَا كَانَ فَإِذَا هُوَ مَا جَاءَ بِهِ اللَّهُ مِنْ الْفَتْحِ وَاجْتِمَاعِ الْمُؤْمِنِينَ وَرَأَيْتُ فِيهَا بَقَرًا وَاللَّهُ خَيْرٌ فَإِذَا هُمْ الْمُؤْمِنُونَ يَوْمَ أُحُدٍ"
3773,44,"Telah menceritakan kepada kami [Ahmad bin Yunus] telah menceritakan kepada kami [Zuhair] telah menceritakan kepada kami [Al A'masy] dari [Syaqiq] dari [Khabbab] radliallahu 'anhu dia berkata, ""Kami pernah berhijrah bersama Nabi shallallahu 'alaihi wasallam demi mengharap ridla Allah, dan balasan kami telah ditulis di sisi Allah, diantara kami sudah ada yang berlalu atau pergi sebelum menikmati balasan (dunia) sedikitpun, diantara mereka adalah Mush'ab bin Umair, ia terbunuh pada saat perang Uhud dan tidak meninggalkan apa-apa melainkan sehelai kain, apabila kami menutup bagian kepala, maka kedua kakinya tersingkap, dan jika kami menutupi kakinya, maka bagian kepalanya tersingkap, lalu Nabi shallallahu 'alaihi wasallam bersabda: ""Tutuplah bagian kepalanya, dan jadikanlah (sesuatu dari) idzkir untuk menutup kedua kakinya."" Atau beliau bersabda: ""Letakkanlah al idzkir untuk menutupi kedua kakinya."" Dan diantara kami ada yang buahnya telah matang, lalu ia pun memetiknya.","حَدَّثَنَا أَحْمَدُ بْنُ يُونُسَ حَدَّثَنَا زُهَيْرٌ حَدَّثَنَا الْأَعْمَشُ عَنْ شَقِيقٍ عَنْ خَبَّابٍ رَضِيَ اللَّهُ عَنْهُ قَالَ
هَاجَرْنَا مَعَ النَّبِيِّ صَلَّى اللَّهُ عَلَيْهِ وَسَلَّمَ وَنَحْنُ نَبْتَغِي وَجْهَ اللَّهِ فَوَجَبَ أَجْرُنَا عَلَى اللَّهِ فَمِنَّا مَنْ مَضَى أَوْ ذَهَبَ لَمْ يَأْكُلْ مِنْ أَجْرِهِ شَيْئًا كَانَ مِنْهُمْ مُصْعَبُ بْنُ عُمَيْرٍ قُتِلَ يَوْمَ أُحُدٍ فَلَمْ يَتْرُكْ إِلَّا نَمِرَةً كُنَّا إِذَا غَطَّيْنَا بِهَا رَأْسَهُ خَرَجَتْ رِجْلَاهُ وَإِذَا غُطِّيَ بِهَا رِجْلَاهُ خَرَجَ رَأْسُهُ فَقَالَ لَنَا النَّبِيُّ صَلَّى اللَّهُ عَلَيْهِ وَسَلَّمَ غَطُّوا بِهَا رَأْسَهُ وَاجْعَلُوا عَلَى رِجْلَيْهِ الْإِذْخِرَ أَوْ قَالَ أَلْقُوا عَلَى رِجْلَيْهِ مِنْ الْإِذْخِرِ وَمِنَّا مَنْ أَيْنَعَتْ لَهُ ثَمَرَتُهُ فَهُوَ يَهْدِبُهَا"
3774,44,"Telah menceritakan kepadaku [Nashr bin Ali] dia berkata, telah mengabarkan kepadaku [Ayahku] dari [Qurrah bin Khalid] dari [Qatadah] aku mendengar [Anas] radliallahu 'anhu bahwa Nabi shallallahu 'alaihi wasallam bersabda: ""Ini adalah gunung yang mencintai kami dan kamipun mencintainya.""","حَدَّثَنِي نَصْرُ بْنُ عَلِيٍّ قَالَ أَخْبَرَنِي أَبِي عَنْ قُرَّةَ بْنِ خَالِدٍ عَنْ قَتَادَةَ سَمِعْتُ أَنَسًا رَضِيَ اللَّهُ عَنْهُ
أَنَّ النَّبِيَّ صَلَّى اللَّهُ عَلَيْهِ وَسَلَّمَ قَالَ هَذَا جَبَلٌ يُحِبُّنَا وَنُحِبُّهُ"
3775,44,"Telah menceritakan kepada kami [Abdullah bin Yusuf] telah mengabarkan kepada kami [Malik] dari ['Amru] mantan budak Al Mutthalib, dari [Anas bin Malik] radliallahu 'anhu, bahwa Rasulullah shallallahu 'alaihi wasallam menengol kea radliallahu 'anha bukit Uhud, lalu beliau bersabda: ""Ini adalah gunung yang mencintai kami, dan kami pun mencintainya, ya Allah sesungguhnya Ibrahim telah mensucikan kota Makkah, dan akupun mensucikan kota yang berada diantara dua batu hitam (yaitu Madinah).""","حَدَّثَنَا عَبْدُ اللَّهِ بْنُ يُوسُفَ أَخْبَرَنَا مَالِكٌ عَنْ عَمْرٍو مَوْلَى الْمُطَّلِبِ عَنْ أَنَسِ بْنِ مَالِكٍ رَضِيَ اللَّهُ عَنْهُ
أَنَّ رَسُولَ اللَّهِ صَلَّى اللَّهُ عَلَيْهِ وَسَلَّمَ طَلَعَ لَهُ أُحُدٌ فَقَالَ هَذَا جَبَلٌ يُحِبُّنَا وَنُحِبُّهُ اللَّهُمَّ إِنَّ إِبْرَاهِيمَ حَرَّمَ مَكَّةَ وَإِنِّي حَرَّمْتُ مَا بَيْنَ لَابَتَيْهَا"
3776,44,"Telah menceritakan kepadaku ['Amru bin Khalid] telah menceritakan kepada kami [Al Laits] dari [Yazid bin Abu Habib] dari [Abu Al Khair] dari ['Uqbah] bahwa suatu hari Nabi shallallahu 'alaihi wasallam keluar lalu mengerjakan shalat untuk para syuhada perang Uhud, yaitu shalat jenazah, setelah itu beliau menuju mimbar dan bersabda: ""Aku akan mendahului kalian dan aku menjadi saksi atas kalian, bahwa aku, demi Allah, sekarang sedang melihat telagaku (di surga) dan sungguh aku telah diberikan kunci-kunci perbendaharaan bumi -atau kekayaan bumi- dan aku demi Allah, tidak lebih takut bahwa kalian akan berbuat syirik sepeninggalku, tapi yang lebih aku takutkan adalah kalian akan saling memperebutkannya (harta dunia).""","حَدَّثَنِي عَمْرُو بْنُ خَالِدٍ حَدَّثَنَا اللَّيْثُ عَنْ يَزِيدَ بْنِ أَبِي حَبِيبٍ عَنْ أَبِي الْخَيْرِ عَنْ عُقْبَةَ
أَنَّ النَّبِيَّ صَلَّى اللَّهُ عَلَيْهِ وَسَلَّمَ خَرَجَ يَوْمًا فَصَلَّى عَلَى أَهْلِ أُحُدٍ صَلَاتَهُ عَلَى الْمَيِّتِ ثُمَّ انْصَرَفَ إِلَى الْمِنْبَرِ فَقَالَ إِنِّي فَرَطٌ لَكُمْ وَأَنَا شَهِيدٌ عَلَيْكُمْ وَإِنِّي لَأَنْظُرُ إِلَى حَوْضِي الْآنَ وَإِنِّي أُعْطِيتُ مَفَاتِيحَ خَزَائِنِ الْأَرْضِ أَوْ مَفَاتِيحَ الْأَرْضِ وَإِنِّي وَاللَّهِ مَا أَخَافُ عَلَيْكُمْ أَنْ تُشْرِكُوا بَعْدِي وَلَكِنِّي أَخَافُ عَلَيْكُمْ أَنْ تَنَافَسُوا فِيهَا"
