haditsId,kitabId,indo,arab
3997,44,"Telah menceritakan kepadaku [Ishaq] Telah menceritakan kepada kami [Khalid] dari [Asysyaibani] dari [Said bin Abu Burdah] dari [ayahnya] dari [Abu Musa Al'Asy'ari] radliallahu 'anhu, adalah Nabi shallallahu 'alaihi wasallam pernah mengutusnya ke negeri Yaman, selanjutnya beliau bertanya minuman yang biasa diminum disana. Tanya Nabi; ""Minuman apa yang biasa disana? ia menjawab; kebiasaan minuman disana adalah ""Albit'u"" dan ""Al Mizru"", aku mencoba bertanya kepada Abu Burdah? apa maksud minuman Albit'u? Jawabnya, ia adalah rendaman kurma, sedang almizru ialah sebutan untuk minuman dari rendaman tepung. Lantas Rasulullah berujar: ""Setiap yang memabukkan adalah haram."" [Jarir] dan [Abdul Wahid] meriwayatkan hadits ini dari [Abu Burdah].","حَدَّثَنِي إِسْحَاقُ حَدَّثَنَا خَالِدٌ عَنْ الشَّيْبَانِيِّ عَنْ سَعِيدِ بْنِ أَبِي بُرْدَةَ عَنْ أَبِيهِ عَنْ أَبِي مُوسَى الْأَشْعَرِيِّ رَضِيَ اللَّهُ عَنْهُ
أَنَّ النَّبِيَّ صَلَّى اللَّهُ عَلَيْهِ وَسَلَّمَ بَعَثَهُ إِلَى الْيَمَنِ فَسَأَلَهُ عَنْ أَشْرِبَةٍ تُصْنَعُ بِهَا فَقَالَ وَمَا هِيَ قَالَ الْبِتْعُ وَالْمِزْرُ فَقُلْتُ لِأَبِي بُرْدَةَ مَا الْبِتْعُ قَالَ نَبِيذُ الْعَسَلِ وَالْمِزْرُ نَبِيذُ الشَّعِيرِ فَقَالَ كُلُّ مُسْكِرٍ حَرَامٌ
رَوَاهُ جَرِيرٌ وَعَبْدُ الْوَاحِدِ عَنْ الشَّيْبَانِيِّ عَنْ أَبِي بُرْدَةَ"
3998,44,"Telah menceritakan kepada kami [Muslim] Telah menceritakan kepada kami [Syubah] Telah menceritakan kepada kami [Said bin Abu Burdah] dari [ayahnya] katanya, Nabi shallallahu 'alaihi wasallam mengutus kakeknya, alias Abu Musa dan Mu'adz ke Yaman dan beliau pesan: ""Hendaklah kalian mempermudah, jangan mempersulit, berilah kabar gembira jangan kalian jadikan manusia lari (alergi terhadap agama), dan bersatu padulah."" Lantas Abu Musa bertanya; ""Wahai Nabiyullah, wilayah kami disana ada minuman dari tepung yang sering diistilahkan almizru dan ada minuman dari kurma yang sering diistilahkan albit""u? Lantas beliau bersabda: ""Setiap yang memabukkan adalah haram."" Keduanya pun berangkat. lalu Mu'adz berkata kepada Abu Musa; ""Bagaimana engkau membaca Al Quran? Jawab Abu Musa; ""Baik dalam keadaan berdiri, duduk, atau saat aku diatas hewan tungganganku, namun terkadang aku masih menambah."" Sedang Muadz mengatakan; ""Jika aku, kadang aku tidur dan shalat malam, aku perkirakan waktu tidurku seperti waktu aku shalat malam, masing-masing terus membuat kemah dan keduanya silih berganti melakukan kunjungan. Suatu kali Mu'adz mengunjungi Abu Musa, tak tahunya ada seorang laki-laki yang diikat. Mu'adz bertanya; ""Siapa laki-laki ini sebenarnya? Abu Musa menjawab ""Dia seorang yahudi yang masuk Islam, kemudian murtad. Maka Mu'adz menjawab; ""Kalau aku, sungguh akan kupenggal tengkuknya."" Hadits ini dikuatkan jalur perawinya oleh [Al'Aqdi] dan [Wahab] dari [Syu'bah] dan [Waki'], [Nadhr] dan [Abu Dawud] mengatakan dari [Syu'bah] dari [Said] dari [ayahnya] dari [kakeknya] dari Nabi shallallahu 'alaihi wasallam. Dan [Jarir bin Abdul Hamid] meriwayatkannya dari [Asy Syaibani] dari [Abu Burdah].","حَدَّثَنَا مُسْلِمٌ حَدَّثَنَا شُعْبَةُ حَدَّثَنَا سَعِيدُ بْنُ أَبِي بُرْدَةَ عَنْ أَبِيهِ قَالَ
بَعَثَ النَّبِيُّ صَلَّى اللَّهُ عَلَيْهِ وَسَلَّمَ جَدَّهُ أَبَا مُوسَى وَمُعَاذًا إِلَى الْيَمَنِ فَقَالَ يَسِّرَا وَلَا تُعَسِّرَا وَبَشِّرَا وَلَا تُنَفِّرَا وَتَطَاوَعَا فَقَالَ أَبُو مُوسَى يَا نَبِيَّ اللَّهِ إِنَّ أَرْضَنَا بِهَا شَرَابٌ مِنْ الشَّعِيرِ الْمِزْرُ وَشَرَابٌ مِنْ الْعَسَلِ الْبِتْعُ فَقَالَ كُلُّ مُسْكِرٍ حَرَامٌ فَانْطَلَقَا فَقَالَ مُعَاذٌ لِأَبِي مُوسَى كَيْفَ تَقْرَأُ الْقُرْآنَ قَالَ قَائِمًا وَقَاعِدًا وَعَلَى رَاحِلَتِي وَأَتَفَوَّقُهُ تَفَوُّقًا قَالَ أَمَّا أَنَا فَأَنَامُ وَأَقُومُ فَأَحْتَسِبُ نَوْمَتِي كَمَا أَحْتَسِبُ قَوْمَتِي وَضَرَبَ فُسْطَاطًا فَجَعَلَا يَتَزَاوَرَانِ فَزَارَ مُعَاذٌ أَبَا مُوسَى فَإِذَا رَجُلٌ مُوثَقٌ فَقَالَ مَا هَذَا فَقَالَ أَبُو مُوسَى يَهُودِيٌّ أَسْلَمَ ثُمَّ ارْتَدَّ فَقَالَ مُعَاذٌ لَأَضْرِبَنَّ عُنُقَهُ
تَابَعَهُ الْعَقَدِيُّ وَوَهْبٌ عَنْ شُعْبَةَ وَقَالَ وَكِيعٌ وَالْنَّضْرُ وَأَبُو دَاوُدَ عَنْ شُعْبَةَ عَنْ سَعِيدٍ عَنْ أَبِيهِ عَنْ جَدِّهِ عَنْ النَّبِيِّ صَلَّى اللَّهُ عَلَيْهِ وَسَلَّمَ رَوَاهُ جَرِيرُ بْنُ عَبْدِ الْحَمِيدِ عَنْ الشَّيْبَانِيِّ عَنْ أَبِي بُرْدَةَ"
3999,44,"Telah menceritakan kepadaku [Abbas bin Al Walid, alias An Narsi] Telah menceritakan kepada kami [Abdul Wahid] dari [Ayyub bin 'Aidz] Telah menceritakan kepada kami [Qais bin Muslim] katanya, aku mendengar [Thariq bin Syihab] mengatakan, Telah menceritakan kepadaku [Abu Musa Al Asy'ary] radliallahu 'anhu, katanya, Rasulullah shallallahu 'alaihi wasallam mengutusku ke perkampungan kaumku, selanjutnya aku singgah di Abtah. Rasulullah bertanya: ""Apa telah engkau lakukan haji wahai Abdullah bin Qais (sebutan Abu Musa)?""Ya Rasulullah"" jawabku. Tanya Nabi: ""Dan bagaimana engkau ucapkan niyat ihram-mu? Kata Abu Musa; aku ucapkan; ""LABBAIKA IHLAALAN KA IHLAALIKA."" (Aku penuhi panggilan-Mu, aku berniyat ihram sebagaimana ihrammu (Rasul, maksudnya). Nabi bertanya: ""Apa engkau juga membawa binatang kurban?""Saya belum membawa, "" jawabku. Kata Nabi: ""Kalau begitu, lakukanlah thawaf di Baitullah dan lakukanlah sa'i antara Shafa dan Marwa, kemudian lakukanlah tahallul!"" dan aku pun mengerjakannya hingga seorang wanita bani Qais menyisiriku dan kami terus melakukan yang demikian hingga Umar diangkat menjadi khalifah.","حَدَّثَنِي عَبَّاسُ بْنُ الْوَلِيدِ هُوَ النَّرْسِيُّ حَدَّثَنَا عَبْدُ الْوَاحِدِ عَنْ أَيُّوبَ بْنِ عَائِذٍ حَدَّثَنَا قَيْسُ بْنُ مُسْلِمٍ قَالَ سَمِعْتُ طَارِقَ بْنَ شِهَابٍ يَقُولُ حَدَّثَنِي أَبُو مُوسَى الْأَشْعَرِيُّ رَضِيَ اللَّهُ عَنْهُ قَالَ
بَعَثَنِي رَسُولُ اللَّهِ صَلَّى اللَّهُ عَلَيْهِ وَسَلَّمَ إِلَى أَرْضِ قَوْمِي فَجِئْتُ وَرَسُولُ اللَّهِ صَلَّى اللَّهُ عَلَيْهِ وَسَلَّمَ مُنِيخٌ بِالْأَبْطَحِ فَقَالَ أَحَجَجْتَ يَا عَبْدَ اللَّهِ بْنَ قَيْسٍ قُلْتُ نَعَمْ يَا رَسُولَ اللَّهِ قَالَ كَيْفَ قُلْتَ قَالَ قُلْتُ لَبَّيْكَ إِهْلَالًا كَإِهْلَالِكَ قَالَ فَهَلْ سُقْتَ مَعَكَ هَدْيًا قُلْتُ لَمْ أَسُقْ قَالَ فَطُفْ بِالْبَيْتِ وَاسْعَ بَيْنَ الصَّفَا وَالْمَرْوَةِ ثُمَّ حِلَّ فَفَعَلْتُ حَتَّى مَشَطَتْ لِي امْرَأَةٌ مِنْ نِسَاءِ بَنِي قَيْسٍ وَمَكُثْنَا بِذَلِكَ حَتَّى اسْتُخْلِفَ عُمَرُ"
4000,44,"Telah menceritakan kepadaku [Hibban] Telah mengabarkan kepada kami [Abdullah] dari [Zakaria bin Ishaq] dari [Yahya bin Abdullah bin Shaifi] dari [Abu Ma'bad] -mantan budak [Ibnu Abbas] dia berkata; Rasulullah shallallahu 'alaihi wasallam bersabda kepada Mu'ad ketika mengutusnya ke Yaman, ""Engkau akan mendatangi kaum ahli kitab, Apabilah telah sampai kepada mereka maka serulah mereka untuk bersaksi bahwa tidak Tuhan yang berhak untuk disembah selain Allah dan Muhammad adalah utusan-Nya. Jika mereka ta'at untuk itu, maka beritahukanlah bahwa Allah telah mewajibkan kepada mereka shalat lima waktu sehari semalam. Jika mereka ta'at untuk itu, maka beritahukanlah bahwa Allah telah mewajibkan kepada mereka untuk mengeluarkan zakat harta mereka, di ambil dari orang-orang kaya mereka dan diberikan kepada orang-orang yang miskin dari mereka. Jika mereka taat untuk itu, maka hati-hatilah engkau dari mengambil harta milik mereka yang paling baik, takutlah engkau dengan do`anya orang dizhalimi, sebab antara ia dengan Allah tidak ada yang menghalanginya."" Abu Abdullah berkata; 'Thawwa'at, thaa'at, 'Athaa'at secara bahasa adalah 'Ti'tu, dan Tu'tu, serta 'Atha'tu. (Aku ta'at).","حَدَّثَنِي حِبَّانُ أَخْبَرَنَا عَبْدُ اللَّهِ عَنْ زَكَرِيَّاءَ بْنِ إِسْحَاقَ عَنْ يَحْيَى بْنِ عَبْدِ اللَّهِ بْنِ صَيْفِيٍّ عَنْ أَبِي مَعْبَدٍ مَوْلَى ابْنِ عَبَّاسٍ عَنْ ابْنِ عَبَّاسٍ رَضِيَ اللَّهُ عَنْهُمَا قَالَ
قَالَ رَسُولُ اللَّهِ صَلَّى اللَّهُ عَلَيْهِ وَسَلَّمَ لِمُعَاذِ بْنِ جَبَلٍ حِينَ بَعَثَهُ إِلَى الْيَمَنِ إِنَّكَ سَتَأْتِي قَوْمًا مِنْ أَهْلِ الْكِتَابِ فَإِذَا جِئْتَهُمْ فَادْعُهُمْ إِلَى أَنْ يَشْهَدُوا أَنْ لَا إِلَهَ إِلَّا اللَّهُ وَأَنَّ مُحَمَّدًا رَسُولُ اللَّهِ فَإِنْ هُمْ طَاعُوا لَكَ بِذَلِكَ فَأَخْبِرْهُمْ أَنَّ اللَّهَ قَدْ فَرَضَ عَلَيْهِمْ خَمْسَ صَلَوَاتٍ فِي كُلِّ يَوْمٍ وَلَيْلَةٍ فَإِنْ هُمْ طَاعُوا لَكَ بِذَلِكَ فَأَخْبِرْهُمْ أَنَّ اللَّهَ قَدْ فَرَضَ عَلَيْهِمْ صَدَقَةً تُؤْخَذُ مِنْ أَغْنِيَائِهِمْ فَتُرَدُّ عَلَى فُقَرَائِهِمْ فَإِنْ هُمْ طَاعُوا لَكَ بِذَلِكَ فَإِيَّاكَ وَكَرَائِمَ أَمْوَالِهِمْ وَاتَّقِ دَعْوَةَ الْمَظْلُومِ فَإِنَّهُ لَيْسَ بَيْنَهُ وَبَيْنَ اللَّهِ حِجَابٌ
قَالَ أَبُو عَبْد اللَّهِ طَوَّعَتْ طَاعَتْ وَأَطَاعَتْ لُغَةٌ طِعْتُ وَطُعْتُ وَأَطَعْتُ"
4001,44,"Telah menceritakan kepada kami [Sulaiman bin Harb] Telah menceritakan kepada kami [Syu'bah] dari [Habib bin Abu Tsabit] dari [Sa'id bin Jubair] dari ['Amru bin Maimun] bahwa ketika [Mu'adz] sampai di Yaman, dia shalat shubuh bersama kaumnya dengan membaca ayat: ""Allah telah menjadikan Ibrahim sebagai kekasihnya."" Maka berkatalah salah seorang dari kaumnya; 'Mata ibu Ibrahim telah berbinar karena bahagia.' Sedangkan di dalam riwayat lain, [Mu'adz] menambahkan dari [Syu'bah] dari [Habib] dari [Sa'id] dari [Amru] bahwa Nabi shallallahu 'alaihi wasallam mengutus [Mu'adz bin Jabal] ke Yaman. Lalu pada waktu shalat shubuh Mu'adz bin Jabal membaca surat An Nisa, tatkala sampai ayat; Allah telah menjadikan Ibrahim sebagai kekasih-Nya."" Seseorang di belakangnya berkata; 'Mata Ibu Ibrahim telah berbinar karena bahagia.'","حَدَّثَنَا سُلَيْمَانُ بْنُ حَرْبٍ حَدَّثَنَا شُعْبَةُ عَنْ حَبِيبِ بْنِ أَبِي ثَابِتٍ عَنْ سَعِيدِ بْنِ جُبَيْرٍ عَنْ عَمْرِو بْنِ مَيْمُونٍ أَنَّ مُعَاذًا رَضِيَ اللَّهُ عَنْهُ
لَمَّا قَدِمَ الْيَمَنَ صَلَّى بِهِمْ الصُّبْحَ فَقَرَأَ
{ وَاتَّخَذَ اللَّهُ إِبْرَاهِيمَ خَلِيلًا }
فَقَالَ رَجُلٌ مِنْ الْقَوْمِ لَقَدْ قَرَّتْ عَيْنُ أُمِّ إِبْرَاهِيمَ
زَادَ مُعَاذٌ عَنْ شُعْبَةَ عَنْ حَبِيبٍ عَنْ سَعِيدٍ عَنْ عَمْرٍو أَنَّ النَّبِيَّ صَلَّى اللَّهُ عَلَيْهِ وَسَلَّمَ بَعَثَ مُعَاذًا إِلَى الْيَمَنِ فَقَرَأَ مُعَاذٌ فِي صَلَاةِ الصُّبْحِ سُورَةَ النِّسَاءِ فَلَمَّا قَالَ
{ وَاتَّخَذَ اللَّهُ إِبْرَاهِيمَ خَلِيلًا }
قَالَ رَجُلٌ خَلْفَهُ قَرَّتْ عَيْنُ أُمِّ إِبْرَاهِيمَ"
4002,44,"Telah menceritakan kepadaku [Ahmad bin 'Utsman] Telah menceritakan kepada kami [Syuraih bin Maslamah] Telah menceritakan kepada kami [Ibrahim bin Yusuf bin Ishaq bin Abu Ishaq] Telah menceritakan kepadaku [Bapakku] dari [Abu Ishaq] Aku mendengar [Al Bara'] berkata; Rasulullah shallallahu 'alaihi wasallam mengutus kami bersama Khalid bin Walid ke Yaman, Al Bara berkata; kemudian Nabi shallallahu 'alaihi wasallam mengutus Ali untuk mengganti kepemimpinanya. Beliau berkata kepada Ali; 'Suruhlah tentara Khalid untuk ikut bersama kamu ke Yaman, bagi siapa saja yang mau, dan siapa yang ingin pulang, silahkan!.' Dan aku termasuk orang yang ikut bersama Ali. Al Bara berkata; 'lalu aku mendapatkan ghanimah yang begitu banyak.'","حَدَّثَنِي أَحْمَدُ بْنُ عُثْمَانَ حَدَّثَنَا شُرَيْحُ بْنُ مَسْلَمَةَ حَدَّثَنَا إِبْرَاهِيمُ بْنُ يُوسُفَ بْنِ إِسْحَاقَ بْنِ أَبِي إِسْحَاقَ حَدَّثَنِي أَبِي عَنْ أَبِي إِسْحَاقَ سَمِعْتُ الْبَرَاءَ رَضِيَ اللَّهُ عَنْهُ
بَعَثَنَا رَسُولُ اللَّهِ صَلَّى اللَّهُ عَلَيْهِ وَسَلَّمَ مَعَ خَالِدِ بْنِ الْوَلِيدِ إِلَى الْيَمَنِ قَالَ ثُمَّ بَعَثَ عَلِيًّا بَعْدَ ذَلِكَ مَكَانَهُ فَقَالَ مُرْ أَصْحَابَ خَالِدٍ مَنْ شَاءَ مِنْهُمْ أَنْ يُعَقِّبَ مَعَكَ فَلْيُعَقِّبْ وَمَنْ شَاءَ فَلْيُقْبِلْ فَكُنْتُ فِيمَنْ عَقَّبَ مَعَهُ قَالَ فَغَنِمْتُ أَوَاقٍ ذَوَاتِ عَدَدٍ"
4003,44,"Telah menceritakan kepadaku [Muhammad bin Basysyar] Telah menceritakan kepada kami [Rauh bin 'Ubadah] Telah menceritakan kepada kami ['Ali bin Suaid bin Manjuf] dari ['Abdullah bin Buraidah] dari [Bapaknya] dia berkata; Rasulullah Shallallahu'alaihiwasallam mengutus 'Ali untuk menemui Khalid bin Al Walid agar mengambil seperlima harta rampasan perang. Aku adalah orang yang membenci Ali yang pada waktu itu dia sudah mandi. Lalu aku berkata kepada Khalid; 'Apa kau tidak melihat apa yang dilakukannya? Tatkala aku menemui Rasulullah Shallallahu'alaihiwasallam aku sampaikan kepada beliau perihal Ali maka beliau bersabda: ""Wahai Buraidah! Apakah kau membenci 'Ali?"" aku Buraidah menjawab: 'Ya.' Rasulullah Shallallahu'alaihiwasallam bersabda: ""Jangan membencinya karena ia berhak mendapatkan yang lebih dari itu dari harta rampasan perang.""","حَدَّثَنِي مُحَمَّدُ بْنُ بَشَّارٍ حَدَّثَنَا رَوْحُ بْنُ عُبَادَةَ حَدَّثَنَا عَلِيُّ بْنُ سُوَيْدِ بْنِ مَنْجُوفٍ عَنْ عَبْدِ اللَّهِ بْنِ بُرَيْدَةَ عَنْ أَبِيهِ رَضِيَ اللَّهُ عَنْهُ قَالَ
بَعَثَ النَّبِيُّ صَلَّى اللَّهُ عَلَيْهِ وَسَلَّمَ عَلِيًّا إِلَى خَالِدٍ لِيَقْبِضَ الْخُمُسَ وَكُنْتُ أُبْغِضُ عَلِيًّا وَقَدْ اغْتَسَلَ فَقُلْتُ لِخَالِدٍ أَلَا تَرَى إِلَى هَذَا فَلَمَّا قَدِمْنَا عَلَى النَّبِيِّ صَلَّى اللَّهُ عَلَيْهِ وَسَلَّمَ ذَكَرْتُ ذَلِكَ لَهُ فَقَالَ يَا بُرَيْدَةُ أَتُبْغِضُ عَلِيًّا فَقُلْتُ نَعَمْ قَالَ لَا تُبْغِضْهُ فَإِنَّ لَهُ فِي الْخُمُسِ أَكْثَرَ مِنْ ذَلِكَ"
4004,44,"Telah menceritakan kepada kami [Qutaibah] Telah menceritakan kepada kami ['Abdul Wahid] dari ['Umarah bin Al Qa'qa' bin Syubrumah]; Telah menceritakan kepada kami ['Abdur Rahman bin Abu Nu'am] dia berkata; Aku mendengar [Abu Sa'id Al Khudri] berkata; Ali bin Abu Thalib mengirimkan sebatang emas yang belum diangkat dari cetakannya kepada Rasulullah shallallahu 'alaihi wasallam. Rasulullah shallallahu 'alaihi wasallam membagikannya kepada empat orang: 'Uyainah bin Badr, Aqra bin Habis, Zaid Al Khail, dan yang keempat adalah Alqamah atau 'Amir bin Thufail. Melihat hal itu, salah seorang sahabatnya berkata; ""Kami lebih berhak atas emas tersebut daripada orang-orang ini."" Ketika kabar itu didengar Rasulullah shallallahu 'alaihi wasallam, Rasulullah shallallahu 'alaihi wasallam bersabda: 'Tidakkah kalian mempercayaiku padahal aku adalah orang yang terpercaya dari langit (surga)? Aku menerima kabar dari langit, pagi hari maupun sore hari.' Tiba-tiba seorang laki-laki dengan mata cekung, tulang pipi cembung, dahi menonjol, berjanggut tipis, berkepala gundul dan menggunakan ikat pinggang berdiri dan berkata; 'Ya Rasulullah! Takutlah kepada Allah.' Nabi shallallahu 'alaihi wasallam bersabda: 'Celaka kamu.' Bukankah di muka bumi ini akulah yang paling takut kepada Allah? ' Orang itu beranjak dari tempat duduknya. Khalid bin Walid berkata; 'Ya Rasulullah! Izinkan aku menebasnya. Nabi shallallahu 'alaihi wasallam bersabda: Jangan, bisa jadi ia mengerjakan shalat. Khalid berkata; Berapa banyak orang yang shalat berkata dengan lisannya yang tidak sesuai dengan hatinya. Rasulullah shallallahu 'alaihi wasallam bersabda: Aku tidak diperintah untuk menyelidiki hati seseorang atau mengetahui isi perutnya. Kemudian Nabi shallallahu 'alaihi wasallam melihat kepada orang itu ketika hendak pergi: sesungguhnya dari keturunannya akan muncul suatu kaum yang membaca Kitabullah tetapi hanya sampai tenggorokannya saja. Mereka lepas dari agama sebagaimana lepasnya anak panah dari busurnya. Aku kira Nabi shallallahu 'alaihi wasallam juga berkata; ""Seandainya aku hadir pada masa itu aku akan membunuh mereka sebagaimana bangsa Tsamud dibinasakan.""","حَدَّثَنَا قُتَيْبَةُ حَدَّثَنَا عَبْدُ الْوَاحِدِ عَنْ عُمَارَةَ بْنِ الْقَعْقَاعِ بْنِ شُبْرُمَةَ حَدَّثَنَا عَبْدُ الرَّحْمَنِ بْنُ أَبِي نُعْمٍ قَالَ سَمِعْتُ أَبَا سَعِيدٍ الْخُدْرِيَّ يَقُولُ
بَعَثَ عَلِيُّ بْنُ أَبِي طَالِبٍ رَضِيَ اللَّهُ عَنْهُ إِلَى رَسُولِ اللَّهِ صَلَّى اللَّهُ عَلَيْهِ وَسَلَّمَ مِنْ الْيَمَنِ بِذُهَيْبَةٍ فِي أَدِيمٍ مَقْرُوظٍ لَمْ تُحَصَّلْ مِنْ تُرَابِهَا قَالَ فَقَسَمَهَا بَيْنَ أَرْبَعَةِ نَفَرٍ بَيْنَ عُيَيْنَةَ بْنِ بَدْرٍ وَأَقْرَعَ بْنِ حابِسٍ وَزَيْدِ الْخَيْلِ وَالرَّابِعُ إِمَّا عَلْقَمَةُ وَإِمَّا عَامِرُ بْنُ الطُّفَيْلِ فَقَالَ رَجُلٌ مِنْ أَصْحَابِهِ كُنَّا نَحْنُ أَحَقَّ بِهَذَا مِنْ هَؤُلَاءِ قَالَ فَبَلَغَ ذَلِكَ النَّبِيَّ صَلَّى اللَّهُ عَلَيْهِ وَسَلَّمَ فَقَالَ أَلَا تَأْمَنُونِي وَأَنَا أَمِينُ مَنْ فِي السَّمَاءِ يَأْتِينِي خَبَرُ السَّمَاءِ صَبَاحًا وَمَسَاءً قَالَ فَقَامَ رَجُلٌ غَائِرُ الْعَيْنَيْنِ مُشْرِفُ الْوَجْنَتَيْنِ نَاشِزُ الْجَبْهَةِ كَثُّ اللِّحْيَةِ مَحْلُوقُ الرَّأْسِ مُشَمَّرُ الْإِزَارِ فَقَالَ يَا رَسُولَ اللَّهِ اتَّقِ اللَّهَ قَالَ وَيْلَكَ أَوَلَسْتُ أَحَقَّ أَهْلِ الْأَرْضِ أَنْ يَتَّقِيَ اللَّهَ قَالَ ثُمَّ وَلَّى الرَّجُلُ قَالَ خَالِدُ بْنُ الْوَلِيدِ يَا رَسُولَ اللَّهِ أَلَا أَضْرِبُ عُنُقَهُ قَالَ لَا لَعَلَّهُ أَنْ يَكُونَ يُصَلِّي فَقَالَ خَالِدٌ وَكَمْ مِنْ مُصَلٍّ يَقُولُ بِلِسَانِهِ مَا لَيْسَ فِي قَلْبِهِ قَالَ رَسُولُ اللَّهِ صَلَّى اللَّهُ عَلَيْهِ وَسَلَّمَ إِنِّي لَمْ أُومَرْ أَنْ أَنْقُبَ عَنْ قُلُوبِ النَّاسِ وَلَا أَشُقَّ بُطُونَهُمْ قَالَ ثُمَّ نَظَرَ إِلَيْهِ وَهُوَ مُقَفٍّ فَقَالَ إِنَّهُ يَخْرُجُ مِنْ ضِئْضِئِ هَذَا قَوْمٌ يَتْلُونَ كِتَابَ اللَّهِ رَطْبًا لَا يُجَاوِزُ حَنَاجِرَهُمْ يَمْرُقُونَ مِنْ الدِّينِ كَمَا يَمْرُقُ السَّهْمُ مِنْ الرَّمِيَّةِ وَأَظُنُّهُ قَالَ لَئِنْ أَدْرَكْتُهُمْ لَأَقْتُلَنَّهُمْ قَتْلَ ثَمُودَ"
4005,44,"Telah menceritakan kepada kami [Al Makki bin Ibrahim] dari [Ibnu Juraij], ['Atha] berkata; [Jabir] berkata; Nabi shallallahu 'alaihi wasallam menyuruh 'Ali untuk melakukan ihram. [Muhammad bin Bakr] menambahkan dari [Ibnu Juraij], [Atha] berkata; [Jabir] berkata; kemudian Ali datang dari Yaman, maka Nabi shallallahu 'alaihi wasallam bertanya kepadanya; 'Wahai Ali dengan apa kamu bertalbiyah? Dia menjawab; saya bertalbiyah dengan talbiyah Rasulullah shallallahu 'alaihi wasallam. Beliau bersabda: 'Menyembelihlah dan tetaplah tinggal di Haram. Jabir berkata; lalu Ali menyembelih hewan kurban.'","حَدَّثَنَا الْمَكِّيُّ بْنُ إِبْرَاهِيمَ عَنْ ابْنِ جُرَيْجٍ قَالَ عَطَاءٌ قَالَ جَابِرٌ أَمَرَ النَّبِيُّ صَلَّى اللَّهُ عَلَيْهِ وَسَلَّمَ عَلِيًّا أَنْ يُقِيمَ عَلَى إِحْرَامِهِ زَادَ مُحَمَّدُ بْنُ بَكْرٍ عَنْ ابْنِ جُرَيْجٍ قَالَ عَطَاءٌ قَالَ جَابِرٌ
فَقَدِمَ عَلِيُّ بْنُ أَبِي طَالِبٍ رَضِيَ اللَّهُ عَنْهُ بِسِعَايَتِهِ قَالَ لَهُ النَّبِيُّ صَلَّى اللَّهُ عَلَيْهِ وَسَلَّمَ بِمَ أَهْلَلْتَ يَا عَلِيُّ قَالَ بِمَا أَهَلَّ بِهِ النَّبِيُّ صَلَّى اللَّهُ عَلَيْهِ وَسَلَّمَ قَالَ فَأَهْدِ وَامْكُثْ حَرَامًا كَمَا أَنْتَ قَالَ وَأَهْدَى لَهُ عَلِيٌّ هَدْيًا"
