haditsId,kitabId,indo,arab
6146,63,"Telah menceritakan kepadaku [Ibrahim bin Musa] telah memberitakan kepada kami [Hisyam yaitu bin Yusuf] dari [Ma'mar] dari [Hammam] dari [Abu Hurairah] menuturkan; Abul qasim Shallallahu'alaihi wa sallam bersabda: ""Demi Dzat yang jiwa Muhammad berada di Tangan-Nya, kalaulah kalian tahu yang kutahu, sungguh kalian banyak menangis dan sedikit tertawa.""","حَدَّثَنِي إِبْرَاهِيمُ بْنُ مُوسَى أَخْبَرَنَا هِشَامٌ هُوَ ابْنُ يُوسُفَ عَنْ مَعْمَرٍ عَنْ هَمَّامٍ عَنْ أَبِي هُرَيْرَةَ قَالَ
قَالَ أَبُو الْقَاسِمِ صَلَّى اللَّهُ عَلَيْهِ وَسَلَّمَ وَالَّذِي نَفْسُ مُحَمَّدٍ بِيَدِهِ لَوْ تَعْلَمُونَ مَا أَعْلَمُ لَبَكَيْتُمْ كَثِيرًا وَلَضَحِكْتُمْ قَلِيلًا"
6147,63,"Telah menceritakan kepada kami [Umar bin Hafsh] telah menceritakan kepada kami [ayahku] telah menceritakan kepada kami [Al A'masy] dari [Ma'rur] dari [Abu dzar] mengatakan, aku menemuinya saat ia dalam lindungan Ka'bah seraya mengatakan; 'Mereka adalah orang yang paling rugi, demi rabb ka'bah, mereka adalah orang yang paling rugi, demi rabb ka'bah.' Aku berkata dalam hati; 'Apa salahku, apakah ia melihat sesuatu beres padaku? apa salahku? ' lantas aku duduk kepadanya dan dia mengatakan; 'saya tak bisa diam! Lalu ia menutupiku sekehendak Allah. Maka aku berkata; 'Siapa mereka yang merugi? Demi menebusmu ayah dan ibuku sebagai tebusannya, ya Rasulullah? ' beliau menjawab; ""yaitu mereka yang berbanyak-banyakan menumpuk kekayaan, kecuali yang mengatakan; yang seperti ini dan seperti ini dan seperti ini.""","حَدَّثَنَا عُمَرُ بْنُ حَفْصٍ حَدَّثَنَا أَبِي حَدَّثَنَا الْأَعْمَشُ عَنْ الْمَعْرُورِ عَنْ أَبِي ذَرٍّ قَالَ
انْتَهَيْتُ إِلَيْهِ وَهُوَ فِي ظِلِّ الْكَعْبَةِ يَقُولُ هُمْ الْأَخْسَرُونَ وَرَبِّ الْكَعْبَةِ هُمْ الْأَخْسَرُونَ وَرَبِّ الْكَعْبَةِ قُلْتُ مَا شَأْنِي أَيُرَى فِيَّ شَيْءٌ مَا شَأْنِي فَجَلَسْتُ إِلَيْهِ وَهُوَ يَقُولُ فَمَا اسْتَطَعْتُ أَنْ أَسْكُتَ وَتَغَشَّانِي مَا شَاءَ اللَّهُ فَقُلْتُ مَنْ هُمْ بِأَبِي أَنْتَ وَأُمِّي يَا رَسُولَ اللَّهِ قَالَ الْأَكْثَرُونَ أَمْوَالًا إِلَّا مَنْ قَالَ هَكَذَا وَهَكَذَا وَهَكَذَا"
6148,63,"Telah menceritakan kepada kami [Abul yaman] telah memberitakan kepada kami [Syu'aib] telah menceritakan kepada kami [Abu Az Zanad] dari [Abdurrahman Al A'raj] dari [Abu Hurairah], Rasulullah Shallallahu'alaihi wa sallam bersabda: ""Sulaiman bin dawud pernah mengatakan; 'Sungguh malam ini aku akan menggilir Sembilan puluh Sembilan isteriku, yang kesemuanya akan melahirkan laki-laki penunggang kuda yang berjihad fi sabilillah.' Salah satu kawannya berujar; 'ucapkan insyaa-allah.' Namun Sulaiman tidak juga mengucapkannya. Akhirnya Sulaiman menggilir mereka semua namun tak satupun pun hamil selain satu isterinya yang melahirkan setengah manusia, demi Dzat yang jiwaku berada di Tangan-Nya, kalaulah ia mengucapkan insyaa-allah, niscaya kesemuanya menjadi prajurit yang berjihad fii sabilillah.""","حَدَّثَنَا أَبُو الْيَمَانِ أَخْبَرَنَا شُعَيْبٌ حَدَّثَنَا أَبُو الزِّنَادِ عَنْ عَبْدِ الرَّحْمَنِ الْأَعْرَجِ عَنْ أَبِي هُرَيْرَةَ
قَالَ رَسُولُ اللَّهِ صَلَّى اللَّهُ عَلَيْهِ وَسَلَّمَ قَالَ سُلَيْمَانُ لَأَطُوفَنَّ اللَّيْلَةَ عَلَى تِسْعِينَ امْرَأَةً كُلُّهُنَّ تَأْتِي بِفَارِسٍ يُجَاهِدُ فِي سَبِيلِ اللَّهِ فَقَالَ لَهُ صَاحِبُهُ قُلْ إِنْ شَاءَ اللَّهُ فَلَمْ يَقُلْ إِنْ شَاءَ اللَّهُ فَطَافَ عَلَيْهِنَّ جَمِيعًا فَلَمْ يَحْمِلْ مِنْهُنَّ إِلَّا امْرَأَةٌ وَاحِدَةٌ جَاءَتْ بِشِقِّ رَجُلٍ وَايْمُ الَّذِي نَفْسُ مُحَمَّدٍ بِيَدِهِ لَوْ قَالَ إِنْ شَاءَ اللَّهُ لَجَاهَدُوا فِي سَبِيلِ اللَّهِ فُرْسَانًا أَجْمَعُونَ"
6149,63,"Telah menceritakan kepada kami [Muhammad] telah menceritakan kepada kami [Abul Ahwash] dari [Abu Ishaq] dari [Al Barra` bin 'Azib] menuturkan; Nabi shallallahu 'alaihi wasallam diberi hadiah pakaian sutera, orang-orang pun secara bergantian memegangnya, mereka terkagum-kagum dengan keindahan dan kelembutannya, kontan Rasulullah Shallallahu'alaihiwasallam pun bertanya: ""apakah kalian merasa terkagum-kagum terhadapnya?"" 'betul ya Rasulullah' Jawab mereka. Nabi bersabda: ""Demi dzat yang jiwaku berada ditangan-Nya, sungguh sapu tangan Sa'd di surga lebih baik daripadanya."" Sedang [Syu'bah], [Israil] dari [Abu Ishaq] tidak mengatakan dengan redaksi; 'Demi dzat yang jiwaku berada di tangan-Nya.'","حَدَّثَنَا مُحَمَّدٌ حَدَّثَنَا أَبُو الْأَحْوَصِ عَنْ أَبِي إِسْحَاقَ عَنْ الْبَرَاءِ بْنِ عَازِبٍ قَالَ
أُهْدِيَ إِلَى النَّبِيِّ صَلَّى اللَّهُ عَلَيْهِ وَسَلَّمَ سَرَقَةٌ مِنْ حَرِيرٍ فَجَعَلَ النَّاسُ يَتَدَاوَلُونَهَا بَيْنَهُمْ وَيَعْجَبُونَ مِنْ حُسْنِهَا وَلِينِهَا فَقَالَ رَسُولُ اللَّهِ صَلَّى اللَّهُ عَلَيْهِ وَسَلَّمَ أَتَعْجَبُونَ مِنْهَا قَالُوا نَعَمْ يَا رَسُولَ اللَّهِ قَالَ وَالَّذِي نَفْسِي بِيَدِهِ لَمَنَادِيلُ سَعْدٍ فِي الْجَنَّةِ خَيْرٌ مِنْهَا
لَمْ يَقُلْ شُعْبَةُ وَإِسْرَائِيلُ عَنْ أَبِي إِسْحَاقَ وَالَّذِي نَفْسِي بِيَدِهِ"
6150,63,"Telah menceritakan kepada kami [Yahya bin Bukair] telah menceritakan kepada kami [Al Laits] dari [Yunus] dari [Ibnu Syihab] telah menceritakan kepadaku ['Urwah bin Zubair] bahwasanya ['Aisyah] radliyallahu'anhuma berkata; Hindun binti 'Utbah bin Rabi'ah mengatakan; 'Ya Rasulullah, dahulu tak ada penghuni rumah di muka bumi yang lebih aku sukai utuk dihinakan daripada penghuni rumah-rumahmu -Yahya ragu apakah dengan bentuk jamak atau tunggal- Namun hari ini tak ada satu pun penghuni rumah yang lebih aku sukai untuk dimuliakan, daripada penghuni rumahmu.' Rasulullah Shallallahu'alaihiwasallam menjawab: ""demi Dzat yang jiwa Muhammad berada di tangan-Nya, (mungkin kamu punya masalah yang lain)?"" Hindun meneruskan; 'ya Rasulullah, Abu Sufyan adalah suami yang kikir, apakah aku berdosa jika memberi makan (anak-anakku) dari hartanya (tanpa sepengetahuannya)? ' Nabi menjawab; ""Tidak berdosa, asalkan ma'ruf (sewajarnya).""","حَدَّثَنَا يَحْيَى بْنُ بُكَيْرٍ حَدَّثَنَا اللَّيْثُ عَنْ يُونُسَ عَنْ ابْنِ شِهَابٍ حَدَّثَنِي عُرْوَةُ بْنُ الزُّبَيْرِ أَنَّ عَائِشَةَ رَضِيَ اللَّهُ عَنْهَا قَالَتْ
إِنَّ هِنْدَ بِنْتَ عُتْبَةَ بْنِ رَبِيعَةَ قَالَتْ يَا رَسُولَ اللَّهِ مَا كَانَ مِمَّا عَلَى ظَهْرِ الْأَرْضِ أَهْلُ أَخْبَاءٍ أَوْ خِبَاءٍ أَحَبَّ إِلَيَّ أَنْ يَذِلُّوا مِنْ أَهْلِ أَخْبَائِكَ أَوْ خِبَائِكَ شَكَّ يَحْيَى ثُمَّ مَا أَصْبَحَ الْيَوْمَ أَهْلُ أَخْبَاءٍ أَوْ خِبَاءٍ أَحَبَّ إِلَيَّ مِنْ أَنْ يَعِزُّوا مِنْ أَهْلِ أَخْبَائِكَ أَوْ خِبَائِكَ قَالَ رَسُولُ اللَّهِ صَلَّى اللَّهُ عَلَيْهِ وَسَلَّمَ وَأَيْضًا وَالَّذِي نَفْسُ مُحَمَّدٍ بِيَدِهِ قَالَتْ يَا رَسُولَ اللَّهِ إِنَّ أَبَا سُفْيَانَ رَجُلٌ مِسِّيكٌ فَهَلْ عَلَيَّ حَرَجٌ أَنْ أُطْعِمَ مِنْ الَّذِي لَهُ قَالَ لَا إِلَّا بِالْمَعْرُوفِ"
6151,63,"Telah menceritakan kepadaku [Ahmad bin Utsman] telah menceritakan kepada kami [Syuraih bin Maslamah] telah menceritakan kepada kami [Ibrahim] dari [Ayahnya] dari [Abu Ishaq], aku mendengar ['Amru bin Maimun] mengatakan; telah menceritakan kepadaku [Abdullah bin Mas'ud] radliyallahu'anhu, menuturkan; ketika Rasulullah Shallallahu'alaihi wa sallam membungkukkan punggungnya di sebuah kubah yang terbuat dari tanah liat Yaman, beliau berujar kepada sahabat-sahabatnya: ""relakah kalian menjadi seperempat penghuni surga?"" 'ya' Jawab mereka. Lanjut Nabi; ""relakah kalian menjadi sepertiga penghuni surga?"" 'ya' Jawab mereka. Lanjut Nabi: ""Demi Dzat yang jiwaku berada di tangan-Nya, sungguh aku berharap agar kalian menjadi separoh penghuni surga.""","حَدَّثَنِي أَحْمَدُ بْنُ عُثْمَانَ حَدَّثَنَا شُرَيْحُ بْنُ مَسْلَمَةَ حَدَّثَنَا إِبْرَاهِيمُ عَنْ أَبِيهِ عَنْ أَبِي إِسْحَاقَ سَمِعْتُ عَمْرَو بْنَ مَيْمُونٍ قَالَ حَدَّثَنِي عَبْدُ اللَّهِ بْنُ مَسْعُودٍ رَضِيَ اللَّهُ عَنْهُ قَالَ
بَيْنَمَا رَسُولُ اللَّهِ صَلَّى اللَّهُ عَلَيْهِ وَسَلَّمَ مُضِيفٌ ظَهْرَهُ إِلَى قُبَّةٍ مِنْ أَدَمٍ يَمَانٍ إِذْ قَالَ لِأَصْحَابِهِ أَتَرْضَوْنَ أَنْ تَكُونُوا رُبُعَ أَهْلِ الْجَنَّةِ قَالُوا بَلَى قَالَ أَفَلَمْ تَرْضَوْا أَنْ تَكُونُوا ثُلُثَ أَهْلِ الْجَنَّةِ قَالُوا بَلَى قَالَ فَوَالَّذِي نَفْسُ مُحَمَّدٍ بِيَدِهِ إِنِّي لَأَرْجُو أَنْ تَكُونُوا نِصْفَ أَهْلِ الْجَنَّةِ"
6152,63,"Telah menceritakan kepada kami [Abdullah bin Maslamah] dari [Malik] dari [Abdurrahman bin Abdullah bin Abdurrahman] dari [ayahnya] dari [Abu Sa'id], ada seorang laki-laki membaca QUL HUWALLAHU AHAD, ia membacanya secara berulang-ulang. Pagi harinya, laki-laki tadi menemui Rasulullah Shallallahu'alaihiwasallam dan menceritakan kisahnya, seolah-olah si laki-laki tadi menganggap remeh bacaannya. Kontan Rasulullah Shallallahu'alaihiwasallam bersabda: ""Demi Dzat yang jiwaku berada di tangan-NYA, sungguh bacaan itu menyamai sepertiga al qur`an.""","حَدَّثَنَا عَبْدُ اللَّهِ بْنُ مَسْلَمَةَ عَنْ مَالِكٍ عَنْ عَبْدِ الرَّحْمَنِ بْنِ عَبْدِ اللَّهِ بْنِ عَبْدِ الرَّحْمَنِ عَنْ أَبِيهِ عَنْ أَبِي سَعِيدٍ
أَنَّ رَجُلًا سَمِعَ رَجُلًا يَقْرَأُ قُلْ هُوَ اللَّهُ أَحَدٌ يُرَدِّدُهَا فَلَمَّا أَصْبَحَ جَاءَ إِلَى رَسُولِ اللَّهِ صَلَّى اللَّهُ عَلَيْهِ وَسَلَّمَ فَذَكَرَ ذَلِكَ لَهُ وَكَأَنَّ الرَّجُلَ يَتَقَالُّهَا فَقَالَ رَسُولُ اللَّهِ صَلَّى اللَّهُ عَلَيْهِ وَسَلَّمَ وَالَّذِي نَفْسِي بِيَدِهِ إِنَّهَا لَتَعْدِلُ ثُلُثَ الْقُرْآنِ"
6153,63,"Telah menceritakan kepadaku [Ishaq] telah mengabarkan kepadaku [Habban] telah menceritakan kepada kami [Hammam] telah menceritakan kepada kami [Qatadah] telah menceritakan kepada kami [Anas bin Malik] radliyallahu'anhu, bahwa ia mendengar Nabi shallallahu 'alaihi wasallam bersabda: ""Sempurnakanlah ruku' dan sujud, demi Dzat yang jiwaku berada di tangan-NYA, sungguh aku bisa melihat kalian dari balik punggungku ketika kalian ruku' dan sujud.""","حَدَّثَنِي إِسْحَاقُ أَخْبَرَنَا حَبَّانُ حَدَّثَنَا هَمَّامٌ حَدَّثَنَا قَتَادَةُ حَدَّثَنَا أَنَسُ بْنُ مَالِكٍ رَضِيَ اللَّهُ عَنْهُ أَنَّهُ
سَمِعَ النَّبِيَّ صَلَّى اللَّهُ عَلَيْهِ وَسَلَّمَ يَقُولُ أَتِمُّوا الرُّكُوعَ وَالسُّجُودَ فَوَالَّذِي نَفْسِي بِيَدِهِ إِنِّي لَأَرَاكُمْ مِنْ بَعْدِ ظَهْرِي إِذَا مَا رَكَعْتُمْ وَإِذَا مَا سَجَدْتُمْ"
6154,63,"Telah menceritakan kepada kami [Ishaq] telah menceritakan kepada kami [Wahb bin Jarir] telah mengabarkan kepada kami [Syu'bah] dari [Hisyam bin Zaid] dari [Anas bin Malik], ada seorang wanita Anshar mendatangi Nabi shallallahu 'alaihi wasallam bersama anak-anaknya, lantas Nabi shallallahu 'alaihi wasallam bersabda: ""Demi Dzat yang jiwaku berada di tangan-NYA, sungguh kalian adalah manusia yang paling kucintai, "" Nabi mengulangi ucapannya tiga kali.","حَدَّثَنَا إِسْحَاقُ حَدَّثَنَا وَهْبُ بْنُ جَرِيرٍ أَخْبَرَنَا شُعْبَةُ عَنْ هِشَامِ بْنِ زَيْدٍ عَنْ أَنَسِ بْنِ مَالِكٍ
أَنَّ امْرَأَةً مِنْ الْأَنْصَارِ أَتَتْ النَّبِيَّ صَلَّى اللَّهُ عَلَيْهِ وَسَلَّمَ مَعَهَا أَوْلَادٌ لَهَا فَقَالَ النَّبِيُّ صَلَّى اللَّهُ عَلَيْهِ وَسَلَّمَ وَالَّذِي نَفْسِي بِيَدِهِ إِنَّكُمْ لَأَحَبُّ النَّاسِ إِلَيَّ قَالَهَا ثَلَاثَ مِرَارٍ"
6155,63,"Telah menceritakan kepada kami [Abdullah bin Maslamah] dari [Malik] dari [Nafi'] dari [Abdullah bin Umar] radliyallahu'anhuma, bahwa Rasulullah Shallallahu'alaihiwasallam menjumpai Umar bin Khattab yang sedang berjalan diatas hewan tunggangannya, dan ia bersumpah dengan nama ayahnya. Maka Rasulullah menegur; ""jangan, tahukah kamu bahwa Allah melarang kalian bersumpah dengan nama ayah-ayah kalian? Barangsiapa yang bersumpah, hendaklah bersumpah dengan nama Allah, atau lebih baik diam.""","حَدَّثَنَا عَبْدُ اللَّهِ بْنُ مَسْلَمَةَ عَنْ مَالِكٍ عَنْ نَافِعٍ عَنْ عَبْدِ اللَّهِ بْنِ عُمَرَ رَضِيَ اللَّهُ عَنْهُمَا
أَنَّ رَسُولَ اللَّهِ صَلَّى اللَّهُ عَلَيْهِ وَسَلَّمَ أَدْرَكَ عُمَرَ بْنَ الْخَطَّابِ وَهُوَ يَسِيرُ فِي رَكْبٍ يَحْلِفُ بِأَبِيهِ فَقَالَ أَلَا إِنَّ اللَّهَ يَنْهَاكُمْ أَنْ تَحْلِفُوا بِآبَائِكُمْ مَنْ كَانَ حَالِفًا فَلْيَحْلِفْ بِاللَّهِ أَوْ لِيَصْمُتْ"
6156,63,"Telah menceritakan kepada kami [Sa'id bin Ufair] telah menceritakan kepada kami [Ibnu Wahb] dari [Yunus] dari [Ibnu Syihab] berkata; [Salim] berkata; [Ibnu Umar] menuturkan; [Umar bin Khattab] menuturkan; Rasulullah Shallallahu'alaihiwasallam bersabda kepadaku: ""Allah melarang kalian bersumpah dengan nama bapak-bapak kalian."" Umar berkata; 'maka demi Allah, aku tak lagi bersumpah dengan nama- nama ayahku secara sengaja, semenjak aku mendengar Nabi shallallahu 'alaihi wasallam.' Mujahid berkomentar mengenai makna atsir sebagaimana kutipan ayat ""Aw atsaarotin min 'ilmin' adalah segala tulisan atau catatan ilmu. Hadits ini diperkuat oleh [Uqail], [Azzubaidi], [Ishaq Al Kalbi], dari [Az Zuhri] dan [Ibnu Uyainah], [Ma'mar] mengatakan dari [Az Zuhri] dari [Salim] dari [Ibnu Umar] bahwa Nabi shallallahu 'alaihi wasallam mendengar Umar,,, dan seterusnya.","حَدَّثَنَا سَعِيدُ بْنُ عُفَيْرٍ حَدَّثَنَا ابْنُ وَهْبٍ عَنْ يُونُسَ عَنْ ابْنِ شِهَابٍ قَالَ قَالَ سَالِمٌ قَالَ ابْنُ عُمَرَ سَمِعْتُ عُمَرَ يَقُولُ
قَالَ لِي رَسُولُ اللَّهِ صَلَّى اللَّهُ عَلَيْهِ وَسَلَّمَ إِنَّ اللَّهَ يَنْهَاكُمْ أَنْ تَحْلِفُوا بِآبَائِكُمْ قَالَ عُمَرُ فَوَاللَّهِ مَا حَلَفْتُ بِهَا مُنْذُ سَمِعْتُ النَّبِيَّ صَلَّى اللَّهُ عَلَيْهِ وَسَلَّمَ ذَاكِرًا وَلَا آثِرًا
قَالَ مُجَاهِدٌ
{ أَوْ أَثَارَةٍ مِنْ عِلْمٍ }
يَأْثُرُ عِلْمًا تَابَعَهُ عُقَيْلٌ وَالزُّبَيْدِيُّ وَإِسْحَاقُ الْكَلْبِيُّ عَنْ الزُّهْرِيِّ وَقَالَ ابْنُ عُيَيْنَةَ وَمَعْمَرٌ عَنْ الزُّهْرِيِّ عَنْ سَالِمٍ عَنْ ابْنِ عُمَرَ سَمِعَ النَّبِيُّ صَلَّى اللَّهُ عَلَيْهِ وَسَلَّمَ عُمَرَ"
6157,63,"Telah menceritakan kepada kami [Musa bin Isma'il] telah menceritakan kepada kami [Abdul 'Aziz bin Muslim] telah menceritakan kepada kami ['Abdullah bin Dinar] menuturkan; aku mendengar ['Abdullah bin Umar] radliallahu 'anhuma menuturkan; Rasulullah Shallallahu'alaihi wa sallam bersabda: ""Janganlah kalian bersumpah dengan nama bapak-bapak kalian.""","حَدَّثَنَا مُوسَى بْنُ إِسْمَاعِيلَ حَدَّثَنَا عَبْدُ الْعَزِيزِ بْنُ مُسْلِمٍ حَدَّثَنَا عَبْدُ اللَّهِ بْنُ دِينَارٍ قَالَ سَمِعْتُ عَبْدَ اللَّهِ بْنَ عُمَرَ رَضِيَ اللَّهُ عَنْهُمَا يَقُولُ
قَالَ رَسُولُ اللَّهِ صَلَّى اللَّهُ عَلَيْهِ وَسَلَّمَ لَا تَحْلِفُوا بِآبَائِكُمْ"
6158,63,"Telah menceritakan kepada kami [Qutaibah] telah menceritakan kepada kami [Abdul Wahhab] dari [Ayyub] dari [Abu Qilabah] dan [Al Qasim At Tamimi] dari [Zahdam] menuturkan; antara sekelompok dusun kabilah Jarom dan orang-orang asy'ari terdapat kecintaan dan persaudaraan, ketika itu kami berada pada [Abu Musa Al Asy'ari], kemudian didekatkan santapan kepadanya, yang isinya berupa daging ayam. Ketika itu di dekatnya ada seorang laki-laki dari Bani taimullah Ahmar sepertinya dari kalangan mantan budak. Abu Musa kemudian mengundangnya menyantap makanan. Kata Zahdam, ketika itu saya melihatnya menyantap suatu makanan yang aku menganggapnya jijik, sehingga aku bersumpah untuk tidak menyantapnya. Kontan Abu Musa mengatakan; 'Berdirilah engkau, akan saya ceritakan kepadamu tentang hal itu. Dahulu aku pernah mendatangi Rasulullah Shallallahu'alaihiwasallam bersama sekelompok orang-orang asy'ari meminta beliau agar kami diikutsertakan membawa kami. Nabi menjawab: ""Demi Allah, saya tidak bisa membawa kalian, dan saya juga tak punya kendaraan untuk mengangkut kalian."" Namun selanjutnya Rasulullah Shallallahu'alaihiwasallam mendapatkan rampasan unta dan bertanya kepada kami: ""Mana tadi orang-orang asy'ari?"" Beliau perintahkan agar kami mendapat lima ekor unta yang punggungnya putih. Ketika kami sudah berangkat, kami berkata; 'Apa yang harus kita lakukan terhadap sumpah Rasulullah Shallallahu'alaihiwasallam, beliau bersumpah untuk tidak membawa kita, yang ketika itu memang beliau tak mempunyai kendaraan untuk mengangkut kita, lantas beliau pun mengikutsertakan kita untuk naik kendaraan dan kita pura-pura lupa terhadap sumpah beliau Shallallahu'alaihiwasallam? demi Allah, kalau begini kita tidak akan untung.' Maka kami kembali menemui beliau dan kami utarakan uneg-uneg kami; ' Dahulu kami pernah mendatangi anda agar mengikutsertakan kami naik kendaraan, lantas anda bersumpah tidak akan mengikutsertakan kami yang ketika itu memang anda tak punya kendaraan untuk mengangkut kami! ' Nabi jawaban: ""Bukan sayalah yang mengikusertakan kalian naik kendaraan, namun Allah lah yang menjadikan kalian bisa naik kendaraan. Demi Allah, tidaklah saya melakukan suatu sumpah, lantas saya melihat suatu yang lebih baik, selain kulakukan yang lebih baik, dan kubayar kaffarat sumpahku.""","حَدَّثَنَا قُتَيْبَةُ حَدَّثَنَا عَبْدُ الْوَهَّابِ عَنْ أَيُّوبَ عَنْ أَبِي قِلَابَةَ وَالْقَاسِمِ التَّمِيمِيِّ عَنْ زَهْدَمٍ قَالَ
كَانَ بَيْنَ هَذَا الْحَيِّ مِنْ جَرْمٍ وَبَيْنَ الْأَشْعَرِيِّينَ وُدٌّ وَإِخَاءٌ فَكُنَّا عِنْدَ أَبِي مُوسَى الْأَشْعَرِيِّ فَقُرِّبَ إِلَيْهِ طَعَامٌ فِيهِ لَحْمُ دَجَاجٍ وَعِنْدَهُ رَجُلٌ مِنْ بَنِي تَيْمِ اللَّهِ أَحْمَرُ كَأَنَّهُ مِنْ الْمَوَالِي فَدَعَاهُ إِلَى الطَّعَامِ فَقَالَ إِنِّي رَأَيْتُهُ يَأْكُلُ شَيْئًا فَقَذِرْتُهُ فَحَلَفْتُ أَنْ لَا آكُلَهُ فَقَالَ قُمْ فَلَأُحَدِّثَنَّكَ عَنْ ذَاكَ إِنِّي أَتَيْتُ رَسُولَ اللَّهِ صَلَّى اللَّهُ عَلَيْهِ وَسَلَّمَ فِي نَفَرٍ مِنْ الْأَشْعَرِيِّينَ نَسْتَحْمِلُهُ فَقَالَ وَاللَّهِ لَا أَحْمِلُكُمْ وَمَا عِنْدِي مَا أَحْمِلُكُمْ عَلَيْهِ فَأُتِيَ رَسُولُ اللَّهِ صَلَّى اللَّهُ عَلَيْهِ وَسَلَّمَ بِنَهْبِ إِبِلٍ فَسَأَلَ عَنَّا فَقَالَ أَيْنَ النَّفَرُ الْأَشْعَرِيُّونَ فَأَمَرَ لَنَا بِخَمْسِ ذَوْدٍ غُرِّ الذُّرَى فَلَمَّا انْطَلَقْنَا قُلْنَا مَا صَنَعْنَا حَلَفَ رَسُولُ اللَّهِ صَلَّى اللَّهُ عَلَيْهِ وَسَلَّمَ لَا يَحْمِلُنَا وَمَا عِنْدَهُ مَا يَحْمِلُنَا ثُمَّ حَمَلَنَا تَغَفَّلْنَا رَسُولَ اللَّهِ صَلَّى اللَّهُ عَلَيْهِ وَسَلَّمَ يَمِينَهُ وَاللَّهِ لَا نُفْلِحُ أَبَدًا فَرَجَعْنَا إِلَيْهِ فَقُلْنَا لَهُ إِنَّا أَتَيْنَاكَ لِتَحْمِلَنَا فَحَلَفْتَ أَنْ لَا تَحْمِلَنَا وَمَا عِنْدَكَ مَا تَحْمِلُنَا فَقَالَ إِنِّي لَسْتُ أَنَا حَمَلْتُكُمْ وَلَكِنَّ اللَّهَ حَمَلَكُمْ وَاللَّهِ لَا أَحْلِفُ عَلَى يَمِينٍ فَأَرَى غَيْرَهَا خَيْرًا مِنْهَا إِلَّا أَتَيْتُ الَّذِي هُوَ خَيْرٌ وَتَحَلَّلْتُهَا"
6159,63,"Telah menceritakan kepadaku [Abdullah bin Muhammad] telah menceritakan kepada kami [Hisyam bin Yusuf] telah mengabarkan kepada kami [Ma'mar] dari [Az Zuhri] dari [Humaid bin 'Abdurrahman] dari [Abu Hurairah] radliallahu 'anhu, dari Nabi shallallahu 'alaihi wasallam bersabda: ""Barangsiapa bersumpah dan dalam sumpahnya menyebut nama berhala Latta, atau Uzza, hendaklah ia ucapkan laa-ilaaha-illallah, dan barangsiapa mengatakan kepada kawannya 'Mari kita berjudi', hendaklah ia bersedekah.""","حَدَّثَنِي عَبْدُ اللَّهِ بْنُ مُحَمَّدٍ حَدَّثَنَا هِشَامُ بْنُ يُوسُفَ أَخْبَرَنَا مَعْمَرٌ عَنْ الزُّهْرِيِّ عَنْ حُمَيْدِ بْنِ عَبْدِ الرَّحْمَنِ عَنْ أَبِي هُرَيْرَةَ رَضِيَ اللَّهُ عَنْهُ
عَنْ النَّبِيِّ صَلَّى اللَّهُ عَلَيْهِ وَسَلَّمَ قَالَ مَنْ حَلَفَ فَقَالَ فِي حَلِفِهِ بِاللَّاتِ وَالْعُزَّى فَلْيَقُلْ لَا إِلَهَ إِلَّا اللَّهُ وَمَنْ قَالَ لِصَاحِبِهِ تَعَالَ أُقَامِرْكَ فَلْيَتَصَدَّقْ"
