haditsId,kitabId,indo,arab
6160,63,"Telah menceritakan kepada kami [Qutaibah] telah menceritakan kepada kami [Al Laits] dari [Nafi'] dari [Ibnu 'Umar] radliyallahu'anhuma, bahwasanya Rasulullah Shallallahu'alaihiwasallam membuat cincin dari bahan emas. Cincin itu sering beliau pakai, dan beliau letakkan mata cincinnya di bagian dalam telapak tangannya. Orang-orang pun menirunya dan membuat cincin, kemudian beliau duduk diatas minbar dan mencopot cincinnya seraya mengatakan: ""sesungguhnya aku selalu memakai cincin ini, dan aku meletakkan mata cincinnya di bagian dalam"" kemudian beliau melemparkannya, sambil berkata: ""Demi Allah, saya tidak akan memakainya selama-lamanya."" Kontan para sahabat membuang cincin-cincin mereka.""","حَدَّثَنَا قُتَيْبَةُ حَدَّثَنَا اللَّيْثُ عَنْ نَافِعٍ عَنْ ابْنِ عُمَرَ رَضِيَ اللَّهُ عَنْهُمَا
أَنَّ رَسُولَ اللَّهِ صَلَّى اللَّهُ عَلَيْهِ وَسَلَّمَ اصْطَنَعَ خَاتَمًا مِنْ ذَهَبٍ وَكَانَ يَلْبَسُهُ فَيَجْعَلُ فَصَّهُ فِي بَاطِنِ كَفِّهِ فَصَنَعَ النَّاسُ خَوَاتِيمَ ثُمَّ إِنَّهُ جَلَسَ عَلَى الْمِنْبَرِ فَنَزَعَهُ فَقَالَ إِنِّي كُنْتُ أَلْبَسُ هَذَا الْخَاتِمَ وَأَجْعَلُ فَصَّهُ مِنْ دَاخِلٍ فَرَمَى بِهِ ثُمَّ قَالَ وَاللَّهِ لَا أَلْبَسُهُ أَبَدًا فَنَبَذَ النَّاسُ خَوَاتِيمَهُمْ"
6161,63,"Telah menceritakan kepada kami [Mu'alla bin Asad] telah menceritakan kepada kami [Wuhaib] dari [Ayyub] dari [Abu Qilabah] dari [Tsabit bin Adh Dhahhak] menuturkan; Nabi shallallahu 'alaihi wasallam bersabda: ""Barangsiapa bersumpah dengan agama selain Islam, maka dia seperti yang dikatakannya, dan barangsiapa membunuh dirinya dengan sesuatu, ia disiksa di neraka jahannam dengan sesuatu yang digunakannya untuk bunuh diri, dan melaknat seorang mukmin bagaikan membunuhnya, dan barangsiapa menuduh seorang mukmin dengan kekafiran, maka dia seperti membunuhnya.""","حَدَّثَنَا مُعَلَّى بْنُ أَسَدٍ حَدَّثَنَا وُهَيْبٌ عَنْ أَيُّوبَ عَنْ أَبِي قِلَابَةَ عَنْ ثَابِتِ بْنِ الضَّحَّاكِ قَالَ
قَالَ النَّبِيُّ صَلَّى اللَّهُ عَلَيْهِ وَسَلَّمَ مَنْ حَلَفَ بِغَيْرِ مِلَّةِ الْإِسْلَامِ فَهُوَ كَمَا قَالَ قَالَ وَمَنْ قَتَلَ نَفْسَهُ بِشَيْءٍ عُذِّبَ بِهِ فِي نَارِ جَهَنَّمَ وَلَعْنُ الْمُؤْمِنِ كَقَتْلِهِ وَمَنْ رَمَى مُؤْمِنًا بِكُفْرٍ فَهُوَ كَقَتْلِهِ"
6162,63,"Telah menceritakan kepada kami [Qabishah] telah menceritakan kepada kami [Sufyan] dari [Asy'ats] dari [Mu'awiyah bin Suwaid bin Muqarrin] dari [Al Barra`] dari Nabi shallallahu 'alaihi wasallam -lewat jalur periwayatan lain- dan telah menceritakan kepadaku [Muhammad bin Basyar] telah menceritakan kepada kami [Ghundar] telah menceritakan kepada kami [Syu'bah] dari [Asy'ats] dari [Mu'awiyah bin Suwaid bin Muqarrin] dari [Al Barra`] radliyallahu'anhu mengatakan, Nabi shallallahu 'alaihi wasallam memerintahkan kami untuk menunaikan sumpah.","حَدَّثَنَا قَبِيصَةُ حَدَّثَنَا سُفْيَانُ عَنْ أَشْعَثَ عَنْ مُعَاوِيَةَ بْنِ سُوَيْدِ بْنِ مُقَرِّنٍ عَنْ الْبَرَاءِ عَنْ النَّبِيِّ صَلَّى اللَّهُ عَلَيْهِ وَسَلَّمَ ح و حَدَّثَنِي مُحَمَّدُ بْنُ بَشَّارٍ حَدَّثَنَا غُنْدَرٌ حَدَّثَنَا شُعْبَةُ عَنْ أَشْعَثَ عَنْ مُعَاوِيَةَ بْنِ سُوَيْدِ بْنِ مُقَرِّنٍ عَنْ الْبَرَاءِ رَضِيَ اللَّهُ عَنْهُ قَالَ
أَمَرَنَا النَّبِيُّ صَلَّى اللَّهُ عَلَيْهِ وَسَلَّمَ بِإِبْرَارِ الْمُقْسِمِ"
6163,63,"Telah menceritakan kepada kami [Hafsh bin Umar] telah menceritakan kepada kami [Syu'bah] Telah mengabarkan kepada kami ['Ashim Al Ahwal] aku mendengar [Abu 'Utsman] menceritakan dari [Usamah], bahwa puteri Rasulullah Shallallahu'alaihiwasallam (Zaenab) mengutus utusan untuk menemui Rasulullah, yang ketika itu Rasulullah Shallallahu'alaihiwasallam bersama Usamah bin Zaid, Sa'd, dan Ubai. Sang utusan menyampaikan pesan yang isinya; 'Anak laki-lakiku telah menghadapi saat-saat kematian, maka kunjungilah kami'. Nabi kemudian mengutus seseorang, menyampaikan salam dan mengatakan; ""Milik Allah sematalah segala yang diambil-Nya dan yang diberikan-Nya, dan segala sesuatu disisi-Nya ada ketentuan ajal tersendiri, maka suruhlah dia untuk bersabar dan mengharap pahala."" Lantas puteri Nabi mengutus utusan untuk kedua kalinya, dan puteri beliau menyertakan sumpah. Maka beliau berdiri dan kami pun berdiri bersamanya. Tatkala beliau sampai (dan beliau) telah duduk, anak laki-laki dari puteri beliau (cucunya) diangkat kepada beliau, dan beliau mendudukkan di pangkuannya, ketika itu cucu beliau nafasnya sudah tersengal-sengal. Kedua mata Rasulullah pun bercucuran. Maka Sa'd bertanya: 'Mengapa mata anda sampai bercucuran?"" Nabi menjawab; ""ini adalah tanda kasih sayang yang Allah letakkan di hati hamba-Nya yang dikehendaki-Nya, hanyasanya Allah menyayangi hamba-Nya yang berhati penyayang.""","حَدَّثَنَا حَفْصُ بْنُ عُمَرَ حَدَّثَنَا شُعْبَةُ أَخْبَرَنَا عَاصِمٌ الْأَحْوَلُ سَمِعْتُ أَبَا عُثْمَانَ يُحَدِّثُ عَنْ أُسَامَةَ
أَنَّ بِنْتًا لِرَسُولِ اللَّهِ صَلَّى اللَّهُ عَلَيْهِ وَسَلَّمَ أَرْسَلَتْ إِلَيْهِ وَمَعَ رَسُولِ اللَّهِ صَلَّى اللَّهُ عَلَيْهِ وَسَلَّمَ أُسَامَةُ بْنُ زَيْدٍ وَسَعْدٌ وَأُبَيٌّ أَنَّ ابْنِي قَدْ احْتُضِرَ فَاشْهَدْنَا فَأَرْسَلَ يَقْرَأُ السَّلَامَ وَيَقُولُ إِنَّ لِلَّهِ مَا أَخَذَ وَمَا أَعْطَى وَكُلُّ شَيْءٍ عِنْدَهُ مُسَمًّى فَلْتَصْبِرْ وَتَحْتَسِبْ فَأَرْسَلَتْ إِلَيْهِ تُقْسِمُ عَلَيْهِ فَقَامَ وَقُمْنَا مَعَهُ فَلَمَّا قَعَدَ رُفِعَ إِلَيْهِ فَأَقْعَدَهُ فِي حَجْرِهِ وَنَفْسُ الصَّبِيِّ جُئِّثُ فَفَاضَتْ عَيْنَا رَسُولِ اللَّهِ صَلَّى اللَّهُ عَلَيْهِ وَسَلَّمَ فَقَالَ سَعْدٌ مَا هَذَا يَا رَسُولَ اللَّهِ قَالَ هَذِهِ رَحْمَةٌ يَضَعُهَا اللَّهُ فِي قُلُوبِ مَنْ يَشَاءُ مِنْ عِبَادِهِ وَإِنَّمَا يَرْحَمُ اللَّهُ مِنْ عِبَادِهِ الرُّحَمَاءَ"
6164,63,"Telah menceritakan kepada kami [Isma'il] menuturkan; telah menceritakan kepadaku [Malik] dari [Ibnu Syihab] dari [Ibnul Musayyab] dari [Abu Hurairah], bahwasanya Rasulullah Shallallahu'alaihiwasallam bersabda: ""Seorang muslim yang mendapat kematian ketiga anaknya, tidak akan tersentuh api neraka kecuali sebatas pelaksanaan sumpah Allah."" ","حَدَّثَنَا إِسْمَاعِيلُ قَالَ حَدَّثَنِي مَالِكٌ عَنْ ابْنِ شِهَابٍ عَنْ ابْنِ الْمُسَيَّبِ عَنْ أَبِي هُرَيْرَةَ
أَنَّ رَسُولَ اللَّهِ صَلَّى اللَّهُ عَلَيْهِ وَسَلَّمَ قَالَ لَا يَمُوتُ لِأَحَدٍ مِنْ الْمُسْلِمِينَ ثَلَاثَةٌ مِنْ الْوَلَدِ تَمَسُّهُ النَّارُ إِلَّا تَحِلَّةَ الْقَسَمِ"
6165,63,"Telah menceritakan kepada kami [Muhammad bin Al Mutsanna] telah menceritakan kepadaku [Ghundar] Telah menceritakan kepada kami [Syu'bah] dari [Ma'bad bin Khalid] aku mendengar [Haritsah bin Wahb] mengatakan; Aku mendengar Nabi shallallahu 'alaihi wasallam bersabda: ""maukah kalian kutunjukkan penghuni surga? Yaitu setiap orang lemah dan tertindas, dan sekiranya ia bersumpah atas nama Allah, niscaya Allah mengabulkannya, dan penghuni neraka adalah setiap orang yang berhati keras dan menentang kebenaran lagi sombong.""","حَدَّثَنَا مُحَمَّدُ بْنُ الْمُثَنَّى حَدَّثَنِي غُنْدَرٌ حَدَّثَنَا شُعْبَةُ عَنْ مَعْبَدِ بْنِ خَالِدٍ سَمِعْتُ حَارِثَةَ بْنَ وَهْبٍ قَالَ
سَمِعْتُ النَّبِيَّ صَلَّى اللَّهُ عَلَيْهِ وَسَلَّمَ يَقُولُ أَلَا أَدُلُّكُمْ عَلَى أَهْلِ الْجَنَّةِ كُلُّ ضَعِيفٍ مُتَضَعَّفٍ لَوْ أَقْسَمَ عَلَى اللَّهِ لَأَبَرَّهُ وَأَهْلِ النَّارِ كُلُّ جَوَّاظٍ عُتُلٍّ مُسْتَكْبِرٍ"
6166,63,"Telah menceritakan kepada kami [Sa'd bin Hafsh] telah menceritakan kepada kami [Syaiban] dari [Manshur] dari [Ibrahim] dari ['Abidah] dari ['Abdullah] mengatakan, Pernah Nabi shallallahu 'alaihi wasallam ditanya; ""Siapakah manusia yang terbaik?"" Nabi menjawab: ""yaitu generasiku, kemudian generasi sesudah mereka, kemudian generasi sesudah mereka, kemudian akan datang suatu kaum yang kesaksian mereka mendahului sumpahnya, dan sumpahnya mendahului kesaksian mereka."" Kata Ibrahim; 'dan kawan-kawan kami -ketika itu kami masih kecil-melarang kami bersumpah untuk melaksanakan kesaksian dan janji.'","حَدَّثَنَا سَعْدُ بْنُ حَفْصٍ حَدَّثَنَا شَيْبَانُ عَنْ مَنْصُورٍ عَنْ إِبْرَاهِيمَ عَنْ عَبِيدَةَ عَنْ عَبْدِ اللَّهِ قَالَ
سُئِلَ النَّبِيُّ صَلَّى اللَّهُ عَلَيْهِ وَسَلَّمَ أَيُّ النَّاسِ خَيْرٌ قَالَ قَرْنِي ثُمَّ الَّذِينَ يَلُونَهُمْ ثُمَّ الَّذِينَ يَلُونَهُمْ ثُمَّ يَجِيءُ قَوْمٌ تَسْبِقُ شَهَادَةُ أَحَدِهِمْ يَمِينَهُ وَيَمِينُهُ شَهَادَتَهُ
قَالَ إِبْرَاهِيمُ وَكَانَ أَصْحَابُنَا يَنْهَوْنَا وَنَحْنُ غِلْمَانٌ أَنْ نَحْلِفَ بِالشَّهَادَةِ وَالْعَهْدِ"
6167,63,"Telah menceritakan kepadaku [Muhammad bin Basyar] telah menceritakan kepada kami [Ibnu Abi 'Adi] dari [Syu'bah] dari [Sulaiman] dan [Manshur] dari [Abu Wa`il] dari [Abdullah] radliallahu 'anhu, dari Nabi shallallahu 'alaihi wasallam bersabda: ""Barangsiapa bersumpah dengan sumpah dusta untuk menguasai harta seorang muslim -atau ia katakan dengan redaksi untuk menguasai harta saudaranya-- ia bertemu Allah sedang Allah dalam keadaan murka kepadanya."" Kemudian Allah menurunkan ayat yang membenarkannya; 'Sesungguhnya orang-orang yang menukar janji Allah,,, dst (QS. Ali'Imran 77), [Sulaiman] berkata dalam haditsnya; kemudian Al Asy'ats bin Qais lewat dan berujar; 'Apa yang diceritakan Abdullah kepada kalian? ' Mereka pun menjawabnya dengan suatu jawaban sebagaimana diutarakan Abdullah. Lantas [Asy'ats] menerangkan; 'Sesungguhnya ayat diatas diturunkan tentang saya dan kawan saya karena suatu sumur yang ada diantara kami.'","حَدَّثَنِي مُحَمَّدُ بْنُ بَشَّارٍ حَدَّثَنَا ابْنُ أَبِي عَدِيٍّ عَنْ شُعْبَةَ عَنْ سُلَيْمَانَ وَمَنْصُورٍ عَنْ أَبِي وَائِلٍ عَنْ عَبْدِ اللَّهِ رَضِيَ اللَّهُ عَنْهُ
عَنْ النَّبِيِّ صَلَّى اللَّهُ عَلَيْهِ وَسَلَّمَ قَالَ مَنْ حَلَفَ عَلَى يَمِينٍ كَاذِبَةٍ يَقْتَطِعَ بِهَا مَالَ رَجُلٍ مُسْلِمٍ أَوْ قَالَ أَخِيهِ لَقِيَ اللَّهَ وَهُوَ عَلَيْهِ غَضْبَانُ فَأَنْزَلَ اللَّهُ تَصْدِيقَهُ
{ إِنَّ الَّذِينَ يَشْتَرُونَ بِعَهْدِ اللَّهِ }
قَالَ سُلَيْمَانُ فِي حَدِيثِهِ فَمَرَّ الْأَشْعَثُ بْنُ قَيْسٍ فَقَالَ مَا يُحَدِّثُكُمْ عَبْدُ اللَّهِ قَالُوا لَهُ فَقَالَ الْأَشْعَثُ نَزَلَتْ فِيَّ وَفِي صَاحِبٍ لِي فِي بِئْرٍ كَانَتْ بَيْنَنَا"
6168,63,"Telah menceritakan kepada kami [Adam] telah menceritakan kepada kami [Syaiban] telah menceritakan kepada kami [Qatadah] dari [Anas bin Malik] menuturkan; Nabi shallallahu 'alaihi wasallam bersabda: ""Jahannam tiada henti menuturkan; 'Masihkah ada tambahan? ' (QS. Qaf 30), sampai Allah rabbul 'izzati meletakkan telapak kaki-Nya disana hingga neraka mengatakan; 'Cukup, cukup demi kemuliaan-Mu, ' hingga sebagian penghuni neraka menghimpit sebagian lainnya."" [Syu'bah] meriwayatkannya dari [Qatadah].","حَدَّثَنَا آدَمُ حَدَّثَنَا شَيْبَانُ حَدَّثَنَا قَتَادَةُ عَنْ أَنَسِ بْنِ مَالِكٍ
قَالَ النَّبِيُّ صَلَّى اللَّهُ عَلَيْهِ وَسَلَّمَ لَا تَزَالُ جَهَنَّمُ
{ تَقُولُ هَلْ مِنْ مَزِيدٍ }
حَتَّى يَضَعَ رَبُّ الْعِزَّةِ فِيهَا قَدَمَهُ فَتَقُولُ قَطْ قَطْ وَعِزَّتِكَ وَيُزْوَى بَعْضُهَا إِلَى بَعْضٍ
رَوَاهُ شُعْبَةُ عَنْ قَتَادَةَ"
6169,63,"Telah menceritakan kepada kami [Al Uwaisi] telah menceritakan kepada kami [Ibrahim] dari [Shalih] dari [Ibnu Syihab] -lewat jalur periwayatan lain- telah menceritakan kepada kami [Hajjaj bin Minhal] telah menceritakan kepada kami [Abdullah bin Umar an Numairi] telah menceritakan kepada kami [Yunus] menuturkan; pernah kudengar ['Urwah bin Zubair], [Sa'id bin Musayyab], [Alqomah bin Waqqash] dan [Ubaidullah bin Abdillah] tentang hadits ' [Aisyah], isteri Nabi shallallahu 'alaihi wasallam ketika orang-orang yang menyebarkan berita bohong menuduhnya berzina, maka Allah menyatakan berita kesuciannya -dan masing-masing menceritakan kepadaku sekumpulan hadits- yang isinya; maka Nabi shallallahu 'alaihi wasallam berdiri dan meminta Abdullah bin Ubai menyatakan permohonan maaf. Lantas Usaid bin Khudair berdiri dan mengatakan kepada Sa'd bin Ubadah: 'Demi Allah, kami akan membunuhnya.'","حَدَّثَنَا الْأُوَيْسِيُّ حَدَّثَنَا إِبْرَاهِيمُ عَنْ صَالِحٍ عَنْ ابْنِ شِهَابٍ ح و حَدَّثَنَا حَجَّاجُ بْنُ مِنْهَالٍ حَدَّثَنَا عَبْدُ اللَّهِ بْنُ عُمَرَ النُّمَيْرِيُّ حَدَّثَنَا يُونُسُ قَالَ سَمِعْتُ الزُّهْرِيَّ قَالَ سَمِعْتُ عُرْوَةَ بْنَ الزُّبَيْرِ وَسَعِيدَ بْنَ الْمُسَيَّبِ وَعَلْقَمَةَ بْنَ وَقَّاصٍ وَعُبَيْدَ اللَّهِ بْنَ عَبْدِ اللَّهِ عَنْ حَدِيثِ عَائِشَةَ زَوْجِ النَّبِيِّ صَلَّى اللَّهُ عَلَيْهِ وَسَلَّمَ
حِينَ قَالَ لَهَا أَهْلُ الْإِفْكِ مَا قَالُوا فَبَرَّأَهَا اللَّهُ وَكُلٌّ حَدَّثَنِي طَائِفَةً مِنْ الْحَدِيثِ وَفِيهِ فَقَامَ النَّبِيُّ صَلَّى اللَّهُ عَلَيْهِ وَسَلَّمَ فَاسْتَعْذَرَ مِنْ عَبْدِ اللَّهِ بْنِ أُبَيٍّ فَقَامَ أُسَيْدُ بْنُ حُضَيْرٍ فَقَالَ لِسَعْدِ بْنِ عُبَادَةَ لَعَمْرُ اللَّهِ لَنَقْتُلَنَّهُ"
6170,63,"Telah menceritakan kepadaku [Muhammad bin Al Mutsanna] telah menceritakan kepada kami [Yahya] dari [Hisyam] mengabarkan, telah mengabarkan kepadaku [Ayahku] dari [Aisyah] radliallahu 'anhuma mengenai firman Allah: 'Allah tidak menghukum kalian karena sumpah kalian yang tak disengaja, ' QS.Albaqarah 225, kata 'Aisyah; ayat tersebut diturunkan tentang ucapan orang yang bersumpah; 'Tidak, demi Allah. Baik, demi Allah.'","حَدَّثَنِي مُحَمَّدُ بْنُ الْمُثَنَّى حَدَّثَنَا يَحْيَى عَنْ هِشَامٍ قَالَ أَخْبَرَنِي أَبِي عَنْ عَائِشَةَ رَضِيَ اللَّهُ عَنْهَا
{ لَا يُؤَاخِذُكُمْ اللَّهُ بِاللَّغْوِ فِي أَيْمَانِكُمْ }
قَالَ قَالَتْ أُنْزِلَتْ فِي قَوْلِهِ لَا وَاللَّهِ بَلَى وَاللَّهِ"
6171,63,"Telah menceritakan kepada kami [Khallad bin Yahya] telah menceritakan kepada kami [Mis'ar] telah menceritakan kepada kami [Qatadah] telah menceritakan kepada kami [Zurarah bin Aufa] dari [Abu Hurairah] yang ia marfu'kan, Rasulullah bersabda: ""Allah memaafkan ummatku dari segala yang dibisikkan dan dikatakan hatinya, selama belum dilakukan atau dibicarakan.'","حَدَّثَنَا خَلَّادُ بْنُ يَحْيَى حَدَّثَنَا مِسْعَرٌ حَدَّثَنَا قَتَادَةُ حَدَّثَنَا زُرَارَةُ بْنُ أَوْفَى عَنْ أَبِي هُرَيْرَةَ
يَرْفَعُهُ قَالَ إِنَّ اللَّهَ تَجَاوَزَ لِأُمَّتِي عَمَّا وَسْوَسَتْ أَوْ حَدَّثَتْ بِهِ أَنْفُسَهَا مَا لَمْ تَعْمَلْ بِهِ أَوْ تَكَلَّمْ"
6172,63,"Telah menceritakan kepada kami [Utsman bin Al Haitsam] atau [Muhammad] darinya, dari [Ibnu Juraij] menuturkan; aku mendengar [Ibnu Syihab] menuturkan; telah menceritakan kepadaku [Isa bin Thalhah], bahwasanya [Abdullah bin Amru bin 'Ash] menceritakan kepadanya, bahwa Nabi shallallahu 'alaihi wasallam ketika berkhutbah di hari raya kurban, seorang lak-laki mendatanginya dan berujar; 'Ya Rasulullah, aku kira (melakukan) seperti ini dan seperti ini (dahulu) sebelum melakukan ini dan ini.' Kemudian yang lainnya berdiri dan berkata; 'ya Rasulullah, aku kira seperti ini dan seperti ini.' (menyebutkan) tiga amalan (pada hari mina). Maka Nabi shallallahu 'alaihi wasallam bersabda: ""Lakukanlah, dan tak mengapa untuk melakukan semua amalan (manasik) di hari itu.' Tidaklah beliau ditanya tentang sesuatu ketika itu, melainkan beliau menjawab: ""lakukanlah, dan tak mengapa.""","حَدَّثَنَا عُثْمَانُ بْنُ الْهَيْثَمِ أَوْ مُحَمَّدٌ عَنْهُ عَنْ ابْنِ جُرَيْجٍ قَالَ سَمِعْتُ ابْنَ شِهَابٍ يَقُولُ حَدَّثَنِي عِيسَى بْنُ طَلْحَةَ أَنَّ عَبْدَ اللَّهِ بْنَ عَمْرِو بْنِ الْعَاصِ حَدَّثَهُ
أَنَّ النَّبِيَّ صَلَّى اللَّهُ عَلَيْهِ وَسَلَّمَ بَيْنَمَا هُوَ يَخْطُبُ يَوْمَ النَّحْرِ إِذْ قَامَ إِلَيْهِ رَجُلٌ فَقَالَ كُنْتُ أَحْسِبُ يَا رَسُولَ اللَّهِ كَذَا وَكَذَا قَبْلَ كَذَا وَكَذَا ثُمَّ قَامَ آخَرُ فَقَالَ يَا رَسُولَ اللَّهِ كُنْتُ أَحْسِبُ كَذَا وَكَذَا لِهَؤُلَاءِ الثَّلَاثِ فَقَالَ النَّبِيُّ صَلَّى اللَّهُ عَلَيْهِ وَسَلَّمَ افْعَلْ وَلَا حَرَجَ لَهُنَّ كُلِّهِنَّ يَوْمَئِذٍ فَمَا سُئِلَ يَوْمَئِذٍ عَنْ شَيْءٍ إِلَّا قَالَ افْعَلْ وَلَا حَرَجَ"
6173,63,"Telah menceritakan kepada kami [Ahmad bin Yunus] telah menceritakan kepada kami [Abu Bakar bin 'Iyyasy] dari ['Abdul Aziz bin Rufai'] dari ['Atho'] dari [Ibnu 'Abbas] radliallahu 'anhuma menuturkan; seorang laki-laki berkata kepada Nabi shallallahu 'alaihi wasallam; 'Saya berziarah sebelum melempar jumrah? ' Nabi menjawab: ""Nggak masalah"", laki-laki lain mengatakan; 'Saya mencukur sebelum melempar jamarat? ' Nabi menjawab: ""Nggak masalah!"" Yang lain mengatakan; 'Saya mencukur sebelum menyembelih? ' Nabi menjawab: ""Nggak masalah!.""","حَدَّثَنَا أَحْمَدُ بْنُ يُونُسَ حَدَّثَنَا أَبُو بَكْرِ بْنُ عَيَّاشٍ عَنْ عَبْدِ الْعَزِيزِ بْنِ رُفَيْعٍ عَنْ عَطَاءٍ عَنْ ابْنِ عَبَّاسٍ رَضِيَ اللَّهُ عَنْهُمَا قَالَ
قَالَ رَجُلٌ لِلنَّبِيِّ صَلَّى اللَّهُ عَلَيْهِ وَسَلَّمَ زُرْتُ قَبْلَ أَنْ أَرْمِيَ قَالَ لَا حَرَجَ قَالَ آخَرُ حَلَقْتُ قَبْلَ أَنْ أَذْبَحَ قَالَ لَا حَرَجَ قَالَ آخَرُ ذَبَحْتُ قَبْلَ أَنْ أَرْمِيَ قَالَ لَا حَرَجَ"
6174,63,"Telah menceritakan kepadaku [Ishaq bin Manshur] telah menceritakan kepada kami [Abu Usamah] telah menceritakan kepada kami [Ubaidullah bin Umar] dari [Said bin Abi Sa'id] dari [Abu Hurairah], ada seorang laki-laki masuk masjid dan shalat, sedang Rasulullah Shallallahu'alaihiwasallam ketika itu berada di pojok masjid. kemudian lelaki tersebut datang menemui Nabi dan memberi salam, tapi beliau berujar: ""kembali dan shalaatlah, (karena) kamu belum melakukan shalat!"" Orang itu mengulangi shalatnya dan mengucapkan salam. Nabi shallallahu 'alaihi wasallam bersabda lagi; ""kembalilah dan lakukan shalat (lagi), sebab engkau belum melakukan shalat!"" Pada kali ketiganya, orang itu berujar; 'ajarilah aku! ' Nabi menjawab: ""Jika kamu hendak melakukan shalat, sempurnakanlah wudhu dan menghadaplah ke kiblat, kemudian bertakbirlah dan bacalah al qur`an yang mudah bagimu, kemudian ruku'lah hingga kamu lakukan ruku'mu dengan tenang, kemudian angkatlah kepalamu hingga engkau berdiri dengan tenang, kemudian sujudlah hingga engkau sujud dengan tenang, kemudian angkatlah hingga engkau betul-betul duduk lurus dan tenang, kemudian sujudlah hingga engkau sujud dengan tenang, kemudian angkatlah hingga engkau berdiri dengan tenang, lakukanlah yang demikian dalam semua shalatmu semuanya.""","حَدَّثَنِي إِسْحَاقُ بْنُ مَنْصُورٍ حَدَّثَنَا أَبُو أُسَامَةَ حَدَّثَنَا عُبَيْدُ اللَّهِ بْنُ عُمَرَ عَنْ سَعِيدِ بْنِ أَبِي سَعِيدٍ عَنْ أَبِي هُرَيْرَةَ
أَنَّ رَجُلًا دَخَلَ الْمَسْجِدَ فَصَلَّى وَرَسُولُ اللَّهِ صَلَّى اللَّهُ عَلَيْهِ وَسَلَّمَ فِي نَاحِيَةِ الْمَسْجِدِ فَجَاءَ فَسَلَّمَ عَلَيْهِ فَقَالَ لَهُ ارْجِعْ فَصَلِّ فَإِنَّكَ لَمْ تُصَلِّ فَرَجَعَ فَصَلَّى ثُمَّ سَلَّمَ فَقَالَ وَعَلَيْكَ ارْجِعْ فَصَلِّ فَإِنَّكَ لَمْ تُصَلِّ قَالَ فِي الثَّالِثَةِ فَأَعْلِمْنِي قَالَ إِذَا قُمْتَ إِلَى الصَّلَاةِ فَأَسْبِغْ الْوُضُوءَ ثُمَّ اسْتَقْبِلْ الْقِبْلَةَ فَكَبِّرْ وَاقْرَأْ بِمَا تَيَسَّرَ مَعَكَ مِنْ الْقُرْآنِ ثُمَّ ارْكَعْ حَتَّى تَطْمَئِنَّ رَاكِعًا ثُمَّ ارْفَعْ رَأْسَكَ حَتَّى تَعْتَدِلَ قَائِمًا ثُمَّ اسْجُدْ حَتَّى تَطْمَئِنَّ سَاجِدًا ثُمَّ ارْفَعْ حَتَّى تَسْتَوِيَ وَتَطْمَئِنَّ جَالِسًا ثُمَّ اسْجُدْ حَتَّى تَطْمَئِنَّ سَاجِدًا ثُمَّ ارْفَعْ حَتَّى تَسْتَوِيَ قَائِمًا ثُمَّ افْعَلْ ذَلِكَ فِي صَلَاتِكَ كُلِّهَا"
