haditsId,kitabId,indo,arab
6131,63,"Telah menceritakan kepada kami [Muhammad bin Muqatil Abul Hasan] telah mengabarkan kepada kami [Abdullah] telah mengabarkan kepada kami [Hisyam bin Urwah] dari [ayahnya] dari [Aisyah], bahwasanya [Abu Bakr] radliallahu 'anhu belum pernah bersumpah hingga Allah menurunkan kaffarat sumpah, dan dia mengatakan; 'Tidaklah aku bersumpah, kemudian aku melihat yang lainnya lebih baik, melainkan aku melakukan yang lebih baik dan aku membayar kaffarat sumpahku.'","حَدَّثَنَا مُحَمَّدُ بْنُ مُقَاتِلٍ أَبُو الْحَسَنِ أَخْبَرَنَا عَبْدُ اللَّهِ أَخْبَرَنَا هِشَامُ بْنُ عُرْوَةَ عَنْ أَبِيهِ عَنْ عَائِشَةَ أَنَّ أَبَا بَكْرٍ رَضِيَ اللَّهُ عَنْهُ
لَمْ يَكُنْ يَحْنَثُ فِي يَمِينٍ قَطُّ حَتَّى أَنْزَلَ اللَّهُ كَفَّارَةَ الْيَمِينِ وَقَالَ لَا أَحْلِفُ عَلَى يَمِينٍ فَرَأَيْتُ غَيْرَهَا خَيْرًا مِنْهَا إِلَّا أَتَيْتُ الَّذِي هُوَ خَيْرٌ وَكَفَّرْتُ عَنْ يَمِينِي"
6132,63,"Telah menceritakan kepada kami [Abu Nu'man Muhammad bin Fadhl] telah menceritakan kepada kami [Jarir bin Hazim] telah menceritakan kepada kami [Al Hasan] telah menceritakan kepada kami [Abdurrahman bin Samurah] mengatakan, Nabi shallallahu 'alaihi wasallam bersabda: ""Wahai Abdurrahman bin Samurah, Janganlah kamu meminta jabatan, sebab jika engkau diberi (jabatan) karena meminta, kamu akan ditelantarkan, dan jika kamu diberi dengan tidak meminta, kamu akan ditolong, dan jika kamu melakukan sumpah, kemudian kamu melihat suatu yang lebih baik, bayarlah kaffarat sumpahmu dan lakukanlah yang lebih baik.""","حَدَّثَنَا أَبُو النُّعْمَانِ مُحَمَّدُ بْنُ الْفَضْلِ حَدَّثَنَا جَرِيرُ بْنُ حَازِمٍ حَدَّثَنَا الْحَسَنُ حَدَّثَنَا عَبْدُ الرَّحْمَنِ بْنُ سَمُرَةَ قَالَ
قَالَ النَّبِيُّ صَلَّى اللَّهُ عَلَيْهِ وَسَلَّمَ يَا عَبْدَ الرَّحْمَنِ بْنَ سَمُرَةَ لَا تَسْأَلْ الْإِمَارَةَ فَإِنَّكَ إِنْ أُوتِيتَهَا عَنْ مَسْأَلَةٍ وُكِلْتَ إِلَيْهَا وَإِنْ أُوتِيتَهَا مِنْ غَيْرِ مَسْأَلَةٍ أُعِنْتَ عَلَيْهَا وَإِذَا حَلَفْتَ عَلَى يَمِينٍ فَرَأَيْتَ غَيْرَهَا خَيْرًا مِنْهَا فَكَفِّرْ عَنْ يَمِينِكَ وَأْتِ الَّذِي هُوَ خَيْرٌ"
6133,63,"Telah menceritakan kepada kami [Abu Nu'man] telah menceritakan kepada kami [Hammad bin Zaid] dari [Ghailan bin Jarir] dari [Abu Burdah] dari [ayahnya] menuturkan; aku pernah mendatangi Nabi shallallahu 'alaihi wasallam di tengah-tengah rombongan orang-orang asy'ari, saya meminta agar bisa membawa kami. Tapi Nabi mengatakan: ""demi Allah kami tidak bisa mengikut sertakan kalian dan kami tidak mempunyai kendaraan untuk mengangkut kalian."" Dia melanjutkan; maka kami pun tinggal sekehendak Allah, dan kami diberi tiga unta yang punggungnya putih, sehingga beliau bisa mengangkut kami dengan unta-unta itu. Tatkala kami berjalan, kami atau sebagian kami mengatakan; 'Demi Allah, kita tak akan memperoleh barakah karena kita mendatangi Nabi Shallalahu'alaihi wasallam meminta diikusertakan menumpang, namun beliau terus bersumpah untuk tidak mengikutkan kita menumpang, namun selanjutnya beliau memberi kendaraan untuk mengangkut kami, maka kembalilah sekarang kepada Nabi shallallahu 'alaihi wasallam, kemudian kita utarakan kepada beliau! ' Maka kami mendatangi beliau, dan Nabi menjawab: ""Bukan kami yang mengangkut kalian, namun Allahlah yang menyediakan kendaraan untuk mengangkut kalian.""","حَدَّثَنَا أَبُو النُّعْمَانِ حَدَّثَنَا حَمَّادُ بْنُ زَيْدٍ عَنْ غَيْلَانَ بْنِ جَرِيرٍ عَنْ أَبِي بُرْدَةَ عَنْ أَبِيهِ قَالَ
أَتَيْتُ النَّبِيَّ صَلَّى اللَّهُ عَلَيْهِ وَسَلَّمَ فِي رَهْطٍ مِنْ الْأَشْعَرِيِّينَ أَسْتَحْمِلُهُ فَقَالَ وَاللَّهِ لَا أَحْمِلُكُمْ وَمَا عِنْدِي مَا أَحْمِلُكُمْ عَلَيْهِ قَالَ ثُمَّ لَبِثْنَا مَا شَاءَ اللَّهُ أَنْ نَلْبَثَ ثُمَّ أُتِيَ بِثَلَاثِ ذَوْدٍ غُرِّ الذُّرَى فَحَمَلَنَا عَلَيْهَا فَلَمَّا انْطَلَقْنَا قُلْنَا أَوْ قَالَ بَعْضُنَا وَاللَّهِ لَا يُبَارَكُ لَنَا أَتَيْنَا النَّبِيَّ صَلَّى اللَّهُ عَلَيْهِ وَسَلَّمَ نَسْتَحْمِلُهُ فَحَلَفَ أَنْ لَا يَحْمِلَنَا ثُمَّ حَمَلَنَا فَارْجِعُوا بِنَا إِلَى النَّبِيِّ صَلَّى اللَّهُ عَلَيْهِ وَسَلَّمَ فَنُذَكِّرُهُ فَأَتَيْنَاهُ فَقَالَ مَا أَنَا حَمَلْتُكُمْ بَلْ اللَّهُ حَمَلَكُمْ وَإِنِّي وَاللَّهِ إِنْ شَاءَ اللَّهُ لَا أَحْلِفُ عَلَى يَمِينٍ فَأَرَى غَيْرَهَا خَيْرًا مِنْهَا إِلَّا كَفَّرْتُ عَنْ يَمِينِي وَأَتَيْتُ الَّذِي هُوَ خَيْرٌ أَوْ أَتَيْتُ الَّذِي هُوَ خَيْرٌ وَكَفَّرْتُ عَنْ يَمِينِي"
6134,63,"Telah menceritakan kepadaku [Ishaq bin Ibrahim] telah mengabarkan kepada kami [Abdurrazaaq] telah mengabarkan kepada kami [Ma'mar] dari [Hammam bin Munabbih] mengatakan, inilah yang diceritakan [Abu Hurairah] kepada kami dari Nabi shallallahu 'alaihi wasallam, beliau bersabda: ""Kita adalah orang-orang yang terakhir, namun lebih dahulu masuk surga di hari kiamat.""","حَدَّثَنِي إِسْحَاقُ بْنُ إِبْرَاهِيمَ أَخْبَرَنَا عَبْدُ الرَّزَّاقِ أَخْبَرَنَا مَعْمَرٌ عَنْ هَمَّامِ بْنِ مُنَبِّهٍ قَالَ هَذَا مَا حَدَّثَنَا بِهِ أَبُو هُرَيْرَةَ
عَنْ النَّبِيِّ صَلَّى اللَّهُ عَلَيْهِ وَسَلَّمَ قَالَ نَحْنُ الْآخِرُونَ السَّابِقُونَ يَوْمَ الْقِيَامَةِ"
6135,63,"Dan (masih dari jalur periwayatan yang sama dengan hadits sebelumnya -dari [Abu Hurairah]-) Rasulullah Shallallahu'alaihiwasallam bersabda: ""Demi Allah, salah seorang diantara kalian terus-menerus bersama keluarganya dengan sumpahnya, lebih berdosa baginya disisi Allah daripada ia memberikan kaffarat sumpahnya yang Allah wajibkan baginya.""",وَقَالَ رَسُولُ اللَّهِ صَلَّى اللَّهُ عَلَيْهِ وَسَلَّمَ وَاللَّهِ لَأَنْ يَلِجَّ أَحَدُكُمْ بِيَمِينِهِ فِي أَهْلِهِ آثَمُ لَهُ عِنْدَ اللَّهِ مِنْ أَنْ يُعْطِيَ كَفَّارَتَهُ الَّتِي افْتَرَضَ اللَّهُ عَلَيْهِ
6136,63,"Telah menceritakan kepadaku [Ishaq yaitu bin Ibrahim] telah menceritakan kepada kami [Yahya bin Shalih] telah menceritakan kepada kami [Mu'awiyah] dari [Yahya] dari [Ikrimah] dari [Abu Hurairah] mengatakan, Rasulullah Shallallahu'alaihiwasallam bersabda: ""Siapa yang terus menerus dalam keluarganya dengan disertai sumpah, itu lebih besar dosanya daripada sekedar membayar kaffarat.""","حَدَّثَنِي إِسْحَاقُ يَعْنِي ابْنَ إِبْرَاهِيمَ حَدَّثَنَا يَحْيَى بْنُ صَالِحٍ حَدَّثَنَا مُعَاوِيَةُ عَنْ يَحْيَى عَنْ عِكْرِمَةَ عَنْ أَبِي هُرَيْرَةَ قَالَ
قَالَ رَسُولُ اللَّهِ صَلَّى اللَّهُ عَلَيْهِ وَسَلَّمَ مَنْ اسْتَلَجَّ فِي أَهْلِهِ بِيَمِينٍ فَهُوَ أَعْظَمُ إِثْمًا لِيَبَرَّ يَعْنِي الْكَفَّارَةَ"
6137,63,"Telah menceritakan kepada kami [Qutaibah bin Sa'd] dari [Isma'il bin Ja'far] dari [Abdullah bin Dinar] dari [Ibnu Umar] radliallahu 'anhuma mengatakan, suatu kali Rasulullah Shallallahu'alaihi wa sallam mengutus utusan dan mengangkat Usamah bin Zaid sebagai komandan mereka, tetapi sebagian sahabat mencela habis-habisan kepemimpinannya. Maka Rasulullah Shallallahu'alaihiwasallam berdiri dan bersabda: ""Kalaulah kalian mencela kepemimpinannya, dahulu kalian telah mencela kepemimpinan ayahnya. Demi Allah, ia adalah orang yang paling ideal memegang kepemimpinan, dan ayahnya dahulu adalah diantara manusia yang paling kucintai, dan anaknya sekarang diantara manusia yang paling kucintai sepeninggal ayahnya.""","حَدَّثَنَا قُتَيْبَةُ بْنُ سَعِيدٍ عَنْ إِسْمَاعِيلَ بْنِ جَعْفَرٍ عَنْ عَبْدِ اللَّهِ بْنِ دِينَارٍ عَنْ ابْنِ عُمَرَ رَضِيَ اللَّهُ عَنْهُمَا قَالَ
بَعَثَ رَسُولُ اللَّهِ صَلَّى اللَّهُ عَلَيْهِ وَسَلَّمَ بَعْثًا وَأَمَّرَ عَلَيْهِمْ أُسَامَةَ بْنَ زَيْدٍ فَطَعَنَ بَعْضُ النَّاسِ فِي إِمْرَتِهِ فَقَامَ رَسُولُ اللَّهِ صَلَّى اللَّهُ عَلَيْهِ وَسَلَّمَ فَقَالَ إِنْ كُنْتُمْ تَطْعَنُونَ فِي إِمْرَتِهِ فَقَدْ كُنْتُمْ تَطْعَنُونَ فِي إِمْرَةِ أَبِيهِ مِنْ قَبْلُ وَايْمُ اللَّهِ إِنْ كَانَ لَخَلِيقًا لِلْإِمَارَةِ وَإِنْ كَانَ لَمِنْ أَحَبِّ النَّاسِ إِلَيَّ وَإِنَّ هَذَا لَمِنْ أَحَبِّ النَّاسِ إِلَيَّ بَعْدَهُ"
6138,63,"Telah menceritakan kepada kami [Muhammad bin Yusuf] dari [Sufyan] dari [Musa bin 'Uqbah] dari [Salim] dari [Ibnu Umar] mengatakan, sumpah Nabi shallallahu 'alaihi wasallam adalah: ""tidak, demi Dzat yang membolak-balikkan hati.""","حَدَّثَنَا مُحَمَّدُ بْنُ يُوسُفَ عَنْ سُفْيَانَ عَنْ مُوسَى بْنِ عُقْبَةَ عَنْ سَالِمٍ عَنْ ابْنِ عُمَرَ قَالَ
كَانَتْ يَمِينُ النَّبِيِّ صَلَّى اللَّهُ عَلَيْهِ وَسَلَّمَ لَا وَمُقَلِّبِ الْقُلُوبِ"
6139,63,"Telah menceritakan kepada kami [Musa] Telah menceritakan kepada kami [Abu 'Awanah] dari [Abdul Malik] dari [Jabir bin Samurah] dari Nabi shallallahu 'alaihi wasallam, beliau bersabda: ""Jika Kaisar telah meninggal, tak akan ada kaisar lagi sepeninggalnya, dan jika Kisra meninggal, maka tak akan ada lagi Kisra sepeninggalnya. Demi Dzat yang jiwaku berada di Tangan-Nya, perbendaharaan kekayaan keduanya akan terbelanjakan fi sabilillah.""","حَدَّثَنَا مُوسَى حَدَّثَنَا أَبُو عَوَانَةَ عَنْ عَبْدِ الْمَلِكِ عَنْ جَابِرِ بْنِ سَمُرَةَ
عَنْ النَّبِيِّ صَلَّى اللَّهُ عَلَيْهِ وَسَلَّمَ قَالَ إِذَا هَلَكَ قَيْصَرُ فَلَا قَيْصَرَ بَعْدَهُ وَإِذَا هَلَكَ كِسْرَى فَلَا كِسْرَى بَعْدَهُ وَالَّذِي نَفْسِي بِيَدِهِ لَتُنْفَقَنَّ كُنُوزُهُمَا فِي سَبِيلِ اللَّهِ"
6140,63,"Telah menceritakan kepadaku [Abul Yaman] telah mengabarkan kepada kami [Syu'aib] dari [Az Zuhri] telah mengabarkan kepada kami [Sa'id bin Al Musayyab] bahwa [Abu Hurairah] menuturkan; Rasulullah shallallahu 'alaihi wasallam bersabda: ""Jika Kaisar telah meninggal, tak akan ada kaisar lagi sepeninggalnya, dan jika Kisra meninggal, maka tak akan ada lagi Kisra sepeninggalnya. Demi Dzat yang jiwa Muhammad berada di Tangan-Nya, perbendaharaan kekayaan keduanya akan terbelanjakan fi sabilillah.""","حَدَّثَنَا أَبُو الْيَمَانِ أَخْبَرَنَا شُعَيْبٌ عَنْ الزُّهْرِيِّ أَخْبَرَنِي سَعِيدُ بْنُ الْمُسَيَّبِ أَنَّ أَبَا هُرَيْرَةَ قَالَ
قَالَ رَسُولُ اللَّهِ صَلَّى اللَّهُ عَلَيْهِ وَسَلَّمَ إِذَا هَلَكَ كِسْرَى فَلَا كِسْرَى بَعْدَهُ وَإِذَا هَلَكَ قَيْصَرُ فَلَا قَيْصَرَ بَعْدَهُ وَالَّذِي نَفْسُ مُحَمَّدٍ بِيَدِهِ لَتُنْفَقَنَّ كُنُوزُهُمَا فِي سَبِيلِ اللَّهِ"
6141,63,"Telah menceritakan kepadaku [Muhammad] Telah memberitakan kepada kami ['Abdah] dari [Hisyam bin 'Urwah] dari [Ayahnya] dari ['Aisyah] radliyallahu'anhuma, dari Nabi shallallahu 'alaihi wasallam, beliau bersabda: ""Wahai umat Muhammad, demi Allah, kalaulah kalian tahu yang aku tahu, niscaya kalian banyak menangis dan sedikit tertawa.""","حَدَّثَنِي مُحَمَّدٌ أَخْبَرَنَا عَبْدَةُ عَنْ هِشَامِ بْنِ عُرْوَةَ عَنْ أَبِيهِ عَنْ عَائِشَةَ رَضِيَ اللَّهُ عَنْهَا
عَنْ النَّبِيِّ صَلَّى اللَّهُ عَلَيْهِ وَسَلَّمَ أَنَّهُ قَالَ يَا أُمَّةَ مُحَمَّدٍ وَاللَّهِ لَوْ تَعْلَمُونَ مَا أَعْلَمُ لَبَكَيْتُمْ كَثِيرًا وَلَضَحِكْتُمْ قَلِيلًا"
6142,63,"Telah menceritakan kepada kami [Yahya bin Sulaiman] menuturkan; telah menceritakan kepadaku [Ibnu Wahab] menuturkan; telah telah mengabarkan kepadaku [Haiwah] mengatakan; telah menceritakan kepadaku [Abu Uqail Zuhra bin Ma'bad] bahwasanya ia mendengar [kakeknya, Abdullah bin Hisyam] menuturkan; kami pernah bersama Nabi shallallahu 'alaihi wasallam yang saat itu beliau menggandeng tangan Umar bin Khattab, kemudian Umar berujar: ""ya Rasulullah, sungguh engkau lebih aku cintai dari segala-galanya selain diriku sendiri."" Nabi shallallahu 'alaihi wasallam bersabda: ""Tidak, demi Dzat yang jiwa berada di Tangan-Nya, hingga aku lebih engkau cintai daripada dirimu sendiri."" Maka Umar berujar; 'Sekarang demi Allah, engkau lebih aku cintai daripada diriku'. Maka Nabi shallallahu 'alaihi wasallam bersabda: ""sekarang (baru benar) wahai Umar.""","حَدَّثَنَا يَحْيَى بْنُ سُلَيْمَانَ قَالَ حَدَّثَنِي ابْنُ وَهْبٍ قَالَ أَخْبَرَنِي حَيْوَةُ قَالَ حَدَّثَنِي أَبُو عَقِيلٍ زُهْرَةُ بْنُ مَعْبَدٍ أَنَّهُ سَمِعَ جَدَّهُ عَبْدَ اللَّهِ بْنَ هِشَامٍ قَالَ
كُنَّا مَعَ النَّبِيِّ صَلَّى اللَّهُ عَلَيْهِ وَسَلَّمَ وَهُوَ آخِذٌ بِيَدِ عُمَرَ بْنِ الْخَطَّابِ فَقَالَ لَهُ عُمَرُ يَا رَسُولَ اللَّهِ لَأَنْتَ أَحَبُّ إِلَيَّ مِنْ كُلِّ شَيْءٍ إِلَّا مِنْ نَفْسِي فَقَالَ النَّبِيُّ صَلَّى اللَّهُ عَلَيْهِ وَسَلَّمَ لَا وَالَّذِي نَفْسِي بِيَدِهِ حَتَّى أَكُونَ أَحَبَّ إِلَيْكَ مِنْ نَفْسِكَ فَقَالَ لَهُ عُمَرُ فَإِنَّهُ الْآنَ وَاللَّهِ لَأَنْتَ أَحَبُّ إِلَيَّ مِنْ نَفْسِي فَقَالَ النَّبِيُّ صَلَّى اللَّهُ عَلَيْهِ وَسَلَّمَ الْآنَ يَا عُمَرُ"
6143,63,"Telah menceritakan kepada kami [Isma'il] mengatakan; telah menceritakan kepadaku [Malik] dari [Ibnu Syihab] dari [Ubaidullah bin Abdillah bin Utbah bin Mas'ud] dari [Abu Hurairah] dan [Zaid bin Khalid] keduanya mengabarkannya, bahwa ada dua orang bersengketa dan mengadukan perkaranya kepada Rasulullah Shallallahu'alaihiwasallam. Salah satu dari keduanya berujar; 'putuskanlah antara kami dengan kitabullah! ' lalu laki-laki kedua -dan dia lebih pandai agama daripada laki-laki pertama- menjawab; 'Betul ya Rasulullah, putuskanlah antara kami dengan kitabullah dan izinkan bagiku untuk berbicara.' ""Bicaralah, "" kata Nabi. Lanjutnya; 'sesungguhnya anakku adalah 'asiif (pekerja) orang ini. -Malik menjelaskan bahwa asiif adalah buruh.- Anakku berzina dengan isterinya. Maka orang-orang mengabarkan kepadaku bahwa anakku harus dihukum rajam, aku pun menebusnya dengan seratus ekor unta dan satu hamba sahaya. Lalu aku bertanya para orang alim, dan mereka menjelaskan, bahwa anakku cukup dijilid (dicambuk) seratus kali cambukan dan diasingkan selama satu tahun, dan rajam berlaku bagi isterinya.' Maka Rasulullah Shallallahu'alaihiwasallam bersabda: ""Ketahuilah, demi Allah, saya putuskan perkara kalian berdua dengan kitabullah, kambing dan hamba sahayamu dikembalikan kepadamu, dan anak laki-lakimu dicambuk seratus kali dan diasingkan setahun."" Kemudian beliau memerintahkan Unais Al Aslami untuk mendatangi isteri laki-laki tersebut, jika ia mengaku telah berzina maka dirajam, dan ternyata perempuan laki-laki tersebut mengakui, maka dia pun merajamnya.","حَدَّثَنَا إِسْمَاعِيلُ قَالَ حَدَّثَنِي مَالِكٌ عَنْ ابْنِ شِهَابٍ عَنْ عُبَيْدِ اللَّهِ بْنِ عَبْدِ اللَّهِ بْنِ عُتْبَةَ بْنِ مَسْعُودٍ عَنْ أَبِي هُرَيْرَةَ وَزَيْدِ بْنِ خَالِدٍ أَنَّهُمَا أَخْبَرَاهُ
أَنَّ رَجُلَيْنِ اخْتَصَمَا إِلَى رَسُولِ اللَّهِ صَلَّى اللَّهُ عَلَيْهِ وَسَلَّمَ فَقَالَ أَحَدُهُمَا اقْضِ بَيْنَنَا بِكِتَابِ اللَّهِ وَقَالَ الْآخَرُ وَهُوَ أَفْقَهُهُمَا أَجَلْ يَا رَسُولَ اللَّهِ فَاقْضِ بَيْنَنَا بِكِتَابِ اللَّهِ وَأْذَنْ لِي أَنْ أَتَكَلَّمَ قَالَ تَكَلَّمْ قَالَ إِنَّ ابْنِي كَانَ عَسِيفًا عَلَى هَذَا قَالَ مَالِكٌ وَالْعَسِيفُ الْأَجِيرُ زَنَى بِامْرَأَتِهِ فَأَخْبَرُونِي أَنَّ عَلَى ابْنِي الرَّجْمَ فَافْتَدَيْتُ مِنْهُ بِمِائَةِ شَاةٍ وَجَارِيَةٍ لِي ثُمَّ إِنِّي سَأَلْتُ أَهْلَ الْعِلْمِ فَأَخْبَرُونِي أَنَّ مَا عَلَى ابْنِي جَلْدُ مِائَةٍ وَتَغْرِيبُ عَامٍ وَإِنَّمَا الرَّجْمُ عَلَى امْرَأَتِهِ فَقَالَ رَسُولُ اللَّهِ صَلَّى اللَّهُ عَلَيْهِ وَسَلَّمَ أَمَا وَالَّذِي نَفْسِي بِيَدِهِ لَأَقْضِيَنَّ بَيْنَكُمَا بِكِتَابِ اللَّهِ أَمَّا غَنَمُكَ وَجَارِيَتُكَ فَرَدٌّ عَلَيْكَ وَجَلَدَ ابْنَهُ مِائَةً وَغَرَّبَهُ عَامًا وَأُمِرَ أُنَيْسٌ الْأَسْلَمِيُّ أَنْ يَأْتِيَ امْرَأَةَ الْآخَرِ فَإِنْ اعْتَرَفَتْ رَجَمَهَا فَاعْتَرَفَتْ فَرَجَمَهَا"
6144,63,"Telah menceritakan kepadaku [Abdullah bin Muhammad] telah menceritakan kepada kami [Wahab] telah menceritakan kepada kami [Syu'bah] dari [Muhammad bin Abi Ya'qub] dari [Abdurrahman bin Abi Bakrah] dari [ayahnya] dari Nabi shallallahu 'alaihi wasallam, bersabda: ""Bagaimana pendapat kalian jika Aslam, Ghifar, Muzainah, dan Juhainah lebih baik dari Bani tamim, Amir bin Sho'sho'ah, Ghathafan, dan Asad yang mereka celaka dan rugi?"" Mereka menjawab; 'Baik."" Nabi lantas bersabda: ""Demi Dzat yang jiwaku di Tangan-Nya, sesungguhnya mereka lebih baik daripada mereka.""","حَدَّثَنِي عَبْدُ اللَّهِ بْنُ مُحَمَّدٍ حَدَّثَنَا وَهْبٌ حَدَّثَنَا شُعْبَةُ عَنْ مُحَمَّدِ بْنِ أَبِي يَعْقُوبَ عَنْ عَبْدِ الرَّحْمَنِ بْنِ أَبِي بَكْرَةَ عَنْ أَبِيهِ
عَنْ النَّبِيِّ صَلَّى اللَّهُ عَلَيْهِ وَسَلَّمَ قَالَ أَرَأَيْتُمْ إِنْ كَانَ أَسْلَمُ وَغِفَارُ وَمُزَيْنَةُ وَجُهَيْنَةُ خَيْرًا مِنْ تَمِيمٍ وَعَامِرِ بْنِ صَعْصَعَةَ وَغَطَفَانَ وَأَسَدٍ خَابُوا وَخَسِرُوا قَالُوا نَعَمْ فَقَالَ وَالَّذِي نَفْسِي بِيَدِهِ إِنَّهُمْ خَيْرٌ مِنْهُمْ"
6145,63,"Telah menceritakan kepada kami [Abul yaman] telah memberitakan kepada kami [Syu'aib] dari [Az Zuhri] mengatakan; telah menceritakan kepadaku [Urwah] dari [Abu Humaid As Sa'idi] bahwasanya ia mengabarkan kepadanya, bahwa Rasulullah Shallallahu'alaihi wa sallam mempekerjakan karyawan zakat ('amil). Setelah selesai dari kerjanya, 'amil tadi mendatangi Nabi dan berujar; 'Wahai Rasulullah, ini untuk kalian dan ini dihadiahkan untukku'. Lantas Nabi bersabda: ""tidakkah kamu duduk-duduk saja di rumah ayahmu atau ibumu kemudian kamu cermati, apakah kamu memperoleh hadiah ataukah tidak?"" Kemudian Rasulullah Shallallahu'alaihi wa sallam berdiri diwaktu sore setelah berdoa, bersyahadat, dan memuji Allah dengan puji-pujian yang semestinya bagi-Nya, kemudian beliau memulai: ""Amma ba'du. Ada apa gerangan dengan 'amil zakat yang kami pekerjakan, dia mendatangi kami dan berujar; 'Ini dari pekerjaan kalian dan ini hadiah untukku, tidakkah ia duduk-duduk saja di rumah ayahnya atu ibunya lantas ia cermati, apakah ia memperoleh hadiah ataukah tidak? Demi dzat yang jiwa Muhammad di Tangan-Nya, tidaklah salah seorang diantara kalian mengambil harta tanpa haknya, selain pada hari kiamat nanti harta itu ia pikul diatas tengkuknya, dan jika unta, ia akan memikulnya dan mengeluarkan suara unta, dan jika sapi, maka sapi itu dipikulnya dan melenguh, dan jika harta yang ia ambil berupa kambing, maka kambing itu akan mengembik. Sungguh telah kusampaikan."" Kata Abu Humaid; 'kemudian Rasulullah Shallallahu'alaihiwasallam mengangkat tangannya hingga kami melihat warna putih ketiaknya.' Abu Humaid berkata; 'dan telah mendengar hal itu bersamaku adalah Zaid bin Tsabit, dari Nabi shallallahu 'alaihi wasallam, maka tanyailah dia.'","حَدَّثَنَا أَبُو الْيَمَانِ أَخْبَرَنَا شُعَيْبٌ عَنْ الزُّهْرِيِّ قَالَ أَخْبَرَنِي عُرْوَةُ عَنْ أَبِي حُمَيْدٍ السَّاعِدِيِّ أَنَّهُ أَخْبَرَهُ
أَنَّ رَسُولَ اللَّهِ صَلَّى اللَّهُ عَلَيْهِ وَسَلَّمَ اسْتَعْمَلَ عَامِلًا فَجَاءَهُ الْعَامِلُ حِينَ فَرَغَ مِنْ عَمَلِهِ فَقَالَ يَا رَسُولَ اللَّهِ هَذَا لَكُمْ وَهَذَا أُهْدِيَ لِي فَقَالَ لَهُ أَفَلَا قَعَدْتَ فِي بَيْتِ أَبِيكَ وَأُمِّكَ فَنَظَرْتَ أَيُهْدَى لَكَ أَمْ لَا ثُمَّ قَامَ رَسُولُ اللَّهِ صَلَّى اللَّهُ عَلَيْهِ وَسَلَّمَ عَشِيَّةً بَعْدَ الصَّلَاةِ فَتَشَهَّدَ وَأَثْنَى عَلَى اللَّهِ بِمَا هُوَ أَهْلُهُ ثُمَّ قَالَ أَمَّا بَعْدُ فَمَا بَالُ الْعَامِلِ نَسْتَعْمِلُهُ فَيَأْتِينَا فَيَقُولُ هَذَا مِنْ عَمَلِكُمْ وَهَذَا أُهْدِيَ لِي أَفَلَا قَعَدَ فِي بَيْتِ أَبِيهِ وَأُمِّهِ فَنَظَرَ هَلْ يُهْدَى لَهُ أَمْ لَا فَوَالَّذِي نَفْسُ مُحَمَّدٍ بِيَدِهِ لَا يَغُلُّ أَحَدُكُمْ مِنْهَا شَيْئًا إِلَّا جَاءَ بِهِ يَوْمَ الْقِيَامَةِ يَحْمِلُهُ عَلَى عُنُقِهِ إِنْ كَانَ بَعِيرًا جَاءَ بِهِ لَهُ رُغَاءٌ وَإِنْ كَانَتْ بَقَرَةً جَاءَ بِهَا لَهَا خُوَارٌ وَإِنْ كَانَتْ شَاةً جَاءَ بِهَا تَيْعَرُ فَقَدْ بَلَّغْتُ فَقَالَ أَبُو حُمَيْدٍ ثُمَّ رَفَعَ رَسُولُ اللَّهِ صَلَّى اللَّهُ عَلَيْهِ وَسَلَّمَ يَدَهُ حَتَّى إِنَّا لَنَنْظُرُ إِلَى عُفْرَةِ إِبْطَيْهِ قَالَ أَبُو حُمَيْدٍ وَقَدْ سَمِعَ ذَلِكَ مَعِي زَيْدُ بْنُ ثَابِتٍ مِنْ النَّبِيِّ صَلَّى اللَّهُ عَلَيْهِ وَسَلَّمَ فَسَلُوهُ"
