haditsId,kitabId,indo,arab,label
4806,46,"Telah mengkhabarkan kepada kami [Utsman bin Abdullah], dia berkata; telah menceritakan kepadaku [Al Hasan bin Hammad], dia berkata; telah menceritakan kepada kami ['Amr bin Hasyim Al Janbi Abu Malik] dari ['Ubaidullah bin Umar] dari [Nafi'] dari [Ibnu Umar radliallahu 'anhuma] bahwa ada seorang wanita meminjam perhiasan milik orang kemudian ia menahannya. Kemudian Rasulullah shallallahu 'alaihi wasallam bersabda: ""Wanita ini hendaknya bertaubat kepada Allah dan RasulNya serta mengembalikan apa yang telah dia ambil dari orang-orang tersebut."" Kemudian Rasulullah shallallahu 'alaihi wasallam bersabda: ""Berdirilah wahai Bilal ambil tangannya lalu potonglah.""","أَخْبَرَنَا عُثْمَانُ بْنُ عَبْدِ اللَّهِ قَالَ حَدَّثَنِي الْحَسَنُ بْنُ حَمَّادٍ قَالَ حَدَّثَنَا عَمْرُو بْنُ هَاشِمٍ الْجَنْبِيُّ أَبُو مَالِكٍ عَنْ عُبَيْدِ اللَّهِ بْنِ عُمَرَ عَنْ نَافِعٍ عَنْ ابْنِ عُمَرَ رَضِيَ اللَّهُ عَنْهُمَا
أَنَّ امْرَأَةً كَانَتْ تَسْتَعِيرُ الْحُلِيَّ لِلنَّاسِ ثُمَّ تُمْسِكُهُ فَقَالَ رَسُولُ اللَّهِ صَلَّى اللَّهُ عَلَيْهِ وَسَلَّمَ لِتَتُبْ هَذِهِ الْمَرْأَةُ إِلَى اللَّهِ وَرَسُولِهِ وَتَرُدَّ مَا تَأْخُذُ عَلَى الْقَوْمِ ثُمَّ قَالَ رَسُولُ اللَّهِ صَلَّى اللَّهُ عَلَيْهِ وَسَلَّمَ قُمْ يَا بِلَالُ فَخُذْ بِيَدِهَا فَاقْطَعْهَا",26
5308,49,"Telah menceritakan kepada kami [Ar Rabi' bin Sulaiman] ia berkata; telah menceritakan kepada kami [Syu'aib bin Al Laits] ia berkata; telah menceritakan kepada kami [Al Laits] dari [Ibnu 'Ajlan] dari [Abu Az Zinad] dari [Al A'raj] dari [Abu Hurairah] dari Rasulullah shallallahu 'alaihi wasallam, bahwa beliau bersabda: ""Dua orang wanita keluar dengan membawa anak mereka masing-masing, lalu seekor serigala mengambil anak salah seorang dari mereka. Lalu mereka mengadu kepada Nabi Dawud 'Alaihis Salam tentang perselisihan mereka terhadap anak yang masih tersisa. Dan Nabi Dawud memberi putusan bahwa anak itu milik wanita yang umurnya lebih tua. Keduanya lalu melewati Nabi Sulaiman, Nabi Sulaiman bertanya, ""Apa masalah kalian?"" akhirnya keduanya mengisahkan masalah tersebut kepadanya, Nabi Sulaiman lalu berkata, ""Berilah aku sebilah pisau, aku dapat membelahnya untuk kalian berdua."" Maka wanita yang lebih muda berkata, ""Engkau akan membelahnya!"" Nabi Sulaiman menjawab, ""Benar."" Wanita itu berkata lagi, ""Jangan engkau lakukan, bagianku akan aku berikan kepadanya."" Nabi Sulaiman kemudian berkata, ""Anak itu adalah milikmu."" Maka Nabi Sulaiman memberi putusan bahwa anak tersebut milik wanita yang lebih muda.""","أَخْبَرَنَا الرَّبِيعُ بْنُ سُلَيْمَانَ قَالَ حَدَّثَنَا شُعَيْبُ بْنُ اللَّيْثِ قَالَ حَدَّثَنَا اللَّيْثُ عَنْ ابْنِ عَجْلَانَ عَنْ أَبِي الزِّنَادِ عَنْ الْأَعْرَجِ عَنْ أَبِي هُرَيْرَةَ
عَنْ رَسُولِ اللَّهِ صَلَّى اللَّهُ عَلَيْهِ وَسَلَّمَ أَنَّهُ قَالَ خَرَجَتْ امْرَأَتَانِ مَعَهُمَا صَبِيَّانِ لَهُمَا فَعَدَا الذِّئْبُ عَلَى إِحْدَاهُمَا فَأَخَذَ وَلَدَهَا فَأَصْبَحَتَا تَخْتَصِمَانِ فِي الصَّبِيِّ الْبَاقِي إِلَى دَاوُدَ عَلَيْهِ السَّلَام فَقَضَى بِهِ لِلْكُبْرَى مِنْهُمَا فَمَرَّتَا عَلَى سُلَيْمَانَ فَقَالَ كَيْفَ أَمْرُكُمَا فَقَصَّتَا عَلَيْهِ فَقَالَ ائْتُونِي بِالسِّكِّينِ أَشُقُّ الْغُلَامَ بَيْنَهُمَا فَقَالَتْ الصُّغْرَى أَتَشُقُّهُ قَالَ نَعَمْ فَقَالَتْ لَا تَفْعَلْ حَظِّي مِنْهُ لَهَا قَالَ هُوَ ابْنُكِ فَقَضَى بِهِ لَهَا",26
5309,49,"Telah mengabarkan kepada kami [Al Mughirah bin 'Abdurrahman] ia berkata; telah menceritakan kepada kami [Miskin bin Bukair] ia berkata; telah menceritakan kepada kami [Syu'aib bin Abu Hamzah] dari [Abu Az Zinad] dari [Al A'raj] dari [Abu Hurairah] dari Nabi shallallahu 'alaihi wasallam, beliau bersabda: ""Dua orang wanita keluar dengan membawa anak mereka masing-masing, lalu seekor serigala mengambil anak salah seorang dari keduanya. Maka keduanya mengadukan kepada Nabi Dawud 'Alaihis Salam tentang setatus anak yang masih tersisa. Lalu Nabi Dawud memutuskan bahwa anak itu adalah milik wanita yang lebih tua. Kemudian mereka mendatangi Nabi Sulaiman, ia lalu bertanya, ""bagaimana Nabi Dawud memberi putusan untuk kalian?"" Wanita yang umurnya lebih muda berkata, ""Dia memberi putusan bahwa anak itu milik wanita yang umurnya lebih tua."" Nabi Sulaiman berkata, ""Aku akan membelahnya menjadi dua bagian, untuk yang ini separuh dan untuk yang ini separuh."" Wanita yang lebih tua berkata, ""Ya, silahkan potong."" Sementara yang muda berkata, ""Jangan engkau potong, biarlah anak itu menjadi miliknya."" Maka Sulaiman memberi putusan bahwa anak itu untuk wanita yang menolak agar anak itu dipotong.""","أَخْبَرَنَا الْمُغِيرَةُ بْنُ عَبْدِ الرَّحْمَنِ قَالَ حَدَّثَنَا مِسْكِينُ بْنُ بُكَيْرٍ قَالَ حَدَّثَنَا شُعَيْبُ بْنُ أَبِي حَمْزَةَ عَنْ أَبِي الزِّنَادِ عَنْ الْأَعْرَجِ عَنْ أَبِي هُرَيْرَةَ
عَنْ النَّبِيِّ صَلَّى اللَّهُ عَلَيْهِ وَسَلَّمَ قَالَ خَرَجَتْ امْرَأَتَانِ مَعَهُمَا وَلَدَاهُمَا فَأَخَذَ الذِّئْبُ أَحَدَهُمَا فَاخْتَصَمَتَا فِي الْوَلَدِ إِلَى دَاوُدَ النَّبِيِّ صَلَّى اللَّهُ عَلَيْهِ وَسَلَّمَ فَقَضَى بِهِ لِلْكُبْرَى مِنْهُمَا فَمَرَّتَا عَلَى سُلَيْمَانَ عَلَيْهِ السَّلَام فَقَالَ كَيْفَ قَضَى بَيْنَكُمَا قَالَتْ قَضَى بِهِ لِلْكُبْرَى قَالَ سُلَيْمَانُ أَقْطَعُهُ بِنِصْفَيْنِ لِهَذِهِ نِصْفٌ وَلِهَذِهِ نِصْفٌ قَالَتْ الْكُبْرَى نَعَمْ اقْطَعُوهُ فَقَالَتْ الصُّغْرَى لَا تَقْطَعْهُ هُوَ وَلَدُهَا فَقَضَى بِهِ لِلَّتِي أَبَتْ أَنْ يَقْطَعَهُ",26
5329,49,"Telah mengabarkan kepada kami [Amru bin Ali] ia berkata; telah menceritakan kepada kami [Abdul A'la] ia berkata; telah menceritakan kepada kami [Sa'id] dari [Qatadah] dari [Sa'id bin Abu Burdah] dari [Bapaknya] dari [Abu Musa] berkata, ""Dua orang laki-laki mengadukan kepada Nabi shallallahu 'alaihi wasallam berkenaan dengan hewan tunggangan yang keduanya tidak mempunyai bukti, beliau lalu memberi putusan bahwa hewan itu milik mereka berdua.""","أَخْبَرَنَا عَمْرُو بْنُ عَلِيٍّ قَالَ حَدَّثَنَا عَبْدُ الْأَعْلَى قَالَ حَدَّثَنَا سَعِيدٌ عَنْ قَتَادَةَ عَنْ سَعِيدِ بْنِ أَبِي بُرْدَةَ عَنْ أَبِيهِ عَنْ أَبِي مُوسَى
أَنَّ رَجُلَيْنِ اخْتَصَمَا إِلَى النَّبِيِّ صَلَّى اللَّهُ عَلَيْهِ وَسَلَّمَ فِي دَابَّةٍ لَيْسَ لِوَاحِدٍ مِنْهُمَا بَيِّنَةٌ فَقَضَى بِهَا بَيْنَهُمَا نِصْفَيْنِ",26
