haditsId,kitabId,indo,arab,label
798,6,"Telah menceritakan kepada kami [Ali bin Khasyram] telah mengabarkan kepada kami [Sufyan bin 'Uyainah] dari [Abu Ishaq] dari [Zaid bin Utsai'] berkata; ""Saya bertanya kepada [Ali]; 'Dengan apa engkau diutus? ' Dia menjawab; 'Saya diutus dengan empat hal; tidak akan masuk surga kecuali orang muslim. Tidak boleh thowaf di Ka'bah dengan telanjang. Setelah tahun ini kaum muslimin dan musyrikin tidak boleh berkumpul. Dan barangsiapa yang memiliki perjanjian dengan Nabi shallallahu 'alaihi wasallam maka batasnya sampai waktu yang telah ditentukan, namun siapa yang tidak memiliki batasan waktu maka diberi batas waktu selama empat bulan'."" (Abu Isa At Tirmidzi) berkata; ""Hadits semakna diriawayatkan dari Abu Hurairah."" Abu 'Isa berkata; ""Hadits Ali Merupakan hadits hasan. Telah menceritakan kepada kami [Ibnu Abu Umar] dan [Nashr bin Ali] keduanya berkata; telah menceritakan kepada kami [Sufyan bin Uyainah] dari [Abu Ishaq] seperti hadits di atas dan keduanya berkata; 'Zaid bin Yutsai' serta ini lebih shahih."" Abu 'Isa berkata; ""Syu'bah salah mengucapkan menjadi Zaid bin Utsail.""","حَدَّثَنَا عَلِيُّ بْنُ خَشْرَمٍ أَخْبَرَنَا سُفْيَانُ بْنُ عُيَيْنَةَ عَنْ أَبِي إِسْحَقَ عَنْ زَيْدِ بْنِ أُثَيْعٍ قَالَ
سَأَلْتُ عَلِيًّا بِأَيِّ شَيْءٍ بُعِثْتَ قَالَ بِأَرْبَعٍ لَا يَدْخُلُ الْجَنَّةَ إِلَّا نَفْسٌ مُسْلِمَةٌ وَلَا يَطُوفُ بِالْبَيْتِ عُرْيَانٌ وَلَا يَجْتَمِعُ الْمُسْلِمُونَ وَالْمُشْرِكُونَ بَعْدَ عَامِهِمْ هَذَا وَمَنْ كَانَ بَيْنَهُ وَبَيْنَ النَّبِيِّ صَلَّى اللَّهُ عَلَيْهِ وَسَلَّمَ عَهْدٌ فَعَهْدُهُ إِلَى مُدَّتِهِ وَمَنْ لَا مُدَّةَ لَهُ فَأَرْبَعَةُ أَشْهُرٍ
قَالَ وَفِي الْبَاب عَنْ أَبِي هُرَيْرَةَ قَالَ أَبُو عِيسَى حَدِيثُ عَلِيٍّ حَدِيثٌ حَسَنٌ حَدَّثَنَا ابْنُ أَبِي عُمَرَ وَنَصْرُ بْنُ عَلِيٍّ قَالَا حَدَّثَنَا سُفْيَانُ بْنُ عُيَيْنَةَ عَنْ أَبِي إِسْحَقَ نَحْوَهُ وَقَالَا زَيْدُ بْنُ يُثَيْعٍ وَهَذَا أَصَحُّ قَالَ أَبُو عِيسَى وَشُعْبَةُ وَهِمَ فِيهِ فَقَالَ زَيْدُ بْنُ أُثَيْلٍ",21
1230,11,"Telah menceritakan kepada kami [Ibrahim bin Abdullah Al Harawi] ia berkata; Telah menceritakan kepada kami [Husyaim] ia berkata; Telah menceritakan kepada kami [Yunus bin Ubaid] dari [Nafi'] dari [Ibnu Umar] dari Nabi shallallahu 'alaihi wasallam, beliau bersabda: ""Penundaan orang kaya dalam membayar hutang adalah kezhaliman, jika hutangmu dipindahkan kepada orang kaya maka ikutilah ia dan tidak ada dua akad dalam satu (transaksi) penjualan."" Abu Isa berkata; Hadits Abu Hurairah adalah hadits hasan shahih, maknanya adalah jika seseorang dari kalian hutangnya dipindahkan (hiwalah) kepada orang kaya, hendaklah ia menerimanya. Sebagian ulama mengatakan; Jika seseorang hutangnya dipindahkan kepada orang kaya, lalu ia memindahkannya maka orang yang memindahkan telah berlepas diri dan tidak ada kewajiban baginya untuk kembali kepada orang yang memindahkan. Ini adalah pendapat Asy Syafi'i, Ahmad dan Ishaq. Sedangkan sebagian ulama berpendapat jika harta hilang maka hal ini merupakan resiko kebangkrutan orang yang dipindahkan hutang atasnya, ia berhak mengembalikan kepada orang pertama. Mereka berhujjah dengan perkataan Utsman dan selainnya ketika mereka berkata; Tidak ada hak terhadap harta seorang muslim yang hilang. Ishaq berkata; Makna hadits ini; Tidak ada hak terhadap harta seorang muslim yang hilang, adalah jika hutang dipindahkan kepada seseorang atas orang lain. Ia juga berpendapat bahwa seseorang itu adalah orang kay, namun jika ia adalah orang tidak punya harta maka tidak ada hak mengembalikan harta orang muslim yang hilang.","حَدَّثَنَا إِبْرَاهِيمُ بْنُ عَبْدِ اللَّهِ الْهَرَوِيُّ قَالَ حَدَّثَنَا هُشَيْمٌ قَالَ حَدَّثَنَا يُونُسُ بْنُ عُبَيْدٍ عَنْ نَافِعٍ عَنْ ابْنِ عُمَرَ
عَنْ النَّبِيِّ صَلَّى اللَّهُ عَلَيْهِ وَسَلَّمَ قَالَ مَطْلُ الْغَنِيِّ ظُلْمٌ وَإِذَا أُحِلْتَ عَلَى مَلِيءٍ فَاتْبَعْهُ وَلَا تَبِعْ بَيْعَتَيْنِ فِي بَيْعَةٍ
قَالَ أَبُو عِيسَى حَدِيثُ أَبِي هُرَيْرَةَ حَدِيثٌ حَسَنٌ صَحِيحٌ وَمَعْنَاهُ إِذَا أُحِيلَ أَحَدُكُمْ عَلَى مَلِيٍّ فَلْيَتْبَعْ فَقَالَ بَعْضُ أَهْلِ الْعِلْمِ إِذَا أُحِيلَ الرَّجُلُ عَلَى مَلِيءٍ فَاحْتَالَهُ فَقَدْ بَرِئَ الْمُحِيلُ وَلَيْسَ لَهُ أَنْ يَرْجِعَ عَلَى الْمُحِيلِ وَهُوَ قَوْلُ الشَّافِعِيِّ وَأَحْمَدَ وَإِسْحَقَ و قَالَ بَعْضُ أَهْلِ الْعِلْمِ إِذَا تَوِيَ مَالُ هَذَا بِإِفْلَاسِ الْمُحَالِ عَلَيْهِ فَلَهُ أَنْ يَرْجِعَ عَلَى الْأَوَّلِ وَاحْتَجُّوا بِقَوْلِ عُثْمَانَ وَغَيْرِهِ حِينَ قَالُوا لَيْسَ عَلَى مَالِ مُسْلِمٍ تَوًى قَالَ إِسْحَقُ مَعْنَى هَذَا الْحَدِيثِ لَيْسَ عَلَى مَالِ مُسْلِمٍ تَوِيَ هَذَا إِذَا أُحِيلَ الرَّجُلُ عَلَى آخَرَ وَهُوَ يَرَى أَنَّهُ مَلِيٌّ فَإِذَا هُوَ مُعْدِمٌ فَلَيْسَ عَلَى مَالِ مُسْلِمٍ تَوًى",21
2044,30,"Telah menceritakan kepada kami [Ibnu Abu 'Umar]; telah menceritakan kepada kami [Sufyan] dari [Ayyub] dari [Nafi'] dari [Ibnu 'Umar] dia berkata; Nabi shallallahu 'alaihi wasallam bersabda: ""Tidak ada hak bagi seorang muslim untuk bermalam selama dua hari, sementara ia memiliki harta yang harus ia wasiatkan, kecuali wasiatnya itu telah tertulis di sisinya."" Abu Isa berkata; Ini adalah hadits Hasan Shahih. Dan telah diriwayatkan pula dari [Az Zuhri] dari [Salim] dari [Ibnu 'Umar] dari Nabi shallallahu 'alaihi wasallam dengan hadits semisalnya.","حَدَّثَنَا ابْنُ أَبِي عُمَرَ حَدَّثَنَا سُفْيَانُ عَنْ أَيُّوبَ عَنْ نَافِعٍ عَنْ ابْنِ عُمَرَ قَالَ
قَالَ النَّبِيُّ صَلَّى اللَّهُ عَلَيْهِ وَسَلَّمَ مَا حَقُّ امْرِئٍ مُسْلِمٍ يَبِيتُ لَيْلَتَيْنِ وَلَهُ مَا يُوصِي فِيهِ إِلَّا وَوَصِيَّتُهُ مَكْتُوبَةٌ عِنْدَهُ
قَالَ أَبُو عِيسَى هَذَا حَدِيثٌ حَسَنٌ صَحِيحٌ وَقَدْ رُوِيَ عَنْ الزُّهْرِيِّ عَنْ سَالِمٍ عَنْ ابْنِ عُمَرَ عَنْ النَّبِيِّ صَلَّى اللَّهُ عَلَيْهِ وَسَلَّمَ نَحْوَهُ",21
2045,30,"Telah menceritakan kepada kami [Ahmad bin Mani']; telah menceritakan kepada kami [Abu Qathan 'Amr bin Al Haitsam Al Baghdadi]; telah menceritakan kepada kami [Malik bin Mighwal] dari [Thalhah bin Musharrif] dia berkata; Aku pernah bertanya kepada [Ibnu Abu Aufa], ""Apakah Rasulullah shallallahu 'alaihi wasallam berwasiat (terkait dengan hartanya)?"" Ia menjawab, ""Tidak."" Kemudian aku bertanya lagi, ""Lalu, kenapa wasiat diwajibkan. Dan kenapa pula beliau memerintahkan orang-orang untuk menunaikannya?"" Ia menjawab, ""Beliau telah berwasiat dengan kitab Allah."" Abu Isa berkata; Ini adalah hadits Hasan Shahih Gharib. Kami tidak mengetahuinya kecuali dari haditsnya Malik bin Mighwal.","حَدَّثَنَا أَحْمَدُ بْنُ مَنِيعٍ حَدَّثَنَا أَبُو قَطَنٍ عَمْرُو بْنُ الْهَيْثَمِ الْبَغْدَادِيُّ حَدَّثَنَا مَالِكُ بْنُ مِغْوَلٍ عَنْ طَلْحَةَ بْنِ مُصَرِّفٍ قَالَ قُلْتُ لِابْنِ أَبِي أَوْفَى
أَوْصَى رَسُولُ اللَّهِ صَلَّى اللَّهُ عَلَيْهِ وَسَلَّمَ قَالَ لَا قُلْتُ كَيْفَ كُتِبَتْ الْوَصِيَّةُ وَكَيْفَ أَمَرَ النَّاسَ قَالَ أَوْصَى بِكِتَابِ اللَّهِ
قَالَ أَبُو عِيسَى هَذَا حَدِيثٌ حَسَنٌ صَحِيحٌ غَرِيبٌ لَا نَعْرِفُهُ إِلَّا مِنْ حَدِيثِ مَالِكِ بْنِ مِغْوَلٍ",21
3654,49,"Telah menceritakan kepada kami [Yusuf bin Musa Al Qatthan Al Baghdadi] telah menceritakan kepada kami [Ali bin Qadim] telah menceritakan kepada kami [Ali bin Shalih bin Hayyi] dari [Hakim bin Jubair] dari [Jumai' bin 'Umair At Taimi] dari [Ibnu Umar] dia berkata; ""Rasulullah shallallahu 'alaihi wasallam mempersaudarakan antara para sahabatnya, tiba-tiba Ali datang dengan meneteskan air mata sambil berkata; ""Wahai Rasulullah, anda telah mempersaudarakan antara para sahabat anda, namun anda tidak mempersaudarakan antara aku dengan yang lain."" Maka Rasulullah shallallahu 'alaihi wasallam bersabda kepadanya: ""Kamu adalah saudaraku di dunia dan Akhirat."" Abu Isa berkata; ""Hadits ini adalah hadits hasan gharib, dan dalam bab ini juga ada riwayat dari Zaid bin Abu Aufa."" ","حَدَّثَنَا يُوسُفُ بْنُ مُوسَى الْقَطَّانُ الْبَغْدَادِيُّ حَدَّثَنَا عَلِيُّ بْنُ قَادِمٍ حَدَّثَنَا عَلِيُّ بْنُ صَالِحِ بْنِ حَيٍّ عَنْ حَكِيمِ بْنِ جُبَيْرٍ عَنْ جُمَيْعِ بْنِ عُمَيْرٍ التَّيْمِيِّ عَنْ ابْنِ عُمَرَ قَالَ
آخَى رَسُولُ اللَّهِ صَلَّى اللَّهُ عَلَيْهِ وَسَلَّمَ بَيْنَ أَصْحَابِهِ فَجَاءَ عَلِيٌّ تَدْمَعُ عَيْنَاهُ فَقَالَ يَا رَسُولَ اللَّهِ آخَيْتَ بَيْنَ أَصْحَابِكَ وَلَمْ تُؤَاخِ بَيْنِي وَبَيْنَ أَحَدٍ فَقَالَ لَهُ رَسُولُ اللَّهِ صَلَّى اللَّهُ عَلَيْهِ وَسَلَّمَ أَنْتَ أَخِي فِي الدُّنْيَا وَالْآخِرَةِ
قَالَ أَبُو عِيسَى هَذَا حَدِيثٌ حَسَنٌ غَرِيبٌ وَفِي الْبَاب عَنْ زَيْدِ بْنِ أَبِي أَوْفَى",21
