haditsId,kitabId,indo,arab,label
407,2,"Telah menceritakan kepada kami [Qutaibah] telah menceritakan kepada kami [Abu 'Awanah] dari [Qatadah] dari [Zurarah bin Aufa] dari [Sa'id bin Hisyam] dari ['Aisyah] dia berkata, adalah Nabi shallallahu 'alaihi wasallam jika tidak sempat shalat malam karena ketiduran atau terserang kantuk, beliau shalat disiang hari sebanyak dua belas raka'at. Abu Isa berkata, ini adalah hadits hasan shahih. Berkata Abu Isa, Sa'ad bin Hisyam, dia adalah Ibnu 'Amir Al Anshari dan Hisyam bin 'Amir, dia merupakan salah satu dari sahabat Nabi shallallahu 'alaihi wasallam telah menceritakan kepada kami 'Abbas dia adalah Ibnu 'Abdul 'Azhim Al 'Anbari, telah menceritakan kepada kami 'Attab bin Mutsanna dari Bahs bin Hakim dia berkata, bahwa Zurarah bin Aufa seorang qadli di Bashrah pernah menjadi imam bagi Bani Qusyair, suatu hari pada saat shalat subuh dia membaca ayat FAIDZAA NUQIRA FIN NAAQUUR FADZAALIKA YAUMAIDZIN YAUMUN 'ASIIR (Apabila ditiup sangkakala, maka waktu itu adalah waktu (datangnya) hari yang sulit). Dia terjatuh dan pingsan, sedangkan saya adalah orang yang membawa kerumahnya.","حَدَّثَنَا قُتَيْبَةُ حَدَّثَنَا أَبُو عَوَانَةَ عَنْ قَتَادَةَ عَنْ زُرَارَةَ بْنِ أَوْفَى عَنْ سَعْدِ بْنِ هِشَامٍ عَنْ عَائِشَةَ قَالَتْ
كَانَ النَّبِيُّ صَلَّى اللَّهُ عَلَيْهِ وَسَلَّمَ إِذَا لَمْ يُصَلِّ مِنْ اللَّيْلِ مَنَعَهُ مِنْ ذَلِكَ النَّوْمُ أَوْ غَلَبَتْهُ عَيْنَاهُ صَلَّى مِنْ النَّهَارِ ثِنْتَيْ عَشْرَةَ رَكْعَةً
قَالَ أَبُو عِيسَى هَذَا حَدِيثٌ حَسَنٌ صَحِيحٌ قَالَ أَبُو عِيسَى وَسَعْدُ بْنُ هِشَامٍ هُوَ ابْنُ عَامِرٍ الْأَنْصَارِيُّ وَهِشَامُ بْنُ عَامِرٍ هُوَ مِنْ أَصْحَابِ النَّبِيِّ صَلَّى اللَّهُ عَلَيْهِ وَسَلَّمَ حَدَّثَنَا عَبَّاسٌ هُوَ ابْنُ عَبْدِ الْعَظِيمِ الْعَنْبَرِيُّ حَدَّثَنَا عَتَّابُ بْنُ الْمُثَنَّى عَنْ بَهْزِ بْنِ حَكِيمٍ قَالَ كَانَ زُرَارَةُ بْنُ أَوْفَى قَاضِيَ الْبَصْرَةِ وَكَانَ يَؤُمُّ فِي بَنِي قُشَيْرٍ فَقَرَأَ يَوْمًا فِي صَلَاةِ الصُّبْحِ
{ فَإِذَا نُقِرَ فِي النَّاقُورِ فَذَلِكَ يَوْمَئِذٍ يَوْمٌ عَسِيرٌ }
خَرَّ مَيِّتًا فَكُنْتُ فِيمَنْ احْتَمَلَهُ إِلَى دَارِهِ",58
421,2,"Telah menceritakan kepada kami [Ishaq bin Manshur Al Kausaj] telah menceritakan kepada kami [Abdullah bin Numair] telah menceritakan kepada kami [Hisyam bin 'Urwah] dari [ayahnya] dari ['Aisyah] dia berkata, bahwa shalat malamnya Nabi Shallahu 'alaihi wa sallam sebanyak tiga belas raka'at termasuk witir sebanyak lima raka'at, beliau tidak duduk kecuali diakhir raka'atnya, jika seorang mu'adzin mengumandangkan adzan, beliau melanjutkan shalat dua raka'at dengan ringan. (perawi) berkata, dalam bab ini (ada juga riwayat -pent) dari Abu Ayub. Abu Isa berkata, haditsnya 'Aisyah adalah hadits hasan shahih, sebagian ulama telah meriwayatkan dari para sahabat Nabi Shallahu 'alaihi wa sallam dan yang lainnya bahwa beliau mengerjakan shalat witir sebanyak lima raka'at, mereka berkata, beliau tidak duduk kecuali setelah raka'at yang terakhir. Ani Isa berkata, saya bertanya kepada Abu Mush'ab Al Madini mengenai hadits ini bahwa Nabi Shallahu 'alaihi wa sallam mengerjakan witir sebanyak sembilan dan tujuh raka'at. Saya bertanya, bagaiman beliau mengerjakan shalat witir sebanyak sembilan dan tujuh raka'at? Dia menjawab, beliau shalat dua raka'at-dua raka'at, kemudian beliau salam dan witir satu raka'at.","حَدَّثَنَا إِسْحَقُ بْنُ مَنْصُورٍ الْكَوْسَجُ حَدَّثَنَا عَبْدُ اللَّهِ بْنُ نُمَيْرٍ حَدَّثَنَا هِشَامُ بْنُ عُرْوَةَ عَنْ أَبِيهِ عَنْ عَائِشَةَ قَالَتْ
كَانَتْ صَلَاةُ النَّبِيِّ صَلَّى اللَّهُ عَلَيْهِ وَسَلَّمَ مِنْ اللَّيْلِ ثَلَاثَ عَشْرَةَ رَكْعَةً يُوتِرُ مِنْ ذَلِكَ بِخَمْسٍ لَا يَجْلِسُ فِي شَيْءٍ مِنْهُنَّ إِلَّا فِي آخِرِهِنَّ فَإِذَا أَذَّنَ الْمُؤَذِّنُ قَامَ فَصَلَّى رَكْعَتَيْنِ خَفِيفَتَيْنِ
قَالَ وَفِي الْبَاب عَنْ أَبِي أَيُّوبَ قَالَ أَبُو عِيسَى حَدِيثُ عَائِشَةَ حَدِيثٌ حَسَنٌ صَحِيحٌ وَقَدْ رَأَى بَعْضُ أَهْلِ الْعِلْمِ مِنْ أَصْحَابِ النَّبِيِّ صَلَّى اللَّهُ عَلَيْهِ وَسَلَّمَ وَغَيْرِهِمْ الْوِتْرَ بِخَمْسٍ وَقَالُوا لَا يَجْلِسُ فِي شَيْءٍ مِنْهُنَّ إِلَّا فِي آخِرِهِنَّ قَالَ أَبُو عِيسَى وَسَأَلْتُ أَبَا مُصْعَبٍ الْمَدِينِيَّ عَنْ هَذَا الْحَدِيثِ كَانَ النَّبِيُّ صَلَّى اللَّهُ عَلَيْهِ وَسَلَّمَ يُوتِرُ بِالتِّسْعِ وَالسَّبْعِ قُلْتُ كَيْفَ يُوتِرُ بِالتِّسْعِ وَالسَّبْعِ قَالَ يُصَلِّي مَثْنَى مَثْنَى وَيُسَلِّمُ وَيُوتِرُ بِوَاحِدَةٍ",58
423,2,"Telah menceritakan kepada kami [Qutaibah] telah menceritakan kepada kami [Hammad bin Zaid] dari [Anas bin Sirin] dia berkata, saya bertanya kepada [Ibnu Umar] seraya berkata, saya memanjangkan dalam dua raka'at shalat fajar, maka dia berkata, adalah Rasulullah Shallahu 'alaihi wa sallam mengerjakan shalat malam dua raka'at-dua raka'at, lalu witir satu raka'at, beliau mengerjakan sunnah (fajar) dua raka'at dengan ringan (cepat) seakan-akan telah terdengar adzan ditelinganya. (perawi) berkata, dalam bab ini (ada juga riwayat -pent) dari 'Aisyah, Jabir, Fadll bin 'Abbas, Abu Ayyub dan Ibnu Abbas. Abu Isa berkata, haditsnya Ibnu Umar adalah hadits hasan shahih. Hadits ini juga diamalkan oleh sebagian ahli ilmu dari kalangan para sahabat Nabi Shallahu 'alaihi wa sallam dan para tabi'in, mereka berpendapat, hendaknya seseorang memisahkan antara raka'at kedua dan raka'at ketiga dengan witir satu raka'at, dengannya pula Malik, Syafi'i, Ahmad dan Ishaq berkata.","حَدَّثَنَا قُتَيْبَةُ حَدَّثَنَا حَمَّادُ بْنُ زَيْدٍ عَنْ أَنَسِ بْنِ سِيرِينَ قَالَ
سَأَلْتُ ابْنَ عُمَرَ فَقُلْتُ أُطِيلُ فِي رَكْعَتَيْ الْفَجْرِ فَقَالَ كَانَ النَّبِيُّ صَلَّى اللَّهُ عَلَيْهِ وَسَلَّمَ يُصَلِّي مِنْ اللَّيْلِ مَثْنَى مَثْنَى وَيُوتِرُ بِرَكْعَةٍ وَكَانَ يُصَلِّي الرَّكْعَتَيْنِ وَالْأَذَانُ فِي أُذُنِهِ يَعْنِي يُخَفِّفُ
قَالَ وَفِي الْبَاب عَنْ عَائِشَةَ وَجَابِرٍ وَالْفَضْلِ بْنِ عَبَّاسٍ وَأَبِي أَيُّوبَ وَابْنِ عَبَّاسٍ قَالَ أَبُو عِيسَى حَدِيثُ ابْنِ عُمَرَ حَدِيثٌ حَسَنٌ صَحِيحٌ وَالْعَمَلُ عَلَى هَذَا عِنْدَ بَعْضِ أَهْلِ الْعِلْمِ مِنْ أَصْحَابِ النَّبِيِّ صَلَّى اللَّهُ عَلَيْهِ وَسَلَّمَ وَالتَّابِعِينَ رَأَوْا أَنْ يَفْصِلَ الرَّجُلُ بَيْنَ الرَّكْعَتَيْنِ وَالثَّالِثَةِ يُوتِرُ بِرَكْعَةٍ وَبِهِ يَقُولُ مَالِكٌ وَالشَّافِعِيُّ وَأَحْمَدُ وَإِسْحَقُ",58
426,2,"Telah menceritakan kepada kami [Qutaibah] telah menceritakan kepada kami [Abu Al Ahwash] dari [Abu Ishaq] dari [Buraid bin Abu Maryam] dari [Abu Al Khaura' As Sa'di] dia berkata, [Al Hasan bin Ali] radliallahu 'anhuma berkata, Rasulullah Shallahu 'alaihi wa sallam mengajariku beberapa kalimat yang saya ucapkan dalam shalat witir, yaitu ALLAHUMMAHDINI FIIMAN HADAIT, WA'AAFINI FIIMAN 'AFAIT, WATAWALLANII FIIMAN TAWALLAIT, WABAARIK LII FIIMA A'THAIT, WAQINII SYARRAMA QADLAIT, FAINNAKA TAQDLI WALAA YUQDLA 'ALAIK, WAINNAHU LAA YADZILLU MAN WAALAIT, TABAARAKTA RABBANA WATA'AALAIT. (perawi) berkata, dalam bab ini (ada juga riwayat -pent) dari Ali. Abu Isa berkata, ini adalah hadits hasan, kami tidak mengetahui (jalur periwayatannya) selain dari jalur ini, dari hadits Abu Al Khaura' As Sa'di dan namanya adalah Rabi'ah bin Syaiban, kami juga tidak mengetahui dari Nabi Shallahu 'alaihi wa sallam sesuatupun dari qunut witir yang lebih bagus dari ini. Para ulama berbeda-beda mengenai masalah qunut witir, Abdullah bin Mas'ud berpendapat qunut witir dikerjakan disetiap tahunnya, sebagian ulama memilih untuk mengerjakan qunut sebelum ruku' diantaranya adalah perkataan Sufyan At Tsauri, Ibnu Mubarak, Ishaq dan penduduk Kufah. Telah diriwayatkan dari Ali bin Abu Thalib bahwa dia tidak melaksanakan qunut melainkan di pertengahan akhir bulan Ramadlan, dan melaksanakan qunut setelah ruku', sebagian para ulam juga berpendapat seperti ini, seperti perkataan Syafi'i dan Ahmad.","حَدَّثَنَا قُتَيْبَةُ حَدَّثَنَا أَبُو الْأَحْوَصِ عَنْ أَبِي إِسْحَقَ عَنْ بُرَيْدِ بْنِ أَبِي مَرْيَمَ عَنْ أَبِي الْحَوْرَاءِ السَّعْدِيِّ قَالَ قَالَ الْحَسَنُ بْنُ عَلِيٍّ رَضِيَ اللَّهُ عَنْهُمَا
عَلَّمَنِي رَسُولُ اللَّهِ صَلَّى اللَّهُ عَلَيْهِ وَسَلَّمَ كَلِمَاتٍ أَقُولُهُنَّ فِي الْوِتْرِ اللَّهُمَّ اهْدِنِي فِيمَنْ هَدَيْتَ وَعَافِنِي فِيمَنْ عَافَيْتَ وَتَوَلَّنِي فِيمَنْ تَوَلَّيْتَ وَبَارِكْ لِي فِيمَا أَعْطَيْتَ وَقِنِي شَرَّ مَا قَضَيْتَ فَإِنَّكَ تَقْضِي وَلَا يُقْضَى عَلَيْكَ وَإِنَّهُ لَا يَذِلُّ مَنْ وَالَيْتَ تَبَارَكْتَ رَبَّنَا وَتَعَالَيْتَ
قَالَ وَفِي الْبَاب عَنْ عَلِيٍّ قَالَ أَبُو عِيسَى هَذَا حَدِيثٌ حَسَنٌ لَا نَعْرِفُهُ إِلَّا مِنْ هَذَا الْوَجْهِ مِنْ حَدِيثِ أَبِي الْحَوْرَاءِ السَّعْدِيِّ وَاسْمُهُ رَبِيعَةُ بْنُ شَيْبَانَ وَلَا نَعْرِفُ عَنْ النَّبِيِّ صَلَّى اللَّهُ عَلَيْهِ وَسَلَّمَ فِي الْقُنُوتِ فِي الْوِتْرِ شَيْئًا أَحْسَنَ مِنْ هَذَا وَاخْتَلَفَ أَهْلُ الْعِلْمِ فِي الْقُنُوتِ فِي الْوِتْرِ فَرَأَى عَبْدُ اللَّهِ بْنُ مَسْعُودٍ الْقُنُوتَ فِي الْوِتْرِ فِي السَّنَةِ كُلِّهَا وَاخْتَارَ الْقُنُوتَ قَبْلَ الرُّكُوعِ وَهُوَ قَوْلُ بَعْضِ أَهْلِ الْعِلْمِ وَبِهِ يَقُولُ سُفْيَانُ الثَّوْرِيُّ وَابْنُ الْمُبَارَكِ وَإِسْحَقُ وَأَهْلُ الْكُوفَةِ وَقَدْ رُوِيَ عَنْ عَلِيِّ بْنِ أَبِي طَالِبٍ أَنَّهُ كَانَ لَا يَقْنُتُ إِلَّا فِي النِّصْفِ الْآخِرِ مِنْ رَمَضَانَ وَكَانَ يَقْنُتُ بَعْدَ الرُّكُوعِ وَقَدْ ذَهَبَ بَعْضُ أَهْلِ الْعِلْمِ إِلَى هَذَا وَبِهِ يَقُولُ الشَّافِعِيُّ وَأَحْمَدُ",58
434,2,"Telah menceritakan kepada kami [Qutaibah] telah menceritakan kepada kami [Malik bin Anas] dari [Abu Bakar bin Umar bin Abdurrahman] dari [Sa'id bin Yasar] dia berkata, saya berjalan bersama [Ibnu Umar] dalam suatu perjalanan, lantas saya menghilang darinya, dia berkata, dimanakah kamu? Saya menjawab, saya melaksanakan shalat witir, maka dia berkata, tidakkah pada diri Rasulullah Shallahu 'alaihi wa sallam terdapat teladan yang baik untukmu? Saya pernah melihat Rasulullah Shallahu 'alaihi wa sallam shalat witir diatas kendaraan. (perawi) berkata, dalam bab ini (ada juga riwayat -pent) dari Ibnu Abbas. Abu Isa berkata, hadits Ibnu Umar adalah hadits hasan shahih, sebagian ulama dari kalangan sahabat Nabi Shallahu 'alaihi wa sallam dan yang lainnya berpendapat atas hadits ini, yaitu hendaknya seseorang mengerjakan shalat witir diatas kendaradliallahu 'anhannya (jika bepergian), ini sebagaimana perkataan Syafi'i, Ahmad dan Ishaq. Sebagian ahli ilmu dari penduduk Kufah berpendapat bahwa hendaknya seseorang tidak melaksanakan shalat witir diatas kendaradliallahu 'anhannya, yaitu hendaknya dia turun dari kendaradliallahu 'anhannya jika ingin melaksanakan shalat witir.","حَدَّثَنَا قُتَيْبَةُ حَدَّثَنَا مَالِكُ بْنُ أَنَسٍ عَنْ أَبِي بَكْرِ بْنِ عُمَرَ بْنِ عَبْدِ الرَّحْمَنِ عَنْ سَعِيدِ بْنِ يَسَارٍ قَالَ
كُنْتُ أَمْشِي مَعَ ابْنِ عُمَرَ فِي سَفَرٍ فَتَخَلَّفْتُ عَنْهُ فَقَالَ أَيْنَ كُنْتَ فَقُلْتُ أَوْتَرْتُ فَقَالَ أَلَيْسَ لَكَ فِي رَسُولِ اللَّهِ أُسْوَةٌ رَأَيْتُ رَسُولَ اللَّهِ صَلَّى اللَّهُ عَلَيْهِ وَسَلَّمَ يُوتِرُ عَلَى رَاحِلَتِهِ
قَالَ وَفِي الْبَاب عَنْ ابْنِ عَبَّاسٍ قَالَ أَبُو عِيسَى حَدِيثُ ابْنِ عُمَرَ حَدِيثٌ حَسَنٌ صَحِيحٌ وَقَدْ ذَهَبَ بَعْضُ أَهْلِ الْعِلْمِ مِنْ أَصْحَابِ النَّبِيِّ صَلَّى اللَّهُ عَلَيْهِ وَسَلَّمَ وَغَيْرِهِمْ إِلَى هَذَا وَرَأَوْا أَنْ يُوتِرَ الرَّجُلُ عَلَى رَاحِلَتِهِ وَبِهِ يَقُولُ الشَّافِعِيُّ وَأَحْمَدُ وَإِسْحَقُ و قَالَ بَعْضُ أَهْلِ الْعِلْمِ لَا يُوتِرُ الرَّجُلُ عَلَى الرَّاحِلَةِ وَإِذَا أَرَادَ أَنْ يُوتِرَ نَزَلَ فَأَوْتَرَ عَلَى الْأَرْضِ وَهُوَ قَوْلُ بَعْضِ أَهْلِ الْكُوفَةِ",58
435,2,"Telah menceritakan kepada kami [Abu Kuraib Muhammad bin Al Ala'] telah menceritakan kepada kami [Yunus bin Bukair] dari [Muhammad bin Ishaq] dia berkata, telah menceritakan kepadaku [Musa bin Fulan bin Anas] dari pamannya yaitu [Tsumamah bin Anas bin Malik] dari [Anas bin Malik] dia berkata, Rasulullah Shallahu 'alaihi wa sallam bersabda: ""Barangsiapa yang melaksanakan shalat dluha dua belas raka'at, niscaya Allah akan membuatkan baginya sebuah istana dari emas di syurga."" (perawi) berkata, dalam bab ini (ada juga riwayat -pent) dari Ummu Hani', Abu Hurairah, Nu'aim bin Hammar, Abu Dzar, 'Aisyah, Abu Umamah, Utbah bin 'Abd As Sulami, Ibnu Abu Aufa, Abu Sa'id, Zaid bin Arqam dan Ibnu Abbas. Abu Isa berkata, hadits Anas adalah hadits gharib, kami tidak mengetahuinya kecuali dari jalur ini.","حَدَّثَنَا أَبُو كُرَيْبٍ مُحَمَّدُ بْنُ الْعَلَاءِ حَدَّثَنَا يُونُسُ بْنُ بُكَيْرٍ عَنْ مُحَمَّدِ بْنِ إِسْحَقَ قَالَ حَدَّثَنِي مُوسَى بْنُ فُلَانِ بْنِ أَنَسٍ عَنْ عَمِّهِ ثُمَامَةَ بْنِ أَنَسِ بْنِ مَالِكٍ عَنْ أَنَسِ بْنِ مَالِكٍ قَالَ
قَالَ رَسُولُ اللَّهِ صَلَّى اللَّهُ عَلَيْهِ وَسَلَّمَ مَنْ صَلَّى الضُّحَى ثِنْتَيْ عَشْرَةَ رَكْعَةً بَنَى اللَّهُ لَهُ قَصْرًا مِنْ ذَهَبٍ فِي الْجَنَّةِ
قَالَ وَفِي الْبَاب عَنْ أُمِّ هَانِئٍ وَأَبِي هُرَيْرَةَ وَنُعَيْمِ بْنِ هَمَّارٍ وَأَبِي ذَرٍّ وَعَائِشَةَ وَأَبِي أُمَامَةَ وَعُتْبَةَ بْنِ عَبْدٍ السُّلَمِيِّ وَابْنِ أَبِي أَوْفَى وَأَبِي سَعِيدٍ وَزَيْدِ بْنِ أَرْقَمَ وَابْنِ عَبَّاسٍ قَالَ أَبُو عِيسَى حَدِيثُ أَنَسٍ حَدِيثٌ غَرِيبٌ لَا نَعْرِفُهُ إِلَّا مِنْ هَذَا الْوَجْهِ",58
439,2,"Telah menceritakan kepada kami [Ziyad bin Ayyub Al Baghdadi] telah menceritakan kepada kami [Muhammad bin Rabi'ah] dari [Fudlail bin Marzuq] dari ['Athiyah Al 'Aufi] dari [Abu Sa'id Al Khudri] dia berkata, Nabi Shallahu 'alaihi wa sallam selalu mengerjakan shalat dluha sampai kami megatakan beliau tidak pernah meninggalkannya, tapi jika beliau meninggalkannya sampai kami mengatakan beliau tidak pernah mengerjakannya. Abu Isa berkata, ini adalah hadits hasan gharib.","حَدَّثَنَا زِيَادُ بْنُ أَيُّوبَ الْبَغْدَادِيُّ حَدَّثَنَا مُحَمَّدُ بْنُ رَبِيعَةَ عَنْ فُضَيْلِ بْنِ مَرْزُوقٍ عَنْ عَطِيَّةَ الْعَوْفِيِّ عَنْ أَبِي سَعِيدٍ الْخُدْرِيِّ قَالَ
كَانَ نَبِيُّ اللَّهِ صَلَّى اللَّهُ عَلَيْهِ وَسَلَّمَ يُصَلِّي الضُّحَى حَتَّى نَقُولَ لَا يَدَعُ وَيَدَعُهَا حَتَّى نَقُولَ لَا يُصَلِّي
قَالَ أَبُو عِيسَى هَذَا حَدِيثٌ حَسَنٌ غَرِيبٌ",58
440,2,"Telah menceritakan kepada kami [Abu Isa Muhmmad bin Al Mutsanna] telah menceritakan kepada kami [Abu Daud At Thayalisi] telah menceritakan kepada kami [Muhammad bin Muslim bin Abu Al Wadldlah dia adalah Abu Sa'id Al Muaddib] dari ['Abdul Karim Al Jazari] dari [Mujahid] dari [Abdullah As Sa'ib] bahwasannya Rasulullah Shallahu 'alaihi wa sallam mengerjakan shalat setelah matahari mulai condong yaitu waktu sebelum dluhur sebanyak empat raka'at, beliau bersabda: ""Sesungguhnya ia merupakan waktu dibukanya pintu-pintu surga dan saya suka jika pada saat itu amalan shalihku diangkat."" (perawi) berkata, dalam bab ini (ada juga riwayat -pent) dari Ali dan Abu Ayyub. Abu Isa berkata, hadits Abdullah bin Sa'ib adalah hadits hasan gharib, dan telah diriwayatkan dari Nabi Shallahu 'alaihi wa sallam bahwasannya beliau shalat empat raka'at setelah matahari tergelinjir, dan beliau tidak salam (dalam empat raka'at tersebut) kecuali di raka'at yang terakhir.","حَدَّثَنَا أَبُو مُوسَى مُحَمَّدُ بْنُ الْمُثَنَّى حَدَّثَنَا أَبُو دَاوُدَ الطَّيَالِسِيُّ حَدَّثَنَا مُحَمَّدُ بْنُ مُسْلِمِ بْنِ أَبِي الْوَضَّاحِ هُوَ أَبُو سَعِيدٍ الْمُؤَدِّبُ عَنْ عَبْدِ الْكَرِيمِ الْجَزَرِيِّ عَنْ مُجَاهِدٍ عَنْ عَبْدِ اللَّهِ بْنِ السَّائِبِ
أَنَّ رَسُولَ اللَّهِ صَلَّى اللَّهُ عَلَيْهِ وَسَلَّمَ كَانَ يُصَلِّي أَرْبَعًا بَعْدَ أَنْ تَزُولَ الشَّمْسُ قَبْلَ الظُّهْرِ وَقَالَ إِنَّهَا سَاعَةٌ تُفْتَحُ فِيهَا أَبْوَابُ السَّمَاءِ وَأُحِبُّ أَنْ يَصْعَدَ لِي فِيهَا عَمَلٌ صَالِحٌ
قَالَ وَفِي الْبَاب عَنْ عَلِيٍّ وَأَبِي أَيُّوبَ قَالَ أَبُو عِيسَى حَدِيثُ عَبْدِ اللَّهِ بْنِ السَّائِبِ حَدِيثٌ حَسَنٌ غَرِيبٌ وَقَدْ رُوِيَ عَنْ النَّبِيِّ صَلَّى اللَّهُ عَلَيْهِ وَسَلَّمَ أَنَّهُ كَانَ يُصَلِّي أَرْبَعَ رَكَعَاتٍ بَعْدَ الزَّوَالِ لَا يُسَلِّمُ إِلَّا فِي آخِرِهِنَّ",58
