haditsId,kitabId,indo,arab,label
398,2,"Telah menceritakan kepada kami [Al Hasan bin Ali Al Hulwani Al Khallal] berkata; telah menceritakan kepada kami [Abdurrazaq] berkata; telah mengabarkan kepada kami [Ma'mar] dari [Ayyub] dari [Nafi'] dari [Ibnu Umar] ia berkata; ""Aku menjaga dari Rasulullah shallallahu 'alaihi wasallam sepuluh rakaat yang selalu beliau laksanakan baik malam maupun siang; dua rakaat sebelum zhuhur, dua rakaat setelahnya, dua rakaat setelah maghrib, dan dua rakaat setelah shalat isya`yang akhir."" Ia berkata; "" [Hafshah] menceritakan kepadaku bahwa beliau melaksanakan shalat dua rakaat sebelum fajar."" Dan ini adalah hadits hasan shahih. Telah menceritakan kepada kami [Al Hasan bin Ali] berkata; telah menceritakan kepada kami [Abdurrazaq] berkata; telah mengabarkan kepada kami [Ma'mar] dari [Az Zuhri] dari [Salim] dari [Ibnu Umar] dari Nabi shallallahu 'alaihi wasallam sebagaimana hadits tersebut.","حَدَّثَنَا الْحَسَنُ بْنُ عَلِيٍّ الْحُلْوَانِيُّ الْخَلَّالُ حَدَّثَنَا عَبْدُ الرَّزَّاقِ أَخْبَرَنَا مَعْمَرٌ عَنْ أَيُّوبَ عَنْ نَافِعٍ عَنْ ابْنِ عُمَرَ قَالَ
حَفِظْتُ عَنْ رَسُولِ اللَّهِ صَلَّى اللَّهُ عَلَيْهِ وَسَلَّمَ عَشْرَ رَكَعَاتٍ كَانَ يُصَلِّيهَا بِاللَّيْلِ وَالنَّهَارِ رَكْعَتَيْنِ قَبْلَ الظُّهْرِ وَرَكْعَتَيْنِ بَعْدَهَا وَرَكْعَتَيْنِ بَعْدَ الْمَغْرِبِ وَرَكْعَتَيْنِ بَعْدَ الْعِشَاءِ الْآخِرَةِ
قَالَ وَحَدَّثَتْنِي حَفْصَةُ أَنَّهُ كَانَ يُصَلِّي قَبْلَ الْفَجْرِ رَكْعَتَيْنِ هَذَا حَدِيثٌ حَسَنٌ صَحِيحٌ حَدَّثَنَا الْحَسَنُ بْنُ عَلِيٍّ حَدَّثَنَا عَبْدُ الرَّزَّاقِ أَخْبَرَنَا مَعْمَرٌ عَنْ الزُّهْرِيِّ عَنْ سَالِمٍ عَنْ ابْنِ عُمَرَ عَنْ النَّبِيِّ صَلَّى اللَّهُ عَلَيْهِ وَسَلَّمَ مِثْلَهُ قَالَ أَبُو عِيسَى هَذَا حَدِيثٌ حَسَنٌ صَحِيحٌ",8
399,2,"Telah menceritakan kepada kami [Abu Kuraib] -yaitu Muhammad bin Al 'Ala` Al Hamdani berkata; telah menceritakan kepada kami [Zaid bin Al Hubab] berkata; telah menceritakan kepada kami [Umar bin Abu Khats'am] dari [Yahya bin Abu katsir] dari [Abu Salamah] dari [Abu Hurairah] ia berkata; ""Rasulullah shallallahu 'alaihi wasallam bersabda: ""Barangsiapa melaksanakan shalat enam rakaat setelah maghrib, kemudian ia tidak berbicara buruk di antara shalat tersebut, maka akan dihitung baginya dengan ibadah selama dua belas tahun."" Abu Isa berkata; ""Diriwayatkan dari 'Aisyah, dari Nabi shallallahu 'alaihi wasallam, bahwa beliau bersabda: ""Barangsiapa shalat dua puluh rakaat setelah maghrib, maka Allah akan membangunkan baginya sebuah rumah di surga."" Abu Isa berkata; ""Hadits Abu Hurairah ini derajatnya gharib, kami tidak mengetahuinya kecuali dari hadits Zaid bin Al Hubab, dari Umar bin Khats'am."" Ia berkata; ""Aku mendengar Muhammad bin Isma'il mengatakan, bahwa Umar bin Abdullah bin Abu Khats'am adalah seorang munkarul hadits, dan Muhammad bin Isma'il sangat melemahkannya.""","حَدَّثَنَا أَبُو كُرَيْبٍ يَعْنِي مُحَمَّدَ بْنَ الْعَلَاءِ الْهَمْدَانِيَّ حَدَّثَنَا زَيْدُ بْنُ الْحُبَابِ حَدَّثَنَا عُمَرُ بْنُ أَبِي خَثْعَمٍ عَنْ يَحْيَى بْنِ أَبِي كَثِيرٍ عَنْ أَبِي سَلَمَةَ عَنْ أَبِي هُرَيْرَةَ قَالَ
قَالَ رَسُولُ اللَّهِ صَلَّى اللَّهُ عَلَيْهِ وَسَلَّمَ مَنْ صَلَّى بَعْدَ الْمَغْرِبِ سِتَّ رَكَعَاتٍ لَمْ يَتَكَلَّمْ فِيمَا بَيْنَهُنَّ بِسُوءٍ عُدِلْنَ لَهُ بِعِبَادَةِ ثِنْتَيْ عَشْرَةَ سَنَةً
قَالَ أَبُو عِيسَى وَقَدْ رُوِيَ عَنْ عَائِشَةَ عَنْ النَّبِيِّ صَلَّى اللَّهُ عَلَيْهِ وَسَلَّمَ قَالَ مَنْ صَلَّى بَعْدَ الْمَغْرِبِ عِشْرِينَ رَكْعَةً بَنَى اللَّهُ لَهُ بَيْتًا فِي الْجَنَّةِ قَالَ أَبُو عِيسَى حَدِيثُ أَبِي هُرَيْرَةَ حَدِيثٌ غَرِيبٌ لَا نَعْرِفُهُ إِلَّا مِنْ حَدِيثِ زَيْدِ بْنِ الْحُبَابِ عَنْ عُمَرَ بْنِ أَبِي خَثْعَمٍ قَالَ و سَمِعْت مُحَمَّدَ بْنَ إِسْمَعِيلَ يَقُولُ عُمَرُ بْنُ عَبْدِ اللَّهِ بْنِ أَبِي خَثْعَمٍ مُنْكَرُ الْحَدِيثِ وَضَعَّفَهُ جِدًّا",8
400,2,"Telah menceritakan kepada kami [Abu Salamah Yahya bin Khalaf] berkata; telah menceritakan kepada kami [Bisyr bin Al Mufadldlal] dari [Khalid Al Hadzdza`] dari [Abdullah bin Syaqiq] berkata; ""Aku pernah bertanya ['Aisyah] tentang shalat Rasulullah shallallahu 'alaihi wasallam, maka ia pun menjawab, ""Beliau biasa shalat dua rakaat sebelum zhuhur, dua rakaat setelahnya, dua rakaat setelah maghrib, dua rakaat setelah isya dan dua rakaat sebelum subuh."" Ia berkata; ""Dalam bab ini juga ada riwayat dari Ali dan Ibnu Umar."" Abu Isa berkata; ""Hadits Abdullah bin Syaqiq, dari 'Aisyah derajatnya hasan shahih.""","حَدَّثَنَا أَبُو سَلَمَةَ يَحْيَى بْنُ خَلَفٍ حَدَّثَنَا بِشْرُ بْنُ الْمُفَضَّلِ عَنْ خَالِدٍ الْحَذَّاءِ عَنْ عَبْدِ اللَّهِ بْنِ شَقِيقٍ قَالَ سَأَلْتُ عَائِشَةَ عَنْ صَلَاةِ رَسُولِ اللَّهِ صَلَّى اللَّهُ عَلَيْهِ وَسَلَّمَ فَقَالَتْ
كَانَ يُصَلِّي قَبْلَ الظُّهْرِ رَكْعَتَيْنِ وَبَعْدَهَا رَكْعَتَيْنِ وَبَعْدَ الْمَغْرِبِ ثِنْتَيْنِ وَبَعْدَ الْعِشَاءِ رَكْعَتَيْنِ وَقَبْلَ الْفَجْرِ ثِنْتَيْنِ
قَالَ وَفِي الْبَاب عَنْ عَلِيٍّ وَابْنِ عُمَرَ قَالَ أَبُو عِيسَى حَدِيثُ عَبْدِ اللَّهِ بْنِ شَقِيقٍ عَنْ عَائِشَةَ حَدِيثٌ حَسَنٌ صَحِيحٌ",8
431,2,"Telah menceritakan kepada kami [Mahmud bin Ghailan] telah menceritakan kepada kami [Abdurrazaq] telah mengabarkan kepada kami [Ibnu Juraij] dari [Sulaiman bin Musa] dari [Nafi'] dari [Ibnu Umar] dari Nabi Shallahu 'alaihi wa sallam beliau bersabda: ""Jika fajar telah terbit, dan telah habis waktu untuk mengerjakan shalat malam serta shalat witir, maka kerjakanlah shalat witir sebelum terbitnya fajar (matahari)."" Abu Isa dan Sulaiman bin Musa berkata, lafalz hadits ini riwayatnya sendiri (tidak ada yang lain) dan telah diriwayatkan dari Nabi Shallahu 'alaihi wa sallam bahwa beliau bersabda: ""Tidak ada witir setelah shalat subuh."" ini adalah perkataan kebanyakan para ulama, sebagaimana perkataan Syafi'i, Ahmad dan Ishaq, mereka berpendapat bahwa tidak ada witir setelah shalat shubuh.","حَدَّثَنَا مَحْمُودُ بْنُ غَيْلَانَ حَدَّثَنَا عَبْدُ الرَّزَّاقِ أَخْبَرَنَا ابْنُ جُرَيْجٍ عَنْ سُلَيْمَانَ بْنِ مُوسَى عَنْ نَافِعٍ عَنْ ابْنِ عُمَرَ
عَنْ النَّبِيِّ صَلَّى اللَّهُ عَلَيْهِ وَسَلَّمَ قَالَ إِذَا طَلَعَ الْفَجْرُ فَقَدْ ذَهَبَ كُلُّ صَلَاةِ اللَّيْلِ وَالْوِتْرُ فَأَوْتِرُوا قَبْلَ طُلُوعِ الْفَجْرِ
قَالَ أَبُو عِيسَى وَسُلَيْمَانُ بْنُ مُوسَى قَدْ تَفَرَّدَ بِهِ عَلَى هَذَا اللَّفْظِ وَرُوِي عَنْ النَّبِيِّ صَلَّى اللَّهُ عَلَيْهِ وَسَلَّمَ أَنَّهُ قَالَ لَا وِتْرَ بَعْدَ صَلَاةِ الصُّبْحِ وَهُوَ قَوْلُ غَيْرِ وَاحِدٍ مِنْ أَهْلِ الْعِلْمِ وَبِهِ يَقُولُ الشَّافِعِيُّ وَأَحْمَدُ وَإِسْحَقُ لَا يَرَوْنَ الْوِتْرَ بَعْدَ صَلَاةِ الصُّبْحِ",8
544,3,"Telah menceritakan kepada kami [Mahmud bin Ghailan] telah menceritakan kepada kami [Wahb bin Jarir] telah menceritakan kepada kami [Syu'bah] dari [Abu Ishaq] dari ['Ashim bin Dlamrah] dia berkata, kami bertanya kepada [Ali] tentang shalatnya Rasulullah Sallallahu 'alaihi wasallam pada siang hari?, dia menjawab, sungguh kalian tidak sanggup untuk melakukannya, kami bertanya, lantas siapa diantara kami yang sanggup melakukannya? Dia menjawab, adalah Rasulullah Sallallahu 'alaihi wasallam apabila matahari terbit dari timur seperti waktu terbenamnya di waktu ashar beliau shalat dua raka'at, dan apabila matahari terbit dari timur pada waktu zhuhur shalat empat raka'at kemudian shalat empat raka'at sebelum shalat zhuhur, setelahnya dua raka'at kemudian shalat empat raka'at sebelum ashar, setiap selesai dua raka'at senantiasa mengucapkan salam kepada para malaikat muqarrabin, para Nabi dan mursalin dan siapa saja yang menempuh jalan mereka dari kaum mukminin dan muslimin. Telah menceritakan kepada kami [Muhammad bin Al Mutsanna] telah menceritakan kepada kami [Muhammad bin Ja'far] telah menceritakan kepada kami [Syu'bah] dari [Abi Ishaq] dari ['Ashim bin Dlamrah] dari [Ali] dari Nabi Sallallahu 'alaihi wasallam seperti hadits di atas. Abu 'Isa berkata, ini adalah hadits hasan. Ishaq bin Ibrahim berkata, ini adalah sebaik-baik hadits yang berbicara tentang tathawwu'nya (shalat sunnah) Nabi Sallallahu 'alaihi wasallam pada waktu siang. Diriwayatkan dari Abdullah bin Mubarak, bahwasanya beliau melemahkan hadits ini, hal itu dikarenakan -wallahu 'alam- karena hadits ini hanya diriwayatkan melalui jalur ini saja yaitu dari 'Ashim bin Dlamrah dari Ali, padahal 'Ashim bin Dlamrah seorang yang tsiqah menurut sebagian ahlul ilmu. Ali bin Al Madini berkata, Yahya bin Sa'id Al Qaththan berkata, Sufyan berkata, kami mengetahui hadits 'Ashim bin Dlamrah lebih utama dari hadits Harits.","حَدَّثَنَا مَحْمُودُ بْنُ غَيْلَانَ حَدَّثَنَا وَهْبُ بْنُ جَرِيرٍ حَدَّثَنَا شُعْبَةُ عَنْ أَبِي إِسْحَقَ عَنْ عَاصِمِ بْنِ ضَمْرَةَ قَالَ
سَأَلْنَا عَلِيًّا عَنْ صَلَاةِ رَسُولِ اللَّهِ صَلَّى اللَّهُ عَلَيْهِ وَسَلَّمَ مِنْ النَّهَارِ فَقَالَ إِنَّكُمْ لَا تُطِيقُونَ ذَاكَ فَقُلْنَا مَنْ أَطَاقَ ذَاكَ مِنَّا فَقَالَ كَانَ رَسُولُ اللَّهِ صَلَّى اللَّهُ عَلَيْهِ وَسَلَّمَ إِذَا كَانَتْ الشَّمْسُ مِنْ هَاهُنَا كَهَيْئَتِهَا مِنْ هَاهُنَا عِنْدَ الْعَصْرِ صَلَّى رَكْعَتَيْنِ وَإِذَا كَانَتْ الشَّمْسُ مِنْ هَاهُنَا كَهَيْئَتِهَا مِنْ هَاهُنَا عِنْدَ الظُّهْرِ صَلَّى أَرْبَعًا وَصَلَّى أَرْبَعًا قَبْلَ الظُّهْرِ وَبَعْدَهَا رَكْعَتَيْنِ وَقَبْلَ الْعَصْرِ أَرْبَعًا يَفْصِلُ بَيْنَ كُلِّ رَكْعَتَيْنِ بِالتَّسْلِيمِ عَلَى الْمَلَائِكَةِ الْمُقَرَّبِينَ وَالنَّبِيِّينَ وَالْمُرْسَلِينَ وَمَنْ تَبِعَهُمْ مِنْ الْمُؤْمِنِينَ وَالْمُسْلِمِينَ
حَدَّثَنَا مُحَمَّدُ بْنُ الْمُثَنَّى حَدَّثَنَا مُحَمَّدُ بْنُ جَعْفَرٍ حَدَّثَنَا شُعْبَةُ عَنْ أَبِي إِسْحَقَ عَنْ عَاصِمِ بْنِ ضَمْرَةَ عَنْ عَلِيٍّ عَنْ النَّبِيِّ صَلَّى اللَّهُ عَلَيْهِ وَسَلَّمَ نَحْوَهُ قَالَ أَبُو عِيسَى هَذَا حَدِيثٌ حَسَنٌ و قَالَ إِسْحَقُ بْنُ إِبْرَاهِيمَ أَحْسَنُ شَيْءٍ رُوِيَ فِي تَطَوُّعِ النَّبِيِّ صَلَّى اللَّهُ عَلَيْهِ وَسَلَّمَ فِي النَّهَارِ هَذَا وَرُوِي عَنْ عَبْدِ اللَّهِ بْنِ الْمُبَارَكِ أَنَّهُ كَانَ يُضَعِّفُ هَذَا الْحَدِيثَ وَإِنَّمَا ضَعَّفَهُ عِنْدَنَا وَاللَّهُ أَعْلَمُ لِأَنَّهُ لَا يُرْوَى مِثْلُ هَذَا عَنْ النَّبِيِّ صَلَّى اللَّهُ عَلَيْهِ وَسَلَّمَ إِلَّا مِنْ هَذَا الْوَجْهِ عَنْ عَاصِمِ بْنِ ضَمْرَةَ عَنْ عَلِيٍّ وَعَاصِمُ بْنُ ضَمْرَةَ هُوَ ثِقَةٌ عِنْدَ بَعْضِ أَهْلِ الْعِلْمِ قَالَ عَلِيُّ بْنُ الْمَدِينِيِّ قَالَ يَحْيَى بْنُ سَعِيدٍ الْقَطَّانُ قَالَ سُفْيَانُ كُنَّا نَعْرِفُ فَضْلَ حَدِيثِ عَاصِمِ بْنِ ضَمْرَةَ عَلَى حَدِيثِ الْحَارِثِ",8
748,6,"Telah menceritakan kepada kami [Qutaibah] telah menceritakan kepada kami [Abdu Salam bin Harb] dari [Khusaif] dari [Sa'id bin Jubair] dari [Ibnu Abbas] bahwa Nabi shallallahu 'alaihi wasallam berihramsetelah shalat. Abu 'Isa berkata; ""Ini merupakan hadits hasan gharib. Tidak kami ketahui seorangpun meriwayatkannya selain Abdu Salam bin Harb, berdasarkan hadits ini para ulama menyunahkan untuk berihramsetelah melaksakan shalat.""","حَدَّثَنَا قُتَيْبَةُ حَدَّثَنَا عَبْدُ السَّلَامِ بْنُ حَرْبٍ عَنْ خُصَيْفٍ عَنْ سَعِيدِ بْنِ جُبَيْرٍ عَنْ ابْنِ عَبَّاسٍ
أَنَّ النَّبِيَّ صَلَّى اللَّهُ عَلَيْهِ وَسَلَّمَ أَهَلَّ فِي دُبُرِ الصَّلَاةِ
قَالَ أَبُو عِيسَى هَذَا حَدِيثٌ حَسَنٌ غَرِيبٌ لَا نَعْرِفُ أَحَدًا رَوَاهُ غَيْرَ عَبْدِ السَّلَامِ بْنِ حَرْبٍ وَهُوَ الَّذِي يَسْتَحِبُّهُ أَهْلُ الْعِلْمِ أَنْ يُحْرِمَ الرَّجُلُ فِي دُبُرِ الصَّلَاةِ",8
795,6,"Telah menceritakan kepada kami [Abu 'Ammar] dan [Ali bin Khusyram] berkata; telah menceritakan kepada kami [Sufyan bin 'Uyainah] dari [Abu Zubair] dari [Abdullah bin Babah] dari [Jubair bin Muth'im] berkata; ""Nabi shallallahu 'alaihi wasallam bersabda: 'Wahai Bani Abdu Manaf, janganlah kalian melarang orang yang thowaf dan shalat di Ka'bah kapanpun dia suka, baik malam ataupun siang'."" (Abu Isa At Tirmidzi) berkata; ""Hadits semakna diriwayatkan dari Ibnu Abbas dan Abu Dzar."" Abu 'Isa berkata; ""Hadits Jubair merupakan hadits hasan shahih. Telah meriwayatkan juga [Abdullah bin Abu Najih] dari [Abdullah bin Babah] juga. Para ulama berbeda pendapat mengenai shalat setelah ashar dan setelah shubuh di Makkah. Sebagian mereka berpendapat; tidak mengapa shalat dan thowaf di Makkah setelah ashar dan setelah shubuh. Mereka beralasan dengan hadits ini. Ini merupakan pendapat Syafi'i, Ahmad dan Ishaq. Sedangkan sebagian yang lin berkata; 'Jika dia thowafsetelah ashar, dia tidak boleh shalat kecuali setelah terbenamnya matahari. Demikian jika dia thowaf setelah shubuh, maka dia tidak boleh shalat kecuali setelah terbit matahari. Mereka beralasan dengan hadits 'Umar. Bahwa dia thowaf setelah shalat subuh dan tidak melakukan shalat. Dia keluar dari Makkah sampai di Dzi Thuwa, kemudian dia shalat setelah matahari terbit. Ini adalah pendapat Sufyan Ats Tsauri dan Malik bin Anas.""","حَدَّثَنَا أَبُو عَمَّارٍ وَعَلِيُّ بْنُ خَشْرَمٍ قَالَا حَدَّثَنَا سُفْيَانُ بْنُ عُيَيْنَةَ عَنْ أَبِي الزُّبَيْرِ عَنْ عَبْدِ اللَّهِ بْنِ بَابَاهَ عَنْ جُبَيْرِ بْنِ مُطْعِمٍ
أَنَّ النَّبِيَّ صَلَّى اللَّهُ عَلَيْهِ وَسَلَّمَ قَالَ يَا بَنِي عَبْدِ مَنَافٍ لَا تَمْنَعُوا أَحَدًا طَافَ بِهَذَا الْبَيْتِ وَصَلَّى أَيَّةَ سَاعَةٍ شَاءَ مِنْ لَيْلٍ أَوْ نَهَارٍ
وَفِي الْبَاب عَنْ ابْنِ عَبَّاسٍ وَأَبِي ذَرٍّ قَالَ أَبُو عِيسَى حَدِيثُ جُبَيْرٍ حَدِيثٌ حَسَنٌ صَحِيحٌ وَقَدْ رَوَاهُ عَبْدُ اللَّهِ بْنُ أَبِي نَجِيحٍ عَنْ عَبْدِ اللَّهِ بْنِ بَابَاهَ أَيْضًا وَقَدْ اخْتَلَفَ أَهْلُ الْعِلْمِ فِي الصَّلَاةِ بَعْدَ الْعَصْرِ وَبَعْدَ الصُّبْحِ بِمَكَّةَ فَقَالَ بَعْضُهُمْ لَا بَأْسَ بِالصَّلَاةِ وَالطَّوَافِ بَعْدَ الْعَصْرِ وَبَعْدَ الصُّبْحِ وَهُوَ قَوْلُ الشَّافِعِيِّ وَأَحْمَدَ وَإِسْحَقَ وَاحْتَجُّوا بِحَدِيثِ النَّبِيِّ صَلَّى اللَّهُ عَلَيْهِ وَسَلَّمَ هَذَا و قَالَ بَعْضُهُمْ إِذَا طَافَ بَعْدَ الْعَصْرِ لَمْ يُصَلِّ حَتَّى تَغْرُبَ الشَّمْسُ وَكَذَلِكَ إِنْ طَافَ بَعْدَ صَلَاةِ الصُّبْحِ أَيْضًا لَمْ يُصَلِّ حَتَّى تَطْلُعَ الشَّمْسُ وَاحْتَجُّوا بِحَدِيثِ عُمَرَ أَنَّهُ طَافَ بَعْدَ صَلَاةِ الصُّبْحِ فَلَمْ يُصَلِّ وَخَرَجَ مِنْ مَكَّةَ حَتَّى نَزَلَ بِذِي طُوًى فَصَلَّى بَعْدَ مَا طَلَعَتْ الشَّمْسُ وَهُوَ قَوْلُ سُفْيَانَ الثَّوْرِيِّ وَمَالِكِ بْنِ أَنَسٍ",8
951,7,"Telah menceritakan kepada kami [Hannad], telah menceritakan kepada kami [Waki'] dari [Musa bin Ali bin Rabah] dari [Bapaknya] dari [Uqbah bin 'Amir Al Juhani] berkata; ""Tiga waktu Rasulullah shallallahu 'alaihi wasallam melarang kami untuk shalat atau mengubur mayit kami: ketika matahari terbit sampai naik sepenggalah, ketika waktu tegak sampai condong sedikit dan ketika matahari hampir terbenam sampai terbenam."" Abu Isa berkata; ""Ini merupakan hadits hasan sahih. Diamalkan oleh sebagian ulama dari kalangan sahabat Nabi shallallahu 'alaihi wasallam dan yang lainnya. Mereka membenci shalat jenazah pada waktu tersebut. Ibnu Mubarak berkata; 'Makna hadits tersebut adalah mengubur orang yang meninggal di antara kita yaitu maksudnya adalah shalat jenazah.' Dia membenci shalat jenazah ketika matahari terbit, ketika tenggelam dan ketika pertengahan siang sehingga matahari condong. Ini juga merupakan pendapat Ahmad dan Ishaq. Asy Syafi'i berkata; 'Tidak mengapa shalat jenazah pada waktu yang dibenci untuk melakukan shalat di dalamnya'.""","حَدَّثَنَا هَنَّادٌ حَدَّثَنَا وَكِيعٌ عَنْ مُوسَى بْنِ عَلِيِّ بْنِ رَبَاحٍ عَنْ أَبِيهِ عَنْ عُقْبَةَ بْنِ عَامِرٍ الْجُهَنِيِّ قَالَ
ثَلَاثُ سَاعَاتٍ كَانَ رَسُولُ اللَّهِ صَلَّى اللَّهُ عَلَيْهِ وَسَلَّمَ يَنْهَانَا أَنْ نُصَلِّيَ فِيهِنَّ أَوْ نَقْبُرَ فِيهِنَّ مَوْتَانَا حِينَ تَطْلُعُ الشَّمْسُ بَازِغَةً حَتَّى تَرْتَفِعَ وَحِينَ يَقُومُ قَائِمُ الظَّهِيرَةِ حَتَّى تَمِيلَ وَحِينَ تَضَيَّفُ الشَّمْسُ لِلْغُرُوبِ حَتَّى تَغْرُبَ
قَالَ أَبُو عِيسَى هَذَا حَدِيثٌ حَسَنٌ صَحِيحٌ وَالْعَمَلُ عَلَى هَذَا عِنْدَ بَعْضِ أَهْلِ الْعِلْمِ مِنْ أَصْحَابِ النَّبِيِّ صَلَّى اللَّهُ عَلَيْهِ وَسَلَّمَ وَغَيْرِهِمْ يَكْرَهُونَ الصَّلَاةَ عَلَى الْجَنَازَةِ فِي هَذِهِ السَّاعَاتِ و قَالَ ابْنُ الْمُبَارَكِ مَعْنَى هَذَا الْحَدِيثِ أَنْ نَقْبُرَ فِيهِنَّ مَوْتَانَا يَعْنِي الصَّلَاةَ عَلَى الْجَنَازَةِ وَكَرِهَ الصَّلَاةَ عَلَى الْجَنَازَةِ عِنْدَ طُلُوعِ الشَّمْسِ وَعِنْدَ غُرُوبِهَا وَإِذَا انْتَصَفَ النَّهَارُ حَتَّى تَزُولَ الشَّمْسُ وَهُوَ قَوْلُ أَحْمَدَ وَإِسْحَقَ قَالَ الشَّافِعِيُّ لَا بَأْسَ فِي الصَّلَاةِ عَلَى الْجَنَازَةِ فِي السَّاعَاتِ الَّتِي تُكْرَهُ فِيهِنَّ الصَّلَاةُ",8
1537,21,"Telah menceritakan kepada kami [Muhammad bin Basysyar] berkata, telah menceritakan kepada kami [Mu'adz bin Hisyam] berkata, telah menceritakan kepadaku [Bapakku] dari [Qatadah] dari [An Nu'man bin Muqarrin] ia berkata, ""Aku pernah berperang bersama Nabi shallallahu 'alaihi wasallam, maka jika terbit fajar beliau menahan diri (tidak berperang) hingga matahari terbit. dan jika matahari telah terbit beliau menyerang, jika telah tiba pertengahan siang beliau berhenti hingga matahari condong ke arah barat, ketika matahari telah condong beliau kembali menyerang hingga tiba waktu asar, kemudian beliau berhenti hingga selesai melaksanakan shalat asar, dan setelah itu beliau kembali menyerang."" Nu'man berkata, ""Maka pada saat itu dikatakan, 'Angin kemenangan telah berhembus, dan orang-orang beriman mendoakan tentaranya dalam shalat mereka."" Abu Isa berkata, ""Hadits ini diriwayatkan dari An Nu'man bin Muqarrin dengan sanad lain yang lebih bersambung dari pada sanad ini. Dan Qatadah belum pernah ketemu An Nu'man bin Muqarrin, sebab Nu'man meninggal pada masa pemerintahan Umar Ibnul Khaththab.""","حَدَّثَنَا مُحَمَّدُ بْنُ بَشَّارٍ حَدَّثَنَا مُعَاذُ بْنُ هِشَامٍ حَدَّثَنِي أَبِي عَنْ قَتَادَةَ عَنْ النُّعْمَانِ بْنِ مُقَرِّنٍ قَالَ
غَزَوْتُ مَعَ النَّبِيِّ صَلَّى اللَّهُ عَلَيْهِ وَسَلَّمَ فَكَانَ إِذَا طَلَعَ الْفَجْرُ أَمْسَكَ حَتَّى تَطْلُعَ الشَّمْسُ فَإِذَا طَلَعَتْ قَاتَلَ فَإِذَا انْتَصَفَ النَّهَارُ أَمْسَكَ حَتَّى تَزُولَ الشَّمْسُ فَإِذَا زَالَتْ الشَّمْسُ قَاتَلَ حَتَّى الْعَصْرِ ثُمَّ أَمْسَكَ حَتَّى يُصَلِّيَ الْعَصْرَ ثُمَّ يُقَاتِلُ قَالَ وَكَانَ يُقَالُ عِنْدَ ذَلِكَ تَهِيجُ رِيَاحُ النَّصْرِ وَيَدْعُو الْمُؤْمِنُونَ لِجُيُوشِهِمْ فِي صَلَاتِهِمْ
قَالَ أَبُو عِيسَى وَقَدْ رُوِيَ هَذَا الْحَدِيثُ عَنْ النُّعْمَانِ بْنِ مُقَرِّنٍ بِإِسْنَادٍ أَوْصَلَ مِنْ هَذَا وَقَتَادَةُ لَمْ يُدْرِكْ النُّعْمَانَ بْنَ مُقَرِّنٍ وَمَاتَ النُّعْمَانُ بْنُ مُقَرِّنٍ فِي خِلَافَةِ عُمَرَ بْنِ الْخَطَّابِ",8
