haditsId,kitabId,indo,arab,label
153,2,"telah menceritakan kepada kami [Ahmad bin Mani'] berkata; telah menceritakan kepada kami [Husyaim] berkata; telah mengabarkan kepada kami [Auf]. [Ahmad] berkata; Dan telah menceritakan kepada kami [Abbad bin Abbad] -yaitu Al Muhallabi- dan [Isma'il bin Ulayyah] menceritakan dari [Auf] dari [Sayyar bin Salamah] -dia adalah Abu Al Minhal Ar Riyahi-, dari [Abu Barzah], ia berkata; ""Nabi shallallahu 'alaihi wasallam tidak menyukai tidur sebelum isya dan setelahnya."" Ia berkata; ""Dalam bab ini juga ada riwayat dari 'Aisyah, Abdullah bin Mas'ud dan Anas."" Abu Isa berkata; ""Hadits Abu Barzah derajatnya hasan shahih. Kebanykan ahli ilmu memakruhkan tidur sebelum isya dan berbincang-bincang setelahnya, sedangkan yang lainnya memberikan keringanan."" Dan Abdullah bin Al Mubarak berkata; ""Kebanyakan hadits menunjukan atas dimakruhkannya hal itu. Meskipun sebagian mereka memberikan keringanan atas dibolehkannya tidur sebelum shalat tidur di bulan ramadlan."" Dan Sayyar bin Salamah adalah Abu Al Minhal Ar Riyahi.""","حَدَّثَنَا أَحْمَدُ بْنُ مَنِيعٍ حَدَّثَنَا هُشَيْمٌ أَخْبَرَنَا عَوْفٌ قَالَ أَحْمَدُ وَحَدَّثَنَا عَبَّادُ بْنُ عَبَّادٍ هُوَ الْمُهَلَّبِيُّ وَإِسْمَعِيلُ ابْنُ عُلَيَّةَ جَمِيعًا عَنْ عَوْفٍ عَنْ سَيَّارِ بْنِ سَلَامَةَ هُوَ أَبُو الْمِنْهَالِ الرِّيَاحِيُّ عَنْ أَبِي بَرْزَةَ قَالَ
كَانَ النَّبِيُّ صَلَّى اللَّهُ عَلَيْهِ وَسَلَّمَ يَكْرَهُ النَّوْمَ قَبْلَ الْعِشَاءِ وَالْحَدِيثَ بَعْدَهَا
قَالَ وَفِي الْبَاب عَنْ عَائِشَةَ وَعَبْدِ اللَّهِ بْنِ مَسْعُودٍ وَأَنَسٍ قَالَ أَبُو عِيسَى حَدِيثُ أَبِي بَرْزَةَ حَدِيثٌ حَسَنٌ صَحِيحٌ وَقَدْ كَرِهَ أَكْثَرُ أَهْلِ الْعِلْمِ النَّوْمَ قَبْلَ صَلَاةِ الْعِشَاءِ وَالْحَدِيثَ بَعْدَهَا وَرَخَّصَ فِي ذَلِكَ بَعْضُهُمْ و قَالَ عَبْدُ اللَّهِ بْنُ الْمُبَارَكِ أَكْثَرُ الْأَحَادِيثِ عَلَى الْكَرَاهِيَةِ وَرَخَّصَ بَعْضُهُمْ فِي النَّوْمِ قَبْلَ صَلَاةِ الْعِشَاءِ فِي رَمَضَانَ وَسَيَّارُ بْنُ سَلَامَةَ هُوَ أَبُو الْمِنْهَالِ الرِّيَاحِيُّ",8
154,2,"telah menceritakan kepada kami [Ahmad bin Mani'] berkata; telah menceritakan kepada kami [Abu Mu'awiyah] dari [Al A'masy] dari [Ibrahim] dari [Alqamah] dari [Umar bin Al Khaththab] ia berkata; ""Rasulullah shallallahu 'alaihi wasallam pernah berbincang-bincang dengan Abu Bakar dalam permasalahan kaum muslimin, sedang aku bersama keduanya."" Ia berkata; ""Dalam bab ini juga ada riwayat dari Abdullah bin Amru, Amru bin Hudzaifah dan Imran bin Hushain."" Abu Isa berkata; ""Hadits Umar derajatnya hasan shahih. [Al Hasan bin Ubaidullah] telah meriwayatkan hadits ini dari [Ibrahim] dari [Alqamah] dari seorang laki-laki dari Ju'fi yang disebut dengan nama [Qais atau Ibnu Qais] dari [Umar] dari Nabi shallallahu 'alaihi wasallam, dan hadits ini ada dalam kisah yang panjang. Para ulama dari kalangan sahabat Nabi shallallahu 'alaihi wasallam, tabi'in dan orang-orang setelah mereka berselisih tentang hukum berbincang-bincang setelah shalat isya akhir. Sebagian mereka memakruhkan perbincangan setelah shalat isya, sedang sebagian yang lain memberi keringanan jika hal itu masih dalam koridor ilmu, atau keperluan yang penting. Dan kebanyakan hadits memberikan keringanan tersebut."" Telah diriwayatkan dari Nabi shallallahu 'alaihi wasallam, beliau bersabda: ""Tidak boleh berbincang-bincang kecuali bagi orang yang shalat atau musafir.""","حَدَّثَنَا أَحْمَدُ بْنُ مَنِيعٍ حَدَّثَنَا أَبُو مُعَاوِيَةَ عَنْ الْأَعْمَشِ عَنْ إِبْرَاهِيمَ عَنْ عَلْقَمَةَ عَنْ عُمَرَ بْنِ الْخَطَّابِ قَالَ
كَانَ رَسُولُ اللَّهِ صَلَّى اللَّهُ عَلَيْهِ وَسَلَّمَ يَسْمُرُ مَعَ أَبِي بَكْرٍ فِي الْأَمْرِ مِنْ أَمْرِ الْمُسْلِمِينَ وَأَنَا مَعَهُمَا
وَفِي الْبَاب عَنْ عَبْدِ اللَّهِ بْنِ عَمْرٍو وَأَوْسِ بْنِ حُذَيْفَةَ وَعِمْرَانَ بْنِ حُصَيْنٍ قَالَ أَبُو عِيسَى حَدِيثُ عُمَرَ حَدِيثٌ حَسَنٌ وَقَدْ رَوَى هَذَا الْحَدِيثَ الْحَسَنُ بْنُ عُبَيْدِ اللَّهِ عَنْ إِبْرَاهِيمَ عَنْ عَلْقَمَةَ عَنْ رَجُلٍ مِنْ جُعْفِيٍّ يُقَالُ لَهُ قَيْسٌ أَوْ ابْنُ قَيْسٍ عَنْ عُمَرَ عَنْ النَّبِيِّ صَلَّى اللَّهُ عَلَيْهِ وَسَلَّمَ هَذَا الْحَدِيثَ فِي قِصَّةٍ طَوِيلَةٍ وَقَدْ اخْتَلَفَ أَهْلُ الْعِلْمِ مِنْ أَصْحَابِ النَّبِيِّ صَلَّى اللَّهُ عَلَيْهِ وَسَلَّمَ وَالتَّابِعِينَ وَمَنْ بَعْدَهُمْ فِي السَّمَرِ بَعْدَ صَلَاةِ الْعِشَاءِ الْآخِرَةِ فَكَرِهَ قَوْمٌ مِنْهُمْ السَّمَرَ بَعْدَ صَلَاةِ الْعِشَاءِ وَرَخَّصَ بَعْضُهُمْ إِذَا كَانَ فِي مَعْنَى الْعِلْمِ وَمَا لَا بُدَّ مِنْهُ مِنْ الْحَوَائِجِ وَأَكْثَرُ الْحَدِيثِ عَلَى الرُّخْصَةِ قَدْ رُوِيَ عَنْ النَّبِيِّ صَلَّى اللَّهُ عَلَيْهِ وَسَلَّمَ قَالَ لَا سَمَرَ إِلَّا لِمُصَلٍّ أَوْ مُسَافِرٍ",8
155,2,"telah menceritakan kepada kami [Abu 'Ammar Al Husain bin Huraits] berkata; telah menceritakan kepada kami [Al Fadll bin Musa] dari [Abdullah bin Umar Al Umari] dari [Al Qasim bin Ghannam] dari bibinya [Ummu Farwah] -dan dia termasuk orang yang ikut serta berbai'at kepada Nabi shallallahu 'alaihi wasallam- bahwasanya ia berkata; ""Nabi shallallahu 'alaihi wasallam pernah ditanya, ""Amalan apakah yang paling utama?"" beliau menjawab: ""Shalat pada awal waktu.""","حَدَّثَنَا أَبُو عَمَّارٍ الْحُسَيْنُ بْنُ حُرَيْثٍ حَدَّثَنَا الْفَضْلُ بْنُ مُوسَى عَنْ عَبْدِ اللَّهِ بْنِ عُمَرَ الْعُمَرِيِّ عَنْ الْقَاسِمِ بْنِ غَنَّامٍ عَنْ عَمَّتِهِ أُمِّ فَرْوَةَ وَكَانَتْ مِمَّنْ بَايَعَتْ النَّبِيَّ صَلَّى اللَّهُ عَلَيْهِ وَسَلَّمَ قَالَتْ
سُئِلَ النَّبِيُّ صَلَّى اللَّهُ عَلَيْهِ وَسَلَّمَ أَيُّ الْأَعْمَالِ أَفْضَلُ قَالَ الصَّلَاةُ لِأَوَّلِ وَقْتِهَا",8
156,2,"telah menceritakan kepada kami [Qutaibah] berkata; telah menceritakan kepada kami [Abdullah bin Wahb] dari [Sa'id bin Abdullah AlJuhani] dari [Muhammad bin Umar bin Ali bin Abu Thalib] dari [Ayahnya] dari [Ali bin Abu Thalib] bahwa Nabi shallallahu 'alaihi wasallam pernah bersabda kepadanya: ""Perhatikanlah tiga perkara, janganlah engkau akhirkan shalat jika telah datang waktunya, jenazah jika telah tiba dan (menikahi) seorang janda jika engkau telah merasa cocok(sepadan)."" Abu Isa berkata; ""Hadits ini derajatnya gharib hasan.""","حَدَّثَنَا قُتَيْبَةُ قَالَ حَدَّثَنَا عَبْدُ اللَّهِ بْنُ وَهْبٍ عَنْ سَعِيدِ بْنِ عَبْدِ اللَّهِ الْجُهَنِيِّ عَنْ مُحَمَّدِ بْنِ عُمَرَ بْنِ عَلِيِّ بْنِ أَبِي طَالِبٍ عَنْ أَبِيهِ عَنْ عَلِيِّ بْنِ أَبِي طَالِبٍ
أَنَّ النَّبِيَّ صَلَّى اللَّهُ عَلَيْهِ وَسَلَّمَ قَالَ لَهُ يَا عَلِيُّ ثَلَاثٌ لَا تُؤَخِّرْهَا الصَّلَاةُ إِذَا آنَتْ وَالْجَنَازَةُ إِذَا حَضَرَتْ وَالْأَيِّمُ إِذَا وَجَدْتَ لَهَا كُفْئًا
قَالَ أَبُو عِيسَى هَذَا حَدِيثٌ غَرِيبٌ حَسَنٌ",8
158,2,"telah menceritakan kepada kami [Qutaibah] berkata; telah menceritakan kepada kami [Marwan bin Mu'awiyah Al Fazari] dari [Abu Ya'fur] dari [Al Walid bin Al 'Aizar] dari [Abu 'Amru Asy Syaibani] bahwa seorang laki-laki berkata kepada [Ibnu Mas'ud], ""Amal apakah yang paling utama?"" ia berkata; ""Aku pernah bertanya Rasulullah shallallahu 'alaihi wasallam tentang hal itu, maka beliau pun menjawab: ""Shalat sesuai dengan waktunya, "" aku bertanya lagi, ""Wahai Rasulullah, lalu apa lagi?"" beliau menjawab: ""Berbuat baik kepada kedua orang tua, "" aku bertanya lagi, ""Wahai Rasulullah, lalu apa lagi?"" beliau menjawab: ""Jihad di jalan Allah."" Abu Isa berkata; ""Hadits ini derajatnya hasan shahih. Dan hadits ini telah diriwayatkan oleh [Al Mas'udi] dan [Syu'bah] dan [Sulaiman] -yakni Abu Ishaq Asy Syaibani- dan yang lain-lain dari [Al Walid bin Al 'Aizar].""","حَدَّثَنَا قُتَيْبَةُ حَدَّثَنَا مَرْوَانُ بْنُ مُعَاوِيَةَ الْفَزَارِيُّ عَنْ أَبِي يَعْفُورٍ عَنْ الْوَلِيدِ بْنِ الْعَيْزَارِ عَنْ أَبِي عَمْرٍو الشَّيْبَانِيِّ
أَنَّ رَجُلًا قَالَ لِابْنِ مَسْعُودٍ أَيُّ الْعَمَلِ أَفْضَلُ قَالَ سَأَلْتُ عَنْهُ رَسُولَ اللَّهِ صَلَّى اللَّهُ عَلَيْهِ وَسَلَّمَ فَقَالَ الصَّلَاةُ عَلَى مَوَاقِيتِهَا قُلْتُ وَمَاذَا يَا رَسُولَ اللَّهِ قَالَ وَبِرُّ الْوَالِدَيْنِ قُلْتُ وَمَاذَا يَا رَسُولَ اللَّهِ قَالَ وَالْجِهَادُ فِي سَبِيلِ اللَّهِ
قَالَ أَبُو عِيسَى وَهَذَا حَدِيثٌ حَسَنٌ صَحِيحٌ وَقَدْ رَوَى الْمَسْعُودِيُّ وَشُعْبَةُ وَسُلَيْمَانُ هُوَ أَبُو إِسْحَقَ الشَّيْبَانِيُّ وَغَيْرُ وَاحِدٍ عَنْ الْوَلِيدِ بْنِ الْعَيْزَارِ هَذَا الْحَدِيثَ",8
159,2,"telah menceritakan kepada kami [Qutaibah] berkata; telah menceritakan kepada kami [Al Laits] dari [Khalid bin Yazid] dari [Sa'id bin Abu Bilal] dari [Ishaq bin Umar] dari ['Aisyah] ia berkata; ""Rasulullah shallallahu 'alaihi wasallam tidak pernah mengerjakan shalat pada akhir waktunya sebanyak dua kali berturut-turut hingga Allah mewafatkannya."" Abu Isa berkata; ""Ini adalah hadits yang derajatnya hasan gharib dan sanadnya tidak bersambung."" Syafi'i berkata; ""Shalat di awal waktu adalah sesuatu yang utama. Dan sesuatu yang menunjukkan keutamaan shalat di awal waktu dari yang akhir adalah memilihnya Nabi shallallahu 'alaihi wasallam, Abu bakar dan Umar, mereka selalu mengerjakannya di awal waktu, dan mereka tidak memilih kecuali sesuatu yang utama. Mereka tidak pernah meninggalkan yang utama, dan mereka selalu melaksanakan shalat di awal waktu."" Ia berkata; ""Abu Al Walid Al Makki menceritakan kepada kami dari Syafi'i seperti itu.""","حَدَّثَنَا قُتَيْبَةُ حَدَّثَنَا اللَّيْثُ عَنْ خَالِدِ بْنِ يَزِيدَ عَنْ سَعِيدِ بْنِ أَبِي هِلَالٍ عَنْ إِسْحَقَ بْنِ عُمَرَ عَنْ عَائِشَةَ قَالَتْ
مَا صَلَّى رَسُولُ اللَّهِ صَلَّى اللَّهُ عَلَيْهِ وَسَلَّمَ صَلَاةً لِوَقْتِهَا الْآخِرِ مَرَّتَيْنِ حَتَّى قَبَضَهُ اللَّهُ
قَالَ أَبُو عِيسَى هَذَا حَدِيثٌ غَرِيبٌ وَلَيْسَ إِسْنَادُهُ بِمُتَّصِلٍ قَالَ الشَّافِعِيُّ وَالْوَقْتُ الْأَوَّلُ مِنْ الصَّلَاةِ أَفْضَلُ وَمِمَّا يَدُلُّ عَلَى فَضْلِ أَوَّلِ الْوَقْتِ عَلَى آخِرِهِ اخْتِيَارُ النَّبِيِّ صَلَّى اللَّهُ عَلَيْهِ وَسَلَّمَ وَأَبِي بَكْرٍ وَعُمَرَ فَلَمْ يَكُونُوا يَخْتَارُونَ إِلَّا مَا هُوَ أَفْضَلُ وَلَمْ يَكُونُوا يَدَعُونَ الْفَضْلَ وَكَانُوا يُصَلُّونَ فِي أَوَّلِ الْوَقْتِ قَالَ حَدَّثَنَا بِذَلِكَ أَبُو الْوَلِيدِ الْمَكِّيُّ عَنْ الشَّافِعِيِّ",8
160,2,"telah menceritakan kepada kami [Qutaibah] berkata; telah menceritakan kepada kami [Al Laits bin Sa'd] dari [Nafi'] dari [Ibnu Umar] dari Nabi shallallahu 'alaihi wasallam, beliau bersabda: ""Orang yang kehilangan shalat asar (berjama'ah) seperti orang yang kehilangan keluarga dan hartanya."" Abu Isa berkata; ""Hadits Ibnu Umar ini derajatnya hasan shahih. Hadits ini juga diriwayatkan oleh [Az Zuhri] dari [Salim] dari ayahnya [Ibnu Umar], dari Nabi shallallahu 'alaihi wasallam.""","حَدَّثَنَا قُتَيْبَةُ حَدَّثَنَا اللَّيْثُ بْنُ سَعْدٍ عَنْ نَافِعٍ عَنْ ابْنِ عُمَرَ
عَنْ النَّبِيِّ صَلَّى اللَّهُ عَلَيْهِ وَسَلَّمَ قَالَ الَّذِي تَفُوتُهُ صَلَاةُ الْعَصْرِ فَكَأَنَّمَا وُتِرَ أَهْلَهُ وَمَالَهُ
وَفِي الْبَاب عَنْ بُرَيْدَةَ وَنَوْفَلِ بْنِ مُعَاوِيَةَ قَالَ أَبُو عِيسَى حَدِيثُ ابْنِ عُمَرَ حَدِيثٌ حَسَنٌ صَحِيحٌ وَقَدْ رَوَاهُ الزُّهْرِيُّ أَيْضًا عَنْ سَالِمٍ عَنْ أَبِيهِ ابْنِ عُمَرَ عَنْ النَّبِيِّ صَلَّى اللَّهُ عَلَيْهِ وَسَلَّمَ",8
162,2,"telah menceritakan kepada kami [Qutaibah] berkata; telah menceritakan kepada kami [Hammad bin Zaid] dari [Tsabit Al Bunani] dari [Abdullah bin Rabah Al Anshari] dari [Abu Qatadah] ia berkata; ""Para sahabat menyebutkan kepada Nabi shallallahu 'alaihi wasallam bahwa mereka ketinggalan shalat karena tidur, maka beliau pun bersabda: ""Dalam tidur tidak ada istilah meremehkan, tetapi meremehkan itu ketika dalam keadaan sadar (tidak tidur). Maka jika salah seorang dari kalian lupa tidak mengerjakan shalat, atau ketiduran, maka hendaklah ia shalat ketika telah ingat."" Ia berkata; ""Dalam bab ini juga ada riwayat dari Ibnu Mas'ud, Abu Maryam, Imran bin Hushain, Jubair bin Muth'im, Abu Juhaifah, Abu Sa'id, 'Amru bin Umayyah Adl Dlamri dan Dzu Mikhbar, disebut juga dengan nama Dzu Mikhmar -yaitu anak laki-laki dari anak laki-laki An Najasyi-."" Abu Isa berkata; ""Hadits Abu Qatadah derajatnya hasan shahih. Para ulama berbeda pendapat mengenai seseorang yang lalai mengerjakan shalat karena ketiduran atau lupa, lalu ia terbangun atau ingat ketika waktu shalat telah habis, yaitu ketika matahari telah terbit atau telah terbenam. Sebagian dari mereka berkata; ""Ia harus mengerjakannya jika telah bangun atau ingat, meskipun matahari ketika itu sedang terbit atau sedang terbenam."" Ini adalah pendapat Ahmad, Ishaq, Syafi'i dan Malik. Sedangkan sebagian lain berkata; ""Ia tidak boleh melaksanakan shalat hingga matahari terbit atau tenggelam.""","حَدَّثَنَا قُتَيْبَةُ حَدَّثَنَا حَمَّادُ بْنُ زَيْدٍ عَنْ ثَابِتٍ الْبُنَانِيِّ عَنْ عَبْدِ اللَّهِ بْنِ رَبَاحٍ الْأَنْصَارِيِّ عَنْ أَبِي قَتَادَةَ قَالَ
ذَكَرُوا لِلنَّبِيِّ صَلَّى اللَّهُ عَلَيْهِ وَسَلَّمَ نَوْمَهُمْ عَنْ الصَّلَاةِ فَقَالَ إِنَّهُ لَيْسَ فِي النَّوْمِ تَفْرِيطٌ إِنَّمَا التَّفْرِيطُ فِي الْيَقَظَةِ فَإِذَا نَسِيَ أَحَدُكُمْ صَلَاةً أَوْ نَامَ عَنْهَا فَلْيُصَلِّهَا إِذَا ذَكَرَهَا
وَفِي الْبَاب عَنْ ابْنِ مَسْعُودٍ وَأَبِي مَرْيَمَ وَعِمْرَانَ بْنِ حُصَيْنٍ وَجُبَيْرِ بْنِ مُطْعِمٍ وَأَبِي جُحَيْفَةَ وَأَبِي سَعِيدٍ وَعَمْرِو بْنِ أُمَيَّةَ الضَّمْرِيِّ وَذِي مِخْبَرٍ وَيُقَالُ ذِي مِخْمَرٍ وَهُوَ ابْنُ أَخِي النَّجَاشِيِّ قَالَ أَبُو عِيسَى وَحَدِيثُ أَبِي قَتَادَةَ حَدِيثٌ حَسَنٌ صَحِيحٌ وَقَدْ اخْتَلَفَ أَهْلُ الْعِلْمِ فِي الرَّجُلِ يَنَامُ عَنْ الصَّلَاةِ أَوْ يَنْسَاهَا فَيَسْتَيْقِظُ أَوْ يَذْكُرُ وَهُوَ فِي غَيْرِ وَقْتِ صَلَاةٍ عِنْدَ طُلُوعِ الشَّمْسِ أَوْ عِنْدَ غُرُوبِهَا فَقَالَ بَعْضُهُمْ يُصَلِّيهَا إِذَا اسْتَيْقَظَ أَوْ ذَكَرَ وَإِنْ كَانَ عِنْدَ طُلُوعِ الشَّمْسِ أَوْ عِنْدَ غُرُوبِهَا وَهُوَ قَوْلُ أَحْمَدَ وَإِسْحَقَ وَالشَّافِعِيِّ وَمَالِكٍ و قَالَ بَعْضُهُمْ لَا يُصَلِّي حَتَّى تَطْلُعَ الشَّمْسُ أَوْ تَغْرُبَ",8
163,2,"telah menceritakan kepada kami [Qutaibah] dan [Bisyr bin Mu'adz] mereka berkata; telah menceritakan kepada kami [Abu Awanah] dari [Qatadah] dari [Anas bin Malik] ia berkata; ""Rasulullah shallallahu 'alaihi wasallam bersabda: ""Barangsiapa lupa mengerjakan shalat, maka hendaklah ia mengerjakannya ketika telah ingat."" Ia berkata; ""Dalam bab ini juga ada riwayat dari Samrah dan Abu Qatadah."" Abu Isa berkata; ""Hadits Anas ini derajatnya hasan shahih."" Telah diriwayatkan dari Ali bin Abu Thalib, bahwa ia berkata tentang seorang laki-laki yang lupa mengerjakan shalat, beliau bersabda: ""Hendaklah ia shalat kapan saja ia mengingatnya, baik dalam waktu atau di luar waktunya."" Ini adalah pendapat yang diambil oleh Syafi'i, Ahmad bin Hambal dan Ishaq."" Diriwayatkan pula dari Abu Bakrah bahwa ia pernah tertidur hingga tidak mengerjakan shalat asar, dan ia terbangun ketika matahari telah terbenam, maka ia pun tidak mengerjakan shalat hingga matahari terbenam."" Sebagian penduduk Kufah berpendapat seperti ini, adapun kawan-kawan kami mereka berpegangan sebagaimana yang diamalkan oleh Ali bin Abu Thalib Radliaallahu 'anhu.""","حَدَّثَنَا قُتَيْبَةُ وَبِشْرُ بْنُ مُعَاذٍ قَالَا حَدَّثَنَا أَبُو عَوَانَةَ عَنْ قَتَادَةَ عَنْ أَنَسِ بْنِ مَالِكٍ قَالَ
قَالَ رَسُولُ اللَّهِ صَلَّى اللَّهُ عَلَيْهِ وَسَلَّمَ مَنْ نَسِيَ صَلَاةً فَلْيُصَلِّهَا إِذَا ذَكَرَهَا
وَفِي الْبَاب عَنْ سَمُرَةَ وَأَبِي قَتَادَةَ قَالَ أَبُو عِيسَى حَدِيثُ أَنَسٍ حَدِيثٌ حَسَنٌ صَحِيحٌ وَيُرْوَى عَنْ عَلِيِّ بْنِ أَبِي طَالِبٍ أَنَّهُ قَالَ فِي الرَّجُلِ يَنْسَى الصَّلَاةَ قَالَ يُصَلِّيهَا مَتَى مَا ذَكَرَهَا فِي وَقْتٍ أَوْ فِي غَيْرِ وَقْتٍ وَهُوَ قَوْلُ الشَّافِعِيِّ وَأَحْمَدَ بْنِ حَنْبَلٍ وَإِسْحَقَ وَيُرْوَى عَنْ أَبِي بَكْرَةَ أَنَّهُ نَامَ عَنْ صَلَاةِ الْعَصْرِ فَاسْتَيْقَظَ عِنْدَ غُرُوبِ الشَّمْسِ فَلَمْ يُصَلِّ حَتَّى غَرَبَتْ الشَّمْسُ وَقَدْ ذَهَبَ قَوْمٌ مِنْ أَهْلِ الْكُوفَةِ إِلَى هَذَا وَأَمَّا أَصْحَابُنَا فَذَهَبُوا إِلَى قَوْلِ عَلِيِّ بْنِ أَبِي طَالِبٍ رَضِيَ اللَّهُ عَنْهُ",8
167,2,"telah menceritakan kepada kami [Hannad] berkata; telah menceritakan kepada kami [Abdah] dari [Sa'id] dari [Qatadah] dari [Al Hasan] dari [Samrah bin Jundab] dari Nabi shallallahu 'alaihi wasallam, bahwasanya beliau bersabda: ""Shalat wustha adalah shalat asar."" Ia berkata; ""Dalam bab ini juga ada riwayat dari Ali, Abdullah bin Mas'ud, Zaid bin Tsabit, 'Aisyah, Hafshah, Abu Hurairah dan Abu Hasyim bin Utbah."" Abu Isa berkata; ""Muhammad berkata; ""Ali bin Abdullah mengatakan bahwa hadits Samrah bin Jundab derajatnya hasan shahih, dan ia telah mendengar darinya."" Abu Isa berkata; ""Hadits Samrah tentang shalat wustha adalah shalat asar, derajatnya hasan shahih. Ini adalah pendapat yang diambil oleh sebagian besar ahli ilmu dari kalangan sahabat Nabi shallallahu 'alaihi wasallam dan selain mereka."" Zaid bin Tsabit dan 'Aisyah mengatakan, ""Shalat wustha adalah shalat zhuhur."" Sedangkan Ibnu Abbas dan Ibnu Umar mengatakan, ""Shalat wustha adalah shalat subuh."" Telah menceritakan kepada kami Abu Musa Muhammad bin Al Mutsanna berkata; telah menceritakan kepada kami Quraisy bin Anas dari Habib Ibnu Asy Syahid ia berkata; ""Muhammad bin Sirin berkata; ""Bertanyalah kepada Al Hasan dari siapa ia mendengar hadits tentang Aqiqah?"" maka aku pun bertanya kepadanya, lalu ia menjawab, ""Aku mendengarnya dari Samrah bin Jundab."" Abu Isa berkata; ""Telah menceritakan kepada kami Muhammad bin Isma'il berkata; telah menceritakan kepada kami Ali bin Abdullah bin Al Madini dari Quraisy bin Anas dengan hadits ini."" Muhammad berkata; ""Ali berkata; ""Mendengarnya Al Hasan dari Samrah adalah benar, dan ia berdasar dengan hadits ini.""","حَدَّثَنَا هَنَّادٌ حَدَّثَنَا عَبْدَةُ عَنْ سَعِيدٍ عَنْ قَتَادَةَ عَنْ الْحَسَنِ عَنْ سَمُرَةَ بْنِ جُنْدَبٍ
عَنْ النَّبِيِّ صَلَّى اللَّهُ عَلَيْهِ وَسَلَّمَ أَنَّهُ قَالَ صَلَاةُ الْوُسْطَى صَلَاةُ الْعَصْرِ
قَالَ وَفِي الْبَاب عَنْ عَلِيٍّ وَعَبْدِ اللَّهِ بْنِ مَسْعُودٍ وَزَيْدِ بْنِ ثَابِتٍ وَعَائِشَةَ وَحَفْصَةَ وَأَبِي هُرَيْرَةَ وَأَبِي هَاشِمِ بْنِ عُتْبَةَ قَالَ أَبُو عِيسَى قَالَ مُحَمَّدٌ قَالَ عَلِيُّ بْنُ عَبْدِ اللَّهِ حَدِيثُ الْحَسَنِ عَنْ سَمُرَةَ بْنِ جُنْدَبٍ حَدِيثٌ صَحِيحٌ وَقَدْ سَمِعَ مِنْهُ قَالَ أَبُو عِيسَى حَدِيثُ سَمُرَةَ فِي صَلَاةِ الْوُسْطَى حَدِيثٌ حَسَنٌ وَهُوَ قَوْلُ أَكْثَرِ الْعُلَمَاءِ مِنْ أَصْحَابِ النَّبِيِّ صَلَّى اللَّهُ عَلَيْهِ وَسَلَّمَ وَغَيْرِهِمْ و قَالَ زَيْدُ بْنُ ثَابِتٍ وَعَائِشَةُ صَلَاةُ الْوُسْطَى صَلَاةُ الظُّهْرِ و قَالَ ابْنُ عَبَّاسٍ وَابْنُ عُمَرَ صَلَاةُ الْوُسْطَى صَلَاةُ الصُّبْحِ حَدَّثَنَا أَبُو مُوسَى مُحَمَّدُ بْنُ الْمُثَنَّى حَدَّثَنَا قُرَيْشُ بْنُ أَنَسٍ عَنْ حَبِيبِ بْنِ الشَّهِيدِ قَالَ قَالَ لِي مُحَمَّدُ بْنُ سِيرِينَ سَلِ الْحَسَنَ مِمَّنْ سَمِعَ حَدِيثَ الْعَقِيقَةِ فَسَأَلْتُهُ فَقَالَ سَمِعْتُهُ مِنْ سَمُرَةَ بْنِ جُنْدَبٍ قَالَ أَبُو عِيسَى و أَخْبَرَنِي مُحَمَّدُ بْنُ إِسْمَعِيلَ حَدَّثَنَا عَلِيُّ بْنُ عَبْدِ اللَّهِ بْنِ الْمَدِينِيِّ عَنْ قُرَيْشِ بْنِ أَنَسٍ بِهَذَا الْحَدِيثِ قَالَ مُحَمَّدٌ قَالَ عَلِيٌّ وَسَمَاعُ الْحَسَنِ مِنْ سَمُرَةَ صَحِيحٌ وَاحْتَجَّ بِهَذَا الْحَدِيثِ",8
