haditsId,kitabId,indo,arab,label
1,1,"telah menceritakan kepada kami [Qutaibah bin Sa'id] berkata, telah menceritakan kepada kami [Abu Awanah] dari [Simak bin Harb], dan telah menceritakan kepada kami [Hannad] berkata, telah menceritakan kepada kami [Waki'] dari [Israil] dari [Simak] dari [Mush'ab bin Sa'd] dari [Ibnu Umar] dari Nabi Shallahu 'alaihi wa Sallam, beliau bersabda: "" Tidak akan diterima shalat yang dilakukan tanpa bersuci, dan tidak akan diterima sedekah yang berasal dari harta curian."" Hannad menyebutkan dalam haditsnya, ""tidak suci."" Abu Isa berkata; ""Hadits ini adalah yang paling shahih dan paling baik dalam bab ini."" Dalam bab tersebut juga ada hadits dari Abu Al Malih dari Bapaknya dan Abu Hurairah dan Anas. Dan Abu Al Malih bin Usamah namanya adalah Amir, disebut juga Zaid bin Usamah bin Umair Al Hudzali.""","حَدَّثَنَا قُتَيْبَةُ بْنُ سَعِيدٍ حَدَّثَنَا أَبُو عَوَانَةَ عَنْ سِمَاكِ بْنِ حَرْبٍ ح و حَدَّثَنَا هَنَّادٌ حَدَّثَنَا وَكِيعٌ عَنْ إِسْرَائِيلَ عَنْ سِمَاكٍ عَنْ مُصْعَبِ بْنِ سَعْدٍ عَنْ ابْنِ عُمَرَ
عَنْ النَّبِيِّ صَلَّى اللَّهُ عَلَيْهِ وَسَلَّمَ قَالَ لَا تُقْبَلُ صَلَاةٌ بِغَيْرِ طُهُورٍ وَلَا صَدَقَةٌ مِنْ غُلُولٍ
قَالَ هَنَّادٌ فِي حَدِيثِهِ إِلَّا بِطُهُورٍ قَالَ أَبُو عِيسَى هَذَا الْحَدِيثُ أَصَحُّ شَيْءٍ فِي هَذَا الْبَابِ وَأَحْسَنُ وَفِي الْبَاب عَنْ أَبِي الْمَلِيحِ عَنْ أَبِيهِ وَأَبِي هُرَيْرَةَ وَأَنَسٍ وَأَبُو الْمَلِيحِ بْنُ أُسَامَةَ اسْمُهُ عَامِرٌ وَيُقَالُ زَيْدُ بْنُ أُسَامَةَ بْنِ عُمَيْرٍ الْهُذَلِيُّ",8
47,1,"telah menceritakan kepada kami [Ali bin Hujr] berkata, telah mengabarkan kepada kami [Isma'il bin Ja'far] dari [Al 'Ala` bin Abdurrahman] dari [Bapaknya] dari [Abu Hurairah] bahwa Rasulullah shallallahu 'alaihi wasallam bersabda: "" Maukah aku tunjukkan kepada kalian sesuatu yang dapat menghapus kesalahan dan menaikkan derajat?"" para sahabat menjawab, ""Tentu, wahai Rasulullah."" Beliau bersabda: ""Menyempurnakan shalat disaat yang tidak disukai, memperbanyak langkah menuju masjid dan menunggu shalat setelah shalat. Dan itulah ribath."" Telah menceritakan kepada kami [Qutaibah] berkata, telah menceritakan kepada kami [Abdul Aziz bin Muhammad] dari [Al 'Ala`] sebagaimana hadits tersebut. Qutaibah menyebutkan dalam haditsnya, ""Itulah ribath, itulah ribath, itulah ribath."" Tiga kali. Abu Isa berkata; ""Dalam bab ini juga ada riwayat dari Ali, Abdullah bin 'Amru, Ibnu Abbas dan Abidah, disebut juga Ubaidah bin Amru, Aisyah, Abdurrahman bin 'A`isy Al Hadlrami, dan Anas."" Abu Isa berkata; ""Dan hadits Abu Hurairah dalam bab ini adalah hadits yang paling baik dan derajatnya shahih."" Dan Al 'Ala` bin Abdurrahman adalah Ibnu Ya'qub Al Juhani Al Huraqi, ia adalah seorang yang dapat dipercaya menurut ahli hadits.""","حَدَّثَنَا عَلِيُّ بْنُ حُجْرٍ أَخْبَرَنَا إِسْمَعِيلُ بْنُ جَعْفَرٍ عَنْ الْعَلَاءِ بْنِ عَبْدِ الرَّحْمَنِ عَنْ أَبِيهِ عَنْ أَبِي هُرَيْرَةَ
أَنَّ رَسُولَ اللَّهِ صَلَّى اللَّهُ عَلَيْهِ وَسَلَّمَ قَالَ أَلَا أَدُلُّكُمْ عَلَى مَا يَمْحُو اللَّهُ بِهِ الْخَطَايَا وَيَرْفَعُ بِهِ الدَّرَجَاتِ قَالُوا بَلَى يَا رَسُولَ اللَّهِ قَالَ إِسْبَاغُ الْوُضُوءِ عَلَى الْمَكَارِهِ وَكَثْرَةُ الْخُطَا إِلَى الْمَسَاجِدِ وَانْتِظَارُ الصَّلَاةِ بَعْدَ الصَّلَاةِ فَذَلِكُمْ الرِّبَاطُ
و حَدَّثَنَا قُتَيْبَةُ حَدَّثَنَا عَبْدُ الْعَزِيزِ بْنُ مُحَمَّدٍ عَنْ الْعَلَاءِ نَحْوَهُ و قَالَ قُتَيْبَةُ فِي حَدِيثِهِ فَذَلِكُمْ الرِّبَاطُ فَذَلِكُمْ الرِّبَاطُ فَذَلِكُمْ الرِّبَاطُ ثَلَاثًا قَالَ أَبُو عِيسَى وَفِي الْبَاب عَنْ عَلِيٍّ وَعَبْدِ اللَّهِ بْنِ عَمْرٍو وَابْنِ عَبَّاسٍ وَعَبِيدَةَ وَيُقَالُ عُبَيْدَةُ بْنُ عَمْرٍو وَعَائِشَةَ وَعَبْدِ الرَّحْمَنِ بْنِ عَائِشٍ الْحَضْرَمِيِّ وَأَنَسٍ قَالَ أَبُو عِيسَى وَحَدِيثُ أَبِي هُرَيْرَةَ فِي هَذَا الْبَابِ حَدِيثٌ حَسَنٌ صَحِيحٌ وَالْعَلَاءُ بْنُ عَبْدِ الرَّحْمَنِ هُوَ ابْنُ يَعْقُوبَ الْجُهَنِيُّ الْحُرَقِيُّ وَهُوَ ثِقَةٌ عِنْدَ أَهْلِ الْحَدِيثِ",8
71,1,"telah menceritakan kepada kami [Mahmud bin Ghailan] berkata, telah menceritakan kepada kami [Abdurrazaq] berkata, telah mengabarkan kepada kami [Ma'mar] dari [Hammam bin Munabbih] dari [Abu Hurairah] dari Nabi shallallahu 'alaihi wasallam, beliau bersabda: "" Sesungguhnya Allah tidak akan menerima shalat salah seorang dari kalian jika berhadats hingga ia berwudlu."" Abu Isa berkata; ""Hadits ini derajatnaya adalah hasan shahih.""","حَدَّثَنَا مَحْمُودُ بْنُ غَيْلَانَ حَدَّثَنَا عَبْدُ الرَّزَّاقِ أَخْبَرَنَا مَعْمَرٌ عَنْ هَمَّامِ بْنِ مُنَبِّهٍ عَنْ أَبِي هُرَيْرَةَ
عَنْ النَّبِيِّ صَلَّى اللَّهُ عَلَيْهِ وَسَلَّمَ قَالَ إِنَّ اللَّهَ لَا يَقْبَلُ صَلَاةَ أَحَدِكُمْ إِذَا أَحْدَثَ حَتَّى يَتَوَضَّأَ
قَالَ أَبُو عِيسَى هَذَا حَدِيثٌ حَسَنٌ صَحِيحٌ",8
138,2,"telah menceritakan kepada kami [Hannad bin As Sari] berkata; telah menceritakan kepada kami [Abdurrahman bin Abu Az Zinad] dari [Abdurrahman bin Al Harits bin Ayyasy bin Abu Rabi'ah] dari [Hakim bin Hakim] -yaitu Ibnu Abbad bin Hunaif- berkata; telah mengabarkan kepadaku [Nafi' bin Jubair bin Muth'im] berkata; telah mengabarkan kepadaku [Ibnu Abbas] bahwa Nabi shallallahu 'alaihi wasallam bersabda: ""Jibril 'Alaihis Salam pernah mengimamiku di sisi Ka'bah dua kali. Pertama kali, ia shalat zhuhur ketika bayang-bayang seperti tali sandal. Kemudian ia shalat asar ketika bayangan sesuatu seperti benda aslinya. Kemudian shalat maghrib ketika matahari terbenam dan orang-orang yang berpuasa berbuka. Kemudian shalat isya ketika warna merah di langit hilang. Setelah itu ia shalat subuh ketika fajar terbit dan makanan menjadi haram bagi orang yang berpuasa. Pada kali kedua, ia shalat zhuhur bayangan sesuatu sebagaimana aslinya, persis untuk waktu shalat asar kemarin. Lalu ia shalat asar ketika bayangan setiap sesuatu dua kali dari benda aslinya. Kemudian ia shalat maghrib sebagaimana waktu yang lalu, lalu shalat isya yang akhir ketika telah berlalu sepertiga waktu malam. Kemudian shalat subuh ketika matahari matahari telah merekah menyinari bumi. Setelah itu Jibril menoleh ke arahku seraya berkata; ""Wahai Muhammad, ini adalah waktu para Nabi sebelummu, dan waktu shalat adalah antara kedua waktu ini."" Abu Isa berkata; ""Dalam bab ini juga ada riwayat dari Abu Hurairah, Buraidah, Abu Musa, Abu Mas'ud Al Anshari, Abu Sa'id, Jabir, 'Amru bin Hazm, Al Bara dan Anas."" Telah mengabarkan kepadaku [Ahmad bin Musa] berkata; telah mengabarkan kepada kami [Abdullah bin Al Mubarak] berkata; telah mengabarkan kepada kami [Husain bin Ali bin Husain] berkata; telah mengabarkan kepadaku [Wahb bin Kaisan] dari [Jabir bin Abdullah] dari Rasulullah shallallahu 'alaihi wasallam, beliau bersabda: ""Jibril mengimamiku……lalu ia menyebutkan sebagaimana dalam hadits Ibnu Abbas secara makna. Dan ia tidak menyebutkan dalam hadits tersebut, ""Untuk waktu asar seperti yang kemarin."" Abu Isa berkata; ""Hadits ini derajatnya hasan shahih gharib. Dan hadits Ibnu Abbas derajatnya hadits hasan shahih. Muhammad berkata; ""Riwayat yang paling shahih dalam hal waktu shalat adalah hadits Jabir dari Nabi shallallahu 'alaihi wasallam."" Ia berkata; ""Hadits Jabir tentang waktu-waktu shalat telah diriwayatkan oleh ['Atha bin Abu Rabah] dan [Amru bin Dinar] dan [Abu Az Zubair] dari [Jabir bin Abdullah] dari Nabi shallallahu 'alaihi wasallam, seperti hadits Wahb bin kaisan, dari Jabir, dari Nabi shallallahu 'alaihi wasallam.""","حَدَّثَنَا هَنَّادُ بْنُ السَّرِيِّ حَدَّثَنَا عَبْدُ الرَّحْمَنِ بْنُ أَبِي الزِّنَادِ عَنْ عَبْدِ الرَّحْمَنِ بْنِ الْحَارِثِ بْنِ عَيَّاشِ بْنِ أَبِي رَبِيعَةَ عَنْ حَكِيمِ بْنِ حَكِيمٍ وَهُوَ ابْنُ عَبَّادِ بْنِ حُنَيْفٍ أَخْبَرَنِي نَافِعُ بْنُ جُبَيْرِ بْنِ مُطْعِمٍ قَالَ أَخْبَرَنِي ابْنُ عَبَّاسٍ
أَنَّ النَّبِيَّ صَلَّى اللَّهُ عَلَيْهِ وَسَلَّمَ قَالَ أَمَّنِي جِبْرِيلُ عَلَيْهِ السَّلَام عِنْدَ الْبَيْتِ مَرَّتَيْنِ فَصَلَّى الظُّهْرَ فِي الْأُولَى مِنْهُمَا حِينَ كَانَ الْفَيْءُ مِثْلَ الشِّرَاكِ ثُمَّ صَلَّى الْعَصْرَ حِينَ كَانَ كُلُّ شَيْءٍ مِثْلَ ظِلِّهِ ثُمَّ صَلَّى الْمَغْرِبَ حِينَ وَجَبَتْ الشَّمْسُ وَأَفْطَرَ الصَّائِمُ ثُمَّ صَلَّى الْعِشَاءَ حِينَ غَابَ الشَّفَقُ ثُمَّ صَلَّى الْفَجْرَ حِينَ بَرَقَ الْفَجْرُ وَحَرُمَ الطَّعَامُ عَلَى الصَّائِمِ وَصَلَّى الْمَرَّةَ الثَّانِيَةَ الظُّهْرَ حِينَ كَانَ ظِلُّ كُلِّ شَيْءٍ مِثْلَهُ لِوَقْتِ الْعَصْرِ بِالْأَمْسِ ثُمَّ صَلَّى الْعَصْرَ حِينَ كَانَ ظِلُّ كُلِّ شَيْءٍ مِثْلَيْهِ ثُمَّ صَلَّى الْمَغْرِبَ لِوَقْتِهِ الْأَوَّلِ ثُمَّ صَلَّى الْعِشَاءَ الْآخِرَةَ حِينَ ذَهَبَ ثُلُثُ اللَّيْلِ ثُمَّ صَلَّى الصُّبْحَ حِينَ أَسْفَرَتْ الْأَرْضُ ثُمَّ الْتَفَتَ إِلَيَّ جِبْرِيلُ فَقَالَ يَا مُحَمَّدُ هَذَا وَقْتُ الْأَنْبِيَاءِ مِنْ قَبْلِكَ وَالْوَقْتُ فِيمَا بَيْنَ هَذَيْنِ الْوَقْتَيْنِ
قَالَ أَبُو عِيسَى وَفِي الْبَاب عَنْ أَبِي هُرَيْرَةَ وَبُرَيْدَةَ وَأَبِي مُوسَى وَأَبِي مَسْعُودٍ الْأَنْصَارِيِّ وَأَبِي سَعِيدٍ وَجَابِرٍ وَعَمْرِو بْنِ حَزْمٍ وَالْبَرَاءِ وَأَنَسٍ أَخْبَرَنِي أَحْمَدُ بْنُ مُحَمَّدِ بْنِ مُوسَى أَخْبَرَنَا عَبْدُ اللَّهِ بْنُ الْمُبَارَكِ أَخْبَرَنَا حُسَيْنُ بْنُ عَلِيِّ بْنِ حُسَيْنٍ أَخْبَرَنِي وَهْبُ بْنُ كَيْسَانَ عَنْ جَابِرِ بْنِ عَبْدِ اللَّهِ عَنْ رَسُولِ اللَّهِ صَلَّى اللَّهُ عَلَيْهِ وَسَلَّمَ قَالَ أَمَّنِي جِبْرِيلُ فَذَكَرَ نَحْوَ حَدِيثِ ابْنِ عَبَّاسٍ بِمَعْنَاهُ وَلَمْ يَذْكُرْ فِيهِ لِوَقْتِ الْعَصْرِ بِالْأَمْسِ قَالَ أَبُو عِيسَى هَذَا حَدِيثٌ حَسَنٌ صَحِيحٌ غَرِيبٌ وَحَدِيثُ ابْنِ عَبَّاسٍ حَدِيثٌ حَسَنٌ صَحِيحٌ و قَالَ مُحَمَّدٌ أَصَحُّ شَيْءٍ فِي الْمَوَاقِيتِ حَدِيثُ جَابِرٍ عَنْ النَّبِيِّ صَلَّى اللَّهُ عَلَيْهِ وَسَلَّمَ قَالَ وَحَدِيثُ جَابِرٍ فِي الْمَوَاقِيتِ قَدْ رَوَاهُ عَطَاءُ بْنُ أَبِي رَبَاحٍ وَعَمْرُو بْنُ دِينَارٍ وَأَبُو الزُّبَيْرِ عَنْ جَابِرِ بْنِ عَبْدِ اللَّهِ عَنْ النَّبِيِّ صَلَّى اللَّهُ عَلَيْهِ وَسَلَّمَ نَحْوَ حَدِيثِ وَهْبِ بْنِ كَيْسَانَ عَنْ جَابِرٍ عَنْ النَّبِيِّ صَلَّى اللَّهُ عَلَيْهِ وَسَلَّمَ",8
139,2,"telah menceritakan kepada kami [Hannad] berkata; telah menceritakan kepada kami [Muhammad Ibnu Fudlail] dari [Al A'masy] dari [Abu Shalih] dari [Abu Hurairah] ia berkata; ""Rasulullah shallallahu 'alaihi wasallam bersabda: ""Sesungguhnya shalat mempunyai waktu awal dan waktu akhir. Awal waktu shalat zhuhur adalah ketika matahari tergelincir dan waktu akhirnya adalah ketika telah masuk waktu asar. Awal waktu shalat asar adalah ketika telah masuk waktunya dan akhirnya adalah ketika matahari berwarna kekuningan. Awal waktu shalat maghrib adalah ketika matahari terbenam dan waktu akhirnya adalah ketika warna kemerahan telah menghilang. Awal waktu isya adalah ketika warna merah telah menghilang dan waktu akhirnya adalah pertengahan malam. Dan awal shalat subuh adalah ketika terbit fajar, dan akhir waktunya adalah ketika matahari terbit."" Ia berkata; ""Dalam bab ini juga ada riwayat dari Abdullah bin Amru. Abu Isa berkata; ""Dan aku mendengar Muhammad berkata; ""Hadits Al A'masy dari Mujahid dalam hal waktu shalat adalah lebih shahih dari hadits Muhammad bin Fudlail dari Al A'masy, sedangkan hadits Muhammad bin Fudlail terdapat kesalahan yang dilakukan Muhammad bin Fudlail. Telah menceritakan kepada kami [Abu Usamah] dari [Abu Ishaq Al Fazari] dari [Al A'masy] dari [Mujahid] "". Ia berkata; ""Terkadang disebutkan; Sesungguhnya shalat memiliki waktu awal dan akhirnya, lalu ia menyebutkan seperti hadits Muhammad bin Fudlail dari Al A'masy seperti itu dengan maknanya.","حَدَّثَنَا هَنَّادٌ حَدَّثَنَا مُحَمَّدُ بْنُ فُضَيْلٍ عَنْ الْأَعْمَشِ عَنْ أَبِي صَالِحٍ عَنْ أَبِي هُرَيْرَةَ قَالَ
قَالَ رَسُولُ اللَّهِ صَلَّى اللَّهُ عَلَيْهِ وَسَلَّمَ إِنَّ لِلصَّلَاةِ أَوَّلًا وَآخِرًا وَإِنَّ أَوَّلَ وَقْتِ صَلَاةِ الظُّهْرِ حِينَ تَزُولُ الشَّمْسُ وَآخِرَ وَقْتِهَا حِينَ يَدْخُلُ وَقْتُ الْعَصْرِ وَإِنَّ أَوَّلَ وَقْتِ صَلَاةِ الْعَصْرِ حِينَ يَدْخُلُ وَقْتُهَا وَإِنَّ آخِرَ وَقْتِهَا حِينَ تَصْفَرُّ الشَّمْسُ وَإِنَّ أَوَّلَ وَقْتِ الْمَغْرِبِ حِينَ تَغْرُبُ الشَّمْسُ وَإِنَّ آخِرَ وَقْتِهَا حِينَ يَغِيبُ الْأُفُقُ وَإِنَّ أَوَّلَ وَقْتِ الْعِشَاءِ الْآخِرَةِ حِينَ يَغِيبُ الْأُفُقُ وَإِنَّ آخِرَ وَقْتِهَا حِينَ يَنْتَصِفُ اللَّيْلُ وَإِنَّ أَوَّلَ وَقْتِ الْفَجْرِ حِينَ يَطْلُعُ الْفَجْرُ وَإِنَّ آخِرَ وَقْتِهَا حِينَ تَطْلُعُ الشَّمْسُ
قَالَ وَفِي الْبَاب عَنْ عَبْدِ اللَّهِ بْنِ عَمْرٍو قَالَ أَبُو عِيسَى و سَمِعْت مُحَمَّدًا يَقُولُ حَدِيثُ الْأَعْمَشِ عَنْ مُجَاهِدٍ فِي الْمَوَاقِيتِ أَصَحُّ مِنْ حَدِيثِ مُحَمَّدِ بْنِ فُضَيْلٍ عَنْ الْأَعْمَشِ وَحَدِيثُ مُحَمَّدِ بْنِ فُضَيْلٍ خَطَأٌ أَخْطَأَ فِيهِ مُحَمَّدُ بْنُ فُضَيْلٍ حَدَّثَنَا هَنَّادٌ حَدَّثَنَا أَبُو أُسَامَةَ عَنْ أَبِي إِسْحَقَ الْفَزَارِيِّ عَنْ الْأَعْمَشِ عَنْ مُجَاهِدٍ قَالَ كَانَ يُقَالُ إِنَّ لِلصَّلَاةِ أَوَّلًا وَآخِرًا فَذَكَرَ نَحْوَ حَدِيثِ مُحَمَّدِ بْنِ فُضَيْلٍ عَنْ الْأَعْمَشِ نَحْوَهُ بِمَعْنَاهُ",8
140,2,"telah menceritakan kepada kami [Ahmad bin Mani'] dan [Al Hasan bin Ash Shabbah Al Bazzar] dan [Ahmad bin Muhammad bin Musa] dengan satu makna. Mereka berkata; ""Telah menceritakan kepada kami [Ishaq bin Yusuf Al Azraq] dari [Sufyan Ats Tsauri] dari [Alqamah bin Martsad] dari [Sulaiman bin Buraidah] dari [Ayahnya] ia berkata; ""Seorang laki-laki datang kepada Nabi shallallahu 'alaihi wasallam dan bertanya tentang waktu shalat, maka beliau pun bersabda: ""Ikutlah shalat bersama kami -insyaallah-."" Lalu beliau memerintahkan Bilal untuk iqamah. Maka ia iqamah ketika terbit fajar. Kemudian beliau memerintahkan iqamah, Bilal pun iqamah ketika matahari telah condong, maka beliau pun shalat zhuhur. Kemudian beliau memerintahkan untuk iqamah, Bilal pun iqamah dan beliau shalat asar ketika matahari berwarna putih dan masih tinggi. Kemudian beliau memerintahkan shalat maghrib ketika sinar marahari terbenam. Kemudian beliau memerintahkan iqamah shalat isya ketika warna merah di langit telah hilang. Dan pada keesokan harinya, beliau memerintahkan iqamah shalat subuh ketika matahari telah terang. Lalu beliau memerintahkan shalat zhuhur, dan beliau tetap menunggu hingga udara terasa sejuk dan enak. Lalu beliau memerintahkan shalat asar, beliau pun melaksanakan shalat sedangkan akhir waktunya tinggal sedikit lagi. Kemudian beliau memerintahkan iqamah lagi, namun beliau mengakhirkan maghrib hingga warna merah di langit hampir menghilang. Lalu beliau memerintahkan untuk shalat isya, dan beliau melaksanakannya ketika telah lewat dari waktu sepertiga malam. Setelah itu beliau bersabda: ""Dimana orang yang bertanya tentang waktu shalat?"" laki-laki itu menjawab, ""Saya."" Lalu beliau bersabda: ""Waktu-waktu shalat itu antara dua waktu ini."" Abu Isa berkata; ""Hadits ini derajatnya hasan gharib shahih."" Ia berkata; "" [Syu'bah] juga meriwayatkannya dari [Alqamah bin Martsad].""","حَدَّثَنَا أَحْمَدُ بْنُ مَنِيعٍ وَالْحَسَنُ بْنُ الصَّبَّاحِ الْبَزَّارُ وَأَحْمَدُ بْنُ مُحَمَّدِ بْنِ مُوسَى الْمَعْنَى وَاحِدٌ قَالُوا حَدَّثَنَا إِسْحَقُ بْنُ يُوسُفَ الْأَزْرَقُ عَنْ سُفْيَانَ الثَّوْرِيِّ عَنْ عَلْقَمَةَ بْنِ مَرْثَدٍ عَنْ سُلَيْمَانَ بْنِ بُرَيْدَةَ عَنْ أَبِيهِ قَالَ
أَتَى النَّبِيَّ صَلَّى اللَّهُ عَلَيْهِ وَسَلَّمَ رَجُلٌ فَسَأَلَهُ عَنْ مَوَاقِيتِ الصَّلَاةِ فَقَالَ أَقِمْ مَعَنَا إِنْ شَاءَ اللَّهُ فَأَمَرَ بِلَالًا فَأَقَامَ حِينَ طَلَعَ الْفَجْرُ ثُمَّ أَمَرَهُ فَأَقَامَ حِينَ زَالَتْ الشَّمْسُ فَصَلَّى الظُّهْرَ ثُمَّ أَمَرَهُ فَأَقَامَ فَصَلَّى الْعَصْرَ وَالشَّمْسُ بَيْضَاءُ مُرْتَفِعَةٌ ثُمَّ أَمَرَهُ بِالْمَغْرِبِ حِينَ وَقَعَ حَاجِبُ الشَّمْسِ ثُمَّ أَمَرَهُ بِالْعِشَاءِ فَأَقَامَ حِينَ غَابَ الشَّفَقُ ثُمَّ أَمَرَهُ مِنْ الْغَدِ فَنَوَّرَ بِالْفَجْرِ ثُمَّ أَمَرَهُ بِالظُّهْرِ فَأَبْرَدَ وَأَنْعَمَ أَنْ يُبْرِدَ ثُمَّ أَمَرَهُ بِالْعَصْرِ فَأَقَامَ وَالشَّمْسُ آخِرَ وَقْتِهَا فَوْقَ مَا كَانَتْ ثُمَّ أَمَرَهُ فَأَخَّرَ الْمَغْرِبَ إِلَى قُبَيْلِ أَنْ يَغِيبَ الشَّفَقُ ثُمَّ أَمَرَهُ بِالْعِشَاءِ فَأَقَامَ حِينَ ذَهَبَ ثُلُثُ اللَّيْلِ ثُمَّ قَالَ أَيْنَ السَّائِلُ عَنْ مَوَاقِيتِ الصَّلَاةِ فَقَالَ الرَّجُلُ أَنَا فَقَالَ مَوَاقِيتُ الصَّلَاةِ كَمَا بَيْنَ هَذَيْنِ
قَالَ أَبُو عِيسَى هَذَا حَدِيثٌ حَسَنٌ غَرِيبٌ صَحِيحٌ قَالَ وَقَدْ رَوَاهُ شُعْبَةُ عَنْ عَلْقَمَةَ بْنِ مَرْثَدٍ أَيْضًا",8
142,2,"telah menceritakan kepada kami [Hannad] berkata; telah menceritakan kepada kami [Abdah] -yaitu Ibnu Sulaiman- dari [Muhammad bin Ishaq] dari ['Ashim bin Umar bin Qatadah] dari [Mahmud bin Labid] dari [Rafi' bin Khadij] ia berkata; ""Aku mendengar Rasulullah shallallahu 'alaihi wasallam bersabda: ""Shalatlah subuh ketika agak siang, karena itu lebih banyak pahalanya."" Ia berkata; "" [Syu'bah] dan [Ats Tsauri] meriwayatkan hadits ini dari [Muhammad bin Ishaq]."" Ia berkata; ""Hadits ini juga diriwayatkan oleh [Muhammad bin 'Ajlan] dari ['Ashim bin Umar bin Qatadah]."" Ia berkata; ""Dalam bab ini juga ada riwayat dari Abu Barzah Al Aslami dan Jabir dan Bilal."" Abu Isa berkata; ""Hadits Rafi' bin Khadij adalah hadits hasan shahih. Dan bukan hanya satu ulama dari kalangan sahabat Nabi shallallahu 'alaihi wasallam dan tabi'in yang berpendapat bahwa shalat subuh dikerjakan ketika hari sudah agak terang. Pendapat ini juga dipegang oleh Sufyan Ats Tsauri. Syafi'i, Ahmad dan Ishaq mengatakan bahwa makna isfar adalah ketika fajar telah terang. Tidak diragukan lagi bahwa mereka tidak mengatakan bahwa makana isfar adalah mengakhirkan shalat.""","حَدَّثَنَا هَنَّادٌ حَدَّثَنَا عَبْدَةُ هُوَ ابْنُ سُلَيْمَانَ عَنْ مُحَمَّدِ بْنِ إِسْحَقَ عَنْ عَاصِمِ بْنِ عُمَرَ بْنِ قَتَادَةَ عَنْ مَحْمُودِ بْنِ لَبِيدٍ عَنْ رَافِعِ بْنِ خَدِيجٍ قَالَ
سَمِعْتُ رَسُولَ اللَّهِ صَلَّى اللَّهُ عَلَيْهِ وَسَلَّمَ يَقُولُ أَسْفِرُوا بِالْفَجْرِ فَإِنَّهُ أَعْظَمُ لِلْأَجْرِ
قَالَ وَقَدْ رَوَى شُعْبَةُ وَالثَّوْرِيُّ هَذَا الْحَدِيثَ عَنْ مُحَمَّدِ بْنِ إِسْحَقَ قَالَ وَرَوَاهُ مُحَمَّدُ بْنُ عَجْلَانَ أَيْضًا عَنْ عَاصِمِ بْنِ عُمَرَ بْنِ قَتَادَةَ قَالَ وَفِي الْبَاب عَنْ أَبِي بَرْزَةَ الْأَسْلَمِيِّ وَجَابِرٍ وَبِلَالٍ قَالَ أَبُو عِيسَى حَدِيثُ رَافِعِ بْنِ خَدِيجٍ حَدِيثٌ حَسَنٌ صَحِيحٌ وَقَدْ رَأَى غَيْرُ وَاحِدٍ مِنْ أَهْلِ الْعِلْمِ مِنْ أَصْحَابِ النَّبِيِّ صَلَّى اللَّهُ عَلَيْهِ وَسَلَّمَ وَالتَّابِعِينَ الْإِسْفَارَ بِصَلَاةِ الْفَجْرِ وَبِهِ يَقُولُ سُفْيَانُ الثَّوْرِيُّ و قَالَ الشَّافِعِيُّ وَأَحْمَدُ وَإِسْحَقُ مَعْنَى الْإِسْفَارِ أَنْ يَضِحَ الْفَجْرُ فَلَا يُشَكَّ فِيهِ وَلَمْ يَرَوْا أَنَّ مَعْنَى الْإِسْفَارِ تَأْخِيرُ الصَّلَاةِ",8
