haditsId,kitabId,indo,arab,label
2199,13,"Telah menceritakan kepada kami [Ali bin Muhammad] dan [Muhammad bin Isma'il] keduanya berkata; telah menceritakan kepada kami [Waki'] dari [Al Mas'udi] dari [Ali bin Mudrik] dari [Kharasyah Ibnul Hur] dari [Abu Dzar] dari Nabi shallallahu 'alaihi wasallam. (dalam jalur lain disebutkan) Telah menceritakan kepada kami [Muhammad bin Basysyar] berkata, telah menceritakan kepada kami [Muhammad bin Ja'far] berkata, telah menceritakan kepada kami [Syu'bah] dari [Ali bin Mudrik] dari [Abu Zur'ah bin Amru bin Jarir] dari [Khasyarah Ibnul Hur] dari [Abu Dzar] dari Nabi shallallahu 'alaihi wasallam, beliau bersabda: ""Ada tiga manusia yang tidak akan diajak bicara oleh Allah pada hari kiamat, tidak akan disucikan dosanya dan bagi mereka siksa yang pedih, "" aku bertanya, ""Wahai Rasulullah, siapakah mereka? sungguh sia-sia dan merugilah mereka?"" beliau bersabda: ""Orang yang kain sarungnya melebihi mata kaki, orang yang mengungkit-ungkit dalam pemberian, dan orang yang melariskan dagangan dengan sumpah palsu.""","حَدَّثَنَا عَلِيُّ بْنُ مُحَمَّدٍ وَمُحَمَّدُ بْنُ إِسْمَعِيلَ قَالَا حَدَّثَنَا وَكِيعٌ عَنْ الْمَسْعُودِيِّ عَنْ عَلِيِّ بْنِ مُدْرِكٍ عَنْ خَرَشَةَ بْنِ الْحُرِّ عَنْ أَبِي ذَرٍّ عَنْ النَّبِيِّ صَلَّى اللَّهُ عَلَيْهِ وَسَلَّمَ ح و حَدَّثَنَا مُحَمَّدُ بْنُ بَشَّارٍ حَدَّثَنَا مُحَمَّدُ بْنُ جَعْفَرٍ حَدَّثَنَا شُعْبَةُ عَنْ عَلِيِّ بْنِ مُدْرِكٍ عَنْ أَبِي زُرْعَةَ بْنِ عَمْرِو بْنِ جَرِيرٍ عَنْ خَرَشَةَ بْنِ الْحُرِّ عَنْ أَبِي ذَرٍّ
عَنْ النَّبِيِّ صَلَّى اللَّهُ عَلَيْهِ وَسَلَّمَ قَالَ ثَلَاثَةٌ لَا يُكَلِّمُهُمْ اللَّهُ يَوْمَ الْقِيَامَةِ وَلَا يَنْظُرُ إِلَيْهِمْ وَلَا يُزَكِّيهِمْ وَلَهُمْ عَذَابٌ أَلِيمٌ فَقُلْتُ مَنْ هُمْ يَا رَسُولَ اللَّهِ فَقَدْ خَابُوا وَخَسِرُوا قَالَ الْمُسْبِلُ إِزَارَهُ وَالْمَنَّانُ عَطَاءَهُ وَالْمُنَفِّقُ سِلْعَتَهُ بِالْحَلِفِ الْكَاذِبِ",30
2313,14,"Telah menceritakan kepada kami [Muhammad bin Abdullah bin Numair] dan [Ali bin Muhammad] keduanya berkata; telah menceritakan kepada kami [Waki'] dan [Abu Mu'awiyah] keduanya berkata; telah menceritakan kepada kami [Al A'masy] dari [Syaqiq] dari [Al Asy'ats bin Qais] ia berkata, ""Antara aku dengan seorang laki-laki yahudi terjadi perselisihan atas sebidang tanah, dan ia ingin mengingkariku. Maka aku serahkan hal itu kepada Nabi shallallahu 'alaihi wasallam, Rasulullah shallallahu 'alaihi wasallam lantas bersabda: ""Apakah kamu mempunyai bukti?"" aku menjawab, ""Tidak."" Beliau lalu bersabda kepada laki-laki yahudi itu, ""Silahkan kamu bersumpah! "" aku berkata, ""Jika demikian, ia akan bersumpah dan hilanglah apa yang menjadi hakku! "" maka Allah Subhaanahu menurunkan ayat: (Sesungguhnya orang-orang yang menukar janji (nya dengan) Allah dan sumpah-sumpah mereka dengan harga yang sedikit) hingga akhir ayat.""","حَدَّثَنَا مُحَمَّدُ بْنُ عَبْدِ اللَّهِ بْنِ نُمَيْرٍ وَعَلِيُّ بْنُ مُحَمَّدٍ قَالَا حَدَّثَنَا وَكِيعٌ وَأَبُو مُعَاوِيَةَ قَالَا حَدَّثَنَا الْأَعْمَشُ عَنْ شَقِيقٍ عَنْ الْأَشْعَثِ بْنِ قَيْسٍ قَالَ
كَانَ بَيْنِي وَبَيْنَ رَجُلٍ مِنْ الْيَهُودِ أَرْضٌ فَجَحَدَنِي فَقَدَّمْتُهُ إِلَى النَّبِيِّ صَلَّى اللَّهُ عَلَيْهِ وَسَلَّمَ فَقَالَ لِي رَسُولُ اللَّهِ صَلَّى اللَّهُ عَلَيْهِ وَسَلَّمَ هَلْ لَكَ بَيِّنَةٌ قُلْتُ لَا قَالَ لِلْيَهُودِيِّ احْلِفْ قُلْتُ إِذًا يَحْلِفُ فِيهِ فَيَذْهَبُ بِمَالِي فَأَنْزَلَ اللَّهُ سُبْحَانَهُ
{ إِنَّ الَّذِينَ يَشْتَرُونَ بِعَهْدِ اللَّهِ وَأَيْمَانِهِمْ ثَمَنًا قَلِيلًا }
إِلَخْ الْآيَةِ",30
2359,14,"Telah menceritakan kepada kami [Abu Mush'ab Al Madini Ahmad bin Abdullah Az Zuhri] dan [Ya'qub bin Ibrahim Ad Dauraqqi] keduanya berkata; telah menceritakan kepada kami [Abdul Aziz bin Muhammad Ad Darawardi] dari [Rabi'ah bin Abu 'Abdurrahman] dari [Suhail bin Abu Shalih] dari [Bapaknya] dari [Abu Hurairah] berkata, ""Rasulullah shallallahu 'alaihi wasallam memutuskan bahwa sumpah harus ada saksi.""","حَدَّثَنَا أَبُو مُصْعَبٍ الْمَدِينِيُّ أَحْمَدُ بْنُ عَبْدِ اللَّهِ الزُّهْرِيُّ وَيَعْقُوبُ بْنُ إِبْرَاهِيمَ الدَّوْرَقِيُّ قَالَا حَدَّثَنَا عَبْدُ الْعَزِيزِ بْنُ مُحَمَّدٍ الدَّرَاوَرْدِيُّ عَنْ رَبِيعَةَ بْنِ أَبِي عَبْدِ الرَّحْمَنِ عَنْ سُهَيْلِ بْنِ أَبِي صَالِحٍ عَنْ أَبِيهِ عَنْ أَبِي هُرَيْرَةَ
أَنَّ رَسُولَ اللَّهِ صَلَّى اللَّهُ عَلَيْهِ وَسَلَّمَ قَضَى بِالْيَمِينِ مَعَ الشَّاهِدِ",30
2360,14,"Telah menceritakan kepada kami [Muhammad bin Basysyar] berkata, telah menceritakan kepada kami [Abdul Wahhab] berkata, telah menceritakan kepada kami [Ja'far bin Muhammad] dari [Bapaknya] dari [Jabir] berkata, ""Nabi shallallahu 'alaihi wasallam memutuskan bahwa sumpah harus ada saksi.""","حَدَّثَنَا مُحَمَّدُ بْنُ بَشَّارٍ حَدَّثَنَا عَبْدُ الْوَهَّابِ حَدَّثَنَا جَعْفَرُ بْنُ مُحَمَّدٍ عَنْ أَبِيهِ عَنْ جَابِرٍ
أَنَّ النَّبِيَّ صَلَّى اللَّهُ عَلَيْهِ وَسَلَّمَ قَضَى بِالْيَمِينِ مَعَ الشَّاهِدِ",30
2431,14,"Telah menceritakan kepada kami [Abu Bakr bin Abu Syaibah] berkata, telah menceritakan kepada kami [Waki'] dari [Zakariya] dari [Asy Sya'bi] dari [Abu Hurairah] ia berkata, ""Rasulullah shallallahu 'alaihi wasallam bersabda: ""Punggung kendaraan boleh dinaiki jika tergadai, susu boleh diminum jika tergadai, dan bagi orang yang menaiki dan meminum wajib memberikan nafkahnya (biaya perawatan).""","حَدَّثَنَا أَبُو بَكْرِ بْنُ أَبِي شَيْبَةَ حَدَّثَنَا وَكِيعٌ عَنْ زَكَرِيَّا عَنْ الشَّعْبِيِّ عَنْ أَبِي هُرَيْرَةَ قَالَ
قَالَ رَسُولُ اللَّهِ صَلَّى اللَّهُ عَلَيْهِ وَسَلَّمَ الظَّهْرُ يُرْكَبُ إِذَا كَانَ مَرْهُونًا وَلَبَنُ الدَّرِّ يُشْرَبُ إِذَا كَانَ مَرْهُونًا وَعَلَى الَّذِي يَرْكَبُ وَيَشْرَبُ نَفَقَتُهُ",30
