haditsId,kitabId,indo,arab,label
231,2,"Telah menceritakan kepada kami [Abu ath-Thahir Ahmad bin Amru bin Abdullah bin Amru bin Sarh] telah mengabarkan kepada kami [Ibnu Wahb] dia berkata, telah mengabarkan kepadaku [Yunus] dari [Ibnu Syihab] dia berkata, telah menceritakan kepada kami [Urwah bin az-Zubair] bahwa [Aisyah] isteri Nabi shallallahu 'alaihi wasallam, telah mengabarkan kepadanya bahwa, dia berkata, ""Wahyu Rasulullah shallallahu 'alaihi wasallam yang pertama kali terjadi adalah dalam bentuk mimpi yang benar dalam tidur beliau. Tidaklah beliau mendapati mimpi tersebut melainkan sebagaimana munculnya keheningan fajar subuh, kemudian beliau suka menyepi sendiri. Beliau biasanya menyepi di gua Hira'. Di sana beliau menghabiskan beberapa malam untuk beribadah kepada Allah sebelum kembali ke rumah. Untuk tujuan tersebut, beliau membawa sedikit perbekalan. (Setelah beberapa hari berada di sana) beliau pulang kepada Khadijah, mengambil perbekalan untuk beberapa malam. Keadaan ini terus berlarut, sehingga beliau dibawakan wahyu ketika beliau berada di gua Hira'. Wahyu tersebut disampaikan oleh Malaikat Jibril dengan berkata, 'Bacalah wahai Muhammad! ' Beliau bersabda: ""Aku tidak pandai membaca."" Rasulullah bersabda: ""Lalu malaikat memegang dan memelukku erat-erat, ketika aku merasakan kepayahan ia pun melepasku. Kemudian dia berkata, 'Bacalah wahai Muhammad! ' Beliau bersabda: 'Aku lalu menjawab, 'Aku tidak bisa membaca'. Beliau melanjutkan: 'Jibril kemudian memegang dan memelukku erat-erat lagi, hingga ketika aku merasakan kepayahan ia pun melepasnya kembali. Kemudian ia berkata, 'Bacalah wahai Muhammad! ' Beliau bersabda: ""Aku lalu menjawab: 'Aku tidak pandai membaca.' Beliau melanjutkan: 'Jibril kembali memegang dan memelukku erat-erat, sehingga ketika aku merasakan kepayahan, ia pun melepaskanku. Kemudian dia membaca firman Allah: '(Bacalah wahai Muhammad dengan nama Rabbmu yang menciptakan sekalian makhluk. Dia menciptakan manusia dari segumpal darah, bacalah, dan Rabbmu Yang Maha Pemurah yang mengajar manusia melalui pena. Dia mengajar manusia sesuatu yang tidak diketahui) ' (Qs. Al 'Alaq: 1-5). Setelah kejadian itu beliau pulang dalam keadaan ketakutan hingga menemui Khadijah, seraya beliau berkata: 'Selimutilah aku! Selimutilah aku.' Lalu Khadijah memberi beliau selimut hingga hilang rasa gementar dari diri beliau. Beliau kemudian bersabda kepada Khadijah: 'Wahai Khadijah! Apakah yang telah terjadi kepadaku? ' Beliau pun menceritakan seluruh peristiwa yang telah terjadi. Beliau bersabda lagi: 'Aku benar-benar khawatir pada diriku.' Khadijah terus menghibur beliau dengan berkata, 'Janganlah begitu, bergembiralah! Demi Allah, Allah tidak akan menghinakanmu, selama-lamanya. Demi Allah! Sesungguhnya, kamu telah menyambung tali persaudaraan, berbicara jujur, memikul beban orang lain, suka mengusahakan sesuatu yang tidak ada, menjamu tamu dan sentiasa membela faktor-faktor kebenaran.' Khadijah beranjak seketika menemui Waraqah bin Naufal bin Asad bin Abdul Uzza, sepupu Khadijah. Dia pernah menjadi Nashrani pada zaman Jahiliyah. Dia suka menulis dengan tulisan Arab dan cukup banyak menulis kitab Injil dalam tulisan Arab. Ketika itu dia telah tua dan buta. Khadijah berkata kepadanya, 'Paman! (Paman adalah panggilan yang biasa digunakan oleh bangsa Arab bagi sepupu dan sebagainya karena menghormati mereka atas dasar lebih tua) Dengarlah cerita anak saudaramu ini.' Waraqah bin Naufal berkata, 'Wahai anak saudaraku! Apakah yang telah terjadi? ' maka Rasulullah shallallahu 'alaihi wasallam menceritakan semua peristiwa yang beliau telah alami. Mendengar peristiwa itu, Waraqah berkata, 'Ini adalah undang-undang yang dahulu pernah diturunkan kepada Nabi Musa. Alangkah baik seandainya aku masih muda di saat-saat kamu dibangkitkan menjadi Nabi. Juga alangkah baik kiranya aku masih hidup di saat-saat kamu diusir oleh kaummu.' Lalu Rasulullah shallallahu 'alaihi wasallam menegaskan: 'Apakah mereka akan mengusirku? ' Waraqah menjawab, ""Ya, tidaklah setiap Nabi yang bangkit membawa tugas sepertimu, melainkan pasti akan dimusuhi. Seandainya aku masih hidup di zamanmu, niscaya aku akan tetap menolong dan membelamu'."" Dan telah menceritakan kepada kami [Muhammad bin Rafi'] telah menceritakan kepada kami [Abdurrazzaq] telah mengabarkan kepada kami [Ma'mar] dia berkata, [az-Zuhri] berkata, Dan telah mengabarkan kepada kami [Urwah] dari [Aisyah] bahwa dia berkata, ""Wahyu Rasulullah shallallahu 'alaihi wasallam yang pertama kali terjadi adalah…lalu dia melansirkan hadits seperti hadits Yunus, hanya saja dia berkata, ""Demi Allah, Allah tidak akan membuatmu sedih selamanya."" Dan dia berkata, ""Khadijah berjakah, 'Wahai pamanku, dengarkan dari anak saudaramu ini'."" Dan telah menceritakan kepada kami [Abdul Malik bin Syu'aib bin al-Laits] dia berkata, telah menceritakan kepada kami [bapakku] dari [kakekku] dia berkata, telah menceritakan kepada kami [Uqail bin Khalid] berkata [Ibnu Syihab] saya mendengar [Urwah bin az-Zubair] berkata, [Aisyah] isteri Nabi shallallahu 'alaihi wasallam berkata, ""Lalu beliau kembali pada Khadijah dalam keadaan hatinya ketakutan, "" lalu menceritakan hadits seperti hadits Yunus dan Ma'mar. Hanya saja dia tidak menyebutkan awal dari hadits keduanya, ""Wahyu Rasulullah shallallahu 'alaihi wasallam yang pertama kali terjadi adalah mimpi yang benar."" Dan dia mengikuti perkataan Yunus, ""Demi Allah, Allah tidak akan menghinakanmu selamanya."" Lalu dia menyebutkan perkataan Khadijah, ""Wahai pamanku, dengarkan dari anak saudaramu.""","حَدَّثَنِي أَبُو الطَّاهِرِ أَحْمَدُ بْنُ عَمْرِو بْنِ عَبْدِ اللَّهِ بْنِ عَمْرِو بْنِ سَرْحٍ أَخْبَرَنَا ابْنُ وَهْبٍ قَالَ أَخْبَرَنِي يُونُسُ عَنْ ابْنِ شِهَابٍ قَالَ حَدَّثَنِي عُرْوَةُ بْنُ الزُّبَيْرِ أَنَّ عَائِشَةَ زَوْجَ النَّبِيِّ صَلَّى اللَّهُ عَلَيْهِ وَسَلَّمَ أَخْبَرَتْهُ
أَنَّهَا قَالَتْ كَانَ أَوَّلُ مَا بُدِئَ بِهِ رَسُولُ اللَّهِ صَلَّى اللَّهُ عَلَيْهِ وَسَلَّمَ مِنْ الْوَحْيِ الرُّؤْيَا الصَّادِقَةَ فِي النَّوْمِ فَكَانَ لَا يَرَى رُؤْيَا إِلَّا جَاءَتْ مِثْلَ فَلَقِ الصُّبْحِ ثُمَّ حُبِّبَ إِلَيْهِ الْخَلَاءُ فَكَانَ يَخْلُو بِغَارِ حِرَاءٍ يَتَحَنَّثُ فِيهِ وَهُوَ التَّعَبُّدُ اللَّيَالِيَ أُوْلَاتِ الْعَدَدِ قَبْلَ أَنْ يَرْجِعَ إِلَى أَهْلِهِ وَيَتَزَوَّدُ لِذَلِكَ ثُمَّ يَرْجِعُ إِلَى خَدِيجَةَ فَيَتَزَوَّدُ لِمِثْلِهَا حَتَّى فَجِئَهُ الْحَقُّ وَهُوَ فِي غَارِ حِرَاءٍ فَجَاءَهُ الْمَلَكُ فَقَالَ اقْرَأْ قَالَ مَا أَنَا بِقَارِئٍ قَالَ فَأَخَذَنِي فَغَطَّنِي حَتَّى بَلَغَ مِنِّي الْجَهْدَ ثُمَّ أَرْسَلَنِي فَقَالَ اقْرَأْ قَالَ قُلْتُ مَا أَنَا بِقَارِئٍ قَالَ فَأَخَذَنِي فَغَطَّنِي الثَّانِيَةَ حَتَّى بَلَغَ مِنِّي الْجَهْدَ ثُمَّ أَرْسَلَنِي فَقَالَ أَقْرَأْ فَقُلْتُ مَا أَنَا بِقَارِئٍ فَأَخَذَنِي فَغَطَّنِي الثَّالِثَةَ حَتَّى بَلَغَ مِنِّي الْجَهْدَ ثُمَّ أَرْسَلَنِي فَقَالَ
{ اقْرَأْ بِاسْمِ رَبِّكَ الَّذِي خَلَقَ خَلَقَ الْإِنْسَانَ مِنْ عَلَقٍ اقْرَأْ وَرَبُّكَ الْأَكْرَمُ الَّذِي عَلَّمَ بِالْقَلَمِ عَلَّمَ الْإِنْسَانَ مَا لَمْ يَعْلَمْ }
فَرَجَعَ بِهَا رَسُولُ اللَّهِ صَلَّى اللَّهُ عَلَيْهِ وَسَلَّمَ تَرْجُفُ بَوَادِرُهُ حَتَّى دَخَلَ عَلَى خَدِيجَةَ فَقَالَ زَمِّلُونِي زَمِّلُونِي فَزَمَّلُوهُ حَتَّى ذَهَبَ عَنْهُ الرَّوْعُ ثُمَّ قَالَ لِخَدِيجَةَ أَيْ خَدِيجَةُ مَا لِي وَأَخْبَرَهَا الْخَبَرَ قَالَ لَقَدْ خَشِيتُ عَلَى نَفْسِي قَالَتْ لَهُ خَدِيجَةُ كَلَّا أَبْشِرْ فَوَاللَّهِ لَا يُخْزِيكَ اللَّهُ أَبَدًا وَاللَّهِ إِنَّكَ لَتَصِلُ الرَّحِمَ وَتَصْدُقُ الْحَدِيثَ وَتَحْمِلُ الْكَلَّ وَتَكْسِبُ الْمَعْدُومَ وَتَقْرِي الضَّيْفَ وَتُعِينُ عَلَى نَوَائِبِ الْحَقِّ فَانْطَلَقَتْ بِهِ خَدِيجَةُ حَتَّى أَتَتْ بِهِ وَرَقَةَ بْنَ نَوْفَلِ بْنِ أَسَدِ بْنِ عَبْدِ الْعُزَّى وَهُوَ ابْنُ عَمِّ خَدِيجَةَ أَخِي أَبِيهَا وَكَانَ امْرَأً تَنَصَّرَ فِي الْجَاهِلِيَّةِ وَكَانَ يَكْتُبُ الْكِتَابَ الْعَرَبِيَّ وَيَكْتُبُ مِنْ الْإِنْجِيلِ بِالْعَرَبِيَّةِ مَا شَاءَ اللَّهُ أَنْ يَكْتُبَ وَكَانَ شَيْخًا كَبِيرًا قَدْ عَمِيَ فَقَالَتْ لَهُ خَدِيجَةُ أَيْ عَمِّ اسْمَعْ مِنْ ابْنِ أَخِيكَ قَالَ وَرَقَةُ بْنُ نَوْفَلٍ يَا ابْنَ أَخِي مَاذَا تَرَى فَأَخْبَرَهُ رَسُولُ اللَّهِ صَلَّى اللَّهُ عَلَيْهِ وَسَلَّمَ خَبَرَ مَا رَآهُ فَقَالَ لَهُ وَرَقَةُ هَذَا النَّامُوسُ الَّذِي أُنْزِلَ عَلَى مُوسَى صَلَّى اللَّهُ عَلَيْهِ وَسَلَّمَ يَا لَيْتَنِي فِيهَا جَذَعًا يَا لَيْتَنِي أَكُونُ حَيًّا حِينَ يُخْرِجُكَ قَوْمُكَ قَالَ رَسُولُ اللَّهِ صَلَّى اللَّهُ عَلَيْهِ وَسَلَّمَ أَوَ مُخْرِجِيَّ هُمْ قَالَ وَرَقَةُ نَعَمْ لَمْ يَأْتِ رَجُلٌ قَطُّ بِمَا جِئْتَ بِهِ إِلَّا عُودِيَ وَإِنْ يُدْرِكْنِي يَوْمُكَ أَنْصُرْكَ نَصْرًا مُؤَزَّرًا
و حَدَّثَنِي مُحَمَّدُ بْنُ رَافِعٍ حَدَّثَنَا عَبْدُ الرَّزَّاقِ أَخْبَرَنَا مَعْمَرٌ قَالَ قَالَ الزُّهْرِيُّ وَأَخْبَرَنِي عُرْوَةُ عَنْ عَائِشَةَ أَنَّهَا قَالَتْ أَوَّلُ مَا بُدِئَ بِهِ رَسُولُ اللَّهِ صَلَّى اللَّهُ عَلَيْهِ وَسَلَّمَ مِنْ الْوَحْيِ وَسَاقَ الْحَدِيثَ بِمِثْلِ حَدِيثِ يُونُسَ غَيْرَ أَنَّهُ قَالَ فَوَاللَّهِ لَا يُحْزِنُكَ اللَّهُ أَبَدًا وَقَالَ قَالَتْ خَدِيجَةُ أَيْ ابْنَ عَمِّ اسْمَعْ مِنْ ابْنِ أَخِيكَ و حَدَّثَنِي عَبْدُ الْمَلِكِ بْنُ شُعَيْبِ بْنِ اللَّيْثِ قَالَ حَدَّثَنِي أَبِي عَنْ جَدِّي قَالَ حَدَّثَنِي عُقَيْلُ بْنُ خَالِدٍ قَالَ ابْنُ شِهَابٍ سَمِعْتُ عُرْوَةَ بْنَ الزُّبَيْرِ يَقُولُ قَالَتْ عَائِشَةُ زَوْجُ النَّبِيِّ صَلَّى اللَّهُ عَلَيْهِ وَسَلَّمَ فَرَجَعَ إِلَى خَدِيجَةَ يَرْجُفُ فُؤَادُهُ وَاقْتَصَّ الْحَدِيثَ بِمِثْلِ حَدِيثِ يُونُسَ وَمَعْمَرٍ وَلَمْ يَذْكُرْ أَوَّلَ حَدِيثِهِمَا مِنْ قَوْلِهِ أَوَّلُ مَا بُدِئَ بِهِ رَسُولُ اللَّهِ صَلَّى اللَّهُ عَلَيْهِ وَسَلَّمَ مِنْ الْوَحْيِ الرُّؤْيَا الصَّادِقَةُ وَتَابَعَ يُونُسَ عَلَى قَوْلِهِ فَوَاللَّهِ لَا يَخْزِيكَ اللَّهُ أَبَدًا وَذَكَرَ قَوْلَ خَدِيجَةَ أَيْ ابْنَ عَمِّ اسْمَعْ مِنْ ابْنِ أَخِيكَ",0
651,5,"Telah menceritakan kepada kami [Abu Bakar bin Abi Syaibah] dan [Abu Kuraib] keduanya berkata, telah menceritakan kepada kami [Abu Muawiyah] dari [al-A'masy] dari [al-Musayyab bin Rafi'] dari [Tamim bin Tharafah] dari [Jabir bin Samurah] dia berkata, ""Mengapa aku melihat kalian mengangkat tangan kalian, seakan-akan ia adalah ekor kuda yang tidak bisa diam. Kalian diamlah di dalam shalat."" Perawi berkata, ""Kemudian beliau keluar melewati kami, lalu beliau melihat kami bergerombol, maka beliau bersabda, 'Mengapa aku melihat kalian bercerai berai'."" Perawi berkata, ""Kemudian Rasulullah keluar menemui kami seraya bersabda, 'Mengapa kalian tidak berbaris sebagaimana malaikat berbaris di sisi Rabbnya? ' Maka kami berkata, 'Wahai Rasulullah, bagaimana malaikat berbaris di sisi Rabbnya? ' Beliau bersabda, 'Mereka menyempurnakan barisan awal dan menempelkan diri dalam barisan'."" Dan telah menceritakan kepadaku [Abu Sa'id al-Asyajj] telah menceritakan kepada kami [Waki'] --lewat jalur periwayatan lain-- dan telah menceritakan kepada kami [Ishaq bin Ibrahim] telah mengabarkan kepada kami [Isa bin Yunus] semuanya berkata, telah menceritakan kepada kami [al-A'masy] dengan isnad ini hadits semisalnya.","حَدَّثَنَا أَبُو بَكْرِ بْنُ أَبِي شَيْبَةَ وَأَبُو كُرَيْبٍ قَالَا حَدَّثَنَا أَبُو مُعَاوِيَةَ عَنْ الْأَعْمَشِ عَنْ الْمُسَيَّبِ بْنِ رَافِعٍ عَنْ تَمِيمِ بْنِ طَرَفَةَ عَنْ جَابِرِ بْنِ سَمُرَةَ قَالَ
خَرَجَ عَلَيْنَا رَسُولُ اللَّهِ صَلَّى اللَّهُ عَلَيْهِ وَسَلَّمَ فَقَالَ مَا لِي أَرَاكُمْ رَافِعِي أَيْدِيكُمْ كَأَنَّهَا أَذْنَابُ خَيْلٍ شُمْسٍ اسْكُنُوا فِي الصَّلَاةِ قَالَ ثُمَّ خَرَجَ عَلَيْنَا فَرَآنَا حَلَقًا فَقَالَ مَالِي أَرَاكُمْ عِزِينَ قَالَ ثُمَّ خَرَجَ عَلَيْنَا فَقَالَ أَلَا تَصُفُّونَ كَمَا تَصُفُّ الْمَلَائِكَةُ عِنْدَ رَبِّهَا فَقُلْنَا يَا رَسُولَ اللَّهِ وَكَيْفَ تَصُفُّ الْمَلَائِكَةُ عِنْدَ رَبِّهَا قَالَ يُتِمُّونَ الصُّفُوفَ الْأُوَلَ وَيَتَرَاصُّونَ فِي الصَّفِّ
و حَدَّثَنِي أَبُو سَعِيدٍ الْأَشَجُّ حَدَّثَنَا وَكِيعٌ ح و حَدَّثَنَا إِسْحَقُ بْنُ إِبْرَاهِيمَ أَخْبَرَنَا عِيسَى بْنُ يُونُسَ قَالَا جَمِيعًا حَدَّثَنَا الْأَعْمَشُ بِهَذَا الْإِسْنَادِ نَحْوَهُ",0
919,6,"Telah menceritakan kepada kami [Muhammad bin Hatim] telah mengabarkan kepada kami [Muhammad bin Bakr] telah mengabarkan kepada kami [Ibn Juraij] katanya; (Dan diriwayatkan dari jalur lain) telah menceritakan kepadaku [Ishaq bin Manshur] dan lafadz darinya, dia berkata; telah mengabarkan kepada kami [Abdurrazaq] telah mengabarkan kepada kami [Ibn Juraij] telah mengabarkan kepadaku ['Amru bin Dinar], bahwa [Abu Ma'bad] mantan budak Ibn Abbas mengabarinya, bahwa [Ibn Abbas] pernah mengabarinya; ""Bahwa mengeraskan suara dzikr sehabis shalat wajib, pernah terjadi di masa Nabi shallallahu 'alaihi wasallam."" kata Abu Ma'bad; Ibn Abbas mengatakan; ""Akulah yang paling tahu tentang hal itu, ketika mereka telah selesai (mengerjakan shalat), sebab aku pernah mendengarnya.""","حَدَّثَنَا مُحَمَّدُ بْنُ حَاتِمٍ أَخْبَرَنَا مُحَمَّدُ بْنُ بَكْرٍ أَخْبَرَنَا ابْنُ جُرَيْجٍ قَالَ ح و حَدَّثَنِي إِسْحَقُ بْنُ مَنْصُورٍ وَاللَّفْظُ لَهُ قَالَ أَخْبَرَنَا عَبْدُ الرَّزَّاقِ أَخْبَرَنَا ابْنُ جُرَيْجٍ أَخْبَرَنِي عَمْرُو بْنُ دِينَارٍ أَنَّ أَبَا مَعْبَدٍ مَوْلَى ابْنِ عَبَّاسٍ أَخْبَرَهُ أَنَّ ابْنَ عَبَّاسٍ أَخْبَرَهُ
أَنَّ رَفْعَ الصَّوْتِ بِالذِّكْرِ حِينَ يَنْصَرِفُ النَّاسُ مِنْ الْمَكْتُوبَةِ كَانَ عَلَى عَهْدِ النَّبِيِّ صَلَّى اللَّهُ عَلَيْهِ وَسَلَّمَ وَأَنَّهُ قَالَ قَالَ ابْنُ عَبَّاسٍ كُنْتُ أَعْلَمُ إِذَا انْصَرَفُوا بِذَلِكَ إِذَا سَمِعْتُهُ",0
2049,16,"Dan Telah menceritakan kepada kami [Yahya bin Yahya] dan [Abu Bakr bin Abu Syaibah] dan [Abu Kuraib] -Yahya berkata- telah mengabarkan kepada kami -sementara dua orang yang lain berkata- Telah menceritakan kepada kami [Abu Mu'awiyah] dari [Al A'masy] dari [Ibrahim] dari [Al Aswad] dari [Aisyah] radliallahu 'anha, ia berkata; ""Aku seolah-olah masih melihat kemilau harum-haruman di garis sisiran kepala Rasulullah shallallahu 'alaihi wasallam ketika beliau sedang membaca Talbiyah.""","و حَدَّثَنَا يَحْيَى بْنُ يَحْيَى وَأَبُو بَكْرِ بْنُ أَبِي شَيْبَةَ وَأَبُو كُرَيْبٍ قَالَ يَحْيَى أَخْبَرَنَا و قَالَ الْآخَرَانِ حَدَّثَنَا أَبُو مُعَاوِيَةَ عَنْ الْأَعْمَشِ عَنْ إِبْرَاهِيمَ عَنْ الْأَسْوَدِ عَنْ عَائِشَةَ رَضِيَ اللَّهُ عَنْهَا قَالَتْ
لَكَأَنِّي أَنْظُرُ إِلَى وَبِيصِ الطِّيبِ فِي مَفَارِقِ رَسُولِ اللَّهِ صَلَّى اللَّهُ عَلَيْهِ وَسَلَّمَ وَهُوَ يُهِلُّ",0
