haditsId,kitabId,indo,arab,label
3322,33,"Telah menceritakan kepada kami [Ishaq bin Ibrahim Al Hanzhali] dan [Ibnu Abu Umar] serta [Muhammad bin Rafi'] dan [Abd bin Humaid] sedangkan lafadznya dari Ibnu Rafi', Ibnu Rafi' dan Ibnu Abu Umar mengatakan; telah menceritakan kepada kami, sedangkan yang dua mengatakan; telah mengabarkan kepada kami [Abdurrazaq] telah mengabarkan kepada kami [Ma'mar] dari [Az Zuhri] dari [Ubaidullah bin Abdullah bin 'Utbah] dari [Ibnu Abbas] bahwa [Abu Sufyan] mengisahkan dari mulutnya sendiri sebagai berikut, ""Pada saat berlangsungnya perjanjian damai antara aku dengan Rasulullah shallallahu 'alaihi wasallam, aku pergi berniaga ke negeri Syam. Ketika aku berada di sana, ada seseorang yang mengirim sepucuk surat dari Rasulullah shallallahu 'alaihi wasallam kepada kaisar Heraclius, penguasa agung Rumawi, yang membawa surat itu adalah Dihyah Al Kalbi kepada pembesar Bushra, kemudian pembesar Bushra menyampaikannya kepada Heraclius. Lantas Heraclius bertanya, ""Adakah di sini orang yang berasal dari kaumnya laki-laki yang mengaku sebagai Nabi ini (Rasulullah)? ' mereka menjawab, ""Ya."" Lalu aku dipanggil untuk menghadap Heraclius bersama beberapa kawanku dari suku Quraisy, kami masuk dan duduk menghadap Hiraclius. Heraclius lantas bertanya, ""Siapakah di antara kalian, yang dekat pertalian darahnya dengan orang yang mendakwakan dirinya menjadi Nabi itu?"" Abu Sufyan berkata, ""Lalu aku menjawab, ""Aku."" Lalu aku duduk di depan, sedangkan kawan-kawanku duduk di belakangku. Kemudian dia memanggil penerjemahnya, lalu dia berkata kepada penerjemahnya, ""Katakanlah kepada mereka, bahwa aku menanyakan kepada mereka perihal laki-laki yang mendakwakan dirinya sebagai Nabi, jika dia berdusta, katakan dia telah berdusta."" Abu Sufyan berkata, ""Demi Allah, kalaulah aku tidak takut dicap sebagai pendusta, sungguh telah ku dustai mereka."" Kemudian Heraclius berkata kepada penerjemahnya, ""Tanyakan kepadanya, bagaimana kebangsaan orang itu di kalanganmu."" Abu Sufyan berkata, ""Jawabku, ""Dia seorang bangsawan di kalangan kami."" Dia bertanya, ""Apakah dia keturunan raja?"" aku menjawab, ""Tidak."" Dia bertanya, ""Pernahkah kalian mengatakannya sebagai pembohong sebelum ia menjadi seorang Nabi?"" Jaawabku, ""Tidak."" Dia bertanya, ""Apakah orang-orang yang mengikutinya dari kalangan pembesar ataukah hanya rakyat kecil?"" jawabku, ""Hanya rakyat kecil."" Dia bertanya, ""Apakah pengikutnya selalu bertambah?"" Jawabku, ""Mereka selalu bertambah."" Dia bertanya, ""Adakah di antara pengikutnya itu murtad karena benci terhadap agama yang dikembangkannya?"" Jawabku, ""Tidak."" Dia bertanya, ""Apakah kamu berperang melawannya?"" Jawabku, ""Ya, pernah."" Dia bertanya, ""Bagaimana perjalanan peperanganmu melawannya?"" Jawabku, ""Peperangan kami berjalan silih berganti antara menang dan kalah. Kadang-kadang kamilah yang menang dan dia yang kalah, dan terkadang pula kami yang kalah dan dia yang menang."" Dia bertanya, ""Apakah dia pernah ingkat janji?"" Jawabku, ""Tidak, bahkan kami sedang dalam masa perjanjian damai, yaitu tidak akan serang menyerang dengannya. Aku tidak tahu apa yang akan dibuatnya terhadap perjanjian tersebut."" Kata Abu Sufyan selanjutnya, ""Demi Allah, tidak ada kalimat lain yang dapat kami ucapkan selain dari pada itu semua."" Dia bertanya, ""Apakah ada orang lain sebelum dia, yang mendakwakan dirinya sebagai Nabi seperti dia?"" Jawabku, ""Tidak."" Kemudian dia berkata kepada penerjemahnya, ""Katakan kepadanya, ""Kutanyakan kepadamu tentang bangsanya (status sosialnya), maka kalian katakan dia termasuk dari bangsawan. Memang demikianlah halnya semua para rasul, mereka dibangkitkan dari kalangan bangsawan kaumnya. Kutanyakan pula kepadamu, apakah dia dari keturunan para raja? Jawabmu 'tidak', kalau sekiranya bapak dan kakeknya yang menjadi raja, tentunya ada sangkaan bahwa dia ingin mengembalikan kekusaan nenek moyangnya. Kutanyakan pula tentang pengikutnya, apakah terdiri dari rakyat kecil atau dari orang-orang besar? Kamu menjawab 'hanya terdiri dari rakyat kecil', memang merekalah pengikut para rasul. Kutanyakan pula, pernahkah kamu menuduhnya sebagai pembohong sebelumnya? Kamu menjawab 'tidak', aku tahu, bahwa dia tidak akan pernah berdusta kepada manusia, apalagi bedusta kepada Allah. Aku tanyakan kepadamu; adakah pengikutnya yang murtad atau mereka membenci agama baru setelah memeluknya? Jawabmu 'tidak', memang begitulah halnya, apabila iman telah tertanam dalam hati seseorang. Aku bertanya kepadamu, apakah pengikutnya berkurang? Jawabmu 'bahkan mereka selalu bertambah', memang seperti itulah iman hingga ia tumbuh sempurna. Kutanya pula, pernahkah kamu memeranginya? Jawabmu 'ya kami memerangi, dan peperangan silih berganti, terkadang menang dan terkadang kalah'. Memang demikianlah halnya, para rasul itu selalu diuji. Namun demikian, kemengangan terakhir selalu dipihak mereka. Kutanyakan pula, pernahkah dia ingkar janji? Jawabmu 'tidak pernah', memang demikian para rasul tidak mungkin ingkar janji. Kutanyakan pula kepadamu, adakah orang lain sebelum dia yang mengaku menjadi Nabi seperti dia? Jawabmu 'tidak', begitulah, kalau ada orang sebelumnya yang mendakwakan dirinya sebagai Nabi seperti dia, mungkin dia hanya ikut-ikutan dengan orang yang sebelumnya."" Kemudian dia bertanya, ""Apa saja yang diperintahkanya kepadamu?"" Jawabku, ""Dia menyuruh kami shalat, membayar zakat, menjalin tali silaturrahmi dan menjaga kehormatan diri."" dia berkata, ""Jika yang kamu katakan itu benar semuanya, maka tak salah lagi bahwa lelaki tersebut adalah seorang Nabi, aku tahu bahwa dia akan muncul, akan tetapi aku tidak menduga bahwa dia akan muncul dari kalangan kalian, sekiranya aku dapat bertemu dengannya, saat di sampingnya maka sungguh aku akan membasuh kedua kakinya. Dan daerah kekuasaannya kelak, akan sampai ke daerah kekuasanku ini."" Abu Sufyan berkata, ""Kemudian dia meminta surat dari Rasulullah shallallahu 'alaihi wasallam dan membacanya, di dalamnya tertulis: ""Dengan nama Allah yang Maha pengasih lagi Maha penyayang, dari Muhammad Rasulullah kepada Heraclius pembesar Rumawi. Keselamatan bagi orang yang mengikuti petunjuk, sesungguhnya aku mengajak anda untuk masuk Islam, masuk Islamlah anda niscaya anda akan selamat. Masuk Islamlah anda, niscaya Allah akan memberi pahala kepada anda dengan berlipat ganda. Jika anda menolak, maka anda akan memikul dosa kaum 'arisyiyun. '(Hai ahli kitab, marilah (berpegang) kepada suatu kalimat (ketetapan) yang tidak ada perselisihan antara kami dan kamu, bahwa kita tidak akan menyembah kecuali Allah dan tidak kita persekutukan dia dengan sesuatupun dan tidak (pula) sebagian kita menjadikan sebagian yang lain sebagai Tuhan selain Allah. jika mereka menolak, maka Katakanlah kepada mereka: ""Saksikanlah, bahwa kami adalah orang-orang yang berserah diri (kepada Allah) ' (Qs. Ali Imran: 64) Setelah dia selesai membaca surat tersebut, tiba-tiba terdengar suara heboh di sekitarnya. Dia memerintahkan kami supaya keluar. Sesampainya di luar, aku berkata kepada kawan-kawanku, ""Sungguh luar biasa urusan Ibnu Abu Kabsyah (maksudnya Rasulullah), hingga dia diikuti oleh raja bani Ashfar (bangsa berkulit kuning), karena itu aku senantiasa yakin bahwa agama Rasulullah shallallahu 'alaihi wasallam ini pasti menang, dan akhirnya Allah memasukkan hidayah Islam ke dalam hati sanubariku."" Dan telah menceritakan kepada kami [Hasan Al Khulwani] dan [Abd bin Humaid] keduanya berkata; telah menceritakan kepada kami [Ya'qub] -yaitu Ibnu Ibrahim bin Sa'd- telah menceritakan kepada kami [ayahku] dari [Shalih] dari [Ibnu Syihab] dengan isnad ini, dan ia menambahkan dalam haditsnya, ""Setelah Allah memenangkan tentara Persi atasnya, maka Kaisar berjalan kaki dari daerah Himsha hingga Iliya` sebagai bentuk syukur akan ujian Allah."" Dan dalam hadits itu pula disebutkan, ""Dari Muhammad, seorang hamba Allah dan Rasul-Nya."" Dan dia juga menyebutkan, ""Dosa kaum Yarisiyin."" Dan dia menyebutkan, ""Dengan seruan Islam.""","حَدَّثَنَا إِسْحَقُ بْنُ إِبْرَاهِيمَ الْحَنْظَلِيُّ وَابْنُ أَبِي عُمَرَ وَمُحَمَّدُ بْنُ رَافِعٍ وَعَبْدُ بْنُ حُمَيْدٍ وَاللَّفْظُ لِابْنِ رَافِعٍ قَالَ ابْنُ رَافِعٍ وَابْنُ أَبِي عُمَرَ حَدَّثَنَا و قَالَ الْآخَرَانِ أَخْبَرَنَا عَبْدُ الرَّزَّاقِ أَخْبَرَنَا مَعْمَرٌ عَنْ الزُّهْرِيِّ عَنْ عُبَيْدِ اللَّهِ بْنِ عَبْدِ اللَّهِ بْنِ عُتْبَةَ عَنْ ابْنِ عَبَّاسٍ أَنَّ أَبَا سُفْيَانَ أَخْبَرَهُ مِنْ فِيهِ إِلَى فِيهِ قَالَ
انْطَلَقْتُ فِي الْمُدَّةِ الَّتِي كَانَتْ بَيْنِي وَبَيْنَ رَسُولِ اللَّهِ صَلَّى اللَّهُ عَلَيْهِ وَسَلَّمَ قَالَ فَبَيْنَا أَنَا بِالشَّأْمِ إِذْ جِيءَ بِكِتَابٍ مِنْ رَسُولِ اللَّهِ صَلَّى اللَّهُ عَلَيْهِ وَسَلَّمَ إِلَى هِرَقْلَ يَعْنِي عَظِيمَ الرُّومِ قَالَ وَكَانَ دَحْيَةُ الْكَلْبِيُّ جَاءَ بِهِ فَدَفَعَهُ إِلَى عَظِيمِ بُصْرَى فَدَفَعَهُ عَظِيمُ بُصْرَى إِلَى هِرَقْلَ فَقَالَ هِرَقْلُ هَلْ هَاهُنَا أَحَدٌ مِنْ قَوْمِ هَذَا الرَّجُلِ الَّذِي يَزْعُمُ أَنَّهُ نَبِيٌّ قَالُوا نَعَمْ قَالَ فَدُعِيتُ فِي نَفَرٍ مِنْ قُرَيْشٍ فَدَخَلْنَا عَلَى هِرَقْلَ فَأَجْلَسَنَا بَيْنَ يَدَيْهِ فَقَالَ أَيُّكُمْ أَقْرَبُ نَسَبًا مِنْ هَذَا الرَّجُلِ الَّذِي يَزْعُمُ أَنَّهُ نَبِيٌّ فَقَالَ أَبُو سُفْيَانَ فَقُلْتُ أَنَا فَأَجْلَسُونِي بَيْنَ يَدَيْهِ وَأَجْلَسُوا أَصْحَابِي خَلْفِي ثُمَّ دَعَا بِتَرْجُمَانِهِ فَقَالَ لَهُ قُلْ لَهُمْ إِنِّي سَائِلٌ هَذَا عَنْ الرَّجُلِ الَّذِي يَزْعُمُ أَنَّهُ نَبِيٌّ فَإِنْ كَذَبَنِي فَكَذِّبُوهُ قَالَ فَقَالَ أَبُو سُفْيَانَ وَايْمُ اللَّهِ لَوْلَا مَخَافَةُ أَنْ يُؤْثَرَ عَلَيَّ الْكَذِبُ لَكَذَبْتُ ثُمَّ قَالَ لِتَرْجُمَانِهِ سَلْهُ كَيْفَ حَسَبُهُ فِيكُمْ قَالَ قُلْتُ هُوَ فِينَا ذُو حَسَبٍ قَالَ فَهَلْ كَانَ مِنْ آبَائِهِ مَلِكٌ قُلْتُ لَا قَالَ فَهَلْ كُنْتُمْ تَتَّهِمُونَهُ بِالْكَذِبِ قَبْلَ أَنْ يَقُولَ مَا قَالَ قُلْتُ لَا قَالَ وَمَنْ يَتَّبِعُهُ أَشْرَافُ النَّاسِ أَمْ ضُعَفَاؤُهُمْ قَالَ قُلْتُ بَلْ ضُعَفَاؤُهُمْ قَالَ أَيَزِيدُونَ أَمْ يَنْقُصُونَ قَالَ قُلْتُ لَا بَلْ يَزِيدُونَ قَالَ هَلْ يَرْتَدُّ أَحَدٌ مِنْهُمْ عَنْ دِينِهِ بَعْدَ أَنْ يَدْخُلَ فِيهِ سَخْطَةً لَهُ قَالَ قُلْتُ لَا قَالَ فَهَلْ قَاتَلْتُمُوهُ قُلْتُ نَعَمْ قَالَ فَكَيْفَ كَانَ قِتَالُكُمْ إِيَّاهُ قَالَ قُلْتُ تَكُونُ الْحَرْبُ بَيْنَنَا وَبَيْنَهُ سِجَالًا يُصِيبُ مِنَّا وَنُصِيبُ مِنْهُ قَالَ فَهَلْ يَغْدِرُ قُلْتُ لَا وَنَحْنُ مِنْهُ فِي مُدَّةٍ لَا نَدْرِي مَا هُوَ صَانِعٌ فِيهَا قَالَ فَوَاللَّهِ مَا أَمْكَنَنِي مِنْ كَلِمَةٍ أُدْخِلُ فِيهَا شَيْئًا غَيْرَ هَذِهِ قَالَ فَهَلْ قَالَ هَذَا الْقَوْلَ أَحَدٌ قَبْلَهُ قَالَ قُلْتُ لَا قَالَ لِتَرْجُمَانِهِ قُلْ لَهُ إِنِّي سَأَلْتُكَ عَنْ حَسَبِهِ فَزَعَمْتَ أَنَّهُ فِيكُمْ ذُو حَسَبٍ وَكَذَلِكَ الرُّسُلُ تُبْعَثُ فِي أَحْسَابِ قَوْمِهَا وَسَأَلْتُكَ هَلْ كَانَ فِي آبَائِهِ مَلِكٌ فَزَعَمْتَ أَنْ لَا فَقُلْتُ لَوْ كَانَ مِنْ آبَائِهِ مَلِكٌ قُلْتُ رَجُلٌ يَطْلُبُ مُلْكَ آبَائِهِ وَسَأَلْتُكَ عَنْ أَتْبَاعِهِ أَضُعَفَاؤُهُمْ أَمْ أَشْرَافُهُمْ فَقُلْتَ بَلْ ضُعَفَاؤُهُمْ وَهُمْ أَتْبَاعُ الرُّسُلِ وَسَأَلْتُكَ هَلْ كُنْتُمْ تَتَّهِمُونَهُ بِالْكَذِبِ قَبْلَ أَنْ يَقُولَ مَا قَالَ فَزَعَمْتَ أَنْ لَا فَقَدْ عَرَفْتُ أَنَّهُ لَمْ يَكُنْ لِيَدَعَ الْكَذِبَ عَلَى النَّاسِ ثُمَّ يَذْهَبَ فَيَكْذِبَ عَلَى اللَّهِ وَسَأَلْتُكَ هَلْ يَرْتَدُّ أَحَدٌ مِنْهُمْ عَنْ دِينِهِ بَعْدَ أَنْ يَدْخُلَهُ سَخْطَةً لَهُ فَزَعَمْتَ أَنْ لَا وَكَذَلِكَ الْإِيمَانُ إِذَا خَالَطَ بَشَاشَةَ الْقُلُوبِ وَسَأَلْتُكَ هَلْ يَزِيدُونَ أَوْ يَنْقُصُونَ فَزَعَمْتَ أَنَّهُمْ يَزِيدُونَ وَكَذَلِكَ الْإِيمَانُ حَتَّى يَتِمَّ وَسَأَلْتُكَ هَلْ قَاتَلْتُمُوهُ فَزَعَمْتَ أَنَّكُمْ قَدْ قَاتَلْتُمُوهُ فَتَكُونُ الْحَرْبُ بَيْنَكُمْ وَبَيْنَهُ سِجَالًا يَنَالُ مِنْكُمْ وَتَنَالُونَ مِنْهُ وَكَذَلِكَ الرُّسُلُ تُبْتَلَى ثُمَّ تَكُونُ لَهُمْ الْعَاقِبَةُ وَسَأَلْتُكَ هَلْ يَغْدِرُ فَزَعَمْتَ أَنَّهُ لَا يَغْدِرُ وَكَذَلِكَ الرُّسُلُ لَا تَغْدِرُ وَسَأَلْتُكَ هَلْ قَالَ هَذَا الْقَوْلَ أَحَدٌ قَبْلَهُ فَزَعَمْتَ أَنْ لَا فَقُلْتُ لَوْ قَالَ هَذَا الْقَوْلَ أَحَدٌ قَبْلَهُ قُلْتُ رَجُلٌ ائْتَمَّ بِقَوْلٍ قِيلَ قَبْلَهُ قَالَ ثُمَّ قَالَ بِمَ يَأْمُرُكُمْ قُلْتُ يَأْمُرُنَا بِالصَّلَاةِ وَالزَّكَاةِ وَالصِّلَةِ وَالْعَفَافِ قَالَ إِنْ يَكُنْ مَا تَقُولُ فِيهِ حَقًّا فَإِنَّهُ نَبِيٌّ وَقَدْ كُنْتُ أَعْلَمُ أَنَّهُ خَارِجٌ وَلَمْ أَكُنْ أَظُنُّهُ مِنْكُمْ وَلَوْ أَنِّي أَعْلَمُ أَنِّي أَخْلُصُ إِلَيْهِ لَأَحْبَبْتُ لِقَاءَهُ وَلَوْ كُنْتُ عِنْدَهُ لَغَسَلْتُ عَنْ قَدَمَيْهِ وَلَيَبْلُغَنَّ مُلْكُهُ مَا تَحْتَ قَدَمَيَّ قَالَ ثُمَّ دَعَا بِكِتَابِ رَسُولِ اللَّهِ صَلَّى اللَّهُ عَلَيْهِ وَسَلَّمَ فَقَرَأَهُ فَإِذَا فِيهِ بِسْمِ اللَّهِ الرَّحْمَنِ الرَّحِيمِ مِنْ مُحَمَّدٍ رَسُولِ اللَّهِ إِلَى هِرَقْلَ عَظِيمِ الرُّومِ سَلَامٌ عَلَى مَنْ اتَّبَعَ الْهُدَى أَمَّا بَعْدُ فَإِنِّي أَدْعُوكَ بِدِعَايَةِ الْإِسْلَامِ أَسْلِمْ تَسْلَمْ وَأَسْلِمْ يُؤْتِكَ اللَّهُ أَجْرَكَ مَرَّتَيْنِ وَإِنْ تَوَلَّيْتَ فَإِنَّ عَلَيْكَ إِثْمَ الْأَرِيسِيِّينَ وَ
{ يَا أَهْلَ الْكِتَابِ تَعَالَوْا إِلَى كَلِمَةٍ سَوَاءٍ بَيْنَنَا وَبَيْنَكُمْ أَنْ لَا نَعْبُدَ إِلَّا اللَّهَ وَلَا نُشْرِكَ بِهِ شَيْئًا وَلَا يَتَّخِذَ بَعْضُنَا بَعْضًا أَرْبَابًا مِنْ دُونِ اللَّهِ فَإِنْ تَوَلَّوْا فَقُولُوا اشْهَدُوا بِأَنَّا مُسْلِمُونَ }
فَلَمَّا فَرَغَ مِنْ قِرَاءَةِ الْكِتَابِ ارْتَفَعَتْ الْأَصْوَاتُ عِنْدَهُ وَكَثُرَ اللَّغْطُ وَأَمَرَ بِنَا فَأُخْرِجْنَا قَالَ فَقُلْتُ لِأَصْحَابِي حِينَ خَرَجْنَا لَقَدْ أَمِرَ أَمْرُ ابْنِ أَبِي كَبْشَةَ إِنَّهُ لَيَخَافُهُ مَلِكُ بَنِي الْأَصْفَرِ قَالَ فَمَا زِلْتُ مُوقِنًا بِأَمْرِ رَسُولِ اللَّهِ صَلَّى اللَّهُ عَلَيْهِ وَسَلَّمَ أَنَّهُ سَيَظْهَرُ حَتَّى أَدْخَلَ اللَّهُ عَلَيَّ الْإِسْلَامَ
و حَدَّثَنَاه حَسَنٌ الْحُلْوَانِيُّ وَعَبْدُ بْنُ حُمَيْدٍ قَالَا حَدَّثَنَا يَعْقُوبُ وَهُوَ ابْنُ إِبْرَاهِيمَ بْنِ سَعْدٍ حَدَّثَنَا أَبِي عَنْ صَالِحٍ عَنْ ابْنِ شِهَابٍ بِهَذَا الْإِسْنَادِ وَزَادَ فِي الْحَدِيثِ وَكَانَ قَيْصَرُ لَمَّا كَشَفَ اللَّهُ عَنْهُ جُنُودَ فَارِسَ مَشَى مِنْ حِمْصَ إِلَى إِيلِيَاءَ شُكْرًا لِمَا أَبْلَاهُ اللَّهُ وَقَالَ فِي الْحَدِيثِ مِنْ مُحَمَّدٍ عَبْدِ اللَّهِ وَرَسُولِهِ وَقَالَ إِثْمَ الْيَرِيسِيِّينَ وَقَالَ بِدَاعِيَةِ الْإِسْلَامِ",0
4186,42,"Telah menceritakan kepadaku [Abu Ja'far Muhammad bin Ash Shabbah] dan ['Ali bin Hujr As Sa'di] seluruhnya dari [Syarik]. [Ibnu Hujr] berkata; Telah mengabarkan kepada kami [Syarik] dari ['Abdul Malik bin 'Umair] dari [Abu Salamah] dari [Abu Hurairah] dari Nabi shallallahu 'alaihi wasallam beliau bersabda: ""Sya'ir (atau sajak) paling indah yang pernah diungkapkan orang Arab ialah sajaknya Labid. Labid bersya'ir: Alaa, kullu syaiin maa khalallaha bathil (Ketahuilah, segala sesuatu selain Allah itu pasti binasa).","حَدَّثَنِي أَبُو جَعْفَرٍ مُحَمَّدُ بْنُ الصَّبَّاحِ وَعَلِيُّ بْنُ حُجْرٍ السَّعْدِيُّ جَمِيعًا عَنْ شَرِيكٍ قَالَ ابْنُ حُجْرٍ أَخْبَرَنَا شَرِيكٌ عَنْ عَبْدِ الْمَلِكِ بْنِ عُمَيْرٍ عَنْ أَبِي سَلَمَةَ عَنْ أَبِي هُرَيْرَةَ
عَنْ النَّبِيِّ صَلَّى اللَّهُ عَلَيْهِ وَسَلَّمَ قَالَ أَشْعَرُ كَلِمَةٍ تَكَلَّمَتْ بِهَا الْعَرَبُ كَلِمَةُ لَبِيدٍ أَلَا كُلُّ شَيْءٍ مَا خَلَا اللَّهَ بَاطِلٌ",0
4304,44,"Dan telah menceritakan kepada kami [Abu Bakr bin Abu Syaibah]; Telah menceritakan kepada kami [Sufyan bin 'Uyainah]; Demikian juga diriwayatkan dari jalur lainnya, Dan telah menceritakan kepada kami [Abu Kuraib]; Telah menceritakan kepada kami [Abu Usamah] dan [Ibnu Bisyr] seluruhnya dari [Hisyam]; Dan telah menceritakan kepada kami [Muhammad bin 'Abdillah bin Numair] dan lafazh ini miliknya; Telah menceritakan kepada kami [Muhammad bin Bisyr]; Telah menceritakan kepada kami [Hisyam] dari [Bapaknya] dari ['Aisyah]; Harits bin Hisyam pernah bertanya kepada Nabi shallallahu 'alaihi wasallam; ""Bagaimana caranya wahyu datang kepada Anda?"" Jawab beliau: ""Terkadang wahyu datang kepadaku seperti bunyi lonceng. Itulah yang paling berat bagiku. Kemudian bunyi terputus, sedangkan aku telah memahami maksudnya. Terkadang malaikat datang menyerupai bentuk laki-laki, lalu aku memahami apa yang dikatakannya.""","و حَدَّثَنَا أَبُو بَكْرِ بْنُ أَبِي شَيْبَةَ حَدَّثَنَا سُفْيَانُ بْنُ عُيَيْنَةَ ح و حَدَّثَنَا أَبُو كُرَيْبٍ حَدَّثَنَا أَبُو أُسَامَةَ وَابْنُ بِشْرٍ جَمِيعًا عَنْ هِشَامٍ و حَدَّثَنَا مُحَمَّدُ بْنُ عَبْدِ اللَّهِ بْنِ نُمَيْرٍ وَاللَّفْظُ لَهُ حَدَّثَنَا مُحَمَّدُ بْنُ بِشْرٍ حَدَّثَنَا هِشَامٌ عَنْ أَبِيهِ عَنْ عَائِشَةَ
أَنَّ الْحَارِثَ بْنَ هِشَامٍ سَأَلَ النَّبِيَّ صَلَّى اللَّهُ عَلَيْهِ وَسَلَّمَ كَيْفَ يَأْتِيكَ الْوَحْيُ فَقَالَ أَحْيَانًا يَأْتِينِي فِي مِثْلِ صَلْصَلَةِ الْجَرَسِ وَهُوَ أَشَدُّهُ عَلَيَّ ثُمَّ يَفْصِمُ عَنِّي وَقَدْ وَعَيْتُهُ وَأَحْيَانًا مَلَكٌ فِي مِثْلِ صُورَةِ الرَّجُلِ فَأَعِي مَا يَقُولُ",0
