haditsId,kitabId,indo,arab,label
2093,16,"Dan Telah menceritakan kepada kami [Abu Rabi' Az Zahrani] telah menceritakan kepada kami [Hammad] dari [Amru bin Dinar] dan [Ayyub] dari [Sa'id bin Jubair] dari [Ibnu Abbas] radliallahu 'anhuma, ia berkata; Ketika seorang laki-laki melakukan wukuf di Arafah bersama Rasulullah shallallahu 'alaihi wasallam, tiba-tiba ia terjatuh dari Untanya -Ayyub berkata; FA`AUQASHATHU, sementara Amru menyebutkan; FAWAQASHATHU- hingga lehernya patah (dan meninggal seketika). Kemudian disampaikanlah peristiwa itu kepada Nabi shallallahu 'alaihi wasallam, maka beliau pun bersabda: ""Mandikanlah ia dengan air bercampur daun bidara. Lalu kafanilah dengan kedua helai kain ihramnya, janganlah kalian memakaikan wewangian padanya dan jangan pula menutupi kepalanya."" Ayyub berkata; ""Karena Allah akan membangkitkannya kelak di hari kiamat dalam keadaan bertalbiyah (menunaikan haji)."" Amru menyebutkan; ""Karena Allah akan membangkitkannya kelak di hari kiamat dalam keadaan YULABBI (bertalbiyah)."" Dan telah menceritakannya kepadaku [Amru An Naqid] telah menceritakan kepada kami [Isma'il bin Ibrahim] dari [Ayyub] ia berkata, terlah diberitakan kepadaku dari [Sa'id bin Jubair] dari [Ibnu Abbas] radliallahu 'anhuma, bahwa ada seorang laki-laki yang sedang melakukan wukuf bersama Nabi shallallahu 'alaihi wasallam, jadi ia dalam keadaan ihram. Maka ia pun menyebutkan sebagaimana hadits yang disebutkan oleh Hammad dari Ayyub.","و حَدَّثَنَا أَبُو الرَّبِيعِ الزَّهْرَانِيُّ حَدَّثَنَا حَمَّادٌ عَنْ عَمْرِو بْنِ دِينَارٍ وَأَيُّوبَ عَنْ سَعِيدِ بْنِ جُبَيْرٍ عَنْ ابْنِ عَبَّاسٍ رَضِيَ اللَّهُ عَنْهُمَا قَالَ
بَيْنَمَا رَجُلٌ وَاقِفٌ مَعَ رَسُولِ اللَّهِ صَلَّى اللَّهُ عَلَيْهِ وَسَلَّمَ بِعَرَفَةَ إِذْ وَقَعَ مِنْ رَاحِلَتِهِ قَالَ أَيُّوبُ فَأَوْقَصَتْهُ أَوْ قَالَ فَأَقْعَصَتْهُ و قَالَ عَمْرٌو فَوَقَصَتْهُ فَذُكِرَ ذَلِكَ لِلنَّبِيِّ صَلَّى اللَّهُ عَلَيْهِ وَسَلَّمَ فَقَالَ اغْسِلُوهُ بِمَاءٍ وَسِدْرٍ وَكَفِّنُوهُ فِي ثَوْبَيْنِ وَلَا تُحَنِّطُوهُ وَلَا تُخَمِّرُوا رَأْسَهُ قَالَ أَيُّوبُ فَإِنَّ اللَّهَ يَبْعَثُهُ يَوْمَ الْقِيَامَةِ مُلَبِّيًا وَقَالَ عَمْرٌو فَإِنَّ اللَّهَ يَبْعَثُهُ يَوْمَ الْقِيَامَةِ يُلَبِّي
و حَدَّثَنِيهِ عَمْرٌو النَّاقِدُ حَدَّثَنَا إِسْمَعِيلُ بْنُ إِبْرَاهِيمَ عَنْ أَيُّوبَ قَالَ نُبِّئْتُ عَنْ سَعِيدِ بْنِ جُبَيْرٍ عَنْ ابْنِ عَبَّاسٍ رَضِيَ اللَّهُ عَنْهُمَا أَنَّ رَجُلًا كَانَ وَاقِفًا مَعَ النَّبِيِّ صَلَّى اللَّهُ عَلَيْهِ وَسَلَّمَ وَهُوَ مُحْرِمٌ فَذَكَرَ نَحْوَ مَا ذَكَرَ حَمَّادٌ عَنْ أَيُّوبَ",11
2094,16,"Dan Telah menceritakan kepada kami [Ali bin Khasyram] telah mengabarkan kepada kami [Isa bin Yunus] dari [Ibnu Juraij] telah mengabarkan kepadaku [Amru bin Dinar] dari [Sa'id bin Jubair] dari [Ibnu Abbas] radliallahu 'anhuma, ia berkata; Seorang laki-laki melakukan Ihram bersama Nabi shallallahu 'alaihi wasallam, lalu ia tersungkur jatuh dari Unta hingga lehernya patah dan meninggal seketika itu. maka Rasulullah shallallahu 'alaihi wasallam pun bersabda: ""Mandikanlah jenazahnya dengan air bercampur daun bidara. Lalu kafanilah ia dengan kedua helai kain (ihram) -nya. Dan janganlah kalian menutupi kepala dengan surban, karena ia akan datang kelak di hari kiamat dalam keadaan Ihram."" Dan Telah menceritakannya kepada kami [Abdu bin Humaid] telah mengabarkan kepada kami [Muhammad bin Bakr Al Bursani] telah mengabarkan kepada kami [Ibnu Juraij] telah mengabarkan kepadaku [Amru bin Dinar] bahwa [Sa'id bin Jubair] telah mengabarkan kepadanya dari [Ibnu Abbas] radliallahu 'anhuma, ia berkata; Seorang laki-laki melakukan Ihram bersama Rasulullah shallallahu 'alaihi wasallam. yakni serupa dengan hadits di atas. Hanya saja ia menyebutkan; ""Sebab, ia akan dibangkitkan kelak di hari kiamat dalam keadaan Mulabbiyan (berihram)."" Dan ia juga menambahkan; Sa'id bin Jubair tidak menyebutkan kata ""HAITSU KHARRA (jatuh tersungkur).""","و حَدَّثَنَا عَلِيُّ بْنُ خَشْرَمٍ أَخْبَرَنَا عِيسَى يَعْنِي ابْنَ يُونُسَ عَنْ ابْنِ جُرَيْجٍ أَخْبَرَنِي عَمْرُو بْنُ دِينَارٍ عَنْ سَعِيدِ بْنِ جُبَيْرٍ عَنْ ابْنِ عَبَّاسٍ رَضِيَ اللَّهُ عَنْهُمَا قَالَ
أَقْبَلَ رَجُلٌ حَرَامًا مَعَ النَّبِيِّ صَلَّى اللَّهُ عَلَيْهِ وَسَلَّمَ فَخَرَّ مِنْ بَعِيرِهِ فَوُقِصَ وَقْصًا فَمَاتَ فَقَالَ رَسُولُ اللَّهِ صَلَّى اللَّهُ عَلَيْهِ وَسَلَّمَ اغْسِلُوهُ بِمَاءٍ وَسِدْرٍ وَأَلْبِسُوهُ ثَوْبَيْهِ وَلَا تُخَمِّرُوا رَأْسَهُ فَإِنَّهُ يَأْتِي يَوْمَ الْقِيَامَةِ يُلَبِّي
و حَدَّثَنَاه عَبْدُ بْنُ حُمَيْدٍ أَخْبَرَنَا مُحَمَّدُ بْنُ بَكْرٍ الْبُرْسَانِيُّ أَخْبَرَنَا ابْنُ جُرَيْجٍ أَخْبَرَنِي عَمْرُو بْنُ دِينَارٍ أَنَّ سَعِيدَ بْنَ جُبَيْرٍ أَخْبَرَهُ عَنْ ابْنِ عَبَّاسٍ رَضِيَ اللَّهُ عَنْهُمَا قَالَ أَقْبَلَ رَجُلٌ حَرَامٌ مَعَ رَسُولِ اللَّهِ صَلَّى اللَّهُ عَلَيْهِ وَسَلَّمَ بِمِثْلِهِ غَيْرَ أَنَّهُ قَالَ فَإِنَّهُ يُبْعَثُ يَوْمَ الْقِيَامَةِ مُلَبِّيًا وَزَادَ لَمْ يُسَمِّ سَعِيدُ بْنُ جُبَيْرٍ حَيْثُ خَرَّ",11
2095,16,"Dan Telah menceritakan kepada kami [Abu Kuraib] telah menceritakan kepada kami [Waki'] dari [Sufyan] dari [Amru bin Dinar] dari [Sa'id bin Jubair] dari [Ibnu Abbas] radliallahu 'anhuma bahwa; Seorang laki-laki patah lehernya karena terjatuh dari Unta ketika Ihram hingga ia meninggal seketika. Maka Rasulullah shallallahu 'alaihi wasallam bersabda: ""Mandikanlah jenazahnya dengan air bercampur daun bidara. Lalu kafanilah ia dengan kedua helai kain (ihram) -nya. Dan janganlah kalian menutupi kepala dengan surban, jangan pula menutupi wajahnya, karena ia akan dibangkitnya kelak di hari kiamat dalam keadaan Ihram.""","و حَدَّثَنَا أَبُو كُرَيْبٍ حَدَّثَنَا وَكِيعٌ عَنْ سُفْيَانَ عَنْ عَمْرِو بْنِ دِينَارٍ عَنْ سَعِيدِ بْنِ جُبَيْرٍ عَنْ ابْنِ عَبَّاسٍ رَضِيَ اللَّهُ عَنْهُمَا
أَنَّ رَجُلًا أَوْقَصَتْهُ رَاحِلَتُهُ وَهُوَ مُحْرِمٌ فَمَاتَ فَقَالَ رَسُولُ اللَّهِ صَلَّى اللَّهُ عَلَيْهِ وَسَلَّمَ اغْسِلُوهُ بِمَاءٍ وَسِدْرٍ وَكَفِّنُوهُ فِي ثَوْبَيْهِ وَلَا تُخَمِّرُوا رَأْسَهُ وَلَا وَجْهَهُ فَإِنَّهُ يُبْعَثُ يَوْمَ الْقِيَامَةِ مُلَبِّيًا",11
2096,16,"Dan Telah menceritakan kepada kami [Muhammad bin Ash Shabbah] telah menceritakan kepada kami [Husyaim] telah mengabarkan kepada kami [Abu Bisyr] telah menceritakan kepada kami [Sa'id bin Jubair] dari [Ibnu Abbas] radliallahu 'anhuma -dalam riwayat lain- Dan Telah menceritakan kepada kami [Yahya bin Yahya] -lafazh juga miliknya- telah mengabarkan kepada kami [Husyaim] dari [Abu Bisyr] dari [Sa'id bin Jubair] dari [Ibnu Abbas] radliallahu 'anhuma, bahwa seorang laki-laki sedang melakukan ihram bersama Rasulullah shallallahu 'alaihi wasallam, lalu lehernya patah karena terjatuh dari Untanya hingga ia meninggal seketika. Maka Rasulullah shallallahu 'alaihi wasallam pun bersabda: ""Mandikanlah jenazahnya dengan air campuran daun bidara. Kemudian kafanilah ia kainnya, dan jangan kalian memakaikannya wewangian, dan jangan pula mengenakan surban di kepalanya, karena ia akan dibangkitkan pada hari kiamat kelak dalam keadaan Ihram.""","و حَدَّثَنَا مُحَمَّدُ بْنُ الصَّبَّاحِ حَدَّثَنَا هُشَيْمٌ أَخْبَرَنَا أَبُو بِشْرٍ حَدَّثَنَا سَعِيدُ بْنُ جُبَيْرٍ عَنْ ابْنِ عَبَّاسٍ رَضِيَ اللَّهُ عَنْهُمَا ح و حَدَّثَنَا يَحْيَى بْنُ يَحْيَى وَاللَّفْظُ لَهُ أَخْبَرَنَا هُشَيْمٌ عَنْ أَبِي بِشْرٍ عَنْ سَعِيدِ بْنِ جُبَيْرٍ عَنْ ابْنِ عَبَّاسٍ رَضِيَ اللَّهُ عَنْهُمَا
أَنَّ رَجُلًا كَانَ مَعَ رَسُولِ اللَّهِ صَلَّى اللَّهُ عَلَيْهِ وَسَلَّمَ مُحْرِمًا فَوَقَصَتْهُ نَاقَتُهُ فَمَاتَ فَقَالَ رَسُولُ اللَّهِ صَلَّى اللَّهُ عَلَيْهِ وَسَلَّمَ اغْسِلُوهُ بِمَاءٍ وَسِدْرٍ وَكَفِّنُوهُ فِي ثَوْبَيْهِ وَلَا تَمَسُّوهُ بِطِيبٍ وَلَا تُخَمِّرُوا رَأْسَهُ فَإِنَّهُ يُبْعَثُ يَوْمَ الْقِيَامَةِ مُلَبِّدًا",11
2097,16,"Dan telah menceritakan kepadaku [Abu Kamil Fudlail bin Husain Al Jahdari] telah menceritakan kepada kami [Abu Awanah] dari [Abu Bisyr] dari [Sa'id bin Jubair] dari [Ibnu Abbas] radliallahu 'anhuma, bahwasanya; ""Seroang laki-laki patah lehernya karena terjatuh dari Untanya ketika Ihram bersama-sama dengan Rasulullah shallallahu 'alaihi wasallam. lalu beliau memerintahkan agar jenazahnya dimandikan dengan air campuran daun bidara, jangan pakai harum-haruman dan jangan ditutup kepalanya, karena dia akan dibangkitkan kelak pada hari kiamat dalam keadaan ihram.""","و حَدَّثَنِي أَبُو كَامِلٍ فُضَيْلُ بْنُ حُسَيْنٍ الْجَحْدَرِيُّ حَدَّثَنَا أَبُو عَوَانَةَ عَنْ أَبِي بِشْرٍ عَنْ سَعِيدِ بْنِ جُبَيْرٍ عَنْ ابْنِ عَبَّاسٍ رَضِيَ اللَّهُ عَنْهُمَا
أَنَّ رَجُلًا وَقَصَهُ بَعِيرُهُ وَهُوَ مُحْرِمٌ مَعَ رَسُولِ اللَّهِ صَلَّى اللَّهُ عَلَيْهِ وَسَلَّمَ فَأَمَرَ بِهِ رَسُولُ اللَّهِ صَلَّى اللَّهُ عَلَيْهِ وَسَلَّمَ أَنْ يُغْسَلَ بِمَاءٍ وَسِدْرٍ وَلَا يُمَسَّ طِيبًا وَلَا يُخَمَّرَ رَأْسُهُ فَإِنَّهُ يُبْعَثُ يَوْمَ الْقِيَامَةِ مُلَبِّدًا",11
2098,16,"Dan Telah menceritakan kepada kami [Muhammad bin Basysyar] dan [Abu Bakr bin Nafi'] telah mengabarkan kepada kami [Ghundar] telah menceritakan kepada kami [Syu'bah] ia berkata, saya mendengar [Abu Bisyr] menceritakan dari [Sa'id bin Jubair] bahwa mendengar [Ibnu Abbas] radliallahu 'anhuma menceritakan bahwasanya; ""Seorang laki-laki yang sedang melakukan Ihram mendatangi Nabi shallallahu 'alaihi wasallam, kemudian laki-laki itu terjatuh dari Untanya lalu meninggal seketika. Maka Nabi shallallahu 'alaihi wasallam memerintahkan untuk memandikannya dengan air dan daun bidara, mengkafaninya dengan dua helai kain dan tidak melumurinya dengan wewangian serta membiarkan bagian kepalanya disingkap."" Syu'bah berkata; Kemudian Abu Bisyr menceritakannya kepadaku; ""(Agar mereka) membiarkan kepala dan wajahnya tersingkap, sebab ia akan dibangkitkan -kelak pada hari kiamat- dalam keadaan bertalbiyah.""","و حَدَّثَنَا مُحَمَّدُ بْنُ بَشَّارٍ وَأَبُو بَكْرِ بْنُ نَافعٍ قَالَ ابْنُ نَافِعٍ أَخْبَرَنَا غُنْدَرٌ حَدَّثَنَا شُعْبَةُ قَالَ سَمِعْتُ أَبَا بِشْرٍ يُحَدِّثُ عَنْ سَعِيدِ بْنِ جُبَيْرٍ أَنَّهُ سَمِعَ ابْنَ عَبَّاسٍ رَضِيَ اللَّهُ عَنْهُمَا يُحَدِّثُ
أَنَّ رَجُلًا أَتَى النَّبِيَّ صَلَّى اللَّهُ عَلَيْهِ وَسَلَّمَ وَهُوَ مُحْرِمٌ فَوَقَعَ مِنْ نَاقَتِهِ فَأَقْعَصَتْهُ فَأَمَرَ النَّبِيُّ صَلَّى اللَّهُ عَلَيْهِ وَسَلَّمَ أَنْ يُغْسَلَ بِمَاءٍ وَسِدْرٍ وَأَنْ يُكَفَّنَ فِي ثَوْبَيْنِ وَلَا يُمَسَّ طِيبًا خَارِجٌ رَأْسُهُ
قَالَ شُعْبَةُ ثُمَّ حَدَّثَنِي بِهِ بَعْدَ ذَلِكَ خَارِجٌ رَأْسُهُ وَوَجْهُهُ فَإِنَّهُ يُبْعَثُ يَوْمَ الْقِيَامَةِ مُلَبِّدًا",11
2099,16,"Telah menceritakan kepada kami [Harun bin Abdullah] telah menceritakan kepada kami [Al Aswad bin Amir] dari [Zuhair] dari [Abu Az Zubair] ia berkata, saya mendengar [Sa'id bin Jubair] berkata, [Ibnu Abbas] radliallahu 'anhuma berkata; Seorang laki-laki terjatuh dari Untanya hingga lehernya patah (dan menigggal), dan saat itu ia sedang bersama Rasulullah shallallahu 'alaihi wasallam. Lalu beliau memerintahkan agar para sahabat memandikannya dengan air dan daun bidara serta menyingkap wajahnya. Abu Zubari berkata; Dan saya menduga ia menyebutkan; (agar mereka menyingkap) kepalanya, sebab ia akan dibangkitkan kelak pada hari kiamat dalam keadaan membaca Talbiyah.","حَدَّثَنَا هَارُونُ بْنُ عَبْدِ اللَّهِ حَدَّثَنَا الْأَسْوَدُ بْنُ عَامِرٍ عَنْ زُهَيْرٍ عَنْ أَبِي الزُّبَيْرِ قَالَ سَمِعْتُ سَعِيدَ بْنَ جُبَيْرٍ يَقُولُ قَالَ ابْنُ عَبَّاسٍ رَضِيَ اللَّهُ عَنْهُمَا
وَقَصَتْ رَجُلًا رَاحِلَتُهُ وَهُوَ مَعَ رَسُولِ اللَّهِ صَلَّى اللَّهُ عَلَيْهِ وَسَلَّمَ فَأَمَرَهُمْ رَسُولُ اللَّهِ صَلَّى اللَّهُ عَلَيْهِ وَسَلَّمَ أَنْ يَغْسِلُوهُ بِمَاءٍ وَسِدْرٍ وَأَنْ يَكْشِفُوا وَجْهَهُ حَسِبْتُهُ قَالَ وَرَأْسَهُ فَإِنَّهُ يُبْعَثُ يَوْمَ الْقِيَامَةِ وَهُوَ يُهِلُّ",11
3082,26,"Telah menceritakan kepada kami [Zuhair bin Harb] telah menceritakan kepada kami [Yahya bin Sa'id] dari [Hisyam bin 'Urwah] telah mengabarkan kepadaku [Ayahku] dari ['Aisyah], bahwa seorang laki-laki bertanya kepada Nabi shallallahu 'alaihi wasallam, katanya, ""Sesungguhnya ibuku telah meninggal dunia, dan saya kira jika dia dapat bicara dia akan bersedekah, apakah saya juga akan mendapatkan pahala jika saya bersedekah atas namanya?"" beliau menjawab: ""Ya.""","حَدَّثَنَا زُهَيْرُ بْنُ حَرْبٍ حَدَّثَنَا يَحْيَى بْنُ سَعِيدٍ عَنْ هِشَامِ بْنِ عُرْوَةَ أَخْبَرَنِي أَبِي عَنْ عَائِشَةَ
أَنَّ رَجُلًا قَالَ لِلنَّبِيِّ صَلَّى اللَّهُ عَلَيْهِ وَسَلَّمَ إِنَّ أُمِّيَ افْتُلِتَتْ نَفْسُهَا وَإِنِّي أَظُنُّهَا لَوْ تَكَلَّمَتْ تَصَدَّقَتْ فَلِي أَجْرٌ أَنْ أَتَصَدَّقَ عَنْهَا قَالَ نَعَمْ",11
3084,26,"Telah menceritakan kepada kami [Yahya bin Ayyub] dan [Qutaibah] -yaitu Ibnu Sa'id- dan [Ibnu Hujr] mereka berkata; telah menceritakan kepada kami [Isma'il] -yaitu Ibnu Ja'far- dari [Al 'Ala'] dari [Ayahnya] dari [Abu Hurairah], bahwa Rasulullah shallallahu 'alaihi wasallam bersabda: ""Apabila salah seorang manusia meninggal dunia, maka terputuslah segala amalannya kecuali tiga perkara; sedekah jariyah, ilmu yang bermanfa'at baginya dan anak shalih yang selalu mendoakannya.""","حَدَّثَنَا يَحْيَى بْنُ أَيُّوبَ وَقُتَيْبَةُ يَعْنِي ابْنَ سَعِيدٍ وَابْنُ حُجْرٍ قَالُوا حَدَّثَنَا إِسْمَعِيلُ هُوَ ابْنُ جَعْفَرٍ عَنْ الْعَلَاءِ عَنْ أَبِيهِ عَنْ أَبِي هُرَيْرَةَ
أَنَّ رَسُولَ اللَّهِ صَلَّى اللَّهُ عَلَيْهِ وَسَلَّمَ قَالَ إِذَا مَاتَ الْإِنْسَانُ انْقَطَعَ عَنْهُ عَمَلُهُ إِلَّا مِنْ ثَلَاثَةٍ إِلَّا مِنْ صَدَقَةٍ جَارِيَةٍ أَوْ عِلْمٍ يُنْتَفَعُ بِهِ أَوْ وَلَدٍ صَالِحٍ يَدْعُو لَهُ",11
3209,30,"Telah menceritakan kepadakuu [Abu Ghassan Malik bin Abdul Wahid Al Misma'i] telah menceritakan kepada kami [Mu'adz] -yaitu Ibnu Hisyam- telah menceritakan kepadaku [ayahku] dari [Yahya bin Abu Katsir] telah menceritakan kepadaku [Abu Qilabah] bahwa [Abu Al Muhallab] telah menceritakan kepadanya dari ['Imran bin Hushain], bahwa seorang wanita dari Juhainah datang menghadap kepada Nabi shallallahu 'alaihi wasallam, padahal dia sedang hamil akibat melakukan zina. Wanita itu berkata, ""Wahai Rasulullah, aku telah melanggar hukum, oleh karena itu tegakkanlah hukuman itu atasku."" Lalu Nabi Allah memanggil wali perempuan itu dan bersabda kepadanya: ""Rawatlah wanita ini sebaik-baiknya, apabila dia telah melahirkan, bawalah dia ke hadapanku."" Lalu walinya melakukan pesan tersebut. setelah itu Nabi shallallahu 'alaihi wasallam memerintahkan untuk merajam wanita tersebut, maka pakaian wanita tersebut dirapikan (agar auratnya tidak terbuka saat dirajam). Kemudian beliau perintahkan agar ia dirajam. Setelah dirajam, beliau menshalatkan jenazahnya, namun hal itu menjadkan Umar bertanya kepada beliau, ""Wahai Nabi Allah, perlukah dia dishalatkan? Bukankah dia telah berzina?"" beliau menjawab: ""Sunnguh, dia telah bertaubat kalau sekiranya taubatnya dibagi-bagikan kepada tujuh puluh orang penduduk Madinah, pasti taubatnya akan mencukupi mereka semua. Adakah taubat yang lebih utama daripada menyerahkan nyawa kepada Allah Ta'ala secara ikhlas?"" Dan telah menceritakan kepada kami [Abu Bakar bin Abu Syaibah] telah menceritakan kepada kami ['Affan bin Muslim] telah menceritakan kepada kami [Aban Aal 'Athar] telah menceritakan kepada kami [Yahya bin Abu Katsir] dengan isnad seperti ini.""","حَدَّثَنِي أَبُو غَسَّانَ مَالِكُ بْنُ عَبْدِ الْوَاحِدِ الْمِسْمَعِيُّ حَدَّثَنَا مُعَاذٌ يَعْنِي ابْنَ هِشَامٍ حَدَّثَنِي أَبِي عَنْ يَحْيَى بْنِ أَبِي كَثِيرٍ حَدَّثَنِي أَبُو قِلَابَةَ أَنَّ أَبَا الْمُهَلَّبِ حَدَّثَهُ عَنْ عِمْرَانَ بْنِ حُصَيْنٍ
أَنَّ امْرَأَةً مِنْ جُهَيْنَةَ أَتَتْ نَبِيَّ اللَّهِ صَلَّى اللَّهُ عَلَيْهِ وَسَلَّمَ وَهِيَ حُبْلَى مِنْ الزِّنَى فَقَالَتْ يَا نَبِيَّ اللَّهِ أَصَبْتُ حَدًّا فَأَقِمْهُ عَلَيَّ فَدَعَا نَبِيُّ اللَّهِ صَلَّى اللَّهُ عَلَيْهِ وَسَلَّمَ وَلِيَّهَا فَقَالَ أَحْسِنْ إِلَيْهَا فَإِذَا وَضَعَتْ فَأْتِنِي بِهَا فَفَعَلَ فَأَمَرَ بِهَا نَبِيُّ اللَّهِ صَلَّى اللَّهُ عَلَيْهِ وَسَلَّمَ فَشُكَّتْ عَلَيْهَا ثِيَابُهَا ثُمَّ أَمَرَ بِهَا فَرُجِمَتْ ثُمَّ صَلَّى عَلَيْهَا فَقَالَ لَهُ عُمَرُ تُصَلِّي عَلَيْهَا يَا نَبِيَّ اللَّهِ وَقَدْ زَنَتْ فَقَالَ لَقَدْ تَابَتْ تَوْبَةً لَوْ قُسِمَتْ بَيْنَ سَبْعِينَ مِنْ أَهْلِ الْمَدِينَةِ لَوَسِعَتْهُمْ وَهَلْ وَجَدْتَ تَوْبَةً أَفْضَلَ مِنْ أَنْ جَادَتْ بِنَفْسِهَا لِلَّهِ تَعَالَى
و حَدَّثَنَاه أَبُو بَكْرِ بْنُ أَبِي شَيْبَةَ حَدَّثَنَا عَفَّانُ بْنُ مُسْلِمٍ حَدَّثَنَا أَبَانُ الْعَطَّارُ حَدَّثَنَا يَحْيَى بْنُ أَبِي كَثِيرٍ بِهَذَا الْإِسْنَادِ مِثْلَهُ",11
3279,33,"Telah menceritakan kepada kami [Yahya bin Yahya] dan [Muhammad bin Rumh] keduanya berkata; telah mengabarkan kepada kami [Al Laits]. (dalam riwayat lain disebutkan) Telah menceritakan kepada kami [Qutaibah bin Sa'id] telah menceritakan kepada kami [Laits] dari [Nafi'] dari [Abdullah] bahwa dalam salah satu peperangan Rasulullah shallallahu 'alaihi wasallam pernah ditemukan jasad seorang wanita, maka Rasulullah shallallahu 'alaihi wasallam pun melarang pembunuhan wanita dan anak-anak.""","حَدَّثَنَا يَحْيَى بْنُ يَحْيَى وَمُحَمَّدُ بْنُ رُمْحٍ قَالَا أَخْبَرَنَا اللَّيْثِ ح و حَدَّثَنَا قُتَيْبَةُ بْنُ سَعِيدٍ حَدَّثَنَا لَيْثٌ عَنْ نَافِعٍ عَنْ عَبْدِ اللَّهِ
أَنَّ امْرَأَةً وُجِدَتْ فِي بَعْضِ مَغَازِي رَسُولِ اللَّهِ صَلَّى اللَّهُ عَلَيْهِ وَسَلَّمَ مَقْتُولَةً فَأَنْكَرَ رَسُولُ اللَّهِ صَلَّى اللَّهُ عَلَيْهِ وَسَلَّمَ قَتْلَ النِّسَاءِ وَالصِّبْيَانِ",11
