haditsId,kitabId,indo,arab,label
173,2,"Telah menceritakan kepada kami [Muhammad bin al-Mutsanna al-Anazi] dan [Abu Ma'n ar-Raqasyi] serta [Ishaq bin Manshur] semuanya dari [Abu Ashim] dan lafazh tersebut milik Ibnu al-Mutsanna, telah menceritakan kepada kami [adl-Dlahhak] -yaitu Abu Ashim- dia berkata, telah mengabarkan kepada kami [Haiwah bin Syuraih] dia berkata, telah menceritakan kepada kami [Yazid bin Abu Habib] dari [Ibnu Syimasah al-Mahri] dia berkata, ""Kami menghadiri [Amru bin al-Ash], sementara dia sedang memandikan orang yang meninggal, lalu dia menangis lama dan memalingkan wajahnya ke tembok, maka mulailah anaknya berkata, 'Wahai bapakku, tidakkah Rasulullah shallallahu 'alaihi wasallam memberikan kabar gembira kepadamu dengan hal demikian, tidakkah Rasulullah shallallahu 'alaihi wasallam memberikan kabar gembira kepadamu dengan hal demikian.' Perawi berkata, 'Maka dia menghadap dengan wajahnya seraya berkata, 'Sesungguhnya sesuatu yang paling utama yang kita anggap adalah persaksian bahwa tidak ada tuhan (yang berhak disembah) kecuali Allah, dan bahwa Muhammad utusan Allah, sesungguhnya aku berada pada tiga keadaan; saya telah melihat diriku, namun tidak ada seorang pun yang lebih membenci Rasulullah shallallahu 'alaihi wasallam daripadaku, dan tidak ada sesuatu yang lebih aku sukai daripada aku dekat dengan beliau, sehingga aku bisa membunuhnya, kalau seandainya aku meninggal dalam keadaan tersebut niscaya aku termasuk pengguhi neraka. Ketika Allah menjadikan Islam di dalam hatiku, maka aku mendatangi Rasulullah shallallahu 'alaihi wasallam dan kukatakan, 'Bentangkan tangan kananmu, maka aku akan membaiatmu', maka beliau membentangkan tangan kanannya."" Amru bin al Ash berkata, 'Lalu aku memegang tanganku'. Beliau bertanya: 'Ada apa denganmu wahai Amru? ' Aku menjawab, 'Aku ingin memberikan persyaratan.' Beliau bersabda: ""Kamu meminta syarat apa? ' Aku menjawab, 'Dengan syarat aku diampuni.' Beliau bersabda: ""Apakah kamu tidak tahu bahwa Islam telah menghapuskan dosa yang telah terdahulu, dan bahwa hijrah juga menghapuskan dosa yang terdahulu, dan haji juga menghapuskan dosa yang terdahulu.' Dan tidak ada seorang pun yang lebih saya cintai daripada Rasulullah shallallahu 'alaihi wasallam, dan tidak ada yang lebih jelas pada mataku daripada beliau, dan aku tidak mampu untuk memenuhi kedua mataku (dengan sesuatupun) daripada beliau karena pengagungan kepada beliau, kalau aku diminta untuk menggambarkannya, niscaya aku tidak mampu, karena aku belum memenuhi mataku dari beliau. Dan kalau aku mati pada kondisi itu, niscaya aku berharap menjadi salah seorang penduduk surga. Kemudian kami melalui sesuatu yang mana aku tidak mengetahui apa keadaanku di dalamnya, maka apabila aku meninggal, maka janganlah wanita yang menangis meraung-raung menemaniku, dan tidak pula api. Apabila kalian menguburkanku maka taburkanlah tanah padaku, kemudian berdirilah kalian di sekitar kuburanku sekitar jarak unta disembelih dan dibagikan dagingnya, hingga aku mendengar kalian dan melihat apa yang dibawa utusan Rabbku.""","حَدَّثَنَا مُحَمَّدُ بْنُ الْمُثَنَّى الْعَنَزِيُّ وَأَبُو مَعْنٍ الرَّقَاشِيُّ وَإِسْحَقُ بْنُ مَنْصُورٍ كُلُّهُمْ عَنْ أَبِي عَاصِمٍ وَاللَّفْظُ لِابْنِ الْمُثَنَّى حَدَّثَنَا الضَّحَّاكُ يَعْنِي أَبَا عَاصِمٍ قَالَ أَخْبَرَنَا حَيْوَةُ بْنُ شُرَيْحٍ قَالَ حَدَّثَنِي يَزِيدُ بْنُ أَبِي حَبِيبٍ عَنْ ابْنِ شِمَاسَةَ الْمَهْرِيِّ قَالَ
حَضَرْنَا عَمْرَو بْنَ الْعَاصِ وَهُوَ فِي سِيَاقَةِ الْمَوْتِ فَبَكَى طَوِيلًا وَحَوَّلَ وَجْهَهُ إِلَى الْجِدَارِ فَجَعَلَ ابْنُهُ يَقُولُ يَا أَبَتَاهُ أَمَا بَشَّرَكَ رَسُولُ اللَّهِ صَلَّى اللَّهُ عَلَيْهِ وَسَلَّمَ بِكَذَا أَمَا بَشَّرَكَ رَسُولُ اللَّهِ صَلَّى اللَّهُ عَلَيْهِ وَسَلَّمَ بِكَذَا قَالَ فَأَقْبَلَ بِوَجْهِهِ فَقَالَ إِنَّ أَفْضَلَ مَا نُعِدُّ شَهَادَةُ أَنْ لَا إِلَهَ إِلَّا اللَّهُ وَأَنَّ مُحَمَّدًا رَسُولُ اللَّهِ إِنِّي كُنْتُ عَلَى أَطْبَاقٍ ثَلَاثٍ لَقَدْ رَأَيْتُنِي وَمَا أَحَدٌ أَشَدَّ بُغْضًا لِرَسُولِ اللَّهِ صَلَّى اللَّهُ عَلَيْهِ وَسَلَّمَ مِنِّي وَلَا أَحَبَّ إِلَيَّ أَنْ أَكُونَ قَدْ اسْتَمْكَنْتُ مِنْهُ فَقَتَلْتُهُ فَلَوْ مُتُّ عَلَى تِلْكَ الْحَالِ لَكُنْتُ مِنْ أَهْلِ النَّارِ فَلَمَّا جَعَلَ اللَّهُ الْإِسْلَامَ فِي قَلْبِي أَتَيْتُ النَّبِيَّ صَلَّى اللَّهُ عَلَيْهِ وَسَلَّمَ فَقُلْتُ ابْسُطْ يَمِينَكَ فَلْأُبَايِعْكَ فَبَسَطَ يَمِينَهُ قَالَ فَقَبَضْتُ يَدِي قَالَ مَا لَكَ يَا عَمْرُو قَالَ قُلْتُ أَرَدْتُ أَنْ أَشْتَرِطَ قَالَ تَشْتَرِطُ بِمَاذَا قُلْتُ أَنْ يُغْفَرَ لِي قَالَ أَمَا عَلِمْتَ أَنَّ الْإِسْلَامَ يَهْدِمُ مَا كَانَ قَبْلَهُ وَأَنَّ الْهِجْرَةَ تَهْدِمُ مَا كَانَ قَبْلِهَا وَأَنَّ الْحَجَّ يَهْدِمُ مَا كَانَ قَبْلَهُ وَمَا كَانَ أَحَدٌ أَحَبَّ إِلَيَّ مِنْ رَسُولِ اللَّهِ صَلَّى اللَّهُ عَلَيْهِ وَسَلَّمَ وَلَا أَجَلَّ فِي عَيْنِي مِنْهُ وَمَا كُنْتُ أُطِيقُ أَنْ أَمْلَأَ عَيْنَيَّ مِنْهُ إِجْلَالًا لَهُ وَلَوْ سُئِلْتُ أَنْ أَصِفَهُ مَا أَطَقْتُ لِأَنِّي لَمْ أَكُنْ أَمْلَأُ عَيْنَيَّ مِنْهُ وَلَوْ مُتُّ عَلَى تِلْكَ الْحَالِ لَرَجَوْتُ أَنْ أَكُونَ مِنْ أَهْلِ الْجَنَّةِ ثُمَّ وَلِينَا أَشْيَاءَ مَا أَدْرِي مَا حَالِي فِيهَا فَإِذَا أَنَا مُتُّ فَلَا تَصْحَبْنِي نَائِحَةٌ وَلَا نَارٌ فَإِذَا دَفَنْتُمُونِي فَشُنُّوا عَلَيَّ التُّرَابَ شَنًّا ثُمَّ أَقِيمُوا حَوْلَ قَبْرِي قَدْرَ مَا تُنْحَرُ جَزُورٌ وَيُقْسَمُ لَحْمُهَا حَتَّى أَسْتَأْنِسَ بِكُمْ وَأَنْظُرَ مَاذَا أُرَاجِعُ بِهِ رُسُلَ رَبِّي",11
367,3,"Telah menceritakan kepada kami [Yahya bin Ayyub] dan [Suraij bin Yunus] dan [Qutaibah bin Sa'id] dan [Ali bin Hujr] semuanya meriwayatkan dari [Ismail bin Ja'far], [Ibnu Ayyub] berkata, telah menceritakan kepada kami [Ismail] telah mengabarkan kepadaku [al-'Ala'] dari [bapaknya] dari [Abu Hurairah], bahwa Rasulullah shallallahu 'alaihi wasallam pernah mendatangi pekuburan lalu bersabda: ""Semoga keselamatan terlimpahkah atas kalian penghuni kuburan kaum mukminin, dan sesungguhnya insya Allah kami akan bertemu kalian, "" sungguh aku sangat gembira seandainya kita dapat melihat saudara-saudara kita."" Para Sahabat bertanya, 'Tidakkah kami semua saudara-saudaramu wahai Rasulullah? ' Beliau menjawab dengan bersabda: ""Kamu semua adalah sahabatku, sedangkan saudara-saudara kita ialah mereka yang belum berwujud."" Sahabat bertanya lagi, 'Bagaimana kamu dapat mengenali mereka yang belum berwujud dari kalangan umatmu wahai Rasulullah? ' Beliau menjawab dengan bersabda: ""Apa pendapat kalian, seandainya seorang lelaki mempunyai seekor kuda yang berbulu putih di dahi serta di kakinya, dan kuda itu berada di tengah-tengah sekelompok kuda yang hitam legam. Apakah dia akan mengenali kudanya itu? ' Para Sahabat menjawab, 'Sudah tentu wahai Rasulullah.' Beliau bersabda lagi: 'Maka mereka datang dalam keadaan muka dan kaki mereka putih bercahaya karena bekas wudlu. Aku mendahului mereka ke telaga. Ingatlah! Ada golongan lelaki yang dihalangi dari datang ke telagaku sebagaimana dihalaunya unta-unta sesat'. Aku memanggil mereka, 'Kemarilah kamu semua'. Maka dikatakan, 'Sesungguhnya mereka telah menukar ajaranmu selepas kamu wafat'. Maka aku bersabda: ""Pergilah jauh-jauh dari sini."" Telah menceritakan kepada kami [Qutaibah bin Sa'id] telah menceritakan kepada kami [Abdul Aziz] -yaitu ad-darawardi. (dalam riwayat lain disebutkan) Dan telah menceritakan kepadaku [Ishaq bin Musa al-Anshari] telah menceritakan kepada kami [Ma'n] telah menceritakan kepada kami [Malik] semuanya meriwayatkan dari [al-'Ala' bin Abdurrahman] dari [bapaknya] dari [Abu Hurairah] bahwa Rasulullah shallallahu 'alaihi wasallam keluar menuju pekuburan seraya berkata, ""Semoga keselamatan terlimpahkan kepada kalian wahai penduduk kuburan kaum mukminin. Dan sesungguhnya insya Allah kita pasti bertemu, "" sebagaimana hadits Ismail bin Ja'far, hanya saja hadits Malik menyebutkan, ""Sungguh, sekelompok laki-laki akan dihalau dari telagaku.""","حَدَّثَنَا يَحْيَى بْنُ أَيُّوبَ وَسُرَيْجُ بْنُ يُونُسَ وَقُتَيْبَةُ بْنُ سَعِيدٍ وَعَلِيُّ بْنُ حُجْرٍ جَمِيعًا عَنْ إِسْمَعِيلَ بْنِ جَعْفَرٍ قَالَ ابْنُ أَيُّوبَ حَدَّثَنَا إِسْمَعِيلُ أَخْبَرَنِي الْعَلَاءُ عَنْ أَبِيهِ عَنْ أَبِي هُرَيْرَةَ
أَنَّ رَسُولَ اللَّهِ صَلَّى اللَّهُ عَلَيْهِ وَسَلَّمَ أَتَى الْمَقْبُرَةَ فَقَالَ السَّلَامُ عَلَيْكُمْ دَارَ قَوْمٍ مُؤْمِنِينَ وَإِنَّا إِنْ شَاءَ اللَّهُ بِكُمْ لَاحِقُونَ وَدِدْتُ أَنَّا قَدْ رَأَيْنَا إِخْوَانَنَا قَالُوا أَوَلَسْنَا إِخْوَانَكَ يَا رَسُولَ اللَّهِ قَالَ أَنْتُمْ أَصْحَابِي وَإِخْوَانُنَا الَّذِينَ لَمْ يَأْتُوا بَعْدُ فَقَالُوا كَيْفَ تَعْرِفُ مَنْ لَمْ يَأْتِ بَعْدُ مِنْ أُمَّتِكَ يَا رَسُولَ اللَّهِ فَقَالَ أَرَأَيْتَ لَوْ أَنَّ رَجُلًا لَهُ خَيْلٌ غُرٌّ مُحَجَّلَةٌ بَيْنَ ظَهْرَيْ خَيْلٍ دُهْمٍ بُهْمٍ أَلَا يَعْرِفُ خَيْلَهُ قَالُوا بَلَى يَا رَسُولَ اللَّهِ قَالَ فَإِنَّهُمْ يَأْتُونَ غُرًّا مُحَجَّلِينَ مِنْ الْوُضُوءِ وَأَنَا فَرَطُهُمْ عَلَى الْحَوْضِ أَلَا لَيُذَادَنَّ رِجَالٌ عَنْ حَوْضِي كَمَا يُذَادُ الْبَعِيرُ الضَّالُّ أُنَادِيهِمْ أَلَا هَلُمَّ فَيُقَالُ إِنَّهُمْ قَدْ بَدَّلُوا بَعْدَكَ فَأَقُولُ سُحْقًا سُحْقًا
حَدَّثَنَا قُتَيْبَةُ بْنُ سَعِيدٍ حَدَّثَنَا عَبْدُ الْعَزِيزِ يَعْنِي الدَّرَاوَرْدِيَّ ح و حَدَّثَنِي إِسْحَقُ بْنُ مُوسَى الْأَنْصَارِيُّ حَدَّثَنَا مَعْنٌ حَدَّثَنَا مَالِكٌ جَمِيعًا عَنْ الْعَلَاءِ بْنِ عَبْدِ الرَّحْمَنِ عَنْ أَبِيهِ عَنْ أَبِي هُرَيْرَةَ أَنَّ رَسُولَ اللَّهِ صَلَّى اللَّهُ عَلَيْهِ وَسَلَّمَ خَرَجَ إِلَى الْمَقْبُرَةِ فَقَالَ السَّلَامُ عَلَيْكُمْ دَارَ قَوْمٍ مُؤْمِنِينَ وَإِنَّا إِنْ شَاءَ اللَّهُ بِكُمْ لَاحِقُونَ بِمِثْلِ حَدِيثِ إِسْمَعِيلَ بْنِ جَعْفَرٍ غَيْرَ أَنَّ حَدِيثَ مَالِكٍ فَلَيُذَادَنَّ رِجَالٌ عَنْ حَوْضِي",11
456,4,"Telah menceritakan kepada kami [Abu Bakar bin Abi Syaibah] telah menceritakan kepada kami [Waki'] dan [Abu Muawiyah] serta [Husyaim] dari [al-A'masy] dari [Mundzir bin Ya'la], dan dia diberi gelar Abu Ya'la dari [Ibnu al-Hanafiyyah] dari [Ali] dia berkata, ""Aku adalah lelaki yang sering keluar madzi, tetapi aku malu untuk bertanya Nabi Shallallahu'alaihiwasallam karena puteri beliau adalah istriku sendiri. Maka kusuruh al-Miqdad bin al-Aswad supaya bertanya beliau, lalu beliau bersabda, ""Hendaklah dia membasuh kemaluannya dan berwudhu.""","حَدَّثَنَا أَبُو بَكْرِ بْنُ أَبِي شَيْبَةَ حَدَّثَنَا وَكِيعٌ وَأَبُو مُعَاوِيَةَ وَهُشَيْمٌ عَنْ الْأَعْمَشِ عَنْ مُنْذِرِ بْنِ يَعْلَى وَيُكْنَى أَبَا يَعْلَى عَنْ ابْنِ الْحَنَفِيَّةِ عَنْ عَلِيٍّ قَالَ
كُنْتُ رَجُلًا مَذَّاءً وَكُنْتُ أَسْتَحْيِي أَنْ أَسْأَلَ النَّبِيَّ صَلَّى اللَّهُ عَلَيْهِ وَسَلَّمَ لِمَكَانِ ابْنَتِهِ فَأَمَرْتُ الْمِقْدَادَ بْنَ الْأَسْوَدِ فَسَأَلَهُ فَقَالَ يَغْسِلُ ذَكَرَهُ وَيَتَوَضَّأُ",11
460,4,"Telah menceritakan kepada kami [Yahya bin Yahya at-Tamimi] dan [Muhammad bin Rumh] keduanya berkata, telah mengabarkan kepada kami [al-Laits] --lewat jalur periwayatan lain-- dan telah menceritakan kepada kami [Qutaibah bin Sa'id] telah menceritakan kepada kami [Laits] dari [Ibnu Syihab] dari [Abu Salamah bin Abdurrahman] dari [Aisyah] bahwa Rasulullah shallallahu 'alaihi wasallam berkata, ""Apabila Rasulullah Shallallahu'alaihiwasallam ingin tidur, sedangkan beliau masih dalam keadaan berjunub, maka beliau berwudhu dengan wudhu untuk mengerjakan shalat sebelum tidur.""","حَدَّثَنَا يَحْيَى بْنُ يَحْيَى التَّمِيمِيُّ وَمُحَمَّدُ بْنُ رُمْحٍ قَالَا أَخْبَرَنَا اللَّيْثُ ح و حَدَّثَنَا قُتَيْبَةُ بْنُ سَعِيدٍ حَدَّثَنَا لَيْثٌ عَنْ ابْنِ شِهَابٍ عَنْ أَبِي سَلَمَةَ بْنِ عَبْدِ الرَّحْمَنِ عَنْ عَائِشَةَ
أَنَّ رَسُولَ اللَّهِ صَلَّى اللَّهُ عَلَيْهِ وَسَلَّمَ كَانَ إِذَا أَرَادَ أَنْ يَنَامَ وَهُوَ جُنُبٌ تَوَضَّأَ وُضُوءَهُ لِلصَّلَاةِ قَبْلَ أَنْ يَنَامَ",11
513,4,"Dan telah menceritakan kepada kami [Muhammad bin Rafi'] telah menceritakan kepada kami [Abdurrazzaq] telah menceritakan kepada kami [Ma'mar] dari [Hammam bin Munabbih] dia berkata, ini adalah sesuatu yang diceritakan [Abu Hurairah] dari Muhammad, Rasulullah Shallallahu'alaihiwasallam maka dia menyebutkan beberapa hadits darinya. Dan Rasulullah Shallallahu'alaihiwasallam pernah bersabda, ""Dahulu, orang-orang Bani Israil mandi telanjang. Sebagian mereka melihat aurat sebagian yang lain. Dahulu Musa 'Alaihissalam juga mandi sendirian. Lalu Mereka berkata, 'Demi Allah, sesuatu yang menyebabkan Musa tidak mau mandi bersama dengan kita ialah karena penyakit pada zakar yang menjadikannya mengembang.' Suatu ketika Musa mandi. Dia letakkan pakaiannya di atas sebuah batu. Tiba-tiba batu tadi bergerak dengan membawa pakaiannya. Musa berlari mengejarnya sambil berteriak, 'Hai batu! Tinggalkan pakaianku! Hai batu! Tinggalkan pakaianku! Sehingga orang-orang Bani Israil dapat melihat aurat Musa.' Kemudian mereka berkata, 'Demi Allah ternyata Musa tiada sedikit pun aib penyakit.' Setelah itu batu tersebut berhenti lalu Musa mengambil pakaiannya kemudian memukul batu tadi'."" Abu Hurairah berkata, ""Demi Allah, pada batu tadi terdapat bekas pukulan Musa, tujuh atau enam kali pukulan.""","و حَدَّثَنَا مُحَمَّدُ بْنُ رَافِعٍ حَدَّثَنَا عَبْدُ الرَّزَّاقِ حَدَّثَنَا مَعْمَرٌ عَنْ هَمَّامِ بْنِ مُنَبِّهٍ قَالَ هَذَا مَا حَدَّثَنَا أَبُو هُرَيْرَةَ عَنْ مُحَمَّدٍ رَسُولِ اللَّهِ صَلَّى اللَّهُ عَلَيْهِ وَسَلَّمَ فَذَكَرَ أَحَادِيثَ مِنْهَا
وَقَالَ رَسُولُ اللَّهِ صَلَّى اللَّهُ عَلَيْهِ وَسَلَّمَ كَانَتْ بَنُو إِسْرَائِيلَ يَغْتَسِلُونَ عُرَاةً يَنْظُرُ بَعْضُهُمْ إِلَى سَوْأَةِ بَعْضٍ وَكَانَ مُوسَى عَلَيْهِ السَّلَام يَغْتَسِلُ وَحْدَهُ فَقَالُوا وَاللَّهِ مَا يَمْنَعُ مُوسَى أَنْ يَغْتَسِلَ مَعَنَا إِلَّا أَنَّهُ آدَرُ قَالَ فَذَهَبَ مَرَّةً يَغْتَسِلُ فَوَضَعَ ثَوْبَهُ عَلَى حَجَرٍ فَفَرَّ الْحَجَرُ بِثَوْبِهِ قَالَ فَجَمَحَ مُوسَى بِإِثْرِهِ يَقُولُ ثَوْبِي حَجَرُ ثَوْبِي حَجَرُ حَتَّى نَظَرَتْ بَنُو إِسْرَائِيلَ إِلَى سَوْأَةِ مُوسَى قَالُوا وَاللَّهِ مَا بِمُوسَى مِنْ بَأْسٍ فَقَامَ الْحَجَرُ حَتَّى نُظِرَ إِلَيْهِ قَالَ فَأَخَذَ ثَوْبَهُ فَطَفِقَ بِالْحَجَرِ ضَرْبًا قَالَ أَبُو هُرَيْرَةَ وَاللَّهِ إِنَّهُ بِالْحَجَرِ نَدَبٌ سِتَّةٌ أَوْ سَبْعَةٌ ضَرْبُ مُوسَى بِالْحَجَرِ",11
514,4,"Dan telah menceritakan kepada kami [Ishaq bin Ibrahim al-Hanzhali] dan [Muhammad bin Hatim bin Maimun] semuanya meriwayatkan dari [Muhammad bin Bakr] dia berkata, telah mengabarkan kepada kami [Ibnu Juraij] --lewat jalur periwayatan lain-- dan telah menceritakan kepada kami [Ishaq bin Manshur] dan [Muhammad bin Rafi'] dan lafazh tersebut milik keduanya. Ishaq berkata, telah mengabarkan kepada kami sedangkan Ibnu Rafi' berkata, telah menceritakan kepada kami [Abdurrazzaq] telah mengabarkan kepada kami [Ibnu Juraij] telah mengabarkan kepadaku [Amr bin Dinar] bahwa dia mendengar [Jabir bin Abdullah] dia berkata, ""Ketika Ka'bah dibangun, Nabi Shallallahu'alaihiwasallam. bersama Abbas pergi untuk mengangkat batu. Maka Abbas berkata kepada Nabi Shallallahu'alaihiwasallam, 'Angkatkan kainmu ke bahumu untuk alas batu. Maka beliau melakukannya, lalu beliau jatuh tersungkur lalu beliau mendongakkan kedua matanya ke langit, kemudian berdiri sambil berkata, 'Kainku, kainku'. Kemudian Beliau memakai kain tersebut."" Ibnu Rafi' berkata dalam riwayatnya, ""Angkatlah di atas lehermu"" dan bukan berkata, ""Di atas pundakmu.""","و حَدَّثَنَا إِسْحَقُ بْنُ إِبْرَاهِيمَ الْحَنْظَلِيُّ وَمُحَمَّدُ بْنُ حَاتِمِ بْنِ مَيْمُونٍ جَمِيعًا عَنْ مُحَمَّدِ بْنِ بَكْرٍ قَالَ أَخْبَرَنَا ابْنُ جُرَيْجٍ ح و حَدَّثَنَا إِسْحَقُ بْنُ مَنْصُورٍ وَمُحَمَّدُ بْنُ رَافِعٍ وَاللَّفْظُ لَهُمَا قَالَ إِسْحَقُ أَخْبَرَنَا وَقَالَ ابْنُ رَافِعٍ حَدَّثَنَا عَبْدُ الرَّزَّاقِ أَخْبَرَنَا ابْنُ جُرَيْجٍ أَخْبَرَنِي عَمْرُو بْنُ دِينَارٍ أَنَّهُ سَمِعَ جَابِرَ بْنَ عَبْدِ اللَّهِ يَقُولُا
لَمَّا بُنِيَتْ الْكَعْبَةُ ذَهَبَ النَّبِيُّ صَلَّى اللَّهُ عَلَيْهِ وَسَلَّمَ وَعَبَّاسٌ يَنْقُلَانِ حِجَارَةً فَقَالَ الْعَبَّاسُ لِلنَّبِيِّ صَلَّى اللَّهُ عَلَيْهِ وَسَلَّمَ اجْعَلْ إِزَارَكَ عَلَى عَاتِقِكَ مِنْ الْحِجَارَةِ فَفَعَلَ فَخَرَّ إِلَى الْأَرْضِ وَطَمَحَتْ عَيْنَاهُ إِلَى السَّمَاءِ ثُمَّ قَامَ فَقَالَ إِزَارِي إِزَارِي فَشَدَّ عَلَيْهِ إِزَارَهُ
قَالَ ابْنُ رَافِعٍ فِي رِوَايَتِهِ عَلَى رَقَبَتِكَ وَلَمْ يَقُلْ عَلَى عَاتِقِكَ",11
521,4,"Telah menceritakan kepada kami [Abu Bakar bin Abi Syaibah] telah menceritakan kepada kami [Ghundar] dari [Syu'bah] --lewat jalur periwayatan lain-- dan telah menceritakan kepada kami [Muhammad bin al-Mutsanna] dan [Ibnu Basysyar] keduanya berkata, telah menceritakan kepada kami [Muhammad bin Ja'far] telah menceritakan kepada kami [Syu'bah] dari [al-Hakam] dari [Dzakwan] dari [Abu Said al-Khudri] bahwa Rasulullah Shallallahu'alaihiwasallam pernah melalui sebuah rumah seorang Sahabat dari Anshar. Kemudian beliau menyuruh seseorang untuk memanggilnya. Lalu sahabat tadi keluar dalam keadaan kepalanya meneteskan (air keringat). Beliau bersabda, ""Barangkali kami yang membuat kamu tergesa-gesa."" Sahabat itu menjawab, ""Benar, wahai Rasulullah."" Beliau bersabda, ""Apabila kamu tergesa-gesa atau kamu tidak mengeluarkan mani semasa mengauli isteri maka kamu tidak perlu mandi. Kamu hanya wajib berwudhu."" Ibnu Basysyar berkata dengan redaksi, ""Apabila kamu tergesa-gesa atau kamu tidak mengeluarkan mani.""","حَدَّثَنَا أَبُو بَكْرِ بْنُ أَبِي شَيْبَةَ حَدَّثَنَا غُنْدَرٌ عَنْ شُعْبَةَ ح و حَدَّثَنَا مُحَمَّدُ بْنُ الْمُثَنَّى وَابْنُ بَشَّارٍ قَالَا حَدَّثَنَا مُحَمَّدُ بْنُ جَعْفَرٍ حَدَّثَنَا شُعْبَةُ عَنْ الْحَكَمِ عَنْ ذَكْوَانَ عَنْ أَبِي سَعِيدٍ الْخُدْرِيِّ
أَنَّ رَسُولَ اللَّهِ صَلَّى اللَّهُ عَلَيْهِ وَسَلَّمَ مَرَّ عَلَى رَجُلٍ مِنْ الْأَنْصَارِ فَأَرْسَلَ إِلَيْهِ فَخَرَجَ وَرَأْسُهُ يَقْطُرُ فَقَالَ لَعَلَّنَا أَعْجَلْنَاكَ قَالَ نَعَمْ يَا رَسُولَ اللَّهِ قَالَ إِذَا أُعْجِلْتَ أَوْ أَقْحَطْتَ فَلَا غُسْلَ عَلَيْكَ وَعَلَيْكَ الْوُضُوءُ
و قَالَ ابْنُ بَشَّارٍ إِذَا أُعْجِلْتَ أَوْ أُقْحِطْتَ",11
523,4,"Dan telah menceritakan kepada kami [Muhammad bin al-Mutsanna] telah menceritakan kepada kami [Muhammad bin Ja'far] telah menceritakan kepada kami [Syu'bah] dari [Hisyam bin Urwah] telah menceritakan kepada kami [bapakku] dari al-Mali dari al-Mali yaitu dengan perkataanya al-Mali, dari al-Mali [Abu Ayyub] dari [Ubaiy bin Ka'ab] dari Rasulullah Shallallahu'alaihiwasallam, bahwa beliau berkata pada seorang laki-laki yang menyenggamai istrinya, kemudian tidak keluar mani. Beliau berkata lagi, ""Hendaklah dia mencuci dzakarnya dan berwudhu.""","و حَدَّثَنَا مُحَمَّدُ بْنُ الْمُثَنَّى حَدَّثَنَا مَحَمَّدُ بْنُ جَعْفَرٍ حَدَّثَنَا شُعْبَةُ عَنْ هِشَامِ بْنِ عُرْوَةَ حَدَّثَنِي أَبِي عَنْ الْمَلِيِّ عَنْ الْمَلِيِّ يَعْنِي بِقَوْلِهِ الْمَلِيِّ عَنْ الْمَلِيِّ أَبُو أَيُّوبَ عَنْ أُبَيِّ بْنِ كَعْبٍ
عَنْ رَسُولِ اللَّهِ صَلَّى اللَّهُ عَلَيْهِ وَسَلَّمَ أَنَّهُ قَالَ فِي الرَّجُلِ يَأْتِي أَهْلَهُ ثُمَّ لَا يُنْزِلُ قَالَ يَغْسِلُ ذَكَرَهُ وَيَتَوَضَّأُ",11
