haditsId,kitabId,indo,arab,label
1570,12,"Telah menceritakan kepadaku [Abu Thahir] dan [Harmalah bin Yahya] dan [Harun bin Sa'id Al Aili] -dan lafazh milik Harun dan Harmalah, Harun berkata- telah menceritakan kepada kami -sementara dua orang yang lain berkata- telah mengabarkan kepada kami [Ibnu Wahb] telah mengabarkan kepadaku [Yunus] dari [Ibnu Syihab] ia berkata, telah menceritakan kepadaku [Abdurrahman bin Hurmuz Al A'raj] bahwa [Abu Hurairah] berkata; Rasulullah shallallahu 'alaihi wasallam bersabda: ""Siapa yang turut menyaksikan pengurusan jenazah hingga ia menshalitinya, maka baginya pahala sebesar satu qirath. Sedangkan siapa yang turut menyaksikan pengurusannya hingga jenazah itu dimakamkan, maka baginya pahala sebesar dua qirath."" Lalu ditanyakanlah, ""Apakah itu dua qirath?"" beliau menjawab: ""Seperti dua gunung yang besar."" sampai disinilah haditsnya Abu Thahir. Kemudian dua orang itu menambahkan; Ibnu Syihab berkata, Salim bin Abdullah bin Umar berkata; Ibnu Umar pernah menshalati jenazah lalu ia bubar dan pergi. Dan ketika hadits Abu Hurairah sampai padanya, ia pun berkata, ""Sungguh, kita telah menyia-nyiakan banyak qirath."" Dan telah menceritakannya kepada kami [Abu Bakar bin Abu Syaibah] telah menceritakan kepada kami [Abdul A'la] -dalam jalur lain- Dan Telah menceritakan kepada kami [Ibnu Rafi'] dan [Abdu bin Humaid] dari [Abdurrazaq] keduanya dari [Ma'mar] dari [Az Zuhri] dari [Sa'id bin Al Musayyab] dari [Abu Hurairah] dari Nabi shallallahu 'alaihi wasallam, hingga sampai pada; ""Seperti dua gunung yang besar."" Dan ia tidak menyebutkan sesudahnya. Dan di dalam haditsnya Abdul A'la tercantum; ""Hingga pengurusan (jenazah itu) selesai."" Sementara di dalam riwayat Abdurrazaq tercantum; ""Hingga (jenazah itu) diletakkan di dalam liang lahad."" Dan telah menceritakan kepadaku [Abdul Malik bin Syu'aib bin Laits] telah menceritakan kepadaku [bapakku] dari [kakekku] ia berkata, telah menceritakan kepadaku [Uqail bin Khalid] dari [Ibnu Syihab] ia berkata, telah menceritakan kepadaku [seorang laki-laki] dari [Abu Hurairah] dari Nabi shallallahu 'alaihi wasallam, yakni seperti haditsnya Ma'mar. dan ia menyebutkan; ""Hingga (jenazah itu) dikebumikan.""","و حَدَّثَنِي أَبُو الطَّاهِرِ وَحَرْمَلَةُ بْنُ يَحْيَى وَهَارُونُ بْنُ سَعِيدٍ الْأَيْلِيُّ وَاللَّفْظُ لِهَارُونَ وَحَرْمَلَةَ قَالَ هَارُونُ حَدَّثَنَا وَقَالَ الْآخَرَانِ أَخْبَرَنَا ابْنُ وَهْبٍ أَخْبَرَنِي يُونُسُ عَنْ ابْنِ شِهَابٍ قَالَ حَدَّثَنِي عَبْدُ الرَّحْمَنِ بْنُ هُرْمُزَ الْأَعْرَجُ أَنَّ أَبَا هُرَيْرَةَ قَالَ
قَالَ رَسُولُ اللَّهِ صَلَّى اللَّهُ عَلَيْهِ وَسَلَّمَ مَنْ شَهِدَ الْجَنَازَةَ حَتَّى يُصَلَّى عَلَيْهَا فَلَهُ قِيرَاطٌ وَمَنْ شَهِدَهَا حَتَّى تُدْفَنَ فَلَهُ قِيرَاطَانِ قِيلَ وَمَا الْقِيرَاطَانِ قَالَ مِثْلُ الْجَبَلَيْنِ الْعَظِيمَيْنِ
انْتَهَى حَدِيثُ أَبِي الطَّاهِرِ وَزَادَ الْآخَرَانِ قَالَ ابْنُ شِهَابٍ قَالَ سَالِمُ بْنُ عَبْدِ اللَّهِ بْنِ عُمَرَ وَكَانَ ابْنُ عُمَرَ يُصَلِّي عَلَيْهَا ثُمَّ يَنْصَرِفُ فَلَمَّا بَلَغَهُ حَدِيثُ أَبِي هُرَيْرَةَ قَالَ لَقَدْ ضَيَّعْنَا قَرَارِيطَ كَثِيرَةً و حَدَّثَنَاه أَبُو بَكْرِ بْنُ أَبِي شَيْبَةَ حَدَّثَنَا عَبْدُ الْأَعْلَى ح و حَدَّثَنَا ابْنُ رَافِعٍ وَعَبْدُ بْنُ حُمَيْدٍ عَنْ عَبْدِ الرَّزَّاقِ كِلَاهُمَا عَنْ مَعْمَرٍ عَنْ الزُّهْرِيِّ عَنْ سَعِيدِ بْنِ الْمُسَيَّبِ عَنْ أَبِي هُرَيْرَةَ عَنْ النَّبِيِّ صَلَّى اللَّهُ عَلَيْهِ وَسَلَّمَ إِلَى قَوْلِهِ الْجَبَلَيْنِ الْعَظِيمَيْنِ وَلَمْ يَذْكُرَا مَا بَعْدَهُ وَفِي حَدِيثِ عَبْدِ الْأَعْلَى حَتَّى يُفْرَغَ مِنْهَا وَفِي حَدِيثِ عَبْدِ الرَّزَّاقِ حَتَّى تُوضَعَ فِي اللَّحْدِ و حَدَّثَنِي عَبْدُ الْمَلِكِ بْنُ شُعَيْبِ بْنِ اللَّيْثِ حَدَّثَنِي أَبِي عَنْ جَدِّي قَالَ حَدَّثَنِي عُقَيْلُ بْنُ خَالِدٍ عَنْ ابْنِ شِهَابٍ أَنَّهُ قَالَ حَدَّثَنِي رِجَالٌ عَنْ أَبِي هُرَيْرَةَ عَنْ النَّبِيِّ صَلَّى اللَّهُ عَلَيْهِ وَسَلَّمَ بِمِثْلِ حَدِيثِ مَعْمَرٍ وَقَالَ وَمَنْ اتَّبَعَهَا حَتَّى تُدْفَنَ",11
1571,12,"Dan telah menceritakan kepadaku [Muhammad bin Hatim] telah menceritakan kepada kami [Bahz] telah menceritakan kepada kami [Wuhaib] telah menceritakan kepadaku [Suhail] dari [bapaknya] dari [Abu Hurairah] dari Nabi shallallahu 'alaihi wasallam, beliau bersabda: ""Barangsiapa yang menshalatkan jenazah, namun ia tidak sampai ikut mengantarnya maka baginya pahala satu qirath. Dan jika ia turut mengantarnya, maka baginya pahala dua qirath."" Kemudian ditanyakanlah, ""Seperti apakah dua qirath itu?"" beliau menjawab: ""Yang paling kecil di antaranya adalah seperti gunung uhud.""","و حَدَّثَنِي مُحَمَّدُ بْنُ حَاتِمٍ حَدَّثَنَا بَهْزٌ حَدَّثَنَا وُهَيْبٌ حَدَّثَنِي سُهَيْلٌ عَنْ أَبِيهِ عَنْ أَبِي هُرَيْرَةَ
عَنْ النَّبِيِّ صَلَّى اللَّهُ عَلَيْهِ وَسَلَّمَ قَالَ مَنْ صَلَّى عَلَى جَنَازَةٍ وَلَمْ يَتْبَعْهَا فَلَهُ قِيرَاطٌ فَإِنْ تَبِعَهَا فَلَهُ قِيرَاطَانِ قِيلَ وَمَا الْقِيرَاطَانِ قَالَ أَصْغَرُهُمَا مِثْلُ أُحُدٍ",11
1572,12,"Telah menceritakan kepada kami [Muhammad bin Hatim] telah menceritakan kepada kami [Yahya bin Sa'id] dari [Yazid bin Kaisan] telah menceritakan kepadaku [Abu Hazim] dari [Abu Hurairah] dari Nabi shallallahu 'alaihi wasallam, beliau bersabda: ""Barangsiapa yang menshalatkan jenazah, maka baginya pahala satu qirath, dan siapa yang mengantarnya hingga jenazah itu di letakkan di liang kubur, maka baginya pahala dua qirath."" Saya bertanya, ""Wahai Abu Hurairah, seperti apakah dua qirath itu?"" ia menjawab, ""Yaitu seperti gunung Uhud.""","حَدَّثَنِي مُحَمَّدُ بْنُ حَاتِمٍ حَدَّثَنَا يَحْيَى بْنُ سَعِيدٍ عَنْ يَزِيدَ بْنِ كَيْسَانَ حَدَّثَنِي أَبُو حَازِمٍ عَنْ أَبِي هُرَيْرَةَ
عَنْ النَّبِيِّ صَلَّى اللَّهُ عَلَيْهِ وَسَلَّمَ قَالَ مَنْ صَلَّى عَلَى جَنَازَةٍ فَلَهُ قِيرَاطٌ وَمَنْ اتَّبَعَهَا حَتَّى تُوضَعَ فِي الْقَبْرِ فَقِيرَاطَانِ
قَالَ قُلْتُ يَا أَبَا هُرَيْرَةَ وَمَا الْقِيرَاطُ قَالَ مِثْلُ أُحُدٍ",11
1573,12,"Telah menceritakan kepada kami [Syaiban bin Farukh] telah menceritakan kepada kami [Jarir bin Hazim] telah menceritakan kepada kami [Nafi'] ia berkata; telah dikatakan kepada Ibnu Umar, bahwa [Abu Hurairah] berkata; Saya mendengar Rasulullah shallallahu 'alaihi wasallam bersabda: ""Siapa yang mengikuti jenazah, maka baginya satu qirath pahala."" Ibnu Umar berkata, ""Yang paling banyak (menceritakan hadits kepada kita) adalah Abu Hurairah."" Lalu ia pun mengutus seseorang kepada Aisyah dan menanyakan hal itu padanya, maka [Aisyah] pun membenarkan Abu Hurairah. Maka Ibnu Umar pun berkata, ""Sungguh, kita telah melewatkan qirath yang banyak.""","حَدَّثَنَا شَيْبَانُ بْنُ فَرُّوخَ حَدَّثَنَا جَرِيرٌ يَعْنِي ابْنَ حَازِمٍ حَدَّثَنَا نَافِعٌ قَالَ قِيلَ لِابْنِ عُمَرَ إِنَّ أَبَا هُرَيْرَةَ يَقُولُا
سَمِعْتُ رَسُولَ اللَّهِ صَلَّى اللَّهُ عَلَيْهِ وَسَلَّمَ يَقُولُ مَنْ تَبِعَ جَنَازَةً فَلَهُ قِيرَاطٌ مِنْ الْأَجْرِ
فَقَالَ ابْنُ عُمَرَ أَكْثَرَ عَلَيْنَا أَبُو هُرَيْرَةَ فَبَعَثَ إِلَى عَائِشَةَ فَسَأَلَهَا فَصَدَّقَتْ أَبَا هُرَيْرَةَ فَقَالَ ابْنُ عُمَرَ لَقَدْ فَرَّطْنَا فِي قَرَارِيطَ كَثِيرَةٍ",11
1575,12,"Dan telah menceritakan kepada kami [Muhammad bin Basysyar] telah menceritakan kepada kami [Yahya, yaitu anaknya Sa'id] telah menceritakan kepada kami [Syu'bah] telah menceritakan kepadaku [Qatadah] dari [Salim bin Abul Ja'd] dari [Ma'dan bin Abu Thalhah Al Ya'mari] dari [Tsauban] maula Rasulullah shallallahu 'alaihi wasallam, bahwa Rasulullah shallallahu 'alaihi wasallam bersabda: ""Barangsiapa menshalatkan jenazah, maka baginya satu qirath pahala. Dan bila turut menyaksikan pemakamannya, maka baginya dua qirath pahala. Sedangkan besar satu qirath seperti besarnya gunung Uhud."" Dan telah menceritakan kepadaku [Muhammad bin Basysyar] Telah menceritakan kepada kami [Mu'adz bin Hisyam] telah menceritakan kepadaku [bapakku] ia berkata, dan telah menceritakan kepada kami [Ibnul Mutsanna] telah menceritakan kepada kami [Ibnu Abu Adi] dari [Sa'id] -dalam jalur lain- Dan telah menceritakan kepadaku [Zuhair bin Harb] telah menceritakan kepada kami ['Affan] Telah menceritakan kepada kami [Aban] semuanya dari [Qatadah] dengan isnad ini, hadits yang semisal dengannya. Dan di dalam hadits Sa'id dan Hisyam; Nabi shallallahu 'alaihi wasallam ditanya tentang qirath, maka beliau menjawab: ""(Yaitu) sebesar gunung Uhud.""","و حَدَّثَنَا مُحَمَّدُ بْنُ بَشَّارٍ حَدَّثَنَا يَحْيَى يَعْنِي ابْنَ سَعِيدٍ حَدَّثَنَا شُعْبَةُ حَدَّثَنِي قَتَادَةُ عَنْ سَالِمِ بْنِ أَبِي الْجَعْدِ عَنْ مَعْدَانَ بْنِ أَبِي طَلْحَةَ الْيَعْمَرِيِّ عَنْ ثَوْبَانَ مَوْلَى رَسُولِ اللَّهِ صَلَّى اللَّهُ عَلَيْهِ وَسَلَّمَ
أَنَّ رَسُولَ اللَّهِ صَلَّى اللَّهُ عَلَيْهِ وَسَلَّمَ قَالَ مَنْ صَلَّى عَلَى جَنَازَةٍ فَلَهُ قِيرَاطٌ فَإِنْ شَهِدَ دَفْنَهَا فَلَهُ قِيرَاطَانِ الْقِيرَاطُ مِثْلُ أُحُدٍ
و حَدَّثَنِي ابْنُ بَشَّارٍ حَدَّثَنَا مُعَاذُ بْنُ هِشَامٍ حَدَّثَنِي أَبِي قَالَ وَحَدَّثَنَا ابْنُ الْمُثَنَّى حَدَّثَنَا ابْنُ أَبِي عَدِيٍّ عَنْ سَعِيدٍ ح و حَدَّثَنِي زُهَيْرُ بْنُ حَرْبٍ حَدَّثَنَا عَفَّانُ حَدَّثَنَا أَبَانُ كُلُّهُمْ عَنْ قَتَادَةَ بِهَذَا الْإِسْنَادِ مِثْلَهُ وَفِي حَدِيثِ سَعِيدٍ وَهِشَامٍ سُئِلَ النَّبِيُّ صَلَّى اللَّهُ عَلَيْهِ وَسَلَّمَ عَنْ الْقِيرَاطِ فَقَالَ مِثْلُ أُحُدٍ",11
1576,12,"Telah menceritakan kepada kami [Al Hasan bin Isa] telah menceritakan kepada kami [Ibnul Mubarak] telah mengabarkan kepada kami [Sallam bin Abu Muthi'] dari [Ayyub] dari [Abu Qilabah] dari [Abdullah bin Yazid] saudara sesusuan Aisyah, dari [Aisyah] dari Nabi shallallahu 'alaihi wasallam, beliau bersabda: ""Mayat yang dishalatkan oleh kaum muslimin dengan jumlah melebihi seratus orang, dan semuanya mendo'akannya, maka do'a mereka untuknya akan dikabulkan."" Lalu saya menceritakannya kepada [Syu'aib bin Habhab], maka ia pun berkata; [Anas bin Malik] telah menceritakannya kepadaku dari Nabi shallallahu 'alaihi wasallam.","حَدَّثَنَا الْحَسَنُ بْنُ عِيسَى حَدَّثَنَا ابْنُ الْمُبَارَكِ أَخْبَرَنَا سَلَّامُ بْنُ أَبِي مُطِيعٍ عَنْ أَيُّوبَ عَنْ أَبِي قِلَابَةَ عَنْ عَبْدِ اللَّهِ بْنِ يَزِيدَ رَضِيعِ عَائِشَةَ عَنْ عَائِشَةَ
عَنْ النَّبِيِّ صَلَّى اللَّهُ عَلَيْهِ وَسَلَّمَ قَالَ مَا مِنْ مَيِّتٍ تُصَلِّي عَلَيْهِ أُمَّةٌ مِنْ الْمُسْلِمِينَ يَبْلُغُونَ مِائَةً كُلُّهُمْ يَشْفَعُونَ لَهُ إِلَّا شُفِّعُوا فِيهِ
قَالَ فَحَدَّثْتُ بِهِ شُعَيْبَ بْنَ الْحَبْحَابِ فَقَالَ حَدَّثَنِي بِهِ أَنَسُ بْنُ مَالِكٍ عَنْ النَّبِيِّ صَلَّى اللَّهُ عَلَيْهِ وَسَلَّمَ",11
1579,12,"Telah menceritakan kepada kami [Qutaibah bin Sa'id] dari [Malik bin Anas] -terkait dengan hadits yang telah dibacakan kepadanya- dari [Muhammad bin Amru bin Halhalah] dari [Ma'bad bin Ka'ab bin Malik] dari [Abu Qatadah bin Rabi'i] bahwa ia menceritakan bahwasanya; Suatu ketika iringan jenazah lewat di hadapan Rasulullah shallallahu 'alaihi wasallam, maka beliau bersabda: ""MUTARIIH dan MUSTARAAH."" Para sahabat bertanya, ""Wahai Rasulullah, apakah itu MUSTARIIH dan MUSTARAAH?"" beliau menjawab, ""Seorang hamba yang mukmin YASTARIH (akan beristirahat) dari memakmurkan dunia, sementara seorang hamba yang fajir, justru seluruh hamba, negeri, pepohonan dan binatang melata akan YASTARIH (beristirahat) dari (kezhalimannya) "" Dan Telah menceritakan kepada kami [Muhammad bin Al Mutsanna] Telah menceritakan kepada kami [Yahya bin Sa'id] -dalam jalur lain- Dan telah menceritakan kepada kami [Ishaq bin Ibrahim] telah mengabarkan kepada kami [Abdurrazaq] semuanya dari [Abdullah bin Sa'id bin Abu Hind] dari [Muhammad bin Amru] dari [Ibnu Ka'ab bin Malik] dari [Abu Qatadah] dari Nabi shallallahu 'alaihi wasallam. Dan di dalam hadits Yahya bin Sa'id: ""(Seorang hamba mukmin) akan beristirahat dari kesulitan dan kepenatan dunia menuju rahmat Allah.""","و حَدَّثَنَا قُتَيْبَةُ بْنُ سَعِيدٍ عَنْ مَالِكِ بْنِ أَنَسٍ فِيمَا قُرِئَ عَلَيْهِ عَنْ مُحَمَّدِ بْنِ عَمْرِو بْنِ حَلْحَلَةَ عَنْ مَعْبَدِ بْنِ كَعْبِ بْنِ مَالِكٍ عَنْ أَبِي قَتَادَةَ بْنِ رِبْعِيٍّ أَنَّهُ كَانَ يُحَدِّثُ
أَنَّ رَسُولَ اللَّهِ صَلَّى اللَّهُ عَلَيْهِ وَسَلَّمَ مُرَّ عَلَيْهِ بِجَنَازَةٍ فَقَالَ مُسْتَرِيحٌ وَمُسْتَرَاحٌ مِنْهُ قَالُوا يَا رَسُولَ اللَّهِ مَا الْمُسْتَرِيحُ وَالْمُسْتَرَاحُ مِنْهُ فَقَالَ الْعَبْدُ الْمُؤْمِنُ يَسْتَرِيحُ مِنْ نَصَبِ الدُّنْيَا وَالْعَبْدُ الْفَاجِرُ يَسْتَرِيحُ مِنْهُ الْعِبَادُ وَالْبِلَادُ وَالشَّجَرُ وَالدَّوَابُّ
و حَدَّثَنَا مُحَمَّدُ بْنُ الْمُثَنَّى حَدَّثَنَا يَحْيَى بْنُ سَعِيدٍ ح و حَدَّثَنَا إِسْحَقُ بْنُ إِبْرَاهِيمَ أَخْبَرَنَا عَبْدُ الرَّزَّاقِ جَمِيعًا عَنْ عَبْدِ اللَّهِ بْنِ سَعِيدِ بْنِ أَبِي هِنْدٍ عَنْ مُحَمَّدِ بْنِ عَمْرٍو عَنْ ابْنٍ لِكَعْبِ بْنِ مَالِكٍ عَنْ أَبِي قَتَادَةَ عَنْ النَّبِيِّ صَلَّى اللَّهُ عَلَيْهِ وَسَلَّمَ وَفِي حَدِيثِ يَحْيَى بْنِ سَعِيدٍ يَسْتَرِيحُ مِنْ أَذَى الدُّنْيَا وَنَصَبِهَا إِلَى رَحْمَةِ اللَّهِ",11
1586,12,"Telah menceritakan kepada kami [Hasan bin Rabi'] dan [Muhammad bin Abdullah bin Numair] keduanya berkata, telah menceritakan kepada kami [Abdullah bin Idris] dari [Asy Syaiban] dari [Asy Sya'bi] bahwa Rasulullah shallallahu 'alaihi wasallam pernah menshalatkan jenazah di atas kuburan setelah dikebumikannya mayit. Beliau bertakbir atasnya empat kali. [Asy Syaibani] berkata; Saya bertanya kepada [Asy Sya'bi], ""Siapa yang menceritakanmu hadits ini?"" ia menjawab, ""Yaitu seorang yang tsiqqah (terpercaya), [Abdullah bin Abbas]. Dan ini adalah lafazh haditsnya Hasan."" Dan dalam riwayat Ibnu Numair ia berkata; Rasulullah shallallahu 'alaihi wasallam sampai pada kuburan yang masih lembab, maka beliau pun menshalatinya, kemudian para sahabat berbaris di belakangnya. Lalu beliau bertakbir empat kali. Saya bertanya kepada [Amir], ""Siapa yang menceritakan hadits ini kepadamu?"" ia menjawab, ""Dari seorang yang terpercaya yaitu [Ibnu Abbas]."" Dan Telah menceritakan kepada kami [Yahya bin Yahya] telah mengabarkan kepada kami [Husyaim] -dalam jalur lain- Dan telah menceritakan kepada kami [Hasan bin Rabi'] dan [Abu Kamil] keduanya berkata, telah menceritakan kepada kami [Abdul Wahid bin Ziyad] -dalam jalur lain- Telah menceritakan kepada kami [Abdul Wahid bin Ziyad] -dalam jalur lain- Dan telah menceritakan kepada kami [Ishaq bin Ibrahim] telah mengabarkan kepada kami [Jarir] -dalam jalur lain- Dan telah menceritakan kepadaku [Muhammad bin Hatim] telah menceritakan kepada kami [Waki'] telah menceritakan kepada kami [Sufyan] -dalam jalur lain- Dan telah menceritakan kepada kami [Ubaidullah bin Mu'adz] telah menceritakan kepada kami [bapakku] -dalam jalur lain- Dan telah menceritakan kepada kami [Muhammad bin Al Mutsanna] Telah menceritakan kepada kami [Muhammad bin Ja'far] ia berkata, telah menceritakan kepada kami [Syu'bah] semuanya dari [Asy Syaibani] dari [Asy Sya'bi] dari [Ibnu Abbas] dari Nabi shallallahu 'alaihi wasallam dengan hadits semisalnya. Dan di antara hadits mereka itu, tidak ada satu pun yang menyatakan; Bahwa Nabi shallallahu 'alaihi wasallam bertakbir atasnya empat kali. Dan Telah menceritakan kepada kami [Ishaq bin Ibrahim] dan [Harun bin Abdullah] semuanya dari [Wahb bin Jarir] dari [Syu'bah] dari [Isma'il bin Abu Khalid] -dalam jalur lain- Dan telah menceritakan kepadaku [Abu Ghassan Muhammad bin Amr Ar Razi] telah menceritakan kepada kami [Yahya bin Adl Dlurais] telah menceritakan kepada kami [Ibrahim bin Thahman] dari [Abu Hashin] keduanya dari [Asy Sya'bi] dari [Ibnu Abbas] dari Nabi shallallahu 'alaihi wasallam, mengenai shalat (jenazah) di kuburan, sebagaimana hadits Asy Syaibani, namun di dalam hadits mereka tidak tercantum; ""Beliau bertakbir sebanyak empat kali.""","حَدَّثَنَا حَسَنُ بْنُ الرَّبِيعِ وَمُحَمَّدُ بْنُ عَبْدِ اللَّهِ بْنِ نُمَيْرٍ قَالَا حَدَّثَنَا عَبْدُ اللَّهِ بْنُ إِدْرِيسَ عَنْ الشَّيْبَانِيِّ عَنْ الشَّعْبِيِّ
أَنَّ رَسُولَ اللَّهِ صَلَّى اللَّهُ عَلَيْهِ وَسَلَّمَ صَلَّى عَلَى قَبْرٍ بَعْدَ مَا دُفِنَ فَكَبَّرَ عَلَيْهِ أَرْبَعًا
قَالَ الشَّيْبَانِيُّ فَقُلْتُ لِلشَّعْبِيِّ مَنْ حَدَّثَكَ بِهَذَا قَالَ الثِّقَةُ عَبْدُ اللَّهِ بْنُ عَبَّاسٍ هَذَا لَفْظُ حَدِيثِ حَسَنٍ وَفِي رِوَايَةِ ابْنِ نُمَيْرٍ قَالَ انْتَهَى رَسُولُ اللَّهِ صَلَّى اللَّهُ عَلَيْهِ وَسَلَّمَ إِلَى قَبْرٍ رَطْبٍ فَصَلَّى عَلَيْهِ وَصَفُّوا خَلْفَهُ وَكَبَّرَ أَرْبَعًا قُلْتُ لِعَامِرٍ مَنْ حَدَّثَكَ قَالَ الثِّقَةُ مَنْ شَهِدَهُ ابْنُ عَبَّاسٍ و حَدَّثَنَا يَحْيَى بْنُ يَحْيَى أَخْبَرَنَا هُشَيْمٌ ح و حَدَّثَنَا حَسَنُ بْنُ الرَّبِيعِ وَأَبُو كَامِلٍ قَالَا حَدَّثَنَا عَبْدُ الْوَاحِدِ بْنُ زِيَادٍ ح و حَدَّثَنَا إِسْحَقُ بْنُ إِبْرَاهِيمَ أَخْبَرَنَا جَرِيرٌ ح و حَدَّثَنِي مُحَمَّدُ بْنُ حَاتِمٍ حَدَّثَنَا وَكِيعٌ حَدَّثَنَا سُفْيَانُ ح و حَدَّثَنَا عُبَيْدُ اللَّهِ بْنُ مُعَاذٍ حَدَّثَنَا أَبِي ح و حَدَّثَنَا مُحَمَّدُ بْنُ الْمُثَنَّى حَدَّثَنَا مُحَمَّدُ بْنُ جَعْفَرٍ قَالَ حَدَّثَنَا شُعْبَةُ كُلُّ هَؤُلَاءِ عَنْ الشَّيْبَانِيِّ عَنْ الشَّعْبِيِّ عَنْ ابْنِ عَبَّاسٍ عَنْ النَّبِيِّ صَلَّى اللَّهُ عَلَيْهِ وَسَلَّمَ بِمِثْلِهِ وَلَيْسَ فِي حَدِيثِ أَحَدٍ مِنْهُمْ أَنَّ النَّبِيَّ صَلَّى اللَّهُ عَلَيْهِ وَسَلَّمَ كَبَّرَ عَلَيْهِ أَرْبَعًا و حَدَّثَنَا إِسْحَقُ بْنُ إِبْرَاهِيمَ وَهَارُونُ بْنُ عَبْدِ اللَّهِ جَمِيعًا عَنْ وَهْبِ بْنِ جَرِيرٍ عَنْ شُعْبَةَ عَنْ إِسْمَعِيلَ بْنِ أَبِي خَالِدٍ ح و حَدَّثَنِي أَبُو غَسَّانَ مُحَمَّدُ بْنُ عَمْرٍو الرَّازِيُّ حَدَّثَنَا يَحْيَى بْنُ الضُّرَيْسِ حَدَّثَنَا إِبْرَاهِيمُ بْنُ طَهْمَانَ عَنْ أَبِي حَصِينٍ كِلَاهُمَا عَنْ الشَّعْبِيِّ عَنْ ابْنِ عَبَّاسٍ عَنْ النَّبِيِّ صَلَّى اللَّهُ عَلَيْهِ وَسَلَّمَ فِي صَلَاتِهِ عَلَى الْقَبْرِ نَحْوَ حَدِيثِ الشَّيْبَانِيِّ لَيْسَ فِي حَدِيثِهِمْ وَكَبَّرَ أَرْبَعًا",11
1587,12,Dan telah menceritakan kepadaku [Ibrahim bin Muhammad bin 'Ar'arah As Sami] telah menceritakan kepada kami [Ghundar] telah menceritakan kepada kami [Syu'bah] dari [Habib bin Asy Syahid] dari [Tsabit] dari [Anas] bahwa Nabi shallallahu 'alaihi wasallam pernah shalat jenazah di atas kuburan.,"و حَدَّثَنِي إِبْرَاهِيمُ بْنُ مُحَمَّدِ بْنِ عَرْعَرَةَ السَّامِيُّ حَدَّثَنَا غُنْدَرٌ حَدَّثَنَا شُعْبَةُ عَنْ حَبِيبِ بْنِ الشَّهِيدِ عَنْ ثَابِتٍ عَنْ أَنَسٍ
أَنَّ النَّبِيَّ صَلَّى اللَّهُ عَلَيْهِ وَسَلَّمَ صَلَّى عَلَى قَبْرٍ",11
