haditsId,kitabId,indo,arab,label
4250,44,"Telah menceritakan kepada kami [Abu Bakr bin Abu Syaibah] dan [Abu Kuraib] serta [Ibnu Numair] mereka berkata; Telah menceritakan kepada kami [Abu Mu'awiyah] dari [Al A'masy] dari [Syaqiq] dari ['Abdullah] berkata; berkata Rasulullah shallallahu 'alaihi wasallam bersabda: ""Aku mendahului kalian ke telaga. Dan sungguh aku akan melawan suatu kaum, kemudian aku mengalahkan mereka. Lalu aku akan berkata; 'Ya Rabbku para pengikutku, para pengikutku. Lalu di katakan kepada beliau; 'Sesungguhnya kamu tidak tahu apa yang mereka lakukan setelah kamu tiada."" Dan telah menceritakannya kepada kami [Utsman bin Abu Syaibah] dan [Ishaq bin Ibrahim] dari [Jarir] dari [Al A'masy] melalui jalur ini. Namun dia tidak menyebutkan 'Para pengikutku, para pengikutku.' Telah menceritakan kepada kami [Utsman bin Abu Syaibah] dan [Ishaq bin Ibrahim] keduanya dari [Jarir] Demikian juga diriwayatkan dari jalur lainnya, Dan telah menceritakan kepada kami [Ibnu Al Mutsanna] Telah menceritakan kepada kami [Muhammad bin Ja'far] Telah menceritakan kepada kami [Syu'bah] seluruhnya dari [Mughirah] dari [Abu Wa'il] dari [Abdullah] dari Nabi shallallahu 'alaihi wasallam yang serupa dengan Hadits Al A'masy. Dan di dalam Hadits [Syu'bah] dan [Mughirah] di sebutkan; 'Aku mendengar [Abu Wa'il]. Dan telah menceritakannya kepada kami [Sa'id bin Amru Al Asy'atsi] Telah mengabarkan kepada kami ['Abtsar] Demikian juga diriwayatkan dari jalur lainnya, Dan telah menceritakan kepada kami [Abu Bakr bin Abu Syaibah] Telah menceritakan kepada kami [Ibnu Fudhail] keduanya dari [Hushain] dari [Abu Wa'il] dari [Hudzaifah] dari Nabi shallallahu 'alaihi wasallam shallallahu 'alaihi wasallam yang serupa dengan Hadits Al A'masy dan Mughirah.","حَدَّثَنَا أَبُو بَكْرِ بْنُ أَبِي شَيْبَةَ وَأَبُو كُرَيْبٍ وَابْنُ نُمَيْرٍ قَالُوا حَدَّثَنَا أَبُو مُعَاوِيَةَ عَنْ الْأَعْمَشِ عَنْ شَقِيقٍ عَنْ عَبْدِ اللَّهِ قَالَ
قَالَ رَسُولُ اللَّهِ صَلَّى اللَّهُ عَلَيْهِ وَسَلَّمَ أَنَا فَرَطُكُمْ عَلَى الْحَوْضِ وَلَأُنَازِعَنَّ أَقْوَامًا ثُمَّ لَأُغْلَبَنَّ عَلَيْهِمْ فَأَقُولُ يَا رَبِّ أَصْحَابِي أَصْحَابِي فَيُقَالُ إِنَّكَ لَا تَدْرِي مَا أَحْدَثُوا بَعْدَكَ
و حَدَّثَنَاه عُثْمَانُ بْنُ أَبِي شَيْبَةَ وَإِسْحَقُ بْنُ إِبْرَاهِيمَ عَنْ جَرِيرٍ عَنْ الْأَعْمَشِ بِهَذَا الْإِسْنَادِ وَلَمْ يَذْكُرْ أَصْحَابِي أَصْحَابِي حَدَّثَنَا عُثْمَانُ بْنُ أَبِي شَيْبَةَ وَإِسْحَقُ بْنُ إِبْرَاهِيمَ كِلَاهُمَا عَنْ جَرِيرٍ ح و حَدَّثَنَا ابْنُ الْمُثَنَّى حَدَّثَنَا مُحَمَّدُ بْنُ جَعْفَرٍ حَدَّثَنَا شُعْبَةُ جَمِيعًا عَنْ مُغِيرَةَ عَنْ أَبِي وَائِلٍ عَنْ عَبْدِ اللَّهِ عَنْ النَّبِيِّ صَلَّى اللَّهُ عَلَيْهِ وَسَلَّمَ بِنَحْوِ حَدِيثِ الْأَعْمَشِ وَفِي حَدِيثِ شُعْبَةَ عَنْ مُغِيرَةَ سَمِعْتُ أَبَا وَائِلٍ و حَدَّثَنَاه سَعِيدُ بْنُ عَمْرٍو الْأَشْعَثِيُّ أَخْبَرَنَا عَبْثَرٌ ح و حَدَّثَنَا أَبُو بَكْرِ بْنُ أَبِي شَيْبَةَ حَدَّثَنَا ابْنُ فُضَيْلٍ كِلَاهُمَا عَنْ حُصَيْنٍ عَنْ أَبِي وَائِلٍ عَنْ حُذَيْفَةَ عَنْ النَّبِيِّ صَلَّى اللَّهُ عَلَيْهِ وَسَلَّمَ نَحْوَ حَدِيثِ الْأَعْمَشِ وَمُغِيرَةَ",2
4274,44,"Telah menceritakan kepada kami [Abu Bakr bin Abu Syaibah] dan [Amru An Naqid] keduanya berkata; Telah menceritakan kepada kami [Sufyan bin Uyainah] dari [Al Munkadir] dia mendengar [Jabir bin 'Abdullah radliallahu 'anhu] berkata; ""Apabila Rasulullah shallallahu 'alaihi wasallam dimintai sesuatu, beliau tidak pernah menjawab: 'Tidak'."" Dan telah menceritakan kepada kami [Abu Kuraib] Telah menceritakan kepada kami [Al Asyja'i] Demikian juga diriwayatkan dari jalur lainnya, Dan telah menceritakan kepadaku [Muhammad bin Al Mutsanna] Telah menceritakan kepada kami [Abdurrahman] yaitu Ibnu Mahdi keduanya dari [Sufyan] dari [Muhammad bin Al Munkadir] dia berkata; Aku mendengar [Jabir bin Abdullah] berkata; -dengan Hadits yang serupa.-","حَدَّثَنَا أَبُو بَكْرِ بْنُ أَبِي شَيْبَةَ وَعَمْرٌو النَّاقِدُ قَالَا حَدَّثَنَا سُفْيَانُ بْنُ عُيَيْنَةَ عَنْ ابْنِ الْمُنْكَدِرِ سَمِعَ جَابِرَ بْنَ عَبْدِ اللَّهِ قَالَ
مَا سُئِلَ رَسُولُ اللَّهِ صَلَّى اللَّهُ عَلَيْهِ وَسَلَّمَ شَيْئًا قَطُّ فَقَالَ لَا
و حَدَّثَنَا أَبُو كُرَيْبٍ حَدَّثَنَا الْأَشْجَعِيُّ ح و حَدَّثَنِي مُحَمَّدُ بْنُ الْمُثَنَّى حَدَّثَنَا عَبْدُ الرَّحْمَنِ يَعْنِي ابْنَ مَهْدِيٍّ كِلَاهُمَا عَنْ سُفْيَانَ عَنْ مُحَمَّدِ بْنِ الْمُنْكَدِرِ قَالَ سَمِعْتُ جَابِرَ بْنَ عَبْدِ اللَّهِ يَقُولُا مِثْلَهُ سَوَاءً",2
4358,44,"Telah menceritakan kepada kami [Abu Bakr bin Abu Syaibah] dan ['Amru An Naqid] seluruhnya dari [Al Aswad bin 'Amir]; [Abu Bakr] berkata; Telah menceritakan kepada kami [Aswad bin 'Amir]; Telah menceritakan kepada kami [Hammad bin Salamah] dari [Hisyam bin 'Urwah] dari [Bapaknya] dari ['Aisyah] dan dari [Tsabit] dari [Anas] bahwa Nabi shallallahu 'alaihi wasallam pernah melewati suatu kaum yang sedang mengawinkan pohon kurma lalu beliau bersabda: ""Sekiranya mereka tidak melakukannya, kurma itu akan (tetap) baik."" Tapi setelah itu, ternyata kurma tersebut tumbuh dalam keadaan rusak. Hingga suatu saat Nabi shallallahu 'alaihi wasallam melewati mereka lagi dan melihat hal itu beliau bertanya: 'Ada apa dengan pohon kurma kalian? Mereka menjawab; Bukankah anda telah mengatakan hal ini dan hal itu? Beliau lalu bersabda: 'Kalian lebih mengetahui urusan dunia kalian.'","حَدَّثَنَا أَبُو بَكْرِ بْنُ أَبِي شَيْبَةَ وَعَمْرٌو النَّاقِدُ كِلَاهُمَا عَنْ الْأَسْوَدِ بْنِ عَامِرٍ قَالَ أَبُو بَكْرٍ حَدَّثَنَا أَسْوَدُ بْنُ عَامِرٍ حَدَّثَنَا حَمَّادُ بْنُ سَلَمَةَ عَنْ هِشَامِ بْنِ عُرْوَةَ عَنْ أَبِيهِ عَنْ عَائِشَةَ وَعَنْ ثَابِتٍ عَنْ أَنَسٍ
أَنَّ النَّبِيَّ صَلَّى اللَّهُ عَلَيْهِ وَسَلَّمَ مَرَّ بِقَوْمٍ يُلَقِّحُونَ فَقَالَ لَوْ لَمْ تَفْعَلُوا لَصَلُحَ قَالَ فَخَرَجَ شِيصًا فَمَرَّ بِهِمْ فَقَالَ مَا لِنَخْلِكُمْ قَالُوا قُلْتَ كَذَا وَكَذَا قَالَ أَنْتُمْ أَعْلَمُ بِأَمْرِ دُنْيَاكُمْ",2
4377,44,"Telah menceritakan kepadaku [Zuhair bin Harb] dan [Abu Bakr bin An Nadhr] keduanya berkata; Telah menceritakan kepada kami [Ya'qub bin Ibrahim]; Telah menceritakan kepada kami [Bapakku] dari [Ibnu Syihab] dari [Abu Salamah bin 'Abdur Rahman] dan ['Abdur Rahman Al A'raj] dari [Abu Hurairah] dia berkata; dua orang laki-laki saling mencela, satu orang dari muslim dan satu orang lagi dari yahudi. Laki-laki muslim berkata; ""Dan demi Dzat yang telah memilih Muhammad di atas penduduk alam."" Dan laki-laki dari yahudi berkata; ""dan demi Dzat yang telah memilih Musa di atas penduduk alam."" Maka marahlah laki-laki muslim tersebut seraya memukul wajahnya, lalu laki-laki yahudi tersebut mendatangi Rasulullah Shallallahu 'alaihi wa Salam dan mengabarkan dengan apa yang telah terjadi di antara keduanya, Kemudian Rasulullah Shallallahu 'alaihi wa Salam bersabda: ""Janganlah engkau mengutamakan aku atas Musa, sesungguhnya pada hari kiamat kelak manusia akan pingsan dan akulah orang yang pertama kali tersadar, tetapi aku dapati Musa tengah berdiri di dekat `Arsy, hingga aku tidak tahu apakah ia termasuk orang yang pingsan kemudian ia tersadar sebelum aku, atau memang ia termasuk yang Allah Azza Wa Jalla kecualikan untuk tidak pingsan."" Dan telah menceritakan kepada kami ['Abdullah bin 'Abdur Rahman Ad Darimi] dan [Abu Bakr bin Ishaq] keduanya berkata; Telah mengabarkan kepada kami [Abu Al Yaman]; Telah mengabarkan kepada kami [Syu'aib] dari [Az Zuhri]; Telah mengabarkan kepadaku [Abu Salamah bin 'Abdur Rahman] dan [Sa'id bin Al Musayyab] dari [Abu Hurairah] dia berkata; dua orang laki-laki saling mencela, satu orang dari muslim dan satu orang lagi dari yahudi. -sebagaimana Hadits Ibrahim bin Sa'ad dari Ibnu Syihab Dan telah menceritakan kepadaku [Amru An Naqid] Telah menceritakan kepada kami [Abu Ahmad Az Zubaidi] Telah menceritakan kepada kami [Sufyan] dari [Amru bin Yahya] dari [Bapaknya] dari [Abu Sa'id Al Khudri] dia berkata; seorang Yahudi yang telah dipukul wajahnya datang kepada Nabi shallallahu 'alaihi wasallam -dan seterusnya yang semakna dengan Hadits Az Zuhri, hanya saja dia berkata dengan kalimat; 'hingga aku tidak tahu apakah ia termasuk orang yang pingsan kemudian ia tersadar sebelum aku, atau memang ia sudah cukup dengan pingsannya ketika di bukit Thur hingga tidak pingsan lagi.'","حَدَّثَنِي زُهَيْرُ بْنُ حَرْبٍ وَأَبُو بَكْرِ بْنُ النَّضْرِ قَالَا حَدَّثَنَا يَعْقُوبُ بْنُ إِبْرَاهِيمَ حَدَّثَنَا أَبِي عَنْ ابْنِ شِهَابٍ عَنْ أَبِي سَلَمَةَ بْنِ عَبْدِ الرَّحْمَنِ وَعَبْدِ الرَّحْمَنِ الْأَعْرَجِ عَنْ أَبِي هُرَيْرَةَ قَالَ
اسْتَبَّ رَجُلَانِ رَجُلٌ مِنْ الْيَهُودِ وَرَجُلٌ مِنْ الْمُسْلِمِينَ فَقَالَ الْمُسْلِمُ وَالَّذِي اصْطَفَى مُحَمَّدًا صَلَّى اللَّهُ عَلَيْهِ وَسَلَّمَ عَلَى الْعَالَمِينَ وَقَالَ الْيَهُودِيُّ وَالَّذِي اصْطَفَى مُوسَى عَلَيْهِ السَّلَام عَلَى الْعَالَمِينَ قَالَ فَرَفَعَ الْمُسْلِمُ يَدَهُ عِنْدَ ذَلِكَ فَلَطَمَ وَجْهَ الْيَهُودِيِّ فَذَهَبَ الْيَهُودِيُّ إِلَى رَسُولِ اللَّهِ صَلَّى اللَّهُ عَلَيْهِ وَسَلَّمَ فَأَخْبَرَهُ بِمَا كَانَ مِنْ أَمْرِهِ وَأَمْرِ الْمُسْلِمِ فَقَالَ رَسُولُ اللَّهِ صَلَّى اللَّهُ عَلَيْهِ وَسَلَّمَ لَا تُخَيِّرُونِي عَلَى مُوسَى فَإِنَّ النَّاسَ يَصْعَقُونَ فَأَكُونُ أَوَّلَ مَنْ يُفِيقُ فَإِذَا مُوسَى بَاطِشٌ بِجَانِبِ الْعَرْشِ فَلَا أَدْرِي أَكَانَ فِيمَنْ صَعِقَ فَأَفَاقَ قَبْلِي أَمْ كَانَ مِمَّنْ اسْتَثْنَى اللَّهُ
و حَدَّثَنَا عَبْدُ اللَّهِ بْنُ عَبْدِ الرَّحْمَنِ الدَّارِمِيُّ وَأَبُو بَكْرِ بْنُ إِسْحَقَ قَالَا أَخْبَرَنَا أَبُو الْيَمَانِ أَخْبَرَنَا شُعَيْبٌ عَنْ الزُّهْرِيِّ أَخْبَرَنِي أَبُو سَلَمَةَ بْنُ عَبْدِ الرَّحْمَنِ وَسَعِيدُ بْنُ الْمُسَيَّبِ عَنْ أَبِي هُرَيْرَةَ قَالَ اسْتَبَّ رَجُلٌ مِنْ الْمُسْلِمِينَ وَرَجُلٌ مِنْ الْيَهُودِ بِمِثْلِ حَدِيثِ إِبْرَاهِيمَ بْنِ سَعْدٍ عَنْ ابْنِ شِهَابٍ و حَدَّثَنِي عَمْرٌو النَّاقِدُ حَدَّثَنَا أَبُو أَحْمَدَ الزُّبَيْرِيُّ حَدَّثَنَا سُفْيَانُ عَنْ عَمْرِو بْنِ يَحْيَى عَنْ أَبِيهِ عَنْ أَبِي سَعِيدٍ الْخُدْرِيِّ قَالَ جَاءَ يَهُودِيٌّ إِلَى النَّبِيِّ صَلَّى اللَّهُ عَلَيْهِ وَسَلَّمَ قَدْ لُطِمَ وَجْهُهُ وَسَاقَ الْحَدِيثَ بِمَعْنَى حَدِيثِ الزُّهْرِيِّ غَيْرَ أَنَّهُ قَالَ فَلَا أَدْرِي أَكَانَ مِمَّنْ صَعِقَ فَأَفَاقَ قَبْلِي أَوْ اكْتَفَى بِصَعْقَةِ الطُّورِ",2
4564,45,"Telah menceritakan kepada kami [Muhammad bin Al Mutsanna] ban [Ibnu Basysyar] seluruhnya dari [Ghundar], [Ibnu Al Mutsanna] berkata; Telah menceritakan kepada kami [Muhammad bin Ja'far] Telah menceritakan kepada kami [Syu'bah] dari [Hisyam bin Zaid] Aku mendengar [Anas bin Malik] berkata; ""Ada seorang wanita Anshar datang kepada Rasulullah shallallahu 'alaihi wasallam. Anas berkata; Kemudian beliau pun menemuinya empat mata. Rasulullah shallallahu 'alaihi wasallam bersabda: 'Demi Dzat yang jiwaku ditangan-Nya, sungguh kalian adalah orang-orang yang paling aku cintai."" Beliau ucapkan kalimat tersebut sebanyak tiga kali. Dan telah menceritakannya kepadaku [Yahya bin Habib]; Telah menceritakan kepada kami [Khalid bin Al Harits]; Demikian juga diriwayatkan dari jalur lainnya, Dan telah menceritakan kepada kami [Abu Bakr bin Abu Syaibah] dan [Abu Kuraib] keduanya berkata; Telah menceritakan kepada kami [Ibnu Idris] keduanya dari [Syu'bah] melalui jalur ini.","حَدَّثَنَا مُحَمَّدُ بْنُ الْمُثَنَّى وَابْنُ بَشَّارٍ جَمِيعًا عَنْ غُنْدَرٍ قَالَ ابْنُ الْمُثَنَّى حَدَّثَنَا مُحَمَّدُ بْنُ جَعْفَرٍ حَدَّثَنَا شُعْبَةُ عَنْ هِشَامِ بْنِ زَيْدٍ سَمِعْتُ أَنَسَ بْنَ مَالِكٍ يَقُولُا
جَاءَتْ امْرَأَةٌ مِنْ الْأَنْصَارِ إِلَى رَسُولِ اللَّهِ صَلَّى اللَّهُ عَلَيْهِ وَسَلَّمَ قَالَ فَخَلَا بِهَا رَسُولُ اللَّهِ صَلَّى اللَّهُ عَلَيْهِ وَسَلَّمَ وَقَالَ وَالَّذِي نَفْسِي بِيَدِهِ إِنَّكُمْ لَأَحَبُّ النَّاسِ إِلَيَّ ثَلَاثَ مَرَّاتٍ
و حَدَّثَنِيهِ يَحْيَى بْنُ حَبِيبٍ حَدَّثَنَا خَالِدُ بْنُ الْحَارِثِ ح و حَدَّثَنَا أَبُو بَكْرِ بْنُ أَبِي شَيْبَةَ وَأَبُو كُرَيْبٍ قَالَا حَدَّثَنَا ابْنُ إِدْرِيسَ كِلَاهُمَا عَنْ شُعْبَةَ بِهَذَا الْإِسْنَادِ",2
4605,45,"Telah menceritakan kepada kami [Muhammad bin Rafi'] dan ['Abad bin Humaid]. [Muhammad bin Rafi'] berkata; Telah menceritakan kepada kami. Sedangkan ['Abad] berkata; Telah mengabarkan kepada kami ['Abdur Razzaq]; Telah mengabarkan kepada kami [Ma'mar] dari [Az Zuhri]; Telah mengabarkan kepadaku [Salim bin 'Abdullah] dan [Abu Bakr bin Sulaiman] bahwa ['Abdullah bin 'Umar] berkata; ""Pada suatu malam, Rasulullah shallallahu 'alaihi wasallam mengimami kami shalat Isya di hari-hari terakhir kehidupannya. Setelah mengucapkan salam, beliau berdiri dan bersabda: 'Dapatkah kalian menghayati malam kalian ini, sesungguhnya pada penghujung seratus tahun yang akan datang tidak ada lagi seseorang yang masih hidup di muka bumi.' Ibnu Umar berkata; 'Para sahabat merasa takut terhadap sabda Rasulullah shallallahu 'alaihi wasallam tersebut, sehingga mereka memperbincangkan maksud kata-kata seratus tahun dalam hadits itu. Sebenarnya Rasulullah shallallahu 'alaihi wasallam hanya ingin mengatakan: 'Di awal abad yang akan datang, orang yang hidup pada masa sekarang ini tak satupun yang masih hidup.' Maksudnya masa para sahabat itu akan habis. Telah menceritakan kepadaku [Abdullah bin Abdurrahman Ad Daarimi] Telah mengabarkan kepada kami [Abul Yaman] Telah mengabarkan kepada kami [Syu'aib]. Dan [Laits] telah meriwayatkannya dari [Abdurrahman bin Khalid bin Musafir] keduanya dari [Az Zuhri] melalui sanad Ma'mar sebagaimana Haditsnya.","حَدَّثَنَا مُحَمَّدُ بْنُ رَافِعٍ وَعَبْدُ بْنُ حُمَيْدٍ قَالَ مُحَمَّدُ بْنُ رَافِعٍ حَدَّثَنَا و قَالَ عَبْدٌ أَخْبَرَنَا عَبْدُ الرَّزَّاقِ أَخْبَرَنَا مَعْمَرٌ عَنْ الزُّهْرِيِّ أَخْبَرَنِي سَالِمُ بْنُ عَبْدِ اللَّهِ وَأَبُو بَكْرِ بْنُ سُلَيْمَانَ أَنَّ عَبْدَ اللَّهِ بْنَ عُمَرَ قَالَ
صَلَّى بِنَا رَسُولُ اللَّهِ صَلَّى اللَّهُ عَلَيْهِ وَسَلَّمَ ذَاتَ لَيْلَةٍ صَلَاةَ الْعِشَاءِ فِي آخِرِ حَيَاتِهِ فَلَمَّا سَلَّمَ قَامَ فَقَالَ أَرَأَيْتَكُمْ لَيْلَتَكُمْ هَذِهِ فَإِنَّ عَلَى رَأْسِ مِائَةِ سَنَةٍ مِنْهَا لَا يَبْقَى مِمَّنْ هُوَ عَلَى ظَهْرِ الْأَرْضِ أَحَدٌ قَالَ ابْنُ عُمَرَ فَوَهَلَ النَّاسُ فِي مَقَالَةِ رَسُولِ اللَّهِ صَلَّى اللَّهُ عَلَيْهِ وَسَلَّمَ تِلْكَ فِيمَا يَتَحَدَّثُونَ مِنْ هَذِهِ الْأَحَادِيثِ عَنْ مِائَةِ سَنَةٍ وَإِنَّمَا قَالَ رَسُولُ اللَّهِ صَلَّى اللَّهُ عَلَيْهِ وَسَلَّمَ لَا يَبْقَى مِمَّنْ هُوَ الْيَوْمَ عَلَى ظَهْرِ الْأَرْضِ أَحَدٌ يُرِيدُ بِذَلِكَ أَنْ يَنْخَرِمَ ذَلِكَ الْقَرْنُ
حَدَّثَنِي عَبْدُ اللَّهِ بْنُ عَبْدِ الرَّحْمَنِ الدَّارِمِيُّ أَخْبَرَنَا أَبُو الْيَمَانِ أَخْبَرَنَا شُعَيْبٌ وَرَوَاهُ اللَّيْثُ عَنْ عَبْدِ الرَّحْمَنِ بْنِ خَالِدِ بْنِ مُسَافِرٍ كِلَاهُمَا عَنْ الزُّهْرِيِّ بِإِسْنَادِ مَعْمَرٍ كَمِثْلِ حَدِيثِهِ",2
4621,46,"Telah menceritakan kepada kami [Qutaibah bin Sa'id bin Jamil bin Tharif Ats Tsaqafi] dan [Zuhair bin Harb] keduanya berkata; Telah menceritakan kepada kami [Jarir] dari ['Umarah bin Al Qa'qa'] dari [Abu Zur'ah] dari [Abu Hurairah] berkata; ""Seorang laki-laki datang kepada Rasulullah shallallahu 'alaihi wasallam lalu dia bertanya, ""Siapakah orang yang paling berhak dengan kebaktianku?"" Jawab Rasulullah shallallahu 'alaihi wasallam, ""Ibumu!"" dia bertanya lagi; ""Kemudian siapa?"" beliau menjawab: ""Ibumu!"" dia bertanya lagi; ""Kemudian siapa?"" beliau menjawab: ""Kemudian Ibumu!"" dia bertanya lagi; ""Kemudian siapa?"" dijawab: ""Kemudian bapakmu!"" sedangkan di dalam Hadits Qutaibah disebutkan; 'Siapakah yang paling berhak dengan kebaktianku? -tanpa menyebutkan kalimat; 'An Nas.'","حَدَّثَنَا قُتَيْبَةُ بْنُ سَعِيدِ بْنِ جَمِيلِ بْنِ طَرِيفٍ الثَّقَفِيُّ وَزُهَيْرُ بْنُ حَرْبٍ قَالَا حَدَّثَنَا جَرِيرٌ عَنْ عُمَارَةَ بْنِ الْقَعْقَاعِ عَنْ أَبِي زُرْعَةَ عَنْ أَبِي هُرَيْرَةَ قَالَ
جَاءَ رَجُلٌ إِلَى رَسُولِ اللَّهِ صَلَّى اللَّهُ عَلَيْهِ وَسَلَّمَ فَقَالَ مَنْ أَحَقُّ النَّاسِ بِحُسْنِ صَحَابَتِي قَالَ أُمُّكَ قَالَ ثُمَّ مَنْ قَالَ ثُمَّ أُمُّكَ قَالَ ثُمَّ مَنْ قَالَ ثُمَّ أُمُّكَ قَالَ ثُمَّ مَنْ قَالَ ثُمَّ أَبُوكَ
وَفِي حَدِيثِ قُتَيْبَةَ مَنْ أَحَقُّ بِحُسْنِ صَحَابَتِي وَلَمْ يَذْكُرْ النَّاسَ",2
4623,46,"Telah menceritakan kepada kami [Abu Bakr bin Abu Syaibah] dan [Zuhair bin Harb] keduanya berkata; Telah menceritakan kepada kami [Waki'] dari [Sufyan] dari [Habib]; Demikian juga diriwayatkan dari jalur lainnya, Dan telah menceritakan kepada kami [Muhammad bin Al Mutsanna]; Telah menceritakan kepada kami [Yahya] yaitu Ibnu Sa'id Al Qaththan dari [Sufyan] dari [Syu'bah] keduanya berkata; Telah menceritakan kepada kami [Habib] dari [Abu Al 'Abbas] dari ['Abdullah bin 'Amru] dia berkata; ""Seseorang datang kepada Nabi shallallahu 'alaihi wasallam minta izin hendak ikut jihad (berperang). Lalu Nabi shallallahu 'alaihi wasallam bertanya kepadanya: ""Apakah kedua orang tuamu masih hidup?"" Jawab orang itu; ""Masih!"" Sabda beliau: ""Berbakti kepada keduanya adalah jihad."" Telah menceritakan kepada kami [Ubaidullah bin Mu'adz] Telah menceritakan kepada kami [Bapakku] Telah menceritakan kepada kami [Syu'bah] dari [Habib] Aku mendengar [Abul Abbas], aku mendengar [Abdullah bin Amru bin Al Ash] dia berkata; Seseorang datang kepada Nabi shallallahu 'alaihi wasallam -lalu Amru menyebutkan Hadits yang serupa.- Muslim berkata; Abul Abbas adalah As Saib bin Farukh Al Makki. Telah menceritakan kepada kami [Abu Kuraib] Telah mengabarkan kepada kami [Ibnu Basyir] dari [Mis'ar] Demikian juga diriwayatkan dari jalur lainnya, Dan telah menceritakan kepadaku [Muhammad bin Hatim] Telah menceritakan kepada kami [Mu'awiyyah bin Amru] dari [Abu Ishaq] Demikian juga diriwayatkan dari jalur lainnya, Dan telah menceritakan kepadaku [Al Qasim bin Zakaria] Telah menceritakan kepada kami [Husain bin Ali Al Ju'fi] dari [Zaidah] keduanya dari [Al A'masy] seluruhnya dari [Habib] melalui jalur ini dengan Hadits yang serupa.","حَدَّثَنَا أَبُو بَكْرِ بْنُ أَبِي شَيْبَةَ وَزُهَيْرُ بْنُ حَرْبٍ قَالَا حَدَّثَنَا وَكِيعٌ عَنْ سُفْيَانَ عَنْ حَبِيبٍ ح و حَدَّثَنَا مُحَمَّدُ بْنُ الْمُثَنَّى حَدَّثَنَا يَحْيَى يَعْنِي ابْنَ سَعِيدٍ الْقَطَّانَ عَنْ سُفْيَانَ وَشُعْبَةَ قَالَا حَدَّثَنَا حَبِيبٌ عَنْ أَبِي الْعَبَّاسِ عَنْ عَبْدِ اللَّهِ بْنِ عَمْرٍو قَالَ
جَاءَ رَجُلٌ إِلَى النَّبِيِّ صَلَّى اللَّهُ عَلَيْهِ وَسَلَّمَ يَسْتَأْذِنُهُ فِي الْجِهَادِ فَقَالَ أَحَيٌّ وَالِدَاكَ قَالَ نَعَمْ قَالَ فَفِيهِمَا فَجَاهِدْ
حَدَّثَنَا عُبَيْدُ اللَّهِ بْنُ مُعَاذٍ حَدَّثَنَا أَبِي حَدَّثَنَا شُعْبَةُ عَنْ حَبِيبٍ سَمِعْتُ أَبَا الْعَبَّاسِ سَمِعْتُ عَبْدَ اللَّهِ بْنَ عَمْرِو بْنِ الْعَاصِ يَقُولُا جَاءَ رَجُلٌ إِلَى النَّبِيِّ صَلَّى اللَّهُ عَلَيْهِ وَسَلَّمَ فَذَكَرَ بِمِثْلِهِ قَالَ مُسْلِم أَبُو الْعَبَّاسِ اسْمُهُ السَّائِبُ بْنُ فَرُّوخَ الْمَكِّيُّ حَدَّثَنَا أَبُو كُرَيْبٍ أَخْبَرَنَا ابْنُ بِشْرٍ عَنْ مِسْعَرٍ ح و حَدَّثَنِي مُحَمَّدُ بْنُ حَاتِمٍ حَدَّثَنَا مُعَاوِيَةُ بْنُ عَمْرٍو عَنْ أَبِي إِسْحَقَ ح و حَدَّثَنِي الْقَاسِمُ بْنُ زَكَرِيَّاءَ حَدَّثَنَا حُسَيْنُ بْنُ عَلِيٍّ الْجُعْفِيُّ عَنْ زَائِدَةَ كِلَاهُمَا عَنْ الْأَعْمَشِ جَمِيعًا عَنْ حَبِيبٍ بِهَذَا الْإِسْنَادِ مِثْلَهُ",2
