haditsId,kitabId,indo,arab,label
1782,13,"Dan Telah menceritakan kepada kami [Abu Kuraib] telah menceritakan kepada kami [Abu Usamah] dari [Za`idah] dari [Manshur] dari [Thalhah bin Musharrif] telah menceritakan kepada kami [Anas bin Malik] bahwa Rasulullah shallallahu 'alaihi wasallam menemukan satu biji kurma di jalan, maka beliau pun bersabda: ""Sekiranya kurma ini bukan dari harta sedekah, niscaya aku akan memakannya.""","و حَدَّثَنَا أَبُو كُرَيْبٍ حَدَّثَنَا أَبُو أُسَامَةَ عَنْ زَائِدَةَ عَنْ مَنْصُورٍ عَنْ طَلْحَةَ بْنِ مُصَرِّفٍ حَدَّثَنَا أَنَسُ بْنُ مَالِكٍ
أَنَّ رَسُولَ اللَّهِ صَلَّى اللَّهُ عَلَيْهِ وَسَلَّمَ مَرَّ بِتَمْرَةٍ بِالطَّرِيقِ فَقَالَ لَوْلَا أَنْ تَكُونَ مِنْ الصَّدَقَةِ لَأَكَلْتُهَا",27
3247,32,"Telah menceritakan kepada kami [Yahya bin Yahya At Tamimi] dia berkata; aku bacakan di hadapan [Malik]; dari [Rabi'ah bin Abu Abdurrahman] dari [Yazid] bekas budak Al Munba'is, dari [Zaid bin Khalid Al Juhani] bahwa dia berkata, ""Seseorang datang kepada Nabi shallallahu 'alaihi wasallam dan menanyakan mengenai barang temuan."" Lalu beliau bersabda: ""Kenalilah wadah dan talinya, setelah itu umumkanlah kepada khalayak ramai, apabila pemiliknya datang maka berikanlah barang tersebut kepadanya."" Kemudian orang itu juga bertanya, ""Wahai Rasulullah, bagaimana jika yang ditemukan adalah kambing?"" Rasulullah shallallahu 'alaihi wasallam menjawab: ""Mungkin ia dapat menjadi milikmu atau milik saudaramu atau bahkan menjadi milik serigala."" Dia berkata, ""Wahai Rasulullah, bagaimana jika yang ditemukan adalah unta?"" beliau menjawab: ""Apa urusanmu dengan unta yang hilang? Ia telah membawa sepatu (punya kaki) dan wadah airnya sendiri. Ia dapat mendatangi mata air dan makan dedaunan sampai ia bertemu pemiliknya."" Yahya berkata, ""Sepertinya aku membaca 'iffashaha (wadahnya).""","حَدَّثَنَا يَحْيَى بْنُ يَحْيَى التَّمِيمِيُّ قَالَ قَرَأْتُ عَلَى مَالِكٍ عَنْ رَبِيعَةَ بْنِ أَبِي عَبْدِ الرَّحْمَنِ عَنْ يَزِيدَ مَوْلَى الْمُنْبَعِثِ عَنْ زَيْدِ بْنِ خَالِدٍ الْجُهَنِيِّ أَنَّهُ قَالَ
جَاءَ رَجُلٌ إِلَى النَّبِيِّ صَلَّى اللَّهُ عَلَيْهِ وَسَلَّمَ فَسَأَلَهُ عَنْ اللُّقَطَةِ فَقَالَ اعْرِفْ عِفَاصَهَا وَوِكَاءَهَا ثُمَّ عَرِّفْهَا سَنَةً فَإِنْ جَاءَ صَاحِبُهَا وَإِلَّا فَشَأْنَكَ بِهَا قَالَ فَضَالَّةُ الْغَنَمِ قَالَ لَكَ أَوْ لِأَخِيكَ أَوْ لِلذِّئْبِ قَالَ فَضَالَّةُ الْإِبِلِ قَالَ مَا لَكَ وَلَهَا مَعَهَا سِقَاؤُهَا وَحِذَاؤُهَا تَرِدُ الْمَاءَ وَتَأْكُلُ الشَّجَرَ حَتَّى يَلْقَاهَا رَبُّهَا قَالَ يَحْيَى أَحْسِبُ قَرَأْتُ عِفَاصَهَا",27
3248,32,"Dan telah menceritakan kepada kami [Yahya bin Ayyub] dan [Qutaibah] dan [Ibin Hujr]. Ibnu Hujr berkata; telah mengabarkan kepada kami, sedangkan yang dua orang mengatakan; telah menceritakan kepada kami [Isma'il] -yaitu Ibnu Ja'far- dari [Rabi'ah bin Abu Abdurrahman] dari [Yazid] -bekas budak Al Munba'its- dari [Zaid bin Khalid Al Juhani] bahwa seorang laki-laki bertanya kepada Rasulullah shallallahu 'alaihi wasallam tentang barang temuan, lalu beliau bersabda: ""Umumkanlah selama setahun, lalu kenalilah wadah dan talinya setelah itu manfaatkanlah ia, jika pemiliknya datang maka berikanlah barang tersebut kepadanya."" Kemudian orang itu bertanya lagi, ""Wahai Rasulullah, bagaimana dengan kambing yang hilang?"" Beliau menjawab: ""Ambillah, mungkin ia dapat menjadi milikmu atau milik saudaramu atau bahkan menjadi milik serigala."" Dia bertanya lagi, ""Wahai Rasulullah, bagaimana jika yang ditemukan adalah unta?"" Zaid bin Khalid berkata, ""Maka Rasulullah shallallahu 'alaihi wasallam marah hingga wajahnya memerah, kemudian beliau bersabda: ""Apa urusanmu dengan unta yang hilang? Ia telah membawa sepatu (punya kaki) dan wadah airnya sendiri hingga ia bertemu pemiliknya."" Dan telah menceritakanku [Abu At Thahir] telah mengabarkan kepada kami [Abdullah bin Wahb] telah mengabarkan kepadaku [Sufyan Ats Tsauri] dan [Malik bin Anas] dan ['Amru bin Al Harits] dan yang lainnya, bahwa [Rabi'ah bin Abu Abdurrahman] telah menceritakan kepada mereka dengan isnad ini seperti hadits Malik, hanya saja ia menambahkan; Zaid berkata, ""Seorang laki-laki datang menemui Rasulullah shallallahu 'alaihi wasallam, sedangkakn saat itu aku bersama beliau, lantas dia bertanya mengenai barang temuan."" Perawi berkata; Amru menyebutkan dalam hadits, ""Jika pemiliknya belum datang untuk mengambilnya, maka kamu boleh memanfaatkannya."" Dan telah menceritakanku [Ahmad bin Utsman bin Hakim Al Audi] telah menceritakan kepadaku [Khlaid bin Makhlad] telah menceritakanku [Sulaiman] -yaitu Ibnu Bilal- dari [Rabi'ah bin Abu Abdurrahman] dari [Yazid] -bekas budak Al Munba'its- dia berkata; aku pernah mendengar [Zaid bin Khalid Al Juhani] berkata, ""Seorang laki-laki datang menemui Rasulullah shallallahu 'alaihi wasallam, lalu dia menyebutkan seperti hadits Isma'il bin Ja'far, namun dia menyebutkan, ""Lalu beliau marah sampai terlihat wajahnya memerah."" Dan setelah perkataanya, ""kemudian umumkanlah selama setahun, jika pemiliknya belum datang maka ia menjadi barang titipan untukmu.""","و حَدَّثَنَا يَحْيَى بْنُ أَيُّوبَ وَقُتَيْبَةُ وَابْنُ حُجْرٍ قَالَ ابْنُ حُجْرٍ أَخْبَرَنَا و قَالَ الْآخَرَانِ حَدَّثَنَا إِسْمَعِيلُ وَهُوَ ابْنُ جَعْفَرٍ عَنْ رَبِيعَةَ بْنِ أَبِي عَبْدِ الرَّحْمَنِ عَنْ يَزِيدَ مَوْلَى الْمُنْبَعِثِ عَنْ زَيْدِ بْنِ خَالِدٍ الْجُهَنِيِّ
أَنَّ رَجُلًا سَأَلَ رَسُولَ اللَّهِ صَلَّى اللَّهُ عَلَيْهِ وَسَلَّمَ عَنْ اللُّقَطَةِ فَقَالَ عَرِّفْهَا سَنَةً ثُمَّ اعْرِفْ وِكَاءَهَا وَعِفَاصَهَا ثُمَّ اسْتَنْفِقْ بِهَا فَإِنْ جَاءَ رَبُّهَا فَأَدِّهَا إِلَيْهِ فَقَالَ يَا رَسُولَ اللَّهِ فَضَالَّةُ الْغَنَمِ قَالَ خُذْهَا فَإِنَّمَا هِيَ لَكَ أَوْ لِأَخِيكَ أَوْ لِلذِّئْبِ قَالَ يَا رَسُولَ اللَّهِ فَضَالَّةُ الْإِبِلِ قَالَ فَغَضِبَ رَسُولُ اللَّهِ صَلَّى اللَّهُ عَلَيْهِ وَسَلَّمَ حَتَّى احْمَرَّتْ وَجْنَتَاهُ أَوْ احْمَرَّ وَجْهُهُ ثُمَّ قَالَ مَا لَكَ وَلَهَا مَعَهَا حِذَاؤُهَا وَسِقَاؤُهَا حَتَّى يَلْقَاهَا رَبُّهَا
و حَدَّثَنِي أَبُو الطَّاهِرِ أَخْبَرَنَا عَبْدُ اللَّهِ بْنُ وَهْبٍ أَخْبَرَنِي سُفْيَانُ الثَّوْرِيُّ وَمَالِكُ بْنُ أَنَسٍ وَعَمْرُو بْنُ الْحَارِثِ وَغَيْرُهُمْ أَنَّ رَبِيعَةَ بْنَ أَبِي عَبْدِ الرَّحْمَنِ حَدَّثَهُمْ بِهَذَا الْإِسْنَادِ مِثْلَ حَدِيثِ مَالِكٍ غَيْرَ أَنَّهُ زَادَ قَالَ أَتَى رَجُلٌ رَسُولَ اللَّهِ صَلَّى اللَّهُ عَلَيْهِ وَسَلَّمَ وَأَنَا مَعَهُ فَسَأَلَهُ عَنْ اللُّقَطَةِ قَالَ وَقَالَ عَمْرٌو فِي الْحَدِيثِ فَإِذَا لَمْ يَأْتِ لَهَا طَالِبٌ فَاسْتَنْفِقْهَا و حَدَّثَنِي أَحْمَدُ بْنُ عُثْمَانَ بْنِ حَكِيمٍ الْأَوْدِيُّ حَدَّثَنَا خَالِدُ بْنُ مَخْلَدٍ حَدَّثَنِي سُلَيْمَانُ وَهُوَ ابْنُ بِلَالٍ عَنْ رَبِيعَةَ بْنِ أَبِي عَبْدِ الرَّحْمَنِ عَنْ يَزِيدَ مَوْلَى الْمُنْبَعِثِ قَالَ سَمِعْتُ زَيْدَ بْنَ خَالِدٍ الْجُهَنِيَّ يَقُولُا أَتَى رَجُلٌ رَسُولَ اللَّهِ صَلَّى اللَّهُ عَلَيْهِ وَسَلَّمَ فَذَكَرَ نَحْوَ حَدِيثِ إِسْمَعِيلَ بْنِ جَعْفَرٍ غَيْرَ أَنَّهُ قَالَ فَاحْمَارَّ وَجْهُهُ وَجَبِينُهُ وَغَضِبَ وَزَادَ بَعْدَ قَوْلِهِ ثُمَّ عَرِّفْهَا سَنَةً فَإِنْ لَمْ يَجِئْ صَاحِبُهَا كَانَتْ وَدِيعَةً عِنْدَكَ",27
3249,32,"Telah menceritakan kepada kami [Abdullah bin Maslamah bin Qa'nab] telah menceritakan kepada kami [Sulaiman] -yaitu Ibnu Bilal- dari [Yahya bin Sa'id] dari [Yazid] -bekas budak Al Munba'its- bahwa dia mendengar [Zaid bin Khalid Al Juhani] salah seorang sahabat Rasulullah shallallahu 'alaihi wasallam berkata, ""Rasulullah shallallahu 'alaihi wasallam pernah ditanya mengenai barang temuan yang berisi emas atau perak."" Maka beliau bersabda: ""Kenalilah wadah dan talinya, kemudian umumkanlah selama setahun, apabila pemiliknya tidak datang untuk mengenalinya, maka -untuk sementara waktu- kamu boleh memanfaatkan, dan itu sebagai barang titipan untukmu. Seandainya di suatu hari pemiliknya datang mencari barang tersebut, maka berikanlah barang tersebut kepadanya."" Lalu dia bertanya menegani temuan unta, maka beliau balik bertanya kepada dia: ""Apa urusanmu dengan unta yang hilang? Biarkanlah unta itu pergi, karena ia membawa sepatu (punya kaki) dan wadah airnya sendiri. Ia dapat mendatangi mata air dan makan dedaunan sampai ia bertemu pemiliknya."" Orang itu bertanya lagi mengenai temuan kambing, beliau menjawab: ""Ambillah ia, mungkin ia dapat menjadi milikmu atau milik saudaramu atau bahkan menjadi milik serigala."" Dan telah menceritakan kepadaku [Ishaq bin Manshur] telah mengabarkan kepada kami [Habban bin Hilal] telah menceritakan kepada kami [Hamamd bin Salamah] telah menceritakan kepadaku [Yahya bin Sa'id] dan [Rabi'ah Ar Ra'iy bin Abu Abdurrahman] dari [Yazid] bekas budak Al Munba'its, dari [Zaid bin Khalid Al Juhani], bahwa ada seorang laki-laki yang bertanya kepada Nabi shallallahu 'alaihi wasallam mengenai unta temuan, Rabi'ah menambahkan, ""Lalu beliau marah hingga terlihat wajahnya memerah...lalu dia menceritakan hadits tersebut seperti hadits mereka. Dia juga menambahkan, ""Jika pemiliknya datang dan mengenali talinya, jumlah serta wadahnya maka berikanlah kepadanya, jika tidak maka itu menjadi milikmu.""","حَدَّثَنَا عَبْدُ اللَّهِ بْنُ مَسْلَمَةَ بْنِ قَعْنَبٍ حَدَّثَنَا سُلَيْمَانُ يَعْنِي ابْنَ بِلَالٍ عَنْ يَحْيَى بْنِ سَعِيدٍ عَنْ يَزِيدَ مَوْلَى الْمُنْبَعِثِ أَنَّهُ سَمِعَ زَيْدَ بْنَ خَالِدٍ الْجُهَنِيَّ صَاحِبَ رَسُولِ اللَّهِ صَلَّى اللَّهُ عَلَيْهِ وَسَلَّمَ يَقُولُا
سُئِلَ رَسُولُ اللَّهِ صَلَّى اللَّهُ عَلَيْهِ وَسَلَّمَ عَنْ اللُّقَطَةِ الذَّهَبِ أَوْ الْوَرِقِ فَقَالَ اعْرِفْ وِكَاءَهَا وَعِفَاصَهَا ثُمَّ عَرِّفْهَا سَنَةً فَإِنْ لَمْ تَعْرِفْ فَاسْتَنْفِقْهَا وَلْتَكُنْ وَدِيعَةً عِنْدَكَ فَإِنْ جَاءَ طَالِبُهَا يَوْمًا مِنْ الدَّهْرِ فَأَدِّهَا إِلَيْهِ وَسَأَلَهُ عَنْ ضَالَّةِ الْإِبِلِ فَقَالَ مَا لَكَ وَلَهَا دَعْهَا فَإِنَّ مَعَهَا حِذَاءَهَا وَسِقَاءَهَا تَرِدُ الْمَاءَ وَتَأْكُلُ الشَّجَرَ حَتَّى يَجِدَهَا رَبُّهَا وَسَأَلَهُ عَنْ الشَّاةِ فَقَالَ خُذْهَا فَإِنَّمَا هِيَ لَكَ أَوْ لِأَخِيكَ أَوْ لِلذِّئْبِ
و حَدَّثَنِي إِسْحَقُ بْنُ مَنْصُورٍ أَخْبَرَنَا حَبَّانُ بْنُ هِلَالٍ حَدَّثَنَا حَمَّادُ بْنُ سَلَمَةَ حَدَّثَنِي يَحْيَى بْنُ سَعِيدٍ وَرَبِيعَةُ الرَّأْيِ بْنُ أَبِي عَبْدِ الرَّحْمَنِ عَنْ يَزِيدَ مَوْلَى الْمُنْبَعِثِ عَنْ زَيْدِ بْنِ خَالِدٍ الْجُهَنِيِّ أَنَّ رَجُلًا سَأَلَ النَّبِيَّ صَلَّى اللَّهُ عَلَيْهِ وَسَلَّمَ عَنْ ضَالَّةِ الْإِبِلِ زَادَ رَبِيعَةُ فَغَضِبَ حَتَّى احْمَرَّتْ وَجْنَتَاهُ وَاقْتَصَّ الْحَدِيثَ بِنَحْوِ حَدِيثِهِمْ وَزَادَ فَإِنْ جَاءَ صَاحِبُهَا فَعَرَفَ عِفَاصَهَا وَعَدَدَهَا وَوِكَاءَهَا فَأَعْطِهَا إِيَّاهُ وَإِلَّا فَهِيَ لَكَ",27
3250,32,"Dan telah menceritakan kepadaku [Abu At Thahir Ahmad bin 'Amru bin Sarh] telah mengabarkan kepada kami [Abdullah bin Wahb] telah menceritakan kepadaku [Adl Dlahak bin Utsman] dari [Abu An Nadlr] dari [Busr bin Sa'id] dari [Zaid bin Khalid Al Juhani] dia berkata, ""Rasulullah shallallahu 'alaihi wasallam pernah ditanya mengenai barang temuan, maka beliau menjawab: ""Umumkanlah sampai setahun lamanya, jika ada orang yang mengenalinya, maka kenalilah tali dan wadahnya kemudian makanlah, jika pemiliknya datang maka kembalikanlah ia kepadanya."" Dan telah menceritakan kepadaku [Ishaq bin Manshur] telah mengabarkan kepada kami [Abu Bakar Al Hanafi] telah menceritakan kepada kami [Ad Dlahak bin Utsman] dengan isnad ini, dan dia menyebutkan dalam haditsnya, ""Jika pemiliknya mengenailnya, maka kembalikanlah ia kepadanya, jika tidak (dapat mengenalinya) maka kenalilah tali, wadah dan jumlahnya.""","و حَدَّثَنِي أَبُو الطَّاهِرِ أَحْمَدُ بْنُ عَمْرِو بْنِ سَرْحٍ أَخْبَرَنَا عَبْدُ اللَّهِ بْنُ وَهْبٍ حَدَّثَنِي الضَّحَّاكُ بْنُ عُثْمَانَ عَنْ أَبِي النَّضْرِ عَنْ بُسْرِ بْنِ سَعِيدٍ عَنْ زَيْدِ بْنِ خَالِدٍ الْجُهَنِيِّ قَالَ
سُئِلَ رَسُولُ اللَّهِ صَلَّى اللَّهُ عَلَيْهِ وَسَلَّمَ عَنْ اللُّقَطَةِ فَقَالَ عَرِّفْهَا سَنَةً فَإِنْ لَمْ تُعْتَرَفْ فَاعْرِفْ عِفَاصَهَا وَوِكَاءَهَا ثُمَّ كُلْهَا فَإِنْ جَاءَ صَاحِبُهَا فَأَدِّهَا إِلَيْهِ
و حَدَّثَنِيهِ إِسْحَقُ بْنُ مَنْصُورٍ أَخْبَرَنَا أَبُو بَكْرٍ الْحَنَفِيُّ حَدَّثَنَا الضَّحَّاكُ بْنُ عُثْمَانَ بِهَذَا الْإِسْنَادِ وَقَالَ فِي الْحَدِيثِ فَإِنْ اعْتُرِفَتْ فَأَدِّهَا وَإِلَّا فَاعْرِفْ عِفَاصَهَا وَوِكَاءَهَا وَعَدَدَهَا",27
3253,32,"Dan telah menceritakan kepadaku [Abu At Thahir] dan [Yunus bin Abdul A'la] keduanya berkata; telah menceritakan kepada kami [Abdullah bin Wahb] dia berkata; telah mengabarkan kepadaku ['Amru bin Harits] dari [Bakr bin Sawadah] dari [Abu Salim Al Jaisyani] dari [Zaid bin Khalid Al Juhani] dari Rasulullah shallallahu 'alaihi wasallam, bahwa beliau bersabda: ""Barangsiapa menyembunyikan barang temuan (emas atau perak), maka dia bersalah selama tidak mengumumkannya.""","و حَدَّثَنِي أَبُو الطَّاهِرِ وَيُونُسُ بْنُ عَبْدِ الْأَعْلَى قَالَا حَدَّثَنَا عَبْدُ اللَّهِ بْنُ وَهْبٍ قَالَ أَخْبَرَنِي عَمْرُو بْنُ الْحَارِثِ عَنْ بَكْرِ بْنِ سَوَادَةَ عَنْ أَبِي سَالِمٍ الْجَيْشَانِيِّ عَنْ زَيْدِ بْنِ خَالِدٍ الْجُهَنِيِّ
عَنْ رَسُولِ اللَّهِ صَلَّى اللَّهُ عَلَيْهِ وَسَلَّمَ أَنَّهُ قَالَ مَنْ آوَى ضَالَّةً فَهُوَ ضَالٌّ مَا لَمْ يُعَرِّفْهَا",27
5315,55,"Telah menceritakan kepada kami [Ishaq bin Ibrahim], [Muhammad bin Al Mutsanna Al Anazi] dan [Muhammad bin Abdullah Ar Razi] semuanya dari [Ats Tsaqafi], teks milik ibnu Al Mutsanna, telah menceritakan kepada kami [Abdulwahhab] telah menceritakan kepada kami [Khalid] dari [Muhammad bin Sirin] dari [Abu Hurairah] berkata: Rasulullah Shallallahu 'alaihi wa Salam bersabda: ""Sekelompok ummat dari Bani Israil hilang, tidak diketahui kondisinya dan tidak ada yang memperlihatkannya selain seekor tikus. Bukankah kalian melihatnya bila susu unta diletakkan untuknya, ia tidak meminumnya dan bila susu kambing diletakkan untuknya, ia meminumnya?"" Abu Hurairah berkata: Lalu aku ceritakan hadits ini kepada Ka'ab, ia bertanya: Kau mendengarnya dari Rasulullah Shallallahu 'alaihi wa Salam? Ia menanyakannya berkali-kali. Aku berkata: Apa aku membaca Taurat? Ishaq berkata dalam riwayatnya: ""Kami tidak mengetahui kondisinya.""","حَدَّثَنَا إِسْحَقُ بْنُ إِبْرَاهِيمَ وَمُحَمَّدُ بْنُ الْمُثَنَّى الْعَنَزِيُّ وَمُحَمَّدُ بْنُ عَبْدِ اللَّهِ الرُّزِّيُّ جَمِيعًا عَنْ الثَّقَفِيِّ وَاللَّفْظُ لِابْنِ الْمُثَنَّى حَدَّثَنَا عَبْدُ الْوَهَّابِ حَدَّثَنَا خَالِدٌ عَنْ مُحَمَّدِ بْنِ سِيرِينَ عَنْ أَبِي هُرَيْرَةَ قَالَ
قَالَ رَسُولُ اللَّهِ صَلَّى اللَّهُ عَلَيْهِ وَسَلَّمَ فُقِدَتْ أُمَّةٌ مِنْ بَنِي إِسْرَائِيلَ لَا يُدْرَى مَا فَعَلَتْ وَلَا أُرَاهَا إِلَّا الْفَأْرَ أَلَا تَرَوْنَهَا إِذَا وُضِعَ لَهَا أَلْبَانُ الْإِبِلِ لَمْ تَشْرَبْهُ وَإِذَا وُضِعَ لَهَا أَلْبَانُ الشَّاءِ شَرِبَتْهُ
قَالَ أَبُو هُرَيْرَةَ فَحَدَّثْتُ هَذَا الْحَدِيثَ كَعْبًا فَقَالَ آنْتَ سَمِعْتَهُ مِنْ رَسُولِ اللَّهِ صَلَّى اللَّهُ عَلَيْهِ وَسَلَّمَ قُلْتُ نَعَمْ قَالَ ذَلِكَ مِرَارًا قُلْتُ أَأَقْرَأُ التَّوْرَاةَ و قَالَ إِسْحَقُ فِي رِوَايَتِهِ لَا نَدْرِي مَا فَعَلَتْ",27
