haditsId,kitabId,indo,arab,label
548,4,"Telah menceritakan kepadaku [Ishaq bin Manshur] dan [Abu Bakar bin Ishaq] Abu Bakar berkata, telah menceritakan kepada kami, sedangkan Ibnu Manshur berkata, telah mengabarkan kepada kami [Amru bin ar-Rabi'] telah mengabarkan kepada kami [Yahya Bin Ayyub] dari [Yazid bin Abi Habib] bahwa [Abu al-Khair] telah menceritakan kepadannya, dia berkata, ""Aku melihat baju kulit [Ibnu Wa'lah as-Saba'i], lalu aku memegangnya. Maka dia bertanya, 'Mengapa kamu memegangnya? Aku telah bertanya kepada [Abdullah bin Abbas]. Aku berkata, 'Aku berada di Maroko, dan kami bersama kaum Barbar dan Majusi, ketika itu dibawakan domba yang telah mereka sembelih, sedangkan kami tidak memakan sembelihan mereka. Dan mereka telah mendatangi kami dengan membawa geriba yang mereka gunakan untuk menyimpan lemak."" Maka Ibnu Abbas berkata, ""Kami telah menanyakan Rasulullah shallallahu 'alaihi wasallam tentang hal tersebut, maka beliau menjawab, 'Menyamaknya adalah cara menyucikannya'.""","حَدَّثَنِي إِسْحَقُ بْنُ مَنْصُورٍ وَأَبُو بَكْرِ بْنُ إِسْحَقَ قَالَ أَبُو بَكْرٍ حَدَّثَنَا وَقَالَ ابْنُ مَنْصُورٍ أَخْبَرَنَا عَمْرُو بْنُ الرَّبِيعِ أَخْبَرَنَا يَحْيَى بْنُ أَيُّوبَ عَنْ يَزِيدَ بْنِ أَبِي حَبِيبٍ أَنَّ أَبَا الْخَيْرِ حَدَّثَهُ قَالَ رَأَيْتُ عَلَى ابْنِ وَعْلَةَ السَّبَإِيِّ فَرْوًا فَمَسِسْتُهُ فَقَالَ مَا لَكَ تَمَسُّهُ قَدْ سَأَلْتُ عَبْدَ اللَّهِ بْنَ عَبَّاسٍ قُلْتُ
إِنَّا نَكُونُ بِالْمَغْرِبِ وَمَعَنَا الْبَرْبَرُ وَالْمَجُوسُ نُؤْتَى بِالْكَبْشِ قَدْ ذَبَحُوهُ وَنَحْنُ لَا نَأْكُلُ ذَبَائِحَهُمْ وَيَأْتُونَا بِالسِّقَاءِ يَجْعَلُونَ فِيهِ الْوَدَكَ فَقَالَ ابْنُ عَبَّاسٍ قَدْ سَأَلْنَا رَسُولَ اللَّهِ صَلَّى اللَّهُ عَلَيْهِ وَسَلَّمَ عَنْ ذَلِكَ فَقَالَ دِبَاغُهُ طَهُورُهُ",3
555,4,"Telah menceritakan kepada kami [Muhamad bin Abdullah bin Numair] telah menceritakan kepada kami [bapakku] telah menceritakan kepada kami [Sufyan] dari [adh-Dhahhak bin Utsman] dari [Nafi'] dari [Ibnu Umar] bahwa seorang laki-laki pernah melewati Rasulullah shallallahu 'alaihi wasallam yang saat itu sedang buang air kecil, lalu dia mengucapkan salam kepada beliau, namun beliau tidak menjawabnya.","حَدَّثَنَا مُحَمَّدُ بْنُ عَبْدِ اللَّهِ بْنِ نُمَيْرٍ حَدَّثَنَا أَبِي حَدَّثَنَا سُفْيَانُ عَنْ الضَّحَّاكِ بْنِ عُثْمَانَ عَنْ نَافِعٍ عَنْ ابْنِ عُمَرَ
أَنَّ رَجُلًا مَرَّ وَرَسُولُ اللَّهِ صَلَّى اللَّهُ عَلَيْهِ وَسَلَّمَ يَبُولُ فَسَلَّمَ فَلَمْ يَرُدَّ عَلَيْهِ",3
559,4,"Telah menceritakan kepada kami [Yahya bin Yahya at-Tamimi] dan [Abu ar-Rabi' az-Zahrani] berkata [Yahya] telah mengabarkan kepada kami [Hammad bin Zaid] dan berkata [Abu ar-Rabi'] telah menceritakan kepada kami [Hammad] dari [Amru bin Dinar] dari [Sa'id bin al-Huwairits] dari [Ibnu Abbas] bahwa Nabi shallallahu 'alaihi wasallam keluar dari WC, lalu beliau dibawakan makanan, maka mereka mengingatkan beliau untuk berwudhu, maka beliau bersabda, ""Saya ingin shalat, maka saya berwudhu.""","حَدَّثَنَا يَحْيَى بْنُ يَحْيَى التَّمِيمِيُّ وَأَبُو الرَّبِيعِ الزَّهْرَانِيُّ قَالَ يَحْيَى أَخْبَرَنَا حَمَّادُ بْنُ زَيْدٍ وَقَالَ أَبُو الرَّبِيعِ حَدَّثَنَا حَمَّادٌ عَنْ عَمْرِو بْنِ دِينَارٍ عَنْ سَعِيدِ بْنِ الْحُوَيْرِثِ عَنْ ابْنِ عَبَّاسٍ
أَنَّ النَّبِيَّ صَلَّى اللَّهُ عَلَيْهِ وَسَلَّمَ خَرَجَ مِنْ الْخَلَاءِ فَأُتِيَ بِطَعَامٍ فَذَكَرُوا لَهُ الْوُضُوءَ فَقَالَ أُرِيدُ أَنْ أُصَلِّيَ فَأَتَوَضَّأَ",3
563,4,"Telah menceritakan kepada kami [Yahya bin Yahya] telah mengabarkan kepada kami [Hammad bin Zaid] dan [Yahya] berkata juga telah mengabarkan kepada kami [Husyaim] keduanya meriwayatkan dari [Abdul Aziz bin Shuhaib] dari [Anas] dalam hadits Hammad, ""Dahulu Rasulullah shallallahu 'alaihi wasallam apabila masuk WC"" --Sedangkan dalam hadis Husyaim dengan redaksi ""Bahwa Rasulullah apabila masuk tempat buang hajat--, maka beliau membaca, 'ALLOOHUMMA INNI A'UUDZU BIKA MINAL KHUBUTSI WALKHOBA'ITS"" Ya Allah, sesungguhnya aku berlindung kepadaMu dari setan laki-laki dan setan perempuan'."" Dan telah menceritakan kepada kami [Abu Bakar bin Abi Syaibah] dan [Zuhair bin Harb] keduanya berkata, telah menceritakan kepada kami [Ismail, yaitu Ibnu Ulayyah] dari [Abdul Aziz] dengan sanad ini, dan dia berkata, ' A'UUDZU BILLAH MINAL KHUBUTSI WALKHOBA'ITS Aku berlindung kepada Allah dari gangguan setan laki-laki dan setan perempuan'.""","حَدَّثَنَا يَحْيَى بْنُ يَحْيَى أَخْبَرَنَا حَمَّادُ بْنُ زَيْدٍ وَقَالَ يَحْيَى أَيْضًا أَخْبَرَنَا هُشَيْمٌ كِلَاهُمَا عَنْ عَبْدِ الْعَزِيزِ بْنِ صُهَيْبٍ عَنْ أَنَسٍ
فِي حَدِيثِ حَمَّادٍ كَانَ رَسُولُ اللَّهِ صَلَّى اللَّهُ عَلَيْهِ وَسَلَّمَ إِذَا دَخَلَ الْخَلَاءَ وَفِي حَدِيثِ هُشَيْمٍ أَنَّ رَسُولَ اللَّهِ صَلَّى اللَّهُ عَلَيْهِ وَسَلَّمَ كَانَ إِذَا دَخَلَ الْكَنِيفَ قَالَ اللَّهُمَّ إِنِّي أَعُوذُ بِكَ مِنْ الْخُبْثِ وَالْخَبَائِثِ
و حَدَّثَنَا أَبُو بَكْرِ بْنُ أَبِي شَيْبَةَ وَزُهَيْرُ بْنُ حَرْبٍ قَالَا حَدَّثَنَا إِسْمَعِيلُ وَهُوَ ابْنُ عُلَيَّةَ عَنْ عَبْدِ الْعَزِيزِ بِهَذَا الْإِسْنَادِ وَقَالَ أَعُوذُ بِاللَّهِ مِنْ الْخُبْثِ وَالْخَبَائِثِ",3
616,5,"Telah menceritakan kepada kami [Yahya bin Ayyub], [Qutaibah] dan [Ibnu Hujr] mereka berkata, telah menceritakan kepada kami [Ismail, yaitu Ibnu Ja'far] dari [al-'Ala'] dari [bapaknya] dari [Abu Hurairah] bahwa Rasulullah shallallahu 'alaihi wasallam bersabda, ""Barangsiapa bershalawat kepadaku satu kali maka Allah akan bershalawat kepadanya sepuluh kali.""","حَدَّثَنَا يَحْيَى بْنُ أَيُّوبَ وَقُتَيْبَةُ وَابْنُ حُجْرٍ قَالُوا حَدَّثَنَا إِسْمَعِيلُ وَهُوَ ابْنُ جَعْفَرٍ عَنْ الْعَلَاءِ عَنْ أَبِيهِ عَنْ أَبِي هُرَيْرَةَ
أَنَّ رَسُولَ اللَّهِ صَلَّى اللَّهُ عَلَيْهِ وَسَلَّمَ قَالَ مَنْ صَلَّى عَلَيَّ وَاحِدَةً صَلَّى اللَّهُ عَلَيْهِ عَشْرًا",3
1000,6,"Dan telah menceritakan kepadaku [Abu Ghassan Al Misma'i] dan [Muhammad bin Al Mutsanna] dari [Mu'adz bin Hisyam]. [Abu Ghassan] mengatakan; telah menceritakan kepada kami [Mu'adz bin Hisyam] telah menceritakan kepadaku [Ayahku] dari [Yahya bin Abu Katsir], katanya; telah menceritakan kepada kami [Abu Salamah bin Abdurrahman] dari [Jabir bin Abdullah], bahwa pada perang Khandaq, Umar bin Khattab mencela habis-habisan terhadap orang kafir Quraisy dan berujar; ""Wahai Rasulullah, demi Allah, hamir saja aku tidak shalat Ashar hingga matahari nyaris tenggelam."" Maka Rasulullah shallallahu 'alaihi wasallam bersabda; ""Demi Allah, jika aku mendirikan sekarang, "" Ketika kita singgah di Bathan (baca, Bat-haan), Rasulullah shallallahu 'alaihi wasallam mengambil air wudlu' dan kami pun berwudlu', lalu Rasulullah shallallahu 'alaihi wasallam shalat ashar setelah matahari terbenam, kemudian beliau shalat maghrib sesudahnya. Dan telah menceritakan kepada kami [Abu Bakr bin Abu Syaibah] dan [Ishaq bin Ibrahim]. Abu Bakr mengatakan; telah menceritakan kepada kami, sedangkan Ishaq mengatakan; telah mengabarkan kepada kami [Waki'] dari [Ali bin Mubarak] dari [Yahya bin Abu Katsir] seperti sanad hadits ini.""","و حَدَّثَنِي أَبُو غَسَّانَ الْمِسْمَعِيُّ وَمُحَمَّدُ بْنُ الْمُثَنَّى عَنْ مُعَاذِ بْنِ هِشَامٍ قَالَ أَبُو غَسَّانَ حَدَّثَنَا مُعَاذُ بْنُ هِشَامٍ حَدَّثَنِي أَبِي عَنْ يَحْيَى بْنِ أَبِي كَثِيرٍ قَالَ حَدَّثَنَا أَبُو سَلَمَةَ بْنُ عَبْدِ الرَّحْمَنِ عَنْ جَابِرِ بْنِ عَبْدِ اللَّهِ
أَنَّ عُمَرَ بْنَ الْخَطَّابِ يَوْمَ الْخَنْدَقِ جَعَلَ يَسُبُّ كُفَّارَ قُرَيْشٍ وَقَالَ يَا رَسُولَ اللَّهِ وَاللَّهِ مَا كِدْتُ أَنْ أُصَلِّيَ الْعَصْرَ حَتَّى كَادَتْ أَنْ تَغْرُبَ الشَّمْسُ فَقَالَ رَسُولُ اللَّهِ صَلَّى اللَّهُ عَلَيْهِ وَسَلَّمَ فَوَاللَّهِ إِنْ صَلَّيْتُهَا فَنَزَلْنَا إِلَى بُطْحَانَ فَتَوَضَّأَ رَسُولُ اللَّهِ صَلَّى اللَّهُ عَلَيْهِ وَسَلَّمَ وَتَوَضَّأْنَا فَصَلَّى رَسُولُ اللَّهِ صَلَّى اللَّهُ عَلَيْهِ وَسَلَّمَ الْعَصْرَ بَعْدَ مَا غَرَبَتْ الشَّمْسُ ثُمَّ صَلَّى بَعْدَهَا الْمَغْرِبَ
و حَدَّثَنَا أَبُو بَكْرِ بْنُ أَبِي شَيْبَةَ وَإِسْحَقُ بْنُ إِبْرَاهِيمَ قَالَ أَبُو بَكْرٍ حَدَّثَنَا وَقَالَ إِسْحَقُ أَخْبَرَنَا وَكِيعٌ عَنْ عَلِيِّ بْنِ الْمُبَارَكِ عَنْ يَحْيَى بْنِ أَبِي كَثِيرٍ فِي هَذَا الْإِسْنَادِ بِمِثْلِهِ",3
1275,7,"Telah menceritakan kepada kami [Yahya bin Yahya] ia berkata: Aku telah membacakan kepada [Malik] dari [Makhramah bin Sulaiman] dari [Kuraib] Maula Ibnu Abbas, bahwa [Ibnu Abbas] telah mengabarkan kepadanya bahwasanya; Pada suatu malam dia tidur di rumah bibinya, Maimunah, Ummul Mukminin. Dia tidur melintang kasur, sedangkan Rasulullah shallallahu 'alaihi wasallam dan isterinya memanjang kasur. Beliau tidur hingga lebih kurang sampai pertengan malam. Setelah itu, beliau bangun sambil menyapu kantuk dari mukanya. Kemudian beliau membaca sepuluh ayat penghabisan dari surat Ali Imran. Sesudah itu, beliau pergi ke tempat air, lalu beliau berwudlu dengan menyempurnakan wudlunya, dan sesudah itu beliau shalat. Ibnu Abbas berkata, ""Aku pun bangun kemudian melakukan sebagaimana yang dilakukan oleh Nabi shallallahu 'alaihi wasallam. Kemudian aku berdiri di samping kiri beliau. Tetapi beliau memegang kepalaku dengan tangannya dan memindahkanku ke sebelah kanannya. Mula-mula beliau shalat dua raka'at, kemudian dua raka'at, kemudian dua raka'at, kemudian dua raka'at, kemudian dua raka'at, kemudian dua raka'at dan kemudian witir satu raka'at. Sesudah itu, beliau berbaring hingga terdengar muadzin mengumandangkan adzan Shubuh. Rasulullah shallallahu 'alaihi wasallam bangun, lalu shalat ringkas dua raka'at, sesudah itu beliau pergi ke (masjid) untuk mengerjakan shalat Shubuh."" Dan telah menceritakan kepadaku [Muhammad bin Salamah Al Muradi] telah menceritakan kepada kami [Abdullah bin Wahb] dari [Iyadl bin Abdullah Al Fihri] dari [Makhramah bin Sulaiman] dengan isnad ini. dan ia menambahkan; ""Kemudian beliau pergi ke tempat air, bersiwak dan berwudlu dengan menyempurnakan wudlunya. Dan beliau tidaklah menggunakan air kecuali hanya sedikit. Sesudah itu, beliau menggerakkanku, hingga aku pun bangun."" Semua hadits (tentang ini) menyerupai haditsnya Malik.","حَدَّثَنَا يَحْيَى بْنُ يَحْيَى قَالَ قَرَأْتُ عَلَى مَالِكٍ عَنْ مَخْرَمَةَ بْنِ سُلَيْمَانَ عَنْ كُرَيْبٍ مَوْلَى ابْنِ عَبَّاسٍ أَنَّ ابْنَ عَبَّاسٍ أَخْبَرَهُ
أَنَّهُ بَاتَ لَيْلَةً عِنْدَ مَيْمُونَةَ أُمِّ الْمُؤْمِنِينَ وَهِيَ خَالَتُهُ قَالَ فَاضْطَجَعْتُ فِي عَرْضِ الْوِسَادَةِ وَاضْطَجَعَ رَسُولُ اللَّهِ صَلَّى اللَّهُ عَلَيْهِ وَسَلَّمَ وَأَهْلُهُ فِي طُولِهَا فَنَامَ رَسُولُ اللَّهِ صَلَّى اللَّهُ عَلَيْهِ وَسَلَّمَ حَتَّى انْتَصَفَ اللَّيْلُ أَوْ قَبْلَهُ بِقَلِيلٍ أَوْ بَعْدَهُ بِقَلِيلٍ اسْتَيْقَظَ رَسُولُ اللَّهِ صَلَّى اللَّهُ عَلَيْهِ وَسَلَّمَ فَجَعَلَ يَمْسَحُ النَّوْمَ عَنْ وَجْهِهِ بِيَدِهِ ثُمَّ قَرَأَ الْعَشْرَ الْآيَاتِ الْخَوَاتِمَ مِنْ سُورَةِ آلِ عِمْرَانَ ثُمَّ قَامَ إِلَى شَنٍّ مُعَلَّقَةٍ فَتَوَضَّأَ مِنْهَا فَأَحْسَنَ وُضُوءَهُ ثُمَّ قَامَ فَصَلَّى قَالَ ابْنُ عَبَّاسٍ فَقُمْتُ فَصَنَعْتُ مِثْلَ مَا صَنَعَ رَسُولُ اللَّهِ صَلَّى اللَّهُ عَلَيْهِ وَسَلَّمَ ثُمَّ ذَهَبْتُ فَقُمْتُ إِلَى جَنْبِهِ فَوَضَعَ رَسُولُ اللَّهِ صَلَّى اللَّهُ عَلَيْهِ وَسَلَّمَ يَدَهُ الْيُمْنَى عَلَى رَأْسِي وَأَخَذَ بِأُذُنِي الْيُمْنَى يَفْتِلُهَا فَصَلَّى رَكْعَتَيْنِ ثُمَّ رَكْعَتَيْنِ ثُمَّ رَكْعَتَيْنِ ثُمَّ رَكْعَتَيْنِ ثُمَّ رَكْعَتَيْنِ ثُمَّ رَكْعَتَيْنِ ثُمَّ أَوْتَرَ ثُمَّ اضْطَجَعَ حَتَّى جَاءَ الْمُؤَذِّنُ فَقَامَ فَصَلَّى رَكْعَتَيْنِ خَفِيفَتَيْنِ ثُمَّ خَرَجَ فَصَلَّى الصُّبْحَ
و حَدَّثَنِي مُحَمَّدُ بْنُ سَلَمَةَ الْمُرَادِيُّ حَدَّثَنَا عَبْدُ اللَّهِ بْنُ وَهْبٍ عَنْ عِيَاضِ بْنِ عَبْدِ اللَّهِ الْفِهْرِيِّ عَنْ مَخْرَمَةَ بْنِ سُلَيْمَانَ بِهَذَا الْإِسْنَادِ وَزَادَ ثُمَّ عَمَدَ إِلَى شَجْبٍ مِنْ مَاءٍ فَتَسَوَّكَ وَتَوَضَّأَ وَأَسْبَغَ الْوُضُوءَ وَلَمْ يُهْرِقْ مِنْ الْمَاءِ إِلَّا قَلِيلًا ثُمَّ حَرَّكَنِي فَقُمْتُ وَسَائِرُ الْحَدِيثِ نَحْوُ حَدِيثِ مَالِكٍ",3
1278,7,"Telah menceritakan kepada kami [Ibnu Abu Umar] dan [Muhammad bin Hatim] dari [Ibnu Uyainah] -dalam jalur lain Ibnu Abu Umar- berkata, telah menceritakan kepada kami [Sufyan] dari [Amru bin Dinar] dari [Kuraib] Maula bin Abbas, dari [Ibnu Abbas] bahwa ia pernah bermalam di tempat bibinya, Maimunah. Kemudian Rasulullah shallallahu 'alaihi wasallam bangun malam lalu berwudlu dengan wudlu yang ringan dari geriba yang tergantung -lalu ia mensifati wudlu Nabi- beliau berwudlu ringan dan meringankannya. Ibnu Abbas berkata; ""Maka saya pun bangun dan melakukan sebagaimana yang dilakukan Nabi shallallahu 'alaihi wasallam. Sesudah itu, saya berdiri ikut shalat di sebelah kiri beliau. Namun beliau memindahkan dan meletakkanku di sebelah kanannya. Maka beliau pun shalat, lalu berbaring dan tidur hingga (aku mendengar) beliau mendengkur. Kemudian Bilal pun datang dan mengumandangkan adzan shalat. Sesudah itu, beliau keluar dan menunaikan shalat Shubuh dengan tanpa berwudlu lagi."" Sufyan berkata; Dan perbuatan ini (tidak berwudlu lagi) adalah khusus bagi Nabi shallallahu 'alaihi wasallam. Sebab telah sampai kabar kepada kita bahwa kedua mata Nabi shallallahu 'alaihi wasallam tidur, namun hatinya tidak tidur.","حَدَّثَنَا ابْنُ أَبِي عُمَرَ وَمُحَمَّدُ بْنُ حَاتِمٍ عَنْ ابْنِ عُيَيْنَةَ قَالَ ابْنُ أَبِي عُمَرَ حَدَّثَنَا سُفْيَانُ عَنْ عَمْرِو بْنِ دِينَارٍ عَنْ كُرَيْبٍ مَوْلَى ابْنِ عَبَّاسٍ عَنْ ابْنِ عَبَّاسٍ
أَنَّهُ بَاتَ عِنْدَ خَالَتِهِ مَيْمُونَةَ فَقَامَ رَسُولُ اللَّهِ صَلَّى اللَّهُ عَلَيْهِ وَسَلَّمَ مِنْ اللَّيْلِ فَتَوَضَّأَ مِنْ شَنٍّ مُعَلَّقٍ وُضُوءًا خَفِيفًا قَالَ وَصَفَ وُضُوءَهُ وَجَعَلَ يُخَفِّفُهُ وَيُقَلِّلُهُ قَالَ ابْنُ عَبَّاسٍ فَقُمْتُ فَصَنَعْتُ مِثْلَ مَا صَنَعَ النَّبِيُّ صَلَّى اللَّهُ عَلَيْهِ وَسَلَّمَ ثُمَّ جِئْتُ فَقُمْتُ عَنْ يَسَارِهِ فَأَخْلَفَنِي فَجَعَلَنِي عَنْ يَمِينِهِ فَصَلَّى ثُمَّ اضْطَجَعَ فَنَامَ حَتَّى نَفَخَ ثُمَّ أَتَاهُ بِلَالٌ فَآذَنَهُ بِالصَّلَاةِ فَخَرَجَ فَصَلَّى الصُّبْحَ وَلَمْ يَتَوَضَّأْ
قَالَ سُفْيَانُ وَهَذَا لِلنَّبِيِّ صَلَّى اللَّهُ عَلَيْهِ وَسَلَّمَ خَاصَّةً لِأَنَّهُ بَلَغَنَا أَنَّ النَّبِيَّ صَلَّى اللَّهُ عَلَيْهِ وَسَلَّمَ تَنَامُ عَيْنَاهُ وَلَا يَنَامُ قَلْبُهُ",3
