haditsId,kitabId,indo,arab,label
3163,29,"Telah menceritakan kepada kami [Abu Ja'far Muhammad bin As Shabah] dan [Abu Bakar bin Abu Syaibah] dan ini adalah lafadz Abu Bakar, dia berkata; telah menceritakan kepada kami [Ibnu 'Ulayyah] dari [Hajjaj bin Abu Utsman] telah menceritakan kepadaku [Abu Raja`] bekas budak Abu Qilabah, dari [Abu Qilabah] telah menceritakan kepadaku [Anas], bahwa sekelompok orang dari Bani 'Ukl yang berjumlah delapan orang datang kepada Rasulullah shallallahu 'alaihi wasallam, lalu mereka membai'at beliau atas Islam. Tidak beberapa lama mereka sakit karena tidak terbiasa dengan iklim Kota Madinah. Mereka kemudian mengadu kepada Nabi shallallahu 'alaihi wasallam, beliau bersabda: ""Maukah kamu pergi ke unta-unta yang sedang digembalakan, lalu kamu meminum susu dan air kencingnya?"" mereka menjawab, ""Tentu."" Kemudian mereka pergi ke unta-unta tersebut dan meminum susu dan air kencingnya hingga mereka sehat seperti biasa, setelah itu mereka membunuh pengembala dan merampas unta-untanya. Setelah peristiwa tersebut sampai kepada Rasulullah shallallahu 'alaihi wasallam, beliau mengutus untuk mengejar mereka sampai dapat, setelah mereka tertangkap dan dibawa ke hadapan beliau, maka beliau memerintahkan supaya tangan dan kaki mereka dipotong dan dicongkel mata mereka. Setelah itu, mereka kemudian dilemparkan di bawah terik matahari yang sangat panas, sehingga mereka mati terkapar."" [Ibnu Shabah] menyebutkan dalam riwayatnya, ""Mereka merampas unta-untanya."" Dan ia juga menyebutkan, ""Kemudian mata mereka dicongkel."" Dan telah menceritakan kepada kami [Harun bin Abdullah] telah menceritakan kepada kami [Sulaiman bin Harb] telah menceritakan kepada kami [Hammad bin Zaid] dari [Ayyub] dari [Abu Raja`] bekas budak Abu Qilabah, dia berkata; [Abu Qiabah] berkata; telah menceritakan kepada kami [Anas bin Malik] dia berkata, ""Beberapa orang dari kaum 'Ukl atau 'Urainah datang kepada Nabi shallallahu 'alaihi wasallam, lalu mereka sakit karena udara Madinah sangat dingin. Rasulullah shallallahu 'alaihi wasallam kemudian memerintahkan mereka supaya pergi ke sekumpulan unta (zakat) untuk meminum susu dan air kencingnya …"", semakna dengan hadits Hajjaj bin Abu Utsman, dia menyebutkan, ""Kemudian mata mereka di congkel dan badan mereka dilemparkan di bawah terik matahari hingga mereka meminta disirami air, dan tidak ada seorang pun yang diberi air."" Dan telah menceritakan kepada kami [Muhammad bin Al Mutsanna] telah menceritakan kepada kami [Mua'dz bin Mu'adz]. (dalam jalur lain disebutkan) Telah menceritakan kepada kami [Ahmad bin Utsman An Naufali] telah menceritakan kepada kami [Azhar As Saman] keduanya berkata; telah menceritakan kepada kami [Ibnu 'Aun] telah menceritakan kepada kami [Abu Raja`] bekas budak Abu Qilabah, dari [Abu Qilabah] dia berkata, ""Aku penah duduk di belakang Umar bin Abdul Aziz, lalu dia berkata kepada orang-orang, ""Apa pendapat kalian tentang qasamah?"" ['Anbasah] menjawab, ""Sungguh telah menceritakan kepada kami [Anas bin Malik] seperti ini dan ini, maka suya pun berkata; Anas juga pernah bercerita kepadaku bahwa sekelompok kaum datang kepada Nabi shallallahu 'alaihi wasallam …"", kemudian dia meneruskan hadits tersebut sebagaimana hadits Ayyub dan Hajjaj."" Abu Qilabah berkata, ""Ketika aku selesai, Anbasah mengucapkan, ""Subhanallah!"" Abu Qilabah melanjutkan, ""Lalu aku berkata, ""Apakah kamu meragukan haditsku wahai 'Anbasah?"" dia menjawab, ""Tidak, seperti ini jugalah Anas bin Malik menceritakan kepada kami. Wahai penduduk Syam, kalian senantiasa dalam kebaikan selagi di antara kalian masih ada orang ini -atau- orang seperti ini."" Dan telah menceritakan kepada kami [Al Hasan bin Abu Syua'ib Al Harrani] telah menceritakan kepada kami [Miskin] -yaitu Ibnu Bukair Al Harrani- telah mengabarkan kepada kami [Al Auza'i]. (dalam jalur lain disebutkan) Telah menceritakan kepada kami [Abdullah bin Abdurrahman Ad Darimi] telah mengabarkan kepada kami [Muhammad bin Yusuf] dari [Al Auza'i] dari [Yahya bin Abu Katsir] dari [Abu Qilabah] dari [Anas bin Malik] dia berkata, ""Sekelompok kaum dari 'Ukl yang berjumlah delapan orang datang kepada Rasulullah shallallahu 'alaihi wasallam …', seperti hadits mereka. Dan dalam haditsnya ada tambahan, ""Dan mereka dibiarkan darahnya mengucur."" Dan telah menceritakan kepada kami [Harun bin Abdullah] telah menceritakan kepada kami [Malik bin Isma'il] telah menceritakan kepada kami [Zuhair] telah menceritakan kepada kami [Simak bin Harb] dari [Mu'awiyah bin Qurrah] dari [Anas] dia berkata, ""Sekelompok orang dari 'Urainah datang kepada Nabi shallallahu 'alaihi wasallam, kemudian mereka masuk Islam dan membai'at beliau. Selama tinggal di Madinah mereka sakit kepala dan sesak nafas…', kemudian dia menyebutkan seperti hadits mereka. Dan ada tambahan, ""Dan di samping beliau ada pemuda-pemuda Anshar yang jumlahnya sekitar dua puluh orang, kemudian beliau mengutus mereka dan juga seorang Qaif (orang yang ahli dalam mencari jejak) untuk mengejar para perampok."" Telah menceritakan kepada kami [Haddab bin Khalid] telah menceritakan kepada kami [Hammam] telah menceritakan kepada kami [Qatadah] dari [Anas]. (dalam jalur lain disebutkan) Telah menceritakan kepada kami [Ibnu Al Mutsanna] telah menceritakan kepada kami [Abdul A'la] telah menceritakan kepada kami [Sa'id] dari [Qatadah] dari [Anas] dan dalam haditsnya [Hammam] disebutkan, ""Sekelompok pemuda dari 'Urainah datang kepada Nabi shallallahu 'alaihi wasallam."" Sedangan dalam haditsnya Sa'id disebutkan, 'Dari 'Ukl dan 'Urainah', seperti dalam hadits mereka.""","حَدَّثَنَا أَبُو جَعْفَرٍ مُحَمَّدُ بْنُ الصَّبَّاحِ وَأَبُو بَكْرِ بْنُ أَبِي شَيْبَةَ وَاللَّفْظُ لِأَبِي بَكْرٍ قَالَ حَدَّثَنَا ابْنُ عُلَيَّةَ عَنْ حَجَّاجِ بْنِ أَبِي عُثْمَانَ حَدَّثَنِي أَبُو رَجَاءٍ مَوْلَى أَبِي قِلَابَةَ عَنْ أَبِي قِلَابَةَ حَدَّثَنِي أَنَسٌ
أَنَّ نَفَرًا مِنْ عُكْلٍ ثَمَانِيَةً قَدِمُوا عَلَى رَسُولِ اللَّهِ صَلَّى اللَّهُ عَلَيْهِ وَسَلَّمَ فَبَايَعُوهُ عَلَى الْإِسْلَامِ فَاسْتَوْخَمُوا الْأَرْضَ وَسَقِمَتْ أَجْسَامُهُمْ فَشَكَوْا ذَلِكَ إِلَى رَسُولِ اللَّهِ صَلَّى اللَّهُ عَلَيْهِ وَسَلَّمَ فَقَالَ أَلَا تَخْرُجُونَ مَعَ رَاعِينَا فِي إِبِلِهِ فَتُصِيبُونَ مِنْ أَبْوَالِهَا وَأَلْبَانِهَا فَقَالُوا بَلَى فَخَرَجُوا فَشَرِبُوا مِنْ أَبْوَالِهَا وَأَلْبَانِهَا فَصَحُّوا فَقَتَلُوا الرَّاعِيَ وَطَرَدُوا الْإِبِلَ فَبَلَغَ ذَلِكَ رَسُولَ اللَّهِ صَلَّى اللَّهُ عَلَيْهِ وَسَلَّمَ فَبَعَثَ فِي آثَارِهِمْ فَأُدْرِكُوا فَجِيءَ بِهِمْ فَأَمَرَ بِهِمْ فَقُطِعَتْ أَيْدِيهِمْ وَأَرْجُلُهُمْ وَسُمِرَ أَعْيُنُهُمْ ثُمَّ نُبِذُوا فِي الشَّمْسِ حَتَّى مَاتُوا
و قَالَ ابْنُ الصَّبَّاحِ فِي رِوَايَتِهِ وَاطَّرَدُوا النَّعَمَ وَقَالَ وَسُمِّرَتْ أَعْيُنُهُمْ و حَدَّثَنَا هَارُونُ بْنُ عَبْدِ اللَّهِ حَدَّثَنَا سُلَيْمَانُ بْنُ حَرْبٍ حَدَّثَنَا حَمَّادُ بْنُ زَيْدٍ عَنْ أَيُّوبَ عَنْ أَبِي رَجَاءٍ مَوْلَى أَبِي قِلَابَةَ قَالَ قَالَ أَبُو قِلَابَةَ حَدَّثَنَا أَنَسُ بْنُ مَالِكٍ قَالَ قَدِمَ عَلَى رَسُولِ اللَّهِ صَلَّى اللَّهُ عَلَيْهِ وَسَلَّمَ قَوْمٌ مِنْ عُكْلٍ أَوْ عُرَيْنَةَ فَاجْتَوَوْا الْمَدِينَةَ فَأَمَرَ لَهُمْ رَسُولُ اللَّهِ صَلَّى اللَّهُ عَلَيْهِ وَسَلَّمَ بِلِقَاحٍ وَأَمَرَهُمْ أَنْ يَشْرَبُوا مِنْ أَبْوَالِهَا وَأَلْبَانِهَا بِمَعْنَى حَدِيثِ حَجَّاجِ بْنِ أَبِي عُثْمَانَ قَالَ وَسُمِرَتْ أَعْيُنُهُمْ وَأُلْقُوا فِي الْحَرَّةِ يَسْتَسْقُونَ فَلَا يُسْقَوْنَ و حَدَّثَنَا مُحَمَّدُ بْنُ الْمُثَنَّى حَدَّثَنَا مُعَاذُ بْنُ مُعَاذٍ ح و حَدَّثَنَا أَحْمَدُ بْنُ عُثْمَانَ النَّوْفَلِيُّ حَدَّثَنَا أَزْهَرُ السَّمَّانُ قَالَا حَدَّثَنَا ابْنُ عَوْنٍ حَدَّثَنَا أَبُو رَجَاءٍ مَوْلَى أَبِي قِلَابَةَ عَنْ أَبِي قِلَابَةَ قَالَ كُنْتُ جَالِسًا خَلْفَ عُمَرَ بْنِ عَبْدِ الْعَزِيزِ فَقَالَ لِلنَّاسِ مَا تَقُولُونَ فِي الْقَسَامَةِ فَقَالَ عَنْبَسَةُ قَدْ حَدَّثَنَا أَنَسُ بْنُ مَالِكٍ كَذَا وَكَذَا فَقُلْتُ إِيَّايَ حَدَّثَ أَنَسٌ قَدِمَ عَلَى النَّبِيِّ صَلَّى اللَّهُ عَلَيْهِ وَسَلَّمَ قَوْمٌ وَسَاقَ الْحَدِيثَ بِنَحْوِ حَدِيثِ أَيُّوبَ وَحَجَّاجٍ قَالَ أَبُو قِلَابَةَ فَلَمَّا فَرَغْتُ قَالَ عَنْبَسَةُ سُبْحَانَ اللَّهِ قَالَ أَبُو قِلَابَةَ فَقُلْتُ أَتَتَّهِمُنِي يَا عَنْبَسَةُ قَالَ لَا هَكَذَا حَدَّثَنَا أَنَسُ بْنُ مَالِكٍ لَنْ تَزَالُوا بِخَيْرٍ يَا أَهْلَ الشَّامِ مَا دَامَ فِيكُمْ هَذَا أَوْ مِثْلُ هَذَا و حَدَّثَنَا الْحَسَنُ بْنُ أَبِي شُعَيْبٍ الْحَرَّانِيُّ حَدَّثَنَا مِسْكِينٌ وَهُوَ ابْنُ بُكَيْرٍ الْحَرَّانِيُّ أَخْبَرَنَا الْأَوْزَاعِيُّ ح و حَدَّثَنَا عَبْدُ اللَّهِ بْنُ عَبْدِ الرَّحْمَنِ الدَّارِمِيُّ أَخْبَرَنَا مُحَمَّدُ بْنُ يُوسُفَ عَنْ الْأَوْزَاعِيِّ عَنْ يَحْيَى بْنِ أَبِي كَثِيرٍ عَنْ أَبِي قِلَابَةَ عَنْ أَنَسِ بْنِ مَالِكٍ قَالَ قَدِمَ عَلَى رَسُولِ اللَّهِ صَلَّى اللَّهُ عَلَيْهِ وَسَلَّمَ ثَمَانِيَةُ نَفَرٍ مِنْ عُكْلٍ بِنَحْوِ حَدِيثِهِمْ وَزَادَ فِي الْحَدِيثِ وَلَمْ يَحْسِمْهُمْ و حَدَّثَنَا هَارُونُ بْنُ عَبْدِ اللَّهِ حَدَّثَنَا مَالِكُ بْنُ إِسْمَعِيلَ حَدَّثَنَا زُهَيْرٌ حَدَّثَنَا سِمَاكُ بْنُ حَرْبٍ عَنْ مُعَاوِيَةَ بْنِ قُرَّةَ عَنْ أَنَسٍ قَالَ أَتَى رَسُولَ اللَّهِ صَلَّى اللَّهُ عَلَيْهِ وَسَلَّمَ نَفَرٌ مِنْ عُرَيْنَةَ فَأَسْلَمُوا وَبَايَعُوهُ وَقَدْ وَقَعَ بِالْمَدِينَةِ الْمُومُ وَهُوَ الْبِرْسَامُ ثُمَّ ذَكَرَ نَحْوَ حَدِيثِهِمْ وَزَادَ وَعِنْدَهُ شَبَابٌ مِنْ الْأَنْصَارِ قَرِيبٌ مِنْ عِشْرِينَ فَأَرْسَلَهُمْ إِلَيْهِمْ وَبَعَثَ مَعَهُمْ قَائِفًا يَقْتَصُّ أَثَرَهُمْ حَدَّثَنَا هَدَّابُ بْنُ خَالِدٍ حَدَّثَنَا هَمَّامٌ حَدَّثَنَا قَتَادَةُ عَنْ أَنَسٍ ح و حَدَّثَنَا ابْنُ الْمُثَنَّى حَدَّثَنَا عَبْدُ الْأَعْلَى حَدَّثَنَا سَعِيدٌ عَنْ قَتَادَةَ عَنْ أَنَسٍ وَفِي حَدِيثِ هَمَّامٍ قَدِمَ عَلَى النَّبِيِّ صَلَّى اللَّهُ عَلَيْهِ وَسَلَّمَ رَهْطٌ مِنْ عُرَيْنَةَ وَفِي حَدِيثِ سَعِيدٍ مِنْ عُكْلٍ وَعُرَيْنَةَ بِنَحْوِ حَدِيثِهِمْ",3
3486,34,"Telah menceritakan kepada kami ['Amru An Naqid] dan [Zuhair bin Harb] keduanya berkata; telah menceritakan kepada kami [Sufyan bin 'Uyainah] dari [Abu Az Zinad] dari [Al A'raj] dari [Abu Hurairah] dari Nabi shallallahu 'alaihi wasallam, beliau bersabda: ""Tidak ada seorang pun yang terluka dalam perang fi sabilillah -dan Allah lebih mengetahui bagi siapa yang terluka di jalan-Nya- kecuali ia akan datang di hari kiamat kelak dengan luka yang mengucurkan darah berwarna merah dan baunya seperti bau kesturi.""","حَدَّثَنَا عَمْرٌو النَّاقِدُ وَزُهَيْرُ بْنُ حَرْبٍ قَالَا حَدَّثَنَا سُفْيَانُ بْنُ عُيَيْنَةَ عَنْ أَبِي الزِّنَادِ عَنْ الْأَعْرَجِ عَنْ أَبِي هُرَيْرَةَ
عَنْ النَّبِيِّ صَلَّى اللَّهُ عَلَيْهِ وَسَلَّمَ قَالَ لَا يُكْلَمُ أَحَدٌ فِي سَبِيلِ اللَّهِ وَاللَّهُ أَعْلَمُ بِمَنْ يُكْلَمُ فِي سَبِيلِهِ إِلَّا جَاءَ يَوْمَ الْقِيَامَةِ وَجُرْحُهُ يَثْعَبُ اللَّوْنُ لَوْنُ دَمٍ وَالرِّيحُ رِيحُ مِسْكٍ",3
3689,37,"Dan telah menceritakan kepadaku ['Amru An Naqid] telah menceritakan kepada kami [Sufyan bin 'Uyainah] dari [Az Zuhri] dari [Anas bin Malik], bahwa Rasulullah shallallahu 'alaihi wasallam melarang membuat perasan dalam bejana dalam bejana dari Ad Duba dan Al Muzaffat."" ","و حَدَّثَنِي عَمْرٌو النَّاقِدُ حَدَّثَنَا سُفْيَانُ بْنُ عُيَيْنَةَ عَنْ الزُّهْرِيِّ عَنْ أَنَسِ بْنِ مَالِكٍ
أَنَّ رَسُولَ اللَّهِ صَلَّى اللَّهُ عَلَيْهِ وَسَلَّمَ نَهَى عَنْ الدُّبَّاءِ وَالْمُزَفَّتِ أَنْ يُنْتَبَذَ فِيهِ",3
3769,37,Telah menceritakan kepada kami ['Amru An Naqid]; Telah menceritakan kepada kami [Sufyan bin 'Uyainah] dari [Az Zuhri] dari ['Ubaidillah] dari [Abu Sa'id] ia berkata; Rasulullah shallallahu 'alaihi wasallam melarang membengkokkan mulut tempat air.,"و حَدَّثَنَا عَمْرٌو النَّاقِدُ حَدَّثَنَا سُفْيَانُ بْنُ عُيَيْنَةَ عَنْ الزُّهْرِيِّ عَنْ عُبَيْدِ اللَّهِ عَنْ أَبِي سَعِيدٍ قَالَ
نَهَى النَّبِيُّ صَلَّى اللَّهُ عَلَيْهِ وَسَلَّمَ عَنْ اخْتِنَاثِ الْأَسْقِيَةِ",3
3880,38,"Telah menceritakan kepadaku ['Ali bin Hujr As Sa'di] dan [Muhammad bin Hatim] dan [Ya'qub bin Ibrahim] seluruhnya dari ['Ulayyah], [Ibnu Hujr] berkata; Telah menceritakan kepada kami [Isma'il] dari [Ayyub] dari [Humaid bin Hilal] dari [Abu Burdah] ia berkata; [Aisyah] mengeluarkan kepada kami kain dan baju yang kasar seraya berkata; ""Rasulullah meninggal dunia dengan mengenakan kain dan baju ini."" Ibnu Hatim di dalam Haditsnya menyebutkan dengan lafazh 'Izaaran Ghalizha' (kain yang tebal). Dan telah menceritakan kepadaku [Muhammad bin Rafi']; Telah menceritakan kepada kami ['Abdurrazaq]; Telah mengabarkan kepada kami [Ma'mar] dari [Ayyub] melalui jalur ini dengan Hadits yang serupa. Dia berkata dengan redaksi; 'Izaaran Ghalizha (kain yang tebal).'","حَدَّثَنِي عَلِيُّ بْنُ حُجْرٍ السَّعْدِيُّ وَمُحَمَّدُ بْنُ حَاتِمٍ وَيَعْقُوبُ بْنُ إِبْرَاهِيمَ جَمِيعًا عَنْ ابْنِ عُلَيَّةَ قَالَ ابْنُ حُجْرٍ حَدَّثَنَا إِسْمَعِيلُ عَنْ أَيُّوبَ عَنْ حُمَيْدِ بْنِ هِلَالٍ عَنْ أَبِي بُرْدَةَ قَالَ
أَخْرَجَتْ إِلَيْنَا عَائِشَةُ إِزَارًا وَكِسَاءً مُلَبَّدًا فَقَالَتْ فِي هَذَا قُبِضَ رَسُولُ اللَّهِ صَلَّى اللَّهُ عَلَيْهِ وَسَلَّمَ
قَالَ ابْنُ حَاتِمٍ فِي حَدِيثِهِ إِزَارًا غَلِيظًا و حَدَّثَنِي مُحَمَّدُ بْنُ رَافِعٍ حَدَّثَنَا عَبْدُ الرَّزَّاقِ أَخْبَرَنَا مَعْمَرٌ عَنْ أَيُّوبَ بِهَذَا الْإِسْنَادِ مِثْلَهُ وَقَالَ إِزَارًا غَلِيظًا",3
3922,38,Telah menceritakan kepada kami [Yahya bin Yahya] dan [Abu Ar Rabi'] dan [Qutaibah bin Sa'id]. [Yahya] berkata; Telah mengabarkan kepada kami [Hammad bin Zaid] dan yang lainnya berkata; Telah menceritakan kepada kami [Hammad] dari ['Abdul 'Aziz bin Shuhaib] dari [Anas bin Malik] bahwa Nabi shallallahu 'alaihi wasallam melarang mencelup dengan Za'faran (warna kuning). [Qutaibah] berkata; [Hammad] berkata; 'Yaitu bagi laki-laki.',"حَدَّثَنَا يَحْيَى بْنُ يَحْيَى وَأَبُو الرَّبِيعِ وَقُتَيْبَةُ بْنُ سَعِيدٍ قَالَ يَحْيَى أَخْبَرَنَا حَمَّادُ بْنُ زَيْدٍ و قَالَ الْآخَرَانِ حَدَّثَنَا حَمَّادٌ عَنْ عَبْدِ الْعَزِيزِ بْنِ صُهَيْبٍ عَنْ أَنَسِ بْنِ مَالِكٍ
أَنَّ النَّبِيَّ صَلَّى اللَّهُ عَلَيْهِ وَسَلَّمَ نَهَى عَنْ التَّزَعْفُرِ
قَالَ قُتَيْبَةُ قَالَ حَمَّادٌ يَعْنِي لِلرِّجَالِ",3
3923,38,Dan telah menceritakan kepada kami [Abu Bakr bin Abu Syaibah] dan ['Amru An Naqid] dan [Zuhair bin Harb] dan [Ibnu Numair] dan [Abu Kuraib] mereka berkata; Telah menceritakan kepada kami [Isma'il] yaitu Ibnu 'Ulayyah dari ['Abdul 'Aziz bin Shuhaib] dari [Anas] ia berkata; Rasulullah shallallahu 'alaihi wasallam melarang laki-laki mencelup dengan Za'faran (warna kuning).,"و حَدَّثَنَا أَبُو بَكْرِ بْنُ أَبِي شَيْبَةَ وَعَمْرٌو النَّاقِدُ وَزُهَيْرُ بْنُ حَرْبٍ وَابْنُ نُمَيْرٍ وَأَبُو كُرَيْبٍ قَالُوا حَدَّثَنَا إِسْمَعِيلُ وَهُوَ ابْنُ عُلَيَّةَ عَنْ عَبْدِ الْعَزِيزِ بْنِ صُهَيْبٍ عَنْ أَنَسٍ قَالَ
نَهَى رَسُولُ اللَّهِ صَلَّى اللَّهُ عَلَيْهِ وَسَلَّمَ أَنْ يَتَزَعْفَرَ الرَّجُلُ",3
4034,40,"Telah menceritakan kepada kami [Abu Bakr bin Abu Syaibah] dan [Abu Kuraib] berkata; Telah menceritakan kepada kami [Abu Usamah] dari [Hisyam] dari [Bapaknya] dari ['Aisyah] berkata; ""Pada suatu malam Saudah bin Zam'ah, istri Rasulullah shallallahu 'alaihi wasallam, keluar untuk buang hajat di tanah lapang. Saudah adalah seorang wanita besar yang tingginya melebihi rata-rata wanita Arab, hingga orang-orang yang melihatnya tidak akan sulit untuk mengenalinya. Kebetulan 'Umar bin Khaththab melihatnya dan berkata; 'Hai Saudah, demi Allah saya bisa mengenalimu. Oleh karena itu, janganlah kamu keluar rumah.' 'Aisyah berkata; 'Setelah itu ia berbalik pulang ke rumah. Pada saat itu Rasulullah shallallahu 'alaihi wasallam sedang makan malam dengan sepotong daging di tangannya. Lalu Saudah masuk ke dalam rumah untuk buang hajat. Tetapi 'Umar berkata begini dan begitu.' 'Aisyah berkata; 'Tak lama kemudian Rasulullah pun menerima wahyu. Setelah menerima wahyu -sementara sepotong daging masih beliau pegang- beliau pun bersabda: 'Sesungguhnya kalian (para istriku) diperbolehkan keluar rumah untuk buang hajat.' Dan di dalam riwayat Abu Bakr di sebutkan dengan lafazh Yafra'u (tubuhnya tinggi). Abu Bakr di dalam Hadits menambahkan, Hisyam berkata; yaitu Al Barraz. Dan telah menceritakannya kepada kami [Abu Kuraib]; Telah menceritakan kepada kami [Ibnu Numair]; Telah menceritakan kepada kami [Hisyam] melalui jalur ini, dan dia berkata; 'Dia adalah seorang wanita yang tinggi tubuhnya di antara yang lainnya. Dia juga berkata; 'Pada saat itu Rasulullah shallallahu 'alaihi wasallam sedang makan malam.' Dan telah menceritakannya kepadaku [Suwaid bin Sa'id]; Telah menceritakan kepada kami ['Ali bin Mushir] dari [Hisyam] melalui jalur ini.","حَدَّثَنَا أَبُو بَكْرِ بْنُ أَبِي شَيْبَةَ وَأَبُو كُرَيْبٍ قَالَا حَدَّثَنَا أَبُو أُسَامَةَ عَنْ هِشَامٍ عَنْ أَبِيهِ عَنْ عَائِشَةَ قَالَتْ
خَرَجَتْ سَوْدَةُ بَعْدَ مَا ضُرِبَ عَلَيْهَا الْحِجَابُ لِتَقْضِيَ حَاجَتَهَا وَكَانَتْ امْرَأَةً جَسِيمَةً تَفْرَعُ النِّسَاءَ جِسْمًا لَا تَخْفَى عَلَى مَنْ يَعْرِفُهَا فَرَآهَا عُمَرُ بْنُ الْخَطَّابِ فَقَالَ يَا سَوْدَةُ وَاللَّهِ مَا تَخْفَيْنَ عَلَيْنَا فَانْظُرِي كَيْفَ تَخْرُجِينَ قَالَتْ فَانْكَفَأَتْ رَاجِعَةً وَرَسُولُ اللَّهِ صَلَّى اللَّهُ عَلَيْهِ وَسَلَّمَ فِي بَيْتِي وَإِنَّهُ لَيَتَعَشَّى وَفِي يَدِهِ عَرْقٌ فَدَخَلَتْ فَقَالَتْ يَا رَسُولَ اللَّهِ إِنِّي خَرَجْتُ فَقَالَ لِي عُمَرُ كَذَا وَكَذَا قَالَتْ فَأُوحِيَ إِلَيْهِ ثُمَّ رُفِعَ عَنْهُ وَإِنَّ الْعَرْقَ فِي يَدِهِ مَا وَضَعَهُ فَقَالَ إِنَّهُ قَدْ أُذِنَ لَكُنَّ أَنْ تَخْرُجْنَ لِحَاجَتِكُنَّ
وَفِي رِوَايَةِ أَبِي بَكْرٍ يَفْرَعُ النِّسَاءَ جِسْمُهَا زَادَ أَبُو بَكْرٍ فِي حَدِيثِهِ فَقَالَ هِشَامٌ يَعْنِي الْبَرَازَ و حَدَّثَنَاه أَبُو كُرَيْبٍ حَدَّثَنَا ابْنُ نُمَيْرٍ حَدَّثَنَا هِشَامٌ بِهَذَا الْإِسْنَادِ وَقَالَ وَكَانَتْ امْرَأَةً يَفْرَعُ النَّاسَ جِسْمُهَا قَالَ وَإِنَّهُ لَيَتَعَشَّى و حَدَّثَنِيهِ سُوَيْدُ بْنُ سَعِيدٍ حَدَّثَنَا عَلِيُّ بْنُ مُسْهِرٍ عَنْ هِشَامٍ بِهَذَا الْإِسْنَادِ",3
