haditsId,kitabId,indo,arab,label
4014,39,"Dan telah menceritakan kepadaku [Harmalah bin Yahya]; Telah mengabarkan kepada kami [Ibnu Wahb]; Telah mengabarkan kepadaku [Yunus] dari [Ibnu Syihab] bahwa [Sahl bin Sa'd Al Anshari]; Telah mengabarkan kepadanya; bahwa seorang laki-laki mengintip ke rumah Rasulullah shallallahu 'alaihi wasallam melalui lubang pintu. Ketika itu Rasulullah shallallahu 'alaihi wasallam sedang menyisir rambut dengan sebuah sisir besi. Maka Beliau berkata: ""Kalau aku tahu engkau mengintip, aku tusuk matamu. Sesunggunyah Allah mensyari'atkan Izin (memberi salam) demi menjaga pandangan."" Dan telah menceritakan kepada kami [Abu Bakr bin Abu Syaib ah], ['Amru An Naqid], [Zuhair bin Harb] dan [Ibnu Abu 'Umar] mereka berkata; Telah menceritakan kepada kami [Sufyan bin 'Uyainah]; Demikian juga diriwayatkan dari jalur lainnya, Dan telah menceritakan kepada kami [Abu Kamil Al Jahdari]; Telah menceritakan kepada kami ['Abdul Wahid bin Ziyad]; Telah menceritakan kepada kami [Ma'mar] keduanya dari [Az Zuhair] dari [Sahl bin Sa'd] dari Nabi shallallahu 'alaihi wasallam yang serupa dengan Hadits Al Laits dan Yunus.","و حَدَّثَنِي حَرْمَلَةُ بْنُ يَحْيَى أَخْبَرَنَا ابْنُ وَهْبٍ أَخْبَرَنِي يُونُسُ عَنْ ابْنِ شِهَابٍ أَنَّ سَهْلَ بْنَ سَعْدٍ الْأَنْصَارِيَّ أَخْبَرَهُ
أَنَّ رَجُلًا اطَّلَعَ مِنْ جُحْرٍ فِي بَابِ رَسُولِ اللَّهِ صَلَّى اللَّهُ عَلَيْهِ وَسَلَّمَ وَمَعَ رَسُولِ اللَّهِ صَلَّى اللَّهُ عَلَيْهِ وَسَلَّمَ مِدْرًى يُرَجِّلُ بِهِ رَأْسَهُ فَقَالَ لَهُ رَسُولُ اللَّهِ صَلَّى اللَّهُ عَلَيْهِ وَسَلَّمَ لَوْ أَعْلَمُ أَنَّكَ تَنْظُرُ طَعَنْتُ بِهِ فِي عَيْنِكَ إِنَّمَا جَعَلَ اللَّهُ الْإِذْنَ مِنْ أَجْلِ الْبَصَرِ
و حَدَّثَنَا أَبُو بَكْرِ بْنُ أَبِي شَيْبَةَ وَعَمْرٌو النَّاقِدُ وَزُهَيْرُ بْنُ حَرْبٍ وَابْنُ أَبِي عُمَرَ قَالُوا حَدَّثَنَا سُفْيَانُ بْنُ عُيَيْنَةَ ح و حَدَّثَنَا أَبُو كَامِلٍ الْجَحْدَرِيُّ حَدَّثَنَا عَبْدُ الْوَاحِدِ بْنُ زِيَادٍ حَدَّثَنَا مَعْمَرٌ كِلَاهُمَا عَنْ الزُّهْرِيِّ عَنْ سَهْلِ بْنِ سَعْدٍ عَنْ النَّبِيِّ صَلَّى اللَّهُ عَلَيْهِ وَسَلَّمَ نَحْوَ حَدِيثِ اللَّيْثِ وَيُونُسَ",66
4017,39,"Telah menceritakan kepada kami [Ibnu Abu 'Umar]; Telah menceritakan kepada kami [Sufyan] dari [Abu Az Ziyad] dari [Al A'raj] dari [Abu Hurairah] bahwa Rasulullah shallallahu 'alaihi wasallam telah bersabda: ""Seandainya seseorang mengintip ke dalam rumahmu tanpa izin, maka tidak berdosa bagaimu sekiranya kamu melempar dia dengan kerikil dan mencongkel matanya.""","حَدَّثَنَا ابْنُ أَبِي عُمَرَ حَدَّثَنَا سُفْيَانُ عَنْ أَبِي الزِّنَادِ عَنْ الْأَعْرَجِ عَنْ أَبِي هُرَيْرَةَ
أَنَّ رَسُولَ اللَّهِ صَلَّى اللَّهُ عَلَيْهِ وَسَلَّمَ قَالَ لَوْ أَنَّ رَجُلًا اطَّلَعَ عَلَيْكَ بِغَيْرِ إِذْنٍ فَخَذَفْتَهُ بِحَصَاةٍ فَفَقَأْتَ عَيْنَهُ مَا كَانَ عَلَيْكَ مِنْ جُنَاحٍ",66
4153,40,"Dan telah menceritakan kepadaku [Abu Ath Thahir]; Telah mengabarkan kepada kami [Ibnu Wahb]; Telah mengabarkan kepadaku [Ibnu Juraij]; Demikian juga diriwayatkan dari jalur lainnya, Dan telah menceritakan kepadaku [Muhammad bin Ahmad bin Abu Khalaf]; Telah menceritakan kepada kami [Rouh] Telah menceritakan kepada kami [Ibnu Juraij]; Demikian juga diriwayatkan dari jalur lainnya, Dan telah menceritakan kepada kami ['Abdu bin Humaid]; Telah mengabarkan kepada kami [Muhammad bin Bakr]; Telah mengabarkan kepada kami [Ibnu Juraij]; Telah mengabarkan kepadaku ['Abdul Humaid bin Jubair bin Syaibah] bahwa [Sa'id bin Al Musayyab] Telah mengabarkan kepadanya, [Ummu Syarik] Telah mengabarkan kepadanya, bahwa dia bertanya kepada Nabi shallallahu 'alaihi wasallam tentang membunuh cecak. Lalu Nabi shallallahu 'alaihi wasallam menyuruhnya agar dibunuh saja. Ummu Syarik adalah salah seorang wanita dari Bani Amir bin Luay. Lafazh Hadits Ibnu Abu Khalaf sama dengan lafazh Hadits Abad bin Humaid demikian juga Hadits Ibnu Wahab mirip dengan Hadits tersebut.","و حَدَّثَنِي أَبُو الطَّاهِرِ أَخْبَرَنَا ابْنُ وَهْبٍ أَخْبَرَنِي ابْنُ جُرَيْجٍ ح و حَدَّثَنِي مُحَمَّدُ بْنُ أَحْمَدَ بْنِ أَبِي خَلَفٍ حَدَّثَنَا رَوْحٌ حَدَّثَنَا ابْنُ جُرَيْجٍ ح و حَدَّثَنَا عَبْدُ بْنُ حُمَيْدٍ أَخْبَرَنَا مُحَمَّدُ بْنُ بَكْرٍ أَخْبَرَنَا ابْنُ جُرَيْجٍ أَخْبَرَنِي عَبْدُ الْحَمِيدِ بْنُ جُبَيْرِ بْنِ شَيْبَةَ أَنَّ سَعِيدَ بْنَ الْمُسَيَّبِ أَخْبَرَهُ أَنَّ أُمَّ شَرِيكٍ أَخْبَرَتْهُ
أَنَّهَا اسْتَأْمَرَتْ النَّبِيَّ صَلَّى اللَّهُ عَلَيْهِ وَسَلَّمَ فِي قَتْلِ الْوِزْغَانِ فَأَمَرَ بِقَتْلِهَا وَأُمُّ شَرِيكٍ إِحْدَى نِسَاءِ بَنِي عَامِرِ بْنِ لُؤَيٍّ اتَّفَقَ لَفْظُ حَدِيثِ ابْنِ أَبِي خَلَفٍ وَعَبْدِ بْنِ حُمَيْدٍ وَحَدِيثُ ابْنِ وَهْبٍ قَرِيبٌ مِنْهُ",66
4155,40,Dan telah menceritakan kepadaku [Abu Ath Thahir] dan [Harmalah] keduanya berkata; Telah mengabarkan kepada kami [Ibnu Wahb]; Telah mengabarkan kepadaku [Yunus] dari [Az Zuhri] dari ['Urwah] dari ['Aisyah] bahwa Rasulullah shallallahu 'alaihi wasallam menamai cecak dengan Fuwaisiq. Harmalah menambahkan; 'Dan aku belum mendengar beliau menyuruh untuk membunuhnya.',"و حَدَّثَنِي أَبُو الطَّاهِرِ وَحَرْمَلَةُ قَالَا أَخْبَرَنَا ابْنُ وَهْبٍ أَخْبَرَنِي يُونُسُ عَنْ الزُّهْرِيِّ عَنْ عُرْوَةَ عَنْ عَائِشَةَ
أَنَّ رَسُولَ اللَّهِ صَلَّى اللَّهُ عَلَيْهِ وَسَلَّمَ قَالَ لِلْوَزَغِ الْفُوَيْسِقُ
زَادَ حَرْمَلَةُ قَالَتْ وَلَمْ أَسْمَعْهُ أَمَرَ بِقَتْلِهِ",66
4431,45,"Telah menceritakan kepada kami [Muhammad bin 'Abbad]; Telah menceritakan kepada kami [Hatim] yaitu Ibnu Isma'il dari [Bukair bin Mismar] dari ['Amir bin Sa'ad] dari [Bapaknya] bahwa Nabi shallallahu 'alaihi wasallam Rasulullah shallallahu 'alaihi wasallam telah menggabungkan kedua orang tuanya sebagai tebusan baginya pada perang Uhud."" Saad bin Abi Waqqash berkata; ""Seorang laki-laki musyrik telah memanas-manasi kaum muslimin."" Kemudian Rasulullah shallallahu 'alaihi wasallam berkata kepada Sa'ad: ""Panahlah dia!"" Sa'ad berkata; Lalu saya membidiknya dengan sebuah anak panah tanpa mata panah yang tajam hingga tepat mengenai Iambungnya. kemudian orang tersebut tersungkur dan terbukalah auratnya. Melihat itu, Rasulullah tersenyum puas hingga terlihat gigi rahamnya.""","حَدَّثَنَا مُحَمَّدُ بْنُ عَبَّادٍ حَدَّثَنَا حَاتِمٌ يَعْنِي ابْنَ إِسْمَعِيلَ عَنْ بُكَيْرِ بْنِ مِسْمَارٍ عَنْ عَامِرِ بْنِ سَعْدٍ عَنْ أَبِيهِ
أَنَّ النَّبِيَّ صَلَّى اللَّهُ عَلَيْهِ وَسَلَّمَ جَمَعَ لَهُ أَبَوَيْهِ يَوْمَ أُحُدٍ قَالَ كَانَ رَجُلٌ مِنْ الْمُشْرِكِينَ قَدْ أَحْرَقَ الْمُسْلِمِينَ فَقَالَ لَهُ النَّبِيُّ صَلَّى اللَّهُ عَلَيْهِ وَسَلَّمَ ارْمِ فِدَاكَ أَبِي وَأُمِّي قَالَ فَنَزَعْتُ لَهُ بِسَهْمٍ لَيْسَ فِيهِ نَصْلٌ فَأَصَبْتُ جَنْبَهُ فَسَقَطَ فَانْكَشَفَتْ عَوْرَتُهُ فَضَحِكَ رَسُولُ اللَّهِ صَلَّى اللَّهُ عَلَيْهِ وَسَلَّمَ حَتَّى نَظَرْتُ إِلَى نَوَاجِذِهِ",66
5033,52,"Telah menceritakan kepadaku [Salamah bin Syabib] telah menceritakan kepada kami [Al Hasan bin A'yan] telah menceritakan kepada kami [Ma'qil] dari [Abu Az Zubair] dari [Jabir] ia mendengar nabi Shallallahu 'alaihi wa Salam bersabda: ""Setan mengutus bala tentaranya lalu mereka menggoda manusia. Yang paling agung bagi iblis adalah (setan) yang paling besar godaannya.""","حَدَّثَنِي سَلَمَةُ بْنُ شَبِيبٍ حَدَّثَنَا الْحَسَنُ بْنُ أَعْيَنَ حَدَّثَنَا مَعْقِلٌ عَنْ أَبِي الزُّبَيْرِ عَنْ جَابِرٍ أَنَّهُ
سَمِعَ النَّبِيَّ صَلَّى اللَّهُ عَلَيْهِ وَسَلَّمَ يَقُولُ يَبْعَثُ الشَّيْطَانُ سَرَايَاهُ فَيَفْتِنُونَ النَّاسَ فَأَعْظَمُهُمْ عِنْدَهُ مَنْزِلَةً أَعْظَمُهُمْ فِتْنَةً",66
5114,53,"Telah menceritakan kepada kami [Abu Bakr bin Abu Syaibah] telah menceritakan kepada kami [Waki']. Telah menceritakan kepada kami [Ubaidullah bin Mu'adz] telah menceritakan kepada kami [ayahku]. Telah menceritakan kepada kami [Muhammad bin Al Mutsanna] dan [Ibnu Basyar] keduanya berkata: Telah menceritakan kepada kami [Muhammad bin Ja'far], semuanya dari [Syu'bah] dari [Aun bin Abu Juhaifah]. Telah menceritakan kepadaku [Zuhair bin Harb], [Muhammad bin Al Mutsanna] dan [Ibnu Basyar], semuanya dari [Yahya Al Qaththan] dan teksnya milik Zuhair, telah menceritakan kepada kami [Yahya bin Sa'id] telah menceritakan kepada kami [Syu'bah] telah menceritakan kepadaku [Aun bin Abu Juhaifah] dari [ayahnya] dari [Al Bara`] dari [Abu Ayyub] berkata: Rasulullah Shallallahu 'alaihi wa Salam pergi setelah matahari terbenam lalu beliau mendengar suara, beliau bersabda: ""Orang-orang Yahudi disiksa dikuburnya.""","حَدَّثَنَا أَبُو بَكْرِ بْنُ أَبِي شَيْبَةَ حَدَّثَنَا وَكِيعٌ ح و حَدَّثَنَا عُبَيْدُ اللَّهِ بْنُ مُعَاذٍ حَدَّثَنَا أَبِي ح و حَدَّثَنَا مُحَمَّدُ بْنُ الْمُثَنَّى وَابْنُ بَشَّارٍ قَالَا حَدَّثَنَا مُحَمَّدُ بْنُ جَعْفَرٍ كُلُّهُمْ عَنْ شُعْبَةَ عَنْ عَوْنِ بْنِ أَبِي جُحَيْفَةَ ح و حَدَّثَنِي زُهَيْرُ بْنُ حَرْبٍ وَمُحَمَّدُ بْنُ الْمُثَنَّى وَابْنُ بَشَّارٍ جَمِيعًا عَنْ يَحْيَى الْقَطَّانِ وَاللَّفْظُ لِزُهَيْرٍ حَدَّثَنَا يَحْيَى بْنُ سَعِيدٍ حَدَّثَنَا شُعْبَةُ حَدَّثَنِي عَوْنُ بْنُ أَبِي جُحَيْفَةَ عَنْ أَبِيهِ عَنْ الْبَرَاءِ عَنْ أَبِي أَيُّوبَ قَالَ
خَرَجَ رَسُولُ اللَّهِ صَلَّى اللَّهُ عَلَيْهِ وَسَلَّمَ بَعْدَ مَا غَرَبَتْ الشَّمْسُ فَسَمِعَ صَوْتًا فَقَالَ يَهُودُ تُعَذَّبُ فِي قُبُورِهَا",66
5123,53,"Telah menceritakan kepadaku [Abdurrahman bin Bisyr bin Al Hakam Al Abdi] telah menceritakan kepada kami [Yahya bin Sa'id Al Qaththan] telah menceritakan kepada kami [Abu Yunus Al Qusyairi] telah menceritakan kepada kami [Ibnu Abi Mulaikah] dari [Al Qasim] dari [Aisyah] dari nabi Shallallahu 'alaihi wa Salam bersabda: ""Tidaklah seseorang dihisab melaikan ia pasti binasa."" Aku bertanya: Wahai Rasulullah, bukankah Allah berfirman: ""Maka dia akan diperiksa dengan pemeriksaan yang mudah."" (Al Insyiqaaq: 8) beliau menjawab: ""Itu adalah pemeriksaan, tapi orang yang dibantah (saat) penghisaban, ia binasa."" Telah menceritakan kepadaku [Abdurrahman bin Bisyr] telah menceritakan kepadaku [Yahya Al Qaththan] dari [Utsman bin Al Aswad] dari [Ibnu Abi Mulaikah] dari [Aisyah] dari nabi Shallallahu 'alaihi wa Salam bersabda: ""Barangsiapa dibantah (saat) penghisaban, ia binasa."" Lalu ia menyebut seperti hadits Abu Yunus.","و حَدَّثَنِي عَبْدُ الرَّحْمَنِ بْنُ بِشْرِ بْنِ الْحَكَمِ الْعَبْدِيُّ حَدَّثَنَا يَحْيَى يَعْنِي ابْنَ سَعِيدٍ الْقَطَّانَ حَدَّثَنَا أَبُو يُونُسَ الْقُشَيْرِيُّ حَدَّثَنَا ابْنُ أَبِي مُلَيْكَةَ عَنْ الْقَاسِمِ عَنْ عَائِشَةَ
عَنْ النَّبِيِّ صَلَّى اللَّهُ عَلَيْهِ وَسَلَّمَ قَالَ لَيْسَ أَحَدٌ يُحَاسَبُ إِلَّا هَلَكَ قُلْتُ يَا رَسُولَ اللَّهِ أَلَيْسَ اللَّهُ يَقُولُ
{ حِسَابًا يَسِيرًا }
قَالَ ذَاكِ الْعَرْضُ وَلَكِنْ مَنْ نُوقِشَ الْحِسَابَ هَلَكَ
و حَدَّثَنِي عَبْدُ الرَّحْمَنِ بْنُ بِشْرٍ حَدَّثَنِي يَحْيَى وَهُوَ الْقَطَّانُ عَنْ عُثْمَانَ بْنِ الْأَسْوَدِ عَنْ ابْنِ أَبِي مُلَيْكَةَ عَنْ عَائِشَةَ عَنْ النَّبِيِّ صَلَّى اللَّهُ عَلَيْهِ وَسَلَّمَ قَالَ مَنْ نُوقِشَ الْحِسَابَ هَلَكَ ثُمَّ ذَكَرَ بِمِثْلِ حَدِيثِ أَبِي يُونُسَ",66
5139,54,"Telah menceritakan kepadaku [Abu Kamil Fudhail bin Husain Al Jahdari] telah menceritakan kepada kami [Hammad bin Zaid] dari [Ayyub] dan [Yunus] dari [Al Hasan] dari [Al Ahnaf bin Qais] berkata: Aku pergi untuk menemui orang ini lalu [Abu Bakrah] menemuiku, ia bertanya: Kamu mau kemana wahai Ahnaf? Aku menjawab: Aku hendak menemui Nashr putra paman Rasulullah Shallallahu 'alaihi wa Salam -maksudnya Ali. Lalu ia berkata: Wahai Ahnaf, kembalilah karena aku pernah mendengar Rasulullah Shallallahu 'alaihi wa Salam bersabda: ""Bila dua orang muslim berhadapan dengan pedang, pembunuh dan yang terbunuh ada dineraka."" Aku berkata: Atau dikatakan: Wahai Rasulullah, ia yang membunuh (pantas masuk neraka), lalu bagaimana dengan yang terbunuh? Beliau menjawab: ""Sesungguhnya ia ingin membunuh kawannya."" ","حَدَّثَنِي أَبُو كَامِلٍ فُضَيْلُ بْنُ حُسَيْنٍ الْجَحْدَرِيُّ حَدَّثَنَا حَمَّادُ بْنُ زَيْدٍ عَنْ أَيُّوبَ وَيُونُسَ عَنْ الْحَسَنِ عَنْ الْأَحْنَفِ بْنِ قَيْسٍ قَالَ خَرَجْتُ وَأَنَا أُرِيدُ هَذَا الرَّجُلَ فَلَقِيَنِي أَبُو بَكْرَةَ فَقَالَ أَيْنَ تُرِيدُ يَا أَحْنَفُ قَالَ قُلْتُ أُرِيدُ نَصْرَ ابْنِ عَمِّ رَسُولِ اللَّهِ صَلَّى اللَّهُ عَلَيْهِ وَسَلَّمَ يَعْنِي عَلِيًّا قَالَ فَقَالَ لِي يَا أَحْنَفُ ارْجِعْ فَإِنِّي
سَمِعْتُ رَسُولَ اللَّهِ صَلَّى اللَّهُ عَلَيْهِ وَسَلَّمَ يَقُولُ إِذَا تَوَاجَهَ الْمُسْلِمَانِ بِسَيْفَيْهِمَا فَالْقَاتِلُ وَالْمَقْتُولُ فِي النَّارِ قَالَ فَقُلْتُ أَوْ قِيلَ يَا رَسُولَ اللَّهِ هَذَا الْقَاتِلُ فَمَا بَالُ الْمَقْتُولِ قَالَ إِنَّهُ قَدْ أَرَادَ قَتْلَ صَاحِبِهِ",66
5140,54,"Telah menceritakannya kepada kami [Ahmad bin Abdah Adh Dhabi] telah menceritakan kepada kami [Hammad] dari [Ayyub], [Yunus] dan [Al Mu'ala bin Ziyad] dari [Al Hasan] dari [Al Ahnaf bin Qais] dari [Abu Bakrah] berkata: Rasulullah Shallallahu 'alaihi wa Salam bersabda: "" Bila dua orang muslim berhadapan dengan pedang, pembunuh dan yang terbunuh ada dineraka."" Telah menceritakan kepadaku [Hajjaj bin Asy Sya'ir] telah menceritakan kepada kami [Abdurrazzaq] dari kitabnya, telah mengkhabarkan kepada kami [Ma'mar] dari [Ayyub] dengan sanad ini seperti hadits Abu Kamil dari Hammad hingga akhir.","و حَدَّثَنَاه أَحْمَدُ بْنُ عَبْدَةَ الضَّبِّيُّ حَدَّثَنَا حَمَّادٌ عَنْ أَيُّوبَ وَيُونُسَ وَالْمُعَلَّى بْنِ زِيَادٍ عَنْ الْحَسَنِ عَنْ الْأَحْنَفِ بْنِ قَيْسٍ عَنْ أَبِي بَكْرَةَ قَالَ
قَالَ رَسُولُ اللَّهِ صَلَّى اللَّهُ عَلَيْهِ وَسَلَّمَ إِذَا الْتَقَى الْمُسْلِمَانِ بِسَيْفَيْهِمَا فَالْقَاتِلُ وَالْمَقْتُولُ فِي النَّارِ
و حَدَّثَنِي حَجَّاجُ بْنُ الشَّاعِرِ حَدَّثَنَا عَبْدُ الرَّزَّاقِ مِنْ كِتَابِهِ أَخْبَرَنَا مَعْمَرٌ عَنْ أَيُّوبَ بِهَذَا الْإِسْنَادِ نَحْوَ حَدِيثِ أَبِي كَامِلٍ عَنْ حَمَّادٍ إِلَى آخِرِهِ",66
5177,54,"Telah menceritakan kepada kami [Ibnu Abi Umar Al Makki] telah menceritakan kepada kami [Marwan] dari [Yazid bin Kaisan] dari [Abu Hazim] dari [Abu Hurairah] berkata: Nabi Shallallahu 'alaihi wa Salam bersabda: ""Sungguh akan datang suatu zaman dimana orang yang membunuh tidak mengerti karena alasan apa ia membunuh dan orang yang terbunuh juga tidak mengerti atas dasar apa ia dibunuh.""","و حَدَّثَنَا ابْنُ أَبِي عُمَرَ الْمَكِّيُّ حَدَّثَنَا مَرْوَانُ عَنْ يَزِيدَ وَهُوَ ابْنُ كَيْسَانَ عَنْ أَبِي حَازِمٍ عَنْ أَبِي هُرَيْرَةَ قَالَ
قَالَ النَّبِيُّ صَلَّى اللَّهُ عَلَيْهِ وَسَلَّمَ وَالَّذِي نَفْسِي بِيَدِهِ لَيَأْتِيَنَّ عَلَى النَّاسِ زَمَانٌ لَا يَدْرِي الْقَاتِلُ فِي أَيِّ شَيْءٍ قَتَلَ وَلَا يَدْرِي الْمَقْتُولُ عَلَى أَيِّ شَيْءٍ قُتِلَ",66
5200,54,"Telah menceritakan kepada kami [Abu Bakr bin Abu Syaibah] telah menceritakan kepada kami [Muhammad bin Bisyr] telah menceritakan kepada kami [Ubaidullah] dari [Nafi'] dari [Ibnu Umar] dari nabi Shallallahu 'alaihi wa Salam bersabda: ""Kalian akan memerangi Yahudi dan kalian akan membunuh mereka hingga batu berkata: 'Hai Muslim, ini orang Yahudi, kemarilah lalu bunuhlah'."" Telah menceritakannya kepada kami [Muhammad bin Al Mutsanna] dan [Ubaidullah bin Sa'id], keduanya berkata: Telah menceritakan kepada kami [Yahya] dari [Ubaidullah] dengan sanad ini. ia berkata dalam haditsnya: ""Ini orang Yahudi dibelakangku.""","حَدَّثَنَا أَبُو بَكْرِ بْنُ أَبِي شَيْبَةَ حَدَّثَنَا مُحَمَّدُ بْنُ بِشْرٍ حَدَّثَنَا عُبَيْدُ اللَّهِ عَنْ نَافِعٍ عَنْ ابْنِ عُمَرَ
عَنْ النَّبِيِّ صَلَّى اللَّهُ عَلَيْهِ وَسَلَّمَ قَالَ لَتُقَاتِلُنَّ الْيَهُودَ فَلَتَقْتُلُنَّهُمْ حَتَّى يَقُولَ الْحَجَرُ يَا مُسْلِمُ هَذَا يَهُودِيٌّ فَتَعَالَ فَاقْتُلْهُ
و حَدَّثَنَاه مُحَمَّدُ بْنُ الْمُثَنَّى وَعُبَيْدُ اللَّهِ بْنُ سَعِيدٍ قَالَا حَدَّثَنَا يَحْيَى عَنْ عُبَيْدِ اللَّهِ بِهَذَا الْإِسْنَادِ وَقَالَ فِي حَدِيثِهِ هَذَا يَهُودِيٌّ وَرَائِي",66
5203,54,"Telah menceritakan kepada kami [Qutaibah bin Sa'id] telah menceritakan kepada kami [Ya'qub bin Abdurrahman] dari [Suhail] dari [ayahnya] dari [Abu Hurairah] Rasulullah Shallallahu 'alaihi wa Salam bersabda: ""Kiamat tidak terjadi hingga kaum muslimin memerangi Yahudi lalu kaum muslimin membunuh mereka hingga orang Yahudi bersembunyi dibalik batu dan pohon, batu atau pohon berkata, 'Hai Muslim, hai hamba Allah, ini orang Yahudi dibelakangku, kemarilah, bunuhlah dia, ' kecuali pohon gharqad, ia adalah pohon Yahudi'.""","حَدَّثَنَا قُتَيْبَةُ بْنُ سَعِيدٍ حَدَّثَنَا يَعْقُوبُ يَعْنِي ابْنَ عَبْدِ الرَّحْمَنِ عَنْ سُهَيْلٍ عَنْ أَبِيهِ عَنْ أَبِي هُرَيْرَةَ
أَنَّ رَسُولَ اللَّهِ صَلَّى اللَّهُ عَلَيْهِ وَسَلَّمَ قَالَ لَا تَقُومُ السَّاعَةُ حَتَّى يُقَاتِلَ الْمُسْلِمُونَ الْيَهُودَ فَيَقْتُلُهُمْ الْمُسْلِمُونَ حَتَّى يَخْتَبِئَ الْيَهُودِيُّ مِنْ وَرَاءِ الْحَجَرِ وَالشَّجَرِ فَيَقُولُ الْحَجَرُ أَوْ الشَّجَرُ يَا مُسْلِمُ يَا عَبْدَ اللَّهِ هَذَا يَهُودِيٌّ خَلْفِي فَتَعَالَ فَاقْتُلْهُ إِلَّا الْغَرْقَدَ فَإِنَّهُ مِنْ شَجَرِ الْيَهُودِ",66
