haditsId,kitabId,indo,arab,label
3181,29,"Telah menceritakan kepada kami ['Ubaidullah bin Mu'adz Al 'Anbari] telah menceritakan kepada kami [Ayahku] telah menceritakan kepada kami [Abu Yunus] dari [Simak bin Harb] bahwa ['Alqamah bin Wa`il] telah menceritakan kepadanya, bahwa [Ayahnya] pernah menceritakan kepadanya, dia berkata, ""Ketika aku duduk bersama Nabi shallallahu 'alaihi wasallam, tiba-tiba datanglah seorang lelaki dengan menarik orang lain dengan seutas tali seraya berkata, ""Wahai Rasulullah, orang ini telah membunuh saudaraku!"" Rasulullah shallallahu 'alaihi wasallam bertanya kepadanya: ""Benarkah kau telah membunuhnya?"" laki-laki yang membawanya berkata, ""Sungguh jika dia tidak mengaku, maka aku akan mendatangkan bukti-bukti atas perbuatannya."" Orang yang telah membunuhnya menjawab, ""Ya, aku telah membunuhnya."" Beliau bertanya lagi: ""Mengapa kamu membunuhnya?"" Dia menjawab, ""Ketika aku dan dia sedang memetik dedaunan dari pohon, dia memakiku dan membuatku marah hingga aku memukulkan kapakku ke lehernya hingga tewas."" Nabi shallallahu 'alaihi wasallam bersabda kepadanya: ""Apakah kamu mempunyai sesuatu untuk menebus dirimu?"" dia menjawab: ""Aku tidak mempunyai harta kecuali hanya kapak dan baju yang melekat di tubuhku ini."" Beliau bersabda: ""Coba pikir lagi, mungkin kaummu mau membelimu?"" dia menjawab, ""Aku adalah orang yang paling hina di mata kaumku."" Lalu beliaupun melemparkan tali (yang dipakai untuk mengikatnya) seraya bersabda: ""Kalau begitu, terserah pada temanmu ini."" Lalu lelaki yang telah melaporkannya pergi dengan membawa orang yang membunuh saudaranya. Ketika dia telah pergi, Rasulullah shallallahu 'alaihi wasallam bersabda: ""Jika dia membunuhnya, berarti dia sama seperti si pembunuh."" Lalu laki-laki itu kembali dan berkata: ""Wahai Rasulullah, sungguh telah sampai kepadaku bahwa anda telah mengatakan: 'Jika ia membunuhnya berarti ia sama seperti dia (si pembunuh)? padahal aku membawanya juga atas perintahmu."" Rasulullah shallallahu 'alaihi wasallam bersabda: ""Tidakkah kamu menginginkan dia menanggung dosamu dan dosanya saudaramu?"" Dia menjawab, ""Wahai Nabi Allah -sepertinya ia menjawab-, tentu."" Dia berkata, ""Perbuatan itu sama dengan perbuatan itu."" Ayah 'Alqamah berkata, ""Akhirnya lelaki itu melempar tali (yang dipakai untuk mengikat si pembunuh) dan membiarkannya pergi.""","حَدَّثَنَا عُبَيْدُ اللَّهِ بْنُ مُعَاذٍ الْعَنْبَرِيُّ حَدَّثَنَا أَبِي حَدَّثَنَا أَبُو يُونُسَ عَنْ سِمَاكِ بْنِ حَرْبٍ أَنَّ عَلْقَمَةَ بْنَ وَائِلٍ حَدَّثَهُ أَنَّ أَبَاهُ حَدَّثَهُ قَالَ
إِنِّي لَقَاعِدٌ مَعَ النَّبِيِّ صَلَّى اللَّهُ عَلَيْهِ وَسَلَّمَ إِذْ جَاءَ رَجُلٌ يَقُودُ آخَرَ بِنِسْعَةٍ فَقَالَ يَا رَسُولَ اللَّهِ هَذَا قَتَلَ أَخِي فَقَالَ رَسُولُ اللَّهِ صَلَّى اللَّهُ عَلَيْهِ وَسَلَّمَ أَقَتَلْتَهُ فَقَالَ إِنَّهُ لَوْ لَمْ يَعْتَرِفْ أَقَمْتُ عَلَيْهِ الْبَيِّنَةَ قَالَ نَعَمْ قَتَلْتَهُ قَالَ كَيْفَ قَتَلْتَهُ قَالَ كُنْتُ أَنَا وَهُوَ نَخْتَبِطُ مِنْ شَجَرَةٍ فَسَبَّنِي فَأَغْضَبَنِي فَضَرَبْتُهُ بِالْفَأْسِ عَلَى قَرْنِهِ فَقَتَلْتُهُ فَقَالَ لَهُ النَّبِيُّ صَلَّى اللَّهُ عَلَيْهِ وَسَلَّمَ هَلْ لَكَ مِنْ شَيْءٍ تُؤَدِّيهِ عَنْ نَفْسِكَ قَالَ مَا لِي مَالٌ إِلَّا كِسَائِي وَفَأْسِي قَالَ فَتَرَى قَوْمَكَ يَشْتَرُونَكَ قَالَ أَنَا أَهْوَنُ عَلَى قَوْمِي مِنْ ذَاكَ فَرَمَى إِلَيْهِ بِنِسْعَتِهِ وَقَالَ دُونَكَ صَاحِبَكَ فَانْطَلَقَ بِهِ الرَّجُلُ فَلَمَّا وَلَّى قَالَ رَسُولُ اللَّهِ صَلَّى اللَّهُ عَلَيْهِ وَسَلَّمَ إِنْ قَتَلَهُ فَهُوَ مِثْلُهُ فَرَجَعَ فَقَالَ يَا رَسُولَ اللَّهِ إِنَّهُ بَلَغَنِي أَنَّكَ قُلْتَ إِنْ قَتَلَهُ فَهُوَ مِثْلُهُ وَأَخَذْتُهُ بِأَمْرِكَ فَقَالَ رَسُولُ اللَّهِ صَلَّى اللَّهُ عَلَيْهِ وَسَلَّمَ أَمَا تُرِيدُ أَنْ يَبُوءَ بِإِثْمِكَ وَإِثْمِ صَاحِبِكَ قَالَ يَا نَبِيَّ اللَّهِ لَعَلَّهُ قَالَ بَلَى قَالَ فَإِنَّ ذَاكَ كَذَاكَ قَالَ فَرَمَى بِنِسْعَتِهِ وَخَلَّى سَبِيلَهُ",66
3182,29,"Telah menceritakan kepadaku [Muhammad bin Hatim] telah menceritakan kepada kami [Sa'id bin Sulaiman] telah menceritakan kepada kami [Husyaim] telah menceritakan kepada kami [Isma'il bin Salim] dari ['Alqamah bin Wa`il] dari [Ayahnya] dia berkata, ""Pernah dihadapkan kepada Rasulullah shallallahu 'alaihi wasallam seorang laki-laki yang telah membunuh laki-laki lain, lalu walinya orang yang terbunuh itu membawa pembunuh tersebut dengan mengikatkan tali di lehernya. Ketika dia pergi Rasulullah shallallahu 'alaihi wasallam bersabda: ""Orang yang membunuh dan terbunuh, kedua-duanya berada dalam neraka."" Lalu seseorang pergi menemui laki-laki yang membawa pembunuh saudaranya itu sambil mengatakan apa yang dikatakan Rasulullah shallallahu 'alaihi wasallam, lantas wali korban membiarkan si pembunuh pergi."" [Isma'il bin Salim] berkata; kemudian aku menyebutkan hal itu kepada [Habib bin Abu Tsabit] katanya; telah menceritakan kepadaku [Ibnu Asywa'], bahwa Nabi shallallahu 'alaihi wasallam pernah meminta kepadanya untuk memaafkan (pembunuh itu), namun dia enggan.""","و حَدَّثَنِي مُحَمَّدُ بْنُ حَاتِمٍ حَدَّثَنَا سَعِيدُ بْنُ سُلَيْمَانَ حَدَّثَنَا هُشَيْمٌ أَخْبَرَنَا إِسْمَعِيلُ بْنُ سَالِمٍ عَنْ عَلْقَمَةَ بْنِ وَائِلٍ عَنْ أَبِيهِ قَالَ
أُتِيَ رَسُولُ اللَّهِ صَلَّى اللَّهُ عَلَيْهِ وَسَلَّمَ بِرَجُلٍ قَتَلَ رَجُلًا فَأَقَادَ وَلِيَّ الْمَقْتُولِ مِنْهُ فَانْطَلَقَ بِهِ وَفِي عُنُقِهِ نِسْعَةٌ يَجُرُّهَا فَلَمَّا أَدْبَرَ قَالَ رَسُولُ اللَّهِ صَلَّى اللَّهُ عَلَيْهِ وَسَلَّمَ الْقَاتِلُ وَالْمَقْتُولُ فِي النَّارِ فَأَتَى رَجُلٌ الرَّجُلَ فَقَالَ لَهُ مَقَالَةَ رَسُولِ اللَّهِ صَلَّى اللَّهُ عَلَيْهِ وَسَلَّمَ فَخَلَّى عَنْهُ
قَالَ إِسْمَعِيلُ بْنُ سَالِمٍ فَذَكَرْتُ ذَلِكَ لِحَبِيبِ بْنِ أَبِي ثَابِتٍ فَقَالَ حَدَّثَنِي ابْنُ أَشْوَعَ أَنَّ النَّبِيَّ صَلَّى اللَّهُ عَلَيْهِ وَسَلَّمَ إِنَّمَا سَأَلَهُ أَنْ يَعْفُوَ عَنْهُ فَأَبَى",66
3185,29,"Telah menceritakan kepadaku [Abu At Thahir] telah menceritakan kepada kami [Ibnu Wahb]. (dalam jalur lain disebutkan) Telah menceritakan kepada kami [Harmalah bin Yahya At Tajibi] telah menceritakan kepada kami [Ibnu Wahb] telah menceritakan kepadaku [Yunus] dari [Ibnu Syihab] dari [Ibnu Musayyab] dan [Abu Salamah bin Abdurrahman] bahwa [Abu Hurairah] berkata, ""Dua wanita Bani Hudzail sedang berkelahi, yang satu melempar lawannya dengan batu sehingga menyebabkan kamatiannya dan kematian anak yang dikandungnya. Lalu mereka mengadukan peristiwa itu kepada Rasulullah shallallahu 'alaihi wasallam. Beliau lalu memberi putusan bahwa denda bagi janin tersebut adalah membebaskan seorang budak yang mahal, baik itu budak laki-laki atau perempuan. Sementara tebusan untuk wanita (terbunuh) dibebankan kepada kerabat terdekat wanita (si pembunuh). Dan menetapkan bahwa harta warisan (wanita yang membunuh) untuk anak-anaknya dan orang yang bersama mereka."" Hamal bin Nabighah Al Hudzali berkata, ""Ya Rasulullah, bagaimana aku harus menanggung orang yang belum bisa makan dan minum, bahkan belum bisa berbicara ataupun menjerit sama sekali? Bukankah itu sebuah kesia-siaan belaka?"" Mendegar hal itu Rasulullah shallallahu 'alaihi wasallam pun bersabda: ""Hanyasanya ini seperti saudara-saudaranya setan, karena sajak yang ia ucapkan."" Dan telah menceritakan kepada kami [Abd bin Humaid] telah mengabarkan kepada kami [Abdurrazaq] telah mengabarkan kepada kami [Ma'mar] dari [Az Zuhri] dari [Abu Salamah] dari [Abu Hurairah] dia berkata, ""Dua wanita Yahudi sedang berkelahi…lalu dia menyebutkan redaksi haditsnya, namun dia tidak menyebutkan, ""Dan menetapkan bahwa harta warisan (wanita yang membunuh) untuk anak-anaknya dan orang yang bersama mereka."" Perawi berkata, ""Maka ada seseorang yang bertanya, ""Bagaimana mungkin kami bisa mengetahuinya padahal ia tidak dinamakan Haml bin Malik.""","و حَدَّثَنِي أَبُو الطَّاهِرِ حَدَّثَنَا ابْنُ وَهْبٍ ح و حَدَّثَنَا حَرْمَلَةُ بْنُ يَحْيَى التُّجِيبِيُّ أَخْبَرَنَا ابْنُ وَهْبٍ أَخْبَرَنِي يُونُسُ عَنْ ابْنِ شِهَابٍ عَنْ ابْنِ الْمُسَيَّبِ وَأَبِي سَلَمَةَ بْنِ عَبْدِ الرَّحْمَنِ أَنَّ أَبَا هُرَيْرَةَ قَالَ
اقْتَتَلَتْ امْرَأَتَانِ مِنْ هُذَيْلٍ فَرَمَتْ إِحْدَاهُمَا الْأُخْرَى بِحَجَرٍ فَقَتَلَتْهَا وَمَا فِي بَطْنِهَا فَاخْتَصَمُوا إِلَى رَسُولِ اللَّهِ صَلَّى اللَّهُ عَلَيْهِ وَسَلَّمَ فَقَضَى رَسُولُ اللَّهِ صَلَّى اللَّهُ عَلَيْهِ وَسَلَّمَ أَنَّ دِيَةَ جَنِينِهَا غُرَّةٌ عَبْدٌ أَوْ وَلِيدَةٌ وَقَضَى بِدِيَةِ الْمَرْأَةِ عَلَى عَاقِلَتِهَا وَوَرَّثَهَا وَلَدَهَا وَمَنْ مَعَهُمْ فَقَالَ حَمَلُ بْنُ النَّابِغَةِ الْهُذَلِيُّ يَا رَسُولَ اللَّهِ كَيْفَ أَغْرَمُ مَنْ لَا شَرِبَ وَلَا أَكَلَ وَلَا نَطَقَ وَلَا اسْتَهَلَّ فَمِثْلُ ذَلِكَ يُطَلُّ فَقَالَ رَسُولُ اللَّهِ صَلَّى اللَّهُ عَلَيْهِ وَسَلَّمَ إِنَّمَا هَذَا مِنْ إِخْوَانِ الْكُهَّانِ مِنْ أَجْلِ سَجْعِهِ الَّذِي سَجَعَ
و حَدَّثَنَا عَبْدُ بْنُ حُمَيْدٍ أَخْبَرَنَا عَبْدُ الرَّزَّاقِ أَخْبَرَنَا مَعْمَرٌ عَنْ الزُّهْرِيِّ عَنْ أَبِي سَلَمَةَ عَنْ أَبِي هُرَيْرَةَ قَالَ اقْتَتَلَتْ امْرَأَتَانِ وَسَاقَ الْحَدِيثَ بِقِصَّتِهِ وَلَمْ يَذْكُرْ وَوَرَّثَهَا وَلَدَهَا وَمَنْ مَعَهُمْ وَقَالَ فَقَالَ قَائِلٌ كَيْفَ نَعْقِلُ وَلَمْ يُسَمِّ حَمَلَ بْنَ مَالِكٍ",66
3377,33,"Telah menceritakan kepada kami [Abdullah bin Maslamah bin Qa'nab] telah menceritakan kepada kami [Sulaiman] -yaitu Ibnu Bilal- dari [Ja'far bin Muhammad] dari [ayahnya] dari [Yazid bin Hurmuz] bahwa Najdah pernah menulis surat kepada [Ibnu Abbas] dan menanyakan mengenai lima masalah. Ibnu Abbas berkata, ""Kalaulah aku tidak khawatir akan dianggap menyembunyikan ilmu, maka tidak akan kubalas suratnya."" (surat 'Abdah -red): ""Amma Ba'd, tolonglah kabarkan kepadaku, adakah kaum wanita yang pergi berperang bersama-sama dengan Rasulullah shallallahu 'alaihi wasallam? Apakah mereka juga diberi ghanimah? Apakah beliau membunuh anak-anak? Kapankah seorang anak tidak lagi dikatakan yatim? Dan untuk siapakah diberikan seperlima pembagian harta ghanimah?"" Ibnu Abbas membalas suratnya: ""Anda menanyakan kepadaku, apakah para wanita ikut berperang bersama-sama dengan Rasulullah shallallahu 'alaihi wasallam? Betul, beliau pergi berperang bersama dengan para wanita. Mereka bertugas mengobati pasukan yang terluka, dan mereka diberi harta ghanimah ala kadarnya, tetapi mereka tidak diberi jumlah tertentu. Dan sesungguhnya beliau tidak pernah membunuh anak-anak, oleh karena itu, tahanlah kalian dari membunuh anak-anak. Kamu menanyakan kepadaku, mengenai kapan masa habisnya keyatiman anak yatim? Demi Dzat yang memanjangkan umurku, ada orang yang telah tumbuh jenggotnya, namun dia masih lemah mengurus dirinya, lemah mengambil dirinya sendiri atau memberi kepada dirinya sendiri. Maka apabila dia sudah sanggup mengurus dirinya sendiri, mengambil apa yang baik bagi dirinya seperti halnya orang lain. Maka ketika itu dia habis masa keyatimannya. Dan anda menanyakan pula tentang untuk siapa seperlima harta ghanimah tersebut?, sesungguhnya kami pernah mengatakan, itu untuk kami (Bani Hasyim), namun keluarga kami keberatan atas kami."" Telah menceritakan kepada kami [Abu Bakar bin Abu Syaibah] dan [Ishaq bin Ibrahim] keduanya dari [Hatim bin Isma'il] dari [Ja'far bin Muhammad] dari [ayahnya] dari [Yazid bin Hurmuz] bahwa Najdah pernah menulis surat kepada [Ibnu Abbas] untuk menanyakan mengenai hal itu sebagaimana hadits Sulaiman bin Bilal, namun dalam hadits Hatim, Rasulullah shallallahu 'alaihi wasallam tidak pernah membunuh anak-anak, oleh karena itu janganlah kamu membunuh anak-anak, kecuali jika kamu mengetahui seorang anak tersebut ikut dalam berperang."" Dan Ishaq menyebutkan dalam haditsnya dari Hatim, bahwa 'Kamu dapat membedakan antara yang mukmin, kemudian kamu bunuh yang kafir dan tinggalkanlah yang mukmin'.""","حَدَّثَنَا عَبْدُ اللَّهِ بْنُ مَسْلَمَةَ بْنِ قَعْنَبٍ حَدَّثَنَا سُلَيْمَانُ يَعْنِي ابْنَ بِلَالٍ عَنْ جَعْفَرِ بْنِ مُحَمَّدٍ عَنْ أَبِيهِ عَنْ يَزِيدَ بْنِ هُرْمُزَ أَنَّ نَجْدَةَ كَتَبَ إِلَى ابْنِ عَبَّاسٍ يَسْأَلُهُ عَنْ خَمْسِ خِلَالٍ فَقَالَ ابْنُ عَبَّاسٍ لَوْلَا أَنْ أَكْتُمَ عِلْمًا مَا كَتَبْتُ إِلَيْهِ كَتَبَ إِلَيْهِ نَجْدَةُ أَمَّا بَعْدُ فَأَخْبِرْنِي
هَلْ كَانَ رَسُولُ اللَّهِ صَلَّى اللَّهُ عَلَيْهِ وَسَلَّمَ يَغْزُو بِالنِّسَاءِ وَهَلْ كَانَ يَضْرِبُ لَهُنَّ بِسَهْمٍ وَهَلْ كَانَ يَقْتُلُ الصِّبْيَانَ وَمَتَى يَنْقَضِي يُتْمُ الْيَتِيمِ وَعَنْ الْخُمْسِ لِمَنْ هُوَ فَكَتَبَ إِلَيْهِ ابْنُ عَبَّاسٍ كَتَبْتَ تَسْأَلُنِي هَلْ كَانَ رَسُولُ اللَّهِ صَلَّى اللَّهُ عَلَيْهِ وَسَلَّمَ يَغْزُو بِالنِّسَاءِ وَقَدْ كَانَ يَغْزُو بِهِنَّ فَيُدَاوِينَ الْجَرْحَى وَيُحْذَيْنَ مِنْ الْغَنِيمَةِ وَأَمَّا بِسَهْمٍ فَلَمْ يَضْرِبْ لَهُنَّ وَإِنَّ رَسُولَ اللَّهِ صَلَّى اللَّهُ عَلَيْهِ وَسَلَّمَ لَمْ يَكُنْ يَقْتُلُ الصِّبْيَانَ فَلَا تَقْتُلْ الصِّبْيَانَ وَكَتَبْتَ تَسْأَلُنِي مَتَى يَنْقَضِي يُتْمُ الْيَتِيمِ فَلَعَمْرِي إِنَّ الرَّجُلَ لَتَنْبُتُ لِحْيَتُهُ وَإِنَّهُ لَضَعِيفُ الْأَخْذِ لِنَفْسِهِ ضَعِيفُ الْعَطَاءِ مِنْهَا فَإِذَا أَخَذَ لِنَفْسِهِ مِنْ صَالِحِ مَا يَأْخُذُ النَّاسُ فَقَدْ ذَهَبَ عَنْهُ الْيُتْمُ وَكَتَبْتَ تَسْأَلُنِي عَنْ الْخُمْسِ لِمَنْ هُوَ وَإِنَّا كُنَّا نَقُولُ هُوَ لَنَا فَأَبَى عَلَيْنَا قَوْمُنَا ذَاكَ
حَدَّثَنَا أَبُو بَكْرِ بْنُ أَبِي شَيْبَةَ وَإِسْحَقُ بْنُ إِبْرَاهِيمَ كِلَاهُمَا عَنْ حَاتِمِ بْنِ إِسْمَعِيلَ عَنْ جَعْفَرِ بْنِ مُحَمَّدٍ عَنْ أَبِيهِ عَنْ يَزِيدَ بْنِ هُرْمُزَ أَنَّ نَجْدَةَ كَتَبَ إِلَى ابْنِ عَبَّاسٍ يَسْأَلُهُ عَنْ خِلَالٍ بِمِثْلِ حَدِيثِ سُلَيْمَانَ بْنِ بِلَالٍ غَيْرَ أَنَّ فِي حَدِيثِ حَاتِمٍ وَإِنَّ رَسُولَ اللَّهِ صَلَّى اللَّهُ عَلَيْهِ وَسَلَّمَ لَمْ يَكُنْ يَقْتُلُ الصِّبْيَانَ فَلَا تَقْتُلْ الصِّبْيَانَ إِلَّا أَنْ تَكُونَ تَعْلَمُ مَا عَلِمَ الْخَضِرُ مِنْ الصَّبِيِّ الَّذِي قَتَلَ وَزَادَ إِسْحَقُ فِي حَدِيثِهِ عَنْ حَاتِمٍ وَتُمَيِّزَ الْمُؤْمِنَ فَتَقْتُلَ الْكَافِرَ وَتَدَعَ الْمُؤْمِنَ",66
3504,34,"Telah menceritakan kepada kami [Muhammad bin Abu Umar Al Maki] telah menceritakan kepada kami [Sufyan] dari [Abu Az Zinad] dari [Al A'raj] dari [Abu Hurairah] bahwa Rasulullah shallallahu 'alaihi wasallam bersabda: ""Allah tertawa terhadap dua orang yang saling membunuh, dan kedua-duanya masuk surga."" Maka para sahabat bertanya; ""Bagaimana hal itu bisa terjadi wahai Rasulullah?"" beliau menjawab: ""Salah seorang darinya berperang di jalan Allah 'azza wajalla lalu dia mati syahid, kemudian Allah menerima taubat si pembunuh, lalu ia masuk Islam dan berperang di jalan Allah 'azza wajalla hingga mati syahid."" Dan telah menceritakan kepada kami [Abu Bakar bin Abu Syaibah] dan [Zuhair bin Harb] dan [Abu Kuraib] mereka berkata; telah menceritakan kepada kami [Waki'] dari [Sufyan] dari [Abu Az Zinad] dengan sanad seperti ini.""","حَدَّثَنَا مُحَمَّدُ بْنُ أَبِي عُمَرَ الْمَكِّيُّ حَدَّثَنَا سُفْيَانُ عَنْ أَبِي الزِّنَادِ عَنْ الْأَعْرَجِ عَنْ أَبِي هُرَيْرَةَ
أَنَّ رَسُولَ اللَّهِ صَلَّى اللَّهُ عَلَيْهِ وَسَلَّمَ قَالَ يَضْحَكُ اللَّهُ إِلَى رَجُلَيْنِ يَقْتُلُ أَحَدُهُمَا الْآخَرَ كِلَاهُمَا يَدْخُلُ الْجَنَّةَ فَقَالُوا كَيْفَ يَا رَسُولَ اللَّهِ قَالَ يُقَاتِلُ هَذَا فِي سَبِيلِ اللَّهِ عَزَّ وَجَلَّ فَيُسْتَشْهَدُ ثُمَّ يَتُوبُ اللَّهُ عَلَى الْقَاتِلِ فَيُسْلِمُ فَيُقَاتِلُ فِي سَبِيلِ اللَّهِ عَزَّ وَجَلَّ فَيُسْتَشْهَدُ
و حَدَّثَنَا أَبُو بَكْرِ بْنُ أَبِي شَيْبَةَ وَزُهَيْرُ بْنُ حَرْبٍ وَأَبُو كُرَيْبٍ قَالُوا حَدَّثَنَا وَكِيعٌ عَنْ سُفْيَانَ عَنْ أَبِي الزِّنَادِ بِهَذَا الْإِسْنَادِ مِثْلَهُ",66
3505,34,"Telah menceritakan kepada kami [Muhammad bin Rafi'] telah menceritakan kepada kami [Abdurrazaq] telah mengabarkan kepada kami [Ma'mar] dari [Hammam bin Munabbih] dia berkata; ini sebagaimana yang pernah diceritakan oleh [Abu Hurairah] kepada kami dari Rasulullah shallallahu 'alaihi wasallam, lalu dia menyebutkan beberapa hadits yang di antaranya adalah, ""Rasulullah shallallahu 'alaihi wasallam bersabda: ""Allah tertawa terhadap dua orang yang saling membunuh, namun keduanya masuk surga."" Para sahabat bertanya, ""Bagaimana hal itu bisa terjadi wahai Rasulullah?"" beliau menjawab: ""Seseorang terbunuh kemudian dia masuk surga, kemudian Allah menerima taubatnya si pembunuh dan menunjukinya untuk masuk Islam, setelah itu dia berjihad di jalan Allah dan akhirnya mati syahid.""","حَدَّثَنَا مُحَمَّدُ بْنُ رَافِعٍ حَدَّثَنَا عَبْدُ الرَّزَّاقِ أَخْبَرَنَا مَعْمَرٌ عَنْ هَمَّامِ بْنِ مُنَبِّهٍ قَالَ هَذَا مَا حَدَّثَنَا أَبُو هُرَيْرَةَ عَنْ رَسُولِ اللَّهِ صَلَّى اللَّهُ عَلَيْهِ وَسَلَّمَ فَذَكَرَ أَحَادِيثَ مِنْهَا
وَقَالَ رَسُولُ اللَّهِ صَلَّى اللَّهُ عَلَيْهِ وَسَلَّمَ يَضْحَكُ اللَّهُ لِرَجُلَيْنِ يَقْتُلُ أَحَدُهُمَا الْآخَرَ كِلَاهُمَا يَدْخُلُ الْجَنَّةَ قَالُوا كَيْفَ يَا رَسُولَ اللَّهِ قَالَ يُقْتَلُ هَذَا فَيَلِجُ الْجَنَّةَ ثُمَّ يَتُوبُ اللَّهُ عَلَى الْآخَرِ فَيَهْدِيهِ إِلَى الْإِسْلَامِ ثُمَّ يُجَاهِدُ فِي سَبِيلِ اللَّهِ فَيُسْتَشْهَدُ",66
3617,35,"Dan telah menceritakan kepada kami [Ubaidullah bin Mu'adz] telah menceritakan kepada kami [ayahku] telah menceritakan kepada kami [Syu'bah] dari ['Adi] dari [Sa'id bin Jubair] dari [Ibnu Abbas], bahwa Nabi shallallahu 'alaihi wasallam bersabda: ""Janganlah kalian mengambil sesuatu yang bernyawa sebagai sasaran (menembak)."" Dan telah menceritakan kepada kami [Muhammad bin Basysyar] telah menceritakan kepada kami [Muhammad bin Ja'far] dan [Abdurrahman bin Mahdi] dari [Syu'bah] dengan isnad seperti ini.""","و حَدَّثَنَا عُبَيْدُ اللَّهِ بْنُ مُعَاذٍ حَدَّثَنَا أَبِي حَدَّثَنَا شُعْبَةُ عَنْ عَدِيٍّ عَنْ سَعِيدِ بْنِ جُبَيْرٍ عَنْ ابْنِ عَبَّاسٍ
أَنَّ النَّبِيَّ صَلَّى اللَّهُ عَلَيْهِ وَسَلَّمَ قَالَ لَا تَتَّخِذُوا شَيْئًا فِيهِ الرُّوحُ غَرَضًا
و حَدَّثَنَاه مُحَمَّدُ بْنُ بَشَّارٍ حَدَّثَنَا مُحَمَّدُ بْنُ جَعْفَرٍ وَعَبْدُ الرَّحْمَنِ بْنُ مَهْدِيٍّ عَنْ شُعْبَةَ بِهَذَا الْإِسْنَادِ مِثْلَهُ",66
