haditsId,kitabId,indo,arab,label
532,4,"Dan telah menceritakan kepada kami [Zuhair bin Harb] telah menceritakan kepada kami [Yahya bin Sa'id] dari [Hisyam bin Urwah] telah mengabarkan kepadaku [Wahab bin Kaisan] dari [Muhammad bin Amru bin 'Atha'] dari [Ibnu Abbas] --lewat jalur periwayatan lain--, dan telah menceritakan kepada kami [az-Zuhri] dari [Ali bin Abdullah bin Abbas] dari [Ibnu Abbas] --lewat jalur periwayatan lain--, dan telah menceritakan kepada kami [Muhammad bin Ali] dari [bapaknya] dari [Ibnu Abbas] bahwa Nabi shallallahu 'alaihi wasallam makan pangkal atau daging, kemudian beliau shalat, dan tanpa berwudhu, dan beliau juga tidak menyentuh air.","و حَدَّثَنَا زُهَيْرُ بْنُ حَرْبٍ حَدَّثَنَا يَحْيَى بْنُ سَعِيدٍ عَنْ هِشَامِ بْنِ عُرْوَةَ أَخْبَرَنِي وَهْبُ بْنُ كَيْسَانَ عَنْ مُحَمَّدِ بْنِ عَمْرِو بْنِ عَطَاءٍ عَنْ ابْنِ عَبَّاسٍ ح و حَدَّثَنِي الزُّهْرِيُّ عَنْ عَلِيِّ بْنِ عَبْدِ اللَّهِ بْنِ عَبَّاسٍ عَنْ ابْنِ عَبَّاسٍ ح و حَدَّثَنِي مُحَمَّدُ بْنُ عَلِيٍّ عَنْ أَبِيهِ عَنْ ابْنِ عَبَّاسٍ
أَنَّ النَّبِيَّ صَلَّى اللَّهُ عَلَيْهِ وَسَلَّمَ أَكَلَ عَرْقًا أَوْ لَحْمًا ثُمَّ صَلَّى وَلَمْ يَتَوَضَّأْ وَلَمْ يَمَسَّ مَاءً",66
1766,13,"Dan telah menceritakan kepadaku [Muhammad bin Al Mutsanna] telah menceritakan kepada kami [Ibnu Abu Adi] dari [Sulaiman] dari [Abu Nadlrah] dari [Abu Sa'id] bahwa suatu ketika Nabi shallallahu 'alaihi wasallam menyebutkan suatu kaum yang akan muncul di tengah-tengah umatnya. Mereka keluar dari suatu kelompok manusia. Cirri-ciri mereka adalah berkepala botak. Beliau bersabda: ""Mereka adalah seburuk-buruk makhluk -atau dari kalangan seburuk-buruk makhluk- yang akan membunuh mereka adalah salah satu dari dua kelompok yang paling dekat dengan kebenaran."" Maka Nabi shallallahu 'alaihi wasallam memberikan permisalan bagi mereka -atau beliau mengungkapkan-: ""Seorang laki-laki melepas lemparan -atau- Al Gharadl (sasaran) lalu ia melihat pada ujung anak panahnya, namun ia tidak melihat sesuatu, dan ia melihat pada pangkal panahnya tidak juga melihat sesuatu. Lalu ia melihat pada Al Fuq (tempat tali busur), juga tidak melihat sesuatu."" Abu Sa'id berkata, ""Dan kalianlah yang membunuh mereka wahai penduduk Irak."" ","و حَدَّثَنِي مُحَمَّدُ بْنُ الْمُثَنَّى حَدَّثَنَا ابْنُ أَبِي عَدِيٍّ عَنْ سُلَيْمَانَ عَنْ أَبِي نَضْرَةَ عَنْ أَبِي سَعِيدٍ
أَنَّ النَّبِيَّ صَلَّى اللَّهُ عَلَيْهِ وَسَلَّمَ ذَكَرَ قَوْمًا يَكُونُونَ فِي أُمَّتِهِ يَخْرُجُونَ فِي فُرْقَةٍ مِنْ النَّاسِ سِيمَاهُمْ التَّحَالُقُ قَالَ هُمْ شَرُّ الْخَلْقِ أَوْ مِنْ أَشَرِّ الْخَلْقِ يَقْتُلُهُمْ أَدْنَى الطَّائِفَتَيْنِ إِلَى الْحَقِّ قَالَ فَضَرَبَ النَّبِيُّ صَلَّى اللَّهُ عَلَيْهِ وَسَلَّمَ لَهُمْ مَثَلًا أَوْ قَالَ قَوْلًا الرَّجُلُ يَرْمِي الرَّمِيَّةَ أَوْ قَالَ الْغَرَضَ فَيَنْظُرُ فِي النَّصْلِ فَلَا يَرَى بَصِيرَةً وَيَنْظُرُ فِي النَّضِيِّ فَلَا يَرَى بَصِيرَةً وَيَنْظُرُ فِي الْفُوقِ فَلَا يَرَى بَصِيرَةً
قَالَ قَالَ أَبُو سَعِيدٍ وَأَنْتُمْ قَتَلْتُمُوهُمْ يَا أَهْلَ الْعِرَاقِ",66
1770,13,"Telah menceritakan kepadaku [Ubaidullah Al Qawariri] telah menceritakan kepada kami [Muhammad bin Abdullah bin Zubair] telah menceritakan kepada kami [Sufyan] dari [Habib bin Abu Tsabit] dari [Adl Dlahah Al Misyraqi] dari [Abu Sa'id Al Khudri] dari Nabi shallallahu 'alaihi wasallam. yakni dalam hadits yang di dalamnya ia menyebutkan; Suatu kaum yang keluar dari berbagai kelompok, dan mereka akan dibunuh oleh salah satu dari dua kelompok yang paling dekat dengan kebenaran.","حَدَّثَنِي عُبَيْدُ اللَّهِ الْقَوَارِيرِيُّ حَدَّثَنَا مُحَمَّدُ بْنُ عَبْدِ اللَّهِ بْنِ الزُّبَيْرِ حَدَّثَنَا سُفْيَانُ عَنْ حَبِيبِ بْنِ أَبِي ثَابِتٍ عَنْ الضَّحَّاكِ الْمِشْرَقِيِّ عَنْ أَبِي سَعِيدٍ الْخُدْرِيِّ
عَنْ النَّبِيِّ صَلَّى اللَّهُ عَلَيْهِ وَسَلَّمَ فِي حَدِيثٍ ذَكَرَ فِيهِ قَوْمًا يَخْرُجُونَ عَلَى فُرْقَةٍ مُخْتَلِفَةٍ يَقْتُلُهُمْ أَقْرَبُ الطَّائِفَتَيْنِ مِنْ الْحَقِّ",66
2415,16,"Telah menceritakan kepadaku [Ishaq bin Manshur] telah mengabarkan kepada kami [Ubaidullah bin Musa] dari [Syaiban] dari [Yahya] telah mengabarkan kepadaku [Abu Salamah] bahwa ia mendengar [Abu Hurairah] berkata; Khuza'ah membunuh seorang laki-laki dari Bani Laits pada saat Fathu Makkah karena terbunuhnya seorang laki-laki dari mereka oleh Bani Laits. Maka peristiwa itu pun dikabarkan kepada Rasulullah shallallahu 'alaihi wasallam. beliau bergegas menaiki kendaraannya, kemudian menyampaikan khutbah seraya bersabda: "" Allah telah melindungi kota Makkah dari serangan tentara gajah serta memberi kekuatan kepada Rasul-Nya dan orang-orang beriman untuk mempertahankannya. Tidak seorang pun yang boleh berperang di negeri ini. Larangan itu telah ada sejak dahulu. Dan juga tidak dibolehkan bagi orang-orang yang sesudahku. Namun, hanya dikecualikan kepadaku untuk sesaat di siang hari. Dan pada waktu ini telah kembali menjadi haram. Tidak boleh dipotong pohon berdurinya, tidak boleh ditebang pepohonannya, dan jangan dipungut barang-barang yang hilang tercecer kecuali untuk diumumkan. Siapa yang anggota keluarganya terbunuh, dia mempunyai dua pilihan yang baik, yaitu; Menerima uang tebusan (diyat) atau atau meminta agar si pembunuh dibunuh."" Kemudian datanglah seorang laki-laki dari penduduk Yaman yang namanya Abu Syahin, ia berkata, ""Tuliskanlah untukku ya Rasulullah."" Maka beliau pun bersabda: ""Tuliskanlah untuk Abu Syahin."" Lalu seorang laki-laki dari Quraisy berkata, ""Kecuali Al Idzkhir, karena kami menggunakannya di rumah dan kuburan kami."" Maka Rasulullah shallallahu 'alaihi wasallam bersabda: ""Melainkan Al Idzkhir.""","حَدَّثَنِي إِسْحَقُ بْنُ مَنْصُورٍ أَخْبَرَنَا عُبَيْدُ اللَّهِ بْنُ مُوسَى عَنْ شَيْبَانَ عَنْ يَحْيَى أَخْبَرَنِي أَبُو سَلَمَةَ أَنَّهُ سَمِعَ أَبَا هُرَيْرَةَ يَقُولُا
إِنَّ خُزَاعَةَ قَتَلُوا رَجُلًا مِنْ بَنِي لَيْثٍ عَامَ فَتْحِ مَكَّةَ بِقَتِيلٍ مِنْهُمْ قَتَلُوهُ فَأُخْبِرَ بِذَلِكَ رَسُولُ اللَّهِ صَلَّى اللَّهُ عَلَيْهِ وَسَلَّمَ فَرَكِبَ رَاحِلَتَهُ فَخَطَبَ فَقَالَ إِنَّ اللَّهَ عَزَّ وَجَلَّ حَبَسَ عَنْ مَكَّةَ الْفِيلَ وَسَلَّطَ عَلَيْهَا رَسُولَهُ وَالْمُؤْمِنِينَ أَلَا وَإِنَّهَا لَمْ تَحِلَّ لِأَحَدٍ قَبْلِي وَلَنْ تَحِلَّ لِأَحَدٍ بَعْدِي أَلَا وَإِنَّهَا أُحِلَّتْ لِي سَاعَةً مِنْ النَّهَارِ أَلَا وَإِنَّهَا سَاعَتِي هَذِهِ حَرَامٌ لَا يُخْبَطُ شَوْكُهَا وَلَا يُعْضَدُ شَجَرُهَا وَلَا يَلْتَقِطُ سَاقِطَتَهَا إِلَّا مُنْشِدٌ وَمَنْ قُتِلَ لَهُ قَتِيلٌ فَهُوَ بِخَيْرِ النَّظَرَيْنِ إِمَّا أَنْ يُعْطَى يَعْنِي الدِّيَةَ وَإِمَّا أَنْ يُقَادَ أَهْلُ الْقَتِيلِ قَالَ فَجَاءَ رَجُلٌ مِنْ أَهْلِ الْيَمَنِ يُقَالُ لَهُ أَبُو شَاهٍ فَقَالَ اكْتُبْ لِي يَا رَسُولَ اللَّهِ فَقَالَ اكْتُبُوا لِأَبِي شَاهٍ فَقَالَ رَجُلٌ مِنْ قُرَيْشٍ إِلَّا الْإِذْخِرَ فَإِنَّا نَجْعَلُهُ فِي بُيُوتِنَا وَقُبُورِنَا فَقَالَ رَسُولُ اللَّهِ صَلَّى اللَّهُ عَلَيْهِ وَسَلَّمَ إِلَّا الْإِذْخِرَ",66
2452,16,"Dan Telah menceritakan kepada kami [Qutaibah bin Sa'id] dari [Malik bin Anas] sebagaimana yang telah dibacakan kepadanya dari [Yahya bin Sa'id] ia berkata, saya mendengar [Abul Hubab Sa'id bin Yasar] berkata, saya mendengar [Abu Hurairah] berkata; Rasulullah shallallahu 'alaihi wasallam bersabda: ""Aku diperintah untuk hijrah ke suatu negeri yang akan menguasai negeri-negeri lain. Sebagian orang-orang munafik menamakannya, 'Yatsrib' (padahal nama sebenarnya adalah) Madinah. Ia akan menghilangkan (para penjahatnya) sebagaimana tukang pandai besi menghilangkan kotoran besi."" Dan Telah menceritakan kepada kami [Amru An Naqid] dan [Ibnu Abu Umar] keduanya berkata, Telah menceritakan kepada kami [Sufyan] -dalam riwayat lain- Dan Telah menceritakan kepada kami [Ibnul Mutsanna] telah menceritakan kepada kami [Abdul Wahhab] semuanya dari [Yahya bin Sa'id] dengan Isnad ini, dan kedunya menyebutkan; ""Sebagaimana tukang pandai besi menghilangkan kotoran."" Ia tidak menyebutkan, ""Al Hadid (besi).""","و حَدَّثَنَا قُتَيْبَةُ بْنُ سَعِيدٍ عَنْ مَالِكِ بْنِ أَنَسٍ فِيمَا قُرِئَ عَلَيْهِ عَنْ يَحْيَى بْنِ سَعِيدٍ قَالَ سَمِعْتُ أَبَا الْحُبَابِ سَعِيدَ بْنَ يَسَارٍ يَقُولُ سَمِعْتُ أَبَا هُرَيْرَةَ يَقُولُا
قَالَ رَسُولُ اللَّهِ صَلَّى اللَّهُ عَلَيْهِ وَسَلَّمَ أُمِرْتُ بِقَرْيَةٍ تَأْكُلُ الْقُرَى يَقُولُونَ يَثْرِبَ وَهِيَ الْمَدِينَةُ تَنْفِي النَّاسَ كَمَا يَنْفِي الْكِيرُ خَبَثَ الْحَدِيدِ
و حَدَّثَنَا عَمْرٌو النَّاقِدُ وَابْنُ أَبِي عُمَرَ قَالَا حَدَّثَنَا سُفْيَانُ ح و حَدَّثَنَا ابْنُ الْمُثَنَّى حَدَّثَنَا عَبْدُ الْوَهَّابِ جَمِيعًا عَنْ يَحْيَى بْنِ سَعِيدٍ بِهَذَا الْإِسْنَادِ وَقَالَا كَمَا يَنْفِي الْكِيرُ الْخَبَثَ لَمْ يَذْكُرَا الْحَدِيدَ",66
3158,29,"telah menceritakan kepadaku ['Ubaidullah bin Umar Al Qawariri] telah menceritakan kepada kami [Hammad bin Zaid] telah menceritakan kepada kami [Yahya bin Sa'id] dari [Busyair bin Yasar] dari [Sahl bin Abu Hatsmah] dan [Rafi' bin Khadij], bahwa Muhayishah bin Mas'ud dan Abdullah bin Sahal pergi ke arah Khaibar, kemudian keduanya berpisah di suatu kebun kurma, tiba-tiba Abdullah terbunuh dan mereka menyangkan orang Yahudi lah pembunuhnya. Lantas saudaranya, Abdurrahman dan kedua anak pamannya, Huwayishah dan Muhayishah, pergi menemui Nabi shallallahu 'alaihi wasallam. Abdurrahman lalu angkat bicara mengenai permasalahan saudaranya, padahal dia adalah orang yang paling muda di antara mereka, maka Rasulullah shallallahu 'alaihi wasallam pun bersabda: ""Hendaknya yang paling tua di antara kalian yang angkat bicara terlebih dahulu."" Atau beliau bersabda: ""Hendaknya yang paling tua yang mulai bicara."" Lalu keduanya angkat bicara mengenai perkara saudaranya, lantas Rasulullah shallallahu 'alaihi wasallam bersabda: ""Hendaknya lima puluh orang dari kalian bersumpah atas satu orang dari mereka (Yahudi), maka dia akan tertuduh."" Mereka berkata, ""Perkara ini sama sekali belum pernah kami alami, bagaimana kami akan bersumpah?"" beliau bersabda: ""Jika demikian, maka orang-orang Yahudi akan bebas dari tuduhan kalian dengan sumpah yang mereka lakukan."" Mereka berkata, ""Wahai Rasulullah, mereka adalah orang-orang kafir."" Rafi' melanjutkan, ""Kemudian Rasulullah shallallahu 'alaihi wasallam membayar diyat kepada mereka."" Sahal berkata; ""Suatu hari aku pernah masuk ke kandang unta mereka, tiba-tiba aku di tendang seekor unta dengan kaki. [Hammad] berkata, ""Ini, atau seperti itu."" Dan telah menceritakan kepada kami [Al Qawariri] telah menceritakan kepada kami [Bisyr bin Al Mufadlal] telah menceritakan kepada kami [Yahya bin Sa'id] dari [Busyair bin Yasar] dari [Sahal bin Abu Khatsmah] dari Nabi shallallahu 'alaihi wasallam seperti itu. Dan dalam haditsnya ia menyebutkan, ""Lalu Rasulullah shallallahu 'alaihi wasallam membayat diyatnya dengan menggunakan uang pribadinya. Dan dalam haditsnya ia tidak menyebutkan, ""Kemudian aku ditendang oleh seekor unta."" Telah menceritakan kepada kami ['Amru An Naqid] telah menceritakan kepada kami [Sufyan bin 'Uyainah]. (dalam jalur lain disebutkan) Telah menceritakan kepada kami [Muhammad bin Mutsanna] telah menceritakan kepada kami [Abdul Wahab] -yaitu Ats Tsaqafi- semuanya dari [Yahya bin Sa'id] dari [Busyair bin Yasar] dari [Sahal bin Abu Khatsmah] seperti hadits mereka.""","و حَدَّثَنِي عُبَيْدُ اللَّهِ بْنُ عُمَرَ الْقَوَارِيرِيُّ حَدَّثَنَا حَمَّادُ بْنُ زَيْدٍ حَدَّثَنَا يَحْيَى بْنُ سَعِيدٍ عَنْ بُشَيْرِ بْنِ يَسَارٍ عَنْ سَهْلِ بْنِ أَبِي حَثْمَةَ وَرَافِعِ بْنِ خَدِيجٍ
أَنَّ مُحَيِّصَةَ بْنَ مَسْعُودٍ وَعَبْدَ اللَّهِ بْنَ سَهْلٍ انْطَلَقَا قِبَلَ خَيْبَرَ فَتَفَرَّقَا فِي النَّخْلِ فَقُتِلَ عَبْدُ اللَّهِ بْنُ سَهْلٍ فَاتَّهَمُوا الْيَهُودَ فَجَاءَ أَخُوهُ عَبْدُ الرَّحْمَنِ وَابْنَا عَمِّهِ حُوَيِّصَةُ وَمُحَيِّصَةُ إِلَى النَّبِيِّ صَلَّى اللَّهُ عَلَيْهِ وَسَلَّمَ فَتَكَلَّمَ عَبْدُ الرَّحْمَنِ فِي أَمْرِ أَخِيهِ وَهُوَ أَصْغَرُ مِنْهُمْ فَقَالَ رَسُولُ اللَّهِ صَلَّى اللَّهُ عَلَيْهِ وَسَلَّمَ كَبِّرْ الْكُبْرَ أَوْ قَالَ لِيَبْدَأْ الْأَكْبَرُ فَتَكَلَّمَا فِي أَمْرِ صَاحِبِهِمَا فَقَالَ رَسُولُ اللَّهِ صَلَّى اللَّهُ عَلَيْهِ وَسَلَّمَ يَقْسِمُ خَمْسُونَ مِنْكُمْ عَلَى رَجُلٍ مِنْهُمْ فَيُدْفَعُ بِرُمَّتِهِ قَالُوا أَمْرٌ لَمْ نَشْهَدْهُ كَيْفَ نَحْلِفُ قَالَ فَتُبْرِئُكُمْ يَهُودُ بِأَيْمَانِ خَمْسِينَ مِنْهُمْ قَالُوا يَا رَسُولَ اللَّهِ قَوْمٌ كُفَّارٌ قَالَ فَوَدَاهُ رَسُولُ اللَّهِ صَلَّى اللَّهُ عَلَيْهِ وَسَلَّمَ مِنْ قِبَلِهِ قَالَ سَهْلٌ فَدَخَلْتُ مِرْبَدًا لَهُمْ يَوْمًا فَرَكَضَتْنِي نَاقَةٌ مِنْ تِلْكَ الْإِبِلِ رَكْضَةً بِرِجْلِهَا
قَالَ حَمَّادٌ هَذَا أَوْ نَحْوَهُ و حَدَّثَنَا الْقَوَارِيرِيُّ حَدَّثَنَا بِشْرُ بْنُ الْمُفَضَّلِ حَدَّثَنَا يَحْيَى بْنُ سَعِيدٍ عَنْ بُشَيْرِ بْنِ يَسَارٍ عَنْ سَهْلِ بْنِ أَبِي حَثْمَةَ عَنْ النَّبِيِّ صَلَّى اللَّهُ عَلَيْهِ وَسَلَّمَ نَحْوَهُ وَقَالَ فِي حَدِيثِهِ فَعَقَلَهُ رَسُولُ اللَّهِ صَلَّى اللَّهُ عَلَيْهِ وَسَلَّمَ مِنْ عِنْدِهِ وَلَمْ يَقُلْ فِي حَدِيثِهِ فَرَكَضَتْنِي نَاقَةٌ حَدَّثَنَا عَمْرٌو النَّاقِدُ حَدَّثَنَا سُفْيَانُ بْنُ عُيَيْنَةَ ح و حَدَّثَنَا مُحَمَّدُ بْنُ الْمُثَنَّى حَدَّثَنَا عَبْدُ الْوَهَّابِ يَعْنِي الثَّقَفِيَّ جَمِيعًا عَنْ يَحْيَى بْنِ سَعِيدٍ عَنْ بُشَيْرِ بْنِ يَسَارٍ عَنْ سَهْلِ بْنِ أَبِي حَثْمَةَ بِنَحْوِ حَدِيثِهِمْ",66
3165,29,"Telah menceritakan kepada kami [Muhammad bin Al Mutsanna] dan [Muhammad bin Basyar] dan ini adalah lafadz Ibnu Mutsanna, keduanya berkata; telah menceritakan kepada kami [Muhammad bin Ja'far] telah menceritakan kepada kami [Syu'bah] dari [Hisyam bin Zaid] dari [Anas bin Malik], bahwa seorang Yahudi membunuh seorang budak perempuan dengan memukul kepalanya pakai batu karena hendak merampas perhiasannya. Lalu budak wanita tersebut dihadapakan kepada Nabi shallallahu 'alaihi wasallam dalam keadaan sekarat, maka beliau bertanya kepada wanita tersebut: ""Apakah fulan yang hendak membunuhmu?"" Wanita itu menggelengkan kepalanya sebagai tanda tidak, kemudian beliau bertanya untuk yang kedua kali: ""Apakah fulan yang hendak membunuhmu?"" wanita itu tetap menggelengkan kepala sebagai tanda tidak, beliau pun bertanya untuk yang ketiga kalinya: ""Apakah si fulan yang hendak membunuhmu?"" wanita itu menjawab, ""Ya, benar."" Maka Rasulullah shallallahu 'alaihi wasallam membunuh laki-laki Yahudi tadi dengan dua bongkah batu."" Dan telah menceritakan kepadaku [Yahya bin Habib Al Haritsi] telah menceritakan kepada kami [Khalid] -yaitu Ibnu Al Harits-. (dalam jalur lain disebutkan) Telah menceritakan kepada kami [Abu Kuraib] telah menceritakan kepada kami [Ibnu Idris] keduanya dari [Syu'bah] dengan sanad seperti ini. Dan dalam riwayat Ibnu Idris disebutkan dengan redaksi, ""Kemudian beliau memukul kepala yahudi tersebut dengan dua bongkah batu.""","حَدَّثَنَا مُحَمَّدُ بْنُ الْمُثَنَّى وَمُحَمَّدُ بْنُ بَشَّارٍ وَاللَّفْظُ لِابْنِ الْمُثَنَّى قَالَا حَدَّثَنَا مُحَمَّدُ بْنُ جَعْفَرٍ حَدَّثَنَا شُعْبَةُ عَنْ هِشَامِ بْنِ زَيْدٍ عَنْ أَنَسِ بْنِ مَالِكٍ
أَنَّ يَهُودِيًّا قَتَلَ جَارِيَةً عَلَى أَوْضَاحٍ لَهَا فَقَتَلَهَا بِحَجَرٍ قَالَ فَجِيءَ بِهَا إِلَى النَّبِيِّ صَلَّى اللَّهُ عَلَيْهِ وَسَلَّمَ وَبِهَا رَمَقٌ فَقَالَ لَهَا أَقَتَلَكِ فُلَانٌ فَأَشَارَتْ بِرَأْسِهَا أَنْ لَا ثُمَّ قَالَ لَهَا الثَّانِيَةَ فَأَشَارَتْ بِرَأْسِهَا أَنْ لَا ثُمَّ سَأَلَهَا الثَّالِثَةَ فَقَالَتْ نَعَمْ وَأَشَارَتْ بِرَأْسِهَا فَقَتَلَهُ رَسُولُ اللَّهِ صَلَّى اللَّهُ عَلَيْهِ وَسَلَّمَ بَيْنَ حَجَرَيْنِ
و حَدَّثَنِي يَحْيَى بْنُ حَبِيبٍ الْحَارِثِيُّ حَدَّثَنَا خَالِدٌ يَعْنِي ابْنَ الْحَارِثِ ح و حَدَّثَنَا أَبُو كُرَيْبٍ حَدَّثَنَا ابْنُ إِدْرِيسَ كِلَاهُمَا عَنْ شُعْبَةَ بِهَذَا الْإِسْنَادِ نَحْوَهُ وَفِي حَدِيثِ ابْنِ إِدْرِيسَ فَرَضَخَ رَأْسَهُ بَيْنَ حَجَرَيْنِ",66
3166,29,"Telah menceritakan kepada kami [Abd bin Humaid] telah menceritakan kepada kami [Abdurrazaq] telah mengabarkan kepada kami [Ma'mar] dari [Ayyub] dari [Abu Qilabah] dari [Anas], bahwa seorang laki-laki Yahudi membunuh sahaya perempuan Anshar karena ingin merampas perhiasannya, kemudian ia melemparkan wanita tersebut ke dalam sumur dan melemparinya dengan batu. Lalu dia ditangkap dan dihadapkan kepada Rasulullah shallallahu 'alaihi wasallam, setelah itu beliau memerintahkan supaya pembunuhnya dirajam, maka ia pun dirajam hingga mati."" Telah menceritakan kepadaku [Ishaq bin Manshur] telah mengabarkan kepada kami [Muhammad bin Bakr] telah mengabarkan kepada kami [Ibnu Juraij] telah mengabarkan kepadaku [Ma'mar] dari [Ayyub] seperti sanad ini.""","حَدَّثَنَا عَبْدُ بْنُ حُمَيْدٍ حَدَّثَنَا عَبْدُ الرَّزَّاقِ أَخْبَرَنَا مَعْمَرٌ عَنْ أَيُّوبَ عَنْ أَبِي قِلَابَةَ عَنْ أَنَسٍ
أَنَّ رَجُلًا مِنْ الْيَهُودِ قَتَلَ جَارِيَةً مِنْ الْأَنْصَارِ عَلَى حُلِيٍّ لَهَا ثُمَّ أَلْقَاهَا فِي الْقَلِيبِ وَرَضَخَ رَأْسَهَا بِالْحِجَارَةِ فَأُخِذَ فَأُتِيَ بِهِ رَسُولُ اللَّهِ صَلَّى اللَّهُ عَلَيْهِ وَسَلَّمَ فَأَمَرَ بِهِ أَنْ يُرْجَمَ حَتَّى يَمُوتَ فَرُجِمَ حَتَّى مَاتَ
و حَدَّثَنِي إِسْحَقُ بْنُ مَنْصُورٍ أَخْبَرَنَا مُحَمَّدُ بْنُ بَكْرٍ أَخْبَرَنَا ابْنُ جُرَيْجٍ أَخْبَرَنِي مَعْمَرٌ عَنْ أَيُّوبَ بِهَذَا الْإِسْنَادِ مِثْلَهُ",66
