haditsId,kitabId,indo,arab,label
1147,7,"Dan telah menceritakan kepada kami [Ahmad bin Yunus] dan ['Aun bin Salam] semuanya dari [Zuhair]. [Ibnu Yunus] mengatakan; telah menceritakan kepada kami [Zuhair] telah menceritakan kepada kami [Abu Zubair] dari [Said bin Jubair] dari [Ibnu Abbas] katanya; Rasulullah shallallahu 'alaihi wasallam pernah shalat Zhuhur dan Ashar sekaligus di Madinah bukan karena takut dan bukan pula karena safar."" [Abu Zubair] mengatakan; ""Aku bertanya kepada [Sa'id]; ""Mengapa beliau melakukan hal itu? Dia menjawab; Aku bertanya kepada [Ibnu Abbas] sebagaimana kamu bertanya kepadaku, lalu dia menjawab; ""Beliau ingin supaya tidak merepotkan (memberatkan) seorangpun dari umatnya.""","و حَدَّثَنَا أَحْمَدُ بْنُ يُونُسَ وَعَوْنُ بْنُ سَلَّامٍ جَمِيعًا عَنْ زُهَيْرٍ قَالَ ابْنُ يُونُسَ حَدَّثَنَا زُهَيْرٌ حَدَّثَنَا أَبُو الزُّبَيْرِ عَنْ سَعِيدِ بْنِ جُبَيْرٍ عَنْ ابْنِ عَبَّاسٍ
قَالَ صَلَّى رَسُولُ اللَّهِ صَلَّى اللَّهُ عَلَيْهِ وَسَلَّمَ الظُّهْرَ وَالْعَصْرَ جَمِيعًا بِالْمَدِينَةِ فِي غَيْرِ خَوْفٍ وَلَا سَفَرٍ
قَالَ أَبُو الزُّبَيْرِ فَسَأَلْتُ سَعِيدًا لِمَ فَعَلَ ذَلِكَ فَقَالَ سَأَلْتُ ابْنَ عَبَّاسٍ كَمَا سَأَلْتَنِي فَقَالَ أَرَادَ أَنْ لَا يُحْرِجَ أَحَدًا مِنْ أُمَّتِهِ",73
1190,7,"Telah menceritakan kepada kami [Ubaidullah bin Muadz] telah menceritakan kepada kami [Ayahku] telah menceritakan kepada kami [Syu'bah] dari [Muhammad bin Abdurrahman Al Anshari], ia mendengar [Amrah binti Abdurrahman] dari ['Aisyah] mengatakan; ""Jika fajar terbit, maka Rasuullah shallallahu 'alaihi wasallam shalat dua rakaat (ringan) hingga aku membatin; ""Apakah beliau membaca surat Al Fatihah?."" (karena cepatnya -pent).","حَدَّثَنَا عُبَيْدُ اللَّهِ بْنُ مُعَاذٍ حَدَّثَنَا أَبِي حَدَّثَنَا شُعْبَةُ عَنْ مُحَمَّدِ بْنِ عَبْدِ الرَّحْمَنِ الْأَنْصَارِيِّ سَمِعَ عَمْرَةَ بِنْتَ عَبْدِ الرَّحْمَنِ عَنْ عَائِشَةَ قَالَتْ
كَانَ رَسُولُ اللَّهِ صَلَّى اللَّهُ عَلَيْهِ وَسَلَّمَ إِذَا طَلَعَ الْفَجْرُ صَلَّى رَكْعَتَيْنِ أَقُولُ هَلْ يَقْرَأُ فِيهِمَا بِفَاتِحَةِ الْكِتَابِ",73
2369,16,"Telah menceritakan kepadaku [Abu Thahir] telah mengabarkan kepada kami [Abdullah bin Wahb] dari [Makhramah] -dalam riwayat lain- Dan telah menceritakan kepadaku [Harun bin Sa'id Al Aili] Telah menceritakan kepada kami [Ibnu Wahb] telah mengabarkan kepadaku [Makhramah bin Bukair] dari [bapaknya] ia berkata, saya mendengar [Nafi'] Maula Ibnu Umar berkata, saya mendengar [Abdullah bin Abu Bakr bin Abu Quhafah] menceritakan dari Abdullah bin Umar dari [Aisyah] isteri Nabi shallallahu 'alaihi wasallam, bahwa ia berkata; Saya mendengar Rasulullah shallallahu 'alaihi wasallam bersabda: ""Kalau bukanlah karena kaummu yang baru saja meninggalkan masa jahiliyah, akan kupakai dana Ka'bah untuk memperbaikinya; pintunya akan kubuat sampai ke tanah, dan hijir kumasukkan ke dalamnya.""","حَدَّثَنِي أَبُو الطَّاهِرِ أَخْبَرَنَا عَبْدُ اللَّهِ بْنُ وَهْبٍ عَنْ مَخْرَمَةَ ح و حَدَّثَنِي هَارُونُ بْنُ سَعِيدٍ الْأَيْلِيُّ حَدَّثَنَا ابْنُ وَهْبٍ أَخْبَرَنِي مَخْرَمَةُ بْنُ بُكَيْرٍ عَنْ أَبِيهِ قَالَ سَمِعْتُ نَافِعًا مَوْلَى ابْنِ عُمَرَ يَقُولُ سَمِعْتُ عَبْدَ اللَّهِ بْنَ أَبِي بَكْرِ بْنِ أَبِي قُحَافَةَ يُحَدِّثُ عَبْدَ اللَّهِ بْنَ عُمَرَ عَنْ عَائِشَةَ زَوْجِ النَّبِيِّ صَلَّى اللَّهُ عَلَيْهِ وَسَلَّمَ أَنَّهَا قَالَتْ
سَمِعْتُ رَسُولَ اللَّهِ صَلَّى اللَّهُ عَلَيْهِ وَسَلَّمَ يَقُولُ لَوْلَا أَنَّ قَوْمَكِ حَدِيثُو عَهْدٍ بِجَاهِلِيَّةٍ أَوْ قَالَ بِكُفْرٍ لَأَنْفَقْتُ كَنْزَ الْكَعْبَةِ فِي سَبِيلِ اللَّهِ وَلَجَعَلْتُ بَابَهَا بِالْأَرْضِ وَلَأَدْخَلْتُ فِيهَا مِنْ الْحِجْرِ",73
4841,49,"Telah menceritakan kepadaku [Hamid bin 'Umar] telah menceritakan kepada kami ['Abdul Wahid] telah menceritakan kepada kami ['Ashim] dari [An-Nadlr Bin Anas] yang saat itu Anas masih hidup, [Anas] berkata; kalau saja Rasulullah Shallallahu'alaihi wasallam tidak bersabda: ""Janganlah di antara kalian mengharapkan kematian"", maka tentu saya akan mengharapkannya.","حَدَّثَنِي حَامِدُ بْنُ عُمَرَ حَدَّثَنَا عَبْدُ الْوَاحِدِ حَدَّثَنَا عَاصِمٌ عَنْ النَّضْرِ بْنِ أَنَسٍ وَأَنَسٌ يَوْمَئِذٍ حَيٌّ قَالَ أَنَسٌ
لَوْلَا أَنَّ رَسُولَ اللَّهِ صَلَّى اللَّهُ عَلَيْهِ وَسَلَّمَ قَالَ لَا يَتَمَنَّيَنَّ أَحَدُكُمْ الْمَوْتَ لَتَمَنَّيْتُهُ",73
5170,54,"Telah menceritakan kepada kami [Abu Bakr bin Abu Syaibah] telah menceritakan kepada kami [Waki'] dari [Ikrimah bin Ammar] dari [Salim] dari [Ibnu Umar] berkata: Rasulullah Shallallahu 'alaihi wa Salam keluar dari rumah Aisyah lalu bersabda: ""Induk kekufuran dari sini, tempat terbitnya tandu setan."" Maksud beliau dari arah timur.","حَدَّثَنَا أَبُو بَكْرِ بْنُ أَبِي شَيْبَةَ حَدَّثَنَا وَكِيعٌ عَنْ عِكْرِمَةَ بْنِ عَمَّارٍ عَنْ سَالِمٍ عَنْ ابْنِ عُمَرَ قَالَ
خَرَجَ رَسُولُ اللَّهِ صَلَّى اللَّهُ عَلَيْهِ وَسَلَّمَ مِنْ بَيْتِ عَائِشَةَ فَقَالَ رَأْسُ الْكُفْرِ مِنْ هَاهُنَا مِنْ حَيْثُ يَطْلُعُ قَرْنُ الشَّيْطَانِ يَعْنِي الْمَشْرِقَ",73
