haditsId,kitabId,indo,arab,label
818,6,"Telah menceritakan kepada kami [Abu Bakar bin Abi Syaibah] telah menceritakan kepada kami [Abu al-Ahwash] dari [Abu Ishaq] dari [al-Bara' bin 'Azib] dia berkata, ""Aku shalat bersama Nabi Shallallahu'alaihiwasallam menghadap Baitul Maqdis selama enam belas bulan hingga turun ayat tersebut yang ada dalam surat al-Baqarah, ""Dan di mana pun kamu berada maka palingkanlah wajah-wajahmu ke arahnya."" (QS.Albaqarah 124), ayat tersebut turun setelah Nabi Shallallahu'alaihiwasallam shalat, lalu seorang laki-laki dari suatu kaum bertolak pergi, lalu dia berjalan bersama beberapa manusia dari kalangan Anshar, dan mereka shalat, lalu beliau menceritakannya kepada mereka, maka mereka menghadapkan wajah-wajah mereka ke Baitullah.""","حَدَّثَنَا أَبُو بَكْرِ بْنُ أَبِي شَيْبَةَ حَدَّثَنَا أَبُو الْأَحْوَصِ عَنْ أَبِي إِسْحَقَ عَنْ الْبَرَاءِ بْنِ عَازِبٍ قَالَ
صَلَّيْتُ مَعَ النَّبِيِّ صَلَّى اللَّهُ عَلَيْهِ وَسَلَّمَ إِلَى بَيْتِ الْمَقْدِسِ سِتَّةَ عَشَرَ شَهْرًا حَتَّى نَزَلَتْ الْآيَةُ الَّتِي فِي الْبَقَرَةِ
{ وَحَيْثُ مَا كُنْتُمْ فَوَلُّوا وُجُوهَكُمْ شَطْرَهُ }
فَنَزَلَتْ بَعْدَمَا صَلَّى النَّبِيُّ صَلَّى اللَّهُ عَلَيْهِ وَسَلَّمَ فَانْطَلَقَ رَجُلٌ مِنْ الْقَوْمِ فَمَرَّ بِنَاسٍ مِنْ الْأَنْصَارِ وَهُمْ يُصَلُّونَ فَحَدَّثَهُمْ فَوَلَّوْا وُجُوهَهُمْ قِبَلَ الْبَيْتِ",12
830,6,"Telah menceritakan kepada kami [Muhammad bin al-'Ala' al-Hamdani Abu Kuraib] dia berkata, telah menceritakan kepada kami [Abu Muawiyah] dari [al-A'masy] dari [Ibrahim] dari [al-Aswad] dan [Alqamah] keduanya berkata, ""Kami mendatangi [Abdullah bin Mas'ud] di rumahnya, lalu dia bertanya, 'Apakah mereka itu shalat di belakangmu? ' Jawab kami, 'Tidak.' Dia berkata, 'Bangunlah, lalu shalatlah, lalu dia tidak menyuruh kami adzan dan tidak pula iqamat'. Lalu kami berdiri di belakangnya. Kemudian dia menarik tangan kami, lalu dia menempatkan masing-masing kami di sebelah kanan dan kirinya. Ketika dia rukuk, kami meletakkan tangan kami di lutut'. Dia berkata, 'Tetapi Abdullah memukul tangan kami, dan dia mempertemukan kedua telapak tangannya lalu memasukkannya ke antara dua pahanya'. Tatkala telah selesai shalat dia berkata, 'Sesungguhnya nanti akan datang para penguasa yang mengakhirkan shalat dari waktunya dan mengundur-ngundur pelaksanaannya hingga hampir habis. Apabila kalian menyaksikan mereka melakukan hal tersebut, maka kalian shalatlah tepat pada waktunya, kemudian shalat pulalah berjamaah bersama-sama dengan mereka dan jadikanlah shalatmu bersama mereka sebagai suatu kesunatan. Apabila kamu bertiga, shalatlah bersama-sama, dan apabila kamu lebih banyak, angkatlah salah seorang menjadi imam. Apabila salah seorang dari kalian rukuk, maka letakkan kedua lenganmu di atas kedua dan membungkuklah. Dan pertemukan kedua telapak tanganmu. Aku seperti masih melihat Rasulullah shallallahu'alaihiwasallam, mempersilangkan anak-anak jari beliau. Lalu 'Abdulllah memperagakannya kepada mereka'."" Dan telah menceritakan kepada kami [Minjab bin al-Harits at-Tamimi] telah mengabarkan kepada kami [Ibnu Mushir] dia berkata, --Lewat jalur periwayatan lain-- dan telah menceritakan kepada kami [Utsman bin Abi Syaibah] telah menceritakan kepada kami [Jarir] dia berkata, --Lewat jalur periwayatan lain-- dan telah menceritakan kepadaku [Muhammad bin Rafi'] telah menceritakan kepada kami [Yahya bin Adam] telah menceritakan kepada kami [Mufadhdhal] semuanya meriwayatkan dari [al-A'masy] dari [Ibrahim] dari [Alqamah] dan [al-Aswad] 'Bahwa keduanya mengunjungi [Abdullah] ', sesuai dengan makna hadits Abu Mu'awiyah. Sedangkan dalam hadits Mushir dan Jarir, ""Seakan-akan aku melihat persilangan jari-jari Rasulullah Shallallahu'alaihiwasallam dalam keadaan beliau rukuk.","حَدَّثَنَا مُحَمَّدُ بْنُ الْعَلَاءِ الْهَمْدَانِيُّ أَبُو كُرَيْبٍ قَالَ حَدَّثَنَا أَبُو مُعَاوِيَةَ عَنْ الْأَعْمَشِ عَنْ إِبْرَاهِيمَ عَنْ الْأَسْوَدِ وَعَلْقَمَةَ قَالَا أَتَيْنَا عَبْدَ اللَّهِ بْنَ مَسْعُودٍ فِي دَارِهِ فَقَالَ أَصَلَّى هَؤُلَاءِ خَلْفَكُمْ فَقُلْنَا لَا قَالَ فَقُومُوا فَصَلُّوا فَلَمْ يَأْمُرْنَا بِأَذَانٍ وَلَا إِقَامَةٍ
قَالَ وَذَهَبْنَا لِنَقُومَ خَلْفَهُ فَأَخَذَ بِأَيْدِينَا فَجَعَلَ أَحَدَنَا عَنْ يَمِينِهِ وَالْآخَرَ عَنْ شِمَالِهِ قَالَ فَلَمَّا رَكَعَ وَضَعْنَا أَيْدِيَنَا عَلَى رُكَبِنَا قَالَ فَضَرَبَ أَيْدِيَنَا وَطَبَّقَ بَيْنَ كَفَّيْهِ ثُمَّ أَدْخَلَهُمَا بَيْنَ فَخِذَيْهِ قَالَ فَلَمَّا صَلَّى قَالَ إِنَّهُ سَتَكُونُ عَلَيْكُمْ أُمَرَاءُ يُؤَخِّرُونَ الصَّلَاةَ عَنْ مِيقَاتِهَا وَيَخْنُقُونَهَا إِلَى شَرَقِ الْمَوْتَى فَإِذَا رَأَيْتُمُوهُمْ قَدْ فَعَلُوا ذَلِكَ فَصَلُّوا الصَّلَاةَ لِمِيقَاتِهَا وَاجْعَلُوا صَلَاتَكُمْ مَعَهُمْ سُبْحَةً وَإِذَا كُنْتُمْ ثَلَاثَةً فَصَلُّوا جَمِيعًا وَإِذَا كُنْتُمْ أَكْثَرَ مِنْ ذَلِكَ فَلْيَؤُمَّكُمْ أَحَدُكُمْ وَإِذَا رَكَعَ أَحَدُكُمْ فَلْيُفْرِشْ ذِرَاعَيْهِ عَلَى فَخِذَيْهِ وَلْيَجْنَأْ وَلْيُطَبِّقْ بَيْنَ كَفَّيْهِ فَلَكَأَنِّي أَنْظُرُ إِلَى اخْتِلَافِ أَصَابِعِ رَسُولِ اللَّهِ صَلَّى اللَّهُ عَلَيْهِ وَسَلَّمَ فَأَرَاهُمْ
و حَدَّثَنَا مِنْجَابُ بْنُ الْحَارِثِ التَّمِيمِيُّ أَخْبَرَنَا ابْنُ مُسْهِرٍ قَالَ ح و حَدَّثَنَا عُثْمَانُ بْنُ أَبِي شَيْبَةَ حَدَّثَنَا جَرِيرٌ قَالَ ح و حَدَّثَنِي مُحَمَّدُ بْنُ رَافِعٍ حَدَّثَنَا يَحْيَى بْنُ آدَمَ حَدَّثَنَا مُفَضَّلٌ كُلُّهُمْ عَنْ الْأَعْمَشِ عَنْ إِبْرَاهِيمَ عَنْ عَلْقَمَةَ وَالْأَسْوَدِ أَنَّهُمَا دَخَلَا عَلَى عَبْدِ اللَّهِ بِمَعْنَى حَدِيثِ أَبِي مُعَاوِيَةَ وَفِي حَدِيثِ ابْنِ مُسْهِرٍ وَجَرِيرٍ فَلَكَأَنِّي أَنْظُرُ إِلَى اخْتِلَافِ أَصَابِعِ رَسُولِ اللَّهِ صَلَّى اللَّهُ عَلَيْهِ وَسَلَّمَ وَهُوَ رَاكِعٌ",12
836,6,"Telah menceritakan kepada kami [Abu Ja'far Muhammad bin ash-Shabbah] dan [Abu Bakar bin Abi Syaibah] dan keduanya berdekatan dalam lafazh hadits tersebut, keduanya berkata, telah menceritakan kepada kami [Ismail bin Ibrahim] dari [Hajjaj ash-Shawwaf] dari [Yahya bin Abi Katsir] dari [Hilal bin Abi Maimunah] dari ['Atha' bin Yasar] dari [Muawiyah bin al-Hakam as-Sulami] dia berkata, ""Ketika aku sedang shalat bersama-sama Rasulullah shallallahu'alaihiwasallam, tiba-tiba ada seorang laki-laki dari suatu kaum bersin. Lalu aku mengucapkan, 'Yarhamukallah (semoga Allah memberi Anda rahmat) '. Maka seluruh jamaah menujukan pandangannya kepadaku."" Aku berkata, ""Aduh, celakalah ibuku! Mengapa Anda semua memelototiku?"" Mereka bahkan menepukkan tangan mereka pada paha mereka. Setelah itu barulah aku tahu bahwa mereka menyuruhku diam. Tetapi aku telah diam. Tatkala Rasulullah Shallallahu'alaihiwasallam selesai shalat, Ayah dan ibuku sebagai tebusanmu (ungkapan sumpah Arab), aku belum pernah bertemu seorang pendidik sebelum dan sesudahnya yang lebih baik pengajarannya daripada beliau. Demi Allah! Beliau tidak menghardikku, tidak memukul dan tidak memakiku. Beliau bersabda, 'Sesungguhnya shalat ini, tidak pantas di dalamnya ada percakapan manusia, karena shalat itu hanyalah tasbih, takbir dan membaca al-Qur'an.' -Atau sebagaimana yang disabdakan Rasulullah Shallallahu'alaihiwasallam, ""Saya berkata, 'Wahai Rasulullah Shallallahu'alaihiwasallam, sesungguhnya aku dekat dengan masa jahiliyyah. Dan sungguh Allah telah mendatangkan agama Islam, sedangkan di antara kita ada beberapa laki-laki yang mendatangi dukun.' Beliau bersabda, 'Janganlah kamu mendatangi mereka.' Dia berkata, 'Dan di antara kita ada beberapa laki-laki yang bertathayyur (berfirasat sial).' Beliau bersabda, 'Itu adalah rasa waswas yang mereka dapatkan dalam dada mereka yang seringkali menghalangi mereka (untuk melakukan sesuatu), maka janganlah menghalang-halangi mereka. -Ibnu Shabbah berkata dengan redaksi, 'Maka jangan menghalangi kalian-."" Dia berkata, ""Aku berkata, 'Di antara kami adalah beberapa orang yang menuliskan garis hidup.' Beliau menjawab, 'Dahulu salah seorang nabi menuliskan garis hidup, maka barangsiapa yang bersesuaian garis hidupnya, maka itulah (yang tepat, maksudnya seorang nabi boleh menggambarkan masa yang akan datang, pent) '."" Dia berkata lagi, ""Dahulu saya mempunyai budak wanita yang menggembala kambing di depan gunung Uhud dan al-Jawwaniyah. Pada suatu hari aku memeriksanya, ternyata seekor serigala telah membawa seekor kambing dari gembalaannya. Aku adalah laki-laki biasa dari keturunan bani Adam yang bisa marah sebagaimana mereka juga bisa marah. Tetapi aku menamparnya sekali. Lalu aku mendatangi Rasulullah Shallallahu'alaihiwasallam, dan beliau anggap tamparan itu adalah masalah besar. Aku berkata, ""(Untuk menebus kesalahanku), tidakkah lebih baik aku memerdekakannya? ' Beliau bersabda, 'Bawalah dia kepadaku.' Lalu aku membawanya menghadap beliau. Lalu beliau bertanya, 'Di manakah Allah? ' Budak itu menjawab, 'Di langit.' Beliau bertanya, 'Siapakah aku? ' Dia menjawab, 'Kamu adalah utusan Allah.' Beliau bersabda, 'Bebaskanlah dia, karena dia seorang wanita mukminah'."" Telah menceritakan kepada kami [Ishaq bin Ibrahim] telah mengabarkan kepada kami [Isa bin Yunus] telah menceritakan kepada kami [al-Auza'i] dari [Yahya bin Abi Katsir] dengan isnad ini hadits semisalnya.","حَدَّثَنَا أَبُو جَعْفَرٍ مُحَمَّدُ بْنُ الصَّبَّاحِ وَأَبُو بَكْرِ بْنُ أَبِي شَيْبَةَ وَتَقَارَبَا فِي لَفْظِ الْحَدِيثِ قَالَا حَدَّثَنَا إِسْمَعِيلُ بْنُ إِبْرَاهِيمَ عَنْ حَجَّاجٍ الصَّوَّافِ عَنْ يَحْيَى بْنِ أَبِي كَثِيرٍ عَنْ هِلَالِ بْنِ أَبِي مَيْمُونَةَ عَنْ عَطَاءِ بْنِ يَسَارٍ عَنْ مُعَاوِيَةَ بْنِ الْحَكَمِ السُّلَمِيِّ قَالَ
بَيْنَا أَنَا أُصَلِّي مَعَ رَسُولِ اللَّهِ صَلَّى اللَّهُ عَلَيْهِ وَسَلَّمَ إِذْ عَطَسَ رَجُلٌ مِنْ الْقَوْمِ فَقُلْتُ يَرْحَمُكَ اللَّهُ فَرَمَانِي الْقَوْمُ بِأَبْصَارِهِمْ فَقُلْتُ وَا ثُكْلَ أُمِّيَاهْ مَا شَأْنُكُمْ تَنْظُرُونَ إِلَيَّ فَجَعَلُوا يَضْرِبُونَ بِأَيْدِيهِمْ عَلَى أَفْخَاذِهِمْ فَلَمَّا رَأَيْتُهُمْ يُصَمِّتُونَنِي لَكِنِّي سَكَتُّ فَلَمَّا صَلَّى رَسُولُ اللَّهِ صَلَّى اللَّهُ عَلَيْهِ وَسَلَّمَ فَبِأَبِي هُوَ وَأُمِّي مَا رَأَيْتُ مُعَلِّمًا قَبْلَهُ وَلَا بَعْدَهُ أَحْسَنَ تَعْلِيمًا مِنْهُ فَوَاللَّهِ مَا كَهَرَنِي وَلَا ضَرَبَنِي وَلَا شَتَمَنِي قَالَ إِنَّ هَذِهِ الصَّلَاةَ لَا يَصْلُحُ فِيهَا شَيْءٌ مِنْ كَلَامِ النَّاسِ إِنَّمَا هُوَ التَّسْبِيحُ وَالتَّكْبِيرُ وَقِرَاءَةُ الْقُرْآنِ أَوْ كَمَا قَالَ رَسُولُ اللَّهِ صَلَّى اللَّهُ عَلَيْهِ وَسَلَّمَ قُلْتُ يَا رَسُولَ اللَّهِ إِنِّي حَدِيثُ عَهْدٍ بِجَاهِلِيَّةٍ وَقَدْ جَاءَ اللَّهُ بِالْإِسْلَامِ وَإِنَّ مِنَّا رِجَالًا يَأْتُونَ الْكُهَّانَ قَالَ فَلَا تَأْتِهِمْ قَالَ وَمِنَّا رِجَالٌ يَتَطَيَّرُونَ قَالَ ذَاكَ شَيْءٌ يَجِدُونَهُ فِي صُدُورِهِمْ فَلَا يَصُدَّنَّهُمْ قَالَ ابْنُ الصَّبَّاحِ فَلَا يَصُدَّنَّكُمْ قَالَ قُلْتُ وَمِنَّا رِجَالٌ يَخُطُّونَ قَالَ كَانَ نَبِيٌّ مِنْ الْأَنْبِيَاءِ يَخُطُّ فَمَنْ وَافَقَ خَطَّهُ فَذَاكَ قَالَ وَكَانَتْ لِي جَارِيَةٌ تَرْعَى غَنَمًا لِي قِبَلَ أُحُدٍ وَالْجَوَّانِيَّةِ فَاطَّلَعْتُ ذَاتَ يَوْمٍ فَإِذَا الذِّيبُ قَدْ ذَهَبَ بِشَاةٍ مِنْ غَنَمِهَا وَأَنَا رَجُلٌ مِنْ بَنِي آدَمَ آسَفُ كَمَا يَأْسَفُونَ لَكِنِّي صَكَكْتُهَا صَكَّةً فَأَتَيْتُ رَسُولَ اللَّهِ صَلَّى اللَّهُ عَلَيْهِ وَسَلَّمَ فَعَظَّمَ ذَلِكَ عَلَيَّ قُلْتُ يَا رَسُولَ اللَّهِ أَفَلَا أُعْتِقُهَا قَالَ ائْتِنِي بِهَا فَأَتَيْتُهُ بِهَا فَقَالَ لَهَا أَيْنَ اللَّهُ قَالَتْ فِي السَّمَاءِ قَالَ مَنْ أَنَا قَالَتْ أَنْتَ رَسُولُ اللَّهِ قَالَ أَعْتِقْهَا فَإِنَّهَا مُؤْمِنَةٌ
حَدَّثَنَا إِسْحَقُ بْنُ إِبْرَاهِيمَ أَخْبَرَنَا عِيسَى بْنُ يُونُسَ حَدَّثَنَا الْأَوْزَاعِيُّ عَنْ يَحْيَى بْنِ أَبِي كَثِيرٍ بِهَذَا الْإِسْنَادِ نَحْوَهُ",12
865,6,"Telah menceritakan kepada kami [Abu Bakar bin Abi Syaibah] telah menceritakan kepada kami [Waki'] dari [Hisyam] dari [Bapaknya] dari [Aisyah ra] ""Bahwa Nabi Shallallahu'alaihiwasallam dahulu memiliki baju bergaris-garis yang memiliki gambar tanda sehingga beliau tersibukkan dengannya dalam shalat (tidak bisa khusyu'), lalu beliau memberikannya kepada Abu Jahm. Lalu dia menjadikannya mantel polos.""","حَدَّثَنَا أَبُو بَكْرِ بْنُ أَبِي شَيْبَةَ حَدَّثَنَا وَكِيعٌ عَنْ هِشَامٍ عَنْ أَبِيهِ عَنْ عَائِشَةَ
أَنَّ النَّبِيَّ صَلَّى اللَّهُ عَلَيْهِ وَسَلَّمَ كَانَتْ لَهُ خَمِيصَةٌ لَهَا عَلَمٌ فَكَانَ يَتَشَاغَلُ بِهَا فِي الصَّلَاةِ فَأَعْطَاهَا أَبَا جَهْمٍ وَأَخَذَ كِسَاءً لَهُ أَنْبِجَانِيًّا",12
872,6,"Dan telah menceritakan kepadaku [Zuhair bin Harb] telah menceritakan kepada kami [Ismail, yaitu Ibnu Ulayyah] dari [Abdul Aziz, dan dia adalah Ibnu Shuhaib] dia berkata, "" [Anas] pernah ditanya perihal bawang putih, maka dia pun menjawab, ""Rasulullah Shallallahu'alaihiwasallam bersabda, 'Barangsiapa memakan dari pepohonan ini maka janganlah dia mendekati kami, dan janganlah dia shalat bersama kami'.""","و حَدَّثَنِي زُهَيْرُ بْنُ حَرْبٍ حَدَّثَنَا إِسْمَعِيلُ يَعْنِي ابْنَ عُلَيَّةَ عَنْ عَبْدِ الْعَزِيزِ وَهُوَ ابْنُ صُهَيْبٍ قَالَ
سُئِلَ أَنَسٌ عَنْ الثُّومِ فَقَالَ قَالَ رَسُولُ اللَّهِ صَلَّى اللَّهُ عَلَيْهِ وَسَلَّمَ مَنْ أَكَلَ مِنْ هَذِهِ الشَّجَرَةِ فَلَا يَقْرَبَنَّا وَلَا يُصَلِّي مَعَنَا",12
877,6,"Dan telah menceritakan kepadaku [Amru an-Naqid] telah menceritakan kepada kami [Ismail bin Ulayyah] dari [al-Jurairi] dari [Abu Nadhrah] dari [Abu Sa'id] dia berkata, ""Kami belum berperang hingga Khaibar telah ditaklukkan, lalu kami menjumpai para sahabat Rasulullah Shallallahu'alaihiwasallam, pada sayur mayur itu terdapat bawang putih, sedangkan orang-orang kelaparan. Maka kami memakan sebagian darinya sangat banyak, kemudian kami pergi ke masjid. Lalu Rasulullah Shallallahu'alaihiwasallam mendapatkan bau tidak sedap, maka beliau bertanya, 'Siapa yang makan sedikit dari pohon bau ini, maka janganlah dia mendekati masjid kami!.' Lalu sekelompok orang berkata, 'Pohon ini telah diharamkan, pohon ini telah diharamkan.' Lalu hal tersebut sampai pada Nabi Shallallahu'alaihiwasallam, maka beliau bersabda, 'Wahai sekalian manusia, sesungguhnya aku tidak berhak mengharamkan sesuatu yang dihalalkan oleh Allah untukku. Akan tetapi ia adalah pohon yang aku membenci baunya'.""","و حَدَّثَنِي عَمْرٌو النَّاقِدُ حَدَّثَنَا إِسْمَعِيلُ ابْنُ عُلَيَّةَ عَنْ الْجُرَيْرِيِّ عَنْ أَبِي نَضْرَةَ عَنْ أَبِي سَعِيدٍ قَالَ
لَمْ نَعْدُ أَنْ فُتِحَتْ خَيْبَرُ فَوَقَعْنَا أَصْحَابَ رَسُولِ اللَّهِ صَلَّى اللَّهُ عَلَيْهِ وَسَلَّمَ فِي تِلْكَ الْبَقْلَةِ الثُّومِ وَالنَّاسُ جِيَاعٌ فَأَكَلْنَا مِنْهَا أَكْلًا شَدِيدًا ثُمَّ رُحْنَا إِلَى الْمَسْجِدِ فَوَجَدَ رَسُولُ اللَّهِ صَلَّى اللَّهُ عَلَيْهِ وَسَلَّمَ الرِّيحَ فَقَالَ مَنْ أَكَلَ مِنْ هَذِهِ الشَّجَرَةِ الْخَبِيثَةِ شَيْئًا فَلَا يَقْرَبَنَّا فِي الْمَسْجِدِ فَقَالَ النَّاسُ حُرِّمَتْ حُرِّمَتْ فَبَلَغَ ذَاكَ النَّبِيَّ صَلَّى اللَّهُ عَلَيْهِ وَسَلَّمَ فَقَالَ أَيُّهَا النَّاسُ إِنَّهُ لَيْسَ بِي تَحْرِيمُ مَا أَحَلَّ اللَّهُ لِي وَلَكِنَّهَا شَجَرَةٌ أَكْرَهُ رِيحَهَا",12
878,6,"Telah menceritakan kepada kami [Harun bin Sa'id al-Aili] dan [Ahmad bin Isa] keduanya berkata, telah menceritakan kepada kami [Ibnu Wahb] telah mengabarkan kepadaku [Amru] dari [Bukair bin al-Asyajj] dari [Ibnu Khabbab] dari [Abu Sa'id al-Khudri] ""Bahwa Rasulullah Shallallahu'alaihiwasallam dan para sahabatnya melewati petani bawang merah. Lalu sekelompok orang dari mereka turun, lalu makan sebagian darinya, sedangkan yang lainnya belum makan, lalu kami pergi kepada beliau, maka beliau memanggil orang-orang yang belum makan bawang merah, dan mengakhirkan orang-orang lainnya (yang makan bawang merah) hingga baunya hilang.""","حَدَّثَنَا هَارُونُ بْنُ سَعِيدٍ الْأَيْلِيُّ وَأَحْمَدُ بْنُ عِيسَى قَالَا حَدَّثَنَا ابْنُ وَهْبٍ أَخْبَرَنِي عَمْرٌو عَنْ بُكَيْرِ بْنِ الْأَشَجِّ عَنْ ابْنِ خَبَّابٍ عَنْ أَبِي سَعِيدٍ الْخُدْرِيِّ
أَنَّ رَسُولَ اللَّهِ صَلَّى اللَّهُ عَلَيْهِ وَسَلَّمَ مَرَّ عَلَى زَرَّاعَةِ بَصَلٍ هُوَ وَأَصْحَابُهُ فَنَزَلَ نَاسٌ مِنْهُمْ فَأَكَلُوا مِنْهُ وَلَمْ يَأْكُلْ آخَرُونَ فَرُحْنَا إِلَيْهِ فَدَعَا الَّذِينَ لَمْ يَأْكُلُوا الْبَصَلَ وَأَخَّرَ الْآخَرِينَ حَتَّى ذَهَبَ رِيحُهَا",12
895,6,"Dan telah menceritakan kepadaku [al-Qasim bin Zakariya'] telah menceritakan kepada kami [Husain bin Ali al-Ju'fi] dari [Zaidah] dari [Sulaiman] dari [Ibrahim] dari [Alqamah] dari [Abdullah] dia berkata, ""Kami shalat bersama Rasulullah Shallallahu'alaihiwasallam, boleh jadi beliau kelebihan, boleh jadi kurang. Ibrahim berkata, 'Demi Allah, tidaklah orang itu datang melainkan dari arah depanku.' Dia berkata lagi, 'Kami berkata, 'Wahai Rasulullah, apakah ada sesuatu baru dalam shalat? ' Beliau menjawab, 'Tidak.' Perawi berkata, 'Kami berkata kepadanya tentang sesuatu yang telah diperbuatnya, maka beliau bersabda, 'Apabila seorang laki-laki kelebihan atau kurang raka'atnya, maka hendaklah dia bersujud dua kali.' Dia berkata, 'Kemudian beliau bersujud dua kali'.""","و حَدَّثَنِي الْقَاسِمُ بْنُ زَكَرِيَّاءَ حَدَّثَنَا حُسَيْنُ بْنُ عَلِيٍّ الْجُعْفِيُّ عَنْ زَائِدَةَ عَنْ سُلَيْمَانَ عَنْ إِبْرَاهِيمَ عَنْ عَلْقَمَةَ عَنْ عَبْدِ اللَّهِ قَالَ
صَلَّيْنَا مَعَ رَسُولِ اللَّهِ صَلَّى اللَّهُ عَلَيْهِ وَسَلَّمَ فَإِمَّا زَادَ أَوْ نَقَصَ قَالَ إِبْرَاهِيمُ وَايْمُ اللَّهِ مَا جَاءَ ذَاكَ إِلَّا مِنْ قِبَلِي قَالَ فَقُلْنَا يَا رَسُولَ اللَّهِ أَحَدَثَ فِي الصَّلَاةِ شَيْءٌ فَقَالَ لَا قَالَ فَقُلْنَا لَهُ الَّذِي صَنَعَ فَقَالَ إِذَا زَادَ الرَّجُلُ أَوْ نَقَصَ فَلْيَسْجُدْ سَجْدَتَيْنِ قَالَ ثُمَّ سَجَدَ سَجْدَتَيْنِ",12
