haditsId,kitabId,indo,arab,label
28,2,"Telah menceritakan kepada kami [Umayyah bin Bistham al-Aisyi] telah menceritakan kepada kami [Yazid bin Zura'i`] telah menceritakan kepada kami [Rauh] -yaitu Ibnu al-Qasim- dari [Ismail bin Umayyah] dari [Yahya bin Abdullah bin Shaifi] dari [Abu Ma'bad] dari [Ibnu Abbas] bahwa Rasulullah shallallahu 'alaihi wasallam ketika mengutus Mu'adz ke Yaman, beliau bersabda: ""Sesungguhnya kamu menghadapi suatu kaum Ahli Kitab, maka hendakah pertama kali yang kalian dakwahkan kepada mereka adalah penyembahan kepada Allah azza wa jalla, apabila mereka mengenal Allah, maka beritahukanlah bahwa Allah mewajibkan kepada mereka shalat lima waktu pada siang dan malam mereka, apabila mereka melakukannya maka beritahukanlah kepada mereka bahwa Allah telah mewajibkan zakat atas mereka yang diambil dari orang kaya mereka lalu dibagikan kepada orang fakir mereka. Jika mereka menaatimu dengan hal tersebut, maka ambillah zakat dari mereka dan takutlah dari harta mulia mereka.""","حَدَّثَنَا أُمَيَّةُ بْنُ بِسْطَامَ الْعَيْشِيُّ حَدَّثَنَا يَزِيدُ بْنُ زُرَيْعٍ حَدَّثَنَا رَوْحٌ وَهُوَ ابْنُ الْقَاسِمِ عَنْ إِسْمَعِيلَ بْنِ أُمَيَّةَ عَنْ يَحْيَى بْنِ عَبْدِ اللَّهِ بْنِ صَيْفِيٍّ عَنْ أَبِي مَعْبَدٍ عَنْ ابْنِ عَبَّاسٍ
أَنَّ رَسُولَ اللَّهِ صَلَّى اللَّهُ عَلَيْهِ وَسَلَّمَ لَمَّا بَعَثَ مُعَاذًا إِلَى الْيَمَنِ قَالَ إِنَّكَ تَقْدَمُ عَلَى قَوْمٍ أَهْلِ كِتَابٍ فَلْيَكُنْ أَوَّلَ مَا تَدْعُوهُمْ إِلَيْهِ عِبَادَةُ اللَّهِ عَزَّ وَجَلَّ فَإِذَا عَرَفُوا اللَّهَ فَأَخْبِرْهُمْ أَنَّ اللَّهَ فَرَضَ عَلَيْهِمْ خَمْسَ صَلَوَاتٍ فِي يَوْمِهِمْ وَلَيْلَتِهِمْ فَإِذَا فَعَلُوا فَأَخْبِرْهُمْ أَنَّ اللَّهَ قَدْ فَرَضَ عَلَيْهِمْ زَكَاةً تُؤْخَذُ مِنْ أَغْنِيَائِهِمْ فَتُرَدُّ عَلَى فُقَرَائِهِمْ فَإِذَا أَطَاعُوا بِهَا فَخُذْ مِنْهُمْ وَتَوَقَّ كَرَائِمَ أَمْوَالِهِمْ",12
502,4,"Telah menceritakan kepada kami [Qutaibah bin Sa'id] telah menceritakan kepada kami [Laits] --lewat jalur periwayatan lain-- dan telah menceritakan kepada kami [Muhammad bin Rumh] telah mengabarkan kepada kami [al-Laits] dari [Ibnu Syihab] dari [Urwah] dari [Aisyah] bahwa dia berkata, ""Ummu Habibah binti Jahsy telah meminta fatwa dari Rasulullah Shallallahu'alaihiwasallam kemudian berkata, 'Aku ini perempuan yang berdarah istihadhah. Maka Rasulullah Shallallahu'alaihiwasallam menjawab dengan bersabda, ' itu adalah darah penyakit, maka hendaklah kamu mandi kemudian shalatlah, maka dia mandi pada setiap waktu shalat'."" Al-Laits bin Sa'd berkata, ""Ibnu Syihab tidak menyebutkan bahwa Rasulullah shallallahu 'alaihi wasallam memerintahkan Ummu Habibah bintu Jahsy untuk mandi pada setiap waktu shalat, akan tetapi itu adalah sesuatu yang dia perbuat sendiri."" Ibnu Rumh berkata dalam riwayatnya, ""Ibnah Jahsy."" Dan tidak menyebutkan, ""Ummu Habibah.""","حَدَّثَنَا قُتَيْبَةُ بْنُ سَعِيدٍ حَدَّثَنَا لَيْثٌ ح و حَدَّثَنَا مُحَمَّدُ بْنُ رُمْحٍ أَخْبَرَنَا اللَّيْثُ عَنْ ابْنِ شِهَابٍ عَنْ عُرْوَةَ عَنْ عَائِشَةَ أَنَّهَا قَالَتْ
اسْتَفْتَتْ أُمُّ حَبِيبَةَ بِنْتُ جَحْشٍ رَسُولَ اللَّهِ صَلَّى اللَّهُ عَلَيْهِ وَسَلَّمَ فَقَالَتْ إِنِّي أُسْتَحَاضُ فَقَالَ إِنَّمَا ذَلِكِ عِرْقٌ فَاغْتَسِلِي ثُمَّ صَلِّي فَكَانَتْ تَغْتَسِلُ عِنْدَ كُلِّ صَلَاةٍ
قَالَ اللَّيْثُ بْنُ سَعْدٍ لَمْ يَذْكُرْ ابْنُ شِهَابٍ أَنَّ رَسُولَ اللَّهِ صَلَّى اللَّهُ عَلَيْهِ وَسَلَّمَ أَمَرَ أُمَّ حَبِيبَةَ بِنْتَ جَحْشٍ أَنْ تَغْتَسِلَ عِنْدَ كُلِّ صَلَاةٍ وَلَكِنَّهُ شَيْءٌ فَعَلَتْهُ هِيَ و قَالَ ابْنُ رُمْحٍ فِي رِوَايَتِهِ ابْنَةُ جَحْشٍ وَلَمْ يَذْكُرْ أُمَّ حَبِيبَةَ",12
550,4,"Telah menceritakan kepada kami [Yahya bin Yahya] dia berkata, ""Saya membaca di hadapan [Malik] dari [Abdurrahman bin al-Qasim] dari [bapaknya] dari [Aisyah radhiyallahu'anha] bahwa dia berkata, ""Kami pernah keluar bersama-sama Rasulullah Shallallahu'alaihiwasallam dalam sebagian perjalanan beliau. Hingga ketika kami tiba di al-Baida' atau di Zatul Jaisy, kalung leherku terputus dan Rasulullah Shallallahu'alaihiwasallam pun mulai mencarinya. Orang-orang juga turut mencarinya bersama Rasulullah Shallallahu'alaihiwasallam sedangkan mereka tidak di tempat yang ada airnya dan mereka tidak mempunyai air sedikit pun. Kemudian orang-orang datang menemui Abu Bakar lalu berkata, 'Tidakkah kamu melihat sesuatu yang telah dilakukan oleh Aisyah? ' Dia telah menyebabkan Rasulullah Shallallahu'alaihiwasallam, dan orang-orang mencari kalung lehernya sedangkan mereka tidak di tempat yang ada airnya dan mereka juga tidak mempunyai air sedikit pun? Kemudian Abu Bakar mendatangiku dan ketika itu Rasulullah Shallallahu'alaihiwasallam. sedang tidur dengan meletakkan kepala beliau di atas pahaku. Dia berkata, 'Kamu telah menahan Rasulullah Shallallahu'alaihiwasallam dan orang-orang, sedangkan mereka semuanya tidak berada di tempat yang ada airnya dan mereka juga tidak mempunyai air sedikit pun'. Aisyah berkata, 'Abu bakar mencelaku dengan kata-kata ""Maa-syaa-Allaah"" hingga dia memencet pangkal pahaku dengan tangannya. Aku tidak dapat bergerak karena Rasulullah Shallallahu'alaihiwasallam berada di atas pahaku. Rasulullah Shallallahu'alaihiwasallam tidur hingga keesokan harinya bangun tanpa ada air sedikit pun. Kemudian Allah menurunkan ayat tayamum. Mereka pun bertayamum. Sehubungan dengan itu, Usaid bin al-Hudhair, salah seorang pemimpin berkata, ""Ini bukanlah keberkatan yang pertama kali bagi kamu, wahai keluarga Abu Bakar! Lalu Aisyah pun berkata, ""Kemudian kami mencari unta yang aku naiki maka kami menemui kalung itu di bawahnya"".","حَدَّثَنَا يَحْيَى بْنُ يَحْيَى قَالَ قَرَأْتُ عَلَى مَالِكٍ عَنْ عَبْدِ الرَّحْمَنِ بْنِ الْقَاسِمِ عَنْ أَبِيهِ عَنْ عَائِشَةَ أَنَّهَا قَالَتْ
خَرَجْنَا مَعَ رَسُولِ اللَّهِ صَلَّى اللَّهُ عَلَيْهِ وَسَلَّمَ فِي بَعْضِ أَسْفَارِهِ حَتَّى إِذَا كُنَّا بِالْبَيْدَاءِ أَوْ بِذَاتِ الْجَيْشِ انْقَطَعَ عِقْدٌ لِي فَأَقَامَ رَسُولُ اللَّهِ صَلَّى اللَّهُ عَلَيْهِ وَسَلَّمَ عَلَى الْتِمَاسِهِ وَأَقَامَ النَّاسُ مَعَهُ وَلَيْسُوا عَلَى مَاءٍ وَلَيْسَ مَعَهُمْ مَاءٌ فَأَتَى النَّاسُ إِلَى أَبِي بَكْرٍ فَقَالُوا أَلَا تَرَى إِلَى مَا صَنَعَتْ عَائِشَةُ أَقَامَتْ بِرَسُولِ اللَّهِ صَلَّى اللَّهُ عَلَيْهِ وَسَلَّمَ وَبِالنَّاسِ مَعَهُ وَلَيْسُوا عَلَى مَاءٍ وَلَيْسَ مَعَهُمْ مَاءٌ فَجَاءَ أَبُو بَكْرٍ وَرَسُولُ اللَّهِ صَلَّى اللَّهُ عَلَيْهِ وَسَلَّمَ وَاضِعٌ رَأْسَهُ عَلَى فَخِذِي قَدْ نَامَ فَقَالَ حَبَسْتِ رَسُولَ اللَّهِ صَلَّى اللَّهُ عَلَيْهِ وَسَلَّمَ وَالنَّاسَ وَلَيْسُوا عَلَى مَاءٍ وَلَيْسَ مَعَهُمْ مَاءٌ قَالَتْ فَعَاتَبَنِي أَبُو بَكْرٍ وَقَالَ مَا شَاءَ اللَّهُ أَنْ يَقُولَ وَجَعَلَ يَطْعُنُ بِيَدِهِ فِي خَاصِرَتِي فَلَا يَمْنَعُنِي مِنْ التَّحَرُّكِ إِلَّا مَكَانُ رَسُولِ اللَّهِ صَلَّى اللَّهُ عَلَيْهِ وَسَلَّمَ عَلَى فَخِذِي فَنَامَ رَسُولُ اللَّهِ صَلَّى اللَّهُ عَلَيْهِ وَسَلَّمَ حَتَّى أَصْبَحَ عَلَى غَيْرِ مَاءٍ فَأَنْزَلَ اللَّهُ آيَةَ التَّيَمُّمِ فَتَيَمَّمُوا فَقَالَ أُسَيْدُ بْنُ الْحُضَيْرِ وَهُوَ أَحَدُ النُّقَبَاءِ مَا هِيَ بِأَوَّلِ بَرَكَتِكُمْ يَا آلَ أَبِي بَكْرٍ فَقَالَتْ عَائِشَةُ فَبَعَثْنَا الْبَعِيرَ الَّذِي كُنْتُ عَلَيْهِ فَوَجَدْنَا الْعِقْدَ تَحْتَهُ",12
552,4,"Telah menceritakan kepada kami [Yahya bin Yahya], [Abu Bakar bin Abi Syaibah] dan [Ibnu Numair] semuanya meriwayatkan dari [Abu Muawiyah] [Abu Bakar] berkata, telah menceritakan kepada kami [Abu Muawiyah] dari [al-A'masy] dari [Syaqiq] dia berkata, dia berkata, ""Aku duduk bersama Abdullah dan Abu Musa al-Asy'ari. Kemudian [Abu Musa] berkata kepada [Abdullah], 'Wahai ayah Abdurrahman, seandainya seorang lelaki berjunub lalu dia tidak mendapatkan air selama sebulan, bagaimanakah yang harus dia lakukan dengan shalatnya? ' Maka Abdullah berkata, 'Dia tidak boleh bertayamum, sekalipun dia tidak mendapati air selama sebulan'. Abu Musa berkata, 'Bagaimana dengan ayat di dalam surah al-Maidah, ""Lalu kamu tidak mendapat air (untuk berwudhu dan mandi) maka hendaklah kamu bertayamum dengan tanah yang suci."" (QS. Almaidah; 6), Abdullah berkata, 'Andai mereka diberi keringanan dengan ayat tersebut, niscaya apabila mereka merasakan air itu dingin maka mereka akan bertayamum dengan tanah.' Maka Abu Musa berkata kepada Abdullah, 'Tidakkah kamu telah mendengar kata-kata Ammar, 'Rasulullah Shallallahu'alaihiwasallam telah mengutusku untuk suatu keperluan kemudian aku berjunub, lalu aku tidak mendapati air, maka aku menggulingkan badan ke tanah sebagaimana binatang melata menggulingkan badannya?. Kemudian kutemui Nabi Shallallahu'alaihiwasallam dan kuceritakan perkara tersebut kepada beliau Shallallahu'alaihiwasallam. Maka Beliau bersabda, 'Sudah cukup memadai bagi kamu dengan kamu menepukkan tangan kamu begini, kemudian beliau menepukkan tangan beliau ke tanah dengan satu tepukan, kemudian beliau menyapu tangan kiri beliau pada tangan kanan dan belakang kedua tapak tangan serta wajah beliau."" Abdullah berkata, ""Apakah kamu tidak melihat bahwa Umar tidak puas dengan perkataan [Ammar]?."" Dan telah menceritakan kepada kami [Abu Kamil al-Jahdari] telah menceritakan kepada kami [Abdu Wahid] telah menceritakan kepada kami [al-A'masy] dari [Syaqiq] dia berkata, [Abu Musa] berkata kepada Abdullah, dan ia menggiring hadits tersebut dengan kisahnya semisal hadits Abu Mu'awiyah, hanya saja dia berkata, ""Maka Rasulullah shallallahu 'alaihi wasallam bersabda, 'Cukup memadai bagi kamu untuk mengatakan demikian, lalu beliau memukulkan kedua tangannya pada tanah, lalu mengibaskan kedua tangannya, lalu dia mengusap wajah dan kedua telapak tangannya'.""","حَدَّثَنَا يَحْيَى بْنُ يَحْيَى وَأَبُو بَكْرِ بْنُ أَبِي شَيْبَةَ وَابْنُ نُمَيْرٍ جَمِيعًا عَنْ أَبِي مُعَاوِيَةَ قَالَ أَبُو بَكْرٍ حَدَّثَنَا أَبُو مُعَاوِيَةَ عَنْ الْأَعْمَشِ عَنْ شَقِيقٍ قَالَ كُنْتُ جَالِسًا مَعَ عَبْدِ اللَّهِ وَأَبِي مُوسَى فَقَالَ أَبُو مُوسَى
يَا أَبَا عَبْدِ الرَّحْمَنِ أَرَأَيْتَ لَوْ أَنَّ رَجُلًا أَجْنَبَ فَلَمْ يَجِدْ الْمَاءَ شَهْرًا كَيْفَ يَصْنَعُ بِالصَّلَاةِ فَقَالَ عَبْدُ اللَّهِ لَا يَتَيَمَّمُ وَإِنْ لَمْ يَجِدْ الْمَاءَ شَهْرًا فَقَالَ أَبُو مُوسَى فَكَيْفَ بِهَذِهِ الْآيَةِ فِي سُورَةِ الْمَائِدَةِ
{ فَلَمْ تَجِدُوا مَاءً فَتَيَمَّمُوا صَعِيدًا طَيِّبًا }
فَقَالَ عَبْدُ اللَّهِ لَوْ رُخِّصَ لَهُمْ فِي هَذِهِ الْآيَةِ لَأَوْشَكَ إِذَا بَرَدَ عَلَيْهِمْ الْمَاءُ أَنْ يَتَيَمَّمُوا بِالصَّعِيدِ فَقَالَ أَبُو مُوسَى لِعَبْدِ اللَّهِ أَلَمْ تَسْمَعْ قَوْلَ عَمَّارٍ بَعَثَنِي رَسُولُ اللَّهِ صَلَّى اللَّهُ عَلَيْهِ وَسَلَّمَ فِي حَاجَةٍ فَأَجْنَبْتُ فَلَمْ أَجِدْ الْمَاءَ فَتَمَرَّغْتُ فِي الصَّعِيدِ كَمَا تَمَرَّغُ الدَّابَّةُ ثُمَّ أَتَيْتُ النَّبِيَّ صَلَّى اللَّهُ عَلَيْهِ وَسَلَّمَ فَذَكَرْتُ ذَلِكَ لَهُ فَقَالَ إِنَّمَا كَانَ يَكْفِيكَ أَنْ تَقُولَ بِيَدَيْكَ هَكَذَا ثُمَّ ضَرَبَ بِيَدَيْهِ الْأَرْضَ ضَرْبَةً وَاحِدَةً ثُمَّ مَسَحَ الشِّمَالَ عَلَى الْيَمِينِ وَظَاهِرَ كَفَّيْهِ وَوَجْهَهُ
فَقَالَ عَبْدُ اللَّهِ أَوَلَمْ تَرَ عُمَرَ لَمْ يَقْنَعْ بِقَوْلِ عَمَّارٍ و حَدَّثَنَا أَبُو كَامِلٍ الْجَحْدَرِيُّ حَدَّثَنَا عَبْدُ الْوَاحِدِ حَدَّثَنَا الْأَعْمَشُ عَنْ شَقِيقٍ قَالَ قَالَ أَبُو مُوسَى لِعَبْدِ اللَّهِ وَسَاقَ الْحَدِيثَ بِقِصَّتِهِ نَحْوَ حَدِيثِ أَبِي مُعَاوِيَةَ غَيْرَ أَنَّهُ قَالَ فَقَالَ رَسُولُ اللَّهِ صَلَّى اللَّهُ عَلَيْهِ وَسَلَّمَ إِنَّمَا كَانَ يَكْفِيكَ أَنْ تَقُولَ هَكَذَا وَضَرَبَ بِيَدَيْهِ إِلَى الْأَرْضِ فَنَفَضَ يَدَيْهِ فَمَسَحَ وَجْهَهُ وَكَفَّيْهِ",12
591,5,"Telah menceritakan kepada kami [Muhammad bin Rafi'] telah menceritakan kepada kami [Abdurrazzaq] telah mengabarkan kepada kami [Ibnu Juraij] telah mengabarkan kepadaku [Ibnu Syihab] dari [Abu Bakar bin Abdurrahman] bahwa dia mendengar [Abu Hurairah] berkata, ""Rasulullah apabila mendirikan shalat, maka beliau bertakbir ketika berdiri kemudian bertakbir ketika rukuk kemudian mengucapkan, 'Semoga Allah mendengar orang yang memujinya' ketika mengangkat tulang rusuknya dari rukuk, kemudian dia membaca -dalam keadaan berdiri-, 'Wahai Rabb kami, bagiMu segala puji' kemudian beliau bertakbir ketika turun sujud, kemudian bertakbir ketika mengangkat kepalanya kemudian bertakbir ketika sujud kemudian bertakbir ketika mengangkat kepalanya, kemudian melakukan seperti itu dalam shalat semuanya hingga menyelesaikannya, dan bertakbir ketika berdiri dari rakaat kedua setelah duduk. Kemudian Abu Hurairah berkata, 'aku adalah orang yang paling mirip shalatnya dengan Rasulullah Shallallahu'alaihiwasallam.' Telah menceritakan kepada kami [Muhammad bin Rafi'] telah menceritakan kepada kami [Hujain] telah menceritakan kepada kami [al-Laits] dari [Uqail] dari [Ibnu Syihab] telah mengabarkan kepadaku [Abu Bakar bin Abdurrahman bin al-Harits] bahwa dia mendengar [Abu Hurairah] berkata, ""Rasululah shallallahu 'alaihi wasallam apabila mendirikan shalat, maka bertakbir ketika berdiri"" seperti hadits Ibnu Juraij, namun dia tidak menyebutkan perkataan Abu Hurairah, 'aku adalah orang yang shalatnya paling mirip dengan Rasulullah Shallallahu'alaihiwasallam.' Dan telah menceritakan kepada kami [Harmalah bin Yahya] telah mengabarkan kepada kami [Ibnu Wahab] telah mengabarkan kepadaku [Yunus] dari [Ibnu Syihab] telah mengabarkan kepadaku [Abu Salamah bin Abdurrahman] bahwa [Abu Hurairah] ketika Marwan mengangkatnya sebagai pengganti imam pada Madinah, apabila dia mendirikan shalat wajib maka dia bertakbir. Lalu dia menyebutkan semisal hadits Ibnu Juraij. Dan dalam haditsnya, 'Ketika dia menyelesaikannya dan mengucapkan salam maka dia menghadap penghuni masjid seraya berkata, 'Demi Dzat yang jiwaku berada di TanganNya, aku adalah orang yang paling mirip shalatnya dengan Rasulullah Shallallahu'alaihiwasallam'.""","حَدَّثَنَا مُحَمَّدُ بْنُ رَافِعٍ حَدَّثَنَا عَبْدُ الرَّزَّاقِ أَخْبَرَنَا ابْنُ جُرَيْجٍ أَخْبَرَنِي ابْنُ شِهَابٍ عَنْ أَبِي بَكْرِ بْنِ عَبْدِ الرَّحْمَنِ أَنَّهُ سَمِعَ أَبَا هُرَيْرَةَ يَقُولُا
كَانَ رَسُولُ اللَّهِ صَلَّى اللَّهُ عَلَيْهِ وَسَلَّمَ إِذَا قَامَ إِلَى الصَّلَاةِ يُكَبِّرُ حِينَ يَقُومُ ثُمَّ يُكَبِّرُ حِينَ يَرْكَعُ ثُمَّ يَقُولُ سَمِعَ اللَّهُ لِمَنْ حَمِدَهُ حِينَ يَرْفَعُ صُلْبَهُ مِنْ الرُّكُوعِ ثُمَّ يَقُولُ وَهُوَ قَائِمٌ رَبَّنَا وَلَكَ الْحَمْدُ ثُمَّ يُكَبِّرُ حِينَ يَهْوِي سَاجِدًا ثُمَّ يُكَبِّرُ حِينَ يَرْفَعُ رَأْسَهُ ثُمَّ يُكَبِّرُ حِينَ يَسْجُدُ ثُمَّ يُكَبِّرُ حِينَ يَرْفَعُ رَأْسَهُ ثُمَّ يَفْعَلُ مِثْلَ ذَلِكَ فِي الصَّلَاةِ كُلِّهَا حَتَّى يَقْضِيَهَا وَيُكَبِّرُ حِينَ يَقُومُ مِنْ الْمَثْنَى بَعْدَ الْجُلُوسِ ثُمَّ يَقُولُ أَبُو هُرَيْرَةَ إِنِّي لَأَشْبَهُكُمْ صَلَاةً بِرَسُولِ اللَّهِ صَلَّى اللَّهُ عَلَيْهِ وَسَلَّمَ
حَدَّثَنِي مُحَمَّدُ بْنُ رَافِعٍ حَدَّثَنَا حُجَيْنٌ حَدَّثَنَا اللَّيْثُ عَنْ عُقَيْلٍ عَنْ ابْنِ شِهَابٍ أَخْبَرَنِي أَبُو بَكْرِ بْنُ عَبْدِ الرَّحْمَنِ بْنِ الْحَارِثِ أَنَّهُ سَمِعَ أَبَا هُرَيْرَةَ يَقُولُا كَانَ رَسُولُ اللَّهِ صَلَّى اللَّهُ عَلَيْهِ وَسَلَّمَ إِذَا قَامَ إِلَى الصَّلَاةِ يُكَبِّرُ حِينَ يَقُومُ بِمِثْلِ حَدِيثِ ابْنِ جُرَيْجٍ وَلَمْ يَذْكُرْ قَوْلَ أَبِي هُرَيْرَةَ إِنِّي أَشْبَهُكُمْ صَلَاةً بِرَسُولِ اللَّهِ صَلَّى اللَّهُ عَلَيْهِ وَسَلَّمَ و حَدَّثَنِي حَرْمَلَةُ بْنُ يَحْيَى أَخْبَرَنَا ابْنُ وَهْبٍ أَخْبَرَنِي يُونُسُ عَنْ ابْنِ شِهَابٍ أَخْبَرَنِي أَبُو سَلَمَةَ بْنُ عَبْدِ الرَّحْمَنِ أَنَّ أَبَا هُرَيْرَةَ كَانَ حِينَ يَسْتَخْلِفُهُ مَرْوَانُ عَلَى الْمَدِينَةِ إِذَا قَامَ لِلصَّلَاةِ الْمَكْتُوبَةِ كَبَّرَ فَذَكَرَ نَحْوَ حَدِيثِ ابْنِ جُرَيْجٍ وَفِي حَدِيثِهِ فَإِذَا قَضَاهَا وَسَلَّمَ أَقْبَلَ عَلَى أَهْلِ الْمَسْجِدِ قَالَ وَالَّذِي نَفْسِي بِيَدِهِ إِنِّي لَأَشْبَهُكُمْ صَلَاةً بِرَسُولِ اللَّهِ صَلَّى اللَّهُ عَلَيْهِ وَسَلَّمَ",12
601,5,"Telah menceritakan kepada kami [Yahya bin Yahya] telah mengabarkan kepada kami [Yazid yaitu Ibnu Zurai'] dari [Habib al-Mu'allim] dari ['Atha'] dia berkata, [Abu Hurairah] berkata, ""Dalam setiap shalat terdapat suatu bacaan, maka sesuatu yang diperdengarkan oleh Nabi Shallallahu'alaihiwasallam, niscaya kami memperdengarkannya kepada kalian. Dan sesuatu yang disembunyikan oleh beliau, niscaya kami menyembunyikannya dari kalian, dan barangsiapa yang membaca Umm al-Kitab, maka sungguh telah cukup baginya, dan barangsiapa menambahkan, maka itu adalah lebih baik.""","حَدَّثَنَا يَحْيَى بْنُ يَحْيَى أَخْبَرَنَا يَزِيدُ يَعْنِي ابْنَ زُرَيْعٍ عَنْ حَبِيبٍ الْمُعَلِّمِ عَنْ عَطَاءٍ قَالَ قَالَ أَبُو هُرَيْرَةَ
فِي كُلِّ صَلَاةٍ قِرَاءَةٌ فَمَا أَسْمَعَنَا النَّبِيُّ صَلَّى اللَّهُ عَلَيْهِ وَسَلَّمَ أَسْمَعْنَاكُمْ وَمَا أَخْفَى مِنَّا أَخْفَيْنَاهُ مِنْكُمْ وَمَنْ قَرَأَ بِأُمِّ الْكِتَابِ فَقَدْ أَجْزَأَتْ عَنْهُ وَمَنْ زَادَ فَهُوَ أَفْضَلُ",12
605,5,"Telah menceritakan kepada kami [Muhammad bin al-Mutsanna] dan [Ibnu Basysyar] keduanya meriwayatkan dari [Ghundar] berkata [Ibnu al-Mutsanna], telah menceritakan kepada kami [Muhammad bin Ja'far] telah menceritakan kepada kami [Syu'bah] dia berkata, saya mendengar [Qatadah] bercerita dari [Anas] dia berkata, ""Saya shalat bersama Rasulullah Shallallahu'alaihiwasallam, Abu Bakar, Umar dan Utsman, lalu aku belum pernah mendengar salah seorang dari mereka membaca, 'Bismillahirrahmanirrahim'."" Telah menceritakan kepada kami [Muhammad bin al-Mutsanna] telah menceritakan kepada kami [Abu Dawud] telah menceritakan kepada kami [Syu'bah] dalam isnad ini dan menambahkan ""Syu'bah berkata, maka saya berkata kepada [Qatadah], 'Apakah kamu mendengarnya dari [Anas]? ' Dia berkata, 'Ya, dan kami menanyakannya tentangnya'.""","حَدَّثَنَا مُحَمَّدُ بْنُ الْمُثَنَّى وَابْنُ بَشَّارٍ كِلَاهُمَا عَنْ غُنْدَرٍ قَالَ ابْنُ الْمُثَنَّى حَدَّثَنَا مُحَمَّدُ بْنُ جَعْفَرٍ حَدَّثَنَا شُعْبَةُ قَالَ سَمِعْتُ قَتَادَةَ يُحَدِّثُ عَنْ أَنَسٍ قَالَ
صَلَّيْتُ مَعَ رَسُولِ اللَّهِ صَلَّى اللَّهُ عَلَيْهِ وَسَلَّمَ وَأَبِي بَكْرٍ وَعُمَرَ وَعُثْمَانَ فَلَمْ أَسْمَعْ أَحَدًا مِنْهُمْ يَقْرَأُ بِسْمِ اللَّهِ الرَّحْمَنِ الرَّحِيمِ
حَدَّثَنَا مُحَمَّدُ بْنُ الْمُثَنَّى حَدَّثَنَا أَبُو دَاوُدَ حَدَّثَنَا شُعْبَةُ فِي هَذَا الْإِسْنَادِ وَزَادَ قَالَ شُعْبَةُ فَقُلْتُ لِقَتَادَةَ أَسَمِعْتَهُ مِنْ أَنَسٍ قَالَ نَعَمْ وَنَحْنُ سَأَلْنَاهُ عَنْهُ",12
