haditsId,kitabId,indo,arab,label
1466,9,"Dan Telah menceritakan kepada kami [Ishaq bin Ibrahim] dan [Muhammad bin Rafi' bin Rafi'] Telah menceritakan kepada kami [Abdurrazaq] telah mengabarkan kepada kami [Ibnu Juraij] telah mengabarkan kepadaku [Atha`] dari [Jabir bin Abdullah] ia berkata, saya mendengarnya berkata; ""Sesungguhnya Nabi shallallahu 'alaihi wasallam berdiri pada hari raya Iedul Fithri, lalu beliau shalat. Beliau shalat sebelum menyampaikan khuthbah. Seusai shalat, baru beliau menyampaikan khuthbah kepada manusia. Setelah Nabi shallallahu 'alaihi wasallam berkhutbah, beliau mendatangi kaum wanita lalu mengingatkan mereka sambil bersandar pada tangan Bilal. Sedangkan Bilal membentangkan kainnya, akhirnya kaum wanita pun melemparkan sedekahnya."" Saya bertanya kepada Atha`, ""Apakah itu merupakan Zakat Fithri?"" ia menjawab, ""Tidak, akan tetapi itu adalah sedekah yang mereka keluarkan, saat itu para wanita melemparkan cincin, sehingga yang lain pun turut melempar."" Saya bertanya lagi kepada Atha`, ""Apakah sekarang dapat dibenarkan, bila seorang imam mendatangi kaum wanita setelah menyampaikan khutbah lalu mengingatkan mereka?"" ia menjawab, ""Wahai Amru, sesungguhnya hal itu benar-benar termasuk tindakan yang benar, apa alasan mereka untuk tidak melakukannya?""","و حَدَّثَنَا إِسْحَقُ بْنُ إِبْرَاهِيمَ وَمُحَمَّدُ بْنُ رَافِعٍ ابْنُ رَافِعٍ حَدَّثَنَا عَبْدُ الرَّزَّاقِ أَخْبَرَنَا ابْنُ جُرَيْجٍ أَخْبَرَنِي عَطَاءٌ عَنْ جَابِرِ بْنِ عَبْدِ اللَّهِ قَالَ سَمِعْتُهُ يَقُولُ
إِنَّ النَّبِيَّ صَلَّى اللَّهُ عَلَيْهِ وَسَلَّمَ قَامَ يَوْمَ الْفِطْرِ فَصَلَّى فَبَدَأَ بِالصَّلَاةِ قَبْلَ الْخُطْبَةِ ثُمَّ خَطَبَ النَّاسَ فَلَمَّا فَرَغَ نَبِيُّ اللَّهِ صَلَّى اللَّهُ عَلَيْهِ وَسَلَّمَ نَزَلَ وَأَتَى النِّسَاءَ فَذَكَّرَهُنَّ وَهُوَ يَتَوَكَّأُ عَلَى يَدِ بِلَالٍ وَبِلَالٌ بَاسِطٌ ثَوْبَهُ يُلْقِينَ النِّسَاءُ صَدَقَةً
قُلْتُ لِعَطَاءٍ زَكَاةَ يَوْمِ الْفِطْرِ قَالَ لَا وَلَكِنْ صَدَقَةً يَتَصَدَّقْنَ بِهَا حِينَئِذٍ تُلْقِي الْمَرْأَةُ فَتَخَهَا وَيُلْقِينَ وَيُلْقِينَ قُلْتُ لِعَطَاءٍ أَحَقًّا عَلَى الْإِمَامِ الْآنَ أَنْ يَأْتِيَ النِّسَاءَ حِينَ يَفْرُغُ فَيُذَكِّرَهُنَّ قَالَ إِي لَعَمْرِي إِنَّ ذَلِكَ لَحَقٌّ عَلَيْهِمْ وَمَا لَهُمْ لَا يَفْعَلُونَ ذَلِكَ",12
1638,13,Telah menceritakan kepada kami [Qutaibah bin Sa'id] Telah menceritakan kepada kami [Laits] -dalam jalur lain- Telah menceritakan kepada kami [Muhammad bin Rumh] telah mengabarkan kepada kami [Laits] dari [Nafi'] bahwa [Abdullah bin Umar] berkata; Sesungguhnya Rasulullah shallallahu 'alaihi wasallam memerintahkan untuk membayar Zakat Fithri berupa satu sha' kurma atau satu sha' gandum. Ibnu Umar berkata; Maka orang-orang pun menyamakannya dengan dua Mud gandum.,"حَدَّثَنَا قُتَيْبَةُ بْنُ سَعِيدٍ حَدَّثَنَا لَيْثٌ ح و حَدَّثَنَا مُحَمَّدُ بْنُ رُمْحٍ أَخْبَرَنَا اللَّيْثُ عَنْ نَافِعٍ أَنَّ عَبْدَ اللَّهِ بْنَ عُمَرَ قَالَ
إِنَّ رَسُولَ اللَّهِ صَلَّى اللَّهُ عَلَيْهِ وَسَلَّمَ أَمَرَ بِزَكَاةِ الْفِطْرِ صَاعٍ مِنْ تَمْرٍ أَوْ صَاعٍ مِنْ شَعِيرٍ
قَالَ ابْنُ عُمَرَ فَجَعَلَ النَّاسُ عَدْلَهُ مُدَّيْنِ مِنْ حِنْطَةٍ",12
1640,13,"Telah menceritakan kepada kami [Yahya bin Yahya] ia berkata, saya telah membacakan kepada [Malik] dari [Zaid bin Aslam] dari [Iyadl bin Abdullah bin Sa'd bin Abu Sarh] bahwa ia mendengar [Abu Sa'id Al Khudri] berkata; ""Kami membayar zakat fithri berupa satu sha' gandum atau kurma atau satu sha' keju atau anggur kering.""","حَدَّثَنَا يَحْيَى بْنُ يَحْيَى قَالَ قَرَأْتُ عَلَى مَالِكٍ عَنْ زَيْدِ بْنِ أَسْلَمَ عَنْ عِيَاضِ بْنِ عَبْدِ اللَّهِ بْنِ سَعْدِ بْنِ أَبِي سَرْحٍ أَنَّهُ سَمِعَ أَبَا سَعِيدٍ الْخُدْرِيَّ يَقُولُا
كُنَّا نُخْرِجُ زَكَاةَ الْفِطْرِ صَاعًا مِنْ طَعَامٍ أَوْ صَاعًا مِنْ شَعِيرٍ أَوْ صَاعًا مِنْ تَمْرٍ أَوْ صَاعًا مِنْ أَقِطٍ أَوْ صَاعًا مِنْ زَبِيبٍ",12
1641,13,"Telah menceritakan kepada kami [Abdullah bin Maslamah bin Qa'nab] Telah menceritakan kepada kami [Dawud bin Qais] dari [Iyadl bin Abdullah] dari [Sa'id Al Khudri] ia berkata; Pada masa Rasulullah shallallahu 'alaihi wasallam masih hidup, kami membayar zakat fithrah untuk setiap orang, baik anak kecil maupun dewasa, merdeka maupun budak, yaitu satu sha' makanan berupa keju, atau gandum, atau kurma atau anggur kering. Pada masa pemerintahan Mu'awiyah bin Abu Sufyan, dia berpidato di hadapan jama'ah haji atau umrah, katanya antara lain; ""Dua Mud gandum negeri Syam sama dengan satu sha' kurma."" Karena pidatonya itu maka banyak orang yang membayar zakat fithrahnya seperti itu. Abu Sa'id berkata, ""Tetapi aku tetap saja membayar seperti apa yang telah kulakukan sejak zaman Nabi shallallahu 'alaihi wasallam hingga akhir hayatku.""","حَدَّثَنَا عَبْدُ اللَّهِ بْنُ مَسْلَمَةَ بْنِ قَعْنَبٍ حَدَّثَنَا دَاوُدُ يَعْنِي ابْنَ قَيْسٍ عَنْ عِيَاضِ بْنِ عَبْدِ اللَّهِ عَنْ أَبِي سَعِيدٍ الْخُدْرِيِّ قَالَ
كُنَّا نُخْرِجُ إِذْ كَانَ فِينَا رَسُولُ اللَّهِ صَلَّى اللَّهُ عَلَيْهِ وَسَلَّمَ زَكَاةَ الْفِطْرِ عَنْ كُلِّ صَغِيرٍ وَكَبِيرٍ حُرٍّ أَوْ مَمْلُوكٍ صَاعًا مِنْ طَعَامٍ أَوْ صَاعًا مِنْ أَقِطٍ أَوْ صَاعًا مِنْ شَعِيرٍ أَوْ صَاعًا مِنْ تَمْرٍ أَوْ صَاعًا مِنْ زَبِيبٍ
فَلَمْ نَزَلْ نُخْرِجُهُ حَتَّى قَدِمَ عَلَيْنَا مُعَاوِيَةُ بْنُ أَبِي سُفْيَانَ حَاجًّا أَوْ مُعْتَمِرًا فَكَلَّمَ النَّاسَ عَلَى الْمِنْبَرِ فَكَانَ فِيمَا كَلَّمَ بِهِ النَّاسَ أَنْ قَالَ إِنِّي أَرَى أَنَّ مُدَّيْنِ مِنْ سَمْرَاءِ الشَّامِ تَعْدِلُ صَاعًا مِنْ تَمْرٍ فَأَخَذَ النَّاسُ بِذَلِكَ قَالَ أَبُو سَعِيدٍ فَأَمَّا أَنَا فَلَا أَزَالُ أُخْرِجُهُ كَمَا كُنْتُ أُخْرِجُهُ أَبَدًا مَا عِشْتُ",12
1643,13,"Dan telah menceritakan kepadaku [Muhammad bin Rafi'] Telah menceritakan kepada kami [Abdurrazaq] telah mengabarkan kepada kami [Ibnu Juraij] dari [Harits bin Abdurrahman bin Abu Dzubab] dari [Iyadl bin Abdullah bin Abu Sarh] dari [Sa'id Al Khudri] ia berkata; ""Kami membayar zakat fithrah dari tiga jenis bahan pokok, yaitu keji, kurma dan gandum.""","و حَدَّثَنِي مُحَمَّدُ بْنُ رَافِعٍ حَدَّثَنَا عَبْدُ الرَّزَّاقِ أَخْبَرَنَا ابْنُ جُرَيْجٍ عَنْ الْحَارِثِ بْنِ عَبْدِ الرَّحْمَنِ بْنِ أَبِي ذُبَابٍ عَنْ عِيَاضِ بْنِ عَبْدِ اللَّهِ بْنِ أَبِي سَرْحٍ عَنْ أَبِي سَعِيدٍ الْخُدْرِيِّ قَالَ
كُنَّا نُخْرِجُ زَكَاةَ الْفِطْرِ مِنْ ثَلَاثَةِ أَصْنَافٍ الْأَقِطِ وَالتَّمْرِ وَالشَّعِيرِ",12
1644,13,"Dan telah menceritakan kepadaku [Amru An Naqid] Telah menceritakan kepada kami [Hatim bin Isma'il] dari [Ibnu Ajlan] dari [Iyadl bin Abdullah bin Abu Sarh] dari [Sa'id Al Khudri] bahwa ketika Mu'awiyah menyamakan setengah sha' gandum dengan satu sha' kurma, maka Abu Sa'id mengingkari hal itu seraya berkata, ""Saya tidak akan mengeluarkan zakat fithrah kecuali dengan bahan pokok yang saya keluarkan pada masa Rasulullah shallallahu 'alaihi wasallam, yaitu satu sha' kurma, atau satu sha' anggur kering atau satu sha' dari gandum atau keju.""","و حَدَّثَنِي عَمْرٌو النَّاقِدُ حَدَّثَنَا حَاتِمُ بْنُ إِسْمَعِيلَ عَنْ ابْنِ عَجْلَانَ عَنْ عِيَاضِ بْنِ عَبْدِ اللَّهِ بْنِ أَبِي سَرْحٍ عَنْ أَبِي سَعِيدٍ الْخُدْرِيِّ
أَنَّ مُعَاوِيَةَ لَمَّا جَعَلَ نِصْفَ الصَّاعِ مِنْ الْحِنْطَةِ عَدْلَ صَاعٍ مِنْ تَمْرٍ أَنْكَرَ ذَلِكَ أَبُو سَعِيدٍ وَقَالَ لَا أُخْرِجُ فِيهَا إِلَّا الَّذِي كُنْتُ أُخْرِجُ فِي عَهْدِ رَسُولِ اللَّهِ صَلَّى اللَّهُ عَلَيْهِ وَسَلَّمَ صَاعًا مِنْ تَمْرٍ أَوْ صَاعًا مِنْ زَبِيبٍ أَوْ صَاعًا مِنْ شَعِيرٍ أَوْ صَاعًا مِنْ أَقِطٍ",12
1645,13,Telah menceritakan kepada kami [Yahya bin Yahya] telah mengabarkan kepada kami [Abu Khaitsamah] dari [Musa bin Uqbah] dari [Nafi'] dari [Ibnu Umar] bahwa Rasulullah shallallahu 'alaihi wasallam memerintahkan agar membayar zakat fithrah sebelum manusia berangkat menunaikan shalat Ied.,"حَدَّثَنَا يَحْيَى بْنُ يَحْيَى أَخْبَرَنَا أَبُو خَيْثَمَةَ عَنْ مُوسَى بْنِ عُقْبَةَ عَنْ نَافِعٍ عَنْ ابْنِ عُمَرَ
أَنَّ رَسُولَ اللَّهِ صَلَّى اللَّهُ عَلَيْهِ وَسَلَّمَ أَمَرَ بِزَكَاةِ الْفِطْرِ أَنْ تُؤَدَّى قَبْلَ خُرُوجِ النَّاسِ إِلَى الصَّلَاةِ",12
1646,13,Telah menceritakan kepada kami [Muhammad bin Rafi'] Telah menceritakan kepada kami [Ibnu Abu Fudaik] telah mengabarkan kepada kami [Adl Dlahak] dari [Nafi'] dari [Abdullah bin Umar] bahwa Rasulullah shallallahu 'alaihi wasallam memerintahkan agar membayar zakat fithrah sebelum manusia berangkat untuk menunaikan shalat Ied.,"حَدَّثَنَا مُحَمَّدُ بْنُ رَافِعٍ حَدَّثَنَا ابْنُ أَبِي فُدَيْكٍ أَخْبَرَنَا الضَّحَّاكُ عَنْ نَافِعٍ عَنْ عَبْدِ اللَّهِ بْنِ عُمَرَ
أَنَّ رَسُولَ اللَّهِ صَلَّى اللَّهُ عَلَيْهِ وَسَلَّمَ أَمَرَ بِإِخْرَاجِ زَكَاةِ الْفِطْرِ أَنْ تُؤَدَّى قَبْلَ خُرُوجِ النَّاسِ إِلَى الصَّلَاةِ",12
1647,13,"Dan telah menceritakan kepadaku [Suwaid bin Sa'id] Telah menceritakan kepada kami [Hafsh yaitu putra Maisarah Ash Shan'ani] dari [Zaid bin Aslam] bahwa [Abu Shalih Dzakwan] bahwa ia mendengar [Abu Hurairah] berkata; Rasulullah shallallahu 'alaihi wasallam bersabda: ""Siapa yang mempunyai emas dan perak, tetapi dia tidak membayar zakatnya, maka di hari kiamat akan dibuatkan untuknya seterika api yang dinyalakan di dalam neraka, lalu diseterikakan ke perut, dahi dan punggungnya. Setiap seterika itu dingin, maka akan dipanaskan kembali lalu diseterikakan pula padanya setiap hari -sehari setara lima puluh tahun (di dunia) - hingga perkaranya diputuskan. Setelah itu, barulah ia melihat jalannya keluar, adakalanya ke surga dan adakalanya ke neraka."" Kemudian ditanyakan kepada beliau, ""Wahai Rasulullah, lantas bagaimana dengan unta?"" beliau menjawab: ""Begitu pula unta, jika pemiliknya tidak membayarkan zakatnya. Diantara zakatnya adalah membayar shadaqah dengan susu yang diperah darinya pada hari ketika ia mendatangi air untuk meminumnya. Maka pada hari kiamat kelak, orang itu akan ditelentangkan di tempat yang rata agar diinjak-injak oleh unta-unta yang paling besar dan gemuk-gemuk, serta anak-anaknya yang paling kecil. Semuanya menginjak-injak dengan kukunya serta menggigit dengan giginya yang tajam. Setiap yang pertama lewat, datang pula yang lain menginjak-injaknya. Demikianlah hal itu berlangsung setiap hari hingga perkaranya selesai diadili. Satu hari di sana sama dengan lima puluh ribu tahun di dunia. Setelah itu, barulah ia dapat melihat jalannya keluar, mungkin ke surga dan mungkin pula ke neraka."" Kemudian ditanyakan kembali pada beliau, ""Wahai Rasulullah, lantas bagaimana dengan sapi dan kambing?"" Beliau menjawab: ""Ya, tidak ketinggalan pula pemilik sapi dan kambing yang tidak membayar zakatnya. Niscaya pada hari kiamat kelak, dia akan ditelentangkan di suatu tempat yang rata, supaya diinjak-injak oleh sapi dan kambing itu dengan kukunya yang tajam dan juga menanduknya dengan tanduk-tanduknya, baik kambing tersebut bengkok tanduknya atau tidak bertanduk ataupun pecah tanduknya. Bila yang pertama telah lewat, maka akan diikuti pula oleh yang kedua dan seterusnya, hingga perkaranya selesai diputuskan. Satu hari di dunia sama dengan lima puluh ribu tahun di dunia. Setelah itu, ia baru bisa melihat jalannya keluar, apakah dia ke surga ataukah ke neraka."" Kemudian ditanyakan lagi kepada beliau, ""Jika kuda bagaimana ya Rasulullah?"" beliau menjawab: ""Kuda itu ada tiga macam, yaitu; (Pertama), yang bisa mendatangkan dosa, (kedua) sebagai penghalang dan (ketiga) yang bisa mendatangkan pahala. Sedangkan kuda yang mendatangkan dosa adalah apabila orang memeliharanya karena riya`, untuk kemegahan dan kebanggaan serta untuk memerangi Islam. Maka kuda bagi orang itu menjadi sumber dosa. (Kedua), kuda sebagai penghalang, yaitu kuda yang dipersiapkan untuk jihad di jalan Allah, kemudian pemiliknya tidak lupa akan hak Allah dengan cara memeliharanya dan mempergunakannya untuk berjihad, maka kuda bagi orang itu adalah sebagai pelindung baginya. (Ketiga), kuda sebagai ladang pahala. Yaitu kuda yang dipersiapkan untuk berjihad di jalan Allah dan membela kepentingan umat Islam di ladang-ladang penggembalaan mereka. Maka apa-apa yang dimakan kuda itu di ladang tersebut, dituliskan bagi pemilik kebun kebajikan sebanyak apa yang dimakan kuda tersebut dan dituliskan pula kebajikan sebanyak kotoran dan air kencing yang dikeluarkan kuda tersebut. Bila tali kuda itu terputus, kemudian kuda itu lari jauh, maka dituliskan untuk pemiliknya kebajikan sebanyak jejak dan tahi kuda itu. Setiap kuda itu melewati sungai, lalu ia minum tanpa sengaja atau diberi minum oleh pemiliknya, maka Allah akan menuliskan kebajikan bagi pemiliknya sebanyak air yang diminum kudanya itu."" Setelah itu, ditanyakan lagi kepada beliau, ""Bagaimana kalau himar (keledai) wahai Rasulullah?"" Beliau menjawab: ""Allah tiada menurunkan wahyu apa-apa kepadaku mengenai himar, selain ayat yang pendek tetapi mencakup yaitu, 'Barangsiapa yang mengerjakan kebajikan sebesar zarrah (biji sawi), niscaya ia akan melihat (pahala) nya. Dan barangsiapa yang mengerjakan keburukan seberat zarrah, niscaya ia akan melihat pula balasannya.'"" Dan telah menceritakan kepadaku [Yunus bin Abdul A'la Ash Shadafi] telah mengabarkan kepada kami [Abdullah bin Wahb] telah menceritakan kepadaku [Hisyam bin Sa'd] dari [Zaid bin Aslam] dalam isnad ini, dan semakna dengan hadits Hafsh bin Maisarah hingga akhirnya. Hanya saja ia mengatakan; ""Siapa pun pemilik Unta yang tidak membayar haknya (zakatnya)."" Dia tidak mengatakan; ""Minhaa haqqihaa"" (dari haknya)."" Dan ia menyebutkan didalamnya: ""laa yafqidu minhaa fashiilan waahidan"", ia berkata: ""yukwa bihaa janbahu wa jabhatuhu wa dhahruhu"" (lalu diseterikakan ke perut, dahi dan punggungnya).","و حَدَّثَنِي سُوَيْدُ بْنُ سَعِيدٍ حَدَّثَنَا حَفْصٌ يَعْنِي ابْنَ مَيْسَرَةَ الصَّنْعَانِيَّ عَنْ زَيْدِ بْنِ أَسْلَمَ أَنَّ أَبَا صَالِحٍ ذَكْوَانَ أَخْبَرَهُ أَنَّهُ سَمِعَ أَبَا هُرَيْرَةَ يَقُولُا
قَالَ رَسُولُ اللَّهِ صَلَّى اللَّهُ عَلَيْهِ وَسَلَّمَ مَا مِنْ صَاحِبِ ذَهَبٍ وَلَا فِضَّةٍ لَا يُؤَدِّي مِنْهَا حَقَّهَا إِلَّا إِذَا كَانَ يَوْمُ الْقِيَامَةِ صُفِّحَتْ لَهُ صَفَائِحُ مِنْ نَارٍ فَأُحْمِيَ عَلَيْهَا فِي نَارِ جَهَنَّمَ فَيُكْوَى بِهَا جَنْبُهُ وَجَبِينُهُ وَظَهْرُهُ كُلَّمَا بَرَدَتْ أُعِيدَتْ لَهُ فِي يَوْمٍ كَانَ مِقْدَارُهُ خَمْسِينَ أَلْفَ سَنَةٍ حَتَّى يُقْضَى بَيْنَ الْعِبَادِ فَيَرَى سَبِيلَهُ إِمَّا إِلَى الْجَنَّةِ وَإِمَّا إِلَى النَّارِ قِيلَ يَا رَسُولَ اللَّهِ فَالْإِبِلُ قَالَ وَلَا صَاحِبُ إِبِلٍ لَا يُؤَدِّي مِنْهَا حَقَّهَا وَمِنْ حَقِّهَا حَلَبُهَا يَوْمَ وِرْدِهَا إِلَّا إِذَا كَانَ يَوْمُ الْقِيَامَةِ بُطِحَ لَهَا بِقَاعٍ قَرْقَرٍ أَوْفَرَ مَا كَانَتْ لَا يَفْقِدُ مِنْهَا فَصِيلًا وَاحِدًا تَطَؤُهُ بِأَخْفَافِهَا وَتَعَضُّهُ بِأَفْوَاهِهَا كُلَّمَا مَرَّ عَلَيْهِ أُولَاهَا رُدَّ عَلَيْهِ أُخْرَاهَا فِي يَوْمٍ كَانَ مِقْدَارُهُ خَمْسِينَ أَلْفَ سَنَةٍ حَتَّى يُقْضَى بَيْنَ الْعِبَادِ فَيَرَى سَبِيلَهُ إِمَّا إِلَى الْجَنَّةِ وَإِمَّا إِلَى النَّارِ قِيلَ يَا رَسُولَ اللَّهِ فَالْبَقَرُ وَالْغَنَمُ قَالَ وَلَا صَاحِبُ بَقَرٍ وَلَا غَنَمٍ لَا يُؤَدِّي مِنْهَا حَقَّهَا إِلَّا إِذَا كَانَ يَوْمُ الْقِيَامَةِ بُطِحَ لَهَا بِقَاعٍ قَرْقَرٍ لَا يَفْقِدُ مِنْهَا شَيْئًا لَيْسَ فِيهَا عَقْصَاءُ وَلَا جَلْحَاءُ وَلَا عَضْبَاءُ تَنْطَحُهُ بِقُرُونِهَا وَتَطَؤُهُ بِأَظْلَافِهَا كُلَّمَا مَرَّ عَلَيْهِ أُولَاهَا رُدَّ عَلَيْهِ أُخْرَاهَا فِي يَوْمٍ كَانَ مِقْدَارُهُ خَمْسِينَ أَلْفَ سَنَةٍ حَتَّى يُقْضَى بَيْنَ الْعِبَادِ فَيَرَى سَبِيلَهُ إِمَّا إِلَى الْجَنَّةِ وَإِمَّا إِلَى النَّارِ قِيلَ يَا رَسُولَ اللَّهِ فَالْخَيْلُ قَالَ الْخَيْلُ ثَلَاثَةٌ هِيَ لِرَجُلٍ وِزْرٌ وَهِيَ لِرَجُلٍ سِتْرٌ وَهِيَ لِرَجُلٍ أَجْرٌ فَأَمَّا الَّتِي هِيَ لَهُ وِزْرٌ فَرَجُلٌ رَبَطَهَا رِيَاءً وَفَخْرًا وَنِوَاءً عَلَى أَهْلِ الْإِسْلَامِ فَهِيَ لَهُ وِزْرٌ وَأَمَّا الَّتِي هِيَ لَهُ سِتْرٌ فَرَجُلٌ رَبَطَهَا فِي سَبِيلِ اللَّهِ ثُمَّ لَمْ يَنْسَ حَقَّ اللَّهِ فِي ظُهُورِهَا وَلَا رِقَابِهَا فَهِيَ لَهُ سِتْرٌ وَأَمَّا الَّتِي هِيَ لَهُ أَجْرٌ فَرَجُلٌ رَبَطَهَا فِي سَبِيلِ اللَّهِ لِأَهْلِ الْإِسْلَامِ فِي مَرْجٍ وَرَوْضَةٍ فَمَا أَكَلَتْ مِنْ ذَلِكَ الْمَرْجِ أَوْ الرَّوْضَةِ مِنْ شَيْءٍ إِلَّا كُتِبَ لَهُ عَدَدَ مَا أَكَلَتْ حَسَنَاتٌ وَكُتِبَ لَهُ عَدَدَ أَرْوَاثِهَا وَأَبْوَالِهَا حَسَنَاتٌ وَلَا تَقْطَعُ طِوَلَهَا فَاسْتَنَّتْ شَرَفًا أَوْ شَرَفَيْنِ إِلَّا كَتَبَ اللَّهُ لَهُ عَدَدَ آثَارِهَا وَأَرْوَاثِهَا حَسَنَاتٍ وَلَا مَرَّ بِهَا صَاحِبُهَا عَلَى نَهْرٍ فَشَرِبَتْ مِنْهُ وَلَا يُرِيدُ أَنْ يَسْقِيَهَا إِلَّا كَتَبَ اللَّهُ لَهُ عَدَدَ مَا شَرِبَتْ حَسَنَاتٍ قِيلَ يَا رَسُولَ اللَّهِ فَالْحُمُرُ قَالَ مَا أُنْزِلَ عَلَيَّ فِي الْحُمُرِ شَيْءٌ إِلَّا هَذِهِ الْآيَةَ الْفَاذَّةُ الْجَامِعَةُ
{ فَمَنْ يَعْمَلْ مِثْقَالَ ذَرَّةٍ خَيْرًا يَرَهُ وَمَنْ يَعْمَلْ مِثْقَالَ ذَرَّةٍ شَرًّا يَرَهُ }
و حَدَّثَنِي يُونُسُ بْنُ عَبْدِ الْأَعْلَى الصَّدَفِيُّ أَخْبَرَنَا عَبْدُ اللَّهِ بْنُ وَهْبٍ حَدَّثَنِي هِشَامُ بْنُ سَعْدٍ عَنْ زَيْدِ بْنِ أَسْلَمَ فِي هَذَا الْإِسْنَادِ بِمَعْنَى حَدِيثِ حَفْصِ بْنِ مَيْسَرَةَ إِلَى آخِرِهِ غَيْرَ أَنَّهُ قَالَ مَا مِنْ صَاحِبِ إِبِلٍ لَا يُؤَدِّي حَقَّهَا وَلَمْ يَقُلْ مِنْهَا حَقَّهَا وَذَكَرَ فِيهِ لَا يَفْقِدُ مِنْهَا فَصِيلًا وَاحِدًا وَقَالَ يُكْوَى بِهَا جَنْبَاهُ وَجَبْهَتُهُ وَظَهْرُهُ",12
