haditsId,kitabId,indo,arab,label
1648,13,"Dan telah menceritakan kepadaku [Muhammad bin Abdul Malik Al Umawi] Telah menceritakan kepada kami [Abdul Aziz bin Al Mukhtar] Telah menceritakan kepada kami [Suhail bin Abu Shalih] dari [bapaknya] dari [Abu Hurairah] ia berkata; Rasulullah shallallahu 'alaihi wasallam bersabda: ""Tidaklah seorang pemilik harta benda yang tidak membayar zakatnya, melainkan pada hari kiamat akan dibuatkan untuknya seterika api yang dipanaskan di neraka Jahannam, kemudian disetrikakan pada lambungnya, dahinya dan punggungya. Hingga Allah memutuskan diantara hamba-hambaNya di suatu hari yang lamanya sama dengan lima puluh ribu tahun dibanding hari di dunia. Kemudian barulah dilihatkan jalannya ke surga atau ke neraka. Dan tidak ada seorang pemilik unta pun yang enggan mengeluarkan haknya (zakat dari untanya) melainkan (pada hari kiamat kelak) ia dilentangkan di suatu tempat yang datar, lalu ia diinjak dan digigit oleh unta-unta itu. Setiap kali unta yang terakhir telah melaluinya, maka unta yang pertama kembali melaluinya. Demikianlah hingga Allah memutuskan perkara di antara para manusia pada suatu hari, dimana waktu itu sama dengan lima puluh ribu tahun (di dunia), dan baru ia akan melihat jalannya, apakah ke surga ataukah ke neraka. Dan tidak seorang pemilik kambing yang tidak menunaikan zakatnya melainkan pada hari kiamat ia akan dilentangkan pada tempat yang datar, lalu kambing-kambing itu menginjaknya dengan kukunya dan menanduknya dengan tanduk-tanduknya. Di antara kambing itu tidak ada yang bengkok tanduknya dan tidak ada pula yang tidak bertanduk. Setiap kali kambing yang terakhir telah melaluinya, maka kambing yang pertama kembali melaluinya. Demikianlah hingga Allah memutuskan perkara di antara para manusia pada suatu hari, dimana waktu itu sama dengan lima puluh ribu tahun (di dunia), dan baru ia akan melihat jalannya, apakah ke surga ataukah ke neraka."" Suhail berkata; ""Aku tidak tahu, apakah beliau menyebutkan sapi atau tidak."" Kemudian para sahabat bertanya, ""Bagaimana dengan kuda, ya Rasulullah?"" beliau bersabda: ""Pada ubun-ubun kuda itu, padanya terikat kebaikan hingga hari kiamat. Kuda itu tiga macam; yaitu kuda yang pemiliknya akan mendapatkan pahala, kuda yang menjadi perisai, dan kuda yang pemiliknya mendapatkan dosa. Adapun kuda yang pemiliknya mendapat pahala adalah kuda yang dipersiapkan untuk membela agama Allah, dan untuk berjihad di jalan Allah. Maka apa-apa yang dimakan kuda itu dituliskan bagi pemiliknya kebajikan sebanyak apa yang dimakan kuda tersebut. Jika ia menggembalakannya di padang gembalaan maka akan ditulis bagi pemiliknya kebajikan sebanyak yang dimakannya. Bila kuda tersebut diberi air minum dari sungai maka akan dituliskan kebajikan bagi pemiliknya sebanyak air yang diminumnya. Bila tali kuda itu terputus, kemudian kuda itu lari ke tempat yang tinggi maka dituliskan untuk pemiliknya kebajikan sebanyak jejak yang dilalui kuda itu. Sedangkan kuda yang menjadi perisai bagi pemiliknya adalah orang yang memelihara kuda untuk kemuliaan dan perhiasan dengan tidak melupakan hak Allah, yaitu dijadikan sebagai tunggangan dan diperhatikan pula makanannya, baik di masa mudah atau sulit. Sedangkan kuda yang pemiliknya akan mendapat dosa ialah apabila orang memeliharanya untuk menyombongkan diri dan karena riya`, maka kuda bagi orang itu menjadi sumber dosa."" Para sahabat bertanya lagi, ""Bagaimana dengan keledai wahai Rasulullah?"" Beliau bersabda: ""Tidak ada sesuatu yang diturunkan oleh Allah tentang himar kecuali ayat ini yang pendek namun menyeluruh; 'Barangsiapa yang mengerjakan kebajikan sebesar zarrah (biji sawi), niscaya ia akan melihat (pahala) nya. Dan barangsiapa yang mengerjakan keburukan seberat zarrah, niscaya ia akan melihat pula balasannya.'"" Dan telah menceritakannya kepada kami [Qutaibah bin Sa'id] Telah menceritakan kepada kami [Abdul Aziz Ad Darawardi] dari [Suhail] dengan isnad ini, dan ia pun menuturkan hadits itu. Dan telah menceritakannya kepadaku [Muhammad bin Abdullah bin Bazi'] Telah menceritakan kepada kami [Yazid bin Zurai'] Telah menceritakan kepada kami [Rauh bin Al Qasim] Telah menceritakan kepada kami [Shuhail bin Abu Shalih] dengan isnad ini dan ia berkata; Ia mengganti AQSHAA` dengan ADLBAA`. Dan ia juga menyebutkan; ""Lalu disetrikakan pada lambung dan punggungnya."" dan ia tidak menyebutkan ""JABINUHU (keningnya)."" Dan telah menceritakan kepadaku [Harun bin Sa'id Al Aili] Telah menceritakan kepada kami [Ibnu Wahb] telah mengabarkan kepadaku [Amru bin Harits] bahwa [Bukair] telah menceritakan kepadanya dari [Dzakwan] dari [Abu Hurairah] dari Rasulullah shallallahu 'alaihi wasallam bahwa beliau bersabda: ""Jika seorang hamba tidak menunaikan hak Allah atau Shadaqah (zakat) untanya…"" Lalu ia menuturkan hadits sebagaimana hadits Suhail dari bapaknya.","و حَدَّثَنِي مُحَمَّدُ بْنُ عَبْدِ الْمَلِكِ الْأُمَوِيُّ حَدَّثَنَا عَبْدُ الْعَزِيزِ بْنُ الْمُخْتَارِ حَدَّثَنَا سُهَيْلُ بْنُ أَبِي صَالِحٍ عَنْ أَبِيهِ عَنْ أَبِي هُرَيْرَةَ قَالَ
قَالَ رَسُولُ اللَّهِ صَلَّى اللَّهُ عَلَيْهِ وَسَلَّمَ مَا مِنْ صَاحِبِ كَنْزٍ لَا يُؤَدِّي زَكَاتَهُ إِلَّا أُحْمِيَ عَلَيْهِ فِي نَارِ جَهَنَّمَ فَيُجْعَلُ صَفَائِحَ فَيُكْوَى بِهَا جَنْبَاهُ وَجَبِينُهُ حَتَّى يَحْكُمَ اللَّهُ بَيْنَ عِبَادِهِ فِي يَوْمٍ كَانَ مِقْدَارُهُ خَمْسِينَ أَلْفَ سَنَةٍ ثُمَّ يَرَى سَبِيلَهُ إِمَّا إِلَى الْجَنَّةِ وَإِمَّا إِلَى النَّارِ وَمَا مِنْ صَاحِبِ إِبِلٍ لَا يُؤَدِّي زَكَاتَهَا إِلَّا بُطِحَ لَهَا بِقَاعٍ قَرْقَرٍ كَأَوْفَرِ مَا كَانَتْ تَسْتَنُّ عَلَيْهِ كُلَّمَا مَضَى عَلَيْهِ أُخْرَاهَا رُدَّتْ عَلَيْهِ أُولَاهَا حَتَّى يَحْكُمَ اللَّهُ بَيْنَ عِبَادِهِ فِي يَوْمٍ كَانَ مِقْدَارُهُ خَمْسِينَ أَلْفَ سَنَةٍ ثُمَّ يَرَى سَبِيلَهُ إِمَّا إِلَى الْجَنَّةِ وَإِمَّا إِلَى النَّارِ وَمَا مِنْ صَاحِبِ غَنَمٍ لَا يُؤَدِّي زَكَاتَهَا إِلَّا بُطِحَ لَهَا بِقَاعٍ قَرْقَرٍ كَأَوْفَرِ مَا كَانَتْ فَتَطَؤُهُ بِأَظْلَافِهَا وَتَنْطَحُهُ بِقُرُونِهَا لَيْسَ فِيهَا عَقْصَاءُ وَلَا جَلْحَاءُ كُلَّمَا مَضَى عَلَيْهِ أُخْرَاهَا رُدَّتْ عَلَيْهِ أُولَاهَا حَتَّى يَحْكُمَ اللَّهُ بَيْنَ عِبَادِهِ فِي يَوْمٍ كَانَ مِقْدَارُهُ خَمْسِينَ أَلْفَ سَنَةٍ مِمَّا تَعُدُّونَ ثُمَّ يَرَى سَبِيلَهُ إِمَّا إِلَى الْجَنَّةِ وَإِمَّا إِلَى النَّارِ قَالَ سُهَيْلٌ فَلَا أَدْرِي أَذَكَرَ الْبَقَرَ أَمْ لَا قَالُوا فَالْخَيْلُ يَا رَسُولَ اللَّهِ قَالَ الْخَيْلُ فِي نَوَاصِيهَا أَوْ قَالَ الْخَيْلُ مَعْقُودٌ فِي نَوَاصِيهَا قَالَ سُهَيْلٌ أَنَا أَشُكُّ الْخَيْرُ إِلَى يَوْمِ الْقِيَامَةِ الْخَيْلُ ثَلَاثَةٌ فَهِيَ لِرَجُلٍ أَجْرٌ وَلِرَجُلٍ سِتْرٌ وَلِرَجُلٍ وِزْرٌ فَأَمَّا الَّتِي هِيَ لَهُ أَجْرٌ فَالرَّجُلُ يَتَّخِذُهَا فِي سَبِيلِ اللَّهِ وَيُعِدُّهَا لَهُ فَلَا تُغَيِّبُ شَيْئًا فِي بُطُونِهَا إِلَّا كَتَبَ اللَّهُ لَهُ أَجْرًا وَلَوْ رَعَاهَا فِي مَرْجٍ مَا أَكَلَتْ مِنْ شَيْءٍ إِلَّا كَتَبَ اللَّهُ لَهُ بِهَا أَجْرًا وَلَوْ سَقَاهَا مِنْ نَهْرٍ كَانَ لَهُ بِكُلِّ قَطْرَةٍ تُغَيِّبُهَا فِي بُطُونِهَا أَجْرٌ حَتَّى ذَكَرَ الْأَجْرَ فِي أَبْوَالِهَا وَأَرْوَاثِهَا وَلَوْ اسْتَنَّتْ شَرَفًا أَوْ شَرَفَيْنِ كُتِبَ لَهُ بِكُلِّ خُطْوَةٍ تَخْطُوهَا أَجْرٌ وَأَمَّا الَّذِي هِيَ لَهُ سِتْرٌ فَالرَّجُلُ يَتَّخِذُهَا تَكَرُّمًا وَتَجَمُّلًا وَلَا يَنْسَى حَقَّ ظُهُورِهَا وَبُطُونِهَا فِي عُسْرِهَا وَيُسْرِهَا وَأَمَّا الَّذِي عَلَيْهِ وِزْرٌ فَالَّذِي يَتَّخِذُهَا أَشَرًا وَبَطَرًا وَبَذَخًا وَرِيَاءَ النَّاسِ فَذَاكَ الَّذِي هِيَ عَلَيْهِ وِزْرٌ قَالُوا فَالْحُمُرُ يَا رَسُولَ اللَّهِ قَالَ مَا أَنْزَلَ اللَّهُ عَلَيَّ فِيهَا شَيْئًا إِلَّا هَذِهِ الْآيَةَ الْجَامِعَةَ الْفَاذَّةَ
{ فَمَنْ يَعْمَلْ مِثْقَالَ ذَرَّةٍ خَيْرًا يَرَهُ وَمَنْ يَعْمَلْ مِثْقَالَ ذَرَّةٍ شَرًّا يَرَهُ }
و حَدَّثَنَاه قُتَيْبَةُ بْنُ سَعِيدٍ حَدَّثَنَا عَبْدُ الْعَزِيزِ يَعْنِي الدَّرَاوَرْدِيَّ عَنْ سُهَيْلٍ بِهَذَا الْإِسْنَادِ وَسَاقَ الْحَدِيثَ و حَدَّثَنِيهِ مُحَمَّدُ بْنُ عَبْدِ اللَّهِ بْنِ بَزِيعٍ حَدَّثَنَا يَزِيدُ بْنُ زُرَيْعٍ حَدَّثَنَا رَوْحُ بْنُ الْقَاسِمِ حَدَّثَنَا سُهَيْلُ بْنُ أَبِي صَالِحٍ بِهَذَا الْإِسْنَادِ وَقَالَ بَدَلَ عَقْصَاءُ عَضْبَاءُ وَقَالَ فَيُكْوَى بِهَا جَنْبُهُ وَظَهْرُهُ وَلَمْ يَذْكُر جَبِينُهُ و حَدَّثَنِي هَارُونُ بْنُ سَعِيدٍ الْأَيْلِيُّ حَدَّثَنَا ابْنُ وَهْبٍ أَخْبَرَنِي عَمْرُو بْنُ الْحَارِثِ أَنَّ بُكَيْرًا حَدَّثَهُ عَنْ ذَكْوَانَ عَنْ أَبِي هُرَيْرَةَ عَنْ رَسُولِ اللَّهِ صَلَّى اللَّهُ عَلَيْهِ وَسَلَّمَ أَنَّهُ قَالَ إِذَا لَمْ يُؤَدِّ الْمَرْءُ حَقَّ اللَّهِ أَوْ الصَّدَقَةَ فِي إِبِلِهِ وَسَاقَ الْحَدِيثَ بِنَحْوِ حَدِيثِ سُهَيْلٍ عَنْ أَبِيهِ",12
1652,13,"Telah menceritakan kepada kami [Abu Bakar bin Abi Syaibah] Telah menceritakan kepada kami [Waki'] Telah menceritakan kepada kami [Al A'masy] dari [Al Ma'rur bin Suwaid] dari [Abu Dzarr] ia berkata; Aku tiba di dekat Rasulullah shallallahu 'alaihi wasallam ketika beliau sedang duduk di bawah naungan Ka'bah. Ketika beliau melihatku, beliau bersabda: ""Demi Tuhannya Ka'bah, mereka itu adalah orang-orang yang merugi."" Lalu kudekati beliau, seraya aku duduk dan bertanya kepada beliau, ""Wahai Rasulullah, siapakah mereka?"" beliau menjawab: ""Mereka adalah orang-orang memiliki harta yag melimpah. Kecuali mereka (yang menghitung-hitung amal kebaikan mereka dengan) mengatakan; Sebegini, sebegini, sebegini (sambil beliau memberi isyarat ke muka dan ke belakang, ke kanan dan ke kiri). Tetapi mereka ini jumlahnya hanya sedikit. Tidak seorang pun pemilik unta, pemilik sapi, dan pemilik kambing yang tidak membayar zakat ternaknya, melainkan pada hari kiamat kelak hewan-hewan ternaknya yang paling besar dan gemuk datang kepadanya menanduk dengan tanduknya dan menginjak-nginjak orang itu dengan kukunya. Setiap yang terakhir selesai menginjak-injaknya, yang pertama datang pula kembali. demikianlah siksa itu berlaku sehingga perkaranya diputuskan."" Dan telah menceritakannya kepada kami [Abu Kuraib Muhammad bin Al Ala`] Telah menceritakan kepada kami [Abu Mu'awiyah] dari [Al A'masy] dari [Al Ma'rur] dari [Abu Dzarr] ia berkata; Saya sampi di dekat Nabi shallallahu 'alaihi wasallam, yang saat itu sedang berlindung di bawah naungan Ka'bah. Maka ia pun menyebutkan hadits yang serupa dengan hadits Waki'. Hanya saja ia mengatakan; ""Demi Dzat yang jiwaku berada di tangan-Nya, tidak seorang pun di dunia ini mati dengan meninggalkan unta atau sapi ataupun kambing yang belum ia tunaikan zakatnya.""","حَدَّثَنَا أَبُو بَكْرِ بْنُ أَبِي شَيْبَةَ حَدَّثَنَا وَكِيعٌ حَدَّثَنَا الْأَعْمَشُ عَنْ الْمَعْرُورِ بْنِ سُوَيْدٍ عَنْ أَبِي ذَرٍّ قَالَ
انْتَهَيْتُ إِلَى النَّبِيِّ صَلَّى اللَّهُ عَلَيْهِ وَسَلَّمَ وَهُوَ جَالِسٌ فِي ظِلِّ الْكَعْبَةِ فَلَمَّا رَآنِي قَالَ هُمْ الْأَخْسَرُونَ وَرَبِّ الْكَعْبَةِ قَالَ فَجِئْتُ حَتَّى جَلَسْتُ فَلَمْ أَتَقَارَّ أَنْ قُمْتُ فَقُلْتُ يَا رَسُولَ اللَّهِ فِدَاكَ أَبِي وَأُمِّي مَنْ هُمْ قَالَ هُمْ الْأَكْثَرُونَ أَمْوَالًا إِلَّا مَنْ قَالَ هَكَذَا وَهَكَذَا وَهَكَذَا مِنْ بَيْنَ يَدَيْهِ وَمِنْ خَلْفِهِ وَعَنْ يَمِينِهِ وَعَنْ شِمَالِهِ وَقَلِيلٌ مَا هُمْ مَا مِنْ صَاحِبِ إِبِلٍ وَلَا بَقَرٍ وَلَا غَنَمٍ لَا يُؤَدِّي زَكَاتَهَا إِلَّا جَاءَتْ يَوْمَ الْقِيَامَةِ أَعْظَمَ مَا كَانَتْ وَأَسْمَنَهُ تَنْطَحُهُ بِقُرُونِهَا وَتَطَؤُهُ بِأَظْلَافِهَا كُلَّمَا نَفِدَتْ أُخْرَاهَا عَادَتْ عَلَيْهِ أُولَاهَا حَتَّى يُقْضَى بَيْنَ النَّاسِ
و حَدَّثَنَاه أَبُو كُرَيْبٍ مُحَمَّدُ بْنُ الْعَلَاءِ حَدَّثَنَا أَبُو مُعَاوِيَةَ عَنْ الْأَعْمَشِ عَنْ الْمَعْرُورِ عَنْ أَبِي ذَرٍّ قَالَ انْتَهَيْتُ إِلَى النَّبِيِّ صَلَّى اللَّهُ عَلَيْهِ وَسَلَّمَ وَهُوَ جَالِسٌ فِي ظِلِّ الْكَعْبَةِ فَذَكَرَ نَحْوَ حَدِيثِ وَكِيعٍ غَيْرَ أَنَّهُ قَالَ وَالَّذِي نَفْسِي بِيَدِهِ مَا عَلَى الْأَرْضِ رَجُلٌ يَمُوتُ فَيَدَعُ إِبِلًا أَوْ بَقَرًا أَوْ غَنَمًا لَمْ يُؤَدِّ زَكَاتَهَا",12
1681,13,"Dan Telah menceritakan kepada kami [Qutaibah bin Sa'id] Telah menceritakan kepada kami [Ya'qub bin Abdurrahman Al Qari] dari [Suhail] dari [bapaknya] dari [Abu Hurairah] bahwa Rasulullah shallallahu 'alaihi wasallam bersabda: ""Tidak akan terjadi hari kiamat, sebelum harta kekayaan telah tertumpuk dan melimpah ruah, hingga seorang laki-laki pergi ke mana-mana sambil membawa harta zakatnya, tetapi dia tidak mendapatkan seorang pun yang bersedia menerima zakatnya itu. Dan sehingga tanah Arab menjadi subur Makmur kembali dengan padang-padang rumput dan sungai-sungai.""","و حَدَّثَنَا قُتَيْبَةُ بْنُ سَعِيدٍ حَدَّثَنَا يَعْقُوبُ وَهُوَ ابْنُ عَبْدِ الرَّحْمَنِ الْقَارِيُّ عَنْ سُهَيْلٍ عَنْ أَبِيهِ عَنْ أَبِي هُرَيْرَةَ
أَنَّ رَسُولَ اللَّهِ صَلَّى اللَّهُ عَلَيْهِ وَسَلَّمَ قَالَ لَا تَقُومُ السَّاعَةُ حَتَّى يَكْثُرَ الْمَالُ وَيَفِيضَ حَتَّى يَخْرُجَ الرَّجُلُ بِزَكَاةِ مَالِهِ فَلَا يَجِدُ أَحَدًا يَقْبَلُهَا مِنْهُ وَحَتَّى تَعُودَ أَرْضُ الْعَرَبِ مُرُوجًا وَأَنْهَارًا",12
1709,13,"Dan telah menceritakan kepada kami [Amru An Naqid] dan [Zuhair bin Harb] dan [Ishaq bin Ibrahim] semuanya dari [Abu Mu'awiyah] - [Zuhair] berkata- telah menceritakan kepada kami [Muhammad bin Hazim] telah menceritakan kepada kami [Hisyam bin Urwah] dari [Abbad bin Hamzah] dan dari [Fathimah binti Al Mundzir] dari [Asma`] ia berkata; Rasulullah shallallahu 'alaihi wasallam bersabda: ""Bersedekahlah kamu dan jangan menghitung-hitung, karena Allah akan menghitung-hitung pula pemberian-Nya kepadamu. Dan janganlah kikir, karena Allah akan kikir pula kepadamu."" Dan telah menceritakan kepada kami [Ibnu Numair] telah menceritakan kepada kami [Muhammad bin Bisyr] telah menceritakan kepada kami [Hisyam] dari [Abbad bin Hamzah] dari [Asma`] bahwa Nabi shallallahu 'alaihi wasallam bersabda kepadanya, sebagaimana hadits mereka.","و حَدَّثَنَا عَمْرٌو النَّاقِدُ وَزُهَيْرُ بْنُ حَرْبٍ وَإِسْحَقُ بْنُ إِبْرَاهِيمَ جَمِيعًا عَنْ أَبِي مُعَاوِيَةَ قَالَ زُهَيْرٌ حَدَّثَنَا مُحَمَّدُ بْنُ خَازِمٍ حَدَّثَنَا هِشَامُ بْنُ عُرْوَةَ عَنْ عَبَّادِ بْنِ حَمْزَةَ وَعَنْ فَاطِمَةَ بِنْتِ الْمُنْذِرِ عَنْ أَسْمَاءَ قَالَتْ
قَالَ رَسُولُ اللَّهِ صَلَّى اللَّهُ عَلَيْهِ وَسَلَّمَ انْفَحِي أَوْ انْضَحِي أَوْ أَنْفِقِي وَلَا تُحْصِي فَيُحْصِيَ اللَّهُ عَلَيْكِ وَلَا تُوعِي فَيُوعِيَ اللَّهُ عَلَيْكِ
و حَدَّثَنَا ابْنُ نُمَيْرٍ حَدَّثَنَا مُحَمَّدُ بْنُ بِشْرٍ حَدَّثَنَا هِشَامٌ عَنْ عَبَّادِ بْنِ حَمْزَةَ عَنْ أَسْمَاءَ أَنَّ النَّبِيَّ صَلَّى اللَّهُ عَلَيْهِ وَسَلَّمَ قَالَ لَهَا نَحْوَ حَدِيثِهِمْ",12
