haditsId,kitabId,indo,arab,label
2998,23,"Telah menceritakan kepada kami [Utsman bin Abu Syaibah] dan [Ishaq bin Ibrahim] dan ini adalah lafadz Utsman. [Ishaq] berkata; telah mengabarkan kepada kami, dan [Utsman] berkata; telah menceritakan kepada kami [Jarir] dari [Mughirah] dari [Asy Sya'bi] dari [Jabir bin Abdullah] dia berkata, ""Dulu ketika saya berperang bersama Rasulullah shallallahu 'alaihi wasallam beliau menemuiku, sedangkan saya tengah mengendarai untaku yang kelelahan dan hampir tidak dapat berjalan. Setelah itu beliau bertanya kepadaku: ""Ada apa dengan untamu wahai Jabir?"" Saya menjawab, ""Sedang sakit wahai Rasulullah."" Kemudian beliau mundur ke belakang, lalu menghentak dan mendo'akan unta saya. Setelah itu unta saya selalu berjalan di depan. Nabi shallallahu 'alaihi wasallam bertanya lagi: ""Bagaimana kamu sekarang melihat untamu wahai Jabir?"" saya menjawab, ""Wah, sekarang untaku terlihat kuat dan sehat kembali."" Lalu beliau bertanya lagi: ""Maukah kamu menjual untamu kepadaku?"" Sebenarnya saya merasa sungkan dan malu mendengar tawaran Rasulullah shallallahu 'alaihi wasallam, sebab saya tidak memiliki kendaraan selain untaku ini, namun akhirnya saya menjawab, ""Baiklah."" Namun saya menjual unta tersebut dengan syarat saya boleh mengendarainya hingga tiba di Madinah. Setelah itu saya berkata kepada beliau, ""Wahai Rasulullah, sesungguhnya saya adalah pengantin baru, oleh karena itu saya hendak meminta izin kepada anda untuk pulang terlebih dahulu."" Ternyata Rasulullah shallallahu 'alaihi wasallam memberikan izin kepada saya, maka saya pun mendahului para sahabat untuk pulang ke Madinah. Sesampainya di rumah, paman saya langsung menemui saya seraya menanyakan unta kepunyaanku. Lalu saya menceritakan kepadanya tentang apa yang telah terjadi."" Jabir melanjutkan, ""Pada saat saya meminta izin kepada Rasulullah shallallahu 'alaihi wasallam untuk pulang terlebih dahulu -karena saya berstatus masih pengantin baru- maka beliau bertanya kepada saya: ""Wahai Jabir, siapakah yang kamu nikahi, gadis ataukah janda?"" saya menjawab, ""Saya menikahi seorang janda."" Beliau melanjutkan sabdanya: ""Mengapa kamu tidak menikahi gadis saja, sehingga dia dapat mengajakmu bercumbu dan kamu dapat mengajaknya bercumbu juga?"" saya menjawab, ""Wahai Rasulullah, ayahku telah meninggal dunia, sedangkan saya memiliki beberapa orang saudara perempuan yang masih muda, dan saya tidak menyukai jika menikahi seorang gadis yang seumuran dengan mereka, sehingga dia tidak bisa mendidik dan mengayomi mereka. Oleh karena itulah saya menikah dengan seorang janda supaya dia dapat mengayomi dan mendidik mereka."" Jabir melanjutkan, ""Ketika Rasulullah shallallahu 'alaihi wasallam sampai di Madinah, maka saya langsung pergi menemui beliau dengan membawa unta, kemudian beliau membayarnya dan mengembalikan unta tersebut kepada saya."" Telah menceritakan kepada kami [Utsman bin Abu Syaibah] telah menceritakan kepada kami [Jarir] dari [Al A'masy] dari [Salim bin Abu Al Ja'd] dari [Jabir] dia berkata, ""Kami kembali dari Makkah ke Madinah bersama Rasulullah shallallahu 'alaihi wasallam, tiba-tiba untaku sakit."" Kemudian dia melanjutkan hadits dengan ceritanya. Dan dalam riwayatnya dikatakan, ""Kemudian beliau bersabda kepadaku: ""Jualah untamu kepadaku!"" Jabir berkata, ""Saya menjawab, ""Tidak, akan tetapi saya hadiahkan kepada anda."" Beliau bersabda: ""Tidak, juallah kepadaku."" Jabir berkata, ""Saya menjawab, ""Tidak, akan tetapi saya hadiahkan kepada anda, wahai Rasulullah."" Beliau bersabda: ""Tidak, juallah kepadaku!"" Saya menjawab, ""Saya punya hutang kepada seseorang satu uqiyah emas, maka sebanyak itulah anda bayar."" Beliau bersabda: ""Baiklah. Bawalah unta itu sampai ke Madinah."" Setibanya di Madinah, Rasulullah shallallahu 'alaihi wasallam memerintahkan kepada Bilal: ""Hai Bilal, bayarlah kepada Jabir uang harga untanya satu uqiyah emas, dan tambahi sedikit."" Lalu Bilal memberikan kepadaku satu uqiyah emas, ditambahnya dengan beberapa qirath."" Jabir melanjutkan, ""Maka saya berkata, ""Dan tambahan dari Rasulullah shallallahu 'alaihi wasallam tersebut selalu saya bawa dan berada dalam kantung uangku, ketika terjadi perang harrah penduduk Syam mengambilnya dariku."" Telah menceritakan kepada kami [Abu Kamil Al Jahdari] telah menceritakan kepada kami [Abdul Wahid bin Ziyad] telah menceritakan kepada kami [Al Jurairi] dari [Abu Nadlrah] dari [Jabir bin Abdullah] dia berkata, ""Kami bersama Nabi shallallahu 'alaihi wasallam di suatu perjalanan, tiba-tiba hewan tungganganku lambat jalannya …, "" kemudian dia melanjutkan haditsnya. Dia berkata, ""Lalu Rasulullah shallallahu 'alaihi wasallam menghardiknya seraya bersabda kepadaku: ""Naikilah dengan menyebut nama Allah."" Dan ditambahkan pula: ""Dan beliau senantiasa memberikan tambahan kepadaku sambil berkata: ""Semoga Allah mengampunimu.""","حَدَّثَنَا عُثْمَانُ بْنُ أَبِي شَيْبَةَ وَإِسْحَقُ بْنُ إِبْرَاهِيمَ وَاللَّفْظُ لِعُثْمَانَ قَالَ إِسْحَقُ أَخْبَرَنَا وَقَالَ عُثْمَانُ حَدَّثَنَا جَرِيرٌ عَنْ مُغِيرَةَ عَنْ الشَّعْبِيِّ عَنْ جَابِرِ بْنِ عَبْدِ اللَّهِ قَالَ
غَزَوْتُ مَعَ رَسُولِ اللَّهِ صَلَّى اللَّهُ عَلَيْهِ وَسَلَّمَ فَتَلَاحَقَ بِي وَتَحْتِي نَاضِحٌ لِي قَدْ أَعْيَا وَلَا يَكَادُ يَسِيرُ قَالَ فَقَالَ لِي مَا لِبَعِيرِكَ قَالَ قُلْتُ عَلِيلٌ قَالَ فَتَخَلَّفَ رَسُولُ اللَّهِ صَلَّى اللَّهُ عَلَيْهِ وَسَلَّمَ فَزَجَرَهُ وَدَعَا لَهُ فَمَا زَالَ بَيْنَ يَدَيْ الْإِبِلِ قُدَّامَهَا يَسِيرُ قَالَ فَقَالَ لِي كَيْفَ تَرَى بَعِيرَكَ قَالَ قُلْتُ بِخَيْرٍ قَدْ أَصَابَتْهُ بَرَكَتُكَ قَالَ أَفَتَبِيعُنِيهِ فَاسْتَحْيَيْتُ وَلَمْ يَكُنْ لَنَا نَاضِحٌ غَيْرُهُ قَالَ فَقُلْتُ نَعَمْ فَبِعْتُهُ إِيَّاهُ عَلَى أَنَّ لِي فَقَارَ ظَهْرِهِ حَتَّى أَبْلُغَ الْمَدِينَةَ قَالَ فَقُلْتُ لَهُ يَا رَسُولَ اللَّهِ إِنِّي عَرُوسٌ فَاسْتَأْذَنْتُهُ فَأَذِنَ لِي فَتَقَدَّمْتُ النَّاسَ إِلَى الْمَدِينَةِ حَتَّى انْتَهَيْتُ فَلَقِيَنِي خَالِي فَسَأَلَنِي عَنْ الْبَعِيرِ فَأَخْبَرْتُهُ بِمَا صَنَعْتُ فِيهِ فَلَامَنِي فِيهِ قَالَ وَقَدْ كَانَ رَسُولُ اللَّهِ صَلَّى اللَّهُ عَلَيْهِ وَسَلَّمَ قَالَ لِي حِينَ اسْتَأْذَنْتُهُ مَا تَزَوَّجْتَ أَبِكْرًا أَمْ ثَيِّبًا فَقُلْتُ لَهُ تَزَوَّجْتُ ثَيِّبًا قَالَ أَفَلَا تَزَوَّجْتَ بِكْرًا تُلَاعِبُكَ وَتُلَاعِبُهَا فَقُلْتُ لَهُ يَا رَسُولَ اللَّهِ تُوُفِّيَ وَالِدِي أَوْ اسْتُشْهِدَ وَلِي أَخَوَاتٌ صِغَارٌ فَكَرِهْتُ أَنْ أَتَزَوَّجَ إِلَيْهِنَّ مِثْلَهُنَّ فَلَا تُؤَدِّبُهُنَّ وَلَا تَقُومُ عَلَيْهِنَّ فَتَزَوَّجْتُ ثَيِّبًا لِتَقُومَ عَلَيْهِنَّ وَتُؤَدِّبَهُنَّ قَالَ فَلَمَّا قَدِمَ رَسُولُ اللَّهِ صَلَّى اللَّهُ عَلَيْهِ وَسَلَّمَ الْمَدِينَةَ غَدَوْتُ إِلَيْهِ بِالْبَعِيرِ فَأَعْطَانِي ثَمَنَهُ وَرَدَّهُ عَلَيَّ
حَدَّثَنَا عُثْمَانُ بْنُ أَبِي شَيْبَةَ حَدَّثَنَا جَرِيرٌ عَنْ الْأَعْمَشِ عَنْ سَالِمِ بْنِ أَبِي الْجَعْدِ عَنْ جَابِرٍ قَالَ أَقْبَلْنَا مِنْ مَكَّةَ إِلَى الْمَدِينَةِ مَعَ رَسُولِ اللَّهِ صَلَّى اللَّهُ عَلَيْهِ وَسَلَّمَ فَاعْتَلَّ جَمَلِي وَسَاقَ الْحَدِيثَ بِقِصَّتِهِ وَفِيهِ ثُمَّ قَالَ لِي بِعْنِي جَمَلَكَ هَذَا قَالَ قُلْتُ لَا بَلْ هُوَ لَكَ قَالَ لَا بَلْ بِعْنِيهِ قَالَ قُلْتُ لَا بَلْ هُوَ لَكَ يَا رَسُولَ اللَّهِ قَالَ لَا بَلْ بِعْنِيهِ قَالَ قُلْتُ فَإِنَّ لِرَجُلٍ عَلَيَّ أُوقِيَّةَ ذَهَبٍ فَهُوَ لَكَ بِهَا قَالَ قَدْ أَخَذْتُهُ فَتَبَلَّغْ عَلَيْهِ إِلَى الْمَدِينَةِ قَالَ فَلَمَّا قَدِمْتُ الْمَدِينَةَ قَالَ رَسُولُ اللَّهِ صَلَّى اللَّهُ عَلَيْهِ وَسَلَّمَ لِبِلَالٍ أَعْطِهِ أُوقِيَّةً مِنْ ذَهَبٍ وَزِدْهُ قَالَ فَأَعْطَانِي أُوقِيَّةً مِنْ ذَهَبٍ وَزَادَنِي قِيرَاطًا قَالَ فَقُلْتُ لَا تُفَارِقُنِي زِيَادَةُ رَسُولِ اللَّهِ صَلَّى اللَّهُ عَلَيْهِ وَسَلَّمَ قَالَ فَكَانَ فِي كِيسٍ لِي فَأَخَذَهُ أَهْلُ الشَّامِ يَوْمَ الْحَرَّةِ حَدَّثَنَا أَبُو كَامِلٍ الْجَحْدَرِيُّ حَدَّثَنَا عَبْدُ الْوَاحِدِ بْنُ زِيَادٍ حَدَّثَنَا الْجُرَيْرِيُّ عَنْ أَبِي نَضْرَةَ عَنْ جَابِرِ بْنِ عَبْدِ اللَّهِ قَالَ كُنَّا مَعَ النَّبِيِّ صَلَّى اللَّهُ عَلَيْهِ وَسَلَّمَ فِي سَفَرٍ فَتَخَلَّفَ نَاضِحِي وَسَاقَ الْحَدِيثَ وَقَالَ فِيهِ فَنَخَسَهُ رَسُولُ اللَّهِ صَلَّى اللَّهُ عَلَيْهِ وَسَلَّمَ ثُمَّ قَالَ لِي ارْكَبْ بِاسْمِ اللَّهِ وَزَادَ أَيْضًا قَالَ فَمَا زَالَ يَزِيدُنِي وَيَقُولُ وَاللَّهُ يَغْفِرُ لَكَ",17
2999,23,"Telah menceritakan kepadaku [Abu Ar Rabi' Al 'Ataki] telah menceritakan kepada kami [Hammad] telah menceritakan kepada kami [Ayyub] dari [Abu Az Zubair] dari [Jabir] dia berkata, ""Nabi shallallahu 'alaihi wasallam menemuiku saat hewan tungganganku kelelahan."" Jabir melanjutkan, ""Maka beliau menghardiknya, dan tiba-tiba hewan itu meloncat dan saya berusaha mengendalikan tali kekangnya agar saya dapat mendengar perkataan beliau, namun saya tidak kuasa mendengarnya. Setelah itu Nabi shallallahu 'alaihi wasallam menemuiku dan bersabda: ""Jual saja untamu kepadaku."" Lalu saya menjualnya seharga lima uqiyah."" Jabir melanjutkan, ""Saya berkata, ""Dengan syarat saya menaikinya sampai Madinah."" Beliau bersabda: ""Naikilah sampai tiba di Madinah."" Jabir berkata, ""Setibanya di Madinah, saya memberikannya kepada beliau dan beliaupun memberiku beberapa uqiyah dan sedikit tambahan, lalu beliau memberikan unta tersebut kepadaku."" Telah menceritakan kepada kami [Uqbah bin Mukram Al 'Ammi] telah menceritakan kepada kami [Ya'qub bin Ishaq] telah menceritakan kepada kami [Basyir bin 'Uqbah] dari [Abu Al Mutawakil An Naji] dari [Jabir bin Abdullah] dia berkata, ""Saya pernah pergi bersama Rasulullah shallallahu 'alaihi wasallam di salah satu perjalanannya -saya kira dia (Jabir) berkata; salah satu peperangan-, kemudian dia menceritakan hadits tersebut dengan tambahan, ""Beliau bersabda: ""Wahai Jabir, apakah harganya sudah cukup?"" saya menjawab, ""Ya."" Beliau bersabda: ""Untukmu harganya (uangnya) dan untukmu pula untanya. Untukmu harganya (uangnya) dan untukmu pula untanya.""","و حَدَّثَنِي أَبُو الرَّبِيعِ الْعَتَكِيُّ حَدَّثَنَا حَمَّادٌ حَدَّثَنَا أَيُّوبُ عَنْ أَبِي الزُّبَيْرِ عَنْ جَابِرٍ قَالَ
لَمَّا أَتَى عَلَيَّ النَّبِيُّ صَلَّى اللَّهُ عَلَيْهِ وَسَلَّمَ وَقَدْ أَعْيَا بَعِيرِي قَالَ فَنَخَسَهُ فَوَثَبَ فَكُنْتُ بَعْدَ ذَلِكَ أَحْبِسُ خِطَامَهُ لِأَسْمَعَ حَدِيثَهُ فَمَا أَقْدِرُ عَلَيْهِ فَلَحِقَنِي النَّبِيُّ صَلَّى اللَّهُ عَلَيْهِ وَسَلَّمَ فَقَالَ بِعْنِيهِ فَبِعْتُهُ مِنْهُ بِخَمْسِ أَوَاقٍ قَالَ قُلْتُ عَلَى أَنَّ لِي ظَهْرَهُ إِلَى الْمَدِينَةِ قَالَ وَلَكَ ظَهْرُهُ إِلَى الْمَدِينَةِ قَالَ فَلَمَّا قَدِمْتُ الْمَدِينَةَ أَتَيْتُهُ بِهِ فَزَادَنِي وُقِيَّةً ثُمَّ وَهَبَهُ لِي
حَدَّثَنَا عُقْبَةُ بْنُ مُكْرَمٍ الْعَمِّيُّ حَدَّثَنَا يَعْقُوبُ بْنُ إِسْحَقَ حَدَّثَنَا بَشِيرُ بْنُ عُقْبَةَ عَنْ أَبِي الْمُتَوَكِّلِ النَّاجِيِّ عَنْ جَابِرِ بْنِ عَبْدِ اللَّهِ قَالَ سَافَرْتُ مَعَ رَسُولِ اللَّهِ صَلَّى اللَّهُ عَلَيْهِ وَسَلَّمَ فِي بَعْضِ أَسْفَارِهِ أَظُنُّهُ قَالَ غَازِيًا وَاقْتَصَّ الْحَدِيثَ وَزَادَ فِيهِ قَالَ يَا جَابِرُ أَتَوَفَّيْتَ الثَّمَنَ قُلْتُ نَعَمْ قَالَ لَكَ الثَّمَنُ وَلَكَ الْجَمَلُ لَكَ الثَّمَنُ وَلَكَ الْجَمَلُ",17
3007,23,"Telah menceritakan kepada kami [Yahya bin Yahya] dan [Abu Bakar bin Abu Syaibah] serta [Muhammad bin 'Ala] dan ini adalah lafadz Yahya, Yahya berkata; telah mengabarkan kepada kami, sedangkan dua orang lainnya berkata; telah menceritakan kepada kami [Abu Mu'awiyah] dari [Al A'masy] dari [Ibrahim] dari [Al Aswad] dari ['Aisyah] dia berkata, ""Rasulullah shallallahu 'alaihi wasallam pernah membeli makanan dari seorang Yahudi dengan bayaran yang ditangguhkan, lantas beliau menggadaikan baju besinya.""","حَدَّثَنَا يَحْيَى بْنُ يَحْيَى وَأَبُو بَكْرِ بْنُ أَبِي شَيْبَةَ وَمُحَمَّدُ بْنُ الْعَلَاءِ وَاللَّفْظُ لِيَحْيَى قَالَ يَحْيَى أَخْبَرَنَا وَقَالَ الْآخَرَانِ حَدَّثَنَا أَبُو مُعَاوِيَةَ عَنْ الْأَعْمَشِ عَنْ إِبْرَاهِيمَ عَنْ الْأَسْوَدِ عَنْ عَائِشَةَ قَالَتْ
اشْتَرَى رَسُولُ اللَّهِ صَلَّى اللَّهُ عَلَيْهِ وَسَلَّمَ مِنْ يَهُودِيٍّ طَعَامًا بِنَسِيئَةٍ فَأَعْطَاهُ دِرْعًا لَهُ رَهْنًا",17
3008,23,"Telah menceritakan kepada kami [Ishaq bin Ibrahim Al Hanzhali] dan [Ali bin Khasyram] keduanya berkata; telah mengabarkan kepada kami [Isa bin Yunus] dari [Al A'masy] dari [Ibrahim] dari [Al Aswad] dari ['Aisyah] dia berkata, ""Rasulullah shallallahu 'alaihi wasallam pernah membeli makanan dari seorang Yahudi, lalu beliau menggadaikan baju besinya (sebagai jaminan).""","حَدَّثَنَا إِسْحَقُ بْنُ إِبْرَاهِيمَ الْحَنْظَلِيُّ وَعَلِيُّ بْنُ خَشْرَمٍ قَالَا أَخْبَرَنَا عِيسَى بْنُ يُونُسَ عَنْ الْأَعْمَشِ عَنْ إِبْرَاهِيمَ عَنْ الْأَسْوَدِ عَنْ عَائِشَةَ قَالَتْ
اشْتَرَى رَسُولُ اللَّهِ صَلَّى اللَّهُ عَلَيْهِ وَسَلَّمَ مِنْ يَهُودِيٍّ طَعَامًا وَرَهَنَهُ دِرْعًا مِنْ حَدِيدٍ",17
3009,23,"Telah menceritakan kepada kami [Ishaq bin Ibrahim Al Hanzhali] telah mengabarkan kepada kami [Al Mahzumi] telah menceritakan kepada kami [Abdul Wahid bin Ziyad] dari [Al A'masy] dia berkata, ""Kami menyebutkan gadai dalam salam (jual beli dengan membayar terlebih dahulu sebelum ada barangnya) di hadapan [Ibrahim An Nakha'i] lalu dia berkata, "" [Al Aswad bin Yazid] telah menceritakan kepada dari ['Aisyah], bahwa Rasulullah shallallahu 'alaihi wasallam pernah membeli makanan dari orang Yahudi sampai batas waktu yang ditentukan, dan beliau menggadaikan baju besi miliknya."" Telah menceritakan kepada kami [Abu Bakar bin Abu Syaibah] telah menceritakan kepada kami [Hafsh bin Ghiyats] dari [Al A'masy] dari [Ibrahim] dia berkata; telah menceritakan kepadaku [Al Aswad] dari ['Aisyah] dari Nabi shallallahu 'alaihi wasallam seperti itu, dan ia tidak menyebutkan, ""Dari besi.""","حَدَّثَنَا إِسْحَقُ بْنُ إِبْرَاهِيمَ الْحَنْظَلِيُّ أَخْبَرَنَا الْمَخْزُومِيُّ حَدَّثَنَا عَبْدُ الْوَاحِدِ بْنُ زِيَادٍ عَنْ الْأَعْمَشِ قَالَ ذَكَرْنَا الرَّهْنَ فِي السَّلَمِ عِنْدَ إِبْرَاهِيمَ النَّخَعِيِّ فَقَالَ حَدَّثَنَا الْأَسْوَدُ بْنُ يَزِيدَ عَنْ عَائِشَةَ
أَنَّ رَسُولَ اللَّهِ صَلَّى اللَّهُ عَلَيْهِ وَسَلَّمَ اشْتَرَى مِنْ يَهُودِيٍّ طَعَامًا إِلَى أَجَلٍ وَرَهَنَهُ دِرْعًا لَهُ مِنْ حَدِيدٍ
و حَدَّثَنَاه أَبُو بَكْرِ بْنُ أَبِي شَيْبَةَ حَدَّثَنَا حَفْصُ بْنُ غِيَاثٍ عَنْ الْأَعْمَشِ عَنْ إِبْرَاهِيمَ قَالَ حَدَّثَنِي الْأَسْوَدُ عَنْ عَائِشَةَ عَنْ النَّبِيِّ صَلَّى اللَّهُ عَلَيْهِ وَسَلَّمَ مِثْلَهُ وَلَمْ يَذْكُرْ مِنْ حَدِيدٍ",17
3010,23,"Telah menceritakan kepada kami [Yahya bin Yahya] dan [Amru An Naqid] dan ini adalah lafadz Yahya, Amru berkata; telah menceritakan kepada kami, dan Yahya berkata; telah mengabarkan kepada kami [Sufyan bin Uyainah] dari [Ibnu Abu Najih] dari [Abdullah bin Katsir] dari [Abu Al Minhal] dari [Ibnu Abbas] dia berkata, ""Ketika Nabi shallallahu 'alaihi wasallam tiba di Madinah, penduduk Madinah menjual buah-buahan dengan pembayaran di muka, sedangkan buah-buahan yang dijualnya dijanjikan mereka dalam tempo setahun atau dua tahun kemudian. Maka Rasulullah shallallahu 'alaihi wasallam bersabda: ""Siapa yang menjual kurma dengan berjanji, hendaklah dengan takaran tertentu, timbangan tertentu dan jangka waktu tertentu.""","حَدَّثَنَا يَحْيَى بْنُ يَحْيَى وَعَمْرٌو النَّاقِدُ وَاللَّفْظُ لِيَحْيَى قَالَ عَمْرٌو حَدَّثَنَا وَقَالَ يَحْيَى أَخْبَرَنَا سُفْيَانُ بْنُ عُيَيْنَةَ عَنْ ابْنِ أَبِي نَجِيحٍ عَنْ عَبْدِ اللَّهِ بْنِ كَثِيرٍ عَنْ أَبِي الْمِنْهَالِ عَنْ ابْنِ عَبَّاسٍ قَالَ
قَدِمَ النَّبِيُّ صَلَّى اللَّهُ عَلَيْهِ وَسَلَّمَ الْمَدِينَةَ وَهُمْ يُسْلِفُونَ فِي الثِّمَارِ السَّنَةَ وَالسَّنَتَيْنِ فَقَالَ مَنْ أَسْلَفَ فِي تَمْرٍ فَلْيُسْلِفْ فِي كَيْلٍ مَعْلُومٍ وَوَزْنٍ مَعْلُومٍ إِلَى أَجَلٍ مَعْلُومٍ",17
3011,23,"Telah menceritakan kepada kami [Syaiban bin Farruh] telah menceritakan kepada kami [Abdul Waris] dari [Ibnu Najih] telah menceritakan kepadaku [Abdullah bin Katsir] dari [Abu Minhal] dari [Ibnu Abbas] dia berkata, ""Ketika Rasulullah shallallahu 'alaihi wasallam tiba di Madinah, orang-orang di sana terbiasa jual beli dengan sistem pembayaran dimuka, maka Rasulullah shallallahu 'alaihi wasallam bersabda: ""Barangsiapa memesan barang, maka janganlah memesan kecuali dengan takaran tertentu dan timbangan tertentu."" Telah menceritakan kepada kami [Yahya bin Yahya] dan [Abu Bakar bin Abu Syaibah] dan [Isma'il bin Salim] semuanya dari [Ibnu Uyainah] dari [Ibnu Abu Najih] dengan isnad seperti hadits Abdul Warits, namun tidak disebutkan, ""Sampai waktu yang ditentukan."" Sedangkan [Abu Kuraib] dan [Ibnu Abu Umar] keduanya berkata; telah menceritakan kepada kami [Waki']. (dalam jalur lain disebutkan) Telah menceritakan kepada kami [Muhammad bin Basysyar] telah menceritakan kepada kami [Abdurrahman bin Mahdi] keduanya dari [Sufyan] dari [Ibnu Abu Najih] dengan isnad mereka, seperti hadits Ibnu Uyainah, dalam hadits tersebut disebutkan, ""Sampai batas waktu yang ditentukan.""","حَدَّثَنَا شَيْبَانُ بْنُ فَرُّوخَ حَدَّثَنَا عَبْدُ الْوَارِثِ عَنْ ابْنِ أَبِي نَجِيحٍ حَدَّثَنِي عَبْدُ اللَّهِ بْنُ كَثِيرٍ عَنْ أَبِي الْمِنْهَالِ عَنْ ابْنِ عَبَّاسٍ
قَالَ قَدِمَ رَسُولُ اللَّهِ صَلَّى اللَّهُ عَلَيْهِ وَسَلَّمَ وَالنَّاسُ يُسْلِفُونَ فَقَالَ لَهُمْ رَسُولُ اللَّهِ صَلَّى اللَّهُ عَلَيْهِ وَسَلَّمَ مَنْ أَسْلَفَ فَلَا يُسْلِفْ إِلَّا فِي كَيْلٍ مَعْلُومٍ وَوَزْنٍ مَعْلُومٍ
حَدَّثَنَا يَحْيَى بْنُ يَحْيَى وَأَبُو بَكْرِ بْنُ أَبِي شَيْبَةَ وَإِسْمَعِيلُ بْنُ سَالِمٍ جَمِيعًا عَنْ ابْنِ عُيَيْنَةَ عَنْ ابْنِ أَبِي نَجِيحٍ بِهَذَا الْإِسْنَادِ مِثْلَ حَدِيثِ عَبْدِ الْوَارِثِ وَلَمْ يَذْكُرْ إِلَى أَجَلٍ مَعْلُومٍ أَبُو كُرَيْبٍ وَابْنُ أَبِي عُمَرَ قَالَا حَدَّثَنَا وَكِيعٌ ح و حَدَّثَنَا مُحَمَّدُ بْنُ بَشَّارٍ حَدَّثَنَا عَبْدُ الرَّحْمَنِ بْنُ مَهْدِيٍّ كِلَاهُمَا عَنْ سُفْيَانَ عَنْ ابْنِ أَبِي نَجِيحٍ بِإِسْنَادِهِمْ مِثْلَ حَدِيثِ ابْنِ عُيَيْنَةَ يَذْكُرُ فِيهِ إِلَى أَجَلٍ مَعْلُومٍ",17
3012,23,"Telah menceritakan kepada kami [Abdullah bin Maslamah bin Qa'nab] telah menceritakan kepada kami [Sulaiman] -yaitu Ibnu Bilal- dari [Yahya] -yaitu Ibnu Sa'id- dia berkata, "" [Sa'id bin Musayyab] menceritakan bahwa [Ma'mar] berkata, ""Rasulullah shallallahu 'alaihi wasallam bersabda: ""Barangsiapa menimbun barang, maka dia berdosa.""","حَدَّثَنَا عَبْدُ اللَّهِ بْنُ مَسْلَمَةَ بْنِ قَعْنَبٍ حَدَّثَنَا سُلَيْمَانُ يَعْنِي ابْنَ بِلَالٍ عَنْ يَحْيَى وَهُوَ ابْنُ سَعِيدٍ قَالَ كَانَ سَعِيدُ بْنُ الْمُسَيَّبِ يُحَدِّثُ أَنَّ مَعْمَرًا قَالَ
قَالَ رَسُولُ اللَّهِ صَلَّى اللَّهُ عَلَيْهِ وَسَلَّمَ مَنْ احْتَكَرَ فَهُوَ خَاطِئٌ
فَقِيلَ لِسَعِيدٍ فَإِنَّكَ تَحْتَكِرُ قَالَ سَعِيدٌ إِنَّ مَعْمَرًا الَّذِي كَانَ يُحَدِّثُ هَذَا الْحَدِيثَ كَانَ يَحْتَكِرُ",17
3014,23,"Telah menceritakan kepada kami [Zuhair bin Harb] telah menceritakan kepada kami [Abu Shafwan Al Amawi]. (dalam jalur lain disebutkan) Telah menceritakan kepadaku [Abu Thahir] dan [Harmalah bin Yahya] keduanya berkata; telah mengabarkan kepada kami [Ibnu Wahb], keduanya dari [Yunus] dari [Ibnu Syihab] dari [Ibnu Musayyab] bahwa [Abu Hurairah] berkata, ""Saya mendengar Rasulullah shallallahu 'alaihi wasallam bersabda: ""Sumpah itu dapat melariskan barang dan menghilangkan barakah keuntungan.""","حَدَّثَنَا زُهَيْرُ بْنُ حَرْبٍ حَدَّثَنَا أَبُو صَفْوَانَ الْأُمَوِيُّ ح و حَدَّثَنِي أَبُو الطَّاهِرِ وَحَرْمَلَةُ بْنُ يَحْيَى قَالَا أَخْبَرَنَا ابْنُ وَهْبٍ كِلَاهُمَا عَنْ يُونُسَ عَنْ ابْنِ شِهَابٍ عَنْ ابْنِ الْمُسَيَّبِ أَنَّ أَبَا هُرَيْرَةَ قَالَ
سَمِعْتُ رَسُولَ اللَّهِ صَلَّى اللَّهُ عَلَيْهِ وَسَلَّمَ يَقُولُ الْحَلِفُ مَنْفَقَةٌ لِلسِّلْعَةِ مَمْحَقَةٌ لِلرِّبْحِ",17
