haditsId,kitabId,indo,arab,label
3831,37,"Telah menceritakan kepada kami [Abu Bakr bin Abu Syaibah]; Telah menceritakan kepada kami [Syababah bin Sawwar]; Telah menceritakan kepada kami [Sulaiman bin Al Mughirah] dari [Tsabit] dari ['Abdurrahman bin Abu Laila] dari [Al Miqdad] ia berkata; ""Saya dan dua orang teman saya datang -sedangkan pada saat itu pendengaran dan penglihatan saya sudah tidak berfungsi lagi karena sakit yang pernah saya alami."" Al Miqdad berkata; ""Kami mulai menyerahkan diri kami (memohon bantuan) kepada para sahabat Rasulullah shallallahu 'alaihi wasallam, tapi tidak seorang pun dari mereka yang sudi menerima kami. Akhirnya, kami mendatangi Rasulullah shallallahu 'alaihi wasallam dan beliau pun mengajak pergi menuju keluarga beliau. Ternyata di rumah beliau ada tiga ekor kambing. Lalu beliau berkata: ""Perahlah susu kambing itu untuk kita minum bersama!"" Al Miqdad berkata; ""Lalu kami memerah susu kambing itu dan setiap orang dari kami pun meminum jatahnya masing-masing. Setelah itu, kami menyimpan susu jatah Rasulullah shallallahu 'alaihi wasallam. Kata Al Miqdad; ""Sebagian malam telah berlalu, kemudian Rasulullah shallallahu 'alaihi wasallam mengucapkan salam yang tidak sampai membangunkan orang tidur, tetapi dapat didengar oleh orang yang terjaga."" Al Miqdad berkata; ""Rasulullah shallallahu 'alaihi wasallam datang ke masjid lalu beliau melaksanakan shalat. Setelah itu, beliau mendekati minumannya untuk diminum."" Pada malam itu, ketika saya telah meminum jatah minuman saya, tiba-tiba saya tergoda oleh bisikan syetan yang selalu terngiang di telinga saya; ""Muhammad mendatangi orang-orang Anshar dan mereka pun menjamunya. Setelah itu, ia (Muhammad) mendapat jamuan di tengah mereka, hingga ia (Muhammad) tidak membutuhkan minumannya yang tersisa."" Lalu saya dekati minuman beliau yang tersisa itu dan langsung saya meminumnya. Setelah minuman Rasulullah itu masuk ke dalam perut saya, dan tentunya tidak mungkin bagi saya untuk mengeluarkannya kembali, maka syetan membisikkan rasa penyesalan ke dalam hati saya; ""Hai celaka sekali kamu ini, "" seru syetan."" Apa yang telah kamu lakukan? Mengapa kamu meminum habis minuman Muhammad itu? Bagaimana nanti, apabila Muhammad datang dan ia tidak mendapatkan lagi minumannya, hingga akhirnya ia mendo'akan kecelakaan bagimu dan kamu akan celaka di dunia dan akhirat?"" kebetulan pada saat itu saya tengah mengenakan jubah, yang apabila saya tutupkan sampai kedua telapak kaki saya pasti akan nampak kepala saya. Sebaliknya, apabila saya tutupkan kepala saya, maka kedua telapak kaki saya pasti akan nampak. Oleh karena itu, saya tidak dapat tidur dengan tenang. Sementara kedua teman saya, sepertinya mereka berdua dapat tidur dengan nyenyak karena mereka tidak berbuat seperti apa yang telah saya perbuat. Al Miqdad berkata; ""Tak lama kemudian Rasulullah shallallahu 'alaihi wasallam datang dan memberi salam seperti biasanya. Setelah itu, beliau pergi ke masjid untuk melaksanakan shalat. Usai melaksanakan shalat, beliau pun langsung menghampiri minumannya untuk diminumnya. Tetapi, beliau mendapatkan minuman yang ada di dalam gelas itu telah habis. Akhirnya, beliau menengadahkan wajahnya ke langit. Batin saya mengatakan; ""Mungkin Rasulullah sekarang akan mendo'akan kecelakaan untuk saya, selaku orang yang telah menghabiskan minumannya itu."" Tetapi, ternyata beliau malah berdo'a: ""Ya Allah, berilah makan orang yang telah memberiku makan dan berilah minum orang yang telah memberiku minum."" Al Miqdad berkata; ""Akhirnya saya singsingkan jubah saya, lalu saya ambil pisau, dan saya pergi menuju kandang kambing saya. Saya pilih kambing yang paling gemuk untuk saya sembelih sebagai makanan bagi Rasulullah shallallahu 'alaihi wasallam. Ketika saya sembelih, ternyata kambing-kambing itu mengandung susu yang sangat banyak, hingga saya segera meminjam wadah kepada keluarga Rasulullah, yang sebelumnya mereka jarang sekali mempergunakan wadah tersebut untuk memerah kambing. Akhirnya saya perah susu kambing itu hingga memenuhi wadah-wadah tersebut. Setelah itu, saya pun menghampiri Rasulullah shallallahu 'alaihi wasallam. Lalu beliau berkata: ""Apakah kalian telah meminum minuman kalian tadi malam?"" Saya berkata; ""Ya Rasulullah, silahkan Anda mencicipi susu kambing ini!"" Kemudian beliau pun meminumnya dengan senang. Setelah itu beliau minta minum lagi. Lalu saya mempersilahkan beliau untuk meminum susu tersebut. Maka beliau pun meminumnya dan setelah itu beliau masih minta lagi. Setelah saya tahu Rasulullah telah merasa lega dan saya telah dapat memenuhi permintaannya, maka saya pun merasa senang hingga saya terjatuh ke tanah. Rasulullah bertanya; ""Hai Miqdad, apakah ada salah satu perbuatanmu yang buruk?"" Saya menjawab; ""Ya, sebenarnya tadi malam saya begini dan begitu, hingga akhirnya saya telah melakukan ini dan itu."" Maka Rasulullah shallallahu 'alaihi wasallam bersabda: ""Sebenarnya hal itu merupakan rahmat dari Allah. Sayangnya, mengapa kamu tidak memberitahu kepadaku hingga kita dapat membangunkan kedua teman kita dan turut serta pula minum bersama kita?"" Al Miqdad berkata; ""Demi Dzat yang telah mengutus engkau, aku tidak peduli jika engkau telah mencicipi air susu ini bersama saya, kemudian ingin bersama para sahabat lainnya lagi."" Dan telah menceritakan kepada kami [Ishaq bin Ibrahim], telah mengabarkan kepada kami [An Nadhr bin Syumail] telah menceritakan kepada kami [Sulaiman bin Al Mughirah] dengan sanad yang serupa.","حَدَّثَنَا أَبُو بَكْرِ بْنُ أَبِي شَيْبَةَ حَدَّثَنَا شَبَابَةُ بْنُ سَوَّارٍ حَدَّثَنَا سُلَيْمَانُ بْنُ الْمُغِيرَةِ عَنْ ثَابِتٍ عَنْ عَبْدِ الرَّحْمَنِ بْنِ أَبِي لَيْلَى عَنْ الْمِقْدَادِ قَالَ
أَقْبَلْتُ أَنَا وَصَاحِبَانِ لِي وَقَدْ ذَهَبَتْ أَسْمَاعُنَا وَأَبْصَارُنَا مِنْ الْجَهْدِ فَجَعَلْنَا نَعْرِضُ أَنْفُسَنَا عَلَى أَصْحَابِ رَسُولِ اللَّهِ صَلَّى اللَّهُ عَلَيْهِ وَسَلَّمَ فَلَيْسَ أَحَدٌ مِنْهُمْ يَقْبَلُنَا فَأَتَيْنَا النَّبِيَّ صَلَّى اللَّهُ عَلَيْهِ وَسَلَّمَ فَانْطَلَقَ بِنَا إِلَى أَهْلِهِ فَإِذَا ثَلَاثَةُ أَعْنُزٍ فَقَالَ النَّبِيُّ صَلَّى اللَّهُ عَلَيْهِ وَسَلَّمَ احْتَلِبُوا هَذَا اللَّبَنَ بَيْنَنَا قَالَ فَكُنَّا نَحْتَلِبُ فَيَشْرَبُ كُلُّ إِنْسَانٍ مِنَّا نَصِيبَهُ وَنَرْفَعُ لِلنَّبِيِّ صَلَّى اللَّهُ عَلَيْهِ وَسَلَّمَ نَصِيبَهُ قَالَ فَيَجِيءُ مِنْ اللَّيْلِ فَيُسَلِّمُ تَسْلِيمًا لَا يُوقِظُ نَائِمًا وَيُسْمِعُ الْيَقْظَانَ قَالَ ثُمَّ يَأْتِي الْمَسْجِدَ فَيُصَلِّي ثُمَّ يَأْتِي شَرَابَهُ فَيَشْرَبُ فَأَتَانِي الشَّيْطَانُ ذَاتَ لَيْلَةٍ وَقَدْ شَرِبْتُ نَصِيبِي فَقَالَ مُحَمَّدٌ يَأْتِي الْأَنْصَارَ فَيُتْحِفُونَهُ وَيُصِيبُ عِنْدَهُمْ مَا بِهِ حَاجَةٌ إِلَى هَذِهِ الْجُرْعَةِ فَأَتَيْتُهَا فَشَرِبْتُهَا فَلَمَّا أَنْ وَغَلَتْ فِي بَطْنِي وَعَلِمْتُ أَنَّهُ لَيْسَ إِلَيْهَا سَبِيلٌ قَالَ نَدَّمَنِي الشَّيْطَانُ فَقَالَ وَيْحَكَ مَا صَنَعْتَ أَشَرِبْتَ شَرَابَ مُحَمَّدٍ فَيَجِيءُ فَلَا يَجِدُهُ فَيَدْعُو عَلَيْكَ فَتَهْلِكُ فَتَذْهَبُ دُنْيَاكَ وَآخِرَتُكَ وَعَلَيَّ شَمْلَةٌ إِذَا وَضَعْتُهَا عَلَى قَدَمَيَّ خَرَجَ رَأْسِي وَإِذَا وَضَعْتُهَا عَلَى رَأْسِي خَرَجَ قَدَمَايَ وَجَعَلَ لَا يَجِيئُنِي النَّوْمُ وَأَمَّا صَاحِبَايَ فَنَامَا وَلَمْ يَصْنَعَا مَا صَنَعْتُ قَالَ فَجَاءَ النَّبِيُّ صَلَّى اللَّهُ عَلَيْهِ وَسَلَّمَ فَسَلَّمَ كَمَا كَانَ يُسَلِّمُ ثُمَّ أَتَى الْمَسْجِدَ فَصَلَّى ثُمَّ أَتَى شَرَابَهُ فَكَشَفَ عَنْهُ فَلَمْ يَجِدْ فِيهِ شَيْئًا فَرَفَعَ رَأْسَهُ إِلَى السَّمَاءِ فَقُلْتُ الْآنَ يَدْعُو عَلَيَّ فَأَهْلِكُ فَقَالَ اللَّهُمَّ أَطْعِمْ مَنْ أَطْعَمَنِي وَأَسْقِ مَنْ أَسْقَانِي قَالَ فَعَمَدْتُ إِلَى الشَّمْلَةِ فَشَدَدْتُهَا عَلَيَّ وَأَخَذْتُ الشَّفْرَةَ فَانْطَلَقْتُ إِلَى الْأَعْنُزِ أَيُّهَا أَسْمَنُ فَأَذْبَحُهَا لِرَسُولِ اللَّهِ صَلَّى اللَّهُ عَلَيْهِ وَسَلَّمَ فَإِذَا هِيَ حَافِلَةٌ وَإِذَا هُنَّ حُفَّلٌ كُلُّهُنَّ فَعَمَدْتُ إِلَى إِنَاءٍ لِآلِ مُحَمَّدٍ صَلَّى اللَّهُ عَلَيْهِ وَسَلَّمَ مَا كَانُوا يَطْمَعُونَ أَنْ يَحْتَلِبُوا فِيهِ قَالَ فَحَلَبْتُ فِيهِ حَتَّى عَلَتْهُ رَغْوَةٌ فَجِئْتُ إِلَى رَسُولِ اللَّهِ صَلَّى اللَّهُ عَلَيْهِ وَسَلَّمَ فَقَالَ أَشَرِبْتُمْ شَرَابَكُمْ اللَّيْلَةَ قَالَ قُلْتُ يَا رَسُولَ اللَّهِ اشْرَبْ فَشَرِبَ ثُمَّ نَاوَلَنِي فَقُلْتُ يَا رَسُولَ اللَّهِ اشْرَبْ فَشَرِبَ ثُمَّ نَاوَلَنِي فَلَمَّا عَرَفْتُ أَنَّ النَّبِيَّ صَلَّى اللَّهُ عَلَيْهِ وَسَلَّمَ قَدْ رَوِيَ وَأَصَبْتُ دَعْوَتَهُ ضَحِكْتُ حَتَّى أُلْقِيتُ إِلَى الْأَرْضِ قَالَ فَقَالَ النَّبِيُّ صَلَّى اللَّهُ عَلَيْهِ وَسَلَّمَ إِحْدَى سَوْآتِكَ يَا مِقْدَادُ فَقُلْتُ يَا رَسُولَ اللَّهِ كَانَ مِنْ أَمْرِي كَذَا وَكَذَا وَفَعَلْتُ كَذَا فَقَالَ النَّبِيُّ صَلَّى اللَّهُ عَلَيْهِ وَسَلَّمَ مَا هَذِهِ إِلَّا رَحْمَةٌ مِنْ اللَّهِ أَفَلَا كُنْتَ آذَنْتَنِي فَنُوقِظَ صَاحِبَيْنَا فَيُصِيبَانِ مِنْهَا قَالَ فَقُلْتُ وَالَّذِي بَعَثَكَ بِالْحَقِّ مَا أُبَالِي إِذَا أَصَبْتَهَا وَأَصَبْتُهَا مَعَكَ مَنْ أَصَابَهَا مِنْ النَّاسِ
و حَدَّثَنَا إِسْحَقُ بْنُ إِبْرَاهِيمَ أَخْبَرَنَا النَّضْرُ بْنُ شُمَيْلٍ حَدَّثَنَا سُلَيْمَانُ بْنُ الْمُغِيرَةِ بِهَذَا الْإِسْنَادِ",53
3843,37,"Dan telah menceritakan kepadaku [Muhammad bin Rafi']; Telah menceritakan kepada kami [Ishaq bin 'Isa]; Telah mengabarkan kepada kami [Malik] dari [Suhail bin Abu Shalih] dari [Bapaknya] dari [Abu Hurairah] bahwa Rasulullah shallallahu 'alaihi wasallam kedatangan tamu orang kafir. Lalu Rasulullah shallallahu 'alaihi wasallam menyuruh pembantunya memerah susu seekor kambing untuk tamu, lalu diminum habis oleh tamu tersebut. Kemudian beliau menyuguhkan lagi, dan habis pula diminumnya. Di suguhkannya lagi, ia pun masih tetap meminumnya, sehingga akhirnya dia meminum habis susu perahan tujuh ekor kambing. Beberapa waktu kemudian dia masuk Islam. Rasulullah memerintahkan supaya diperah seekor kambing untuknya. Susu itu diminumnya habis. Kemudian Nabi shallallahu 'alaihi wasallam menyuruh supaya diperah seekor lagi lalu diberikan pula kepadanya, tetapi dia tidak sanggup menghabiskannya. Maka Rasulullah shallallahu 'alaihi wasallam bersabda: ""Orang mukmin minum dengan satu usus (perut), dan orang kafir minum dengan tujuh usus (perut).""","و حَدَّثَنِي مُحَمَّدُ بْنُ رَافِعٍ حَدَّثَنَا إِسْحَقُ بْنُ عِيسَى أَخْبَرَنَا مَالِكٌ عَنْ سُهَيْلِ بْنِ أَبِي صَالِحٍ عَنْ أَبِيهِ عَنْ أَبِي هُرَيْرَةَ
أَنَّ رَسُولَ اللَّهِ صَلَّى اللَّهُ عَلَيْهِ وَسَلَّمَ ضَافَهُ ضَيْفٌ وَهُوَ كَافِرٌ فَأَمَرَ لَهُ رَسُولُ اللَّهِ صَلَّى اللَّهُ عَلَيْهِ وَسَلَّمَ بِشَاةٍ فَحُلِبَتْ فَشَرِبَ حِلَابَهَا ثُمَّ أُخْرَى فَشَرِبَهُ ثُمَّ أُخْرَى فَشَرِبَهُ حَتَّى شَرِبَ حِلَابَ سَبْعِ شِيَاهٍ ثُمَّ إِنَّهُ أَصْبَحَ فَأَسْلَمَ فَأَمَرَ لَهُ رَسُولُ اللَّهِ صَلَّى اللَّهُ عَلَيْهِ وَسَلَّمَ بِشَاةٍ فَشَرِبَ حِلَابَهَا ثُمَّ أَمَرَ بِأُخْرَى فَلَمْ يَسْتَتِمَّهَا فَقَالَ رَسُولُ اللَّهِ صَلَّى اللَّهُ عَلَيْهِ وَسَلَّمَ الْمُؤْمِنُ يَشْرَبُ فِي مِعًى وَاحِدٍ وَالْكَافِرُ يَشْرَبُ فِي سَبْعَةِ أَمْعَاءٍ",53
3846,38,"Telah menceritakan kepada kami [Yahya bin Yahya] ia berkata; Aku membaca Hadits dari [Malik] dari [Nafi'] dari [Zaid bin 'Abdullah] dari ['Abdullah bin 'Abdurrahman bin Abu Bakr Ash Shidiqi] dari [Ummu Salamah] istri Nabi shallallahu 'alaihi wasallam bahwa Rasulullah shallallahu 'alaihi wasallam bersabda: ""Orang yang minum dengan bejana yang terbuat dari perak, sebenarnya dia sedang menggodok api neraka di dalam perutnya."" Telah menceritakannya kepada kami [Qutaibah] dan [Muhammad bin Rumh] dari [Al Laits bin Sa'd]; Demikian juga telah diriwayatkan dari jalur yang lain, Telah menceritakannya kepadaku ['Ali bin Hujr As Sa'idi]; Telah menceritakan kepada kami [Isma'il] yaitu Ibnu 'Ulayah dari [Ayyub]; Demikian juga telah diriwayatkan dari jalur yang lain, Telah menceritakan kepada kami [Ibnu Numair]; Telah menceritakan kepada kami [Muhammad bin Bisyr]; Demikian juga telah diriwayatkan dari jalur yang lain; Telah menceritakan kepada kami [Muhammad bin Al Mutsanna]; Telah menceritakan kepada kami [Yahya bin Sa'id]; Demikian juga telah diriwayatkan dari jalur yang lain, Telah menceritakan kepada kami [Abu Bakr bin Abu Syaibah] dan [Al Walid bin Syuja'] keduanya berkata; Telah menceritakan kepada kami ['Ali bin Mushir] dari ['Ubaidillah]; Demikian juga telah diriwayatkan dari jalur yang lain; Telah menceritakan kepada kami [Muhammad bin Abu Bakr Al Muqaddami]; Telah menceritakan kepada kami [Al Fudhail bin Sulaiman]; Telah menceritakan kepada kami [Musa bin 'Uqbah]; Demikian juga telah diriwayatkan dari jalur yang lain; Telah menceritakan kepada kami [Syaiban bin Farrukh]; Telah menceritakan kepada kami [Jarir] yaitu Ibnu Hazim dari ['Abdurrahman As Sarraj] mereka semuanya meriwayatkan dari [Nafi], sebagaimana Hadits Malik bin Anas dengan sanadnya. Di dalam Hadits Ali bin Mushir dari Ubaidullah ada tambahan lafazh; 'Bahwa orang yang makan atau minum dengan bejana yang terbuat dari perak dan emas…'. Padahal dalam semua Hadits yang lain tidak ada tambahan 'makan dan emas', kecuali Hadits dari Ibnu Mushir saja.","حَدَّثَنَا يَحْيَى بْنُ يَحْيَى قَالَ قَرَأْتُ عَلَى مَالِكٍ عَنْ نَافِعٍ عَنْ زَيْدِ بْنِ عَبْدِ اللَّهِ عَنْ عَبْدِ اللَّهِ بْنِ عَبْدِ الرَّحْمَنِ بْنِ أَبِي بَكْرٍ الصِّدِّيقِ عَنْ أُمِّ سَلَمَةَ زَوْجِ النَّبِيِّ صَلَّى اللَّهُ عَلَيْهِ وَسَلَّمَ
أَنَّ رَسُولَ اللَّهِ صَلَّى اللَّهُ عَلَيْهِ وَسَلَّمَ قَالَ الَّذِي يَشْرَبُ فِي آنِيَةِ الْفِضَّةِ إِنَّمَا يُجَرْجِرُ فِي بَطْنِهِ نَارَ جَهَنَّمَ
و حَدَّثَنَاه قُتَيْبَةُ وَمُحَمَّدُ بْنُ رُمْحٍ عَنْ اللَّيْثِ بْنِ سَعْدٍ ح و حَدَّثَنِيهِ عَلِيُّ بْنُ حُجْرٍ السَّعْدِيُّ حَدَّثَنَا إِسْمَعِيلُ يَعْنِي ابْنَ عُلَيَّةَ عَنْ أَيُّوبَ ح و حَدَّثَنَا ابْنُ نُمَيْرٍ حَدَّثَنَا مُحَمَّدُ بْنُ بِشْرٍ ح و حَدَّثَنَا مُحَمَّدُ بْنُ الْمُثَنَّى حَدَّثَنَا يَحْيَى بْنُ سَعِيدٍ ح و حَدَّثَنَا أَبُو بَكْرِ بْنُ أَبِي شَيْبَةَ وَالْوَلِيدُ بْنُ شُجَاعٍ قَالَا حَدَّثَنَا عَلِيُّ بْنُ مُسْهِرٍ عَنْ عُبَيْدِ اللَّهِ ح و حَدَّثَنَا مُحَمَّدُ بْنُ أَبِي بَكْرٍ الْمُقَدَّمِيُّ حَدَّثَنَا الْفُضَيْلُ بْنُ سُلَيْمَانَ حَدَّثَنَا مُوسَى بْنُ عُقْبَةَ ح و حَدَّثَنَا شَيْبَانُ بْنُ فَرُّوخَ حَدَّثَنَا جَرِيرٌ يَعْنِي ابْنَ حَازِمٍ عَنْ عَبْدِ الرَّحْمَنِ السَّرَّاجِ كُلُّ هَؤُلَاءِ عَنْ نَافِعٍ بِمِثْلِ حَدِيثِ مَالِكِ بْنِ أَنَسٍ بِإِسْنَادِهِ عَنْ نَافِعٍ وَزَادَ فِي حَدِيثِ عَلِيِّ بْنِ مُسْهِرٍ عَنْ عُبَيْدِ اللَّهِ أَنَّ الَّذِي يَأْكُلُ أَوْ يَشْرَبُ فِي آنِيَةِ الْفِضَّةِ وَالذَّهَبِ وَلَيْسَ فِي حَدِيثِ أَحَدٍ مِنْهُمْ ذِكْرُ الْأَكْلِ وَالذَّهَبِ إِلَّا فِي حَدِيثِ ابْنِ مُسْهِرٍ",53
3847,38,"Dan telah menceritakan kepadaku [Zaid bin Yazid Abu Ma'an Ar Raqqasyi]; Telah menceritakan kepada kami [Abu 'Ashim] dari ['Utsman] yaitu Ibnu Murrah; Telah menceritakan kepada kami ['Abdullah bin 'Abdurrahman]; dari bibinya [Ummu Salamah] dia berkata; Rasulullah shallallahu 'alaihi wasallam barsabda: ""Barangsiapa minum dengan bejana emas atau perak, maka sebenarnya dia sedang menggodok api neraka di dalam perutnya.""","و حَدَّثَنِي زَيْدُ بْنُ يَزِيدَ أَبُو مَعْنٍ الرَّقَّاشِيُّ حَدَّثَنَا أَبُو عَاصِمٍ عَنْ عُثْمَانَ يَعْنِي ابْنَ مُرَّةَ حَدَّثَنَا عَبْدُ اللَّهِ بْنُ عَبْدِ الرَّحْمَنِ عَنْ خَالَتِهِ أُمِّ سَلَمَةَ قَالَتْ
قَالَ رَسُولُ اللَّهِ صَلَّى اللَّهُ عَلَيْهِ وَسَلَّمَ مَنْ شَرِبَ فِي إِنَاءٍ مِنْ ذَهَبٍ أَوْ فِضَّةٍ فَإِنَّمَا يُجَرْجِرُ فِي بَطْنِهِ نَارًا مِنْ جَهَنَّمَ",53
