haditsId,kitabId,indo,arab,label
2619,18,"Telah menceritakan kepada kami [Abu Bakar bin Abu Syaibah] dan [Abu Kuraib] keduanya berkata; Telah menceritakan kepada kami [Ibnu Numair] dari [Hisyam] dari [ayahnya] dari ['Aisyah] dia berkata; Pamanku sesusuan datang meminta izin untuk menemuiku, lalu saya enggan mengizinkan dia sebelum ada perintah dari Rasulullah shallallahu 'alaihi wasallam, tatkala Rasulullah shallallahu 'alaihi wasallam datang, saya berkata; Sesungguhnya pamanku dari sesusuan meminta izin untuk menemuiku, namun saya enggan memberikannya izin, maka Rasulullah shallallahu 'alaihi wasallam bersabda: ""Biarkanlah pamanmu masuk menemuimu."" Saya berkata; Yang menyusuiku adalah seorang wanita bukan seorang laki-laki, beliau bersabda: ""Sesungguhnya dia adalah pamanmu, biarkanlah dia masuk menemuimu."" Telah menceritakan kepadaku [Abu Ar Rabi' Az Zahrani] telah menceritakan kepada kami [Hammad yaitu Ibnu Zaid] telah menceritakan kepada kami [Hisyam] dengan isnad ini, bahwa saudara Abu Al Qu'ais meminta izin untuk menemuinya, kemudian dia menyebutkan seperti hadits di atas. Telah menceritakan kepada kami [Yahya bin Yahya] telah mengabarkan kepada kami [Abu Mu'awiyah] dari [Hisyam] dengan isnad seperti ini, namun dia menyebutkan; Bahwa Abu Al Qu'ais meminta izin untuk menemuinya.""","و حَدَّثَنَا أَبُو بَكْرِ بْنُ أَبِي شَيْبَةَ وَأَبُو كُرَيْبٍ قَالَا حَدَّثَنَا ابْنُ نُمَيْرٍ عَنْ هِشَامٍ عَنْ أَبِيهِ عَنْ عَائِشَةَ قَالَتْ
جَاءَ عَمِّي مِنْ الرَّضَاعَةِ يَسْتَأْذِنُ عَلَيَّ فَأَبَيْتُ أَنْ آذَنَ لَهُ حَتَّى أَسْتَأْمِرَ رَسُولَ اللَّهِ صَلَّى اللَّهُ عَلَيْهِ وَسَلَّمَ فَلَمَّا جَاءَ رَسُولُ اللَّهِ صَلَّى اللَّهُ عَلَيْهِ وَسَلَّمَ قُلْتُ إِنَّ عَمِّي مِنْ الرَّضَاعَةِ اسْتَأْذَنَ عَلَيَّ فَأَبَيْتُ أَنْ آذَنَ لَهُ فَقَالَ رَسُولُ اللَّهِ صَلَّى اللَّهُ عَلَيْهِ وَسَلَّمَ فَلْيَلِجْ عَلَيْكِ عَمُّكِ قُلْتُ إِنَّمَا أَرْضَعَتْنِي الْمَرْأَةُ وَلَمْ يُرْضِعْنِي الرَّجُلُ قَالَ إِنَّهُ عَمُّكِ فَلْيَلِجْ عَلَيْكِ
و حَدَّثَنِي أَبُو الرَّبِيعِ الزَّهْرَانِيُّ حَدَّثَنَا حَمَّادٌ يَعْنِي ابْنَ زَيْدٍ حَدَّثَنَا هِشَامٌ بِهَذَا الْإِسْنَادِ أَنَّ أَخَا أَبِي الْقُعَيْسِ اسْتَأْذَنَ عَلَيْهَا فَذَكَرَ نَحْوَهُ و حَدَّثَنَا يَحْيَى بْنُ يَحْيَى أَخْبَرَنَا أَبُو مُعَاوِيَةَ عَنْ هِشَامٍ بِهَذَا الْإِسْنَادِ نَحْوَهُ غَيْرَ أَنَّهُ قَالَ اسْتَأْذَنَ عَلَيْهَا أَبُو الْقُعَيْسِ",58
2704,19,"Telah menceritakan kepada kami [Zuhair bin Harb] telah menceritakan kepada kami ['Umar bin Yunus Al Hanafi] telah menceritakan kepada kami [Ikrimah bin 'Ammar] dari [Simak Abu Zumail] telah menceritakan kepadaku ['Abdullah bin Abbas] telah menceritakan kepadaku [Umar bin Al Khaththab] dia berkata; Ketika Nabi shallallahu 'alaihi wasallam mengasingkan diri dari para istrinya. Dia (umar) melanjutkan; Lalu saya memasuki masjid dan saya lihat orang-orang sedang memain-mainkan kerikil. Mereka semua berkata; Rasulullah shallallahu 'alaihi wasallam telah menceraikan para istrinya, kejadian itu terjadi sebelum ada perintah hijab, maka Umar berkata; Kemudian saya berkata; Saya ingin tahu kepastiannya sekarang juga. Dia melanjutkan; Lalu saya menemui Aisyah sambil bertanya; Wahai putri Abu Bakar, belum puas jugakah kamu menyakiti hati Rasulullah shallallahu 'alaihi wasallam? Dia menjawab; Apa urusanku denganmu wahai Ibnul Khaththab! Sebaiknya kamu mengurusi tempatmu sendiri (maksudnya disuruh untuk menasehati Hafshah putrinya), dia (Umar) melanjutkan; Kemudian saya menemui Hafshah binti Umar, lantas saya berkata kepadanya; Wahai Hafshah, sudah puaskah kamu menyakiti hati Rasulullah shallallahu 'alaihi wasallam, sungguh kamu telah mengerahui bahwa Rasulullah shallallahu 'alaihi wasallam tidak mencintaimu, kalau bukan karenaku, niscaya Rasulullah shallallahu 'alaihi wasallam telah menceraikanmu, karena itu dia (Hafshah) menangis sejadi-jadinya. Lalu saya bertanya kepadanya; Di manakah sekarang Rasulullah shallallahu 'alaihi wasallam? Dia menjawab; Beliau ada di ruangan pribadinya. Kemudian saya pergi untuk menemui beliau, tiba-tiba saya bertemu dengan Rabah, seorang pelayan Rasulullah shallallahu 'alaihi wasallam, sedang duduk dengan menjulurkan kakinya di atas kayu yang berada di depan pintu ruangan, yaitu kayu yang dibuat tangga Rasulullah shallallahu 'alaihi wasallam untuk naik, lantas saya memanggilnya; wahai Rabah, mintakanlah saya izin untuk bertemu Rasulullah shallallahu 'alaihi wasallam! Kemudian Rabah menengok ke ruangan lalu memandangku tanpa mengatakan suatu apa pun, lalu saya memanggilnya dengan agak keras; Wahai rabah, mintakanlah saya izin untuk menemui Rasulullah shallallahu 'alaihi wasallam, sebab saya mengira, bahwasannya Rasulullah shallallahu 'alaihi wasallam tahu jika kedatanganku karena Hafshah, demi Allah seandainya Rasulullah shallallahu 'alaihi wasallam memerintahkanku untuk memenggal lehernya, sungguh saya akan memenggal lehernya! Perkataanku itu saya katakan dengan nada yang keras. Kemudian dia memberi isyarat supaya saya naik. Saya langsung menemui Rasulullah shallallahu 'alaihi wasallam, dan beliau sedang berbaring di atas tikar, lantas saya duduk di dekat beliau, sewaktu beliau membetulkan sarungnya, terlihat olehku bekas tikar di tulang rusuk beliau, kuperhatikan di tempat penyimpanan barang, ternyata saya tidak mendapati apa-apa, kecuali sekantong gandum kira-kira satu sha' dan seukuran qarazh berada di sudut ruangan dan sehelai kulit yang menggantung, (Umar) melanjutkan; (Melihat keadaan seperti itu) air mataku menetes, lalu beliau bertanya: ""Kenapa kamu menangis wahai Ibnul Khaththab?"" Saya menjawab; Wahai Nabiyullah, bagaimana saya tidak menangis, sebab saya melihat tikar ini membekas di rusuk anda, dan saya tidak melihat sesuatu pun di tempat penyimpanan barang anda ini selain apa yang telah saya lihat, padahal istana Persia dan kekaisaran Romawi berlimpah-limpah dengan buah-buahan dan sungai-sungai, sedangkan anda adalah Rasulullah shallallahu 'alaihi wasallam dan orang pilihan-Nya, hanya beginilah tempat penyimpanan barang anda! Beliau bersabda: ""Hai Ibnul Khaththab, tidak sukakah kamu jika akhirat untuk kita sedangkan dunia untuk mereka?"" Saya menjawab; Tentu. Ketika saya masuk menemui beliau, seakan-akan wajah beliau sedang marah, lantas saya bertanya; Wahai Rasulullah, apakah yang menyusahkan anda perihal istri-istri anda? Jika anda menceraikan mereka, maka Allah dan sekalian Malaikat-Nya, Jibril, Mika`il, saya sendiri dan Abu Bakar serta orang-orang yang beriman akan tetap bersama anda. Dan saya belum pernah mengucapkan kata-kata seperti itu kepada beliau sambil memuji Allah, kecuali saya berharap semoga Allah membenarkan ucapanku kepada beliau, kemudian turunlah ayat pilhan berikut ini: ""Jika Nabi menceraikanmu sekalian, mungkin Rabbnya akan mengganti baginya dengan istri-istri yang lebih baik dari kalian."" ""Dan jika kamu berdua saling membantu untuk menyusahkan Nabi, maka sesungguhnya Allah adalah Pelindungnya, begitu pula Jibril dan orang-orang Mukmin yang shalih serta seluruh Malaikat adalah penolongnya pula."" Sedangkan Aisyah dan Hafshahlah yang bekerja sama berdemo dan mempengaruhi istri-istri Nabi shallallahu 'alaihi wasallam yang lain, lalu saya berkata; Wahai Rasulullah, apakah anda menceraikan mereka? Beliau menjawab: ""Tidak."" Saya melanjutkan; Wahai Rasulullah, ketika saya memasuki masjid, saya melihat kaum Muslimin sedang mempermainkan kerikil sambil berkata; Rasulullah shallallahu 'alaihi wasallam telah menceraikan para istrinya. Apakah saya harus turun dan menjelaskan kepada mereka bahwa anda tida menceraikan mereka? Beliau menjawab; ""Ya, jika kamu mau."" Saya senantiasa berbicara dengan beliau, hingga hilang kesan marah dari wajah beliau dan berganti dengan senyuman. Dan beliau adalah manusia yang mimiliki deretan gigi paling baik. Kemudian Nabiyullah shallallahu 'alaihi wasallam turun, saya pun turun dengan berpegangan batang pohon kurma, sedangkan Rasulullah shallallahu 'alaihi wasallam turun layaknya berjalan di atas bumi, tidak berpegangan dengan apapun, lalu saya berkata; Wahai Rasulullah, padahal anda di ruangan itu baru dua puluh sembilan hari! beliau bersabda: ""Sesungguhnya hari itu hanya dua puluh sembilan hari."" Lantas saya berdiri di depan pintu masjid sambil menyeru dengan suara yang lantang bahwa Rasulullah shallallahu 'alaihi wasallam tidak menceraikan para istri beliau. Kemudian turunlah ayat: ""Dan apabila datang kepada mereka suatu berita yang menyenangkan dan menakutkan, mereka langsung menyiarkannya. Padahal, apabila mereka menyerahkannya kepada Allah dan pemimpin (ulil Amri) di antara mereka, tentulah orang-orang yang ingin suatu kepastian tentang kebenarannya akan mengetahuinya dari mereka."" Dan sayalah yang memastikan kebenaran berita tersebut, kemudian Allah Azza Wa Jalla menurunkan ayat pilihan (yaitu Al Ahzab: 28-29).","حَدَّثَنِي زُهَيْرُ بْنُ حَرْبٍ حَدَّثَنَا عُمَرُ بْنُ يُونُسَ الْحَنَفِيُّ حَدَّثَنَا عِكْرِمَةُ بْنُ عَمَّارٍ عَنْ سِمَاكٍ أَبِي زُمَيْلٍ حَدَّثَنِي عَبْدُ اللَّهِ بْنُ عَبَّاسٍ حَدَّثَنِي عُمَرُ بْنُ الْخَطَّابِ قَالَ
لَمَّا اعْتَزَلَ نَبِيُّ اللَّهِ صَلَّى اللَّهُ عَلَيْهِ وَسَلَّمَ نِسَاءَهُ قَالَ دَخَلْتُ الْمَسْجِدَ فَإِذَا النَّاسُ يَنْكُتُونَ بِالْحَصَى وَيَقُولُونَ طَلَّقَ رَسُولُ اللَّهِ صَلَّى اللَّهُ عَلَيْهِ وَسَلَّمَ نِسَاءَهُ وَذَلِكَ قَبْلَ أَنْ يُؤْمَرْنَ بِالْحِجَابِ فَقَالَ عُمَرُ فَقُلْتُ لَأَعْلَمَنَّ ذَلِكَ الْيَوْمَ قَالَ فَدَخَلْتُ عَلَى عَائِشَةَ فَقُلْتُ يَا بِنْتَ أَبِي بَكْرٍ أَقَدْ بَلَغَ مِنْ شَأْنِكِ أَنْ تُؤْذِي رَسُولَ اللَّهِ صَلَّى اللَّهُ عَلَيْهِ وَسَلَّمَ فَقَالَتْ مَا لِي وَمَا لَكَ يَا ابْنَ الْخَطَّابِ عَلَيْكَ بِعَيْبَتِكَ قَالَ فَدَخَلْتُ عَلَى حَفْصَةَ بِنْتِ عُمَرَ فَقُلْتُ لَهَا يَا حَفْصَةُ أَقَدْ بَلَغَ مِنْ شَأْنِكِ أَنْ تُؤْذِي رَسُولَ اللَّهِ صَلَّى اللَّهُ عَلَيْهِ وَسَلَّمَ وَاللَّهِ لَقَدْ عَلِمْتِ أَنَّ رَسُولَ اللَّهِ صَلَّى اللَّهُ عَلَيْهِ وَسَلَّمَ لَا يُحِبُّكِ وَلَوْلَا أَنَا لَطَلَّقَكِ رَسُولُ اللَّهِ صَلَّى اللَّهُ عَلَيْهِ وَسَلَّمَ فَبَكَتْ أَشَدَّ الْبُكَاءِ فَقُلْتُ لَهَا أَيْنَ رَسُولُ اللَّهِ صَلَّى اللَّهُ عَلَيْهِ وَسَلَّمَ قَالَتْ هُوَ فِي خِزَانَتِهِ فِي الْمَشْرُبَةِ فَدَخَلْتُ فَإِذَا أَنَا بِرَبَاحٍ غُلَامِ رَسُولِ اللَّهِ صَلَّى اللَّهُ عَلَيْهِ وَسَلَّمَ قَاعِدًا عَلَى أُسْكُفَّةِ الْمَشْرُبَةِ مُدَلٍّ رِجْلَيْهِ عَلَى نَقِيرٍ مِنْ خَشَبٍ وَهُوَ جِذْعٌ يَرْقَى عَلَيْهِ رَسُولُ اللَّهِ صَلَّى اللَّهُ عَلَيْهِ وَسَلَّمَ وَيَنْحَدِرُ فَنَادَيْتُ يَا رَبَاحُ اسْتَأْذِنْ لِي عِنْدَكَ عَلَى رَسُولِ اللَّهِ صَلَّى اللَّهُ عَلَيْهِ وَسَلَّمَ فَنَظَرَ رَبَاحٌ إِلَى الْغُرْفَةِ ثُمَّ نَظَرَ إِلَيَّ فَلَمْ يَقُلْ شَيْئًا ثُمَّ قُلْتُ يَا رَبَاحُ اسْتَأْذِنْ لِي عِنْدَكَ عَلَى رَسُولِ اللَّهِ صَلَّى اللَّهُ عَلَيْهِ وَسَلَّمَ فَنَظَرَ رَبَاحٌ إِلَى الْغُرْفَةِ ثُمَّ نَظَرَ إِلَيَّ فَلَمْ يَقُلْ شَيْئًا ثُمَّ رَفَعْتُ صَوْتِي فَقُلْتُ يَا رَبَاحُ اسْتَأْذِنْ لِي عِنْدَكَ عَلَى رَسُولِ اللَّهِ صَلَّى اللَّهُ عَلَيْهِ وَسَلَّمَ فَإِنِّي أَظُنُّ أَنَّ رَسُولَ اللَّهِ صَلَّى اللَّهُ عَلَيْهِ وَسَلَّمَ ظَنَّ أَنِّي جِئْتُ مِنْ أَجْلِ حَفْصَةَ وَاللَّهِ لَئِنْ أَمَرَنِي رَسُولُ اللَّهِ صَلَّى اللَّهُ عَلَيْهِ وَسَلَّمَ بِضَرْبِ عُنُقِهَا لَأَضْرِبَنَّ عُنُقَهَا وَرَفَعْتُ صَوْتِي فَأَوْمَأَ إِلَيَّ أَنْ ارْقَهْ فَدَخَلْتُ عَلَى رَسُولِ اللَّهِ صَلَّى اللَّهُ عَلَيْهِ وَسَلَّمَ وَهُوَ مُضْطَجِعٌ عَلَى حَصِيرٍ فَجَلَسْتُ فَأَدْنَى عَلَيْهِ إِزَارَهُ وَلَيْسَ عَلَيْهِ غَيْرُهُ وَإِذَا الْحَصِيرُ قَدْ أَثَّرَ فِي جَنْبِهِ فَنَظَرْتُ بِبَصَرِي فِي خِزَانَةِ رَسُولِ اللَّهِ صَلَّى اللَّهُ عَلَيْهِ وَسَلَّمَ فَإِذَا أَنَا بِقَبْضَةٍ مِنْ شَعِيرٍ نَحْوِ الصَّاعِ وَمِثْلِهَا قَرَظًا فِي نَاحِيَةِ الْغُرْفَةِ وَإِذَا أَفِيقٌ مُعَلَّقٌ قَالَ فَابْتَدَرَتْ عَيْنَايَ قَالَ مَا يُبْكِيكَ يَا ابْنَ الْخَطَّابِ قُلْتُ يَا نَبِيَّ اللَّهِ وَمَا لِي لَا أَبْكِي وَهَذَا الْحَصِيرُ قَدْ أَثَّرَ فِي جَنْبِكَ وَهَذِهِ خِزَانَتُكَ لَا أَرَى فِيهَا إِلَّا مَا أَرَى وَذَاكَ قَيْصَرُ وَكِسْرَى فِي الثِّمَارِ وَالْأَنْهَارِ وَأَنْتَ رَسُولُ اللَّهِ صَلَّى اللَّهُ عَلَيْهِ وَسَلَّمَ وَصَفْوَتُهُ وَهَذِهِ خِزَانَتُكَ فَقَالَ يَا ابْنَ الْخَطَّابِ أَلَا تَرْضَى أَنْ تَكُونَ لَنَا الْآخِرَةُ وَلَهُمْ الدُّنْيَا قُلْتُ بَلَى قَالَ وَدَخَلْتُ عَلَيْهِ حِينَ دَخَلْتُ وَأَنَا أَرَى فِي وَجْهِهِ الْغَضَبَ فَقُلْتُ يَا رَسُولَ اللَّهِ مَا يَشُقُّ عَلَيْكَ مِنْ شَأْنِ النِّسَاءِ فَإِنْ كُنْتَ طَلَّقْتَهُنَّ فَإِنَّ اللَّهَ مَعَكَ وَمَلَائِكَتَهُ وَجِبْرِيلَ وَمِيكَائِيلَ وَأَنَا وَأَبُو بَكْرٍ وَالْمُؤْمِنُونَ مَعَكَ وَقَلَّمَا تَكَلَّمْتُ وَأَحْمَدُ اللَّهَ بِكَلَامٍ إِلَّا رَجَوْتُ أَنْ يَكُونَ اللَّهُ يُصَدِّقُ قَوْلِي الَّذِي أَقُولُ وَنَزَلَتْ هَذِهِ الْآيَةُ آيَةُ التَّخْيِيرِ
{ عَسَى رَبُّهُ إِنْ طَلَّقَكُنَّ أَنْ يُبْدِلَهُ أَزْوَاجًا خَيْرًا مِنْكُنَّ }
{ وَإِنْ تَظَاهَرَا عَلَيْهِ فَإِنَّ اللَّهَ هُوَ مَوْلَاهُ وَجِبْرِيلُ وَصَالِحُ الْمُؤْمِنِينَ وَالْمَلَائِكَةُ بَعْدَ ذَلِكَ ظَهِيرٌ }
وَكَانَتْ عَائِشَةُ بِنْتُ أَبِي بَكْرٍ وَحَفْصَةُ تَظَاهَرَانِ عَلَى سَائِرِ نِسَاءِ النَّبِيِّ صَلَّى اللَّهُ عَلَيْهِ وَسَلَّمَ فَقُلْتُ يَا رَسُولَ اللَّهِ أَطَلَّقْتَهُنَّ قَالَ لَا قُلْتُ يَا رَسُولَ اللَّهِ إِنِّي دَخَلْتُ الْمَسْجِدَ وَالْمُسْلِمُونَ يَنْكُتُونَ بِالْحَصَى يَقُولُونَ طَلَّقَ رَسُولُ اللَّهِ صَلَّى اللَّهُ عَلَيْهِ وَسَلَّمَ نِسَاءَهُ أَفَأَنْزِلُ فَأُخْبِرَهُمْ أَنَّكَ لَمْ تُطَلِّقْهُنَّ قَالَ نَعَمْ إِنْ شِئْتَ فَلَمْ أَزَلْ أُحَدِّثُهُ حَتَّى تَحَسَّرَ الْغَضَبُ عَنْ وَجْهِهِ وَحَتَّى كَشَرَ فَضَحِكَ وَكَانَ مِنْ أَحْسَنِ النَّاسِ ثَغْرًا ثُمَّ نَزَلَ نَبِيُّ اللَّهِ صَلَّى اللَّهُ عَلَيْهِ وَسَلَّمَ وَنَزَلْتُ فَنَزَلْتُ أَتَشَبَّثُ بِالْجِذْعِ وَنَزَلَ رَسُولُ اللَّهِ صَلَّى اللَّهُ عَلَيْهِ وَسَلَّمَ كَأَنَّمَا يَمْشِي عَلَى الْأَرْضِ مَا يَمَسُّهُ بِيَدِهِ فَقُلْتُ يَا رَسُولَ اللَّهِ إِنَّمَا كُنْتَ فِي الْغُرْفَةِ تِسْعَةً وَعِشْرِينَ قَالَ إِنَّ الشَّهْرَ يَكُونُ تِسْعًا وَعِشْرِينَ فَقُمْتُ عَلَى بَابِ الْمَسْجِدِ فَنَادَيْتُ بِأَعْلَى صَوْتِي لَمْ يُطَلِّقْ رَسُولُ اللَّهِ صَلَّى اللَّهُ عَلَيْهِ وَسَلَّمَ نِسَاءَهُ وَنَزَلَتْ هَذِهِ الْآيَةُ
{ وَإِذَا جَاءَهُمْ أَمْرٌ مِنْ الْأَمْنِ أَوْ الْخَوْفِ أَذَاعُوا بِهِ وَلَوْ رَدُّوهُ إِلَى الرَّسُولِ وَإِلَى أُولِي الْأَمْرِ مِنْهُمْ لَعَلِمَهُ الَّذِينَ يَسْتَنْبِطُونَهُ مِنْهُمْ }
فَكُنْتُ أَنَا اسْتَنْبَطْتُ ذَلِكَ الْأَمْرَ وَأَنْزَلَ اللَّهُ عَزَّ وَجَلَّ آيَةَ التَّخْيِيرِ",58
2708,19,"Telah menceritakan kepada kami [Ishaq bin Ibrahim Al Handlali] dan [Muhammad bin Abi Umar] sedangkan lafazh haditsnya hampir sama, dia berkata; Ibnu Abi Umar berkata; Telah menceritakan kepada kami. Sedangkan Ishaq mengatakan; Telah mengabarkan kepada kami [Abdur Razzaq] telah mengabarkan kepada kami [Ma'mar] dari [Az Zuhri] berkata; Telah mengabarkan kepadaku [Urwah] dari ['Aisyah] dia berkata; Ketika telah berlalu dua puluh sembilan malam, Rasulullah shallallahu 'alaihi wasallam pertama kalinya menemuiku, maka saya bertanya; Wahai Rasulullah, anda telah bersumpah untuk tidak menemui kami selama sebulan, akan tetapi baru dua puluh sembilan hari saya menghitungnya, anda sudah menemuiku. Beliau bersabda: ""Sesungguhnya sebulan itu dua puluh sembilan hari."" Kemudian beliau melanjutkan: ""Wahai 'Aisyah, sesungguhnya saya akan mengemukakan suatu perkara, maka janganlah kamu tergesa-gesa memutuskannya sebelum kamu bermusyawarah dengan kedua orang tuamu."" Kemudian beliau membacakan ayat kepadaku, yaitu: ""Wahai Nabi, katakanlah kepada para istrimu -sampai pada ayat- pahala yang besar"". Aisyah berkata; Sungguh beliau telah mengetahui, demi Allah sesungguhnya kedua orang tuaku tidak akan mengizinkanku untuk berpisah dengannya. Dia (Aisyah) melanjutkan; Saya berkata; Apakah dengan urusan ini anda menyuruhku meminta pendapat dengan kedua orang tuaku! Sesungguhnya saya memilih Allah, Rasul-Nya dan kampung akhirat. [Ma'mar] berkata; Telah mengabarkan kepadaku [Ayyub] bahwasannya ['Aisyah] berkata; Janganlah anda mengabarkan kepada istri-istrimu yang lain kalau saya memilih anda. Maka Nabi shallallahu 'alaihi wasallam kepadanya: ""Sesungguhnya Allah mengutusku sebagai orang yang menyampaikan dan tidak mengutusku sebagai orang yang menyusahkan."" Qatadah mengatakan; Maksud dari kalimat ""in shaghat qulubukuma"", yakni: Hatimu berdua telah condong (untuk menerima kebaikan).""","قَالَ الزُّهْرِيُّ فَأَخْبَرَنِي عُرْوَةُ عَنْ عَائِشَةَ قَالَتْ
لَمَّا مَضَى تِسْعٌ وَعِشْرُونَ لَيْلَةً دَخَلَ عَلَيَّ رَسُولُ اللَّهِ صَلَّى اللَّهُ عَلَيْهِ وَسَلَّمَ بَدَأَ بِي فَقُلْتُ يَا رَسُولَ اللَّهِ إِنَّكَ أَقْسَمْتَ أَنْ لَا تَدْخُلَ عَلَيْنَا شَهْرًا وَإِنَّكَ دَخَلْتَ مِنْ تِسْعٍ وَعِشْرِينَ أَعُدُّهُنَّ فَقَالَ إِنَّ الشَّهْرَ تِسْعٌ وَعِشْرُونَ ثُمَّ قَالَ يَا عَائِشَةُ إِنِّي ذَاكِرٌ لَكِ أَمْرًا فَلَا عَلَيْكِ أَنْ لَا تَعْجَلِي فِيهِ حَتَّى تَسْتَأْمِرِي أَبَوَيْكِ ثُمَّ قَرَأَ عَلَيَّ الْآيَةَ
{ يَا أَيُّهَا النَّبِيُّ قُلْ لِأَزْوَاجِكَ حَتَّى بَلَغَ أَجْرًا عَظِيمًا }
قَالَتْ عَائِشَةُ قَدْ عَلِمَ وَاللَّهِ أَنَّ أَبَوَيَّ لَمْ يَكُونَا لِيَأْمُرَانِي بِفِرَاقِهِ قَالَتْ فَقُلْتُ أَوَ فِي هَذَا أَسْتَأْمِرُ أَبَوَيَّ فَإِنِّي أُرِيدُ اللَّهَ وَرَسُولَهُ وَالدَّارَ الْآخِرَةَ
قَالَ مَعْمَرٌ فَأَخْبَرَنِي أَيُّوبُ أَنَّ عَائِشَةَ قَالَتْ لَا تُخْبِرْ نِسَاءَكَ أَنِّي اخْتَرْتُكَ فَقَالَ لَهَا النَّبِيُّ صَلَّى اللَّهُ عَلَيْهِ وَسَلَّمَ إِنَّ اللَّهَ أَرْسَلَنِي مُبَلِّغًا وَلَمْ يُرْسِلْنِي مُتَعَنِّتًا قَالَ قَتَادَةُ
{ صَغَتْ قُلُوبُكُمَا }
مَالَتْ قُلُوبُكُمَا",58
