haditsId,kitabId,indo,arab,label
1201,7,"Telah menceritakan kepada kami [Yahya bin Yahya] telah mengabarkan kepada kami [Husyaim] dari [Khalid] dari [Abdullah bin Syaqiq] katanya; aku bertanya kepada ['Aisyah] tentang shalat Rasulullah shallallahu 'alaihi wasallam, maksudnya shalat sunnahnya, maka dia menjawab; ""Beliau shalat di rumahku empat raka'at sebelum zhuhur, kemudian keluar dan shalat mengimami manusia, seusai shalat, beliau melaksanakan dua raka'at sunnah, dan setelah mengimami shalat maghrib, beliau masuk dan shalat dua rakaat, kemudian mengimami sahabat untuk shalat isya`, dan masuk rumahku untuk mengerjakan shalat dua rakaat, dan beliau shalat malam sebanyak sembilan rakaat termasuk witirnya, beliau mendirikan shalat malam sekian lama sambil berdiri, dan juga shalat malam sekian lama sambil duduk, jika beliau membaca dengan berdiri, beliau ruku dan sujud dengan berdiri, jika beliau membaca sambil duduk, maka beliau ruku dan sujud dengan duduk, jika fajar telah terbit, maka beliau shalat (sunnah) dua rakaat.""","حَدَّثَنَا يَحْيَى بْنُ يَحْيَى أَخْبَرَنَا هُشَيْمٌ عَنْ خَالِدٍ عَنْ عَبْدِ اللَّهِ بْنِ شَقِيقٍ قَالَ سَأَلْتُ عَائِشَةَ
عَنْ صَلَاةِ رَسُولِ اللَّهِ صَلَّى اللَّهُ عَلَيْهِ وَسَلَّمَ عَنْ تَطَوُّعِهِ فَقَالَتْ كَانَ يُصَلِّي فِي بَيْتِي قَبْلَ الظُّهْرِ أَرْبَعًا ثُمَّ يَخْرُجُ فَيُصَلِّي بِالنَّاسِ ثُمَّ يَدْخُلُ فَيُصَلِّي رَكْعَتَيْنِ وَكَانَ يُصَلِّي بِالنَّاسِ الْمَغْرِبَ ثُمَّ يَدْخُلُ فَيُصَلِّي رَكْعَتَيْنِ وَيُصَلِّي بِالنَّاسِ الْعِشَاءَ وَيَدْخُلُ بَيْتِي فَيُصَلِّي رَكْعَتَيْنِ وَكَانَ يُصَلِّي مِنْ اللَّيْلِ تِسْعَ رَكَعَاتٍ فِيهِنَّ الْوِتْرُ وَكَانَ يُصَلِّي لَيْلًا طَوِيلًا قَائِمًا وَلَيْلًا طَوِيلًا قَاعِدًا وَكَانَ إِذَا قَرَأَ وَهُوَ قَائِمٌ رَكَعَ وَسَجَدَ وَهُوَ قَائِمٌ وَإِذَا قَرَأَ قَاعِدًا رَكَعَ وَسَجَدَ وَهُوَ قَاعِدٌ وَكَانَ إِذَا طَلَعَ الْفَجْرُ صَلَّى رَكْعَتَيْنِ",58
1282,7,"Dan telah menceritakan kepadaku [Harun bin Abdullah] dan [Muhammad bin Rafi'] keduanya berkata, telah menceritakan kepada kami [Wahb bin Jarir] telah mengabarkan kepadaku [bapakku] ia berkata, saya mendengar [Qais bin Sa'd] ia menceritakan dari ['Atha`] dari [Ibnu Abbas] ia berkata; ""Al Abbas mengutusku menemui Nabi shallallahu 'alaihi wasallam, sementara beliau berada di rumah bibiku Maimunah. Maka pada malam itu aku menginap bersama beliau. Kemudian beliau bangun dan menunaikan shalat malam. Lalu saya ikut shalat di sebelah kiri beliau, namun beliau memindahkanku dari arah belakangnya dan menempatkanku di samping kanannya."" Dan telah menceritakan kepadaku [Ibnu Numair] telah menceritakan kepada kami [bapakku] telah menceritakan kepada kami [Abdul Malik] dari [Atha`] dari [Ibnu Abbas] ia berkata; Saya bermalan di rumah bibiku, Maimunah. Yakni sebagaimana hadits Ibnu Juraij dan Qais bin Sa'd.","و حَدَّثَنِي هَارُونُ بْنُ عَبْدِ اللَّهِ وَمُحَمَّدُ بْنُ رَافِعٍ قَالَا حَدَّثَنَا وَهْبُ بْنُ جَرِيرٍ أَخْبَرَنِي أَبِي قَالَ سَمِعْتُ قَيْسَ بْنَ سَعْدٍ يُحَدِّثُ عَنْ عَطَاءٍ عَنْ ابْنِ عَبَّاسٍ قَالَ
بَعَثَنِي الْعَبَّاسُ إِلَى النَّبِيِّ صَلَّى اللَّهُ عَلَيْهِ وَسَلَّمَ وَهُوَ فِي بَيْتِ خَالَتِي مَيْمُونَةَ فَبِتُّ مَعَهُ تِلْكَ اللَّيْلَةَ فَقَامَ يُصَلِّي مِنْ اللَّيْلِ فَقُمْتُ عَنْ يَسَارِهِ فَتَنَاوَلَنِي مِنْ خَلْفِ ظَهْرِهِ فَجَعَلَنِي عَلَى يَمِينِهِ
و حَدَّثَنِي ابْنُ نُمَيْرٍ حَدَّثَنَا أَبِي حَدَّثَنَا عَبْدُ الْمَلِكِ عَنْ عَطَاءٍ عَنْ ابْنِ عَبَّاسٍ قَالَ بِتُّ عِنْدَ خَالَتِي مَيْمُونَةَ نَحْوَ حَدِيثِ ابْنِ جُرَيْجٍ وَقَيْسِ بْنِ سَعْدٍ",58
1292,7,"Dan telah menceritakan kepada kami [Utsman bin Abu Syaibah] dan [Ishaq bin Ibrahim] keduanya dari [Jarir] -dalam jalur lain [Utsman] berkata- telah menceritakan kepada kami [Jarir] dari [Al A'masy] dari [Abu Wa`il] ia berkata, [Abdullah] berkata; ""Saya pernah shalat bersama Rasulullah shallallahu 'alaihi wasallam lalu beliau memanjangkannya hingga saya berkeinginan untuk berbuat sesuatu yang tidak baik."" Ditanyakan kepadanya, ""Perbuatan apa yang hendak kamu lakukan?"" Abdullah menjawab, ""Saya hendak duduk dan meninggalkannya."" Dan telah menceritakannya kepada kami [Isma'il bin Khalil] dan [Suwaid bin Sa'id] dari [Ali bin Mushir] dari [Al A'masy] dengan isnad ini semisalnya.","و حَدَّثَنَا عُثْمَانُ بْنُ أَبِي شَيْبَةَ وَإِسْحَقُ بْنُ إِبْرَاهِيمَ كِلَاهُمَا عَنْ جَرِيرٍ قَالَ عُثْمَانُ حَدَّثَنَا جَرِيرٌ عَنْ الْأَعْمَشِ عَنْ أَبِي وَائِلٍ قَالَ
قَالَ عَبْدُ اللَّهِ صَلَّيْتُ مَعَ رَسُولِ اللَّهِ صَلَّى اللَّهُ عَلَيْهِ وَسَلَّمَ فَأَطَالَ حَتَّى هَمَمْتُ بِأَمْرِ سَوْءٍ قَالَ قِيلَ وَمَا هَمَمْتَ بِهِ قَالَ هَمَمْتُ أَنْ أَجْلِسَ وَأَدَعَهُ
و حَدَّثَنَاه إِسْمَعِيلُ بْنُ الْخَلِيلِ وَسُوَيْدُ بْنُ سَعِيدٍ عَنْ عَلِيِّ بْنِ مُسْهِرٍ عَنْ الْأَعْمَشِ بِهَذَا الْإِسْنَادِ مِثْلَهُ",58
1301,7,"Dan telah menceritakan kepada kami [Muhammad bin Al Mutsanna] telah menceritakan kepada kami [Muhammad bin Ja'far] telah menceritakan kepada kami [Abdullah bin Sa'id] telah menceritakan kepada kami [Salim Abu Nadlr] maula Umar bin Ubaidullah, dari [Busr bin Sa'id] dari [Zaid bin Tsabit] ia berkata; ""Rasulullah shallallahu 'alaihi wasallam memasang tenda dari tikar pada sebuah tempat di Masjid, sehingga merupakan sebuah kamar tempat beliau shalat (malam). Melihat hal itu, beberapa orang sahabat mendatangi tempat itu dan mereka shalat pula mengikuti Nabi shallallahu 'alaihi wasallam shalat. Pada suatu malam mereka datang pula, tetapi Rasulullah shallallahu 'alaihi wasallam terlambat, sehingga beliau tidak keluar sama sekali menemui mereka. Oleh karena itu, mereka mengeraskan suara dan melempar pintu dengan kerikil, untuk memberi tahu Nabi shallallahu 'alaihi wasallam, karena mereka menyangka kalau-kalau beliau lupa. Maka dalam keadaan marah Rasulullah shallallahu 'alaihi wasallam keluar menemui mereka sambil bersabda: ""Janganlah kalian berbuat demikian, karena aku mengira bahwa shalat malam itu akan diwajibkan kepada kalian. Karena itu, shalatlah kalian di rumah kalian masing-masing, karena sebaik-baik shalat seseorang adalah yang dilakukan di rumahnya sendiri, kecuali shalat wajib."" Dan telah menceritakan kepadaku [Muhammad bin Hatim] telah menceritakan kepada kami [Bahz] telah menceritakan kepada kami [Wuhaib] telah menceritakan kepada kami [Musa bin Uqbah] ia berkata, saya mendengar [Abu An Nadlr] dari [Busr bin Sa'id] dari [Zaid bin Tsabit] bahwa Nabi shallallahu 'alaihi wasallam memasang tenda dari tikar pada sebuah tempat di Masjid, sehingga merupakan sebuah kamar tempat beliau shalat (malam). Melihat hal itu, beberapa orang sahabat mendatangi tempat itu. Maka ia pun menyebutkan hadits yang serupa dengannya. Dan ia menambahkan di dalamnya; ""Jika (shalat malam) itu diwajibkan atas kalian, niscaya kalian tidak akan mampu melakukannya.""","و حَدَّثَنَا مُحَمَّدُ بْنُ الْمُثَنَّى حَدَّثَنَا مُحَمَّدُ بْنُ جَعْفَرٍ حَدَّثَنَا عَبْدُ اللَّهِ بْنُ سَعِيدٍ حَدَّثَنَا سَالِمٌ أَبُو النَّضْرِ مَوْلَى عُمَرَ بْنِ عُبَيْدِ اللَّهِ عَنْ بُسْرِ بْنِ سَعِيدٍ عَنْ زَيْدِ بْنِ ثَابِتٍ قَالَ
احْتَجَرَ رَسُولُ اللَّهِ صَلَّى اللَّهُ عَلَيْهِ وَسَلَّمَ حُجَيْرَةً بِخَصَفَةٍ أَوْ حَصِيرٍ فَخَرَجَ رَسُولُ اللَّهِ صَلَّى اللَّهُ عَلَيْهِ وَسَلَّمَ يُصَلِّي فِيهَا قَالَ فَتَتَبَّعَ إِلَيْهِ رِجَالٌ وَجَاءُوا يُصَلُّونَ بِصَلَاتِهِ قَالَ ثُمَّ جَاءُوا لَيْلَةً فَحَضَرُوا وَأَبْطَأَ رَسُولُ اللَّهِ صَلَّى اللَّهُ عَلَيْهِ وَسَلَّمَ عَنْهُمْ قَالَ فَلَمْ يَخْرُجْ إِلَيْهِمْ فَرَفَعُوا أَصْوَاتَهُمْ وَحَصَبُوا الْبَابَ فَخَرَجَ إِلَيْهِمْ رَسُولُ اللَّهِ صَلَّى اللَّهُ عَلَيْهِ وَسَلَّمَ مُغْضَبًا فَقَالَ لَهُمْ رَسُولُ اللَّهِ صَلَّى اللَّهُ عَلَيْهِ وَسَلَّمَ مَا زَالَ بِكُمْ صَنِيعُكُمْ حَتَّى ظَنَنْتُ أَنَّهُ سَيُكْتَبُ عَلَيْكُمْ فَعَلَيْكُمْ بِالصَّلَاةِ فِي بُيُوتِكُمْ فَإِنَّ خَيْرَ صَلَاةِ الْمَرْءِ فِي بَيْتِهِ إِلَّا الصَّلَاةَ الْمَكْتُوبَةَ
و حَدَّثَنِي مُحَمَّدُ بْنُ حَاتِمٍ حَدَّثَنَا بَهْزٌ حَدَّثَنَا وُهَيْبٌ حَدَّثَنَا مُوسَى بْنُ عُقْبَةَ قَالَ سَمِعْتُ أَبَا النَّضْرِ عَنْ بُسْرِ بْنِ سَعِيدٍ عَنْ زَيْدِ بْنِ ثَابِتٍ أَنَّ النَّبِيَّ صَلَّى اللَّهُ عَلَيْهِ وَسَلَّمَ اتَّخَذَ حُجْرَةً فِي الْمَسْجِدِ مِنْ حَصِيرٍ فَصَلَّى رَسُولُ اللَّهِ صَلَّى اللَّهُ عَلَيْهِ وَسَلَّمَ فِيهَا لَيَالِيَ حَتَّى اجْتَمَعَ إِلَيْهِ نَاسٌ فَذَكَرَ نَحْوَهُ وَزَادَ فِيهِ وَلَوْ كُتِبَ عَلَيْكُمْ مَا قُمْتُمْ بِهِ",58
1427,8,"Dan telah menceritakan kepada kami [Yahya bin Yahya] telah mengabarkan kepada kami [Abu Khaitsamah] dari [Simak] ia berkata, ia telah memberitakan kepadaku [Jabir bin Samurah] bahwasanya Rasulullah shallallahu 'alaihi wasallam berkhutbah sambil berdiri. Kemudian beliau duduk, setelah itu beliau berdiri kembali dan menyampaikan khutbah kedua. Maka barangsiapa yang memberitakan kepadamu bahwa beliau berkhutbah sambil duduk, sesungguhnya ia telah berkata dusta. Demi Allah, saya telah shalat bersama beliau lebih dari duaribu kali.""","و حَدَّثَنَا يَحْيَى بْنُ يَحْيَى أَخْبَرَنَا أَبُو خَيْثَمَةَ عَنْ سِمَاكٍ قَالَ أَنْبَأَنِي جَابِرُ بْنُ سَمُرَةَ
أَنَّ رَسُولَ اللَّهِ صَلَّى اللَّهُ عَلَيْهِ وَسَلَّمَ كَانَ يَخْطُبُ قَائِمًا ثُمَّ يَجْلِسُ ثُمَّ يَقُومُ فَيَخْطُبُ قَائِمًا فَمَنْ نَبَّأَكَ أَنَّهُ كَانَ يَخْطُبُ جَالِسًا فَقَدْ كَذَبَ فَقَدْ وَاللَّهِ صَلَّيْتُ مَعَهُ أَكْثَرَ مِنْ أَلْفَيْ صَلَاةٍ",58
1530,12,"Telah menceritakan kepada kami [Abu Bakar bin Abu Syaibah] dan [Ibnu Numair] dan [Ishaq bin Ibrahim] semuanya dari [Ibnu Uyainah] - [Ibnu Numair] berkata- telah menceritakan kepada kami [Sufyan] dari [Ibnu Abu Najih] dari [bapaknya] dari [Ubaid bin Umair] ia berkata; [Ummu Salamah] berkata; Ketika Abu Salamah meninggal dunia, saya pun berkata, ""Orang asing, meninggal pula di negeri asing. Akan kuratapi dia sepuas-puasnya sehingga menjadi buah bibir orang."" Ketika aku bersiap-siap hendak meratapinya, tiba-tiba datang seorang perempuan dari dusun menawarkan diri hendak menolongku meratap. Lalu Rasulullah shallallahu 'alaihi wasallam mendatanginya seraya bersabda: ""Apakah kamu hendak memasukkan syetan lagi ke dalam rumah ini, yang mana Allah telah mengeluarkannya dari sini?"" beliau mengulanginya hingga dua kali. Maka mendengar sabda beliau itu, akhirnya aku menahan diri dan tidak jadi meratap.","و حَدَّثَنَا أَبُو بَكْرِ بْنُ أَبِي شَيْبَةَ وَابْنُ نُمَيْرٍ وَإِسْحَقُ بْنُ إِبْرَاهِيمَ كُلُّهُمْ عَنْ ابْنِ عُيَيْنَةَ قَالَ ابْنُ نُمَيْرٍ حَدَّثَنَا سُفْيَانُ عَنْ ابْنِ أَبِي نَجِيحٍ عَنْ أَبِيهِ عَنْ عُبَيْدِ بْنِ عُمَيْرٍ قَالَ قَالَتْ أُمُّ سَلَمَةَ
لَمَّا مَاتَ أَبُو سَلَمَةَ قُلْتُ غَرِيبٌ وَفِي أَرْضِ غُرْبَةٍ لَأَبْكِيَنَّهُ بُكَاءً يُتَحَدَّثُ عَنْهُ فَكُنْتُ قَدْ تَهَيَّأْتُ لِلْبُكَاءِ عَلَيْهِ إِذْ أَقَبَلَتْ امْرَأَةٌ مِنْ الصَّعِيدِ تُرِيدُ أَنْ تُسْعِدَنِي فَاسْتَقْبَلَهَا رَسُولُ اللَّهِ صَلَّى اللَّهُ عَلَيْهِ وَسَلَّمَ وَقَالَ أَتُرِيدِينَ أَنْ تُدْخِلِي الشَّيْطَانَ بَيْتًا أَخْرَجَهُ اللَّهُ مِنْهُ مَرَّتَيْنِ فَكَفَفْتُ عَنْ الْبُكَاءِ فَلَمْ أَبْكِ",58
1599,12,"Dan telah menceritakan kepadaku [Zuhair bin Harb] telah menceritakan kepada kami [Abdurrahman bin Mahdi] telah menceritakan kepada kami [Syu'bah] dari [Muhammad bin Al Munkadir] ia berkata, saya mendengar [Mas'ud bin Al Hakam] menceritakan dari [Ali] ia berkata; Suatu ketika, kami melihat Rasulullah shallallahu 'alaihi wasallam berdiri, maka kami pun ikut berdiri. Kemudian beliau duduk dan kami pun ikut duduk kembali. Yakni (mereka berdiri) karena (di hadapan mereka lewat) jenazah. Dan telah menceritakannya kepada kami [Muhammad bin Abu Bakar Al Muqaddami] dan [Ubaidullah bin Sa'id] keduanya berkata, telah menceritakan kepada kami [Yahya Al Qaththan] dari [Syu'bah] dengan isnad ini.","و حَدَّثَنِي زُهَيْرُ بْنُ حَرْبٍ حَدَّثَنَا عَبْدُ الرَّحْمَنِ بْنُ مَهْدِيٍّ حَدَّثَنَا شُعْبَةُ عَنْ مُحَمَّدِ بْنِ الْمُنْكَدِرِ قَالَ سَمِعْتُ مَسْعُودَ بْنَ الْحَكَمِ يُحَدِّثُ عَنْ عَلِيٍّ قَالَ
رَأَيْنَا رَسُولَ اللَّهِ صَلَّى اللَّهُ عَلَيْهِ وَسَلَّمَ قَامَ فَقُمْنَا وَقَعَدَ فَقَعَدْنَا يَعْنِي فِي الْجَنَازَةِ
و حَدَّثَنَاه مُحَمَّدُ بْنُ أَبِي بَكْرٍ الْمُقَدَّمِيُّ وَعُبَيْدُ اللَّهِ بْنُ سَعِيدٍ قَالَا حَدَّثَنَا يَحْيَى وَهُوَ الْقَطَّانُ عَنْ شُعْبَةَ بِهَذَا الْإِسْنَادِ",58
1619,12,"Dan telah menceritakan kepadaku [Harun bin Sa'id Al Aili] telah menceritakan kepada kami [Abdullah bin Wahb] telah mengabarkan kepada kami [Ibnu Juraij] dari [Abdullah bin Katsir bin Muthallib] bahwa ia mendengar [Muhammad bin Qais] berkata, saya mendengar [Aisyah] menceritakan, ia berkata; ""Maukah kalian aku ceritakan sebuah hadits dari Rasulullah shallallahu 'alaihi wasallam dan juga dariku?"" Kami menjawab, ""Ya."" -dalam jalur lain- Dan telah menceritakan kepadaku [seorang] yang mendengar Hajjaj Al A'war, dan lafazh juga miliknya, ia berkata, telah menceritakan kepada kami [Hajjaj bin Muhammad] Telah menceritakan kepada kami [Ibnu Juraij] telah mengabarkan kepadaku [Abdullah] -seorang laki-laki dari Qurais- dari [Muhammad bin Qais bin Makhramah bin Al Muthallib] bahwa pada suatu hari ia berkata, ""Maukah kalian aku ceritakan (hadits) dariku dan dari ibuku?"" -maka kami pun menyangka bahwa yang ia maksud dengan ibunya adalah Ibu yang telah melahirkannya- Ia berkata; [Aisyah] berkata, ""Maukah kalian aku ceritakan hadits dariku dan dari Rasulullah shallallahu 'alaihi wasallam?"" kami menjawab, ""Ya, mau."" Aisyah berkata; Pada suatu malam ketika giliran Rasulullah shallallahu 'alaihi wasallam di rumahku, setelah beliau menanggalkan pakaiannya, meletakkan terompahnya dekat kaki dan membentangkan pinggir jubahnya di atas kasur, beliau lantas berbaring. Setelah beberapa lama kemudian dan barangkali beliau menyangkaku telah tidur, beliau mengambil baju dan terompahnya, dibukanya pintu perlahan-lahan dan kemudian ditutupnya kembali perlahan-lahan. Menyaksikan beliau seperti itu, kukenakan pula bajuku dan kututup kepalaku dengan kain, kemudian aku mengikuti beliau dari belakang hingga sampai di Baqi'. Ketika sampai di sana beliau berdiri agak lama, kemudian beliau mengangkat kedua tangannya tiga kali, sesudah itu beliau berbalik pulang. Aku pun berbalik pula mendahului beliau. Kalau beliau berjalan cepat, maka aku pun berjalan cepat-cepat. Bila beliau berlari kecil, aku pun demikian. Ketika beliau sampai, aku pun sudah sampai lebih dulu dari beliau. Kemudian aku masuk ke dalam rumah dan langsung tidur. Setelah itu, beliau masuk dan bertanya: ""Kenapa kamu wahai Aisyah? Kudengar nafasmu kembang kempis.?"" Jawabku, ""Tidak ada apa-apa wahai Rasulullah?"" Beliau berkata: ""Ceritakanlah kepadaku atau kalau tidak Allah -Yang MahaLembut dan Mengetahui- akan menceritakannya padaku."" Aku menjawab, ""Wahai Rasulullah, demi bapak dan ibuku."" Lalu kuceritakanlah kepada beliau apa yang sebenarnya terjadi. Beliau berkata, ""Kalau begitu, kamulah kiranya bayangan hitam yang saya lihat di depanku tadi?"" Saya menjawab, ""Ya, benar wahai Rasulullah."" Maka beliau pun mendorong dadaku dengan keras hingga terasa sakit bagiku. Kemudian beliau berkata, ""Apakah kamu masih curiga, Allah dan Rasul-Nya akan berbuat curang kepadamu?"" jawabku, ""Setiap apa yang dirahasiakan manusia, pasti Allah mengetahuinya pula."" Kemudian Rasulullah shallallahu 'alaihi wasallam menceritakan kenapa beliau sampai keluar. Beliau bercerita: ""Tadi Jibril datang, tapi karena ia melihat ada kamu, dia memanggilku perlahan-lahan sehingga tidak terdengar olehmu. Aku menjawab panggilannya tanpa terdengar pula olehmu. Dia tidak masuk ke rumah, karena kamu menanggalkan pakaianmu. Dan aku pun mengira bahwa kamu telah tidur, karena itu aku segan membangunkanmu khawatir engkau akan merasa kesepian. Jibril berkata padaku, 'Allah memerintahkan agar Tuan datang ke Baqi' dan memohonkan ampunan bagi para penghuninya.' Aku berkata, 'Lalu apa yang kubaca sesampai di sana wahai rasulullah? ' Jibril menjawab, 'Bacalah: AS SALAAMU 'ALA AHLID DIYAAR MINAL MUKMINIIN WAL MUSLIMIIN WA YARHAMULLAHUL MUSTAQDIMIIN MINNAA WAL MUSTA`KHIRIIN WA INNAA INSYAA`ALLAHU BIKUM LAAHIQUUN (Semoga keselamatan tercurah bagi penduduk kampung orang-orang mukmin dan muslim ini. Dan semoga Allah memberi rahmat kepada orang-orang yang telah mendahului kami dan orang-orang kemudian, dan kami insya Allah akan menyusul kalian semua).'""","و حَدَّثَنِي هَارُونُ بْنُ سَعِيدٍ الْأَيْلِيُّ حَدَّثَنَا عَبْدُ اللَّهِ بْنُ وَهْبٍ أَخْبَرَنَا ابْنُ جُرَيْجٍ عَنْ عَبْدِ اللَّهِ بْنِ كَثِيرِ بْنِ الْمُطَّلِبِ أَنَّهُ سَمِعَ مُحَمَّدَ بْنَ قَيْسٍ يَقُولُ سَمِعْتُ عَائِشَةَ تُحَدِّثُ فَقَالَتْ أَلَا أُحَدِّثُكُمْ عَنْ النَّبِيِّ صَلَّى اللَّهُ عَلَيْهِ وَسَلَّمَ وَعَنِّي قُلْنَا بَلَى ح و حَدَّثَنِي مَنْ سَمِعَ حَجَّاجًا الْأَعْوَرَ وَاللَّفْظُ لَهُ قَالَ حَدَّثَنَا حَجَّاجُ بْنُ مُحَمَّدٍ حَدَّثَنَا ابْنُ جُرَيْجٍ أَخْبَرَنِي عَبْدُ اللَّهِ رَجُلٌ مِنْ قُرَيْشٍ عَنْ مُحَمَّدِ بْنِ قَيْسِ بْنِ مَخْرَمَةَ بْنِ الْمُطَّلِبِ
أَنَّهُ قَالَ يَوْمًا أَلَا أُحَدِّثُكُمْ عَنِّي وَعَنْ أُمِّي قَالَ فَظَنَنَّا أَنَّهُ يُرِيدُ أُمَّهُ الَّتِي وَلَدَتْهُ قَالَ قَالَتْ عَائِشَةُ أَلَا أُحَدِّثُكُمْ عَنِّي وَعَنْ رَسُولِ اللَّهِ صَلَّى اللَّهُ عَلَيْهِ وَسَلَّمَ قُلْنَا بَلَى قَالَ قَالَتْ لَمَّا كَانَتْ لَيْلَتِي الَّتِي كَانَ النَّبِيُّ صَلَّى اللَّهُ عَلَيْهِ وَسَلَّمَ فِيهَا عِنْدِي انْقَلَبَ فَوَضَعَ رِدَاءَهُ وَخَلَعَ نَعْلَيْهِ فَوَضَعَهُمَا عِنْدَ رِجْلَيْهِ وَبَسَطَ طَرَفَ إِزَارِهِ عَلَى فِرَاشِهِ فَاضْطَجَعَ فَلَمْ يَلْبَثْ إِلَّا رَيْثَمَا ظَنَّ أَنْ قَدْ رَقَدْتُ فَأَخَذَ رِدَاءَهُ رُوَيْدًا وَانْتَعَلَ رُوَيْدًا وَفَتَحَ الْبَابَ فَخَرَجَ ثُمَّ أَجَافَهُ رُوَيْدًا فَجَعَلْتُ دِرْعِي فِي رَأْسِي وَاخْتَمَرْتُ وَتَقَنَّعْتُ إِزَارِي ثُمَّ انْطَلَقْتُ عَلَى إِثْرِهِ حَتَّى جَاءَ الْبَقِيعَ فَقَامَ فَأَطَالَ الْقِيَامَ ثُمَّ رَفَعَ يَدَيْهِ ثَلَاثَ مَرَّاتٍ ثُمَّ انْحَرَفَ فَانْحَرَفْتُ فَأَسْرَعَ فَأَسْرَعْتُ فَهَرْوَلَ فَهَرْوَلْتُ فَأَحْضَرَ فَأَحْضَرْتُ فَسَبَقْتُهُ فَدَخَلْتُ فَلَيْسَ إِلَّا أَنْ اضْطَجَعْتُ فَدَخَلَ فَقَالَ مَا لَكِ يَا عَائِشُ حَشْيَا رَابِيَةً قَالَتْ قُلْتُ لَا شَيْءَ قَالَ لَتُخْبِرِينِي أَوْ لَيُخْبِرَنِّي اللَّطِيفُ الْخَبِيرُ قَالَتْ قُلْتُ يَا رَسُولَ اللَّهِ بِأَبِي أَنْتَ وَأُمِّي فَأَخْبَرْتُهُ قَالَ فَأَنْتِ السَّوَادُ الَّذِي رَأَيْتُ أَمَامِي قُلْتُ نَعَمْ فَلَهَدَنِي فِي صَدْرِي لَهْدَةً أَوْجَعَتْنِي ثُمَّ قَالَ أَظَنَنْتِ أَنْ يَحِيفَ اللَّهُ عَلَيْكِ وَرَسُولُهُ قَالَتْ مَهْمَا يَكْتُمِ النَّاسُ يَعْلَمْهُ اللَّهُ نَعَمْ قَالَ فَإِنَّ جِبْرِيلَ أَتَانِي حِينَ رَأَيْتِ فَنَادَانِي فَأَخْفَاهُ مِنْكِ فَأَجَبْتُهُ فَأَخْفَيْتُهُ مِنْكِ وَلَمْ يَكُنْ يَدْخُلُ عَلَيْكِ وَقَدْ وَضَعْتِ ثِيَابَكِ وَظَنَنْتُ أَنْ قَدْ رَقَدْتِ فَكَرِهْتُ أَنْ أُوقِظَكِ وَخَشِيتُ أَنْ تَسْتَوْحِشِي فَقَالَ إِنَّ رَبَّكَ يَأْمُرُكَ أَنْ تَأْتِيَ أَهْلَ الْبَقِيعِ فَتَسْتَغْفِرَ لَهُمْ قَالَتْ قُلْتُ كَيْفَ أَقُولُ لَهُمْ يَا رَسُولَ اللَّهِ قَالَ قُولِي السَّلَامُ عَلَى أَهْلِ الدِّيَارِ مِنْ الْمُؤْمِنِينَ وَالْمُسْلِمِينَ وَيَرْحَمُ اللَّهُ الْمُسْتَقْدِمِينَ مِنَّا وَالْمُسْتَأْخِرِينَ وَإِنَّا إِنْ شَاءَ اللَّهُ بِكُمْ لَلَاحِقُونَ",58
