haditsId,kitabId,indo,arab,label
3797,37,"Telah menceritakan kepada kami [Qutaibah bin Sa'id] dan ['Utsman bin Abu Syaibah] -lafazh keduanya hampir sama-; keduanya berkata; Telah menceritakan kepada kami [Jarir] dari [Al A'masy] dari [Abu Wail] dari [Abu Mas'ud Al Anshari] ia berkata; Ada seorang laki-laki Anshar bernama Abu Syu'aib, dia mempunyai seorang pelayan tukang daging. Pada suatu hari Abu Syu'aib melihat Rasulullah shallallahu 'alaihi wasallam. Dia tahu dari wajah beliau bahwa beliau sedang lapar. Maka Syu'aib berkata kepada pelayannya; ""Kasihan! Siapkan hidangan untuk lima orang. Aku hendak mengundang Rasulullah shallallahu 'alaihi wasallam beserta empat orang lainnya."" Setelah hidangan tersedia, Nabi shallallahu 'alaihi wasallam pun tiba beserta empat orang lainnya dan seorang lagi mengikuti mereka. Tatkala sampai di pintu Nabi shallallahu 'alaihi wasallam berkata: 'Kawan ini mengikuti kami. Jika engkau izinkan dia turut makan, silakan. Jika tidak, biarkan dia kembali.' Jawab Abu Syu'aib; 'Jangan, tentu aku izinkan, ya Rasulullah! ' Dan telah menceritakannya pula kepada kami [Abu Bakr bin Abu Syaibah] dan [Ishaq bin Ibrahim] secara keseluruhan, dari [Abu Mu'awiyah]. Demikian juga telah diriwayatkan dari jalur yang lain; Dan telah menceritakannya kepada kami [Nashr bin 'Ali Al Jahdlami] dan [Abu Sa'id Al Asyaj] mereka berkata; Telah menceritakan kepada kami [Abu Usamah]; Demikian juga telah diriwayatkan dari jalur yang lain, Dan telah menceritakan kepada kami ['Ubaidullah bin Mu'adz]; Telah menceritakan kepada kami [Bapakku]; Telah menceritakan kepada kami [Syu'bah], Demikian juga telah diriwayatkan dari jalur yang lain; Dan telah menceritakan kepadaku ['Abdullah bin 'Abdurrahman Ad Darimi]; Telah menceritakan kepada kami [Muhammad bin Yusuf] dari [Sufyan] -seluruhnya-, Dari [Al A'masy] dari [Abu Wail] dari [Abu Mas'ud] dengan Hadits ini, dari Nabi shallallahu 'alaihi wasallam sebagaimana Hadits [Jarir]. [Nashr bin 'Ali] berkata dalam meriwayatkan Hadits ini. Telah menceritakan kepada kami [Abu Usamah]; Telah menceritakan kepada kami [Al A'masy]; Telah menceritakan kepada kami [Syaqiq bin Salamah]; Telah menceritakan kepada kami [Abu Mas'ud Al Anshari]; (Kemudian dia menyebutkan Haditsnya). Dan telah menceritakan kepadaku [Muhammad bin 'Amru bin Jabalah bin Abu Rawwad]; Telah menceritakan kepada kami [Abul Jawwab]; Telah menceritakan kepada kami ['Ammar] yaitu Ibnu Ruzaiq dari [Al A'masy] dari [Abu Sufyan] dari [Jabir]; Demikian juga telah diriwayatkan dari jalur yang lain; Dan telah menceritakan kepadaku [Salamah bin Syabib]; Telah menceritakan kepada kami [Al Hasan bin Al A'yan]; Telah menceritakan kepada kami [Zuhair]; Telah menceritakan kepada kami [Al A'masy] dari [Syaqiq] dari [Abu Mas'ud] dari Nabi shallallahu 'alaihi wasallam. Dan dari [Al A'masy] dari [Abu Sufyan] dari [Jabir] dengan Hadits ini.","حَدَّثَنَا قُتَيْبَةُ بْنُ سَعِيدٍ وَعُثْمَانُ بْنُ أَبِي شَيْبَةَ وَتَقَارَبَا فِي اللَّفْظِ قَالَا حَدَّثَنَا جَرِيرٌ عَنْ الْأَعْمَشِ عَنْ أَبِي وَائِلٍ عَنْ أَبِي مَسْعُودٍ الْأَنْصَارِيِّ قَالَ
كَانَ رَجُلٌ مِنْ الْأَنْصَارِ يُقَالُ لَهُ أَبُو شُعَيْبٍ وَكَانَ لَهُ غُلَامٌ لَحَّامٌ فَرَأَى رَسُولَ اللَّهِ صَلَّى اللَّهُ عَلَيْهِ وَسَلَّمَ فَعَرَفَ فِي وَجْهِهِ الْجُوعَ فَقَالَ لِغُلَامِهِ وَيْحَكَ اصْنَعْ لَنَا طَعَامًا لِخَمْسَةِ نَفَرٍ فَإِنِّي أُرِيدُ أَنْ أَدْعُوَ النَّبِيَّ صَلَّى اللَّهُ عَلَيْهِ وَسَلَّمَ خَامِسَ خَمْسَةٍ قَالَ فَصَنَعَ ثُمَّ أَتَى النَّبِيَّ صَلَّى اللَّهُ عَلَيْهِ وَسَلَّمَ فَدَعَاهُ خَامِسَ خَمْسَةٍ وَاتَّبَعَهُمْ رَجُلٌ فَلَمَّا بَلَغَ الْبَابَ قَالَ النَّبِيُّ صَلَّى اللَّهُ عَلَيْهِ وَسَلَّمَ إِنَّ هَذَا اتَّبَعَنَا فَإِنْ شِئْتَ أَنْ تَأْذَنَ لَهُ وَإِنْ شِئْتَ رَجَعَ قَالَ لَا بَلْ آذَنُ لَهُ يَا رَسُولَ اللَّهِ
و حَدَّثَنَاه أَبُو بَكْرِ بْنُ أَبِي شَيْبَةَ وَإِسْحَقُ بْنُ إِبْرَاهِيمَ جَمِيعًا عَنْ أَبِي مُعَاوِيَةَ ح و حَدَّثَنَاه نَصْرُ بْنُ عَلِيٍّ الْجَهْضَمِيُّ وَأَبُو سَعِيدٍ الْأَشَجُّ قَالَا حَدَّثَنَا أَبُو أُسَامَةَ ح و حَدَّثَنَا عُبَيْدُ اللَّهِ بْنُ مُعَاذٍ حَدَّثَنَا أَبِي حَدَّثَنَا شُعْبَةُ ح و حَدَّثَنِي عَبْدُ اللَّهِ بْنُ عَبْدِ الرَّحْمَنِ الدَّارِمِيُّ حَدَّثَنَا مُحَمَّدُ بْنُ يُوسُفَ عَنْ سُفْيَانَ كُلُّهُمْ عَنْ الْأَعْمَشِ عَنْ أَبِي وَائِلٍ عَنْ أَبِي مَسْعُودٍ بِهَذَا الْحَدِيثِ عَنْ النَّبِيِّ صَلَّى اللَّهُ عَلَيْهِ وَسَلَّمَ بِنَحْوِ حَدِيثِ جَرِيرٍ قَالَ نَصْرُ بْنُ عَلِيٍّ فِي رِوَايَتِهِ لِهَذَا الْحَدِيثِ حَدَّثَنَا أَبُو أُسَامَةَ حَدَّثَنَا الْأَعْمَشُ حَدَّثَنَا شَقِيقُ بْنُ سَلَمَةَ حَدَّثَنَا أَبُو مَسْعُودٍ الْأَنْصَارِيُّ وَسَاقَ الْحَدِيثَ و حَدَّثَنِي مُحَمَّدُ بْنُ عَمْرِو بْنِ جَبَلَةَ بْنِ أَبِي رَوَّادٍ حَدَّثَنَا أَبُو الْجَوَّابِ حَدَّثَنَا عَمَّارٌ وَهُوَ ابْنُ رُزَيْقٍ عَنْ الْأَعْمَشِ عَنْ أَبِي سُفْيَانَ عَنْ جَابِرٍ ح و حَدَّثَنِي سَلَمَةُ بْنُ شَبِيبٍ حَدَّثَنَا الْحَسَنُ بْنُ أَعْيَنَ حَدَّثَنَا زُهَيْرٌ حَدَّثَنَا الْأَعْمَشُ عَنْ شَقِيقٍ عَنْ أَبِي مَسْعُودٍ عَنْ النَّبِيِّ صَلَّى اللَّهُ عَلَيْهِ وَسَلَّمَ وَعَنْ الْأَعْمَشِ عَنْ أَبِي سُفْيَانَ عَنْ جَابِرٍ بِهَذَا الْحَدِيثِ",58
3828,37,"Dan telah menceritakan kepadaku [Hajjaj bin As Syaa'ir] dan [Ahmad bin Sa'id bin Shakhr] lafazh dari keduanya hampir mirip. Keduanya berkata; Telah menceritakan kepada kami [Abu An Nu'man], Telah menceritakan kepada kami [Tsabit] dalam riwayat Hajjaj bin Yazid Abu Zaid Al Ahwal, Telah menceritakan kepada kami ['Ashim bin Abdullah bin Al Harits] dari [Aflah] -budak- Abu Ayyub dari [Abu Ayyub] bahwa Nabi Shallallah 'Alaihi Wa Sallam singgah di rumahnya. Lalu Beliau bermalam dan tinggal di bagian bawah sementara Abu Ayyub Al Anshari berada diatas. Pada suatu malam Abu Ayyub Al Anshari terbangun, ia (Abu Ayyub Al Anshari) berkata; Kami berjalan diatas kepala Rasulullah Shallallahu 'alaihi wa Salam? Lalu dia pindah dan tidur bersama keluarganya disebelahnya. Abu Ayyub Al Anshari menyebutkan hal itu kepada Nabi Shallallahu 'alaihi wa Salam lalu Nabi shallallahu 'alaihi wasallam bersabda: ""Di bawah lebih bermanfaat bagiku."" Abu Ayyub Al Anshari berkata: Aku tidak akan tinggal di atas loteng sementara anda berada dibawahnya."" Lalu Abu Ayyub Al Anshari pindah ke bawah sementara Nabi shallallahu 'alaihi wasallam pindah ke atas. Abu Ayyub Al Anshari juga membuatkan makanan untuk Nabi Shallallahu 'alaihi wa Salam. Bila tempat makanan di kembalikan Abu Ayyub Al Anshari bertanya dimanakah tempat jari-jari Nabi shallallahu 'alaihi wasallam, lalu ia makan pada bekas jari-jari Nabi Shallallahu 'alaihi wa Salam. Pernah juga dia membuatkan makanan yang di dalamnya ada bawang putihnya. Tatkala bekas piring beliau di kembalikan, dia bertanya bekas jari-jari Nabi shallallahu 'alaihi wasallam, dikatakan padanya; 'Rasulullah Shallallahu 'alaihi wa Salam tidak makan.' Abu Ayyub Al Anshari kaget dan segera naik ke atas, dia bertanya: 'Apakah makanan itu haram? Nabi shallallahu 'alaihi wasallam bersabda: 'Tidak, aku cuman tidak menyukainya.' Abu Ayyub Al Anshari berkata; 'Sesungguhnya aku juga membenci yang anda benci. (Dan Nabi Shallallahu 'alaihi wa Salam pada waktu itu sering di datangi malaikat dan wahyu).","و حَدَّثَنِي حَجَّاجُ بْنُ الشَّاعِرِ وَأَحْمَدُ بْنُ سَعِيدِ بْنِ صَخْرٍ وَاللَّفْظُ مِنْهُمَا قَرِيبٌ قَالَا حَدَّثَنَا أَبُو النُّعْمَانِ حَدَّثَنَا ثَابِتٌ فِي رِوَايَةِ حَجَّاجِ بْنِ يَزِيدَ أَبُو زَيْدٍ الْأَحْوَلُ حَدَّثَنَا عَاصِمُ بْنُ عَبْدِ اللَّهِ بْنِ الْحَارِثِ عَنْ أَفْلَحَ مَوْلَى أَبِي أَيُّوبَ عَنْ أَبِي أَيُّوبَ
أَنَّ النَّبِيَّ صَلَّى اللَّهُ عَلَيْهِ وَسَلَّمَ نَزَلَ عَلَيْهِ فَنَزَلَ النَّبِيُّ صَلَّى اللَّهُ عَلَيْهِ وَسَلَّمَ فِي السُّفْلِ وَأَبُو أَيُّوبَ فِي الْعِلْوِ قَالَ فَانْتَبَهَ أَبُو أَيُّوبَ لَيْلَةً فَقَالَ نَمْشِي فَوْقَ رَأْسِ رَسُولِ اللَّهِ صَلَّى اللَّهُ عَلَيْهِ وَسَلَّمَ فَتَنَحَّوْا فَبَاتُوا فِي جَانِبٍ ثُمَّ قَالَ لِلنَّبِيِّ صَلَّى اللَّهُ عَلَيْهِ وَسَلَّمَ فَقَالَ النَّبِيُّ صَلَّى اللَّهُ عَلَيْهِ وَسَلَّمَ السُّفْلُ أَرْفَقُ فَقَالَ لَا أَعْلُو سَقِيفَةً أَنْتَ تَحْتَهَا فَتَحَوَّلَ النَّبِيُّ صَلَّى اللَّهُ عَلَيْهِ وَسَلَّمَ فِي الْعُلُوِّ وَأَبُو أَيُّوبَ فِي السُّفْلِ فَكَانَ يَصْنَعُ لِلنَّبِيِّ صَلَّى اللَّهُ عَلَيْهِ وَسَلَّمَ طَعَامًا فَإِذَا جِيءَ بِهِ إِلَيْهِ سَأَلَ عَنْ مَوْضِعِ أَصَابِعِهِ فَيَتَتَبَّعُ مَوْضِعَ أَصَابِعِهِ فَصَنَعَ لَهُ طَعَامًا فِيهِ ثُومٌ فَلَمَّا رُدَّ إِلَيْهِ سَأَلَ عَنْ مَوْضِعِ أَصَابِعِ النَّبِيِّ صَلَّى اللَّهُ عَلَيْهِ وَسَلَّمَ فَقِيلَ لَهُ لَمْ يَأْكُلْ فَفَزِعَ وَصَعِدَ إِلَيْهِ فَقَالَ أَحَرَامٌ هُوَ فَقَالَ النَّبِيُّ صَلَّى اللَّهُ عَلَيْهِ وَسَلَّمَ لَا وَلَكِنِّي أَكْرَهُهُ قَالَ فَإِنِّي أَكْرَهُ مَا تَكْرَهُ أَوْ مَا كَرِهْتَ قَالَ وَكَانَ النَّبِيُّ صَلَّى اللَّهُ عَلَيْهِ وَسَلَّمَ يُؤْتَى",58
3960,38,"Telah menceritakan kepadaku [Suwaid bin Sa'id]; Telah menceritakan kepadaku [Hafsh bin Maisarah] dari [Zaid bin Aslam] dari ['Atha bin Yasar] dari [Abu Sa'id Al Khudri] dari Nabi shallallahu 'alaihi wasallam beliau bersabda: ""Hindarilah olehmu duduk-duduk di pinggir jalan!"" Para sahabat bertanya; 'Ya Rasulullah bagaimana kalau kami butuh untuk duduk-duduk di situ memperbincangkan hal yang memang perlu?.' Rasulullah shallallahu 'alaihi wasallam menjawab: 'Jika memang perlu kalian duduk-duduk di situ, berikanlah hak jalanan.' Mereka bertanya; 'Apa haknya ya Rasulullah? ' beliau menjawab: 'Tundukkan pandangan, jangan mengganggu, menjawab salam (orang lewat), menganjurkan kebaikan, dan mencegah yang mungkar.' Dan telah menceritakannya kepada kami [Yahya bin Yahya]; Telah mengabarkan kepada kami ['Abdul' Aziz bin Muhammad Al Madani]; Demikian juga telah diriwayatkan dari jalur yang lain; Dan telah menceritakannya kepada kami [Muhammad bin Rafi']; Telah menceritakan kepada kami [Ibnu Abu Fudaik]; Telah mengabarkan kepada kami [Hisyam] yaitu Ibnu Sa'ad seluruhnya dari [Zaid bin Aslam] melalui sanad ini dengan Hadits yang serupa.","حَدَّثَنِي سُوَيْدُ بْنُ سَعِيدٍ حَدَّثَنِي حَفْصُ بْنُ مَيْسَرَةَ عَنْ زَيْدِ بْنِ أَسْلَمَ عَنْ عَطَاءِ بْنِ يَسَارٍ عَنْ أَبِي سَعِيدٍ الْخُدْرِيِّ
عَنْ النَّبِيِّ صَلَّى اللَّهُ عَلَيْهِ وَسَلَّمَ قَالَ إِيَّاكُمْ وَالْجُلُوسَ فِي الطُّرُقَاتِ قَالُوا يَا رَسُولَ اللَّهِ مَا لَنَا بُدٌّ مِنْ مَجَالِسِنَا نَتَحَدَّثُ فِيهَا قَالَ رَسُولُ اللَّهِ صَلَّى اللَّهُ عَلَيْهِ وَسَلَّمَ فَإِذَا أَبَيْتُمْ إِلَّا الْمَجْلِسَ فَأَعْطُوا الطَّرِيقَ حَقَّهُ قَالُوا وَمَا حَقُّهُ قَالَ غَضُّ الْبَصَرِ وَكَفُّ الْأَذَى وَرَدُّ السَّلَامِ وَالْأَمْرُ بِالْمَعْرُوفِ وَالنَّهْيُ عَنْ الْمُنْكَرِ
و حَدَّثَنَاه يَحْيَى بْنُ يَحْيَى أَخْبَرَنَا عَبْدُ الْعَزِيزِ بْنُ مُحَمَّدٍ الْمَدَنِيُّ ح و حَدَّثَنَاه مُحَمَّدُ بْنُ رَافِعٍ حَدَّثَنَا ابْنُ أَبِي فُدَيْكٍ أَخْبَرَنَا هِشَامٌ يَعْنِي ابْنَ سَعْدٍ كِلَاهُمَا عَنْ زَيْدِ بْنِ أَسْلَمَ بِهَذَا الْإِسْنَادِ مِثْلَهُ",58
4006,39,"Telah menceritakan kepadaku ['Amru bin Muhammad bin Bukair An Naqid]; Telah menceritakan kepada kami [Sufyan bin 'Uyainah]; Telah menceritakan kepada kami [Yazid bin Khushaifah] dari [Busr bin Sa'id] dia berkata; Aku mendengar [Abu Sa'id Al Khudri] berkata; ""Ketika aku duduk di suatu majelis Anshar di Madinah, tiba-tiba Abu Musa datang tergopoh-gopoh dalam keadaan takut. Lalu kami tanyai dia, ""Ada apa dengan anda?"" jawab [Abu Musa]; ""Umar (bin khaththab) memanggilku supaya aku datang menemuinya. Setelah aku tiba di muka pintu, aku memberi salam sampai tiga kali, tetapi tidak ada jawaban. Karena itu aku pulang lagi. Kemudian 'Umar menanyaiku; ""Mengapa engkau tidak datang, apa yang menghalangimu?"" jawabku; ""Aku telah mendatangi anda dan memberi salam di muka pintu rumah Anda tiga kali, tetapi tidak ada jawaban. Karena itu aku pulang saja kembali. Karena Rasulullah shallallahu 'alaihi wasallam telah bersabda: ""Apabila kamu telah minta izin (memberi salam) tiga kali tetapi tidak dijawab, maka kembalilah!"" 'Umar berkata; ""Berikan aku saksi atas keteranganmu itu. Kalau tidak aku akan menghukumimu!"" maka Ubay bin Ka'ab berkata; Hendaklah yang menjadi saksi baginya adalah orang yang paling muda. [Abu Sa'id] berkata; 'Akulah orang yang paling muda.' Ubay berkata; 'Berangkatlah bersamanya menemui Umar! ' Telah menceritakan kepada kami [Qutaibah bin Sa'id] dan [Ibnu Abu 'Umar] keduanya berkata; Telah menceritakan kepada kami [Sufyan] dari [Yazid bin Khushaifah] melalui jalur ini. Ibnu Abu 'Umar menambahkan dalam Haditsnya; 'Abu Sa'id berkata; 'Maka kemudian aku berdiri dan berangkat bersamanya menemui Umar untuk bersaksi.'","حَدَّثَنِي عَمْرُو بْنُ مُحَمَّدِ بْنِ بُكَيْرٍ النَّاقِدُ حَدَّثَنَا سُفْيَانُ بْنُ عُيَيْنَةَ حَدَّثَنَا وَاللَّهِ يَزِيدُ بْنُ خُصَيْفَةَ عَنْ بُسْرِ بْنِ سَعِيدٍ قَالَ سَمِعْتُ أَبَا سَعِيدٍ الْخُدْرِيَّ يَقُولُا
كُنْتُ جَالِسًا بِالْمَدِينَةِ فِي مَجْلِسِ الْأَنْصَارِ فَأَتَانَا أَبُو مُوسَى فَزِعًا أَوْ مَذْعُورًا قُلْنَا مَا شَأْنُكَ قَالَ إِنَّ عُمَرَ أَرْسَلَ إِلَيَّ أَنْ آتِيَهُ فَأَتَيْتُ بَابَهُ فَسَلَّمْتُ ثَلَاثًا فَلَمْ يَرُدَّ عَلَيَّ فَرَجَعْتُ فَقَالَ مَا مَنَعَكَ أَنْ تَأْتِيَنَا فَقُلْتُ إِنِّي أَتَيْتُكَ فَسَلَّمْتُ عَلَى بَابِكَ ثَلَاثًا فَلَمْ يَرُدُّوا عَلَيَّ فَرَجَعْتُ وَقَدْ قَالَ رَسُولُ اللَّهِ صَلَّى اللَّهُ عَلَيْهِ وَسَلَّمَ إِذَا اسْتَأْذَنَ أَحَدُكُمْ ثَلَاثًا فَلَمْ يُؤْذَنْ لَهُ فَلْيَرْجِعْ
فَقَالَ عُمَرُ أَقِمْ عَلَيْهِ الْبَيِّنَةَ وَإِلَّا أَوْجَعْتُكَ فَقَالَ أُبَيُّ بْنُ كَعْبٍ لَا يَقُومُ مَعَهُ إِلَّا أَصْغَرُ الْقَوْمِ قَالَ أَبُو سَعِيدٍ قُلْتُ أَنَا أَصْغَرُ الْقَوْمِ قَالَ فَاذْهَبْ بِهِ حَدَّثَنَا قُتَيْبَةُ بْنُ سَعِيدٍ وَابْنُ أَبِي عُمَرَ قَالَا حَدَّثَنَا سُفْيَانُ عَنْ يَزِيدَ بْنِ خُصَيْفَةَ بِهَذَا الْإِسْنَادِ وَزَادَ ابْنُ أَبِي عُمَرَ فِي حَدِيثِهِ قَالَ أَبُو سَعِيدٍ فَقُمْتُ مَعَهُ فَذَهَبْتُ إِلَى عُمَرَ فَشَهِدْتُ",58
4010,39,"Telah menceritakan kepada kami [Husain bin Huraits Abu 'Ammar]; Telah menceritakan kepada kami [Al Fadhl bin Musa]; Telah mengabarkan kepada kami [Thalhah bin Yahya] dari [Abu Burdah] dari [Abu Musa Al Asy'ari] dia berkata; Abu datang menemui 'Umar bin Khaththab. Lalu dia memberi salam, ""Assalamu'alaikum, saya 'Abdullah bin Qais (nama Abu Musa)."" Tetapi tidak ada yang menjawab salamnya. Kemudian diulangnya memberi salam sampai tiga kali, tetapi tetap tidak ada yang menyahut. Karena itu dia pulang saja kembali. Kata 'Umar sesudah itu; ""panggil, panggil dia ke mari."" Setelah Abu Musa datang, 'Umar berkata, ""Wahai Abu Musa, kenapa anda pulang? Engkau kan maklum, bahwa kami sedang sibuk."" Kata Abu Musa; ""Aku mendengar Rasulullah shallallahu 'alaihi wasallam bersabda: ""Minta izin (memberi salam) hanya tiga kali. Jika diizinkan silakan masuk. Jika tidak, maka kembalilah."" Kata 'Umar; ""Engkau harus mandatangkan saksi ke hadapanku mengenai hadits itu. Jika tidak, aku akan menghukum kamu."" Lalu pergilah Abu Musa. Kata 'Umar, ""Jika dia mendapatkan saksi, kalian akan menemuinya sore nanti dekat mimbar. Jika tidak, kalian tidak akan menemuinya."" Tatkala hari telah petang, mereka mendatangi 'Umar, kata 'Umar; ""Bagaimana, hai Abu Musa? Apakah kamu sudah mendapatkan saksi?"" kata Abu Musa, ""Sudah! Yaitu Ubay bin Ka'ab!"" kata 'Umar; ""Boleh! Dia adalah saksi yang adil. Hai, Abu Thufail! Bagaimana pendapatmu (kesaksianmu) mengenai masalah ini?"". Jawab [Ubay bin Ka'ab]; ""Memang, aku telah mendengar pula Rasulullah shallallahu 'alaihi wasallam bersabda seperti yang dikatakan Abu Musa. Karena itu janganlah Anda sekali-kali menjatuhkan hukuman terhadap para sahabat Rasulullah!"" jawab 'Umar; ""Subhanallah! Sesungguhnya jika aku mendengar sesuatu yang baru, aku lebih suka menyelidiki kebenarannya."" Dan telah menceritakannya kepada kami ['Abdullah bin 'Umar bin Muhammad bin Aban]; Telah menceritakan kepada kami ['Ali bin Hasyim] dari [Thalhah bin Yahya] melalui jalur ini. Namun dia berkata di dalam Haditsnya; 'Wahai Abu Mundzir, apakah kamu mendengar Hadits ini dari Rasulullah shallallahu 'alaihi wasallam? Dia menjawab; 'Ya.' Oleh karena itu anda wahai Ibnu Khattab jangan menjatuhkan hukuman pada para sahabat Rasulullah shallallahu 'alaihi wasallam.' (dia tidak menyebutkan perkataan Umar; 'Subhaanallah dan seterusnya.'","حَدَّثَنَا حُسَيْنُ بْنُ حُرَيْثٍ أَبُو عَمَّارٍ حَدَّثَنَا الْفَضْلُ بْنُ مُوسَى أَخْبَرَنَا طَلْحَةُ بْنُ يَحْيَى عَنْ أَبِي بُرْدَةَ عَنْ أَبِي مُوسَى الْأَشْعَرِيِّ قَالَ
جَاءَ أَبُو مُوسَى إِلَى عُمَرَ بْنِ الْخَطَّابِ فَقَالَ السَّلَامُ عَلَيْكُمْ هَذَا عَبْدُ اللَّهِ بْنُ قَيْسٍ فَلَمْ يَأْذَنْ لَهُ فَقَالَ السَّلَامُ عَلَيْكُمْ هَذَا أَبُو مُوسَى السَّلَامُ عَلَيْكُمْ هَذَا الْأَشْعَرِيُّ ثُمَّ انْصَرَفَ فَقَالَ رُدُّوا عَلَيَّ رُدُّوا عَلَيَّ فَجَاءَ فَقَالَ يَا أَبَا مُوسَى مَا رَدَّكَ كُنَّا فِي شُغْلٍ قَالَ سَمِعْتُ رَسُولَ اللَّهِ صَلَّى اللَّهُ عَلَيْهِ وَسَلَّمَ يَقُولُ الِاسْتِئْذَانُ ثَلَاثٌ فَإِنْ أُذِنَ لَكَ وَإِلَّا فَارْجِعْ
قَالَ لَتَأْتِيَنِّي عَلَى هَذَا بِبَيِّنَةٍ وَإِلَّا فَعَلْتُ وَفَعَلْتُ فَذَهَبَ أَبُو مُوسَى قَالَ عُمَرُ إِنْ وَجَدَ بَيِّنَةً تَجِدُوهُ عِنْدَ الْمِنْبَرِ عَشِيَّةً وَإِنْ لَمْ يَجِدْ بَيِّنَةً فَلَمْ تَجِدُوهُ فَلَمَّا أَنْ جَاءَ بِالْعَشِيِّ وَجَدُوهُ قَالَ يَا أَبَا مُوسَى مَا تَقُولُ أَقَدْ وَجَدْتَ قَالَ نَعَمْ أُبَيَّ بْنَ كَعْبٍ قَالَ عَدْلٌ قَالَ يَا أَبَا الطُّفَيْلِ مَا يَقُولُ هَذَا قَالَ سَمِعْتُ رَسُولَ اللَّهِ صَلَّى اللَّهُ عَلَيْهِ وَسَلَّمَ يَقُولُ ذَلِكَ يَا ابْنَ الْخَطَّابِ فَلَا تَكُونَنَّ عَذَابًا عَلَى أَصْحَابِ رَسُولِ اللَّهِ صَلَّى اللَّهُ عَلَيْهِ وَسَلَّمَ قَالَ سُبْحَانَ اللَّهِ إِنَّمَا سَمِعْتُ شَيْئًا فَأَحْبَبْتُ أَنْ أَتَثَبَّتَ
و حَدَّثَنَاه عَبْدُ اللَّهِ بْنُ عُمَرَ بْنِ مُحَمَّدِ بْنِ أَبَانَ حَدَّثَنَا عَلِيُّ بْنُ هَاشِمٍ عَنْ طَلْحَةَ بْنِ يَحْيَى بِهَذَا الْإِسْنَادِ غَيْرَ أَنَّهُ قَالَ فَقَالَ يَا أَبَا الْمُنْذِرِ آنْتَ سَمِعْتَ هَذَا مِنْ رَسُولِ اللَّهِ صَلَّى اللَّهُ عَلَيْهِ وَسَلَّمَ فَقَالَ نَعَمْ فَلَا تَكُنْ يَا ابْنَ الْخَطَّابِ عَذَابًا عَلَى أَصْحَابِ رَسُولِ اللَّهِ صَلَّى اللَّهُ عَلَيْهِ وَسَلَّمَ وَلَمْ يَذْكُرْ مِنْ قَوْلِ عُمَرَ سُبْحَانَ اللَّهِ وَمَا بَعْدَهُ",58
4011,39,"Telah menceritakan kepada kami [Muhammad bin 'Abdillah bin Numair]; Telah menceritakan kepada kami ['Abdullah bin Idris] dari [Syu'bah] dari [Muhammad bin Al Munkadir] dari [Jabir bin 'Abdullah] dia berkata; ""Aku datang ke rumah Nabi shallallahu 'alaihi wasallam lalu kupanggil beliau. Rasulullah menyahut sambil bertanya, ""siapa itu?"" jawabku; ""Saya!"" lalu beliau keluar sambil berkata: ""Saya...! Saya...! ","حَدَّثَنَا مُحَمَّدُ بْنُ عَبْدِ اللَّهِ بْنِ نُمَيْرٍ حَدَّثَنَا عَبْدُ اللَّهِ بْنُ إِدْرِيسَ عَنْ شُعْبَةَ عَنْ مُحَمَّدِ بْنِ الْمُنْكَدِرِ عَنْ جَابِرِ بْنِ عَبْدِ اللَّهِ قَالَ
أَتَيْتُ النَّبِيَّ صَلَّى اللَّهُ عَلَيْهِ وَسَلَّمَ فَدَعَوْتُ فَقَالَ النَّبِيُّ صَلَّى اللَّهُ عَلَيْهِ وَسَلَّمَ مَنْ هَذَا قُلْتُ أَنَا قَالَ فَخَرَجَ وَهُوَ يَقُولُ أَنَا أَنَا",58
