haditsId,kitabId,indo,arab,label
850,6,"Telah menceritakan kepada kami [Muhammad bin al-Mutsanna] telah menceritakan kepada kami [Yahya bin Sa'id] dari [Hisyam] dia berkata, telah menceritakan kepadaku [Ibnu Abi Katsir] dari [Abu Salamah] dari [Mu'aiqib] bahwasanya mereka bertanya kepada Nabi shallallahu'alaihiwasallam tentang membersihkan tempat sujud dalam shalat, maka beliau bersabda, ""Cukup sekali saja."" Dan telah menceritakannya kepadaku [Ubaidullah bin Umar al-Qawariri] telah menceritakan kepada kami [Khalid, yaitu Ibnu al-Harits] telah menceritakan kepada kami [Hisyam] dengan isnad ini, dan dia berkata di dalamnya, telah menceritakan kepadaku [Mu'aiqib] --Lewat jalur periwayatan lain--.","حَدَّثَنَا مُحَمَّدُ بْنُ الْمُثَنَّى حَدَّثَنَا يَحْيَى بْنُ سَعِيدٍ عَنْ هِشَامٍ قَالَ حَدَّثَنِي ابْنُ أَبِي كَثِيرٍ عَنْ أَبِي سَلَمَةَ عَنْ مُعَيْقِيبٍ
أَنَّهُمْ سَأَلُوا النَّبِيَّ صَلَّى اللَّهُ عَلَيْهِ وَسَلَّمَ عَنْ الْمَسْحِ فِي الصَّلَاةِ فَقَالَ وَاحِدَةً
و حَدَّثَنِيهِ عُبَيْدُ اللَّهِ بْنُ عُمَرَ الْقَوَارِيرِيُّ حَدَّثَنَا خَالِدٌ يَعْنِي ابْنَ الْحَارِثِ حَدَّثَنَا هِشَامٌ بِهَذَا الْإِسْنَادِ وَقَالَ فِيهِ حَدَّثَنِي مُعَيْقِيبٌ ح",63
1642,13,"Telah menceritakan kepada kami [Muhammad bin Rafi'] Telah menceritakan kepada kami [Abdurrazaq] dari [Ma'mar] dari [Isma'il bin Umayyah] ia berkata, telah mengabarkan kepadaku [Iyadl bin Abdullah bin Sa'd bin Abu Sarh] bahwa ia mendengar [Sa'id Al Khudri] berkata; Kami mengeluarkan zakat Fithrah pada masa Rasulullah shallallahu 'alaihi wasallam yakni dari setiap anak kecil dan besar, merdeka atau hamba sahaya, berupa tiga bahan makanan pokok yaitu, satu sha' kurma, atau satu sha' keju atau satu sha' gandum. Kami senantiasa membayarnya seperti itu hingga pada masa pemerintahan Mu'awiyah. Menurutnya, bahwa dua Mud gandum Syam adalah setara dengan satu sha' kurma. Abu Sa'id Al Khudri berkata, ""Adapun saya, maka saya tetap saja membayarnya seperti biasanya.""","حَدَّثَنَا مُحَمَّدُ بْنُ رَافِعٍ حَدَّثَنَا عَبْدُ الرَّزَّاقِ عَنْ مَعْمَرٍ عَنْ إِسْمَعِيلَ بْنِ أُمَيَّةَ قَالَ أَخْبَرَنِي عِيَاضُ بْنُ عَبْدِ اللَّهِ بْنِ سَعْدِ بْنِ أَبِي سَرْحٍ أَنَّهُ سَمِعَ أَبَا سَعِيدٍ الْخُدْرِيَّ يَقُولُا
كُنَّا نُخْرِجُ زَكَاةَ الْفِطْرِ وَرَسُولُ اللَّهِ صَلَّى اللَّهُ عَلَيْهِ وَسَلَّمَ فِينَا عَنْ كُلِّ صَغِيرٍ وَكَبِيرٍ حُرٍّ وَمَمْلُوكٍ مِنْ ثَلَاثَةِ أَصْنَافٍ صَاعًا مِنْ تَمْرٍ صَاعًا مِنْ أَقِطٍ صَاعًا مِنْ شَعِيرٍ
فَلَمْ نَزَلْ نُخْرِجُهُ كَذَلِكَ حَتَّى كَانَ مُعَاوِيَةُ فَرَأَى أَنَّ مُدَّيْنِ مِنْ بُرٍّ تَعْدِلُ صَاعًا مِنْ تَمْرٍ قَالَ أَبُو سَعِيدٍ فَأَمَّا أَنَا فَلَا أَزَالُ أُخْرِجُهُ كَذَلِكَ",63
1870,14,"Telah menceritakan kepada kami [Yahya bin Yahya] dan [Abu Bakar bin Abu Syaibah] dan [Zuhair bin Harb] dan [Ibnu Numair] semuanya dari [Ibnu Uyainah] - [Yahya] berkata- telah mengabarkan kepada kami [Sufyan bin Uyainah] dari [Az Zuhri] dari [Humaid bin Abdurrahman] dari [Abu Hurairah] radliallahu 'anhu, ia berkata; Seorang laki-laki datang menghadap Nabi shallallahu 'alaihi wasallam dan berkata, ""Celaka diriku wahai Rasulullah."" Beliau bertanya: ""Apa yang telah mencelakakanmu?"" Laki-laki itu menjawab, ""Saya telah menggauli isteriku di siang hari pada bulan Ramadlan."" Beliau bertanya: ""Sanggupkah kamu untuk memerdekakan budak?"" Ia menjawab, ""Tidak."" Beliau bertanya lagi: ""Sanggupkan kamu berpuasa dua bulan berturut-turut?"" ""Tidak."" jawabnya, Beliau bertanya lagi: ""Sanggupkah kamu memberi makan kepada enam puluh orang miskin?"" Ia menjawab, ""Tidak."" Abu Hurairah berkata; Kemudian laki-laki itu pun duduk, sementara Nabi shallallahu 'alaihi wasallam diberi satu keranjang berisi kurma. Maka beliau pun bersabda: ""Bersedekahlah dengan kurma ini."" Laki-laki itu pun berkata, ""Adakah orang yang lebih fakir dari kami. Karena tidak ada penduduk di sekitar sini yang lebih membutuhkannya daripada kami."" Mendengar ucapan itu, Nabi shallallahu 'alaihi wasallam tertawa hingga gigi taringnya terlihat. Akhirnya beliau bersabda: ""Pulanglah dan berilah makan keluargamu dengannya."" Telah menceritakan kepada kami [Ishaq bin Ibrahim] telah mengabarkan kepada kami [Jarir] dari [Manshur] dari [Muhammad bin Muslim Az Zuhri] dengan isnad ini sebagaimana riwayat Ibnu Uyainah. Ia mengatakan; ""BI'ARAQ FIIHI TAMR (keranjang/takaran berisi kurma)."" Namun ia tidak menyebutkan ungkapan; ""Maka Nabi shallallahu 'alaihi wasallam pun tertawa hingga gigi taringnya terlihat.""","حَدَّثَنَا يَحْيَى بْنُ يَحْيَى وَأَبُو بَكْرِ بْنُ أَبِي شَيْبَةَ وَزُهَيْرُ بْنُ حَرْبٍ وَابْنُ نُمَيْرٍ كُلُّهُمْ عَنْ ابْنِ عُيَيْنَةَ قَالَ يَحْيَى أَخْبَرَنَا سُفْيَانُ بْنُ عُيَيْنَةَ عَنْ الزُّهْرِيِّ عَنْ حُمَيْدِ بْنِ عَبْدِ الرَّحْمَنِ عَنْ أَبِي هُرَيْرَةَ رَضِيَ اللَّهُ عَنْهُ قَالَ
جَاءَ رَجُلٌ إِلَى النَّبِيِّ صَلَّى اللَّهُ عَلَيْهِ وَسَلَّمَ فَقَالَ هَلَكْتُ يَا رَسُولَ اللَّهِ قَالَ وَمَا أَهْلَكَكَ قَالَ وَقَعْتُ عَلَى امْرَأَتِي فِي رَمَضَانَ قَالَ هَلْ تَجِدُ مَا تُعْتِقُ رَقَبَةً قَالَ لَا قَالَ فَهَلْ تَسْتَطِيعُ أَنْ تَصُومَ شَهْرَيْنِ مُتَتَابِعَيْنِ قَالَ لَا قَالَ فَهَلْ تَجِدُ مَا تُطْعِمُ سِتِّينَ مِسْكِينًا قَالَ لَا قَالَ ثُمَّ جَلَسَ فَأُتِيَ النَّبِيُّ صَلَّى اللَّهُ عَلَيْهِ وَسَلَّمَ بِعَرَقٍ فِيهِ تَمْرٌ فَقَالَ تَصَدَّقْ بِهَذَا قَالَ أَفْقَرَ مِنَّا فَمَا بَيْنَ لَابَتَيْهَا أَهْلُ بَيْتٍ أَحْوَجُ إِلَيْهِ مِنَّا فَضَحِكَ النَّبِيُّ صَلَّى اللَّهُ عَلَيْهِ وَسَلَّمَ حَتَّى بَدَتْ أَنْيَابُهُ ثُمَّ قَالَ اذْهَبْ فَأَطْعِمْهُ أَهْلَكَ
حَدَّثَنَا إِسْحَقُ بْنُ إِبْرَاهِيمَ أَخْبَرَنَا جَرِيرٌ عَنْ مَنْصُورٍ عَنْ مُحَمَّدِ بْنِ مُسْلِمٍ الزُّهْرِيِّ بِهَذَا الْإِسْنَادِ مِثْلَ رِوَايَةِ ابْنِ عُيَيْنَةَ وَقَالَ بِعَرَقٍ فِيهِ تَمْرٌ وَهُوَ الزِّنْبِيلُ وَلَمْ يَذْكُرْ فَضَحِكَ النَّبِيُّ صَلَّى اللَّهُ عَلَيْهِ وَسَلَّمَ حَتَّى بَدَتْ أَنْيَابُهُ",63
1931,14,"Telah menceritakan kepada kami [Qutaibah bin Sa'id] telah menceritakan kepada kami [Bakr bin Manshur] dari [Amru bin Harits] dari [Bukair] dari [Yazid] Maula Salamah, dari [Salamah bin Al Akwa'] ia berkata; Ketika turun ayat; ""…dan wajib bagi orang-orang yang berat menjalankannya (jika mereka tidak berpuasa) membayar fidyah, (yaitu): memberi makan seorang miskin…"". (QS. Albaqarah 184), banyak orang yang menginginkan untuk tetap makan (tidak berpuasa) dan hanya membayar fidyah, sampai turun ayat setelahnya dan iapun saya me-nasakh-nya.","حَدَّثَنَا قُتَيْبَةُ بْنُ سَعِيدٍ حَدَّثَنَا بَكْرٌ يَعْنِي ابْنَ مُضَرَ عَنْ عَمْرِو بْنِ الْحَارِثِ عَنْ بُكَيْرٍ عَنْ يَزِيدَ مَوْلَى سَلَمَةَ عَنْ سَلَمَةَ بْنِ الْأَكْوَعِ رَضِيَ اللَّهُ عَنْهُ قَالَ
لَمَّا نَزَلَتْ هَذِهِ الْآيَةُ
{ وَعَلَى الَّذِينَ يُطِيقُونَهُ فِدْيَةٌ طَعَامُ مِسْكِينٍ }
كَانَ مَنْ أَرَادَ أَنْ يُفْطِرَ وَيَفْتَدِيَ حَتَّى نَزَلَتْ الْآيَةُ الَّتِي بَعْدَهَا فَنَسَخَتْهَا",63
1939,14,"Dan telah menceritakan kepadaku [Ali bin Hujr As Sa'di] telah menceritakan kepada kami [Ali bin Mushir Abul Hasan] dari [Abdullah bin 'Atha`] dari [Abdullah bin Buraidah] dari [bapaknya] radliallahu 'anhu, ia berkata; Ketika saya sedang duduk di sisi Rasulullah shallallahu 'alaihi wasallam, tiba-tiba datanglah seorang wanita dan berkata, ""Aku pernah memberikan seorang budak wanita kepada ibuku, dan kini ibuku telah meninggal. Bagaimana dengan hal itu?"" beliau menjawab, ""Kamu telah mendapatkan pahala atas pemberianmu itu, dan sekarang pemberianmu itu telah kembali kepadamu sebagai pusaka."" Wanita itu bertanya lagi, ""Wahai Rasulullah, Ibuku punya hutang puasa satu bulan, bolehkah saya membayar puasanya?"" beliau menjawab: ""Ya, bayarlah puasanya itu."" wanita itu berkata lagi, ""Ibuku juga belum menunaikan haji, bolehkah aku yang menghajikannya?"" beliau menjawab: ""Ya, hajikanlah ia."" Dan Telah meceritakannya kepada kami [Abu Bakr bin Abu Syaibah] telah menceritakan kepada kami [Abdullah bin Numair] dari [Abdullah bin 'Atha`] dari [Abdullah bin Buraidah] dari [bapaknya] radliallahu 'anhu, ia berkata; Saya pernah duduk di sisi Rasulullah shallallahu 'alaihi wasallam. yakni serupa dengan haditsnya Ibnu Mushir, hanyanya saja ia mengatakan; ""Puasa selama dua bulan."" Dan Telah menceritakan kepada kami [Abdu bin Humaid] telah mengabarkan kepada kami [Abdurrazaq] telah mengabarkan kepada kami [Ats Tsauri] dari [Abdullah bin Atha`] dari [Ibnu Buraidah] dari [bapaknya] radliallahu 'anhu ia berkata; Seorang wanita mendatangi Nabi shallallahu 'alaihi wasallam. Maka ia pun menyebutkan hadits semisalnya. Dan ia juga mengatakan; ""Puasa selama satu bulan."" Dan telah meceritakannya kepadaku [Ishaq bin Manshur] telah mengabarkan kepada kami [Ubaidullah bin Musa] dari [Sufyan] dengan isnad ini, dan ia mengatakan; ""(Hutang) Puasa selama dua bulan."" Dan telah menceritakan kepadaku [Ibnu Abu Khalaf] Telah menceritakan kepada kami [Ishaq bin Yusuf] telah menceritakan kepada kami [Abdul Malik bin Abu Sulaiman] dari [Abdullah bin Atha` Al Makki] dari [Sulaiman bin Buraidah] dari [bapaknya] radliallahu 'anhu, ia berkata; Seorang wanita mendatangi Nabi shallallahu 'alaihi wasallam, yakni serupa dengan hadits mereka, dan ia juga mengatakan; ""Puasa satu bulan.""","و حَدَّثَنِي عَلِيُّ بْنُ حُجْرٍ السَّعْدِيُّ حَدَّثَنَا عَلِيُّ بْنُ مُسْهِرٍ أَبُو الْحَسَنِ عَنْ عَبْدِ اللَّهِ بْنِ عَطَاءٍ عَنْ عَبْدِ اللَّهِ بْنِ بُرَيْدَةَ عَنْ أَبِيهِ رَضِيَ اللَّهُ عَنْهُ قَالَ
بَيْنَا أَنَا جَالِسٌ عِنْدَ رَسُولِ اللَّهِ صَلَّى اللَّهُ عَلَيْهِ وَسَلَّمَ إِذْ أَتَتْهُ امْرَأَةٌ فَقَالَتْ إِنِّي تَصَدَّقْتُ عَلَى أُمِّي بِجَارِيَةٍ وَإِنَّهَا مَاتَتْ قَالَ فَقَالَ وَجَبَ أَجْرُكِ وَرَدَّهَا عَلَيْكِ الْمِيرَاثُ قَالَتْ يَا رَسُولَ اللَّهِ إِنَّهُ كَانَ عَلَيْهَا صَوْمُ شَهْرٍ أَفَأَصُومُ عَنْهَا قَالَ صُومِي عَنْهَا قَالَتْ إِنَّهَا لَمْ تَحُجَّ قَطُّ أَفَأَحُجُّ عَنْهَا قَالَ حُجِّي عَنْهَا
و حَدَّثَنَاه أَبُو بَكْرِ بْنُ أَبِي شَيْبَةَ حَدَّثَنَا عَبْدُ اللَّهِ بْنُ نُمَيْرٍ عَنْ عَبْدِ اللَّهِ بْنِ عَطَاءٍ عَنْ عَبْدِ اللَّهِ بْنِ بُرَيْدَةَ عَنْ أَبِيهِ رَضِيَ اللَّهُ عَنْهُ قَالَ كُنْتُ جَالِسًا عِنْدَ النَّبِيِّ صَلَّى اللَّهُ عَلَيْهِ وَسَلَّمَ بِمِثْلِ حَدِيثِ ابْنِ مُسْهِرٍ غَيْرَ أَنَّهُ قَالَ صَوْمُ شَهْرَيْنِ و حَدَّثَنَا عَبْدُ بْنُ حُمَيْدٍ أَخْبَرَنَا عَبْدُ الرَّزَّاقِ أَخْبَرَنَا الثَّوْرِيُّ عَنْ عَبْدِ اللَّهِ بْنِ عَطَاءٍ عَنْ ابْنِ بُرَيْدَةَ عَنْ أَبِيهِ رَضِيَ اللَّهُ عَنْهُ قَالَ جَاءَتْ امْرَأَةٌ إِلَى النَّبِيِّ صَلَّى اللَّهُ عَلَيْهِ وَسَلَّمَ فَذَكَرَ بِمِثْلِهِ وَقَالَ صَوْمُ شَهْرٍ و حَدَّثَنِيهِ إِسْحَقُ بْنُ مَنْصُورٍ أَخْبَرَنَا عُبَيْدُ اللَّهِ بْنُ مُوسَى عَنْ سُفْيَانَ بِهَذَا الْإِسْنَادِ وَقَالَ صَوْمُ شَهْرَيْنِ و حَدَّثَنِي ابْنُ أَبِي خَلَفٍ حَدَّثَنَا إِسْحَقُ بْنُ يُوسُفَ حَدَّثَنَا عَبْدُ الْمَلِكِ بْنُ أَبِي سُلَيْمَانَ عَنْ عَبْدِ اللَّهِ بْنِ عَطَاءٍ الْمَكِّيِّ عَنْ سُلَيْمَانَ بْنِ بُرَيْدَةَ عَنْ أَبِيهِ رَضِيَ اللَّهُ عَنْهُ قَالَ أَتَتْ امْرَأَةٌ إِلَى النَّبِيِّ صَلَّى اللَّهُ عَلَيْهِ وَسَلَّمَ بِمِثْلِ حَدِيثِهِمْ وَقَالَ صَوْمُ شَهْرٍ",63
3318,33,"Dan telah menceritakan kepadaku [Abu At Thahir] dan [Harmalah] keduanya; telah mengabarkan kepada kami [Ibnu Wahb] telah mengabarkan kepadaku [Yunus] dari [Ibnu Syihab] dari [Anas bin Malik] dia berkata, ""Ketika kaum muhajirin tiba dari Makkah ke Madinah, mereka datang dengan tidak membawa sesuatupun, sedangkan kaum Anshar mempunyai tanah dan kebun kurma yang luas. Maka orang-orang Anshar membagikan sebagiannya kepada Sahabat Muhajirin dengan syarat mereka memberikan setengah dari hasil penennya setiap tahun. Maka orang-orang Muhajirin pun membayar kepada orang-orang Anshar dengan kerja dan makanan."" Ibu Anas bin Malik atau yang biasa dipanggil Ummu Sulaim, dan Ibu Abdullah bin Abu Thalhah - saudara seibu Anas-, Ibu Anas memberikan kebun kurma miliknya kepada Rasulullah shallallahu 'alaihi wasallam, lalu beliau memberikannya kepada Ummu Aiman, budak Ibu Usamah bin Zaid."" Ibnu Syihab berkata, ""Lalu Anas bin Malik mengabarkan kepadaku, bahwa ketika Rasulullah shallallahu 'alaihi wasallam kembali dari perang Khaibar beliau pulang ke Madinah, lalu kaum muhajirin mengembalikan kebun kurma pemberian kaum anshar kepada mereka."" Ibnu Syihab berkata, ""Rasulullah shallallahu 'alaihi wasallam juga mengembalikan kebun kurmanya kepada ibuku, dan beliau shallallahu 'alaihi wasallam juga memberikan bagian dari kebun kurmanya kepada Ummu Aiman."" Ibnu Syihab berkata, ""Yang menjadi permasalahan Ummu Aiman ialah, bahwa Ibu Usamah bin Zaid dulunya seorang pelayan milik Abdullah bin Abdul Muththallib yang berasal dari Habasyah. Ketika Aminah (Ibu Rasul) melahirkan Rasulullah shallallahu 'alaihi wasallam, setelah ditinggal wafat oleh ayahnya, maka Ummu Aimanlah yang merawat beliau hingga beliau shallallahu 'alaihi wasallam dewasa, kemudian ia dimerdekakan dan dinikahi oleh Zaid bin Haritsah. Ummu Aiman meninggal dunia lima tahun setelah meninggalnya Rasulullah shallallahu 'alaihi wasallam.""","و حَدَّثَنِي أَبُو الطَّاهِرِ وَحَرْمَلَةُ قَالَا أَخْبَرَنَا ابْنُ وَهْبٍ أَخْبَرَنِي يُونُسُ عَنْ ابْنِ شِهَابٍ عَنْ أَنَسِ بْنِ مَالِكٍ قَالَ
لَمَّا قَدِمَ الْمُهَاجِرُونَ مِنْ مَكَّةَ الْمَدِينَةَ قَدِمُوا وَلَيْسَ بِأَيْدِيهِمْ شَيْءٌ وَكَانَ الْأَنْصَارُ أَهْلَ الْأَرْضِ وَالْعَقَارِ فَقَاسَمَهُمْ الْأَنْصَارُ عَلَى أَنْ أَعْطَوْهُمْ أَنْصَافَ ثِمَارِ أَمْوَالِهِمْ كُلَّ عَامٍ وَيَكْفُونَهُمْ الْعَمَلَ وَالْمَئُونَةَ وَكَانَتْ أُمُّ أَنَسِ بْنِ مَالِكٍ وَهِيَ تُدْعَى أُمَّ سُلَيْمٍ وَكَانَتْ أُمُّ عَبْدِ اللَّهِ بْنِ أَبِي طَلْحَةَ كَانَ أَخًا لِأَنَسٍ لِأُمِّهِ وَكَانَتْ أَعْطَتْ أُمُّ أَنَسٍ رَسُولَ اللَّهِ صَلَّى اللَّهُ عَلَيْهِ وَسَلَّمَ عِذَاقًا لَهَا فَأَعْطَاهَا رَسُولُ اللَّهِ صَلَّى اللَّهُ عَلَيْهِ وَسَلَّمَ أُمَّ أَيْمَنَ مَوْلَاتَهُ أُمَّ أُسَامَةَ بْنِ زَيْدٍ قَالَ ابْنُ شِهَابٍ فَأَخْبَرَنِي أَنَسُ بْنُ مَالِكٍ أَنَّ رَسُولَ اللَّهِ صَلَّى اللَّهُ عَلَيْهِ وَسَلَّمَ لَمَّا فَرَغَ مِنْ قِتَالِ أَهْلِ خَيْبَرَ وَانْصَرَفَ إِلَى الْمَدِينَةِ رَدَّ الْمُهَاجِرُونَ إِلَى الْأَنْصَارِ مَنَائِحَهُمْ الَّتِي كَانُوا مَنَحُوهُمْ مِنْ ثِمَارِهِمْ قَالَ فَرَدَّ رَسُولُ اللَّهِ صَلَّى اللَّهُ عَلَيْهِ وَسَلَّمَ إِلَى أُمِّي عِذَاقَهَا وَأَعْطَى رَسُولُ اللَّهِ صَلَّى اللَّهُ عَلَيْهِ وَسَلَّمَ أُمَّ أَيْمَنَ مَكَانَهُنَّ مِنْ حَائِطِهِ
قَالَ ابْنُ شِهَابٍ وَكَانَ مِنْ شَأْنِ أُمِّ أَيْمَنَ أُمِّ أُسَامَةَ بْنِ زَيْدٍ أَنَّهَا كَانَتْ وَصِيفَةً لِعَبْدِ اللَّهِ بْنِ عَبْدِ الْمُطَّلِبِ وَكَانَتْ مِنْ الْحَبَشَةِ فَلَمَّا وَلَدَتْ آمِنَةُ رَسُولَ اللَّهِ صَلَّى اللَّهُ عَلَيْهِ وَسَلَّمَ بَعْدَ مَا تُوُفِّيَ أَبُوهُ فَكَانَتْ أُمُّ أَيْمَنَ تَحْضُنُهُ حَتَّى كَبِرَ رَسُولُ اللَّهِ صَلَّى اللَّهُ عَلَيْهِ وَسَلَّمَ فَأَعْتَقَهَا ثُمَّ أَنْكَحَهَا زَيْدَ بْنَ حَارِثَةَ ثُمَّ تُوُفِّيَتْ بَعْدَ مَا تُوُفِّيَ رَسُولُ اللَّهِ صَلَّى اللَّهُ عَلَيْهِ وَسَلَّمَ بِخَمْسَةِ أَشْهُرٍ",63
5156,54,"Telah menceritakan kepada kami [Ubaid bin Ya'isy] dan [Ishaq bin Ibrahim] teks milik Ubaid, keduanya berkata: Telah menceritakan kepada kami [Yahya bin Adam bin Sulaiman] maua Khalid bin Khalid, telah menceritakan kepada kami [Zuhair] dari [Suhail bin Abu Shalih] dari [ayahnya] dari [Abu Hurairah] berkata: Rasulullah Shallallahu 'alaihi wa Salam bersabda: ""Irak menahan dirham dan takarannya, Syam menahan mud dan dinarnya, Mesir menahan timbangan dan dinarnya, kalian kembali seperti sedia kala, kalian kembali seperti sedia kala, kalian kembali seperti sedia kala."" Abu Hurairah berkata: Daging dan darah Abu Hurairah menyaksikannya.","حَدَّثَنَا عُبَيْدُ بْنُ يَعِيشَ وَإِسْحَقُ بْنُ إِبْرَاهِيمَ وَاللَّفْظُ لِعُبَيْدٍ قَالَا حَدَّثَنَا يَحْيَى بْنُ آدَمَ بْنِ سُلَيْمَانَ مَوْلَى خَالِدِ بْنِ خَالِدٍ حَدَّثَنَا زُهَيْرٌ عَنْ سُهَيْلِ بْنِ أَبِي صَالِحٍ عَنْ أَبِيهِ عَنْ أَبِي هُرَيْرَةَ قَالَ
قَالَ رَسُولُ اللَّهِ صَلَّى اللَّهُ عَلَيْهِ وَسَلَّمَ مَنَعَتْ الْعِرَاقُ دِرْهَمَهَا وَقَفِيزَهَا وَمَنَعَتْ الشَّأْمُ مُدْيَهَا وَدِينَارَهَا وَمَنَعَتْ مِصْرُ إِرْدَبَّهَا وَدِينَارَهَا وَعُدْتُمْ مِنْ حَيْثُ بَدَأْتُمْ وَعُدْتُمْ مِنْ حَيْثُ بَدَأْتُمْ وَعُدْتُمْ مِنْ حَيْثُ بَدَأْتُمْ شَهِدَ عَلَى ذَلِكَ لَحْمُ أَبِي هُرَيْرَةَ وَدَمُهُ",63
