haditsId,kitabId,indo,arab,label
4366,44,"Telah menceritakan kepadaku [Muhammad bin Rafi'] Telah menceritakan kepada kami [Abdur Razaq] Telah menceritakan kepada kami [Ma'mar] dari [Hammam bin Munabih] dia berkata; 'Inilah yang telah di ceritakan oleh [Abu Hurairah] kepada kami dari Rasulullah shallallahu 'alaihi wasallam, -kemudian dia menyebutkan beberapa Hadits yang di antaranya-; dan Rasulullah shallallahu 'alaihi wasallam telah bersabda: ""Isa 'Alaihis Salam melihat seorang laki-laki mencuri, lalu Isa berkata kepadanya; 'kamu mencuri'? maka dia menjawab; 'Tidak, dan demi Dzat yang tidak ada Ilah kecuali Dia, ' Isa berkata; 'Aku beriman kepada Allah dan aku dustakan kedua mataku atas diriku.'","حَدَّثَنِي مُحَمَّدُ بْنُ رَافِعٍ حَدَّثَنَا عَبْدُ الرَّزَّاقِ حَدَّثَنَا مَعْمَرٌ عَنْ هَمَّامِ بْنِ مُنَبِّهٍ قَالَ هَذَا مَا حَدَّثَنَا أَبُو هُرَيْرَةَ عَنْ رَسُولِ اللَّهِ صَلَّى اللَّهُ عَلَيْهِ وَسَلَّمَ فَذَكَرَ أَحَادِيثَ مِنْهَا
وَقَالَ رَسُولُ اللَّهِ صَلَّى اللَّهُ عَلَيْهِ وَسَلَّمَ رَأَى عِيسَى ابْنُ مَرْيَمَ رَجُلًا يَسْرِقُ فَقَالَ لَهُ عِيسَى سَرَقْتَ قَالَ كَلَّا وَالَّذِي لَا إِلَهَ إِلَّا هُوَ فَقَالَ عِيسَى آمَنْتُ بِاللَّهِ وَكَذَّبْتُ نَفْسِي",65
4370,44,"Dan telah menceritakan kepadaku [Zuhair bin Harb] Telah menceritakan kepada kami [Syababah] Telah menceritakan kepada kami [Warqa] dari [Abu Az Zinad] dari [Al A'raj] dari [Abu Hurairah] dari Nabi shallallahu 'alaihi wasallam beliau bersabda: ""Semoga Allah mengampuni Nabi Luth, Sungguh dia berlindung kepada keluarga yang kuat.""","و حَدَّثَنِي زُهَيْرُ بْنُ حَرْبٍ حَدَّثَنَا شَبَابَةُ حَدَّثَنَا وَرْقَاءُ عَنْ أَبِي الزِّنَادِ عَنْ الْأَعْرَجِ عَنْ أَبِي هُرَيْرَةَ
عَنْ النَّبِيِّ صَلَّى اللَّهُ عَلَيْهِ وَسَلَّمَ قَالَ يَغْفِرُ اللَّهُ لِلُوطٍ إِنَّهُ أَوَى إِلَى رُكْنٍ شَدِيدٍ",65
4495,45,"Telah menceritakan kepadaku [Abu Ja'far Muhammad bin Al Faraj]; Telah menceritakan kepada kami [Zaid bin Al Hubab]; Telah mengabarkan kepadaku ['Abdul 'Aziz bin Abu Salamah]; Telah mengabarkan kepada kami [Muhammad bin Al Munkadir] dari [Jabir bin 'Abdillah] bahwa Rasulullah shallallahu 'alaihi wasallam bersabda: ""Surga pernah di perlihatkan kepadaku, lalu aku melihat istri Abu Thalhah. Kemudian aku mendengar suara gesekan sandal di depanku yang ternyata adalah langkah Bilal.""","حَدَّثَنِي أَبُو جَعْفَرٍ مُحَمَّدُ بْنُ الْفَرَجِ حَدَّثَنَا زَيْدُ بْنُ الْحُبَابِ أَخْبَرَنِي عَبْدُ الْعَزِيزِ بْنُ أَبِي سَلَمَةَ أَخْبَرَنَا مُحَمَّدُ بْنُ الْمُنْكَدِرِ عَنْ جَابِرِ بْنِ عَبْدِ اللَّهِ
أَنَّ رَسُولَ اللَّهِ صَلَّى اللَّهُ عَلَيْهِ وَسَلَّمَ قَالَ أُرِيتُ الْجَنَّةَ فَرَأَيْتُ امْرَأَةَ أَبِي طَلْحَةَ ثُمَّ سَمِعْتُ خَشْخَشَةً أَمَامِي فَإِذَا بِلَالٌ",65
4570,45,"Telah menceritakan kepada kami [Nashr bin 'Ali Al Jahdhami] dan [Muhammad bin Al Mutsanna] dan [Ibnu Basysyar] seluruhnya dari [Ibnu 'Ar'arah] dan lafazh ini milik Jahdhami; Telah menceritakan kepadaku [Muhammad bin 'Ar'arah]; Telah menceritakan kepada kami [Syu'bah] dari [Yunus bin 'Ubaid] dari [Tsabit Al Bunani] dari [Anas bin Malik] dia berkata; 'Saya pernah bepergian bersama Jarir bin Abdullah Al Bajali dan dia melayani segala keperluan saya. Lalu saya berkata kepadanya; ""Hai Jarir, janganlah kamu sibuk melayani saya!"" Jarir menjawab; ""Saya pernah melihat orang-orang Anshar membantu Rasulullah shallallahu 'alaihi wasallam, hingga saya bersumpah bahwasanya jika saya berteman dengan seorang sahabat Anshar, maka saya pasti akan melayaninya."" Ibnu Mutsanna dan Ibnu Basyar menambahkan di dalam Hadits keduanya, 'Jarir lebih tua dari Anas.""","حَدَّثَنَا نَصْرُ بْنُ عَلِيٍّ الْجَهْضَمِيُّ وَمُحَمَّدُ بْنُ الْمُثَنَّى وَابْنُ بَشَّارٍ جَمِيعًا عَنْ ابْنِ عَرْعَرَةَ وَاللَّفْظُ لِلْجَهْضَمِيِّ حَدَّثَنِي مُحَمَّدُ بْنُ عَرْعَرَةَ حَدَّثَنَا شُعْبَةُ عَنْ يُونُسَ بْنِ عُبَيْدٍ عَنْ ثَابِتٍ الْبُنَانِيِّ عَنْ أَنَسِ بْنِ مَالِكٍ قَالَ
خَرَجْتُ مَعَ جَرِيرِ بْنِ عَبْدِ اللَّهِ الْبَجَلِيِّ فِي سَفَرٍ فَكَانَ يَخْدُمُنِي فَقُلْتُ لَهُ لَا تَفْعَلْ فَقَالَ إِنِّي قَدْ رَأَيْتُ الْأَنْصَارَ تَصْنَعُ بِرَسُولِ اللَّهِ صَلَّى اللَّهُ عَلَيْهِ وَسَلَّمَ شَيْئًا آلَيْتُ أَنْ لَا أَصْحَبَ أَحَدًا مِنْهُمْ إِلَّا خَدَمْتُهُ
زَادَ ابْنُ الْمُثَنَّى وَابْنُ بَشَّارٍ فِي حَدِيثِهِمَا وَكَانَ جَرِيرٌ أَكْبَرَ مِنْ أَنَسٍ وَقَالَ ابْنُ بَشَّارٍ أَسَنَّ مِنْ أَنَسٍ",65
4733,46,"Telah menceritakan kepada kami [Abu Bakr bin Abu Syaibah]; Telah menceritakan kepada kami [Hafsh bin Ghiyats] dari [Hisyam bin 'Urwah] dari [Bapaknya] dari [Hisyam bin Hakim bin Hizam] dia berkata; ""Saya pernah melewati beberapa orang di Syam yang dijemur di terik matahari sedangkan kepala mereka dituangi minyak. Kemudian Hisyam bertanya; 'Mengapa mereka ini dihukum? ' Seseorang menjawab; 'Mereka disiksa karena masalah pajak.' Hisyam berkata; 'Sesungguhnya saya pernah mendengar Rasulullah shallallahu 'alaihi wasallam bersabda: 'Sesungguhnya Allah akan menyiksa orang-orang yang menyiksa orang lain di dunia.""","حَدَّثَنَا أَبُو بَكْرِ بْنُ أَبِي شَيْبَةَ حَدَّثَنَا حَفْصُ بْنُ غِيَاثٍ عَنْ هِشَامِ بْنِ عُرْوَةَ عَنْ أَبِيهِ عَنْ هِشَامِ بْنِ حَكِيمِ بْنِ حِزَامٍ قَالَ
مَرَّ بِالشَّامِ عَلَى أُنَاسٍ وَقَدْ أُقِيمُوا فِي الشَّمْسِ وَصُبَّ عَلَى رُءُوسِهِمْ الزَّيْتُ فَقَالَ مَا هَذَا قِيلَ يُعَذَّبُونَ فِي الْخَرَاجِ فَقَالَ أَمَا إِنِّي سَمِعْتُ رَسُولَ اللَّهِ صَلَّى اللَّهُ عَلَيْهِ وَسَلَّمَ يَقُولُ إِنَّ اللَّهَ يُعَذِّبُ الَّذِينَ يُعَذِّبُونَ فِي الدُّنْيَا",65
4734,46,"Telah menceritakan kepada kami [Abu Kuraib]; Telah menceritakan kepada kami [Abu Usamah] dari [Hisyam] dari [Bapaknya] dia berkata; [Hisyam bin Hakim bin Hizam] pernah melewati beberapa orang dari para petani di Syam yang dijemur di terik matahari. Kemudian Hisyam bertanya; 'Mengapa mereka ini dihukum? ' mereka menjawab; 'Mereka disiksa karena masalah pajak.' Hisyam berkata; Aku bersaksi'Sesungguhnya saya pernah mendengar Rasulullah shallallahu 'alaihi wasallam bersabda: 'Sesungguhnya Allah akan menyiksa orang-orang yang menyiksa orang lain di dunia."" Telah menceritakan kepada kami [Abu Kuraib]; Telah menceritakan kepada kami [Waki'] dan [Abu Mu'awiyah]; Demikian juga diriwayatkan dari jalur lainnya, Dan telah menceritakan kepada kami [Ishaq bin Ibrahim]; Telah mengabarkan kepada kami [Jarir] seluruhnya dari [Hisyam] melalui jalur ini di dalam Hadits Jarir ada tambahan; di Palestina pemimpin mereka pada waktu itu adalah Umair bin Sa'ad. Maka Hisyam menemuinya dan menyampaikan Hadits tersebut kepadanya. Akhirnya Umair menyuruh untuk membebaskan para petani tersebut.","حَدَّثَنَا أَبُو كُرَيْبٍ حَدَّثَنَا أَبُو أُسَامَةَ عَنْ هِشَامٍ عَنْ أَبِيهِ قَالَ
مَرَّ هِشَامُ بْنُ حَكِيمِ بْنِ حِزَامٍ عَلَى أُنَاسٍ مِنْ الْأَنْبَاطِ بِالشَّامِ قَدْ أُقِيمُوا فِي الشَّمْسِ فَقَالَ مَا شَأْنُهُمْ قَالُوا حُبِسُوا فِي الْجِزْيَةِ فَقَالَ هِشَامٌ أَشْهَدُ لَسَمِعْتُ رَسُولَ اللَّهِ صَلَّى اللَّهُ عَلَيْهِ وَسَلَّمَ يَقُولُ إِنَّ اللَّهَ يُعَذِّبُ الَّذِينَ يُعَذِّبُونَ النَّاسَ فِي الدُّنْيَا
حَدَّثَنَا أَبُو كُرَيْبٍ حَدَّثَنَا وَكِيعٌ وَأَبُو مُعَاوِيَةَ ح و حَدَّثَنَا إِسْحَقُ بْنُ إِبْرَاهِيمَ أَخْبَرَنَا جَرِيرٌ كُلُّهُمْ عَنْ هِشَامٍ بِهَذَا الْإِسْنَادِ وَزَادَ فِي حَدِيثِ جَرِيرٍ قَالَ وَأَمِيرُهُمْ يَوْمَئِذٍ عُمَيْرُ بْنُ سَعْدٍ عَلَى فِلَسْطِينَ فَدَخَلَ عَلَيْهِ فَحَدَّثَهُ فَأَمَرَ بِهِمْ فَخُلُّوا",65
4735,46,"Telah menceritakan kepadaku [Abu Ath Thahir]; Telah mengabarkan kepada kami [Ibnu Wahb]; Telah mengabarkan kepadaku [Yunus] dari [Ibnu Syihab] dari ['Urwah bin Az Zubair] bahwa [Hisyam bin Hakim] pernah melewati orang di Syam sedang menjemur beberapa orang petani di terik matahari karena tidak membayar pajak. Kemudian Hisyam bertanya; 'Mengapa mereka ini dihukum? ' 'Sesungguhnya saya pernah mendengar Rasulullah shallallahu 'alaihi wasallam bersabda: 'Sesungguhnya Allah akan menyiksa orang-orang yang menyiksa orang lain di dunia.'""","حَدَّثَنِي أَبُو الطَّاهِرِ أَخْبَرَنَا ابْنُ وَهْبٍ أَخْبَرَنِي يُونُسُ عَنْ ابْنِ شِهَابٍ عَنْ عُرْوَةَ بْنِ الزُّبَيْرِ أَنَّ هِشَامَ بْنَ حَكِيمٍ
وَجَدَ رَجُلًا وَهُوَ عَلَى حِمْصَ يُشَمِّسُ نَاسًا مِنْ النَّبْطِ فِي أَدَاءِ الْجِزْيَةِ فَقَالَ مَا هَذَا إِنِّي سَمِعْتُ رَسُولَ اللَّهِ صَلَّى اللَّهُ عَلَيْهِ وَسَلَّمَ يَقُولُ إِنَّ اللَّهَ يُعَذِّبُ الَّذِينَ يُعَذِّبُونَ النَّاسَ فِي الدُّنْيَا",65
4966,50,"Telah menceritakan kepada kami [Nashr bin 'Ali Al Jahdhami] dan [Zuhair bin Harb] -dan lafadh ini milik Zuhair- mereka berdua berkata; telah menceritakan kepada kami ['Umar bin Yunus] telah menceritakan kepada kami ['Ikrimah bin 'Ammar] telah menceritakan kepada kami [Syaddad] telah menceritakan kepada kami [Abu Umamah] dia berkata; ""Ketika Rasulullah shallallahu 'alaihi wasallam berada di masjid, sedangkan kami tengah duduk-duduk dan bercengkrama dengan beliau, tiba-tiba ada seorang laki-laki yang datang dan berkata; 'Ya Rasulullah, saya telah berbuat dosa. Oleh karena itu, berilah saya hukuman! ' Tetapi Rasulullah hanya terdiam saja. Setelah itu, orang tersebut mengulangi lagi ucapannya; 'Ya Rasulullah, saya telah berbuat dosa. Oleh karena itu, berilah saya hukuman.' Namun Rasulullah hanya terdiam saja. Tak lama kemudian, dilaksanakan shalat berjama'ah. Abu Umamah berkata; 'Ketika Rasulullah shallallahu 'alaihi wasallam pulang ke rumah, orang tersebut tetap mengikutinya untuk mengetahui jawaban kepada orang laki-laki tersebut. Rasulullah shallallahu 'alaihi wasallam menjawab pertanyaan orang tersebut: 'Tahukah kamu bahwasanya kamu keluar dari rumah, bukankah kamu telah berwudlu dengan sebaik-baiknya? ' Laki-laki itu menjawab; 'Benar ya Rasulullah.' Kemudian Rasulullah melanjutkan sabdanya: 'Setelah itu, bukankah kamu telah mengikuti shalat berjamaah bersama kami? ' Laki-laki itu menjawab; 'Benar ya Rasulullah.' Lalu Rasulullah shallallahu 'alaihi wasallam bersabda: 'Sesungguhnya Allah telah mengampuni hukuman bagimu, atau dia berkata, dosamu.'""","حَدَّثَنَا نَصْرُ بْنُ عَلِيٍّ الْجَهْضَمِيُّ وَزُهَيْرُ بْنُ حَرْبٍ وَاللَّفْظُ لِزُهَيْرٍ قَالَا حَدَّثَنَا عُمَرُ بْنُ يُونُسَ حَدَّثَنَا عِكْرِمَةُ بْنُ عَمَّارٍ حَدَّثَنَا شَدَّادٌ حَدَّثَنَا أَبُو أُمَامَةَ قَالَ
بَيْنَمَا رَسُولُ اللَّهِ صَلَّى اللَّهُ عَلَيْهِ وَسَلَّمَ فِي الْمَسْجِدِ وَنَحْنُ قُعُودٌ مَعَهُ إِذْ جَاءَ رَجُلٌ فَقَالَ يَا رَسُولَ اللَّهِ إِنِّي أَصَبْتُ حَدًّا فَأَقِمْهُ عَلَيَّ فَسَكَتَ عَنْهُ رَسُولُ اللَّهِ صَلَّى اللَّهُ عَلَيْهِ وَسَلَّمَ ثُمَّ أَعَادَ فَقَالَ يَا رَسُولَ اللَّهِ إِنِّي أَصَبْتُ حَدًّا فَأَقِمْهُ عَلَيَّ فَسَكَتَ عَنْهُ وَأُقِيمَتْ الصَّلَاةُ فَلَمَّا انْصَرَفَ نَبِيُّ اللَّهِ صَلَّى اللَّهُ عَلَيْهِ وَسَلَّمَ قَالَ أَبُو أُمَامَةَ فَاتَّبَعَ الرَّجُلُ رَسُولَ اللَّهِ صَلَّى اللَّهُ عَلَيْهِ وَسَلَّمَ حِينَ انْصَرَفَ وَاتَّبَعْتُ رَسُولَ اللَّهِ صَلَّى اللَّهُ عَلَيْهِ وَسَلَّمَ أَنْظُرُ مَا يَرُدُّ عَلَى الرَّجُلِ فَلَحِقَ الرَّجُلُ رَسُولَ اللَّهِ صَلَّى اللَّهُ عَلَيْهِ وَسَلَّمَ فَقَالَ يَا رَسُولَ اللَّهِ إِنِّي أَصَبْتُ حَدًّا فَأَقِمْهُ عَلَيَّ قَالَ أَبُو أُمَامَةَ فَقَالَ لَهُ رَسُولُ اللَّهِ صَلَّى اللَّهُ عَلَيْهِ وَسَلَّمَ أَرَأَيْتَ حِينَ خَرَجْتَ مِنْ بَيْتِكَ أَلَيْسَ قَدْ تَوَضَّأْتَ فَأَحْسَنْتَ الْوُضُوءَ قَالَ بَلَى يَا رَسُولَ اللَّهِ قَالَ ثُمَّ شَهِدْتَ الصَّلَاةَ مَعَنَا فَقَالَ نَعَمْ يَا رَسُولَ اللَّهِ قَالَ فَقَالَ لَهُ رَسُولُ اللَّهِ صَلَّى اللَّهُ عَلَيْهِ وَسَلَّمَ فَإِنَّ اللَّهَ قَدْ غَفَرَ لَكَ حَدَّكَ أَوْ قَالَ ذَنْبَكَ",65
5095,53,"Telah menceritakan kepada kami [Abu Bakr bin Abu Syaibah] dan [Abu Kuraib] keduanya berkata: Telah menceritakan kepada kami [Ibnu Numair] dari [Hisyam bin Urwah] dari [ayahnya] dari [Abdullah bin Zam'ah] berkata: Rasulullah Shallallahu 'alaihi wa Salam berkhutbah, beliau menyebut unta dan menyebut orang yang menyembelihnya, beliau menyebut: ""Ketika bangkit orang yang paling celaka di antara mereka."" (Asy Syams: 12) orang mulia dan kuat dalam golongannya seperti Abu Zam'ah."" Setelah itu beliau menyebut kaum wanita dan memberi mereka nasehat lalu beliau bertanya: ""Kenapa seseorang dari kalian mencambuk istrinya -riwayat Abu Bakr menyebut: ""Mencambuk budak wanita, "" riwayat Abu Kuraib menyebut: ""Menyambuk budak lelaki- dan mungkin ia menidurinya dipenghujung hari."" Setelah itu beliau menasehati mereka tentang tawa karena kentut, beliau bersabda: ""Kenapa salah seorang dari kalian menertawakan yang dilakukannya?""","حَدَّثَنَا أَبُو بَكْرِ بْنُ أَبِي شَيْبَةَ وَأَبُو كُرَيْبٍ قَالَا حَدَّثَنَا ابْنُ نُمَيْرٍ عَنْ هِشَامِ بْنِ عُرْوَةَ عَنْ أَبِيهِ عَنْ عَبْدِ اللَّهِ بْنِ زَمْعَةَ قَالَ
خَطَبَ رَسُولُ اللَّهِ صَلَّى اللَّهُ عَلَيْهِ وَسَلَّمَ فَذَكَرَ النَّاقَةَ وَذَكَرَ الَّذِي عَقَرَهَا فَقَالَ
{ إِذْ انْبَعَثَ أَشْقَاهَا }
انْبَعَثَ بِهَا رَجُلٌ عَزِيزٌ عَارِمٌ مَنِيعٌ فِي رَهْطِهِ مِثْلُ أَبِي زَمْعَةَ ثُمَّ ذَكَرَ النِّسَاءَ فَوَعَظَ فِيهِنَّ ثُمَّ قَالَ إِلَامَ يَجْلِدُ أَحَدُكُمْ امْرَأَتَهُ
فِي رِوَايَةِ أَبِي بَكْرٍ جَلْدَ الْأَمَةِ وَفِي رِوَايَةِ أَبِي كُرَيْبٍ جَلْدَ الْعَبْدِ وَلَعَلَّهُ يُضَاجِعُهَا مِنْ آخِرِ يَوْمِهِ ثُمَّ وَعَظَهُمْ فِي ضَحِكِهِمْ مِنْ الضَّرْطَةِ فَقَالَ إِلَامَ يَضْحَكُ أَحَدُكُمْ مِمَّا يَفْعَلُ",65
5098,53,"Telah menceritakan kepadaku [Zuhair bin Harb] telah menceritakan kepada kami [Jurair] dari [Suhail] dari [ayahnya] dari [Abu Hurairah] berkata: Rasulullah Shallallahu 'alaihi wa Salam bersabda: ""Dua golongan penghuni neraka yang belum pernah aku lihat; kaum membawa cambuk seperti ekor sapi, dengannya ia memukuli orang dan wanita-wanita yang berpakaian (tapi) telanjang, mereka berlenggak-lenggok dan condong (dari ketaatan), rambut mereka seperti punuk unta yang miring, mereka tidak masuk surga dan tidak akan mencium baunya, padahal sesungguhnya bau surga itu tercium dari perjalanan sejauh ini dan ini.""","حَدَّثَنِي زُهَيْرُ بْنُ حَرْبٍ حَدَّثَنَا جَرِيرٌ عَنْ سُهَيْلٍ عَنْ أَبِيهِ عَنْ أَبِي هُرَيْرَةَ قَالَ
قَالَ رَسُولُ اللَّهِ صَلَّى اللَّهُ عَلَيْهِ وَسَلَّمَ صِنْفَانِ مِنْ أَهْلِ النَّارِ لَمْ أَرَهُمَا قَوْمٌ مَعَهُمْ سِيَاطٌ كَأَذْنَابِ الْبَقَرِ يَضْرِبُونَ بِهَا النَّاسَ وَنِسَاءٌ كَاسِيَاتٌ عَارِيَاتٌ مُمِيلَاتٌ مَائِلَاتٌ رُءُوسُهُنَّ كَأَسْنِمَةِ الْبُخْتِ الْمَائِلَةِ لَا يَدْخُلْنَ الْجَنَّةَ وَلَا يَجِدْنَ رِيحَهَا وَإِنَّ رِيحَهَا لَيُوجَدُ مِنْ مَسِيرَةِ كَذَا وَكَذَا",65
