haditsId,kitabId,indo,arab,label
2728,19,"Telah menceritakan kepada kami [Abu Ath Thahir] dan [Harmalah bin Yahya] sedangkan lafazh haditsnya hampir sama, Harmalah mengatakan; Telah menceritakan kepada kami, sedangkan Abu Thahir mengatakan; Telah mengabarkan kepada kami [Ibnu Wahb] telah menceritakan kepadaku [Yunus bin Yazid] dari [Ibnu Syihab] telah menceritakan kepadaku [Ubaidullah bin Abdillah bin 'Utbah bin Mas'ud] bahwa [ayahnya] pernah menulis kepada [Umar bin Abdullah bin Arqam Az Zuhri] dan memerintahkannya untuk menemui [Subai'ah binti Al Harits Al Aslamiyah] untuk menanyakan tentang riwayat haditsnya dan mengenai permasalahan apa Rasulullah shallallahu 'alaihi wasallam pernah bersabda kepadanya ketika dia meminta fatwa. Umar bin Abdillah menulis surat kepada Abdullah bin 'Utbah dan mengabarkan kepadanya bahwa Suba'iah pernah mengabarkan kepadanya; Bahwa dia adalah istri Sa'ad bin Khaulah dari suku 'Amir bin Lu'ai. Sedangkan Sa'ad adalah salah seorang sahabat yang ikut berperang dalam peperangan Badar, dia meninggal dunia ketika Haji Wada' di saat istrinya hamil tua. Beberapa hari setelah dia wafat, istrinya pun melahirkan. Setelah istrinya suci dari nifas, dia pun berhias diri karena mengharap supaya dia dilamar orang. Tidak lama kemudian datanglah Abu Sanabil bin Ba'kak -seorang laki-laki dari Bani Abdid Dar- dia berkata kepadanya; ""Saya melihatmu berhias diri, barang kali kamu berharap untuk menikah lagi. Demi Allah, kamu belum boleh menikah lagi sebelum lewat empat bulan sepuluh hari."" Kata Subai'ah; Setelah dia berkata demikian kepadaku, lalu saya langsung mengenakan pakaianku dan pergi menemui Rasulullah shallallahu 'alaihi wasallam, kutanyakan masalah tersebut kepada beliau. Kemudian beliau berfatwa kepadaku bahwa sebenarnya saya sudah halal untuk menikah setelah melahirkan anakku, bahkan beliau menyuruhku menikah lagi jika saya berkenan. Ibnu Syihab mengatakan; ""Maka saya berpendapat bolehnya seorang wanita menikah setelah melahirkan, meskipun ia masih mengeluarkan darah, asal suaminya tidak menyetubuhinya hingga ia suci.""","و حَدَّثَنِي أَبُو الطَّاهِرِ وَحَرْمَلَةُ بْنُ يَحْيَى وَتَقَارَبَا فِي اللَّفْظِ قَالَ حَرْمَلَةُ حَدَّثَنَا و قَالَ أَبُو الطَّاهِرِ أَخْبَرَنَا ابْنُ وَهْبٍ حَدَّثَنِي يُونُسُ بْنُ يَزِيدَ عَنْ ابْنِ شِهَابٍ حَدَّثَنِي عُبَيْدُ اللَّهِ بْنُ عَبْدِ اللَّهِ بْنِ عُتْبَةَ بْنِ مَسْعُودٍ أَنَّ أَبَاهُ كَتَبَ إِلَى عُمَرَ بْنِ عَبْدِ اللَّهِ بْنِ الْأَرْقَمِ الزُّهْرِيِّ
يَأْمُرُهُ أَنْ يَدْخُلَ عَلَى سُبَيْعَةَ بِنْتِ الْحَارِثِ الْأَسْلَمِيَّةِ فَيَسْأَلَهَا عَنْ حَدِيثِهَا وَعَمَّا قَالَ لَهَا رَسُولُ اللَّهِ صَلَّى اللَّهُ عَلَيْهِ وَسَلَّمَ حِينَ اسْتَفْتَتْهُ فَكَتَبَ عُمَرُ بْنُ عَبْدِ اللَّهِ إِلَى عَبْدِ اللَّهِ بْنِ عُتْبَةَ يُخْبِرُهُ أَنَّ سُبَيْعَةَ أَخْبَرَتْهُ أَنَّهَا كَانَتْ تَحْتَ سَعْدِ بْنِ خَوْلَةَ وَهُوَ فِي بَنِي عَامِرِ بْنِ لُؤَيٍّ وَكَانَ مِمَّنْ شَهِدَ بَدْرًا فَتُوُفِّيَ عَنْهَا فِي حَجَّةِ الْوَدَاعِ وَهِيَ حَامِلٌ فَلَمْ تَنْشَبْ أَنْ وَضَعَتْ حَمْلَهَا بَعْدَ وَفَاتِهِ فَلَمَّا تَعَلَّتْ مِنْ نِفَاسِهَا تَجَمَّلَتْ لِلْخُطَّابِ فَدَخَلَ عَلَيْهَا أَبُو السَّنَابِلِ بْنُ بَعْكَكٍ رَجُلٌ مِنْ بَنِي عَبْدِ الدَّارِ فَقَالَ لَهَا مَا لِي أَرَاكِ مُتَجَمِّلَةً لَعَلَّكِ تَرْجِينَ النِّكَاحَ إِنَّكِ وَاللَّهِ مَا أَنْتِ بِنَاكِحٍ حَتَّى تَمُرَّ عَلَيْكِ أَرْبَعَةُ أَشْهُرٍ وَعَشْرٌ قَالَتْ سُبَيْعَةُ فَلَمَّا قَالَ لِي ذَلِكَ جَمَعْتُ عَلَيَّ ثِيَابِي حِينَ أَمْسَيْتُ فَأَتَيْتُ رَسُولَ اللَّهِ صَلَّى اللَّهُ عَلَيْهِ وَسَلَّمَ فَسَأَلْتُهُ عَنْ ذَلِكَ فَأَفْتَانِي بِأَنِّي قَدْ حَلَلْتُ حِينَ وَضَعْتُ حَمْلِي وَأَمَرَنِي بِالتَّزَوُّجِ إِنْ بَدَا لِي
قَالَ ابْنُ شِهَابٍ فَلَا أَرَى بَأْسًا أَنْ تَتَزَوَّجَ حِينَ وَضَعَتْ وَإِنْ كَانَتْ فِي دَمِهَا غَيْرَ أَنْ لَا يَقْرَبُهَا زَوْجُهَا حَتَّى تَطْهُرَ",65
2751,20,"Telah menceritakan kepada kami [Amru An Naqid] dan [Ibnu Abi Umar] sedangkan lafazhnya dari Amru, keduanya berkata; Telah menceritakan kepada kami [Sufyan bin Uyainah] dari [Abu Az Zinad] dari [Qasim bin Muhammad] dia berkata; [Abdullah bin Syaddad] berkata; Telah disebutkan sepasang suami istri yang melakuan li'an di hadapan Ibnu Abbas, Ibnu Syaddad berkata; Apakah sepasang suami istri tersebut yang telah disebutkan oleh Nabi shallallahu 'alaihi wasallam: ""Sekiranya saya diperbolehkan merajam seseorang tanpa ada bukti yang jelas, niscaya saya akan merajamnya."" Maka Ibnu Abbas menjawab; ""Tidak, akan tetapi ia adalah wanita yang mengumumkan perbuatan kejinya."" Dalam riwayatnya Ibnu Abi Umar berkata; Dari Qasim bin Muhammad dia berkata; Saya pernah mendengar Ibnu Abbas. ","و حَدَّثَنَا عَمْرٌو النَّاقِدُ وَابْنُ أَبِي عُمَرَ وَاللَّفْظُ لِعَمْرٍو قَالَا حَدَّثَنَا سُفْيَانُ بْنُ عُيَيْنَةَ عَنْ أَبِي الزِّنَادِ عَنْ الْقَاسِمِ بْنِ مُحَمَّدٍ قَالَ قَالَ عَبْدُ اللَّهِ بْنُ شَدَّادٍ
وَذُكِرَ الْمُتَلَاعِنَانِ عِنْدَ ابْنِ عَبَّاسٍ فَقَالَ ابْنُ شَدَّادٍ أَهُمَا اللَّذَانِ قَالَ النَّبِيُّ صَلَّى اللَّهُ عَلَيْهِ وَسَلَّمَ لَوْ كُنْتُ رَاجِمًا أَحَدًا بِغَيْرِ بَيِّنَةٍ لَرَجَمْتُهَا
فَقَالَ ابْنُ عَبَّاسٍ لَا تِلْكَ امْرَأَةٌ أَعْلَنَتْ قَالَ ابْنُ أَبِي عُمَرَ فِي رِوَايَتِهِ عَنْ الْقَاسِمِ بْنِ مُحَمَّدٍ قَالَ سَمِعْتُ ابْنَ عَبَّاسٍ",65
2931,23,"Dan telah menceritakan kepadaku [Muhammad bin Hatim] telah menceritakan kepada kami [Yahya bin Sa'id Al Qatthan] dari [Muhammad bin Yusuf] dia berkata; saya mendengar [As Saib bin Yazid] telah menceritakan dari [Rafi' bin Khudaij] berkata, ""Saya mendengar Nabi shallallahu 'alaihi wasallam bersabda: ""Sejelek-jelek usaha adalah usaha pelacuran, jaul beli anjing dan usaha tukang bekam.""","و حَدَّثَنِي مُحَمَّدُ بْنُ حَاتِمٍ حَدَّثَنَا يَحْيَى بْنُ سَعِيدٍ الْقَطَّانُ عَنْ مُحَمَّدِ بْنِ يُوسُفَ قَالَ سَمِعْتُ السَّائِبَ بْنَ يَزِيدَ يُحَدِّثُ عَنْ رَافِعِ بْنِ خَدِيجٍ قَالَ
سَمِعْتُ النَّبِيَّ صَلَّى اللَّهُ عَلَيْهِ وَسَلَّمَ يَقُولُ شَرُّ الْكَسْبِ مَهْرُ الْبَغِيِّ وَثَمَنُ الْكَلْبِ وَكَسْبُ الْحَجَّامِ",65
3103,27,"Telah menceritakan kepadaku [Harun bin Sa'id Al Aili] dan [Yunus bin Abdul A'la] dan [Ahmad bin Isa], Yunus berkata; telah mengabarkan kepada kami, sedangkan yang dua orang mengakatan; telah menceritakan kepada kami [Ibnu Wahab] telah mengabarkan kepadaku ['Amru bin Al Harits] dari [Ka'b bin 'Alqamah] dari [Abdurrahman bin Syimasah] dari [Abu Al Khair] dari ['Alqamah bin 'Amir] dari Rasulullah shallallahu 'alaihi wasallam, beliau bersabda: ""Kafarahnya (denda) nadzar sama dengan kafarahnya sumpah.""","و حَدَّثَنِي هَارُونُ بْنُ سَعِيدٍ الْأَيْلِيُّ وَيُونُسُ بْنُ عَبْدِ الْأَعْلَى وَأَحْمَدُ بْنُ عِيسَى قَالَ يُونُسُ أَخْبَرَنَا و قَالَ الْآخَرَانِ حَدَّثَنَا ابْنُ وَهْبٍ أَخْبَرَنِي عَمْرُو بْنُ الْحَارِثِ عَنْ كَعْبِ بْنِ عَلْقَمَةَ عَنْ عَبْدِ الرَّحْمَنِ بْنِ شِمَاسَةَ عَنْ أَبِي الْخَيْرِ عَنْ عُقْبَةَ بْنِ عَامِرٍ
عَنْ رَسُولِ اللَّهِ صَلَّى اللَّهُ عَلَيْهِ وَسَلَّمَ قَالَ كَفَّارَةُ النَّذْرِ كَفَّارَةُ الْيَمِينِ",65
3188,29,"Dan telah menceritakan kepada kami [Abu Bakar bin Abu Syaibah] dan [Abu Kuraib] dan [Ishaq bin Ibrahim] dan ini adalah lafadz Abu Bakar. [Ishaq] berkata; telah mengabarkan kepada kami, dia berkata; perawi berkata; telah menceritakan kepada kami [Waki'] dari [Hisyam bin 'Urwah] dari [Ayahnya] dari [Al Miswar bin Mahramah], sedangkan yang dua mengatakan, ""Umar bin Khattab bermusyawarah dengan orang-orang mengenai hukuman wanita yang menggugurkan kandungan, maka [Mughirah bin Syu'bah] berkata, ""Aku pernah menyaksikan Nabi shallallahu 'alaihi wasallam memberi putusan dalam masalah itu, bahwa dendanya adalah dengan membebaskan seorang budak mahal, baik budak tersebut laki-laki atau perempuan."" Umar berkata, ""Hadapkanlah kepadaku orang-orang yang pernah menyaksikan denganmu putusan Rasulullah shallallahu 'alaihi wasallam tersebut!"" Mughirah berkata, "" [Muhammad bin Maslamah] adalah salah seorang yang pernah ikut menyaksikannya.""","و حَدَّثَنَا أَبُو بَكْرِ بْنُ أَبِي شَيْبَةَ وَأَبُو كُرَيْبٍ وَإِسْحَقُ بْنُ إِبْرَاهِيمَ وَاللَّفْظُ لِأَبِي بَكْرٍ قَالَ إِسْحَقُ أَخْبَرَنَا قَالَ وَقَالَ حَدَّثَنَا وَكِيعٌ عَنْ هِشَامِ بْنِ عُرْوَةَ عَنْ أَبِيهِ عَنْ الْمِسْوَرِ بْنِ مَخْرَمَةَ قَالَ
الْآخَرَانِ عُمَرُ بْنُ الْخَطَّابِ اسْتَشَارَ النَّاسَ فِي إِمْلَاصِ الْمَرْأَةِ الْمُغِيرَةُ بْنُ شُعْبَةَ فَقَالَ شَهِدْتُ النَّبِيَّ صَلَّى اللَّهُ عَلَيْهِ وَسَلَّمَ قَضَى فِيهِ بِغُرَّةٍ عَبْدٍ أَوْ أَمَةٍ
قَالَ فَقَالَ عُمَرُ ائْتِنِي بِمَنْ يَشْهَدُ مَعَكَ قَالَ فَشَهِدَ مُحَمَّدُ بْنُ مَسْلمَةَ",65
3189,30,"Telah menceritakan kepada kami [Yahya bin Yahya] dan [Ishaq bin Ibrahim] dan [Ibnu Abu Umar] dan ini adalah lafadz Yahya. Ibnu Abu Umar berkata; telah menceritakan kepada kami, sedangkan yang dua mengatakan; telah mengabarkan kepada kami [Sufyan bin 'Uyainah] dari [Az Zuhri] dari ['Amrah] dari ['Aisyah] dia berkata, ""Rasulullah shallallahu 'alaihi wasallam hanya memotong tangan pecuri jika ia mencuri seperempat dinar atau lebih."" Dan telah menceritakan kepada kami [Ishaq bin Ibrahim] dan [Abd bin Humaid] keduanya berkata; telah mengabarkan kepada kami [Abdurrazaq] telah mengabarkan kepada kami [Ma'mar]. (dalam jalur lain disebutkan) Telah menceritakan kepada kami [Abu Bakar bin Abu Syaibah] telah menceritakan kepada kami [Yazid bin Harun] telah mengabarkan kepada kami [Sulaiman bin Katsir] dan [Ibrahim bin Sa'd] semuanya dari [Az Zuhri] seperti hadits di atas dengan isnad ini.""","حَدَّثَنَا يَحْيَى بْنُ يَحْيَى وَإِسْحَقُ بْنُ إِبْرَاهِيمَ وَابْنُ أَبِي عُمَرَ وَاللَّفْظُ لِيَحْيَى قَالَ ابْنُ أَبِي عُمَرَ حَدَّثَنَا و قَالَ الْآخَرَانِ أَخْبَرَنَا سُفْيَانُ بْنُ عُيَيْنَةَ عَنْ الزُّهْرِيِّ عَنْ عَمْرَةَ عَنْ عَائِشَةَ قَالَتْ
كَانَ رَسُولُ اللَّهِ صَلَّى اللَّهُ عَلَيْهِ وَسَلَّمَ يَقْطَعُ السَّارِقَ فِي رُبْعِ دِينَارٍ فَصَاعِدًا
و حَدَّثَنَا إِسْحَقُ بْنُ إِبْرَاهِيمَ وَعَبْدُ بْنُ حُمَيْدٍ قَالَا أَخْبَرَنَا عَبْدُ الرَّزَّاقِ أَخْبَرَنَا مَعْمَرٌ ح و حَدَّثَنَا أَبُو بَكْرِ بْنُ أَبِي شَيْبَةَ حَدَّثَنَا يَزِيدُ بْنُ هَارُونَ أَخْبَرَنَا سُلَيْمَانُ بْنُ كَثِيرٍ وَإِبْرَاهِيمُ بْنُ سَعْدٍ كُلُّهُمْ عَنْ الزُّهْرِيِّ بِمِثْلِهِ فِي هَذَا الْإِسْنَادِ",65
3190,30,"Dan telah menceritakan kepadaku [Abu At Thahir] dan [Harmalah bin Yahya], dan telah menceritakan kepada kami [Al Walid bin Syuja'] dan ini adalah lafadz Al Walid, dan [Harmalah] mereka berkata; telah menceritakan kepada kami [Ibnu Wahb] telah mengabarkan kepadaku [Yunus] dari [Ibnu Syihab] dari ['Urwah] dan ['Amrah] dari ['Aisyah] dari Rasulullah shallallahu 'alaihi wasallam, beliau bersabda: ""Tangan pencuri tidak dipotong hingga ia mencuri (harta) senilai seperempat dinar atau lebih.""","و حَدَّثَنِي أَبُو الطَّاهِرِ وَحَرْمَلَةُ بْنُ يَحْيَى وَحَدَّثَنَا الْوَلِيدُ بْنُ شُجَاعٍ وَاللَّفْظُ لِلْوَلِيدِ وَحَرْمَلَةَ قَالُوا حَدَّثَنَا ابْنُ وَهْبٍ أَخْبَرَنِي يُونُسُ عَنْ ابْنِ شِهَابٍ عَنْ عُرْوَةَ وَعَمْرَةَ عَنْ عَائِشَةَ
عَنْ رَسُولِ اللَّهِ صَلَّى اللَّهُ عَلَيْهِ وَسَلَّمَ قَالَ لَا تُقْطَعُ يَدُ السَّارِقِ إِلَّا فِي رُبْعِ دِينَارٍ فَصَاعِدًا",65
3191,30,"Dan telah menceritakan kepadaku [Abu At Thahir] dan [Harun bin Sa'id Al Aili] serta [Ahamad bin Isa] dan ini adalah lafadz Harun dan Ahmad, Abu At Thahir berkata; telah mengabarkan kepada kami, sedangkan yang dua mengatakan; telah menceritakan kepada kami [Ibnu Wahb] telah mengabarkan kepadaku [Mahramah] dari [Ayahnya] dari [Sulaiman bin Yasar] dari ['Amrah] bahwa dia pernah mendengar ['Aisyah] menceritakan bahwa, dia mendengar Rasulullah shallallahu 'alaihi wasallam bersabda: ""Tangan pencuri tidak dipotong hingga ia mencuri (harta) senilai seperempat dinar atau lebih.""","و حَدَّثَنِي أَبُو الطَّاهِرِ وَهَارُونُ بْنُ سَعِيدٍ الْأَيْلِيُّ وَأَحْمَدُ بْنُ عِيسَى وَاللَّفْظُ لِهَارُونَ وَأَحْمَدَ قَالَ أَبُو الطَّاهِرِ أَخْبَرَنَا وَقَالَ الْآخَرَانِ حَدَّثَنَا ابْنُ وَهْبٍ أَخْبَرَنِي مَخْرَمَةُ عَنْ أَبِيهِ عَنْ سُلَيْمَانَ بْنِ يَسَارٍ عَنْ عَمْرَةَ أَنَّهَا سَمِعَتْ عَائِشَةَ تُحَدِّثُ
أَنَّهَا سَمِعَتْ رَسُولَ اللَّهِ صَلَّى اللَّهُ عَلَيْهِ وَسَلَّمَ يَقُولُ لَا تُقْطَعُ الْيَدُ إِلَّا فِي رُبْعِ دِينَارٍ فَمَا فَوْقَهُ",65
3192,30,"Telah menceritakan kepadaku [Bisyr bin Al Hakam Al 'Abdi] telah menceritakan kepada kami [Abdul Aziz bin Muhammad] dari [Yazid bin Abdullah bin Al Hadi] dari [Abu Bakar bin Muhammad] dari ['Amrah] dari ['Aisyah], bahwa dia mendengar Nabi shallallahu 'alaihi wasallam bersabda: ""Janganlah tangan pencuri dipotong kecuali jika telah mencapai seperempat dinar atau lebih."" Dan telah menceritakan kepada kami [Ishaq bin Ibrahim] dan [Muhammad bin Al Mutsanna] dan [Ishaq bin Manshur] semuanya dari [Abu 'Amir Al 'Aqadi] telah menceritakan kepada kami [Abdullah bin Ja'far] dari anaknya Al Miswar bin Mahzamah, dari [Yazid bin Abdullah bin Al Hadi] dengan isnad seperti ini.""","حَدَّثَنِي بِشْرُ بْنُ الْحَكَمِ الْعَبْدِيُّ حَدَّثَنَا عَبْدُ الْعَزِيزِ بْنُ مُحَمَّدٍ عَنْ يَزِيدَ بْنِ عَبْدِ اللَّهِ بْنِ الْهَادِ عَنْ أَبِي بَكْرِ بْنِ مُحَمَّدٍ عَنْ عَمْرَةَ عَنْ عَائِشَةَ
أَنَّهَا سَمِعَتْ النَّبِيَّ صَلَّى اللَّهُ عَلَيْهِ وَسَلَّمَ يَقُولُ لَا تُقْطَعُ يَدُ السَّارِقِ إِلَّا فِي رُبْعِ دِينَارٍ فَصَاعِدًا
و حَدَّثَنَا إِسْحَقُ بْنُ إِبْرَاهِيمَ وَمُحَمَّدُ بْنُ الْمُثَنَّى وَإِسْحَقُ بْنُ مَنْصُورٍ جَمِيعًا عَنْ أَبِي عَامِرٍ الْعَقَدِيِّ حَدَّثَنَا عَبْدُ اللَّهِ بْنُ جَعْفَرٍ مِنْ وَلَدِ الْمِسْوَرِ بْنِ مَخْرَمَةَ عَنْ يَزِيدَ بْنِ عَبْدِ اللَّهِ بْنِ الْهَادِ بِهَذَا الْإِسْنَادِ مِثْلَهُ",65
3193,30,"Dan telah menceritakan kepada kami [Muhammad bin Abdullah bin Numair] telah menceritakan kepada kami [Humaid bin Abdurrahman Ar Ru`asi] dari [Hisyam bin 'Urwah] dari [Ayahnya] dari ['Aisyah] dia berkata, ""Pada zaman Rasulullah shallallahu 'alaihi wasallam tangan pencuri belum bisa dipotong jika (ia mencuri) kurang dari seharga tameng atau perisai yang keduanya punya nilai."" Dan telah menceritakan kepada kami [Utsman bin Abu Syaibah] telah mengabarkan kepada kami ['Abdah bin Sulaiman] dan [Humaid bin Abdurrahman]. (dalam jalur lain disebutkan) Telah menceritakan kepada kami [Abu Bakar bin Abu Syaibah] telah menceritakan kepada kami [Abdurrahim bin Sulaiman]. (dalam jalur lain disebutkan) Telah menceritakan kepada kami [Abu Kuraib] telah menceritakan kepada kami [Abu Usamah] semuanya dari [Hisyam] dengan isnad ini, seperti hadits Ibnu Numair, dari Humaid bin Abdurrahman Ar Ru`asi. Dan dalam hadits Abdurrahim dan Abu Usamah disebutkan, ""keduanya mempunyai nilai."" ","و حَدَّثَنَا مُحَمَّدُ بْنُ عَبْدِ اللَّهِ بْنِ نُمَيْرٍ حَدَّثَنَا حُمَيْدُ بْنُ عَبْدِ الرَّحْمَنِ الرُّؤَاسِيُّ عَنْ هِشَامِ بْنِ عُرْوَةَ عَنْ أَبِيهِ عَنْ عَائِشَةَ قَالَتْ
لَمْ تُقْطَعْ يَدُ سَارِقٍ فِي عَهْدِ رَسُولِ اللَّهِ صَلَّى اللَّهُ عَلَيْهِ وَسَلَّمَ فِي أَقَلَّ مِنْ ثَمَنِ الْمِجَنِّ حَجَفَةٍ أَوْ تُرْسٍ وَكِلَاهُمَا ذُو ثَمَنٍ
و حَدَّثَنَا عُثْمَانُ بْنُ أَبِي شَيْبَةَ أَخْبَرَنَا عَبْدَةُ بْنُ سُلَيْمَانَ وَحُمَيْدُ بْنُ عَبْدِ الرَّحْمَنِ ح و حَدَّثَنَا أَبُو بَكْرِ بْنُ أَبِي شَيْبَةَ حَدَّثَنَا عَبْدُ الرَّحِيمِ بْنُ سُلَيْمَانَ ح و حَدَّثَنَا أَبُو كُرَيْبٍ حَدَّثَنَا أَبُو أُسَامَةَ كُلُّهُمْ عَنْ هِشَامٍ بِهَذَا الْإِسْنَادِ نَحْوَ حَدِيثِ ابْنِ نُمَيْرٍ عَنْ حُمَيْدِ بْنِ عَبْدِ الرَّحْمَنِ الرُّؤَاسِيِّ وَفِي حَدِيثِ عَبْدِ الرَّحِيمِ وَأَبِي أُسَامَةَ وَهُوَ يَوْمَئِذٍ ذُو ثَمَنٍ",65
3195,30,"Telah menceritakan kepada kami [Abu Bakar bin Abu Syaibah] dan [Abu Kuraib] keduanya berkata; telah menceritakan kepada kami [Abu Mu'awiyah] dari [Al A'masy] dari [Abu Shalih] dari [Abu Hurairah] dia berkata, ""Rasulullah shallallahu 'alaihi wasallam bersabda: ""Allah melaknat seorang pencuri yang mencuri telur, lalu dipotong tangannya dan mencuri seutas tali lalu dipotong tangannya."" Dan telah menceritakan kepada kami ['Amru An Naqid] dan [Ishaq bin Ibrahim] dan [Ali bin Khasyram] semuanya dari [Isa bin Yunus] dari [Al A'masy] dengan sanad seperti ini, namun ia menyebutkan, ""Jika ia mencuri seutas tali atau sebutir telur.""","حَدَّثَنَا أَبُو بَكْرِ بْنُ أَبِي شَيْبَةَ وَأَبُو كُرَيْبٍ قَالَا حَدَّثَنَا أَبُو مُعَاوِيَةَ عَنْ الْأَعْمَشِ عَنْ أَبِي صَالِحٍ عَنْ أَبِي هُرَيْرَةَ قَالَ
قَالَ رَسُولُ اللَّهِ صَلَّى اللَّهُ عَلَيْهِ وَسَلَّمَ لَعَنَ اللَّهُ السَّارِقَ يَسْرِقُ الْبَيْضَةَ فَتُقْطَعُ يَدُهُ وَيَسْرِقُ الْحَبْلَ فَتُقْطَعُ يَدُهُ
حَدَّثَنَا عَمْرٌو النَّاقِدُ وَإِسْحَقُ بْنُ إِبْرَاهِيمَ وَعَلِيُّ بْنُ خَشْرَمٍ كُلُّهُمْ عَنْ عِيسَى بْنِ يُونُسَ عَنْ الْأَعْمَشِ بِهَذَا الْإِسْنَادِ مِثْلَهُ غَيْرَ أَنَّهُ يَقُولُ إِنْ سَرَقَ حَبْلًا وَإِنْ سَرَقَ بَيْضَةً",65
3196,30,"Telah menceritakan kepada kami [Qutaibah bin Sa'id] telah menceritakan kepada kami [Laits]. (dalam jalur lain disebutkan) Telah menceritakan kepada kami [Muhammad bin Rumh] telah mengabarkan kepada kami [Al Laits] dari [Ibnu Syihab] dari ['Urwah] dari ['Aisyah], bahwa orang-orang Quraisy merasa kebingungan dengan masalah seorang wanita Makhzumiyah yang ketahuan mencuri, lalu mereka berkata, ""Siapakah yang kiranya berani membicarakan hal ini kepada Rasulullah shallallahu 'alaihi wasallam?"" Maka mereka mengusulkan, ""Tidak ada yang berani melakukan hal ini kecuali Usamah, seorang yang dicintai oleh Rasulullah shallallahu 'alaihi wasallam."" Sesaat kemudian, Usamah mengadukan hal itu kepada beliau, maka Rasulullah shallallahu 'alaihi wasallam bersabda: ""Apakah kamu hendak memberi Syafa'at (keringanan) dalam hukum dari hukum-hukum Allah?"" Kemudian beliau berdiri dan berkhutbah, sabdanya: ""Wahai sekalian manusia, hanyasanya yang membinasakan orang-orang sebelum kalian adalah, ketika orang-orang terpandang mereka mencuri, mereka membiarkannya (tidak menghukum), sementara jika orang-orang yang rendahan dari mereka mencuri mereka menegakkan hukuman had. Demi Allah, sekiranya Fatimah binti Muhammad mencuri, sungguh aku sendiri yang akan memotong tangannya."" Dan dalam hadits Ibnu Rumh disebutkan, ""Hanyasanya yang menyebabkan kebinasaan orang-orang sebelum kalian.""","حَدَّثَنَا قُتَيْبَةُ بْنُ سَعِيدٍ حَدَّثَنَا لَيْثٌ ح و حَدَّثَنَا مُحَمَّدُ بْنُ رُمْحٍ أَخْبَرَنَا اللَّيْثُ عَنْ ابْنِ شِهَابٍ عَنْ عُرْوَةَ عَنْ عَائِشَةَ
أَنَّ قُرَيْشًا أَهَمَّهُمْ شَأْنُ الْمَرْأَةِ الْمَخْزُومِيَّةِ الَّتِي سَرَقَتْ فَقَالُوا مَنْ يُكَلِّمُ فِيهَا رَسُولَ اللَّهِ صَلَّى اللَّهُ عَلَيْهِ وَسَلَّمَ فَقَالُوا وَمَنْ يَجْتَرِئُ عَلَيْهِ إِلَّا أُسَامَةُ حِبُّ رَسُولِ اللَّهِ صَلَّى اللَّهُ عَلَيْهِ وَسَلَّمَ فَكَلَّمَهُ أُسَامَةُ فَقَالَ رَسُولُ اللَّهِ صَلَّى اللَّهُ عَلَيْهِ وَسَلَّمَ أَتَشْفَعُ فِي حَدٍّ مِنْ حُدُودِ اللَّهِ ثُمَّ قَامَ فَاخْتَطَبَ فَقَالَ أَيُّهَا النَّاسُ إِنَّمَا أَهْلَكَ الَّذِينَ قَبْلَكُمْ أَنَّهُمْ كَانُوا إِذَا سَرَقَ فِيهِمْ الشَّرِيفُ تَرَكُوهُ وَإِذَا سَرَقَ فِيهِمْ الضَّعِيفُ أَقَامُوا عَلَيْهِ الْحَدَّ وَايْمُ اللَّهِ لَوْ أَنَّ فَاطِمَةَ بِنْتَ مُحَمَّدٍ سَرَقَتْ لَقَطَعْتُ يَدَهَا
وَفِي حَدِيثِ ابْنِ رُمْحٍ إِنَّمَا هَلَكَ الَّذِينَ مِنْ قَبْلِكُمْ",65
