haditsId,kitabId,indo,arab,label
86,2,"Telah menceritakan kepadaku [Harmalah bin Yahya bin Abdullah bin Imran at-Tujibi] telah memberitakan kepada kami [Ibnu Wahab] dia berkata, telah mengabarkan kepada kami [Yunus] dari [Ibnu Syihab] dia berkata, saya mendengar [Abu Salamah bin Abdurrahman] dan [Sa'id bin al-Musayyab] keduanya berkata, [Abu Hurairah] berkata, ""Sesungguhnya Rasulullah shallallahu 'alaihi wasallam bersabda: ""Seorang mukmin tidak disebut mukmin saat ia berzina, seorang mukmin tidak disebut sebagai mukmin saat ia mencuri."" [Ibnu Syihab] berkata, telah mengabarkan kepadaku [Abdul Malik bin Abu Bakar bin Abdurrahman] bahwa [Abu Bakar] telah menceritakan kepada mereka dari [Abu Hurairah] kemudian dia berkata, ""Abu Hurairah mengikutkan dalam kalimat-kalimat (hadits) tersebut, 'Dan tidaklah orang yang mulia merampas yang karenanya manusia mengarahkan pandangannya kepada dirinya, saat melakukan (perampasan tersebut) ia disebut sebagai mukmin."" Dan telah menceritakan kepadaku [Abdul Malik bin Syu'aib bin al-Laits bin Sa'ad] dia berkata, telah menceritakan kepadaku [bapakku] dari [kakekku] dia berkata, telah menceritakan kepadaku [Uqail bin Khalid] dia berkata [Ibnu Syihab] berkata, telah mengabarkan kepadaku [Abu Bakar bin Abdurrahman bin al-Harits bin Hisyam] dari [Abu Hurairah] bahwa dia berkata, ""Sesungguhnya Rasulullah shallallahu 'alaihi wasallam bersabda: 'Tidaklah seorang pezina melakukan perzinaan… lalu dia meneruskan hadits tersebut seperti hadits di atas. Ia menyebutkan 'perampasan', namun tidak menyebutkan 'orang yang mulia'. [Ibnu Syihab] berkata, telah menceritakan kepadaku [Sa'id bin al-Musayyib] dan [Abu Salamah bin Abdurrahman] dari [Abu Hurairah] dari Rasulullah shallallahu 'alaihi wasallam dengan semisal hadits Abu Bakar ini, kecuali kalimat 'perampasan'."" Dan telah menceritakan kepadaku [Muhammad bin Mihran ar-Razi] dia berkata, telah mengabarkan kepada kami [Isa bin Yunus] telah menceritakan kepada kami [al-Auza'i] dari [az-Zuhri] dari [Ibnu al-Musayyab] dan [Abu Salamah] serta [Abu Bakar bin Abdurrahman bin al-Harits bin Hisyam] dari [Abu Hurairah] dari Nabi shallallahu 'alaihi wasallam dengan semisal hadits Uqail, dari az-Zuhri, dari Abu Bakar bin Abdurrahman, dari Abu Hurairah, dia menyebutkan 'perampasan' namun tidak menyebutkan 'orang yang mulia'."" Dan telah menceritakan kepadaku [Hasan bin Ali al-Hulwani] telah menceritakan kepada kami [Ya'qub bin Ibrahim] telah menceritakan kepada kami [Abdul Aziz bin al-Muththalib] dari [Shafwan bin Sulaim] dari [Atha' bin Yasar] mantan budak Maimunah, dan [Humaid bin Abdurrahman] dari [Abu Hurairah] dari Nabi shallallahu 'alaihi wasallam. (dalam riwayat lain disebutkan) Dan telah menceritakan kepada kami [Muhammad bin Rafi'] telah menceritakan kepada kami [Abdurrazzaq] telah mengabarkan kepada kami [Ma'mar] dari [Hammam bin Munabbih] dari [Abu Hurairah] dari Nabi shallallahu 'alaihi wasallam."" Telah menceritakan kepada kami [Qutaibah bin Sa'id] telah menceritakan kepada kami [Abdul Aziz] -yaitu ad-Darawardi- dari [al-Ala' bin Abdurrahman] dari [bapaknya] dari [Abu Hurairah] dari Nabi shallallahu 'alaihi wasallam, semua riwayat mereka seperti riwayat hadits az-Zuhri, hanya saja dalam hadits al-Ala' dan Shafwan bin Sulaim tidak ada kalimat 'orang-orang mengarahkan pandangannya kepadanya', sedangkan dalam hadits Hammam ada kalimat 'orang-orang mukmin mengarahkan pandangan kepadanya, sementara saat melakukannya ia disebut mukmin'. Dan dia menambahkan, 'Dan tidaklah salah seorang dari kalian berkhianat, saat melakukannya ia disebut mukmin. Maka hati-hatilah kalian.""","حَدَّثَنِي حَرْمَلَةُ بْنُ يَحْيَى بْنِ عَبْدِ اللَّهِ بْنِ عِمْرَانَ التُّجِيبِيُّ أَنْبَأَنَا ابْنُ وَهْبٍ قَالَ أَخْبَرَنِي يُونُسُ عَنْ ابْنِ شِهَابٍ قَالَ سَمِعْتُ أَبَا سَلَمَةَ بْنَ عَبْدِ الرَّحْمَنِ وَسَعِيدَ بْنَ الْمُسَيَّبِ يَقُولَانِ قَالَ أَبُو هُرَيْرَةَ
إِنَّ رَسُولَ اللَّهِ صَلَّى اللَّهُ عَلَيْهِ وَسَلَّمَ قَالَ لَا يَزْنِي الزَّانِي حِينَ يَزْنِي وَهُوَ مُؤْمِنٌ وَلَا يَسْرِقُ السَّارِقُ حِينَ يَسْرِقُ وَهُوَ مُؤْمِنٌ وَلَا يَشْرَبُ الْخَمْرَ حِينَ يَشْرَبُهَا وَهُوَ مُؤْمِنٌ
قَالَ ابْنُ شِهَابٍ فَأَخْبَرَنِي عَبْدُ الْمَلِكِ بْنُ أَبِي بَكْرِ بْنِ عَبْدِ الرَّحْمَنِ أَنَّ أَبَا بَكْرٍ كَانَ يُحَدِّثُهُمْ هَؤُلَاءِ عَنْ أَبِي هُرَيْرَةَ ثُمَّ يَقُولُا وَكَانَ أَبُو هُرَيْرَةَ يُلْحِقُ مَعَهُنَّ وَلَا يَنْتَهِبُ نُهْبَةً ذَاتَ شَرَفٍ يَرْفَعُ النَّاسُ إِلَيْهِ فِيهَا أَبْصَارَهُمْ حِينَ يَنْتَهِبُهَا وَهُوَ مُؤْمِنٌ و حَدَّثَنِي عَبْدُ الْمَلِكِ بْنُ شُعَيْبِ بْنِ اللَّيْثِ بْنِ سَعْدٍ قَالَ حَدَّثَنِي أَبِي عَنْ جَدِّي قَالَ حَدَّثَنِي عُقَيْلُ بْنُ خَالِدٍ قَالَ قَالَ ابْنُ شِهَابٍ أَخْبَرَنِي أَبُو بَكْرِ بْنُ عَبْدِ الرَّحْمَنِ بْنِ الْحَارِثِ بْنِ هِشَامٍ عَنْ أَبِي هُرَيْرَةَ أَنَّهُ قَالَ إِنَّ رَسُولَ اللَّهِ صَلَّى اللَّهُ عَلَيْهِ وَسَلَّمَ قَالَ لَا يَزْنِي الزَّانِي وَاقْتَصَّ الْحَدِيثَ بِمِثْلِهِ يَذْكُرُ مَعَ ذِكْرِ النُّهْبَةِ وَلَمْ يَذْكُرْ ذَاتَ شَرَفٍ قَالَ ابْنُ شِهَابٍ حَدَّثَنِي سَعِيدُ بْنُ الْمُسَيَّبِ وَأَبُو سَلَمَةَ بْنُ عَبْدِ الرَّحْمَنِ عَنْ أَبِي هُرَيْرَةَ عَنْ رَسُولِ اللَّهِ صَلَّى اللَّهُ عَلَيْهِ وَسَلَّمَ بِمِثْلِ حَدِيثِ أَبِي بَكْرٍ هَذَا إِلَّا النُّهْبَةَ و حَدَّثَنِي مُحَمَّدُ بْنُ مِهْرَانَ الرَّازِيُّ قَالَ أَخْبَرَنِي عِيسَى بْنُ يُونُسَ حَدَّثَنَا الْأَوْزَاعِيُّ عَنْ الزُّهْرِيِّ عَنْ ابْنِ الْمُسَيَّبِ وَأَبِي سَلَمَةَ وَأَبِي بَكْرِ بْنِ عَبْدِ الرَّحْمَنِ بْنِ الْحَارِثِ بْنِ هِشَامٍ عَنْ أَبِي هُرَيْرَةَ عَنْ النَّبِيِّ صَلَّى اللَّهُ عَلَيْهِ وَسَلَّمَ بِمِثْلِ حَدِيثِ عُقَيْلٍ عَنْ الزُّهْرِيِّ عَنْ أَبِي بَكْرِ بْنِ عَبْدِ الرَّحْمَنِ عَنْ أَبِي هُرَيْرَةَ وَذَكَرَ النُّهْبَةَ وَلَمْ يَقُلْ ذَاتَ شَرَفٍ و حَدَّثَنِي حَسَنُ بْنُ عَلِيٍّ الْحُلْوَانِيُّ حَدَّثَنَا يَعْقُوبُ بْنُ إِبْرَاهِيمَ حَدَّثَنَا عَبْدُ الْعَزِيزِ بْنُ الْمُطَّلِبِ عَنْ صَفْوَانَ بْنِ سُلَيْمٍ عَنْ عَطَاءِ بْنِ يَسَارٍ مَوْلَى مَيْمُونَةَ وَحُمَيْدِ بْنِ عَبْدِ الرَّحْمَنِ عَنْ أَبِي هُرَيْرَةَ عَنْ النَّبِيِّ صَلَّى اللَّهُ عَلَيْهِ وَسَلَّمَ ح و حَدَّثَنَا مُحَمَّدُ بْنُ رَافِعٍ حَدَّثَنَا عَبْدُ الرَّزَّاقِ أَخْبَرَنَا مَعْمَرٌ عَنْ هَمَّامِ بْنِ مُنَبِّهٍ عَنْ أَبِي هُرَيْرَةَ عَنْ النَّبِيِّ صَلَّى اللَّهُ عَلَيْهِ وَسَلَّمَ حَدَّثَنَا قُتَيْبَةُ بْنُ سَعِيدٍ حَدَّثَنَا عَبْدُ الْعَزِيزِ يَعْنِي الدَّرَاوَرْدِيَّ عَنْ الْعَلَاءِ بْنِ عَبْدِ الرَّحْمَنِ عَنْ أَبِيهِ عَنْ أَبِي هُرَيْرَةَ عَنْ النَّبِيِّ صَلَّى اللَّهُ عَلَيْهِ وَسَلَّمَ كُلُّ هَؤُلَاءِ بِمِثْلِ حَدِيثِ الزُّهْرِيِّ غَيْرَ أَنَّ الْعَلَاءَ وَصَفْوَانَ بْنَ سُلَيْمٍ لَيْسَ فِي حَدِيثِهِمَا يَرْفَعُ النَّاسُ إِلَيْهِ فِيهَا أَبْصَارَهُمْ وَفِي حَدِيثِ هَمَّامٍ يَرْفَعُ إِلَيْهِ الْمُؤْمِنُونَ أَعْيُنَهُمْ فِيهَا وَهُوَ حِينَ يَنْتَهِبُهَا مُؤْمِنٌ وَزَادَ وَلَا يَغُلُّ أَحَدُكُمْ حِينَ يَغُلُّ وَهُوَ مُؤْمِنٌ فَإِيَّاكُمْ إِيَّاكُمْ",65
137,2,"Dan telah menceritakan kepada kami [Muhammad bin al-Mutsanna] dan [Ibnu Basysyar], [Ibnu al-Mutsanna] berkata, telah menceritakan kepada kami [Muhammad bin Ja'far] telah menceritakan kepada kami [Syu'bah] dari [Washil al-Ahdab] dari [al-Ma'rur bin Suwaid] dia berkata, ""Saya mendengar [Abu Dzar] menceritakan dari Nabi shallallahu 'alaihi wasallam, bahwa beliau bersabda: ""Jibril Alaihissalam mendatangiku lalu memberikan kabar gembira kepadaku, bahwa orang yang meninggal dari umatmu dalam keadaan tidak mensyirikkan Allah dengan sesuatu apa pun niscaya masuk surga."" Maka aku bertanya: ""Meskipun dia berzina dan mencuri?"" Jibril menjawab, ""Walaupun dia berzina dan mencuri.""","و حَدَّثَنَا مُحَمَّدُ بْنُ الْمُثَنَّى وَابْنُ بَشَّارٍ قَالَ ابْنُ الْمُثَنَّى حَدَّثَنَا مُحَمَّدُ بْنُ جَعْفَرٍ حَدَّثَنَا شُعْبَةُ عَنْ وَاصِلٍ الْأَحْدَبِ عَنْ الْمَعْرُورِ بْنِ سُوَيْدٍ قَالَ سَمِعْتُ أَبَا ذَرٍّ يُحَدِّثُ
عَنْ النَّبِيِّ صَلَّى اللَّهُ عَلَيْهِ وَسَلَّمَ أَنَّهُ قَالَ أَتَانِي جِبْرِيلُ عَلَيْهِ السَّلَام فَبَشَّرَنِي أَنَّهُ مَنْ مَاتَ مِنْ أُمَّتِكَ لَا يُشْرِكُ بِاللَّهِ شَيْئًا دَخَلَ الْجَنَّةَ قُلْتُ وَإِنْ زَنَى وَإِنْ سَرَقَ قَالَ وَإِنْ زَنَى وَإِنْ سَرَقَ",65
138,2,"Telah menceritakan kepada kami [Zuhair bin Harb] dan [Ahmad bin Khirasy] keduanya berkata, telah menceritakan kepada kami [Abd ash-Shamad bin Abd al-Warits] telah menceritakan kepada kami [bapakku] dia berkata, telah menceritakan kepada kami [Husain al-Mu'allim] dari [Ibnu Buraidah] bahwa [Yahya bin Ya'mar] telah menceritakan kepadanya, bahwa [Abu al-Aswad ad-Dailami] telah menceritakan kepadanya, bahwa [Abu Dzar] telah menceritakan kepadanya, dia berkata, ""Aku mendatangi Nabi shallallahu 'alaihi wasallam yang saat itu sedang tidur, dan beliau saat itu memakai baju putih. Kemudian saat aku mendatanginya (lagi), beliau masih tidur, kemudian ketika aku mendatanginya lagi beliau telah bangun. aku lantas duduk dengan menghadap ke arahnya, beliau lantas bersabda: ""Tidaklah seorang hamba mengatakan, 'Tidak ada tuhan (yang berhak disembah) selain Allah', kemudian dia meninggal dengan berpegang teguh pada hal tersebut, melainkan dia pasti masuk surga.' Aku bertanya, 'Walaupun dia berzina dan mencuri.' Beliau menjawab: 'Walaupun dia berzina dan mencuri.' Aku bertanya, 'Walaupun dia berzina dan mencuri.' Beliau menjawab: 'Walaupun dia berzina dan mencuri.' Tiga kali. Kemudian pada kali keempatnya beliau berkata: 'Meskipun Abu Dzar kurang setuju.' Perawi berkata, ""Abu Dzar pun keluar, sedangkan dia berkata, 'Meskipun Abu Dzar kurang setuju.""","حَدَّثَنِي زُهَيْرُ بْنُ حَرْبٍ وَأَحْمَدُ بْنُ خِرَاشٍ قَالَا حَدَّثَنَا عَبْدُ الصَّمَدِ بْنُ عَبْدِ الْوَارِثِ حَدَّثَنَا أَبِي قَالَ حَدَّثَنِي حُسَيْنٌ الْمُعَلِّمُ عَنْ ابْنِ بُرَيْدَةَ أَنَّ يَحْيَى بْنَ يَعْمَرَ حَدَّثَهُ أَنَّ أَبَا الْأَسْوَدِ الدِّيلِيَّ حَدَّثَهُ أَنَّ أَبَا ذَرٍّ حَدَّثَهُ قَالَ
أَتَيْتُ النَّبِيَّ صَلَّى اللَّهُ عَلَيْهِ وَسَلَّمَ وَهُوَ نَائِمٌ عَلَيْهِ ثَوْبٌ أَبْيَضُ ثُمَّ أَتَيْتُهُ فَإِذَا هُوَ نَائِمٌ ثُمَّ أَتَيْتُهُ وَقَدْ اسْتَيْقَظَ فَجَلَسْتُ إِلَيْهِ فَقَالَ مَا مِنْ عَبْدٍ قَالَ لَا إِلَهَ إِلَّا اللَّهُ ثُمَّ مَاتَ عَلَى ذَلِكَ إِلَّا دَخَلَ الْجَنَّةَ قُلْتُ وَإِنْ زَنَى وَإِنْ سَرَقَ قَالَ وَإِنْ زَنَى وَإِنْ سَرَقَ قُلْتُ وَإِنْ زَنَى وَإِنْ سَرَقَ قَالَ وَإِنْ زَنَى وَإِنْ سَرَقَ ثَلَاثًا ثُمَّ قَالَ فِي الرَّابِعَةِ عَلَى رَغْمِ أَنْفِ أَبِي ذَرٍّ قَالَ فَخَرَجَ أَبُو ذَرٍّ وَهُوَ يَقُولُ وَإِنْ رَغِمَ أَنْفُ أَبِي ذَرٍّ",65
171,2,"Telah menceritakan kepada kami [Utsman bin Abu Syaibah] telah menceritakan kepada kami [Jarir] dari [Manshur] dari [Abu Wail] dari [Abdullah] dia berkata, ""Seseorang telah bertanya Rasulullah shallallahu 'alaihi wasallam, ""Wahai Rasulullah! Apakah kami akan dihukum karena perbuatan yang telah kami lakukan semasa Jahiliyah?"" Rasulullah shallallahu 'alaihi wasallam menjawab: ""Barangsiapa di antara kamu yang berbuat baik pada zaman Islam, maka dia tidak akan dikenakan hukuman karena perbuatannya pada zaman Jahiliyah. Tetapi barangsiapa yang berbuat kejahatan, maka dia akan dihukum karena perbuatannya pada zaman Jahiliyah dan pada zaman Islam.""","حَدَّثَنَا عُثْمَانُ بْنُ أَبِي شَيْبَةَ حَدَّثَنَا جَرِيرٌ عَنْ مَنْصُورٍ عَنْ أَبِي وَائِلٍ عَنْ عَبْدِ اللَّهِ قَالَ
قَالَ أُنَاسٌ لِرَسُولِ اللَّهِ صَلَّى اللَّهُ عَلَيْهِ وَسَلَّمَ يَا رَسُولَ اللَّهِ أَنُؤَاخَذُ بِمَا عَمِلْنَا فِي الْجَاهِلِيَّةِ قَالَ أَمَّا مَنْ أَحْسَنَ مِنْكُمْ فِي الْإِسْلَامِ فَلَا يُؤَاخَذُ بِهَا وَمَنْ أَسَاءَ أُخِذَ بِعَمَلِهِ فِي الْجَاهِلِيَّةِ وَالْإِسْلَامِ",65
536,4,"Berkata [Amru] dan telah menceritakan kepada kami [Sa'id bin Abi Hilal] dari [Abdullah bin Ubaidillah bin Abi Rafi'] dari [Abu Ghathafan] dari [Abu Rafi'] dia berkata, ""Saya bersaksi aku pernah membakar perut kambing untuk Rasulullah Shallallahu'alaihiwasallam, kemudian beliau shalat tanpa berwudhu lagi.""","قَالَ عَمْرٌو وَحَدَّثَنِي سَعِيدُ بْنُ أَبِي هِلَالٍ عَنْ عَبْدِ اللَّهِ بْنِ عُبَيْدِ اللَّهِ بْنِ أَبِي رَافِعٍ عَنْ أَبِي غَطَفَانَ عَنْ أَبِي رَافِعٍ قَالَ
أَشْهَدُ لَكُنْتُ أَشْوِي لِرَسُولِ اللَّهِ صَلَّى اللَّهُ عَلَيْهِ وَسَلَّمَ بَطْنَ الشَّاةِ ثُمَّ صَلَّى وَلَمْ يَتَوَضَّأْ",65
671,5,"Telah menceritakan kepada kami [Muhammad bin Hatim] dan [Ibnu Rafi'] keduanya berkata, telah menceritakan kepada kami [Syababah] telah menceritakan kepadaku [Warqa'] dari [Amru] dari [Mujahid] dari [Ibnu Umar] dia berkata, ""Rasulullah shallallahu 'alaihi wasallam bersabda, 'Berikanlah izin kepada wanita pada malam hari ke masjid.' Putranya, Waqid berkata kepadanya, 'Kalau dibolehkan, siapa tahu dijadikan kesempatan melakukan kejahatan'."" Perawi berkata, ""Lalu Ibn Umar memukul dada puteranya atas pembangkangannya. Dan dia berkata, 'Aku menceritakan kepadamu hadits dari Rasulullah Shallallahu'alaihiwasallam, namun kamu malahan mengatakan tidak'.""","حَدَّثَنَا مُحَمَّدُ بْنُ حَاتِمٍ وَابْنُ رَافِعٍ قَالَا حَدَّثَنَا شَبَابَةُ حَدَّثَنِي وَرْقَاءُ عَنْ عَمْرٍو عَنْ مُجَاهِدٍ عَنْ ابْنِ عُمَرَ قَالَ
قَالَ رَسُولُ اللَّهِ صَلَّى اللَّهُ عَلَيْهِ وَسَلَّمَ ائْذَنُوا لِلنِّسَاءِ بِاللَّيْلِ إِلَى الْمَسَاجِدِ
فَقَالَ ابْنٌ لَهُ يُقَالُ لَهُ وَاقِدٌ إِذَنْ يَتَّخِذْنَهُ دَغَلًا قَالَ فَضَرَبَ فِي صَدْرِهِ وَقَالَ أُحَدِّثُكَ عَنْ رَسُولِ اللَّهِ صَلَّى اللَّهُ عَلَيْهِ وَسَلَّمَ وَتَقُولُ لَا",65
1655,13,"Dan Telah menceritakan kepada kami [Qutaibah bin Sa'id] Telah menceritakan kepada kami [Jarir] dari [Abdul Aziz, yaitu putra Rufai'] dari [Zaid bin Wahb] dari [Abu Dzar] ia berkata; Padau suatu malam, saya keluar, tiba-tiba saya mendapati Rasulullah shallallahu 'alaihi wasallam sedang berjalan sendirian tanpa ditemani seorang pun. Maka saya pun mengira bahwa beliau tidak suka kalau ada orang lain yang ikut berjalan bersamanya. Maka saya pun berjalan di bawah naungan bulan, lalu beliau menoleh dan melihatku, maka beliau pun bertanya: ""Siapa ini?"" saya menjawab, ""Abu Dzar, semoga Allah menjadikanku sebagai tebusan untuk Anda."" Beliau bersabda: ""Wahai Abu Dzar, kemarilah."" Maka saya pun berjalan bersama beliau sesaat, kemudian beliau bersabda: ""Sesungguhnya orang-orang yang suka menumpuk-numpuk (harta), nantinya pada hari kiamat mereka termasuk orang-orang yang penuh dengan kekurangan. Kecuali mereka yang diberikan kebaikan oleh Allah -beliau kemudian seperti memberi ke sebelah kanannya, kirinya dan ke arah depan serta belakangnya- kemudian ia mengelolanya dengan baik."" Setelah itu, kami pun berjalan sesaat. Kemudian beliau bersabda: ""Duduklah di sini."" Maka beliau menempatkanku di tempat yang luas dan datar serta dikelilingi oleh bebatuan. Kemudian beliau berpesan lagi: ""Duduklah di sini hingga aku kembali menemuimu."" Kemudian beliau segera pergi ke hurrah (tanah yang tidak berpasir) hingga aku tidak lagi melihatnya. Setelah lama kemudian, saya mendengarnya bertanya: ""Meskipun ia pernah mencuri dan berzina?"" Maka ketika beliau kembali dengan tidak sabar saya pun segera bertanya, ""Wahai Nabiyullah, semoga Allah menjadikanku sebagi tebusanmu, siapa yang Anda ajak bicara di samping tanah yang tak berpasir? Saya mendengar tida ada seorang pun yang menjawab pertanyaan Anda."" Beliau menjawab: ""Itu adalah Jibril, ia menemuiku di samping tanah yang tak berpasir seraya berkata, 'Berilah kabar gembira kepada umatmu, bahwa barangsiapa di antara mereka yang mati dengan tidak menyekutukan Allah dengan sesuatu pun, niscaya dia akan masuk surga.' Maka saya pun bertanya, 'Wahai Jibril, meskipun ia pernah mencuri dan berzina? ' ia menjawab, 'Ya, meskipun ia pernah mencuri dan berzina.' Saya bertanya lagi, 'Meskipun ia pernah mencuri dan berzina? ' ia menjawab, 'Ya, meskipun ia pernah mencuri dan berzina.' Saya bertanya lagi, 'Meskipun ia pernah mencuri dan berzina? ' ia menjawab, 'Ya, meskipun ia pernah mencuri dan meminum khamer.'""","و حَدَّثَنَا قُتَيْبَةُ بْنُ سَعِيدٍ حَدَّثَنَا جَرِيرٌ عَنْ عَبْدِ الْعَزِيزِ وَهُوَ ابْنُ رُفَيْعٍ عَنْ زَيْدِ بْنِ وَهْبٍ عَنْ أَبِي ذَرٍّ قَالَ
خَرَجْتُ لَيْلَةً مِنْ اللَّيَالِي فَإِذَا رَسُولُ اللَّهِ صَلَّى اللَّهُ عَلَيْهِ وَسَلَّمَ يَمْشِي وَحْدَهُ لَيْسَ مَعَهُ إِنْسَانٌ قَالَ فَظَنَنْتُ أَنَّهُ يَكْرَهُ أَنْ يَمْشِيَ مَعَهُ أَحَدٌ قَالَ فَجَعَلْتُ أَمْشِي فِي ظِلِّ الْقَمَرِ فَالْتَفَتَ فَرَآنِي فَقَالَ مَنْ هَذَا فَقُلْتُ أَبُو ذَرٍّ جَعَلَنِي اللَّهُ فِدَاءَكَ قَالَ يَا أَبَا ذَرٍّ تَعَالَهْ قَالَ فَمَشَيْتُ مَعَهُ سَاعَةً فَقَالَ إِنَّ الْمُكْثِرِينَ هُمْ الْمُقِلُّونَ يَوْمَ الْقِيَامَةِ إِلَّا مَنْ أَعْطَاهُ اللَّهُ خَيْرًا فَنَفَحَ فِيهِ يَمِينَهُ وَشِمَالَهُ وَبَيْنَ يَدَيْهِ وَوَرَاءَهُ وَعَمِلَ فِيهِ خَيْرًا قَالَ فَمَشَيْتُ مَعَهُ سَاعَةً فَقَالَ اجْلِسْ هَا هُنَا قَالَ فَأَجْلَسَنِي فِي قَاعٍ حَوْلَهُ حِجَارَةٌ فَقَالَ لِي اجْلِسْ هَا هُنَا حَتَّى أَرْجِعَ إِلَيْكَ قَالَ فَانْطَلَقَ فِي الْحَرَّةِ حَتَّى لَا أَرَاهُ فَلَبِثَ عَنِّي فَأَطَالَ اللَّبْثَ ثُمَّ إِنِّي سَمِعْتُهُ وَهُوَ مُقْبِلٌ وَهُوَ يَقُولُ وَإِنْ سَرَقَ وَإِنْ زَنَى قَالَ فَلَمَّا جَاءَ لَمْ أَصْبِرْ فَقُلْتُ يَا نَبِيَّ اللَّهِ جَعَلَنِي اللَّهُ فِدَاءَكَ مَنْ تُكَلِّمُ فِي جَانِبِ الْحَرَّةِ مَا سَمِعْتُ أَحَدًا يَرْجِعُ إِلَيْكَ شَيْئًا قَالَ ذَاكَ جِبْرِيلُ عَرَضَ لِي فِي جَانِبِ الْحَرَّةِ فَقَالَ بَشِّرْ أُمَّتَكَ أَنَّهُ مَنْ مَاتَ لَا يُشْرِكُ بِاللَّهِ شَيْئًا دَخَلَ الْجَنَّةَ فَقُلْتُ يَا جِبْرِيلُ وَإِنْ سَرَقَ وَإِنْ زَنَى قَالَ نَعَمْ قَالَ قُلْتُ وَإِنْ سَرَقَ وَإِنْ زَنَى قَالَ نَعَمْ قَالَ قُلْتُ وَإِنْ سَرَقَ وَإِنْ زَنَى قَالَ نَعَمْ وَإِنْ شَرِبَ الْخَمْرَ",65
2612,17,"Dan telah menceritakan kepada kami [Khalaf bin Hisyam] telah menceritakan kepada kami [Malik bin Anas]. Dan dari jalur lain, telah menceritakan kepada kami [Yahya bin Yahya] sedangkan lafazhnya dari dia (Yahya) dia berkata; Saya membaca di depan [Malik] dari [Muhammad bin Abdurrahman bin Naufal] dari [Urwah] dari [Aisyah] dari [Judamah binti Wahb Al Asadiyyah] bahwa dia mendengar Rasulullah shallallahu 'alaihi wasallam bersabda: ""Sesungguhnya saya bertekad untuk melarang ghilah (yaitu menyetubuhi istri yang sedang menyusui anak), akan tetapi saya perhatikan orang-orang romawi dan Persia melakukan ghilah, namun hal itu tidak membahayakan anak-anak mereka."" Muslim berkata; Khalaf mengatakan; Dari Judzamah (dengan dzal), namun yang shahih adalah yang dikatakan Yahya, yaitu dengan dal (Judamah).","و حَدَّثَنَا خَلَفُ بْنُ هِشَامٍ حَدَّثَنَا مَالِكُ بْنُ أَنَسٍ ح و حَدَّثَنَا يَحْيَى بْنُ يَحْيَى وَاللَّفْظُ لَهُ قَالَ قَرَأْتُ عَلَى مَالِكٍ عَنْ مُحَمَّدِ بْنِ عَبْدِ الرَّحْمَنِ بْنِ نَوْفَلٍ عَنْ عُرْوَةَ عَنْ عَائِشَةَ عَنْ جُدَامَةَ بِنْتِ وَهْبٍ الْأَسَدِيَّةِ
أَنَّهَا سَمِعَتْ رَسُولَ اللَّهِ صَلَّى اللَّهُ عَلَيْهِ وَسَلَّمَ يَقُولُ لَقَدْ هَمَمْتُ أَنْ أَنْهَى عَنْ الْغِيلَةِ حَتَّى ذَكَرْتُ أَنَّ الرُّومَ وَفَارِسَ يَصْنَعُونَ ذَلِكَ فَلَا يَضُرُّ أَوْلَادَهُمْ
قَالَ مُسْلِم وَأَمَّا خَلَفٌ فَقَالَ عَنْ جُذَامَةَ الْأَسَدِيَّةِ وَالصَّحِيحُ مَا قَالَهُ يَحْيَى بِالدَّالِ",65
