haditsId,kitabId,indo,arab,label
3199,30,"Telah menceritakan kepada kami [Yahya bin Yahya At Tamimi] telah mengabarkan kepada kami [Husyaim] dari [Manshur] dari [Al Hasan] dari [Hitthan bin Abdullah Ar Raqasyi] dari ['Ubadah bin Shamit] dia berkata, ""Rasulullah shallallahu 'alaihi wasallam bersabda: ""Ikutilah semua ajaranku, ikutilah semua ajaranku. Sungguh, Allah telah menetapkan hukuman bagi mereka (kaum wanita), perjaka dengan perawan hukumannya adalah cambuk seratus kali dan diasingkan selama setahun, sedangkan laki-laki dan wanita yang sudah menikah hukumannya adalah dera seratus kali dan dirajam."" Dan telah menceritakan kepada kami ['Amru An Naqid] telah menceritakan kepada kami [Husyaim] telah mengabarkan kepada kami [Manshur] dengan isnad seperti ini.""","و حَدَّثَنَا يَحْيَى بْنُ يَحْيَى التَّمِيمِيُّ أَخْبَرَنَا هُشَيْمٌ عَنْ مَنْصُورٍ عَنْ الْحَسَنِ عَنْ حِطَّانَ بْنِ عَبْدِ اللَّهِ الرَّقَاشِيِّ عَنْ عُبَادَةَ بْنِ الصَّامِتِ قَالَ
قَالَ رَسُولُ اللَّهِ صَلَّى اللَّهُ عَلَيْهِ وَسَلَّمَ خُذُوا عَنِّي خُذُوا عَنِّي قَدْ جَعَلَ اللَّهُ لَهُنَّ سَبِيلًا الْبِكْرُ بِالْبِكْرِ جَلْدُ مِائَةٍ وَنَفْيُ سَنَةٍ وَالثَّيِّبُ بِالثَّيِّبِ جَلْدُ مِائَةٍ وَالرَّجْمُ
و حَدَّثَنَا عَمْرٌو النَّاقِدُ حَدَّثَنَا هُشَيْمٌ أَخْبَرَنَا مَنْصُورٌ بِهَذَا الْإِسْنَادِ مِثْلَهُ",65
3201,30,"Telah menceritakan kepada kami [Abu At Thahir] dan [Harmalah bin Yahya] keduanya berkata; telah menceritakan kepada kami [Ibnu Wahb] telah menceritakan kepadaku [Yunus] dari [Ibnu Syihab] dia berkata; telah menceritakan kepadaku [Ubaidullah bin Abdullah bin 'Utbah] bahwa dia pernah mendengar [Abdullah bin Abbas] berkata, "" [Umar bin Khattab] berkata sambil duduk di atas mimbar Rasulullah shallallahu 'alaihi wasallam, ""Sesungguhnya Allah telah mengutus Muhammad shallallahu 'alaihi wasallam dengan kebenaran, dan Dia juga telah menurunkan kitab kepadanya, di antara ayat yang diturunkan kepadanya, yang kita semua telah membacanya, mempelajari dan berusaha memahaminya adalah ayat tentang rajam. Rasulullah shallallahu 'alaihi wasallam telah melaksanakan hukuman rajam tersebut, begitu juga kita akan tetap melaksanakan hukum tersebut setelah kepergian beliau. Aku khawatir, jika semakin lama, maka akan ada yang berkata, 'Di dalam al Qur'an tidak kita dapati ayat mengenai hukum rajam'. Lantas mereka tersesat karena meninggalkan hukum wajib itu yang telah diturunkan oleh Allah Ta'la. Sesungguhnya hukuman rajam yang terdapat dalam kitabullah, wajib dijalankan atas orang laki-laki dan perempuan yang telah menikah melakukan perzinahan apabila ada saksi, ada bukti dan juga ada pengakuan."" Dan telah menceritakan kepada kami [Abu Bakar bin Abu Syaibah] dan [Zuhair bin Harb] dan [Ibnu Abu Umar] mereka berkata; telah menceritakan kepada kami [Sufyan] dari [Az Zuhri] dengan isnad ini.""","حَدَّثَنِي أَبُو الطَّاهِرِ وَحَرْمَلَةُ بْنُ يَحْيَى قَالَا حَدَّثَنَا ابْنُ وَهْبٍ أَخْبَرَنِي يُونُسُ عَنْ ابْنِ شِهَابٍ قَالَ أَخْبَرَنِي عُبَيْدُ اللَّهِ بْنُ عَبْدِ اللَّهِ بْنِ عُتْبَةَ أَنَّهُ سَمِعَ عَبْدَ اللَّهِ بْنَ عَبَّاسٍ يَقُولُ قَالَ عُمَرُ بْنُ الْخَطَّابِ وَهُوَ جَالِسٌ عَلَى مِنْبَرِ رَسُولِ اللَّهِ صَلَّى اللَّهُ عَلَيْهِ وَسَلَّمَ
إِنَّ اللَّهَ قَدْ بَعَثَ مُحَمَّدًا صَلَّى اللَّهُ عَلَيْهِ وَسَلَّمَ بِالْحَقِّ وَأَنْزَلَ عَلَيْهِ الْكِتَابَ فَكَانَ مِمَّا أُنْزِلَ عَلَيْهِ آيَةُ الرَّجْمِ قَرَأْنَاهَا وَوَعَيْنَاهَا وَعَقَلْنَاهَا فَرَجَمَ رَسُولُ اللَّهِ صَلَّى اللَّهُ عَلَيْهِ وَسَلَّمَ وَرَجَمْنَا بَعْدَهُ فَأَخْشَى إِنْ طَالَ بِالنَّاسِ زَمَانٌ أَنْ يَقُولَ قَائِلٌ مَا نَجِدُ الرَّجْمَ فِي كِتَابِ اللَّهِ فَيَضِلُّوا بِتَرْكِ فَرِيضَةٍ أَنْزَلَهَا اللَّهُ وَإِنَّ الرَّجْمَ فِي كِتَابِ اللَّهِ حَقٌّ عَلَى مَنْ زَنَى إِذَا أَحْصَنَ مِنْ الرِّجَالِ وَالنِّسَاءِ إِذَا قَامَتْ الْبَيِّنَةُ أَوْ كَانَ الْحَبَلُ أَوْ الِاعْتِرَافُ
و حَدَّثَنَاه أَبُو بَكْرِ بْنُ أَبِي شَيْبَةَ وَزُهَيْرُ بْنُ حَرْبٍ وَابْنُ أَبِي عُمَرَ قَالُوا حَدَّثَنَا سُفْيَانُ عَنْ الزُّهْرِيِّ بِهَذَا الْإِسْنَادِ",65
3214,30,"Dan telah menceritakan kepada kami [Abu Kamil Al Jahdari] telah menceritakan kepada kami [Abdul Wahid] telah menceritakan kepada kami [Sulaiman Asy Syaibani] dia berkata; aku bertanya kepada [Abdullah bin Abu Aufa]. (dalam jalur lain disebutkan) Telah menceritakan kepada kami [Abu Bakar bin Abu Syaibah] sedangkan lafadznya dari dia, telah menceritakan kepada kami [Ali bin Mushir] dari [Abu Ishaq Asy Syaibani] dia berkata; aku pernah bertanya kepada [Abdullah bin Abu Aufa], ""Apakah Rasulullah shallallahu 'alaihi wasallam pernah melaksanakan hukuman rajam?"" dia menjawab, ""Ya, benar."" Aku bertanya, ""Apakah beliau melakukan hal itu setelah turunnya surat An Nuur atau sebelumnya?"" dia menjawab, ""Aku tidak tahu.""","و حَدَّثَنَا أَبُو كَامِلٍ الْجَحْدَرِيُّ حَدَّثَنَا عَبْدُ الْوَاحِدِ حَدَّثَنَا سُلَيْمَانُ الشَّيْبَانِيُّ قَالَ سَأَلْتُ عَبْدَ اللَّهِ بْنَ أَبِي أَوْفَى ح و حَدَّثَنَا أَبُو بَكْرِ بْنُ أَبِي شَيْبَةَ وَاللَّفْظُ لَهُ حَدَّثَنَا عَلِيُّ بْنُ مُسْهِرٍ عَنْ أَبِي إِسْحَقَ الشَّيْبَانِيِّ قَالَ
سَأَلْتُ عَبْدَ اللَّهِ بْنَ أَبِي أَوْفَى هَلْ رَجَمَ رَسُولُ اللَّهِ صَلَّى اللَّهُ عَلَيْهِ وَسَلَّمَ قَالَ نَعَمْ قَالَ قُلْتُ بَعْدَ مَا أُنْزِلَتْ سُورَةُ النُّورِ أَمْ قَبْلَهَا قَالَ لَا أَدْرِي",65
3218,30,"Telah menceritakan kepada kami [Muhammad bin Al Mutsanna] dan [Muhammad bin Basyar] keduanya berkata; telah menceritakan kepada kami [Muhammad bin Ja'far] telah menceritakan kepada kami [Syu'bah] dia berkata; aku pernah mendengar [Qatadah] menceritakan dari [Anas bin Malik], bahwa Nabi shallallahu 'alaihi wasallam pernah dihadapkan seorang laki-laki yang terbukti meminum khamer, lalu beliau menderanya dengan dua pelepah kurma sebanyak empat puluh kali, hal itu juga dilakukan oleh Abu Bakar. Ketika pada masa pemerintahan Umar, maka ia minta pendapat kepada orang-orang. Abdurrahman berkata, ""Hukuman dera yang paling ringan adalah delapan puluh kali."" Lantas Umar memutuskannya seperti itu."" Telah menceritakan kepada kami [Yahya bin Habib Al Haritsi] telah menceritakan kepada kami [Khalid] -yaitu Ibnu Harits- telah menceritakan kepada kami [Syu'bah] telah menceritakan kepada kami [Qatadah] dia berkata; aku pernah mendengar [Anas] berkata, ""Suatu ketika, seorang laki-laki dihadapkan kepada Rasulullah shallallahu 'alaihi wasallam …lalu dia menyebutkan hadits semisalnya.""","حَدَّثَنَا مُحَمَّدُ بْنُ الْمُثَنَّى وَمُحَمَّدُ بْنُ بَشَّارٍ قَالَا حَدَّثَنَا مُحَمَّدُ بْنُ جَعْفَرٍ حَدَّثَنَا شُعْبَةُ قَالَ سَمِعْتُ قَتَادَةَ يُحَدِّثُ عَنْ أَنَسِ بْنِ مَالِكٍ
أَنَّ النَّبِيَّ صَلَّى اللَّهُ عَلَيْهِ وَسَلَّمَ أُتِيَ بِرَجُلٍ قَدْ شَرِبَ الْخَمْرَ فَجَلَدَهُ بِجَرِيدَتَيْنِ نَحْوَ أَرْبَعِينَ
قَالَ وَفَعَلَهُ أَبُو بَكْرٍ فَلَمَّا كَانَ عُمَرُ اسْتَشَارَ النَّاسَ فَقَالَ عَبْدُ الرَّحْمَنِ أَخَفَّ الْحُدُودِ ثَمَانِينَ فَأَمَرَ بِهِ عُمَرُ و حَدَّثَنَا يَحْيَى بْنُ حَبِيبٍ الْحَارِثِيُّ حَدَّثَنَا خَالِدٌ يَعْنِي ابْنَ الْحَارِثِ حَدَّثَنَا شُعْبَةُ حَدَّثَنَا قَتَادَةُ قَالَ سَمِعْتُ أَنَسًا يَقُولُا أُتِيَ رَسُولُ اللَّهِ صَلَّى اللَّهُ عَلَيْهِ وَسَلَّمَ بِرَجُلٍ فَذَكَرَ نَحْوَهُ",65
3219,30,"Telah menceritakan kepada kami [Muhammad bin Al Mutsanna] telah menceritakan kepada kami [Mu'adz bin Hisyam] telah menceritakan kepadaku [ayahku] dari [Qatadah] dari [Anas bin Malik], bahwa Nabi Allah shallallahu 'alaihi wasallam pernah mendera terhadap orang yang meminum khamer dengan pelepah kurma dan terompah (sebanyak empat puluh kali), kemudian (masa pemerintahan) Abu Bakar juga menderanya sebanyak empat puluh kali. Ketika pemerintahannya Umar, maka orang-orang semakin banyak yang tinggal di daerah pelosok-pelosok dan di daerah pedesaan. Karena itu Umar bertanya, ""Bagaimana pendapat kalian mengenai hukuman dera bagi peminum khamer?"" maka Abdurrahman bin Auf berkata, ""Aku berpendapat bahwa seringan-ringannya hukuman adalah delapan puluh kali dera."" Anas berkata, ""Lantas Umar melaksanakan hukuman dera sebanyak empat puluh kali."" Telah menceritakan kepada kami [Muhammad bin Al Mutsanna] telah menceritakan kepada kami [Yahya bin Sa'id] telah menceritakan kepada kami [Hisyam] dengan isnad seperti ini."" Dan telah menceritakan kepada kami [Abu Bakar bin Abu Syaibah] telah menceritakan kepada kami [Waki'] dari [Hisyam] dari [Qatadah] dari [Anas] bahwa Nabi shallallahu 'alaihi wasallam pernah mendera peminum khamer dengan menggunakan terompah dan pelepah kurma sebanyak empat puluh kali. Kemudian dia menyebutkan seperti hadits keduanya, dan dia tidak menyebutkan, ""Daerah pelosok-pelosok dan daerah pedesaan.""","حَدَّثَنَا مُحَمَّدُ بْنُ الْمُثَنَّى حَدَّثَنَا مُعَاذُ بْنُ هِشَامٍ حَدَّثَنِي أَبِي عَنْ قَتَادَةَ عَنْ أَنَسِ بْنِ مَالِكٍ
أَنَّ نَبِيَّ اللَّهِ صَلَّى اللَّهُ عَلَيْهِ وَسَلَّمَ جَلَدَ فِي الْخَمْرِ بِالْجَرِيدِ وَالنِّعَالِ
ثُمَّ جَلَدَ أَبُو بَكْرٍ أَرْبَعِينَ فَلَمَّا كَانَ عُمَرُ وَدَنَا النَّاسُ مِنْ الرِّيفِ وَالْقُرَى قَالَ مَا تَرَوْنَ فِي جَلْدِ الْخَمْرِ فَقَالَ عَبْدُ الرَّحْمَنِ بْنُ عَوْفٍ أَرَى أَنْ تَجْعَلَهَا كَأَخَفِّ الْحُدُودِ قَالَ فَجَلَدَ عُمَرُ ثَمَانِينَ و حَدَّثَنَا مُحَمَّدُ بْنُ الْمُثَنَّى حَدَّثَنَا يَحْيَى بْنُ سَعِيدٍ حَدَّثَنَا هِشَامٌ بِهَذَا الْإِسْنَادِ مِثْلَهُ و حَدَّثَنَا أَبُو بَكْرِ بْنُ أَبِي شَيْبَةَ حَدَّثَنَا وَكِيعٌ عَنْ هِشَامٍ عَنْ قَتَادَةَ عَنْ أَنَسٍ أَنَّ النَّبِيَّ صَلَّى اللَّهُ عَلَيْهِ وَسَلَّمَ كَانَ يَضْرِبُ فِي الْخَمْرِ بِالنِّعَالِ وَالْجَرِيدِ أَرْبَعِينَ ثُمَّ ذَكَرَ نَحْوَ حَدِيثِهِمَا وَلَمْ يَذْكُرْ الرِّيفَ وَالْقُرَى",65
3220,30,"Telah menceritakan kepada kami [Abu Bakar bin Abu Syaibah] dan [Zuhair bin Harb] dan [Ali bin Hujr] mereka berkata; telah menceritakan kepada kami [Isma'il] -yaitu Ibnu Ulayyah- dari [Ibnu Abu 'Arubah] dari [Abdullah Ad Danaj]. (dalam jalur lain disebutkan) Telah menceritakan kepada kami [Ishaq bin Ibrahim Al Hanzhali] sedangkan lafadznya dari dia, telah mengabarkan kepada kami [Yahya bin Hammad] telah menceritakan kepada kami [Abdul Aziz bin Mukhtar] telah menceritakan kepada kami [Abdullah bin Fairuz] bekas budak Ibnu 'Amir Ad Dannaj, telah menceritakan kepada kami [Hudlain bin Mundzir Abu Sasan] dia berkata, ""Aku pernah melihat Al Walid dihadapkan kepada 'Utsman bin Affan, setelah melaksanakan shalat subuh dua rakaat, Utsman lalu berkata, ""Apakah aku boleh menambahkan untuk kalian? Ada dua orang laki-laki yang menjadi saksi atas perbuatannya, salah seorang di antaranya adalah Humran, dia menyaksikan sendiri bagaimana dia meminum khamer, sedangkan yang lainnya bersaksi bahwa dia pernah melihat Al Walid sedang muntah-muntah (setelah meminum khamer)."" Lalu Utsman berkata, ""Dia tidak akan muntah kecuali ia minum khamer."" Setelah itu, Utsman berkata kepada Ali, ""Wahai Ali, bangun dan deralah Al Walid."" [Ali] pun berkata kepada Hasan, ""Wahai Hasan, bangun dan deralah Al Walid."" Kemudian Hasan pun berkata, ""Sebaiknya kita serahkan saja pelaksanaan hukuman dera ini kepada khalifah Utsman dan para aparatnya."" Akhirnya dia berkata kepada Abdullah bin Ja'far, ""Wahai Abdullah, bangun dan laksanakanlah hukuman dera kepada Al Walid."" Setelah itu Abdullah bin Ja'far menderanya sedangkan Ali yang menghitungnya, ketika deraan telah sampai pada hitungan ke empat puluh, Ali berseru, ""Berhentilah."" Lalu dia berkata, ""Dahulu Rasulullah shallallahu 'alaihi wasallam pernah mendera peminum khamer sebanyak empat puluh kali, Abu Bakar juga pernah melakukan hal yang sama, sementara Umar bin Khattab pernah melaksanakan hukuman dera sebanyak delapan puluh kali. Sebenarnya semua itu adalah sunnah (pernah dilakukan), dan itulah yang lebih aku sukai."" [Ali bin Hujr] menambahkan dalam riwayatnya, "" [Isma'il] berkata, ""Sungguh aku pernah mendengar hadits Ad Dannaj darinya, namun aku tidak begitu menghafalnya.""","و حَدَّثَنَا أَبُو بَكْرِ بْنُ أَبِي شَيْبَةَ وَزُهَيْرُ بْنُ حَرْبٍ وَعَلِيُّ بْنُ حُجْرٍ قَالُوا حَدَّثَنَا إِسْمَعِيلُ وَهُوَ ابْنُ عُلَيَّةَ عَنْ ابْنِ أَبِي عَرُوبَةَ عَنْ عَبْدِ اللَّهِ الدَّانَاجِ ح و حَدَّثَنَا إِسْحَقُ بْنُ إِبْرَاهِيمَ الْحَنْظَلِيُّ وَاللَّفْظُ لَهُ أَخْبَرَنَا يَحْيَى بْنُ حَمَّادٍ حَدَّثَنَا عَبْدُ الْعَزِيزِ بْنُ الْمُخْتَارِ حَدَّثَنَا عَبْدُ اللَّهِ بْنُ فَيْرُوزَ مَوْلَى ابْنِ عَامِرٍ الدَّانَاجِ حَدَّثَنَا حُضَيْنُ بْنُ الْمُنْذِرِ أَبُو سَاسَانَ قَالَ شَهِدْتُ عُثْمَانَ بْنَ عَفَّانَ وَأُتِيَ بِالْوَلِيدِ قَدْ صَلَّى الصُّبْحَ رَكْعَتَيْنِ ثُمَّ قَالَ أَزِيدُكُمْ فَشَهِدَ عَلَيْهِ رَجُلَانِ أَحَدُهُمَا حُمْرَانُ أَنَّهُ شَرِبَ الْخَمْرَ وَشَهِدَ آخَرُ أَنَّهُ رَآهُ يَتَقَيَّأُ فَقَالَ عُثْمَانُ إِنَّهُ لَمْ يَتَقَيَّأْ حَتَّى شَرِبَهَا فَقَالَ يَا عَلِيُّ قُمْ فَاجْلِدْهُ فَقَالَ عَلِيٌّ قُمْ يَا حَسَنُ فَاجْلِدْهُ فَقَالَ الْحَسَنُ وَلِّ حَارَّهَا مَنْ تَوَلَّى قَارَّهَا فَكَأَنَّهُ وَجَدَ عَلَيْهِ فَقَالَ يَا عَبْدَ اللَّهِ بْنَ جَعْفَرٍ قُمْ فَاجْلِدْهُ فَجَلَدَهُ وَعَلِيٌّ يَعُدُّ حَتَّى بَلَغَ أَرْبَعِينَ فَقَالَ أَمْسِكْ ثُمَّ
قَالَ جَلَدَ النَّبِيُّ صَلَّى اللَّهُ عَلَيْهِ وَسَلَّمَ أَرْبَعِينَ
وَجَلَدَ أَبُو بَكْرٍ أَرْبَعِينَ وَعُمَرُ ثَمَانِينَ وَكُلٌّ سُنَّةٌ وَهَذَا أَحَبُّ إِلَيَّ زَادَ عَلِيُّ بْنُ حُجْرٍ فِي رِوَايَتِهِ قَالَ إِسْمَعِيلُ وَقَدْ سَمِعْتُ حَدِيثَ الدَّانَاجِ مِنْهُ فَلَمْ أَحْفَظْهُ",65
3221,30,"Telah menceritakan kepadaku [Muhammad bin Minhal Ad Dlarir] telah menceritakan kepada kami [Yazid bin Zurai'] telah menceritakan kepada kami [Sufyan Ats Tsauri] dari [Abu Hashin] dari ['Umair bin Sa'id] dari ['Ali] dia berkata, ""Aku tidak suka jika menegakkan hukuman kepada seseorang peminum khamer sampai dia meninggal, sebab jika sampai meninggal maka negaralah yang akan membayar diyatnya, dan Rasulullah shallallahu 'alaihi wasallam tidak pernah mencontohkan yang demikian itu."" Telah menceritakan kepada kami [Muhammad bin Al Mutsanna] telah menceritakan kepada kami [Abdurrahman] telah menceritakan kepada kami [Sufyan] dengan isnad seperti ini.""","حَدَّثَنِي مُحَمَّدُ بْنُ مِنْهَالٍ الضَّرِيرُ حَدَّثَنَا يَزِيدُ بْنُ زُرَيْعٍ حَدَّثَنَا سُفْيَانُ الثَّوْرِيُّ عَنْ أَبِي حَصِينٍ عَنْ عُمَيْرِ بْنِ سَعِيدٍ عَنْ عَلِيٍّ قَالَ
مَا كُنْتُ أُقِيمُ عَلَى أَحَدٍ حَدًّا فَيَمُوتَ فِيهِ فَأَجِدَ مِنْهُ فِي نَفْسِي إِلَّا صَاحِبَ الْخَمْرِ لِأَنَّهُ إِنْ مَاتَ وَدَيْتُهُ لِأَنَّ رَسُولَ اللَّهِ صَلَّى اللَّهُ عَلَيْهِ وَسَلَّمَ لَمْ يَسُنَّهُ
حَدَّثَنَا مُحَمَّدُ بْنُ الْمُثَنَّى حَدَّثَنَا عَبْدُ الرَّحْمَنِ حَدَّثَنَا سُفْيَانُ بِهَذَا الْإِسْنَادِ مِثْلَهُ",65
3222,30,"Telah menceritakan kepada kami [Ahmad bin Isa] telah menceritakan kepada kami [Ibnu Wahb] telah mengabarkan kepadaku ['Amru] dari [Bukair bin Al Asyaj] dia berkata, ""Ketika kami berada di sisi Sulaiman bin Yasar, tiba-tiba Abdurrahman Jabir datang lalu menceritakan (hadits) kepadanya, kemudian [Sulaiman] menghadapkan wajahnya kepada kami sambil berkata; telah menceritakan kepadaku [Abdurrahman bin Jabir] dari [ayahnya] dari [Abu Burdah Al Anshari], bahwa dia pernah mendengar Rasulullah shallallahu 'alaihi wasallam bersabda: ""Seseorang tidak boleh didera lebih dari sepuluh kali, melainkan hukuman yang telah jelas ditetapkan oleh Allah.""","حَدَّثَنَا أَحْمَدُ بْنُ عِيسَى حَدَّثَنَا ابْنُ وَهْبٍ أَخْبَرَنِي عَمْرٌو عَنْ بُكَيْرِ بْنِ الْأَشَجِّ قَالَ بَيْنَا نَحْنُ عِنْدَ سُلَيْمَانَ بْنِ يَسَارٍ إِذْ جَاءَهُ عَبْدُ الرَّحْمَنِ بْنُ جَابِرٍ فَحَدَّثَهُ فَأَقْبَلَ عَلَيْنَا سُلَيْمَانُ فَقَالَ حَدَّثَنِي عَبْدُ الرَّحْمَنِ بْنُ جَابِرٍ عَنْ أَبِيهِ عَنْ أَبِي بُرْدَةَ الْأَنْصَارِيِّ أَنَّهُ
سَمِعَ رَسُولَ اللَّهِ صَلَّى اللَّهُ عَلَيْهِ وَسَلَّمَ يَقُولُ لَا يُجْلَدُ أَحَدٌ فَوْقَ عَشَرَةِ أَسْوَاطٍ إِلَّا فِي حَدٍّ مِنْ حُدُودِ اللَّهِ",65
3658,36,"Telah menceritakan kepada kami [Abu Bakar bin Abu Syaibah] telah menceritakan kepada kami [Abu Khalid Al Ahmar Sulaiman bin Hayyan] dari [Manshur bin Hayyan] dari [Abu At Thufail] dia berkata; saya berkata kepada [Ali bin Abu Thalib], ""Beritahukanlah kepadaku sesuatu yang pernah dirahasiakan Rasulullah shallallahu 'alaihi wasallam kepadamu!"" Ali menjawab, ""Beliau tidak pernah merahasiakan kepadaku sesuatu pun dari manusia, akan tetapi saya mendengar beliau bersabda: ""Allah mengutuk orang yang menyembelih untuk selain Allah, dan mengutuk orang yang melindungi tindak kejahatan, mengutuk orang yang mencaci kedua orang tuanya, dan mengutuk orang yang memindahkan tanda batas tanah.""","حَدَّثَنَا أَبُو بَكْرِ بْنُ أَبِي شَيْبَةَ حَدَّثَنَا أَبُو خَالِدٍ الْأَحْمَرُ سُلَيْمَانُ بْنُ حَيَّانَ عَنْ مَنْصُورِ بْنِ حَيَّانَ عَنْ أَبِي الطُّفَيْلِ قَالَ
قُلْنَا لِعَلِيِّ بْنِ أَبِي طَالِبٍ أَخْبِرْنَا بِشَيْءٍ أَسَرَّهُ إِلَيْكَ رَسُولُ اللَّهِ صَلَّى اللَّهُ عَلَيْهِ وَسَلَّمَ فَقَالَ مَا أَسَرَّ إِلَيَّ شَيْئًا كَتَمَهُ النَّاسَ وَلَكِنِّي سَمِعْتُهُ يَقُولُ لَعَنَ اللَّهُ مَنْ ذَبَحَ لِغَيْرِ اللَّهِ وَلَعَنَ اللَّهُ مَنْ آوَى مُحْدِثًا وَلَعَنَ اللَّهُ مَنْ لَعَنَ وَالِدَيْهِ وَلَعَنَ اللَّهُ مَنْ غَيَّرَ الْمَنَارَ",65
3886,38,"Telah menceritakan kepadaku [Abu Ath Thahir Ahmad bin 'Amru bin Sarh]; Telah mengabarkan kepada kami [Ibnu Wahb]; Telah menceritakan kepadaku [Abu Hani]; Bahwasannya dia mendengar [Abu 'Abdurrahman] berkata; Dari [Jabir bin 'Abdullah]; Rasulullah shallallahu 'alaihi wasallam berkata kepadanya; ""Satu kasur untuk seorang suami, satu kasur untuk istrinya, kasur ketiga untuk tamu, dan kasur keempat untuk syetan.""","حَدَّثَنِي أَبُو الطَّاهِرِ أَحْمَدُ بْنُ عَمْرِو بْنِ سَرْحٍ أَخْبَرَنَا ابْنُ وَهْبٍ حَدَّثَنِي أَبُو هَانِئٍ أَنَّهُ سَمِعَ أَبَا عَبْدِ الرَّحْمَنِ يَقُولُ عَنْ جَابِرِ بْنِ عَبْدِ اللَّهِ
أَنَّ رَسُولَ اللَّهِ صَلَّى اللَّهُ عَلَيْهِ وَسَلَّمَ قَالَ لَهُ فِرَاشٌ لِلرَّجُلِ وَفِرَاشٌ لِامْرَأَتِهِ وَالثَّالِثُ لِلضَّيْفِ وَالرَّابِعُ لِلشَّيْطَانِ",65
3972,38,"Telah menceritakan kepada kami [Muhammad bin 'Abdillah bin Numair]; Telah menceritakan kepada kami [Waki'] dan ['Abdah] dari [Hisyam bin 'Urwah] dari [Bapaknya] dari ['Aisyah] bahwa ada seorang perempuan berkata; ""Ya Rasulullah aku adakalanya menyebarkan isu 'Sesungguhnya suamiku memberiku demikian-demikian, padahal apa yang aku katakan hanyalah bualan belaka, tanggapan anda? Rasulullah shallallahu 'alaihi wasallam menjawab: 'Orang yang menampak-nampakkan kepuasan dengan sesuatu yang sebenarnya tidak diberikan kepadanya, sama artinya dengan memakai dua helai baju palsu (penuh dosa).'","حَدَّثَنَا مُحَمَّدُ بْنُ عَبْدِ اللَّهِ بْنِ نُمَيْرٍ حَدَّثَنَا وَكِيعٌ وَعَبْدَةُ عَنْ هِشَامِ بْنِ عُرْوَةَ عَنْ أَبِيهِ عَنْ عَائِشَةَ
أَنَّ امْرَأَةً قَالَتْ يَا رَسُولَ اللَّهِ أَقُولُ إِنَّ زَوْجِي أَعْطَانِي مَا لَمْ يُعْطِنِي فَقَالَ رَسُولُ اللَّهِ صَلَّى اللَّهُ عَلَيْهِ وَسَلَّمَ الْمُتَشَبِّعُ بِمَا لَمْ يُعْطَ كَلَابِسِ ثَوْبَيْ زُورٍ",65
