haditsId,kitabId,indo,arab,label
189,2,"Telah menceritakan kepada kami [Yusuf bin Ya'qub ash-Shaffar] telah menceritakan kepadaku [Ali bin Atstsam] dari [Su'air bin al-Khims] dari [Mughirah] dari [Ibrahim] dari ['Alqamah] dari [Abdullah] dia berkata, ""Nabi shallallahu 'alaihi wasallam pernah ditanya mengenai perasaan waswas, maka beliau menjawab: 'Itu adalah tanda keimanan yang murni (benar) '.""","حَدَّثَنَا يُوسُفُ بْنُ يَعْقُوبَ الصَّفَّارُ حَدَّثَنِي عَلِيُّ بْنُ عَثَّامٍ عَنْ سُعَيْرِ بْنِ الْخِمْسِ عَنْ مُغِيرَةَ عَنْ إِبْرَاهِيمَ عَنْ عَلْقَمَةَ عَنْ عَبْدِ اللَّهِ قَالَ
سُئِلَ النَّبِيُّ صَلَّى اللَّهُ عَلَيْهِ وَسَلَّمَ عَنْ الْوَسْوَسَةِ قَالَ تِلْكَ مَحْضُ الْإِيمَانِ",69
559,4,"Telah menceritakan kepada kami [Yahya bin Yahya at-Tamimi] dan [Abu ar-Rabi' az-Zahrani] berkata [Yahya] telah mengabarkan kepada kami [Hammad bin Zaid] dan berkata [Abu ar-Rabi'] telah menceritakan kepada kami [Hammad] dari [Amru bin Dinar] dari [Sa'id bin al-Huwairits] dari [Ibnu Abbas] bahwa Nabi shallallahu 'alaihi wasallam keluar dari WC, lalu beliau dibawakan makanan, maka mereka mengingatkan beliau untuk berwudhu, maka beliau bersabda, ""Saya ingin shalat, maka saya berwudhu.""","حَدَّثَنَا يَحْيَى بْنُ يَحْيَى التَّمِيمِيُّ وَأَبُو الرَّبِيعِ الزَّهْرَانِيُّ قَالَ يَحْيَى أَخْبَرَنَا حَمَّادُ بْنُ زَيْدٍ وَقَالَ أَبُو الرَّبِيعِ حَدَّثَنَا حَمَّادٌ عَنْ عَمْرِو بْنِ دِينَارٍ عَنْ سَعِيدِ بْنِ الْحُوَيْرِثِ عَنْ ابْنِ عَبَّاسٍ
أَنَّ النَّبِيَّ صَلَّى اللَّهُ عَلَيْهِ وَسَلَّمَ خَرَجَ مِنْ الْخَلَاءِ فَأُتِيَ بِطَعَامٍ فَذَكَرُوا لَهُ الْوُضُوءَ فَقَالَ أُرِيدُ أَنْ أُصَلِّيَ فَأَتَوَضَّأَ",69
1067,6,"Dan telah menceritakan kepada kami [Hajjaj bin Asy Syair] telah menceritakan kepada kami [Rauh bin 'Ubadah] telah menceritakan kepada kami [Zakariya bin Ishaq] telah menceritakan kepada kami [Abu Zubair] katanya; aku mendengar [Jabir bin Abdullah] mengatakan; ""Rumah kami terpencil dari masjid, maka kami ingin menjual rumah kami dengan harapan untuk kami pindahkan dekat masjid, maka Rasulullah shallallahu 'alaihi wasallam melarang kami seraya berujar: ""Setiap langkah, kamu akan memperoleh pahala.""","و حَدَّثَنَا حَجَّاجُ بْنُ الشَّاعِرِ حَدَّثَنَا رَوْحُ بْنُ عُبَادَةَ حَدَّثَنَا زَكَرِيَّاءُ بْنُ إِسْحَقَ حَدَّثَنَا أَبُو الزُّبَيْرِ قَالَ سَمِعْتُ جَابِرَ بْنَ عَبْدِ اللَّهِ قَالَ
كَانَتْ دِيَارُنَا نَائِيَةً عَنْ الْمَسْجِدِ فَأَرَدْنَا أَنْ نَبِيعَ بُيُوتَنَا فَنَقْتَرِبَ مِنْ الْمَسْجِدِ فَنَهَانَا رَسُولُ اللَّهِ صَلَّى اللَّهُ عَلَيْهِ وَسَلَّمَ فَقَالَ إِنَّ لَكُمْ بِكُلِّ خَطْوَةٍ دَرَجَةً",69
1484,9,"Dan telah menceritakan kepadaku [Ibrahim bin Dinar] dan [Uqbah bin Murqam Al Amiy] dan [Abdu bin Humaid] semuanya dari [Abu Ashim] -sementara lafazhnya dari Uqbah- ia berkata, Telah menceritakan kepada kami [Abu Ashim] dari [Ibnu Juraij] ia berkata, telah mengabarkan kepadaku [Atha`] telah mengabarkan kepadaku [Ubaid bin Umair] telah mengabarkan kepadaku [Aisyah] bahwa ia berkata berkenaan dengan orang sedang bermain-main, ""Saya ingin melihat mereka."" Maka Rasulullah shallallahu 'alaihi wasallam berdiri dan saya pun ikut berdiri di atas pintu sehingga saya melihat di antara kedua telinga dan pundak beliau, sementara mereka bermain-main di masjid. Atha` bertanya; Orang-orang Faris ataukah Habasyi? Dan Ibnu 'Atiq berkata kepadaku; Bahkan mereka adalah orang-orang Habasyi.","و حَدَّثَنِي إِبْرَاهِيمُ بْنُ دِينَارٍ وَعُقْبَةُ بْنُ مُكْرَمٍ الْعَمِّيُّ وَعَبْدُ بْنُ حُمَيْدٍ كُلُّهُمْ عَنْ أَبِي عَاصِمٍ وَاللَّفْظُ لِعُقْبَةَ قَالَ حَدَّثَنَا أَبُو عَاصِمٍ عَنْ ابْنِ جُرَيْجٍ قَالَ أَخْبَرَنِي عَطَاءٌ أَخْبَرَنِي عُبَيْدُ بْنُ عُمَيْرٍ أَخْبَرَتْنِي عَائِشَةُ
أَنَّهَا قَالَتْ لِلَعَّابِينَ وَدِدْتُ أَنِّي أَرَاهُمْ قَالَتْ فَقَامَ رَسُولُ اللَّهِ صَلَّى اللَّهُ عَلَيْهِ وَسَلَّمَ وَقُمْتُ عَلَى الْبَابِ أَنْظُرُ بَيْنَ أُذُنَيْهِ وَعَاتِقِهِ وَهُمْ يَلْعَبُونَ فِي الْمَسْجِدِ
قَالَ عَطَاءٌ فُرْسٌ أَوْ حَبَشٌ قَالَ وَقَالَ لِي ابْنُ عَتِيقٍ بَلْ حَبَشٌ",69
1632,13,"Dan telah menceritakan kepadaku [Amru An Naqid] dan [Zuhair bin Harb] keduanya berkata, telah menceritakan kepada kami [Sufyan bin Uyainah] telah menceritakan kepada kami [Ayyub bin Musa] dari [Makhul] dari [Sulaiman bin Yasar] dari [Irak bin Malik] dari [Abu Hurairah] -Amru mengatakan- dari Nabi shallallahu 'alaihi wasallam -sementara Zuhair berkata-sampai kepada Nabi shallallahu 'alaihi wasallam: ""Tidak wajib bagi seorang muslim menzakati hamba sahanya dan kudanya."" Telah menceritakan kepada kami [Yahya bin Yahya] telah mengabarkan kepada kami [Sulaiman bin Bilal] -dalam jalur lain- Telah menceritakan kepada kami [Qutaibah] Telah menceritakan kepada kami [Hammad bin Zaid] -dalam jalur lain- Dan Telah menceritakan kepada kami [Abu Bakar bin Abi Syaibah] Telah menceritakan kepada kami [Hatim bin Isma'il] semuanya dari [Khutsaim bin Irak bin Malik] dari [bapaknya] dari [Abu Hurairah] dari Nabi shallallahu 'alaihi wasallam dengan semisalnya.","و حَدَّثَنِي عَمْرٌو النَّاقِدُ وَزُهَيْرُ بْنُ حَرْبٍ قَالَا حَدَّثَنَا سُفْيَانُ بْنُ عُيَيْنَةَ حَدَّثَنَا أَيُّوبُ بْنُ مُوسَى عَنْ مَكْحُولٍ عَنْ سُلَيْمَانَ بْنِ يَسَارٍ عَنْ عِرَاكِ بْنِ مَالِكٍ عَنْ أَبِي هُرَيْرَةَ قَالَ عَمْرٌو عَنْ النَّبِيِّ صَلَّى اللَّهُ عَلَيْهِ وَسَلَّمَ وَقَالَ زُهَيْرٌ يَبْلُغُ بِهِ
لَيْسَ عَلَى الْمُسْلِمِ فِي عَبْدِهِ وَلَا فَرَسِهِ صَدَقَةٌ
حَدَّثَنَا يَحْيَى بْنُ يَحْيَى أَخْبَرَنَا سُلَيْمَانُ بْنُ بِلَالٍ ح و حَدَّثَنَا قُتَيْبَةُ حَدَّثَنَا حَمَّادُ بْنُ زَيْدٍ ح و حَدَّثَنَا أَبُو بَكْرِ بْنُ أَبِي شَيْبَةَ حَدَّثَنَا حَاتِمُ بْنُ إِسْمَعِيلَ كُلُّهُمْ عَنْ خُثَيْمِ بْنِ عِرَاكِ بْنِ مَالِكٍ عَنْ أَبِيهِ عَنْ أَبِي هُرَيْرَةَ عَنْ النَّبِيِّ صَلَّى اللَّهُ عَلَيْهِ وَسَلَّمَ بِمِثْلِهِ",69
1633,13,"Dan telah menceritakan kepadaku [Abu Thahir] dan [Harun bin Sa'id Al Aili] dan [Ahmad bin Isa] mereka berkata, telah menceritakan kepada kami [Ibnu Wahb] telah mengabarkan kepadaku [Makhramah] dari [bapaknya] dari [Irak bin Malik] ia berkata, saya mendengar [Abu Hurairah] menceritakan dari Rasulullah shallallahu 'alaihi wasallam, beliau bersabda: ""Tidak wajib menzakati hamba sahaya kecuali zakat fitrahnya.""","و حَدَّثَنِي أَبُو الطَّاهِرِ وَهَارُونُ بْنُ سَعِيدٍ الْأَيْلِيُّ وَأَحْمَدُ بْنُ عِيسَى قَالُوا حَدَّثَنَا ابْنُ وَهْبٍ أَخْبَرَنِي مَخْرَمَةُ عَنْ أَبِيهِ عَنْ عِرَاكِ بْنِ مَالِكٍ قَالَ سَمِعْتُ أَبَا هُرَيْرَةَ يُحَدِّثُ
عَنْ رَسُولِ اللَّهِ صَلَّى اللَّهُ عَلَيْهِ وَسَلَّمَ قَالَ لَيْسَ فِي الْعَبْدِ صَدَقَةٌ إِلَّا صَدَقَةُ الْفِطْرِ",69
1677,13,"Dan Telah menceritakan kepada kami [Muhammad bin Rafi'] Telah menceritakan kepada kami [Abdurrazaq bin Hammam] Telah menceritakan kepada kami [Ma'mar] dari [Hammam bin Munabbih] ia berkata, ini adalah hadits yang telah diceritakan kepada kami oleh [Abu Hurairah] dari Muhammad shallallahu 'alaihi wasallam. ia pun menyebutkan beberapa hadits, di antaranya adalah; Dan Rasulullah shallallahu 'alaihi wasallam bersabda: ""Setiap anggota tubuh manusia memiliki keharusan sedekah pada setiap harinya. Yaitu seperti mendamaikan dua orang yang berselisih, adalah sedekah. Menolong orang yang naik kendaraan, atau menolong mengangkatkan barangnya ke atas kendaraan, itu pun termasuk sedekah. Ucapan atau tutur kata yang baik, juga sedekah. Setiap langkah yang Anda ayunkan untuk menunaikan shalat, juga sedekah. Dan menyingkirkan sesuatu yang membahayakan di jalanan umum, adalah sedekah.""","و حَدَّثَنَا مُحَمَّدُ بْنُ رَافِعٍ حَدَّثَنَا عَبْدُ الرَّزَّاقِ بْنُ هَمَّامٍ حَدَّثَنَا مَعْمَرٌ عَنْ هَمَّامِ بْنِ مُنَبِّهٍ قَالَ هَذَا مَا حَدَّثَنَا أَبُو هُرَيْرَةَ عَنْ مُحَمَّدٍ رَسُولِ اللَّهِ صَلَّى اللَّهُ عَلَيْهِ وَسَلَّمَ فَذَكَرَ أَحَادِيثَ مِنْهَا
وَقَالَ رَسُولُ اللَّهِ صَلَّى اللَّهُ عَلَيْهِ وَسَلَّمَ كُلُّ سُلَامَى مِنْ النَّاسِ عَلَيْهِ صَدَقَةٌ كُلَّ يَوْمٍ تَطْلُعُ فِيهِ الشَّمْسُ قَالَ تَعْدِلُ بَيْنَ الِاثْنَيْنِ صَدَقَةٌ وَتُعِينُ الرَّجُلَ فِي دَابَّتِهِ فَتَحْمِلُهُ عَلَيْهَا أَوْ تَرْفَعُ لَهُ عَلَيْهَا مَتَاعَهُ صَدَقَةٌ قَالَ وَالْكَلِمَةُ الطَّيِّبَةُ صَدَقَةٌ وَكُلُّ خُطْوَةٍ تَمْشِيهَا إِلَى الصَّلَاةِ صَدَقَةٌ وَتُمِيطُ الْأَذَى عَنْ الطَّرِيقِ صَدَقَةٌ",69
2037,16,"Dan telah menceritakan kepadaku [Harun bin Abdullah] telah menceritakan kepada kami [Hajjaj bin Muhammad] ia berkata, telah berkata [Ibnu Juraij] telah mengabarkan kepadaku [Shalih bin Kaisan] dari [Nafi'] dari [Ibnu Umar] radliallahu 'anhu, bahwa ia mengabarkan bahwasanya; Nabi shallallahu 'alaihi wasallam berihram ketika hewan tunggangannya telah berdiri tegak siap memberangkatkannya.","و حَدَّثَنِي هَارُونُ بْنُ عَبْدِ اللَّهِ حَدَّثَنَا حَجَّاجُ بْنُ مُحَمَّدٍ قَالَ قَالَ ابْنُ جُرَيْجٍ أَخْبَرَنِي صَالِحُ بْنُ كَيْسَانَ عَنْ نَافِعٍ عَنْ ابْنِ عُمَرَ رَضِيَ اللَّهُ عَنْهُ
أَنَّهُ كَانَ يُخْبِرُ أَنَّ النَّبِيَّ صَلَّى اللَّهُ عَلَيْهِ وَسَلَّمَ أَهَلَّ حِينَ اسْتَوَتْ بِهِ نَاقَتُهُ قَائِمَةً",69
2124,16,"Dan telah meceritakan kepadaku [Hasan bin Ali Al Hulwani] Telah menceritakan kepada kami [Zaid bin Hujab] telah menceritakan kepadaku [Ibrahim bin Nafi'] telah menceritakan kepadaku [Abdullah bin Abu Najih] dari [Mujahid] dari [Aisyah] radliallahu 'anha, bahwa ia haid di Saraf dan suci kembali ketika berada di Arafah, maka Rasulullah shallallahu 'alaihi wasallam pun bersabda padanya: ""Thafmu antara Shafa dan Marwa telah mencukupi untuk haji dan sekaligus umrahmu.""","و حَدَّثَنِي حَسَنُ بْنُ عَلِيٍّ الْحُلْوَانِيُّ حَدَّثَنَا زَيْدُ بْنُ الْحُبَابِ حَدَّثَنِي إِبْرَاهِيمُ بْنُ نَافِعٍ حَدَّثَنِي عَبْدُ اللَّهِ بْنُ أَبِي نَجِيحٍ عَنْ مُجَاهِدٍ عَنْ عَائِشَةَ رَضِيَ اللَّهُ عَنْهَا
أَنَّهَا حَاضَتْ بِسَرِفَ فَتَطَهَّرَتْ بِعَرَفَةَ فَقَالَ لَهَا رَسُولُ اللَّهِ صَلَّى اللَّهُ عَلَيْهِ وَسَلَّمَ يُجْزِئُ عَنْكِ طَوَافُكِ بِالصَّفَا وَالْمَرْوَةِ عَنْ حَجِّكِ وَعُمْرَتِكِ",69
2149,16,"Dan Telah meceritakan kepada kami [Abu Bakr bin Abu Syaibah] Telah menceritakan kepada kami [Abdurrahman bin Mahdi] dari [Sufyan] dari [Ayyas Al Amiri] dari [Ibrahim At Taimi] dari [bapaknya] dari [Abu Dzar] radliallahu 'anhu, ia berkata; ""Dulu haji tamattu' itu adalah rukhshah (keringanan) bagi kami.""","و حَدَّثَنَا أَبُو بَكْرِ بْنُ أَبِي شَيْبَةَ حَدَّثَنَا عَبْدُ الرَّحْمَنِ بْنُ مَهْدِيٍّ عَنْ سُفْيَانَ عَنْ عَيَّاشٍ الْعَامِرِيِّ عَنْ إِبْرَاهِيمَ التَّيْمِيِّ عَنْ أَبِيهِ عَنْ أَبِي ذَرٍّ رَضِيَ اللَّهُ عَنْهُ قَالَ
كَانَتْ لَنَا رُخْصَةً يَعْنِي الْمُتْعَةَ فِي الْحَجِّ",69
2150,16,"Dan Telah meceritakan kepada kami [Qutaibah bin Sa'id] Telah menceritakan kepada kami [Jarir] dari [Fudlail] dari [Zubaid] dari [Ibrahim At Tamimi] dari [bapaknya] ia berkata, [Abu Dzar] radliallahu 'anhu berkata; ""Tidak diperbolehkan dua Mut'ah, kecuali khusus bagi kami (dahulu), yaitu Mut'atun Nisa` (nikah mut'ah) dan Mut'atul Hajji (haji tamattu').","و حَدَّثَنَا قُتَيْبَةُ بْنُ سَعِيدٍ حَدَّثَنَا جَرِيرٌ عَنْ فُضَيْلٍ عَنْ زُبَيْدٍ عَنْ إِبْرَاهِيمَ التَّيْمِيِّ عَنْ أَبِيهِ قَالَ
قَالَ أَبُو ذَرٍّ رَضِيَ اللَّهُ عَنْهُ لَا تَصْلُحُ الْمُتْعَتَانِ إِلَّا لَنَا خَاصَّةً يَعْنِي مُتْعَةَ النِّسَاءِ وَمُتْعَةَ الْحَجِّ",69
2318,16,"Telah menceritakan kepada kami [Abu Bakr bin Abu Syaibah] Telah menceritakan kepada kami [Ibnu Numair] dan [Abu Usamah] keduanya berkata, Telah menceritakan kepada kami [Ubaidullah] dari [Nafi'] dari [Ibnu Umar] -dalam riwayat lain- Dan Telah menceritakan kepada kami [Ibnu Numair] -lafazh juga miliknya- Telah menceritakan kepada kami [bapakku] Telah menceritakan kepada kami [Ubaidullah] telah menceritakan kepadaku [Nafi'] dari [Ibnu Umar] bahwa Al Abbas bin Abdul Muthalib meminta izin kepada Rasulullah shallallahu 'alaihi wasallam untuk bermalam di Makkah pada malam-malam di Mina, dengan tujuan agar ia dapat memberi minum jama'ah haji, maka beliau pun mengizinkannya. Dan Telah menceritakannya kepada kami [Ishaq bin Ibrahim] telah mengabarkan kepada kami [Isa bin Yunus] -dalam riwayat lain- Dan telah menceritakannya kepadaku [Muhammad bin Hatim] dan [Abdu bin Humaid] semuanya dari [Muhammad bin Bakr] telah mengabarkan kepada kami [Ibnu Juraij] keduanya dari [Ubaidullah bin Umar] dengan isnad ini, semisalnya.","حَدَّثَنَا أَبُو بَكْرِ بْنُ أَبِي شَيْبَةَ حَدَّثَنَا ابْنُ نُمَيْرٍ وَأَبُو أُسَامَةَ قَالَا حَدَّثَنَا عُبَيْدُ اللَّهِ عَنْ نَافِعٍ عَنْ ابْنِ عُمَرَ ح و حَدَّثَنَا ابْنُ نُمَيْرٍ وَاللَّفْظُ لَهُ حَدَّثَنَا أَبِي حَدَّثَنَا عُبَيْدُ اللَّهِ حَدَّثَنِي نَافِعٌ عَنْ ابْنِ عُمَرَ
أَنَّ الْعَبَّاسَ بْنَ عَبْدِ الْمُطَّلِبِ اسْتَأْذَنَ رَسُولَ اللَّهِ صَلَّى اللَّهُ عَلَيْهِ وَسَلَّمَ أَنْ يَبِيتَ بِمَكَّةَ لَيَالِي مِنًى مِنْ أَجْلِ سِقَايَتِهِ فَأَذِنَ لَهُ
و حَدَّثَنَاه إِسْحَقُ بْنُ إِبْرَاهِيمَ أَخْبَرَنَا عِيسَى بْنُ يُونُسَ ح و حَدَّثَنِيهِ مُحَمَّدُ بْنُ حَاتِمٍ وَعَبْدُ بْنُ حُمَيْدٍ جَمِيعًا عَنْ مُحَمَّدِ بْنِ بَكْرٍ أَخْبَرَنَا ابْنُ جُرَيْجٍ كِلَاهُمَا عَنْ عُبَيْدِ اللَّهِ بْنِ عُمَرَ بِهَذَا الْإِسْنَادِ مِثْلَهُ",69
2444,16,"Dan Telah menceritakan kepada kami [Abu Bakr bin Abu Syaibah] telah menceritakan kepada kami [Abdah] dari [Hisyam] dari [bapaknya] dari [Aisyah] ia berkata; Dulu aku datang ke Madinah ketika kota ini banyak penyakitnya. Sehingga Abu Bakar dan Bilal jatuh sakit. Maka beliau pun berdo'a: ""Ya Allah, berikanlah kecintaan kepada kami terhadap kota Madinah sebagaimana Engkau memberikan kepada kami kecintaan terhadap Makkah, atau bahkan lebih dari Makkah. Jadikanlah Madinah sebagai kota yang sehat, dan berikanlah keberkahan pada takaran Sha' dan takaran Mudd kami, serta pindahkan penyakitnya ke Juhfah."" Dan Telah menceritakan kepada kami [Abu Kuraib] telah menceritakan kepada kami [Abu Usamah] dan [Ibnu Numair] dari [Hisyam bin Urwah] dengan isnad ini, semisalnya.","و حَدَّثَنَا أَبُو بَكْرِ بْنُ أَبِي شَيْبَةَ حَدَّثَنَا عَبْدَةُ عَنْ هِشَامٍ عَنْ أَبِيهِ عَنْ عَائِشَةَ قَالَتْ
قَدِمْنَا الْمَدِينَةَ وَهِيَ وَبِيئَةٌ فَاشْتَكَى أَبُو بَكْرٍ وَاشْتَكَى بِلَالٌ فَلَمَّا رَأَى رَسُولُ اللَّهِ صَلَّى اللَّهُ عَلَيْهِ وَسَلَّمَ شَكْوَى أَصْحَابِهِ قَالَ اللَّهُمَّ حَبِّبْ إِلَيْنَا الْمَدِينَةَ كَمَا حَبَّبْتَ مَكَّةَ أَوْ أَشَدَّ وَصَحِّحْهَا وَبَارِكْ لَنَا فِي صَاعِهَا وَمُدِّهَا وَحَوِّلْ حُمَّاهَا إِلَى الْجُحْفَةِ
و حَدَّثَنَا أَبُو كُرَيْبٍ حَدَّثَنَا أَبُو أُسَامَةَ وَابْنُ نُمَيْرٍ عَنْ هِشَامِ بْنِ عُرْوَةَ بِهَذَا الْإِسْنَادِ نَحْوَهُ",69
2539,17,"Dan telah menceritakan kepadaku [Muhammad bin Rafi'] telah menceritakan kepada kami [Abdur Razzaq] telah mengabarkan kepada kami [Ma'mar] dari [Ayyub] dari [Nafi'] dari [Ibnu Umar] bahwasannya Nabi shallallahu 'alaihi wasallam bersabda: ""Tidak ada nikah syighar dalam Islam.""","و حَدَّثَنِي مُحَمَّدُ بْنُ رَافِعٍ حَدَّثَنَا عَبْدُ الرَّزَّاقِ أَخْبَرَنَا مَعْمَرٌ عَنْ أَيُّوبَ عَنْ نَافِعٍ عَنْ ابْنِ عُمَرَ
أَنَّ النَّبِيَّ صَلَّى اللَّهُ عَلَيْهِ وَسَلَّمَ قَالَ لَا شِغَارَ فِي الْإِسْلَامِ",69
2540,17,"Telah menceritakan kepada kami [Abu Bakar bin Abi Syaibah] telah menceritakan kepada kami [Ibnu Numair] dan [Abu Usamah] dari [Ubaidillah] dari [Abu Az Zinad] dari [Al A'raj] dari [Abu Hurairah] dia berkata; Rasulullah shallallahu 'alaihi wasallam melarang melakukan nikah syighar, Ibnu Numair menambahkan, nikah syighar adalah seseorang mengatakan kepada laki-laki lain; Nikahkanlah putrimu denganku, niscaya aku akan menikahkan putriku untukmu, atau nikahkanlah sudara perempuanmu denganku, maka saya akan nikahkan saudara perempuanku denganmu. Dan telah menceritakan kepada kami [Abu Kuraib] telah menceritakan kepada kami ['Abdah] dari [Ubaidillah] dia adalah Ibnu Umar dengan isnad ini, dan dia tidak menyebutan tambahan Ibnu Numair. ","حَدَّثَنَا أَبُو بَكْرِ بْنُ أَبِي شَيْبَةَ حَدَّثَنَا ابْنُ نُمَيْرٍ وَأَبُو أُسَامَةَ عَنْ عُبَيْدِ اللَّهِ عَنْ أَبِي الزِّنَادِ عَنْ الْأَعْرَجِ عَنْ أَبِي هُرَيْرَةَ قَالَ
نَهَى رَسُولُ اللَّهِ صَلَّى اللَّهُ عَلَيْهِ وَسَلَّمَ عَنْ الشِّغَارِ
زَادَ ابْنُ نُمَيْرٍ وَالشِّغَارُ أَنْ يَقُولَ الرَّجُلُ لِلرَّجُلِ زَوِّجْنِي ابْنَتَكَ وَأُزَوِّجُكَ ابْنَتِي أَوْ زَوِّجْنِي أُخْتَكَ وَأُزَوِّجُكَ أُخْتِي و حَدَّثَنَاه أَبُو كُرَيْبٍ حَدَّثَنَا عَبْدَةُ عَنْ عُبَيْدِ اللَّهِ وَهُوَ ابْنُ عُمَرَ بِهَذَا الْإِسْنَادِ وَلَمْ يَذْكُرْ زِيَادَةَ ابْنِ نُمَيْرٍ",69
2545,17,"Telah menceritakan kepada kami [Sa'id bin Manshur] dan [Qutaibah bin Sa'id] keduanya berkata; Telah menceritakan kepada kami [Malik] Dan diriwayatkan dari jalur lain, telah menceritakan kepada kami [Yahya bin Yahya] sedangkan lafazhnya dari dia (Yahya), dia berkata; Saya bertanya kepada [Malik]; Apakah [Abdullah bin Fadll] pernah menceritakan kepadamu dari [Nafi' bin Jubair] dari [Ibnu Abbas] bahwa Nabi shallallahu 'alaihi wasallam telah bersabda: ""Seorang janda lebih berhak atas dirinya daripada walinya, sedangkan anak gadis harus di mintai izin darinya, dan izinnya adalah diamnya""? Dia menjawab; ""Ya.""","حَدَّثَنَا سَعِيدُ بْنُ مَنْصُورٍ وَقُتَيْبَةُ بْنُ سَعِيدٍ قَالَا حَدَّثَنَا مَالِكٌ ح و حَدَّثَنَا يَحْيَى بْنُ يَحْيَى وَاللَّفْظُ لَهُ قَالَ قُلْتُ لِمَالِكٍ حَدَّثَكَ عَبْدُ اللَّهِ بْنُ الْفَضْلِ عَنْ نَافِعِ بْنِ جُبَيْرٍ عَنْ ابْنِ عَبَّاسٍ
أَنَّ النَّبِيَّ صَلَّى اللَّهُ عَلَيْهِ وَسَلَّمَ قَالَ الْأَيِّمُ أَحَقُّ بِنَفْسِهَا مِنْ وَلِيِّهَا وَالْبِكْرُ تُسْتَأْذَنُ فِي نَفْسِهَا وَإِذْنُهَا صُمَاتُهَا قَالَ نَعَمْ",69
2577,17,"Telah menceritakan kepadaku [Abu Ar Rabi'] dan [Abu Kamil] keduanya berkata; Telah menceritakan kepada kami [Hammad] telah menceritakan kepada kami [Ayyub]. Dan diriwayatkan dari jalur lain, telah menceritakan kepada kami [Qutaibah] telah menceritakan kepada kami [Hammad] dari [Ayyub] dari [Nafi'] dari [Ibnu Umar] dia berkata; Rasulullah shallallahu 'alaihi wasallam bersabda: ""Penuhilah undangan, jika kalian diundang."" ","حَدَّثَنِي أَبُو الرَّبِيعِ وَأَبُو كَامِلٍ قَالَ حَدَّثَنَا حَمَّادٌ حَدَّثَنَا أَيُّوبُ ح و حَدَّثَنَا قُتَيْبَةُ حَدَّثَنَا حَمَّادٌ عَنْ أَيُّوبَ عَنْ نَافِعٍ عَنْ ابْنِ عُمَرَ قَالَ
قَالَ رَسُولُ اللَّهِ صَلَّى اللَّهُ عَلَيْهِ وَسَلَّمَ ائْتُوا الدَّعْوَةَ إِذَا دُعِيتُمْ",69
2580,17,"Dan telah menceritakan kepadaku [Humaid bin Mas'adah Al Bahili] telah menceritakan kepada kami [Bisyr Al Mufadldlal] telah menceritakan kepada kami [Isma'il bin Umayyah] dari [Nafi'] dari ['Abdullah bin Umar] dia berkata; Rasulullah shallallahu 'alaihi wasallam bersabda: ""Penuhilah undangan jika kalian diundang."" ","حَدَّثَنِي حُمَيْدُ بْنُ مَسْعَدَةَ الْبَاهِلِيُّ حَدَّثَنَا بِشْرُ بْنُ الْمُفَضَّلِ حَدَّثَنَا إِسْمَعِيلُ بْنُ أُمَيَّةَ عَنْ نَافِعٍ عَنْ عَبْدِ اللَّهِ بْنِ عُمَرَ قَالَ
قَالَ رَسُولُ اللَّهِ صَلَّى اللَّهُ عَلَيْهِ وَسَلَّمَ ائْتُوا الدَّعْوَةَ إِذَا دُعِيتُمْ",69
