haditsId,kitabId,indo,arab,label
5189,54,"Telah menceritakan kepada kami [Zuhair bin Harb] dan [Ali bin Hujr], teks milik Zuhair, keduanya berkata: Telah menceritakan kepada kami [Isma'il bin Ibrahim] dari [Al Jurairi] dari [Abu An Nadhrah] berkata: Kami berada di dekat [Jabir bin Abdullah], ia berkata: Hampir saja Irak tidak dipunguti takaran dan dirham. Kami bertanya: Kenapa? Ia menjawab: Karena orang-orang ajam, mereka menahannya. Setelah itu ia berkata: Hampir saja penduduk Syam tidak dipunguti dinar dan mud. Kami bertanya: Kenapa? Ia menjawab: Karena orang-orang Romawi. Ia diam sejenak lalu berkata: Rasulullah Shallallahu 'alaihi wa Salam bersabda: ""Diakhir ummatku nanti akan ada seorang khalifah menebar harta tanpa menghitungnya."" Aku berkata kepada Abu Nadhrah dan Abu Al Ala`: Maksud kalian Umar bin Abdulaziz? Keduanya menjawab: Tidak. telah menceritakan kepada kami [Ibnu Al Mutsanna] telah menceritakan kepada kami [Abdulwahhab] telah menceritakan kepada kami [Sa'id Al Jurairi] dengan sanad ini dengan matan serupa.","حَدَّثَنَا زُهَيْرُ بْنُ حَرْبٍ وَعَلِيُّ بْنُ حُجْرٍ وَاللَّفْظُ لِزُهَيْرٍ قَالَا حَدَّثَنَا إِسْمَعِيلُ بْنُ إِبْرَاهِيمَ عَنْ الْجُرَيْرِيِّ عَنْ أَبِي نَضْرَةَ قَالَ
كُنَّا عِنْدَ جَابِرِ بْنِ عَبْدِ اللَّهِ فَقَالَ يُوشِكُ أَهْلُ الْعِرَاقِ أَنْ لَا يُجْبَى إِلَيْهِمْ قَفِيزٌ وَلَا دِرْهَمٌ قُلْنَا مِنْ أَيْنَ ذَاكَ قَالَ مِنْ قِبَلِ الْعَجَمِ يَمْنَعُونَ ذَاكَ ثُمَّ قَالَ يُوشِكُ أَهْلُ الشَّأْمِ أَنْ لَا يُجْبَى إِلَيْهِمْ دِينَارٌ وَلَا مُدْيٌ قُلْنَا مِنْ أَيْنَ ذَاكَ قَالَ مِنْ قِبَلِ الرُّومِ ثُمَّ سَكَتَ هُنَيَّةً ثُمَّ قَالَ قَالَ رَسُولُ اللَّهِ صَلَّى اللَّهُ عَلَيْهِ وَسَلَّمَ يَكُونُ فِي آخِرِ أُمَّتِي خَلِيفَةٌ يَحْثِي الْمَالَ حَثْيًا لَا يَعُدُّهُ عَدَدًا قَالَ قُلْتُ لِأَبِي نَضْرَةَ وَأَبِي الْعَلَاءِ أَتَرَيَانِ أَنَّهُ عُمَرُ بْنُ عَبْدِ الْعَزِيزِ فَقَالَا لَا
و حَدَّثَنَا ابْنُ الْمُثَنَّى حَدَّثَنَا عَبْدُ الْوَهَّابِ حَدَّثَنَا سَعِيدٌ يَعْنِي الْجُرَيْرِيَّ بِهَذَا الْإِسْنَادِ نَحْوَهُ",69
5190,54,"Telah menceritakan kepada kami [Nashr bin Ali Al Jahdhami] telah menceritakan kepada kami [Bisyr bin Al Mufadhdhal]. Telah menceritakan kepada kami [Ali bin Hujr As Sa'di] telah menceritakan kepada kami [Isma'il bin Ulaiyah] keduanya dari [Sa'id bin Yazid] dari [Abu An Nadhrah] dari [Abu Sa'id] berkata: Rasulullah Shallallahu 'alaihi wa Salam bersabda: ""Diantara khalifah-khalifah kalian, ada seorang khalifah yang menabur harta tanpa menghitungnya."" Riwayat Ibnu Hujr menyebut: YAHTSIL MAAL.","حَدَّثَنَا نَصْرُ بْنُ عَلِيٍّ الْجَهْضَمِيُّ حَدَّثَنَا بِشْرٌ يَعْنِي ابْنَ الْمُفَضَّلِ ح و حَدَّثَنَا عَلِيُّ بْنُ حُجْرٍ السَّعْدِيُّ حَدَّثَنَا إِسْمَعِيلُ يَعْنِي ابْنَ عُلَيَّةَ كِلَاهُمَا عَنْ سَعِيدِ بْنِ يَزِيدَ عَنْ أَبِي نَضْرَةَ عَنْ أَبِي سَعِيدٍ قَالَ
قَالَ رَسُولُ اللَّهِ صَلَّى اللَّهُ عَلَيْهِ وَسَلَّمَ مِنْ خُلَفَائِكُمْ خَلِيفَةٌ يَحْثُو الْمَالَ حَثْيًا لَا يَعُدُّهُ عَدَدًا
وَفِي رِوَايَةِ ابْنِ حُجْرٍ يَحْثِي الْمَالَ",69
