haditsId,kitabId,indo,arab,label
688,5,"Telah menceritakan kepada kami [Hannad] telah menceritakan kepada kami [Abu Mu'wiyah] dari [Al A'masy] dari [Muslim] dia adalah Al Bathin yaitu Ibnu Abu Imran dari [Sa'id bin Jubair] dari [Ibnu Abbas] berkata, Rasulullah Shallallaahu 'alaihi wasallam bersabda: "" Tidak ada hari-hari untuk berbuat amal shalih yang lebih Allah cintai kecuali sepuluh hari pertama bulan Dzul Hijjah, "" para shahabat bertanya, wahai Rasulullah, sekalipun Jihad fi sabilillah?, Rasulullah Shalallahu 'alaihi wa salam menjawab: ""Sekalipun jihad fi sabilillah, kecuali seorang lelaki yang pergi berjihad dengan harta dan jiwanya lalu tidak kembali sedikitpun dari keduanya."" Dalam bab ini (ada juga riwayat -pent) dari Ibnu Umar, Abu Hurairah, Abdullah bin Amru dan Jabir. Hadits Ibnu Abbas merupakan hadits hasan shahih gharib.","حَدَّثَنَا هَنَّادٌ حَدَّثَنَا أَبُو مُعَاوِيَةَ عَنْ الْأَعْمَشِ عَنْ مُسْلِمٍ هُوَ الْبَطِينُ وَهُوَ ابْنُ أَبِي عِمْرَانَ عَنْ سَعِيدِ بْنِ جُبَيْرٍ عَنْ ابْنِ عَبَّاسٍ قَالَ
قَالَ رَسُولُ اللَّهِ صَلَّى اللَّهُ عَلَيْهِ وَسَلَّمَ مَا مِنْ أَيَّامٍ الْعَمَلُ الصَّالِحُ فِيهِنَّ أَحَبُّ إِلَى اللَّهِ مِنْ هَذِهِ الْأَيَّامِ الْعَشْرِ فَقَالُوا يَا رَسُولَ اللَّهِ وَلَا الْجِهَادُ فِي سَبِيلِ اللَّهِ فَقَالَ رَسُولُ اللَّهِ صَلَّى اللَّهُ عَلَيْهِ وَسَلَّمَ وَلَا الْجِهَادُ فِي سَبِيلِ اللَّهِ إِلَّا رَجُلٌ خَرَجَ بِنَفْسِهِ وَمَالِهِ فَلَمْ يَرْجِعْ مِنْ ذَلِكَ بِشَيْءٍ
وَفِي الْبَاب عَنْ ابْنِ عُمَرَ وَأَبِي هُرَيْرَةَ وَعَبْدِ اللَّهِ بْنِ عَمْرٍو وَجَابِرٍ قَالَ أَبُو عِيسَى حَدِيثُ ابْنِ عَبَّاسٍ حَدِيثٌ حَسَنٌ صَحِيحٌ غَرِيبٌ",37
1328,13,"Telah menceritakan kepada kami [Muhammad bin Basysyar], telah menceritakan kepada kami [Abdurrahman bin Mahdi] telah menceritakan kepada kami [Sufyan] dari ['Alqamah bin Martsad] dari [Sulaiman bin Buraidah] dari [ayahnya] ia berkata; Rasulullah shallallahu 'alaihi wasallam jika mengutus pimpinan pasukan, beliau memberi wasiat khusus untuk dirinya untuk bertaqwa kepada Allah dan wasiat kebaikan kepada kaum muslimin yang bersamanya. Beliau bersabda: ""Berperanglah dengan nama Allah dan di Jalan Allah, perangilah orang yang kafir, berperanglah dan janganlah melampaui batas, berkhianat, memutilasi dan janganlah membunuh anak-anak."" Dalam hadits ini terdapat kisah. Ia mengatakan; Dalam hal ini ada hadits serupa dari Abdullah bin Mas'ud, Syaddad bin Aus, Imran bin Hushain, Anas, Samurah, Al Mughirah, Ya'la bin Murrah dan Abu Ayyub. Abu 'Isa berkata; Hadits Buraidah adalah hadits hasan shahih. Para ulama memakruhkan Al Mutslah.","حَدَّثَنَا مُحَمَّدُ بْنُ بَشَّارٍ حَدَّثَنَا عَبْدُ الرَّحْمَنِ بْنُ مَهْدِيٍّ حَدَّثَنَا سُفْيَانُ عَنْ عَلْقَمَةَ بْنِ مَرْثَدٍ عَنْ سُلَيْمَانَ بْنِ بُرَيْدَةَ عَنْ أَبِيهِ قَالَ
كَانَ رَسُولُ اللَّهِ صَلَّى اللَّهُ عَلَيْهِ وَسَلَّمَ إِذَا بَعَثَ أَمِيرًا عَلَى جَيْشٍ أَوْصَاهُ فِي خَاصَّةِ نَفْسِهِ بِتَقْوَى اللَّهِ وَمَنْ مَعَهُ مِنْ الْمُسْلِمِينَ خَيْرًا فَقَالَ اغْزُوا بِسْمِ اللَّهِ وَفِي سَبِيلِ اللَّهِ قَاتِلُوا مَنْ كَفَرَ اغْزُوا وَلَا تَغُلُّوا وَلَا تَغْدِرُوا وَلَا تُمَثِّلُوا وَلَا تَقْتُلُوا وَلِيدًا وَفِي الْحَدِيثِ قِصَّةٌ
قَالَ وَفِي الْبَاب عَنْ عَبْدِ اللَّهِ بْنِ مَسْعُودٍ وَشَدَّادِ بْنِ أَوْسٍ وَعِمْرَانَ بْنِ حُصَيْنٍ وَأَنَسٍ وَسَمُرَةَ وَالْمُغِيرَةِ وَيَعْلَى بْنِ مُرَّةَ وَأَبِي أَيُّوبَ قَالَ أَبُو عِيسَى حَدِيثُ بُرَيْدَةَ حَدِيثٌ حَسَنٌ صَحِيحٌ وَكَرِهَ أَهْلُ الْعِلْمِ الْمُثْلَةَ",37
