haditsId,kitabId,indo,arab,label
3571,49,"Telah menceritakan kepada kami [Abu Ja'far Muhammad bin Al Husain bin Abu Halimah] dari daerah Qahsril Ahnaf, dan [Ahmad bin 'Abdah Adl Dlabbi] serta [Ali bin Hujr] sedangkan (riwayatnya) semakna, mereka berkata; telah menceritakan kepada kami [Isa bin Yunus] telah menceritakan kepada kami [Umar bin Abdullah] bekas budak (yang telah dimerdekakan oleh) Ghufrah, telah menceritakan kepadaku [Ibrahim bin Muhammad] -salah seorang anak Ali bin Abu Thalib- dia berkata; Apabila [Ali radliallahu 'anhu] menshifati Nabi shallallahu 'alaihi wasallam dia berkata; Beliau adalah sosok orang yang berpawakan tidak terlalu tinggi dan tidak pula terlalu pendek, orang yang berpawakan sedang-sedang, rambutnya tidak kaku dan tidak pula keriting, rambutnya lebat, tidak gemuk dan tidak pula kurus, wajahnya sedikit bulat, kedua biji matanya sangat hitam, bulu matanya panjang, persendian-persendiannya yang pokok besar, bahunya bidang, bulu dadanya lembut, tidak ada bulu-bulu di badan, telapak kakinya tebal, jika berjalan seakan-akan sedang berjalan di jalanan yang menurun, jika menoleh seluruh badannya ikut menoleh, di antara kedua bahunya ada stempel kenabian yaitu stempel para Nabi, telapak tangannya bagus, dadanya bidang, yang paling jujur bicaranya, yang lembut perangainya, yang paling mulia pergaulannya, siapa pun yang tiba-tiba memandangnya tentu menaruh hormat kepadanya, siapa yang bergaul dengannya tentu akan mencintainya."" Dia melanjutkan; ""Aku tidak pernah melihat orang yang seperti beliau sebelum maupun sesudahnya."" Abu Isa berkata; ""Hadits ini derajatnya hasan gharib, dan isnadnya tidak bersambung. Abu Ja'far berkata; ""Saya mendengar Al Ashma'i berkata dalam tafsirnya tentang sifat kepribadian Nabi shallallahu 'alaihi wasallam yaitu; ""panjang (rambutnya) menjuntai, dan saya mendengar seorang Arab badui berkata; ""Sangat panjang maksudnya tinggi panjang, sedangkan berperawakan pendek maksudnya sebagian (dari anggota badannya) sangat pendek, keriting maksudnya (rambutnya) sangat keriting (kribo) seperti seseorang yang rambutnya berkelok-kelok artinya bengkok-bengkok, sedangkan ""Al Muthahham"" maksudnya banyak dagingnya, Al Mukaltsam maksudnya wajahnya bulat (oval), dan Al Musyrab maksudnya seakan-akan di ubun-ubunnya ada warna agak kemerah-merahan, sedangkan matanya hitam maksudnya (biji) matanya berwarna hitam, al Ahdab maksudnya bulu matanya panjang, Al Katadu maksudnya kedua bahunya bidang, yang (di depannya) dadanya terdapat bulu yaitu bulu dada yang sangat lembut yang terdapat pada daerah antara dada hingga pusar, dan Syatsnu maksudnya telapak tangan dan kakinya tebal, At Taqallu' maksudnya berjalan dengan penuh kekuatan, dan Ash Shabab maksudnya tempat yang menurun seperti kalimat; ""inhadarnaa fie shabuubin wa shababin"" artinya; ""kami berjalan di daerah yang menurun."" Sedangkan perkataannya; ""Besar tulang pangkalnya, yang di maksud adalah tulang pokok persendiannya."" Al 'Isyrah adalah As Shuhbah (pergaulan) sedangkan Al 'Asyir adalah Ash Shahib (teman) dan Al Badihah adalah Al Mufaja`ah (secara tiba-tiba), contoh perkataan; ""Badahtu bi amrin"" maksudnya adalah; aku melakukan sesuatu kepadanya secara tiba-tiba."" ","حَدَّثَنَا أَبُو جَعْفَرٍ مُحَمَّدُ بْنِ الْحُسَيْنِ بْنِ أَبِي حَلِيمَةَ مِنْ قَصْرِ الْأَحْنَفِ وَأَحْمَدُ بْنُ عَبْدَةَ الضَّبِّيُّ وَعَلِيُّ بْنُ حُجْرٍ الْمَعْنَى وَاحِدٌ قَالُوا حَدَّثَنَا عِيسَى بْنُ يُونُسَ حَدَّثَنَا عُمَرُ بْنُ عَبْدِ اللَّهِ مَوْلَى غُفْرَةَ حَدَّثَنِي إِبْرَاهِيمُ بْنُ مُحَمَّدٍ مِنْ وَلَدِ عَلِيِّ بْنِ أَبِي طَالِبٍ قَالَ
كَانَ عَلِيٌّ رَضِيَ اللَّهُ عَنْهُ إِذَا وَصَفَ النَّبِيَّ صَلَّى اللَّهُ عَلَيْهِ وَسَلَّمَ قَالَ لَمْ يَكُنْ بِالطَّوِيلِ الْمُمَّغِطِ وَلَا بِالْقَصِيرِ الْمُتَرَدِّدِ وَكَانَ رَبْعَةً مِنْ الْقَوْمِ وَلَمْ يَكُنْ بِالْجَعْدِ الْقَطَطِ وَلَا بِالسَّبِطِ كَانَ جَعْدًا رَجِلًا وَلَمْ يَكُنْ بِالْمُطَهَّمِ وَلَا بِالْمُكَلْثَمِ وَكَانَ فِي الْوَجْهِ تَدْوِيرٌ أَبْيَضُ مُشْرَبٌ أَدْعَجُ الْعَيْنَيْنِ أَهْدَبُ الْأَشْفَارِ جَلِيلُ الْمُشَاشِ وَالْكَتَدِ أَجْرَدُ ذُو مَسْرُبَةٍ شَثْنُ الْكَفَّيْنِ وَالْقَدَمَيْنِ إِذَا مَشَى تَقَلَّعَ كَأَنَّمَا يَمْشِي فِي صَبَبٍ وَإِذَا الْتَفَتَ الْتَفَتَ مَعًا بَيْنَ كَتِفَيْهِ خَاتَمُ النُّبُوَّةِ وَهُوَ خَاتَمُ النَّبِيِّينَ أَجْوَدُ النَّاسِ كَفَّا وَأَشْرَحُهُمْ صَدْرًا وَأَصْدَقُ النَّاسِ لَهْجَةً وَأَلْيَنُهُمْ عَرِيكَةً وَأَكْرَمُهُمْ عِشْرَةً مَنْ رَآهُ بَدِيهَةً هَابَهُ وَمَنْ خَالَطَهُ مَعْرِفَةً أَحَبَّهُ يَقُولُ نَاعِتُهُ لَمْ أَرَ قَبْلَهُ وَلَا بَعْدَهُ مِثْلَهُ
قَالَ أَبُو عِيسَى هَذَا حَدِيثٌ حَسَنٌ غَرِيبٌ لَيْسَ إِسْنَادُهُ بِمُتَّصِلٍ قَالَ أَبُو جَعْفَرٍ سَمِعْتُ الْأَصْمَعِيَّ يَقُولُ فِي تَفْسِيرِهِ صِفَةَ النَّبِيِّ صَلَّى اللَّهُ عَلَيْهِ وَسَلَّمَ الْمُمَّغِطُ الذَّاهِبُ طُولًا وَسَمِعْتُ أَعْرَابِيًّا يَقُولُ تَمَغَّطَ فِي نُشَّابَةٍ أَيْ مَدَّهَا مَدًّا شَدِيدًا وَأَمَّا الْمُتَرَدِّدُ فَالدَّاخِلُ بَعْضُهُ فِي بَعْضٍ قِصَرًا وَأَمَّا الْقَطَطُ فَالشَّدِيدُ الْجُعُودَةِ وَالرَّجِلُ الَّذِي فِي شَعْرِهِ حُجُونَةٌ أَيْ يَنْحَنِي قَلِيلًا وَأَمَّا الْمُطَهَّمُ فَالْبَادِنُ الْكَثِيرُ اللَّحْمِ وَأَمَّا الْمُكَلْثَمُ فَالْمُدَوَّرُ الْوَجْهِ وَأَمَّا الْمُشْرَبُ فَهُوَ الَّذِي فِي نَاصِيَتِهِ حُمْرَةٌ وَالْأَدْعَجُ الشَّدِيدُ سَوَادِ الْعَيْنِ وَالْأَهْدَبُ الطَّوِيلُ الْأَشْفَارِ وَالْكَتَدُ مُجْتَمَعُ الْكَتِفَيْنِ وَهُوَ الْكَاهِلُ وَالْمَسْرُبَةُ هُوَ الشَّعْرُ الدَّقِيقُ الَّذِي هُوَ كَأَنَّهُ قَضِيبٌ مِنْ الصَّدْرِ إِلَى السُّرَّةِ وَالشَّثْنُ الْغَلِيظُ الْأَصَابِعِ مِنْ الْكَفَّيْنِ وَالْقَدَمَيْنِ وَالتَّقَلُّعُ أَنْ يَمْشِيَ بِقُوَّةٍ وَالصَّبَبُ الْحُدُورُ يَقُولُ انْحَدَرْنَا فِي صَبُوبٍ وَصَبَبٍ وَقَوْلُهُ جَلِيلُ الْمُشَاشِ يُرِيدُ رُءُوسَ الْمَنَاكِبِ وَالْعِشْرَةُ الصُّحْبَةُ وَالْعَشِيرُ الصَّاحِبُ وَالْبَدِيهَةُ الْمُفَاجَأَةُ يُقَالُ بَدَهْتُهُ بِأَمْرٍ أَيْ فَجَأْتُهُ",42
3592,49,"Telah menceritakan kepada kami [Muhammad bin Abdul Malik bin Abu Asy Syawarib] telah menceritakan kepada kami [Abu 'Awanah] dari [Abdul Malik bin 'Umair] dari [Ibnu Abu Al Mu'alla] dari [ayahnya] bahwa suatu hari Rasulullah shallallahu 'alaihi wasallam berkhutbah, beliau bersabda: ""Sesungguhnya ada seorang laki-laki yang diberi pilihan oleh Rabbnya Azza wa jalla untuk memilih antara hidup di dunia sesuka hati, ia bisa makan di dunia sesuka hati atau memilih berjumpa dengan Rabbnya, maka ia pun memilih berjumpa dengan Rabbnya."" Abu Al Mu'ala berkata: ""Lalu Abu Bakar menangis."" Maka para sahabat Nabi shallallahu 'alaihi wasallam berkata; ""Tidakkah kalian heran dengan orang tua ini (Abu Bakr), ketika Rasulullah shallallahu 'alaihi wasallam menceritakan tentang seorang laki-laki shalih yang disuruh Rabnya memilih antara (perhiasan) dunia atau berjumpa dengan Rabbnya namun ia memilih berjumpa dengan Rabbnya."" Abu Al Mu'alla berkata; ""Abu Bakar adalah orang yang paling mengerti maksud dari sabda Rasulullah shallallahu 'alaihi wasallam di antara para sahabat yang lain, maka Abu bakar berkata; ""Bahkan kami akan menebus anda dengan harta dan anak-anak kami wahai Rasulullah."" Maka Rasulullah shallallahu 'alaihi wasallam bersabda: ""Tidak seorang pun di antara manusia yang lebih berbuat baik kepada kami dalam persahabatannya dan apa yang telah diberikannya melebihi imannya Ibnu Abi Quhafah (Abu Bakar), seandaianya aku boleh menjadikan khalil (kekasih sebagai seorang Nabi-pent) tentulah aku menjadikan Ibnu Abi Quhafah sebagai khalil, akan tetapi ia sangat menyukai persaudaraan dan keimanan (yang tulus), akan tetapi ia sangat menyukai persaudaraan dan keimanan (yang tulus), -beliau mengatakannya hingga dua kali-. Ketahuilah sesungguhnya sahabat kalian ini (Abu Bakar) adalah khalilullah."" Dan dalam bab ini, ada juga riwayat dari Abu Sa'id. Hadits ini derajatnya hasan gharib, hadits ini juga telah diriwayatkan dari Abu 'Awanah dari Abdul Malik bin 'Umair dengan sanad selain ini, sedangkan makna sabda beliau: ""Amanna ilaina (berbuat baik kepada kami) maksudnya adalah Amanna 'alaina (berbuat baik atas kami)."" ","حَدَّثَنَا مُحَمَّدُ بْنُ عَبْدِ الْمَلِكِ بْنِ أَبِي الشَّوَارِبِ حَدَّثَنَا أَبُو عَوَانَةَ عَنْ عَبْدِ الْمَلِكِ بْنِ عُمَيْرٍ عَنْ ابْنِ أَبِي الْمُعَلَّى عَنْ أَبِيهِ
أَنَّ رَسُولَ اللَّهِ صَلَّى اللَّهُ عَلَيْهِ وَسَلَّمَ خَطَبَ يَوْمًا فَقَالَ إِنَّ رَجُلًا خَيَّرَهُ رَبُّهُ بَيْنَ أَنْ يَعِيشَ فِي الدُّنْيَا مَا شَاءَ أَنْ يَعِيشَ وَيَأْكُلَ فِي الدُّنْيَا مَا شَاءَ أَنْ يَأْكُلَ وَبَيْنَ لِقَاءِ رَبِّهِ فَاخْتَارَ لِقَاءَ رَبِّهِ قَالَ فَبَكَى أَبُو بَكْرٍ فَقَالَ أَصْحَابُ النَّبِيِّ صَلَّى اللَّهُ عَلَيْهِ وَسَلَّمَ أَلَا تَعْجَبُونَ مِنْ هَذَا الشَّيْخِ إِذْ ذَكَرَ رَسُولُ اللَّهِ صَلَّى اللَّهُ عَلَيْهِ وَسَلَّمَ رَجُلًا صَالِحًا خَيَّرَهُ رَبُّهُ بَيْنَ الدُّنْيَا وَبَيْنَ لِقَاءِ رَبِّهِ فَاخْتَارَ لِقَاءَ رَبِّهِ قَالَ فَكَانَ أَبُو بَكْرٍ أَعْلَمَهُمْ بِمَا قَالَ رَسُولُ اللَّهِ صَلَّى اللَّهُ عَلَيْهِ وَسَلَّمَ فَقَالَ أَبُو بَكْرٍ بَلْ نَفْدِيكَ بِآبَائِنَا وَأَمْوَالِنَا فَقَالَ رَسُولُ اللَّهِ صَلَّى اللَّهُ عَلَيْهِ وَسَلَّمَ مَا مِنْ النَّاسِ أَحَدٌ أَمَنَّ إِلَيْنَا فِي صُحْبَتِهِ وَذَاتِ يَدِهِ مِنْ ابْنِ أَبِي قُحَافَةَ وَلَوْ كُنْتُ مُتَّخِذًا خَلِيلًا لَاتَّخَذْتُ ابْنَ أَبِي قُحَافَةَ خَلِيلًا وَلَكِنْ وُدٌّ وَإِخَاءُ إِيمَانٍ وُدٌّ وَإِخَاءُ إِيمَانٍ مَرَّتَيْنِ أَوْ ثَلَاثًا وَإِنَّ صَاحِبَكُمْ خَلِيلُ اللَّهِ
وَفِي الْبَاب عَنْ أَبِي سَعِيدٍ وَهَذَا حَدِيثٌ حَسَنٌ غَرِيبٌ وَقَدْ رُوِيَ هَذَا الْحَدِيثُ عَنْ أَبِي عَوَانَةَ عَنْ عَبْدِ الْمَلِكِ بْنِ عُمَيْرٍ بِإِسْنَادٍ غَيْرِ هَذَا وَمَعْنَى قَوْلِهِ أَمَنَّ إِلَيْنَا يَعْنِي أَمَنَّ عَلَيْنَا",42
3595,49,"Telah menceritakan kepada kami [Al Hasan bin As Shabah Al Bazzar] telah menceritakan kepada kami [Sufyan bin 'Uyainah] dari [Za`idah] dari [Abdul Malik bin Umair] dari [Rib'i yaitu Ibnu Hirasy] dari [Hudzaifah] dia berkata; Rasulullah shallallahu 'alaihi wasallam bersabda: ""Teladanilah dua orang sepeninggalku yaitu Abu Bakar dan Umar."" Dan dalam bab ini, ada juga riwayat dari Ibnu Mas'ud. Abu Isa berkata; ""Hadits ini adalah hadits hasan, dan hadits ini juga di riwayatkan pula oleh [Sufyan Ats Tsauri] dari [Abdul Malik bin 'Umair] dari [bekas budak (yang telah dimerdekakan oleh) Rib'i] dari [Rib'i] dari [Hudzaifah] dari Nabi shallallahu 'alaihi wasallam. Telah menceritakan kepada kami [Ahmad bin Mani'] dan yang lain, mereka berkata; telah menceritakan kepada kami [Sufyan bin 'Uyainah] dari [Abdul Malik bin 'Umair] seperti hadits di atas, sedangkan Sufyan bin 'Uyainah telah berbuat tadlis (menyamarkan, menggelapkan, meyembunyikan, menipu) dalam hadits ini, kemungkinan ia menyebutkannya dari Za`idah dari Abdul Malik bin Umair seperti hadits di atas, dan kemungkinan juga ia tidak menyebutkan di dalam sanadnya dari Zaidah. Hadits ini juga di riwayatkan oleh [Ibrahim bin Sa'd] dari [Sufyan Ats Tsauri] dari [Abdul Malik bin 'Umair] dari [Hilal] bekas budak (yang telah dimerdekakan oleh) dari [Rib'i] dari [Hudzaifah] dari Nabi shallallahu 'alaihi wasallam. hadits ini juga diriwayatkan melalui jalur selain ini, dari [Rib'i] dari [Hudzaifah] dari Nabi shallallahu 'alaihi wasallam. dan diriwayatkan pula oleh [Salim Al Al'an'umi] seorang Kufah dari [Rib'I bin Hirasy] dari [Hudzaifah].""","حَدَّثَنَا الْحَسَنُ بْنُ الصَّبَّاحِ الْبَزَّارُ حَدَّثَنَا سُفْيَانُ بْنُ عُيَيْنَةَ عَنْ زَائِدَةَ عَنْ عَبْدِ الْمَلِكِ بْنِ عُمَيْرٍ عَنْ رِبْعِيٍّ وَهُوَ ابْنُ حِرَاشٍ عَنْ حُذَيْفَةَ قَالَ
قَالَ رَسُولُ اللَّهِ صَلَّى اللَّهُ عَلَيْهِ وَسَلَّمَ اقْتَدُوا بِاللَّذَيْنِ مِنْ بَعْدِي أَبِي بَكْرٍ وَعُمَرَ
وَفِي الْبَاب عَنْ ابْنِ مَسْعُودٍ قَالَ أَبُو عِيسَى هَذَا حَدِيثٌ حَسَنٌ وَرَوَى سُفْيَانُ الثَّوْرِيُّ هَذَا الْحَدِيثَ عَنْ عَبْدِ الْمَلِكِ ابْنِ عُمَيْرٍ عَنْ مَوْلًى لِرِبْعِيٍّ عَنْ رِبْعِيٍّ عَنْ حُذَيْفَةَ عَنْ النَّبِيِّ صَلَّى اللَّهُ عَلَيْهِ وَسَلَّمَ حَدَّثَنَا أَحْمَدُ بْنُ مَنِيعٍ وَغَيْرُ وَاحِدٍ قَالُوا حَدَّثَنَا سُفْيَانُ بْنُ عُيَيْنَةَ عَنْ عَبْدِ الْمَلِكِ بْنِ عُمَيْرٍ نَحْوَهُ وَكَانَ سُفْيَانُ بْنُ عُيَيْنَةَ يُدَلِّسُ فِي هَذَا الْحَدِيثِ فَرُبَّمَا ذَكَرَهُ عَنْ زَائِدَةَ عَنْ عَبْدِ الْمَلِكِ بْنِ عُمَيْرٍ وَرُبَّمَا لَمْ يَذْكُرْ فِيهِ عَنْ زَائِدَةَ وَرَوَى هَذَا الْحَدِيثَ إِبْرَاهِيمُ بْنُ سَعْدٍ عَنْ سُفْيَانَ الثَّوْرِيِّ عَنْ عَبْدِ الْمَلِكِ بْنِ عُمَيْرٍ عَنْ هِلَالٍ مَوْلَى رِبْعِيٍّ عَنْ رِبْعِيٍّ عَنْ حُذَيْفَةَ عَنْ النَّبِيِّ صَلَّى اللَّهُ عَلَيْهِ وَسَلَّمَ وَقَدْ رُوِيَ هَذَا الْحَدِيثُ مِنْ غَيْرِ هَذَا الْوَجْهِ أَيْضًا عَنْ رِبْعِيٍّ عَنْ حُذَيْفَةَ عَنْ النَّبِيِّ صَلَّى اللَّهُ عَلَيْهِ وَسَلَّمَ وَرَوَاهُ سَالِمٌ الْأَنْعُمِيُّ كُوفِيٌّ عَنْ رِبْعِيِّ بْنِ حِرَاشٍ عَنْ حُذَيْفَةَ",42
3616,49,"Telah menceritakan kepada kami [Abu Kuraib] telah menceritakan kepada kami [Yunus bin Bukair] dari [An Nadhr Abu Umar] dari ['Ikrimah] dari [Ibnu Abbas] bahwa Nabi shallallahu 'alaihi wasallam pernah berdo'a: ""Ya Allah, muliakanlah Islam dengan Abu Jahal bin Hisyam atau Umar."" Ibnu Abbas berkata; ""Ternyata di pagi harinya, Umar datang menemui Rasulullah shallallahu 'alaihi wasallam untuk memeluk Islam."" Abu Isa berkata; ""Hadits ini derajatnya gharib melalui jalur ini, dan sebagian mereka (ahli hadits) telah memberi komentar mengenai diri An Nadhr Abu Umar, karena ia meriwayatkan dari para perawi yang riwayatnya munkar."" ","حَدَّثَنَا أَبُو كُرَيْبٍ حَدَّثَنَا يُونُسُ بْنُ بُكَيْرٍ عَنْ النَّضْرِ أَبِي عُمَرَ عَنْ عِكْرِمَةَ عَنْ ابْنِ عَبَّاسٍ
أَنَّ النَّبِيَّ صَلَّى اللَّهُ عَلَيْهِ وَسَلَّمَ قَالَ اللَّهُمَّ أَعِزَّ الْإِسْلَامَ بِأَبِي جَهْلِ ابْنِ هِشَامٍ أَوْ بِعُمَرَ قَالَ فَأَصْبَحَ فَغَدَا عُمَرُ عَلَى رَسُولِ اللَّهِ صَلَّى اللَّهُ عَلَيْهِ وَسَلَّمَ فَأَسْلَمَ
قَالَ أَبُو عِيسَى هَذَا حَدِيثٌ غَرِيبٌ مِنْ هَذَا الْوَجْهِ وَقَدْ تَكَلَّمَ بَعْضُهُمْ فِي النَّضْرِ أَبِي عُمَرَ وَهُوَ يَرْوِي مَنَاكِيرَ",42
3648,49,"Telah menceritakan kepada kami [Sufyan bin Waki'] telah menceritakan kepada kami [ayahku] dari [Syarik] dari [Manshur] dari [Rib'i bin Hirasy]; telah menceritakan kepada kami [Ali bin Abi Thalib] ketika di Rahabiyah, dia berkata; ""Ketika peristiwa Hudaibiyah, sekelompok orang-orang Musryik, -diantara mereka terdapat Suheil bin 'Amru dan sekelompok dari pemimpin kaum musyrikin- yang keluar memerangi kami. Lalu mereka (para sahabat) berkata; ""Wahai Rasulullah, sekelompok orang dari anak-anak kami, saudara-saudara kami dan budak-budak kami keluar memerangimu, padahal mereka tidak paham terhadap agama, akan tetapi mereka berperang karena lari dengan membawa harta-harta kami dan kebun-kebun kami, maka kembalikanlah mereka kepada kami."" Beliau bersabda; ""Bila mereka tidak paham terhadap agama, maka kami akan memahamkan mereka."" Lalu Nabi shallallahu 'alaihi wasallam bersabda: ""Wahai kaum Quraisy, Kalian tidak akan henti-hentinya (mengatakan apa yang kalian katakan), sungguh Allah akan mengutus atas kalian orang yang akan memenggal leher kalian dengan pedang, ketika (kalian) berada diatas agama, sungguh Allah telah menguji keimanan yang ada pada hatinya."" Lalu mereka bertanya; ""Siapakah dia ya Rasulullah?"" Abu Bakar juga bertanya kepada beliau; ""Siapa dia ya Rasulullah?"" dan Umar pun bertanya kepada beliau; ""Siapa dia ya Rasulullah?"" beliau menjawab: ""Ia adalah seorang yang memperbaiki sandal."" lalu beliau memberikan sandalnya kepada Ali untuk di perbaiki. Ali menoleh kepada kami seraya berkata; ""Sesungguhnya Rasulullah shallallahu 'alaihi wasallam telah bersabda: ""Barangsiapa yang berdusta atas namaku, maka bersiaplah menempati tempat tinggalnya di neraka."" Abu Isa berkata; ""Hadits ini adalah hadits hasan shahih gharib. Kami tidak mengetahuinya kecuali dari dari jalur ini yaitu dari hadits Rib'i dari Ali dia berkata…"" dan saya telah mendengar Jarud berkata; saya mendengar Waki' berkomentar; Rib'i bin Hirasy tidak pernah sama sekali berdusta dalam Islam, dan telah mengabarkan kepadaku Muhammad bin Isma'il dari Abdullah bin Abu Al Aswad dia berkata; saya mendengar Abdurrahman bin Mahdi berkata; ""Manshur bin Al Mu'tamir adalah seoraang perawi kufah yang paling kuat."" ","حَدَّثَنَا سُفْيَانُ بْنُ وَكِيعٍ حَدَّثَنَا أَبِي عَنْ شَرِيكٍ عَنْ مَنْصُورٍ عَنْ رِبْعِيِّ بْنِ حِرَاشٍ حَدَّثَنَا عَلِيُّ بْنُ أَبِي طَالِبٍ بِالرَّحَبِيَّةِ قَالَ
لَمَّا كَانَ يَوْمُ الْحُدَيْبِيَةِ خَرَجَ إِلَيْنَا نَاسٌ مِنْ الْمُشْرِكِينَ فِيهِمْ سُهَيْلُ بْنُ عَمْرٍو وَأُنَاسٌ مِنْ رُؤَسَاءِ الْمُشْرِكِينَ فَقَالُوا يَا رَسُولَ اللَّهِ خَرَجَ إِلَيْكَ نَاسٌ مِنْ أَبْنَائِنَا وَإِخْوَانِنَا وَأَرِقَّائِنَا وَلَيْسَ لَهُمْ فِقْهٌ فِي الدِّينِ وَإِنَّمَا خَرَجُوا فِرَارًا مِنْ أَمْوَالِنَا وَضِيَاعِنَا فَارْدُدْهُمْ إِلَيْنَا قَالَ فَإِنْ لَمْ يَكُنْ لَهُمْ فِقْهٌ فِي الدِّينِ سَنُفَقِّهُهُمْ فَقَالَ النَّبِيُّ صَلَّى اللَّهُ عَلَيْهِ وَسَلَّمَ يَا مَعْشَرَ قُرَيْشٍ لَتَنْتَهُنَّ أَوْ لَيَبْعَثَنَّ اللَّهُ عَلَيْكُمْ مَنْ يَضْرِبُ رِقَابَكُمْ بِالسَّيْفِ عَلَى الدِّينِ قَدْ امْتَحَنَ اللَّهُ قَلْبَهُ عَلَى الْإِيمَانِ قَالُوا مَنْ هُوَ يَا رَسُولَ اللَّهِ فَقَالَ لَهُ أَبُو بَكْرٍ مَنْ هُوَ يَا رَسُولَ اللَّهِ وَقَالَ عُمَرُ مَنْ هُوَ يَا رَسُولَ اللَّهِ قَالَ هُوَ خَاصِفُ النَّعْلِ وَكَانَ أَعْطَى عَلِيًّا نَعْلَهُ يَخْصِفُهَا ثُمَّ الْتَفَتَ إِلَيْنَا عَلِيٌّ فَقَالَ إِنَّ رَسُولَ اللَّهِ صَلَّى اللَّهُ عَلَيْهِ وَسَلَّمَ قَالَ مَنْ كَذَبَ عَلَيَّ مُتَعَمِّدًا فَلْيَتَبَوَّأْ مَقْعَدَهُ مِنْ النَّارِ
قَالَ أَبُو عِيسَى هَذَا حَدِيثٌ حَسَنٌ صَحِيحٌ غَرِيبٌ لَا نَعْرِفُهُ إِلَّا مِنْ هَذَا الْوَجْهِ مِنْ حَدِيثِ رِبْعِيٍّ عَنْ عَلِيٍّ قَالَ و سَمِعْت الْجَارُودَ يَقُولُ سَمِعْتُ وَكِيعًا يَقُولُ لَمْ يَكْذِبْ رِبْعِيُّ بْنُ حِرَاشٍ فِي الْإِسْلَامِ كَذْبَةً و أَخْبَرَنِي مُحَمَّدُ بْنُ إِسْمَعِيلَ عَنْ عَبْدِ اللَّهِ بْنِ أَبِي الْأَسْوَدِ قَال سَمِعْتُ عَبْدَ الرَّحْمَنِ بْنَ مَهْدِيٍّ يَقُولُ مَنْصُورُ بْنُ الْمُعْتَمِرِ أَثْبَتُ أَهْلِ الْكُوفَةِ",42
3650,49,"Telah menceritakan kepada kami [Qutaibah] telah menceritakan kepada kami [Ja'far bin Sulaiman] dari [Abu Harun] dari [Abu Sa'id Al Khudri] dia berkata; ""Sungguh kami orang-orang Anshar mengetahui orang-orang Munafik dengan kebencian mereka terhadap Ali bin Abi Thalib."" Abu Isa berkata; ""Hadits ini adalah hadits gharib, kami hanya mengetahuinya dari hadits Abu Harun, Syu'bah telah memperbincangkan jati diri Harun, hadits ini juga telah diriwayatkan dari [Al A'masy] dari [Abu Shalih] dari [Abu Sa'id]."" ","حَدَّثَنَا قُتَيْبَةُ حَدَّثَنَا جَعْفَرُ بْنُ سُلَيْمَانَ عَنْ أَبِي هَارُونَ عَنْ أَبِي سَعِيدٍ الْخُدْرِيِّ قَالَ
إِنَّا كُنَّا لَنَعْرِفُ الْمُنَافِقِينَ نَحْنُ مَعْشَرَ الْأَنْصَارِ بِبُغْضِهِمْ عَلِيَّ بْنَ أَبِي طَالِبٍ
قَالَ أَبُو عِيسَى هَذَا حَدِيثٌ غَرِيبٌ إِنَّمَا نَعْرِفُهُ مِنْ حَدِيثِ أَبِي هَارُونَ وَقَدْ تَكَلَّمَ شُعْبَةُ فِي أَبِي هَارُونَ وَقَدْ رُوِيَ هَذَا عَنْ الْأَعْمَشِ عَنْ أَبِي صَالِحٍ عَنْ أَبِي سَعِيدٍ",42
