haditsId,kitabId,indo,arab,label
158,2,"telah menceritakan kepada kami [Qutaibah] berkata; telah menceritakan kepada kami [Marwan bin Mu'awiyah Al Fazari] dari [Abu Ya'fur] dari [Al Walid bin Al 'Aizar] dari [Abu 'Amru Asy Syaibani] bahwa seorang laki-laki berkata kepada [Ibnu Mas'ud], ""Amal apakah yang paling utama?"" ia berkata; ""Aku pernah bertanya Rasulullah shallallahu 'alaihi wasallam tentang hal itu, maka beliau pun menjawab: ""Shalat sesuai dengan waktunya, "" aku bertanya lagi, ""Wahai Rasulullah, lalu apa lagi?"" beliau menjawab: ""Berbuat baik kepada kedua orang tua, "" aku bertanya lagi, ""Wahai Rasulullah, lalu apa lagi?"" beliau menjawab: ""Jihad di jalan Allah."" Abu Isa berkata; ""Hadits ini derajatnya hasan shahih. Dan hadits ini telah diriwayatkan oleh [Al Mas'udi] dan [Syu'bah] dan [Sulaiman] -yakni Abu Ishaq Asy Syaibani- dan yang lain-lain dari [Al Walid bin Al 'Aizar].""","حَدَّثَنَا قُتَيْبَةُ حَدَّثَنَا مَرْوَانُ بْنُ مُعَاوِيَةَ الْفَزَارِيُّ عَنْ أَبِي يَعْفُورٍ عَنْ الْوَلِيدِ بْنِ الْعَيْزَارِ عَنْ أَبِي عَمْرٍو الشَّيْبَانِيِّ
أَنَّ رَجُلًا قَالَ لِابْنِ مَسْعُودٍ أَيُّ الْعَمَلِ أَفْضَلُ قَالَ سَأَلْتُ عَنْهُ رَسُولَ اللَّهِ صَلَّى اللَّهُ عَلَيْهِ وَسَلَّمَ فَقَالَ الصَّلَاةُ عَلَى مَوَاقِيتِهَا قُلْتُ وَمَاذَا يَا رَسُولَ اللَّهِ قَالَ وَبِرُّ الْوَالِدَيْنِ قُلْتُ وَمَاذَا يَا رَسُولَ اللَّهِ قَالَ وَالْجِهَادُ فِي سَبِيلِ اللَّهِ
قَالَ أَبُو عِيسَى وَهَذَا حَدِيثٌ حَسَنٌ صَحِيحٌ وَقَدْ رَوَى الْمَسْعُودِيُّ وَشُعْبَةُ وَسُلَيْمَانُ هُوَ أَبُو إِسْحَقَ الشَّيْبَانِيُّ وَغَيْرُ وَاحِدٍ عَنْ الْوَلِيدِ بْنِ الْعَيْزَارِ هَذَا الْحَدِيثَ",43
165,2,"telah menceritakan kepada kami [Muhammad bin Basyar Bundar] berkata; telah menceritakan kepada kami [Mu'adz bin Hisyam] berkata; telah menceritakan kepadaku [Ayahku] dari [Yahya bin Abu Katsir] berkata; telah menceritakan kepada kami [Abu Salamah bin Abdurrahman] dari [Jabir bin Abdullah] berkata: ""Pada saat perang Khandaq, Umar bin Khaththab mencerca orang-orang kafir Quraisy seraya mengatakan, ""Wahai Rasulullah, hampir-hampir saya tidak bisa melaksanakan shalat asar hingga matahari tenggelam!"" Rasulullah shallallahu 'alaihi wasallam kemudian menjawab: ""Demi Allah, aku juga belum melaksanakannya."" Jabir berkata; ""Kemudian kami singgah di Buthhan (sebuah lembah di Madinah), lalu Rasulullah shallallahu 'alaihi wasallam berwudlu dan kamipun ikut berwudlu, Rasulullah shallallahu 'alaihi wasallam kemudian melaksanakan shalat asar setelah matahari tenggelam, setelah itu beliau melaksanakan shalat maghrib."" Abu Isa berkata; ""Hadits ini derejatnya hasan shahih.""","و حَدَّثَنَا مُحَمَّدُ بْنُ بَشَّارٍ بُنْدَارٌ حَدَّثَنَا مُعَاذُ بْنُ هِشَامٍ حَدَّثَنِي أَبِي عَنْ يَحْيَى بْنِ أَبِي كَثِيرٍ حَدَّثَنَا أَبُو سَلَمَةَ بْنُ عَبْدِ الرَّحْمَنِ عَنْ جَابِرِ بْنِ عَبْدِ اللَّهِ
أَنَّ عُمَرَ بْنَ الْخَطَّابِ قَالَ يَوْمَ الْخَنْدَقِ وَجَعَلَ يَسُبُّ كُفَّارَ قُرَيْشٍ قَالَ يَا رَسُولَ اللَّهِ مَا كِدْتُ أُصَلِّي الْعَصْرَ حَتَّى تَغْرُبَ الشَّمْسُ فَقَالَ رَسُولُ اللَّهِ صَلَّى اللَّهُ عَلَيْهِ وَسَلَّمَ وَاللَّهِ إِنْ صَلَّيْتُهَا قَالَ فَنَزَلْنَا بُطْحَانَ فَتَوَضَّأَ رَسُولُ اللَّهِ صَلَّى اللَّهُ عَلَيْهِ وَسَلَّمَ وَتَوَضَّأْنَا فَصَلَّى رَسُولُ اللَّهِ صَلَّى اللَّهُ عَلَيْهِ وَسَلَّمَ الْعَصْرَ بَعْدَ مَا غَرَبَتْ الشَّمْسُ ثُمَّ صَلَّى بَعْدَهَا الْمَغْرِبَ
قَالَ أَبُو عِيسَى هَذَا حَدِيثٌ حَسَنٌ صَحِيحٌ",43
197,2,"telah menceritakan kepada kami [Muhammad bin Yahya An Naisaburi] berkata; telah menceritakan kepada kami [Abdurrazaq] berkata; telah mengabarkan kepada kami [Ma'mar] dari [Az Zuhri] dari [Anas bin Malik] ia berkata; ""Di malam isra` Nabi shallallahu 'alaihi wasallam diberi kewajiban untuk melaksanakan shalat sebanyak lima puluh kali. Kemudian bilangan tersebut dikurangi hingga menjadi lima kali, beliau lalu diseru, ""Wahai Muhammad, sesungguhnya ketentuan yang ada di sisi-Ku tidak bisa dirubah, maka engkau akan mendapatkan pahala lima puluh (waktu shalat) dengan lima (waktu shalat) ini."" Ia berkata; ""Dalam bab ini ada juga hadits dari Ubadah bin Ash Shamit, Thalhah bin Ubaidullah, Abu Dzar, Abu Qatadah, Malik bin Sha'sha'ah dan Abu Sa'id Al Khudri."" Abu Isa berkata; ""Hadits Anas adalah hadits hasan shahih gharib.""","حَدَّثَنَا مُحَمَّدُ بْنُ يَحْيَى النَّيْسَابُورِيُّ حَدَّثَنَا عَبْدُ الرَّزَّاقِ أَخْبَرَنَا مَعْمَرٌ عَنْ الزُّهْرِيِّ عَنْ أَنَسِ بْنِ مَالِكٍ قَالَ
فُرِضَتْ عَلَى النَّبِيِّ صَلَّى اللَّهُ عَلَيْهِ وَسَلَّمَ لَيْلَةَ أُسْرِيَ بِهِ الصَّلَوَاتُ خَمْسِينَ ثُمَّ نُقِصَتْ حَتَّى جُعِلَتْ خَمْسًا ثُمَّ نُودِيَ يَا مُحَمَّدُ إِنَّهُ لَا يُبَدَّلُ الْقَوْلُ لَدَيَّ وَإِنَّ لَكَ بِهَذِهِ الْخَمْسِ خَمْسِينَ
قَالَ وَفِي الْبَاب عَنْ عُبَادَةَ بْنِ الصَّامِتِ وَطَلْحَةَ بْنِ عُبَيْدِ اللَّهِ وَأَبِي ذَرٍّ وَأَبِي قَتَادَةَ وَمَالِكِ بْنِ صَعْصَعَةَ وَأَبِي سَعِيدٍ الْخُدْرِيِّ قَالَ أَبُو عِيسَى حَدِيثُ أَنَسٍ حَدِيثٌ حَسَنٌ صَحِيحٌ غَرِيبٌ",43
318,2,"telah menceritakan kepada kami [Muhammad bin Basysyar] berkata; telah menceritakan kepada kami [Yahya bin Sa'id] dari [Syu'bah] dari [Abu At Tayyah Adl Dluba'i] dari [Anas bin Malik] berkata; ""Nabi shallallahu 'alaihi wasallam pernah shalat di kandang kambing."" Abu Isa berkata; ""Hadits ini derajatnya hasan shahih. Dan Abu At Tayyah Adl Dluba'i namanya Yazid bin Humaid.""","حَدَّثَنَا مُحَمَّدُ بْنُ بَشَّارٍ حَدَّثَنَا يَحْيَى بْنُ سَعِيدٍ عَنْ شُعْبَةَ عَنْ أَبِي التَّيَّاحِ الضُّبَعِيِّ عَنْ أَنَسِ بْنِ مَالِكٍ
أَنَّ النَّبِيَّ صَلَّى اللَّهُ عَلَيْهِ وَسَلَّمَ كَانَ يُصَلِّي فِي مَرَابِضِ الْغَنَمِ
قَالَ أَبُو عِيسَى هَذَا حَدِيثٌ حَسَنٌ صَحِيحٌ وَأَبُو التَّيَّاحِ الضُّبَعِيُّ اسْمُهُ يَزِيدُ بْنُ حُمَيْدٍ",43
404,2,"Telah menceritakan kepada kami [Ishaq bin Musa Al Anshari] telah menceritakan kepada kami [Ma'n bin Isa] telah menceritakan kepada kami [Malik] dari [Ibnu Syihab] dari ['Urwah] dari ['Aisyah] bahwasannya Rasulullah shallallahu 'alaihi wasallam melaksanakan shalat malam sebelas raka'at dengan satu kali witir, jika beliau selesai, beliau berbaring diatas tulang rusuknya yang sebelah kanan. Telah menceritakan kepada kami [Qutaibah] dari [Malik] dari [Ibnu Syihab] seperti itu, Abu Isa berkata, ini adalah hadits hasan shahih.","حَدَّثَنَا إِسْحَقُ بْنُ مُوسَى الْأَنْصَارِيُّ حَدَّثَنَا مَعْنُ بْنُ عِيسَى حَدَّثَنَا مَالِكٌ عَنْ ابْنِ شِهَابٍ عَنْ عُرْوَةَ عَنْ عَائِشَةَ
أَنَّ رَسُولَ اللَّهِ صَلَّى اللَّهُ عَلَيْهِ وَسَلَّمَ كَانَ يُصَلِّي مِنْ اللَّيْلِ إِحْدَى عَشْرَةَ رَكْعَةً يُوتِرُ مِنْهَا بِوَاحِدَةٍ فَإِذَا فَرَغَ مِنْهَا اضْطَجَعَ عَلَى شِقِّهِ الْأَيْمَنِ
حَدَّثَنَا قُتَيْبَةُ عَنْ مَالِكٍ عَنْ ابْنِ شِهَابٍ نَحْوَهُ قَالَ أَبُو عِيسَى هَذَا حَدِيثٌ حَسَنٌ صَحِيحٌ",43
485,3,"Telah menceritakan kepada kami [Ahmad bin Mani'] telah menceritakan kepada kami [Abu Mu'awiyah] dari [Hajjaj] dari [Al Hakam] dari [Miqsam] dari [Ibnu Abbas] dia berkata, Nabi Shallahu 'alaihi wa sallam mengutus Abdullah bin Rawahah dalam sebuah ekspedisi, pada saat itu bertepatan dengan hari Juma'at, kemudian sahabat-sahabatnya telah berangkat dipagi hari, lalu dia berkata, saya akan menunda keberangkatan sehingga saya bisa shalat (jum'at) bersama Rasulullah Shallahu 'alaihi wa sallam kemudian saya akan menyusul mereka, tatkala dia shalat bersama Rasulullah Shallahu 'alaihi wa sallam, beliau melihatnya, maka beliau bersabda: ""Apa yang mencegahmu untuk tidak berangkat bersama dengan para sahabatmu?"" dia menjawab, saya ingin shalat bersamamu, lalu saya akan menyusul mereka (setelah shalat). Lantas beliau bersabda: ""Sekiranya kamu menginfakkan semua yang ada dibumi, kamu tidak akan dapat menyamai keutamaan mereka berangkat dipagi hari."" Abu Isa berkata, ini adalah hadits gharib, kami tidak mengetahuinya selain jalur ini. Ali bin Madini berkata, berkata Yahya bin Sa'id. Dan Syu'bah juga berkata, Al Hakam belum pernah mendengar dari Miqsam kecuali hanya lima haidts, kemudian Syu'bah menghitungnya (hadits yang dihafal oleh Al Hakam dari Miqsam), sedangkan hadits ini tidak termasuk yang dihitung oleh Syu'bah, maka sepertinya Al Hakam tidak mendengar hadits ini dari Miqsam. Para ahli ilmu juga berbeda pendapat mengenai safar pada hari Jum'at, bahkan sebagian mereka tidak berpendapat akan bolehnya keluar (untuk safar) pada hari Jum'at dan tidak ikut menghadiri shalat Jum'at. Sebagian yang lain berkata, jika dia berada di pagi harinya, hendaknya dia tidak keluar (untuk safar) sampai dia melaksanakan shalat Jum'at.","حَدَّثَنَا أَحْمَدُ بْنُ مَنِيعٍ حَدَّثَنَا أَبُو مُعَاوِيَةَ عَنْ الْحَجَّاجِ عَنْ الْحَكَمِ عَنْ مِقْسَمٍ عَنْ ابْنِ عَبَّاسٍ قَالَ
بَعَثَ النَّبِيُّ صَلَّى اللَّهُ عَلَيْهِ وَسَلَّمَ عَبْدَ اللَّهِ بْنَ رَوَاحَةَ فِي سَرِيَّةٍ فَوَافَقَ ذَلِكَ يَوْمَ الْجُمُعَةِ فَغَدَا أَصْحَابُهُ فَقَالَ أَتَخَلَّفُ فَأُصَلِّي مَعَ رَسُولِ اللَّهِ صَلَّى اللَّهُ عَلَيْهِ وَسَلَّمَ ثُمَّ أَلْحَقُهُمْ فَلَمَّا صَلَّى مَعَ رَسُولِ اللَّهِ صَلَّى اللَّهُ عَلَيْهِ وَسَلَّمَ رَآهُ فَقَالَ مَا مَنَعَكَ أَنْ تَغْدُوَ مَعَ أَصْحَابِكَ فَقَالَ أَرَدْتُ أَنْ أُصَلِّيَ مَعَكَ ثُمَّ أَلْحَقَهُمْ قَالَ لَوْ أَنْفَقْتَ مَا فِي الْأَرْضِ جَمِيعًا مَا أَدْرَكْتَ فَضْلَ غَدْوَتِهِمْ
قَالَ أَبُو عِيسَى هَذَا حَدِيثٌ غَرِيبٌ لَا نَعْرِفُهُ إِلَّا مِنْ هَذَا الْوَجْهِ قَالَ عَلِيُّ بْنُ الْمَدِينِيِّ قَالَ يَحْيَى بْنُ سَعِيدٍ وَقَالَ شُعْبَةُ لَمْ يَسْمَعْ الْحَكَمُ مِنْ مِقْسَمٍ إِلَّا خَمْسَةَ أَحَادِيثَ وَعَدَّهَا شُعْبَةُ وَلَيْسَ هَذَا الْحَدِيثُ فِيمَا عَدَّ شُعْبَةُ فَكَأَنَّ هَذَا الْحَدِيثَ لَمْ يَسْمَعْهُ الْحَكَمُ مِنْ مِقْسَمٍ وَقَدْ اخْتَلَفَ أَهْلُ الْعِلْمِ فِي السَّفَرِ يَوْمَ الْجُمُعَةِ فَلَمْ يَرَ بَعْضُهُمْ بَأْسًا بِأَنْ يَخْرُجَ يَوْمَ الْجُمُعَةِ فِي السَّفَرِ مَا لَمْ تَحْضُرْ الصَّلَاةُ و قَالَ بَعْضُهُمْ إِذَا أَصْبَحَ فَلَا يَخْرُجْ حَتَّى يُصَلِّيَ الْجُمُعَةَ",43
500,3,"Telah menceritakan kepada kami [Ahmad bin Mani'] telah menceritakan kepada kami [Husyaim] telah mengabarkan kepada kami [Ali bin Zaid bin Jud'an Al Qurasyi] dari [Abu Nadlrah] dia berkata, [Imran bin Hushain] ditanya tentang shalatnya seorang musafir (dalam perjalanan), dia menjawab, saya melaksanakan haji bersama Rasulullah Shallahu 'alaihi wa sallam, lalu beliau shalat dua raka'at, kemudian saya melaksanakan haji bersama Abu Bakar dan dia melaksanakan shalat dua raka'at, dan bersama Umar, dia juga shalat dua raka'at, bersama Utsman selama enam atau delapan tahun pada masa kepemimpinannya juga shalat dua raka'at. Abu Isa berkata, hadits ini shahih.","حَدَّثَنَا أَحْمَدُ بْنُ مَنِيعٍ حَدَّثَنَا هُشَيْمٌ أَخْبَرَنَا عَلِيُّ بْنُ زَيْدِ بْنِ جُدْعَانَ الْقُرَشِيُّ عَنْ أَبِي نَضْرَةَ قَالَ
سُئِلَ عِمْرَانُ بْنُ حُصَيْنٍ عَنْ صَلَاةِ الْمُسَافِرِ فَقَالَ حَجَجْتُ مَعَ رَسُولِ اللَّهِ صَلَّى اللَّهُ عَلَيْهِ وَسَلَّمَ فَصَلَّى رَكْعَتَيْنِ
وَحَجَجْتُ مَعَ أَبِي بَكْرٍ فَصَلَّى رَكْعَتَيْنِ وَمَعَ عُمَرَ فَصَلَّى رَكْعَتَيْنِ وَمَعَ عُثْمَانَ سِتَّ سِنِينَ مِنْ خِلَافَتِهِ أَوْ ثَمَانِيَ ثَمَانِي فَصَلَّى رَكْعَتَيْنِ قَالَ أَبُو عِيسَى هَذَا حَدِيثٌ صَحِيحٌ",43
507,3,"Telah menceritakan kepada kami [Muhammad bin 'Ubaid Al Muharibi yakni Al Kufi] telah menceritakan kepada kami [Ali bin Hasyim] dari [Ibnu Abu Laila] dari ['Athiyah] dan [Nafi'] dari [Ibnu Umar] dia berkata, saya shalat bersama Nabi Shalallahu 'alaihi wa salam waktu mukim dan waktu safar, dan saya shalat bersama beliau waktu mukim sebanyak empat raka'at dan setelahnya dua raka'at, saya juga shalat zhuhur bersama beliau waktu safar sebanyak dua raka'at dan setelahnya dua raka'at, shalat ashar dua raka'at dan beliau tidak mengerjakan dua raka'at setelahnya (ashar), beliau shalat maghrib tiga raka'at, beliau tidak menguranginya baik waktu mukim atau safar, ia merupakan witirnya siang, setelahnya beliau melaksanakan dua raka'at. Abu Isa berkata, ini adalah hadits hasan, saya pernah mendengar Muhammad berkata, ini adalah hadits hasan, saya pernah mendengar Muhammad berkata, saya tidak pernah mendapati riwayat Ibnu Abu Laila yang lebih menakjubkanku daripada hadits ini, padahal saya tidak pernah mengambil riwayat sesuatupun darinya.","حَدَّثَنَا مُحَمَّدُ بْنُ عُبَيْدٍ الْمُحَارِبِيُّ يَعْنِي الْكُوفِيَّ حَدَّثَنَا عَلِيُّ بْنُ هَاشِمٍ عَنْ ابْنِ أَبِي لَيْلَى عَنْ عَطِيَّةَ وَنَافِعٍ عَنْ ابْنِ عُمَرَ قَالَ
صَلَّيْتُ مَعَ النَّبِيِّ صَلَّى اللَّهُ عَلَيْهِ وَسَلَّمَ فِي الْحَضَرِ وَالسَّفَرِ فَصَلَّيْتُ مَعَهُ فِي الْحَضَرِ الظُّهْرَ أَرْبَعًا وَبَعْدَهَا رَكْعَتَيْنِ وَصَلَّيْتُ مَعَهُ فِي السَّفَرِ الظُّهْرَ رَكْعَتَيْنِ وَبَعْدَهَا رَكْعَتَيْنِ وَالْعَصْرَ رَكْعَتَيْنِ وَلَمْ يُصَلِّ بَعْدَهَا شَيْئًا وَالْمَغْرِبَ فِي الْحَضَرِ وَالسَّفَرِ سَوَاءً ثَلَاثَ رَكَعَاتٍ لَا تَنْقُصُ فِي الْحَضَرِ وَلَا فِي السَّفَرِ هِيَ وِتْرُ النَّهَارِ وَبَعْدَهَا رَكْعَتَيْنِ
قَالَ أَبُو عِيسَى هَذَا حَدِيثٌ حَسَنٌ سَمِعْت مُحَمَّدًا يَقُولُ مَا رَوَى ابْنُ أَبِي لَيْلَى حَدِيثًا أَعْجَبَ إِلَيَّ مِنْ هَذَا وَلَا أَرْوِي عَنْهُ شَيْئًا",43
517,3,"Telah menceritakan kepada kami [Muhammad bin Abdul Malik bin Abu Syawarib] telah menceritakan kepada kami [Yazid bin Zurai'] telah menceritakan kepada kami [Ma'mar] dari [Az Zuhri] dari [Salim] dari [ayahnya] bahwasanya Nabi shallallahu 'alaihi wasallam shalat khauf satu raka'at dengan salah satu kelompok dari dua pasukannya, sedangkan pasukan yang lain menghadapi musuh, kemudian mereka (pasukan yang tadinya shalat) beranjak dan menempati tempat pasukan yang berhadapan dengan musuh. Kemudian pasukan kedua datang, maka beliau shalat satu raka'at bersama mereka (pasukan yang kedua) kemudian beliau salam waktu mengimami mereka, kemudian mereka bangkit untuk menyempurnakan raka'at berikutnya, lalu pasukan yang pertama juga menyempurnakan raka'at berikutnya. Abu Isa berkata, hadits ini shahih, [Musa bin 'Uqbah] telah meriwayatkan dari [Nafi'] dari [Ibnu Umar] seperti hadit ini. Abu Isa berkata, dalam bab ini (ada juga riwayat -pent) dari Jabir, Hudzaifah, Zaid bin Tsabit, Ibnu 'Abbas, Abu Hurairah, Ibnu Mas'ud, Sahal bin Abu Hatsmah, Abu Ayasy Az Zuraqi -namanya adalah Zaid bin Shamit- dan Abu Bakrah. Abu Isa berkata, Malik bin Anas berpendapat dengan hadits Sahal bin Abu Hatsmah mengenai shalat kahuf ini. Syafi'i juga berpendapat dengan hadits ini. Ahmad berkata, telah diriwayatkan dari Nabi shallallahu 'alaihi wasallam mengenai shalat khauf dengan banyak versi, dan saya tidak mengetahui dalam masalah ini kecuali dari hadits shahih saja, dan saya memilih hadits Sahal bin Abu Hatsmah. Ishaq bin Ibrahim juga mengatakan bahwa banyak riwayat yang tetap dari Nabi shallallahu 'alaihi wasallam dalam shalat khauf. Dia berpendapat bahwa semua yang diriwayatkan dari Nabi shallallahu 'alaihi wasallam tentang shalat khauf boleh dikerjakan, dan ini sesuai dengan tingkatan rasa takut itu sendiri. Ishaq berkata, kami tidak memilih hadits Sahal bin Abu Hatsmah atas riwayat-riwayat lain.","حَدَّثَنَا مُحَمَّدُ بْنُ عَبْدِ الْمَلِكِ بْنِ أَبِي الشَّوَارِبِ حَدَّثَنَا يَزِيدُ بْنُ زُرَيْعٍ حَدَّثَنَا مَعْمَرٌ عَنْ الزُّهْرِيِّ عَنْ سَالِمٍ عَنْ أَبِيهِ
أَنَّ النَّبِيَّ صَلَّى اللَّهُ عَلَيْهِ وَسَلَّمَ صَلَّى صَلَاةَ الْخَوْفِ بِإِحْدَى الطَّائِفَتَيْنِ رَكْعَةً وَالطَّائِفَةُ الْأُخْرَى مُوَاجِهَةُ الْعَدُوِّ ثُمَّ انْصَرَفُوا فَقَامُوا فِي مَقَامِ أُولَئِكَ وَجَاءَ أُولَئِكَ فَصَلَّى بِهِمْ رَكْعَةً أُخْرَى ثُمَّ سَلَّمَ عَلَيْهِمْ فَقَامَ هَؤُلَاءِ فَقَضَوْا رَكْعَتَهُمْ وَقَامَ هَؤُلَاءِ فَقَضَوْا رَكْعَتَهُمْ
قَالَ أَبُو عِيسَى هَذَا حَدِيثٌ صَحِيحٌ وَقَدْ رَوَى مُوسَى بْنُ عُقْبَةَ عَنْ نَافِعٍ عَنْ ابْنِ عُمَرَ مِثْلَ هَذَا قَالَ وَفِي الْبَاب عَنْ جَابِرٍ وَحُذَيْفَةَ وَزَيْدِ بْنِ ثَابِتٍ وَابْنِ عَبَّاسٍ وَأَبِي هُرَيْرَةَ وَابْنِ مَسْعُودٍ وَسَهْلِ بْنِ أَبِي حَثْمَةَ وَأَبِي عَيَّاشٍ الزُّرَقِيِّ وَاسْمُهُ زَيْدُ بْنُ صَامِتٍ وَأَبِي بَكْرَةَ قَالَ أَبُو عِيسَى وَقَدْ ذَهَبَ مَالِكُ بْنُ أَنَسٍ فِي صَلَاةِ الْخَوْفِ إِلَى حَدِيثِ سَهْلِ بْنِ أَبِي حَثْمَةَ وَهُوَ قَوْلُ الشَّافِعِيِّ و قَالَ أَحْمَدُ قَدْ رُوِيَ عَنْ النَّبِيِّ صَلَّى اللَّهُ عَلَيْهِ وَسَلَّمَ صَلَاةُ الْخَوْفِ عَلَى أَوْجُهٍ وَمَا أَعْلَمُ فِي هَذَا الْبَابِ إِلَّا حَدِيثًا صَحِيحًا وَأَخْتَارُ حَدِيثَ سَهْلِ بْنِ أَبِي حَثْمَةَ وَهَكَذَا قَالَ إِسْحَقُ بْنُ إِبْرَاهِيمَ قَالَ ثَبَتَتْ الرِّوَايَاتُ عَنْ النَّبِيِّ صَلَّى اللَّهُ عَلَيْهِ وَسَلَّمَ فِي صَلَاةِ الْخَوْفِ وَرَأَى أَنَّ كُلَّ مَا رُوِيَ عَنْ النَّبِيِّ صَلَّى اللَّهُ عَلَيْهِ وَسَلَّمَ فِي صَلَاةِ الْخَوْفِ فَهُوَ جَائِزٌ وَهَذَا عَلَى قَدْرِ الْخَوْفِ قَالَ إِسْحَقُ وَلَسْنَا نَخْتَارُ حَدِيثَ سَهْلِ بْنِ أَبِي حَثْمَةَ عَلَى غَيْرِهِ مِنْ الرِّوَايَاتِ",43
