haditsId,kitabId,indo,arab,label
1634,23,"Telah menceritakan kepada kami [Qutaibah] berkata, telah menceritakan kepada kami [Al Laits] dari [Sa'id bin Abu Sa'id Al Maqburi] dari [Abdullah bin Abu Qatadah] dari [Bapaknya] Bahwasanya ia pernah mendengarnya menceritakan dari Rasulullah shallallahu 'alaihi wasallam, bahwa beliau pernah berdiri di hadapan mereka dan mengatakan bahwa jihad di jalan Allah dan beriman kepada Allah adalah sebaik-baik amalan. Lalu seorang laki-laki berdiri dan bertanya, ""Wahai Rasulullah, bagaimana pendapatmu jika aku terbunuh di jalan Allah, apakah dosa-dosaku akan terampuni?"" Rasulullah shallallahu 'alaihi wasallam lalu menjawab: ""Benar. Jika engkau terbunuh di jalan Allah sementara engkau sabar, mengharap palaha, berani dan tidak lari."" Kemudian Rasulullah shallallahu 'alaihi wasallam bertanya: ""Apa yang kamu katakan tadi?"" ia menjawab, ""Bagaimana pendapatmu jika aku terbunuh di jalan Allah, apakah dosa-dosaku akan termapuni?"" Rasulullah shallallahu 'alaihi wasallam menjawab: ""Benar, jika engkau bersabar, mengharap pahala dan tidak lari (dari medan perang), kecuali hutang. karena Jibril memberitahu hal itu padaku."" Abu Isa berkata, ""Dalam bab ini juga ada hadits dari Anas, Muhammad bin Jahsy dan Abvu Hurairah. Hadits ini derajatnya hasan shahih. sebagian ulama meriwayatkan hadits ini dari [Sa'id Al Maqburi], dari [Abu Hurairah], dari Nabi shallallahu 'alaihi wasallam seperti hadits tersebut. [Yahya bin Sa'id Al Anshari] dan banyak perawai lain meriwayatkan hadits ini dari [Sa'id Al Maqburi], dari [Abdullah bin Abu Qatadah], dari [bapaknya], dari Nabi shallallahu 'alaihi wasallam. Dan ini lebih shahih dari hadits Sa'id Al Maqburi dari Abu Hurairah.""","حَدَّثَنَا قُتَيْبَةُ حَدَّثَنَا اللَّيْثُ عَنْ سَعِيدِ بْنِ أَبِي سَعِيدٍ الْمَقْبُرِيِّ عَنْ عَبْدِ اللَّهِ بْنِ أَبِي قَتَادَةَ عَنْ أَبِيهِ أَنَّهُ سَمِعَهُ يُحَدِّثُ
عَنْ رَسُولِ اللَّهِ صَلَّى اللَّهُ عَلَيْهِ وَسَلَّمَ أَنَّهُ قَامَ فِيهِمْ فَذَكَرَ لَهُمْ أَنَّ الْجِهَادَ فِي سَبِيلِ اللَّهِ وَالْإِيمَانَ بِاللَّهِ أَفْضَلُ الْأَعْمَالِ فَقَامَ رَجُلٌ فَقَالَ يَا رَسُولَ اللَّهِ أَرَأَيْتَ إِنْ قُتِلْتُ فِي سَبِيلِ اللَّهِ يُكَفِّرُ عَنِّي خَطَايَايَ فَقَالَ رَسُولُ اللَّهِ صَلَّى اللَّهُ عَلَيْهِ وَسَلَّمَ نَعَمْ إِنْ قُتِلْتَ فِي سَبِيلِ اللَّهِ وَأَنْتَ صَابِرٌ مُحْتَسِبٌ مُقْبِلٌ غَيْرُ مُدْبِرٍ ثُمَّ قَالَ رَسُولُ اللَّهِ صَلَّى اللَّهُ عَلَيْهِ وَسَلَّمَ كَيْفَ قُلْتَ قَالَ أَرَأَيْتَ إِنْ قُتِلْتُ فِي سَبِيلِ اللَّهِ أَيُكَفِّرُ عَنِّي خَطَايَايَ فَقَالَ رَسُولُ اللَّهِ صَلَّى اللَّهُ عَلَيْهِ وَسَلَّمَ نَعَمْ وَأَنْتَ صَابِرٌ مُحْتَسِبٌ مُقْبِلٌ غَيْرُ مُدْبِرٍ إِلَّا الدَّيْنَ فَإِنَّ جِبْرِيلَ قَالَ لِي ذَلِكَ
قَالَ أَبُو عِيسَى وَفِي الْبَاب عَنْ أَنَسٍ وَمُحَمَّدِ بْنِ جَحْشٍ وَأَبِي هُرَيْرَةَ وَهَذَا حَدِيثٌ حَسَنٌ صَحِيحٌ وَرَوَى بَعْضُهُمْ هَذَا الْحَدِيثَ عَنْ سَعِيدٍ الْمَقْبُرِيِّ عَنْ أَبِي هُرَيْرَةَ عَنْ النَّبِيِّ صَلَّى اللَّهُ عَلَيْهِ وَسَلَّمَ نَحْوَ هَذَا وَرَوَى يَحْيَى بْنُ سَعِيدٍ الْأَنْصَارِيُّ وَغَيْرُ وَاحِدٍ هَذَا عَنْ سَعِيدٍ الْمَقْبُرِيِّ عَنْ عَبْدِ اللَّهِ بْنِ أَبِي قَتَادَةَ عَنْ أَبِيهِ عَنْ النَّبِيِّ صَلَّى اللَّهُ عَلَيْهِ وَسَلَّمَ وَهَذَا أَصَحُّ مِنْ حَدِيثِ سَعِيدٍ الْمَقْبُرِيِّ عَنْ أَبِي هُرَيْرَةَ",43
1635,23,"Telah menceritakan kepada kami [Azhar bin Marwan Al Bashri] berkata, telah menceritakan kepada kami [Abdul Warits bin Sa'id] dari [Ayyub] dari [Humaid bin Hilal] dari [Abu Ad Dahma] dari [Hisyam bin Amir] ia berkata, ""Pernah dikeluhkan kepada Rasulullah shallallahu 'alaihi wasallam tentang orang-orang yang terbunuh pada perang uhud, beliau lalu bersabda: ""Buatlah lubang, luaskan, perbagus dan kuburkanlah mereka dua orang atau tiga orang dalam satu lubang. Dan dahulukanlah di antara mereka yang banyak bafalan Al-Qur'annya."" Lalu bapakku meninggal, hingga ia pun didahulukan di antara dua orang yang ada."" Abu Isa berkata, ""Dalam bab ini juga ada hadits dari Khabbab, Jabir dan Anas. Hadits ini derajatnya hasan shahih. [Sufyan Ats Tsauri] dan selainnya meriwayatkan hadits ini dari [Ayyub], dari [Humaid bin Hilal] dan dari [Hisyam bin Amir]. Abu Dahma nama aslinya adalah Qirfah bin Buhais, atau Baihas.""","حَدَّثَنَا أَزْهَرُ بْنُ مَرْوَانَ الْبَصْرِيُّ حَدَّثَنَا عَبْدُ الْوَارِثِ بْنُ سَعِيدٍ عَنْ أَيُّوبَ عَنْ حُمَيْدِ بْنِ هِلَالٍ عَنْ أَبِي الدَّهْمَاءِ عَنْ هِشَامِ بْنِ عَامِرٍ قَالَ
شُكِيَ إِلَى رَسُولِ اللَّهِ صَلَّى اللَّهُ عَلَيْهِ وَسَلَّمَ الْجِرَاحَاتُ يَوْمَ أُحُدٍ فَقَالَ احْفِرُوا وَأَوْسِعُوا وَأَحْسِنُوا وَادْفِنُوا الِاثْنَيْنِ وَالثَّلَاثَةَ فِي قَبْرٍ وَاحِدٍ وَقَدِّمُوا أَكْثَرَهُمْ قُرْآنًا فَمَاتَ أَبِي فَقُدِّمَ بَيْنَ يَدَيْ رَجُلَيْنِ
قَالَ أَبُو عِيسَى وَفِي الْبَاب عَنْ خَبَّابٍ وَجَابِرٍ وَأَنَسٍ وَهَذَا حَدِيثٌ حَسَنٌ صَحِيحٌ وَرَوَى سُفْيَانُ الثَّوْرِيُّ وَغَيْرُهُ هَذَا الْحَدِيثَ عَنْ أَيُّوبَ عَنْ حُمَيْدِ بْنِ هِلَالٍ عَنْ هِشَامِ بْنِ عَامِرٍ وَأَبُو الدَّهْمَاءِ اسْمُهُ قِرْفَةُ بْنُ بُهَيْسٍ أَوْ بَيْهَسٍ",43
1638,23,"Telah menceritakan kepada kami [Ibnu Abu Umar] berkata, telah menceritakan kepada kami [Sufyan] dari [Yazid bin Abu Ziyad] dari ['Abdurrahman bin Abu Laila] dari [Ibnu Umar] ia berkata, ""Rasulullah shallallahu 'alaihi wasallam mengutuskan kami dalam sebuah ekspedisi, lalu orang-orang melarikan diri dari peperangan. Katika sampai di Madinah, kami bersembunyi karena malu. Kami lalu berkata; ""Kita telah celaka."" Setelah itu kami mendatangi Rasulullah shallallahu 'alaihi wasallam dan berkata, ""Wahai Rasulullah, kami adalah orang-orang yang telah lari dari peperangan!"" beliau menjawab: ""Bahkan kalian adalah orang-orang yang kembali pada kancah peperangan, dan aku berada pada kelompok kalian."" Abu Isa berkata, ""Ini adalah hadits hasan, kami tidak mengetahuinya kecuali dari hadits Yazid bin Ziyad. Adapun makna dari ungkapan, 'orang-orang melarikan diri dari peperangan' adalah mundur mundur dari peperangan. Dan makna sabda Nabi, 'Bahkan kalian adalah orang-orang yang kembali pada kancah peperangan' adalah berlari kepada pemimpinnya agar ia menolongnya, bukan lari untuk kabur dari peperangan.""","حَدَّثَنَا ابْنُ أَبِي عُمَرَ حَدَّثَنَا سُفْيَانُ عَنْ يَزِيدَ بْنِ أَبِي زِيَادٍ عَنْ عَبْدِ الرَّحْمَنِ بْنِ أَبِي لَيْلَى عَنْ ابْنِ عُمَرَ قَالَ
بَعَثَنَا رَسُولُ اللَّهِ صَلَّى اللَّهُ عَلَيْهِ وَسَلَّمَ فِي سَرِيَّةٍ فَحَاصَ النَّاسُ حَيْصَةً فَقَدِمْنَا الْمَدِينَةَ فَاخْتَبَيْنَا بِهَا وَقُلْنَا هَلَكْنَا ثُمَّ أَتَيْنَا رَسُولَ اللَّهِ صَلَّى اللَّهُ عَلَيْهِ وَسَلَّمَ فَقُلْنَا يَا رَسُولَ اللَّهِ نَحْنُ الْفَرَّارُونَ قَالَ بَلْ أَنْتُمْ الْعَكَّارُونَ وَأَنَا فِئَتُكُمْ
قَالَ أَبُو عِيسَى هَذَا حَدِيثٌ حَسَنٌ لَا نَعْرِفُهُ إِلَّا مِنْ حَدِيثِ يَزِيدَ بْنِ أَبِي زِيَادٍ وَمَعْنَى قَوْلِهِ فَحَاصَ النَّاسُ حَيْصَةً يَعْنِي أَنَّهُمْ فَرُّوا مِنْ الْقِتَالِ وَمَعْنَى قَوْلِهِ بَلْ أَنْتُمْ الْعَكَّارُونَ وَالْعَكَّارُ الَّذِي يَفِرُّ إِلَى إِمَامِهِ لِيَنْصُرَهُ لَيْسَ يُرِيدُ الْفِرَارَ مِنْ الزَّحْفِ",43
1639,23,"Telah menceritakan kepada kami [Mahmud bin Ghailan] berkata, telah menceritakan kepada kami [Abu Dawud] berkata, telah mengabarkan kepada kami [Syu'bah] dari [Al Aswad bin Qais] ia berkata; Aku mendengar [Nubaih Al Anazi] menceritakan dari [Jabir] ia berkata, ""Pada perang uhud bibiku datang dengan membawa jasad ayahku untuk dikuburkan di pekuburan kami. Tiba-tiba penyeru Rasulullah shallallahu 'alaihi wasallam berteriak, ""Kembalikanlah semua korban perang di tempatnya masing-masing."" Abu Isa berkata, ""Hadits ini derajatnya hasan shahih, dan Nubaih adalah seorang yang tsiqah.""","حَدَّثَنَا مَحْمُودُ بْنُ غَيْلَانَ حَدَّثَنَا أَبُو دَاوُدَ أَخْبَرَنَا شُعْبَةُ عَنْ الْأَسْوَدِ بْنِ قَيْسٍ قَال سَمِعْتُ نُبَيْحًا الْعَنَزِيَّ يُحَدِّثُ عَنْ جَابِرٍ قَالَ
لَمَّا كَانَ يَوْمُ أُحُدٍ جَاءَتْ عَمَّتِي بِأَبِي لِتَدْفِنَهُ فِي مَقَابِرِنَا فَنَادَى مُنَادِي رَسُولِ اللَّهِ صَلَّى اللَّهُ عَلَيْهِ وَسَلَّمَ رُدُّوا الْقَتْلَى إِلَى مَضَاجِعِهِمْ
قَالَ أَبُو عِيسَى هَذَا حَدِيثٌ حَسَنٌ صَحِيحٌ وَنُبَيْحٌ ثِقَةٌ",43
1640,23,"Telah menceritakan kepada kami [Ibnu Abu Umar] dan [Sa'id bin 'Abdurrahman Al Makhzumi] keduanya berkata; telah menceritakan kepada kami [Sufyan bin Uyainah] dari [Az Zuhri] dari [As Sa`ib bin Yazid] ia berkata, ""Ketika Rasulullah shallallahu 'alaihi wasallam kembali dari perang Tabuk, orang-orang menyambut kedatangan beliau hingga Tsaniyatul Wada'."" As Sa`ib berkata, ""Aku lalu keluar bersama orang-orang, sementara waktu itu masih seorang bocah."" Abu Isa berkata, ""Hadits ini derajatnya hasan shahih.""","حَدَّثَنَا ابْنُ أَبِي عُمَرَ وَسَعِيدُ بْنُ عَبْدِ الرَّحْمَنِ الْمَخْزُومِيُّ قَالَا حَدَّثَنَا سُفْيَانُ بْنُ عُيَيْنَةَ عَنْ الزُّهْرِيِّ عَنْ السَّائِبِ بْنِ يَزِيدَ قَالَ
لَمَّا قَدِمَ رَسُولُ اللَّهِ صَلَّى اللَّهُ عَلَيْهِ وَسَلَّمَ مِنْ تَبُوكَ خَرَجَ النَّاسُ يَتَلَقَّوْنَهُ إِلَى ثَنِيَّةِ الْوَدَاعِ قَالَ السَّائِبُ فَخَرَجْتُ مَعَ النَّاسِ وَأَنَا غُلَامٌ
قَالَ أَبُو عِيسَى هَذَا حَدِيثٌ حَسَنٌ صَحِيحٌ",43
1641,23,"Telah menceritakan kepada kami [Ibnu Abu Umar] berkata, telah menceritakan kepada kami [Sufyan bin Uyainah] dari [Amru bin Dinar] dari [Ibnu Syihab] dari [Malik bin Aus bin Al Hadatsan] ia berkata, ""Aku mendengar [Umar Ibnul Khaththab] berkata, ""Harta kekayaan bani Nadhir yang Allah berikan kepada rasul-Nya, (untuk mendapatkan itu semua) kaum muslimin tidak susah-susah mengerahkan seekor kuda atau unta, semuanya itu adalah milik Rasulullah shallallahu 'alaihi wasallam. Rasulullah shallallahu 'alaihi wasallam menyisakan nafkah untuk kebutuhan keluarganya selama satu tahun, kemudian sisanya beliau gunakan untuk memenuhi kebutuhan hewan tunggangan, peralatan senjata dan bekal untuk perang fi sabilillah."" Abu Isa berkata, ""Hadits ini derajatnya hasan shahih. [Sufyan bin Uyainah] meriwayatkan hadits ini dari [Ma'mar], dari [Ibnu Syihab].""","حَدَّثَنَا ابْنُ أَبِي عُمَرَ حَدَّثَنَا سُفْيَانُ بْنُ عُيَيْنَةَ عَنْ عَمْرِو بْنِ دِينَارٍ عَنْ ابْنِ شِهَابٍ عَنْ مَالِكِ بْنِ أَوْسِ بْنِ الْحَدَثَانِ قَال سَمِعْتُ عُمَرَ بْنَ الْخَطَّابِ يَقُولُ
كَانَتْ أَمْوَالُ بَنِي النَّضِيرِ مِمَّا أَفَاءَ اللَّهُ عَلَى رَسُولِهِ مِمَّا لَمْ يُوجِفْ الْمُسْلِمُونَ عَلَيْهِ بِخَيْلٍ وَلَا رِكَابٍ وَكَانَتْ لِرَسُولِ اللَّهِ صَلَّى اللَّهُ عَلَيْهِ وَسَلَّمَ خَالِصًا وَكَانَ رَسُولُ اللَّهِ صَلَّى اللَّهُ عَلَيْهِ وَسَلَّمَ يَعْزِلُ نَفَقَةَ أَهْلِهِ سَنَةً ثُمَّ يَجْعَلُ مَا بَقِيَ فِي الْكُرَاعِ وَالسِّلَاحِ عُدَّةً فِي سَبِيلِ اللَّهِ
قَالَ أَبُو عِيسَى هَذَا حَدِيثٌ حَسَنٌ صَحِيحٌ وَرَوَى سُفْيَانُ بْنُ عُيَيْنَةَ هَذَا الْحَدِيثَ عَنْ مَعْمَرٍ عَنْ ابْنِ شِهَابٍ",43
1657,24,"Telah menceritakan kepada kami [Muhammad bin Basysyar] berkata, telah menceritakan kepada kami ['Abdurrahman bin Mahdi] dari [Hammad bin Salamah] dari [Abu Az Z ubair] dari [Jabir] ia berkata, ""Nabi shallallahu 'alaihi wasallam masuk Makkah saat terjadi penaklukan dengan mengenakan imamah (surban yang dililitkan kepala) berwarna hitam."" Abu Isa berkata, ""Dalam bab ini juga ada hadits dari Ali, Umar, Ibnu Huraits, Ibnu Abbas dan Rukanah."" Abu Isa berkata, ""Hadits Jabir ini derajatnya hasan shahih.""","حَدَّثَنَا مُحَمَّدُ بْنُ بَشَّارٍ حَدَّثَنَا عَبْدُ الرَّحْمَنِ بْنُ مَهْدِيٍّ عَنْ حَمَّادِ بْنِ سَلَمَةَ عَنْ أَبِي الزُّبَيْرِ عَنْ جَابِرٍ قَالَ
دَخَلَ النَّبِيُّ صَلَّى اللَّهُ عَلَيْهِ وَسَلَّمَ مَكَّةَ يَوْمَ الْفَتْحِ وَعَلَيْهِ عِمَامَةٌ سَوْدَاءُ
قَالَ وَفِي الْبَاب عَنْ عَلِيٍّ وَعُمَرَ وَابْنِ حُرَيْثٍ وَابْنِ عَبَّاسٍ وَرُكَانَةَ قَالَ أَبُو عِيسَى حَدِيثُ جَابِرٍ حَدِيثٌ حَسَنٌ صَحِيحٌ",43
1706,24,"Telah menceritakan kepadaku [Qutaibah], telah menceritakan kepadaku [Muhammad bin Rabi'ah] dari [Abu Hasan Al Asqalani] dari [Abu Ja'far bin Muhammad bin Rukanah] dari [bapaknya] bahwasanya; [Rukanah] pernah bergulat dengan Nabi shallallahu 'alaihi wasallam lalu Nabi shallallahu 'alaihi wasallam mengalahkannya. Rukanah berkata; Aku mendengar Rosulullah shallallaahu 'alaihi wa sallam bersabda: ""Perbedaan antara kami dan kaum musyrikin ialah Imamah di atas peci."" Abu Isa berkakta; Ini merupakan hadits gharib dan sanadnya tidaklah kuat dan kami tidak mengetahui Abul Hasan Al 'Asqalani demikian pula Ibnu Rukanah.","حَدَّثَنَا قُتَيْبَةُ حَدَّثَنَا مُحَمَّدُ بْنُ رَبِيعَةَ عَنْ أَبِي الْحَسَنِ الْعَسْقَلَانِيِّ عَنْ أَبِي جَعْفَرِ بْنِ مُحَمَّدِ بْنِ رُكَانَةَ عَنْ أَبِيهِ أَنَّ رُكَانَةَ صَارَعَ النَّبِيَّ صَلَّى اللَّهُ عَلَيْهِ وَسَلَّمَ فَصَرَعَهُ النَّبِيُّ صَلَّى اللَّهُ عَلَيْهِ وَسَلَّمَ قَالَ رُكَانَةُ
سَمِعْتُ رَسُولَ اللَّهِ صَلَّى اللَّهُ عَلَيْهِ وَسَلَّمَ يَقُولُ إِنَّ فَرْقَ مَا بَيْنَنَا وَبَيْنَ الْمُشْرِكِينَ الْعَمَائِمُ عَلَى الْقَلَانِسِ
قَالَ أَبُو عِيسَى هَذَا حَدِيثٌ غَرِيبٌ وَإِسْنَادُهُ لَيْسَ بِالْقَائِمِ وَلَا نَعْرِفُ أَبَا الْحَسَنِ الْعَسْقَلَانِيَّ وَلَا ابْنَ رُكَانَةَ",43
1713,25,"Telah menceritakan kepadaku [Ahmad bin Mani'], telah menceritakan kepadaku [Isma'il bin Ibrahim] Telah mengabarkan kepada kami [Ibnu Juraij] dari [Abdullah bin Ubaid bin Umair] dari [Ibnu Abu Ammar] ia berkata; Aku pernah bertanya kepada [Jabir], ""Apakah biawak termasuk binatang buruan?"" Jabir menjawab, ""Ya."" Aku bertanya lagi, ""Bolehkah aku memakannya?"" Jabir menjawab, ""Ya."" Aku bertanya lagi, ""Apakah Rasulullah shallallahu 'alaihi wasallam pernah mengatakannya?"" Jabir menjawab, ""Ya."" Abu Isa berkata; Ini adalah hadits Hasan Shahih dan sebagian Ahlul Ilmi berpendapat demikian. Menurut mereka, makan daging biawak tidaklah mengapa. Demikianlah pendapat Ahmad dan Ishaq. Dan telah diriwayatkan dari Nabi shallallahu 'alaihi wasallam suatu hadits mengenai makruhnya makan daging biawak, namun isnadnya tidaklah kuat. Sebagian ulama juga ada yang memakruhkan makan daging biawak, di antaranya adalah Ibnul Mubarak. Yahya Al Qaththan berkata; Jarir bin Hazim telah meriwayatkan hadits ini dari Abdullah bin Ubaid bin Umair dari Ibnu Abu Ammar dari Jabir dari Umar. Sedangkan hadits Ibnu Juraij adalah lebih Shahih. Ibnu Abu Ammar adalah Abdurrahman bin Abdullah bin Abu Ammar Al Makki.","حَدَّثَنَا أَحْمَدُ بْنُ مَنِيعٍ حَدَّثَنَا إِسْمَعِيلُ بْنُ إِبْرَاهِيمَ أَخْبَرَنَا ابْنُ جُرَيْجٍ عَنْ عَبْدِ اللَّهِ بْنِ عُبَيْدِ بْنِ عُمَيْرٍ عَنْ ابْنِ أَبِي عَمَّارٍ قَالَ قُلْتُ لِجَابِرٍ
الضَّبُعُ صَيْدٌ هِيَ قَالَ نَعَمْ قَالَ قُلْتُ آكُلُهَا قَالَ نَعَمْ قَالَ قُلْتُ لَهُ أَقَالَهُ رَسُولُ اللَّهِ صَلَّى اللَّهُ عَلَيْهِ وَسَلَّمَ قَالَ نَعَمْ
قَالَ أَبُو عِيسَى هَذَا حَدِيثٌ حَسَنٌ صَحِيحٌ وَقَدْ ذَهَبَ بَعْضُ أَهْلِ الْعِلْمِ إِلَى هَذَا وَلَمْ يَرَوْا بِأَكْلِ الضَّبُعِ بَأْسًا وَهُوَ قَوْلُ أَحْمَدَ وَإِسْحَقَ وَرُوِيَ عَنْ النَّبِيِّ صَلَّى اللَّهُ عَلَيْهِ وَسَلَّمَ حَدِيثٌ فِي كَرَاهِيَةِ أَكْلِ الضَّبُعِ وَلَيْسَ إِسْنَادُهُ بِالْقَوِيِّ وَقَدْ كَرِهَ بَعْضُ أَهْلِ الْعِلْمِ أَكْلَ الضَّبُعِ وَهُوَ قَوْلُ ابْنِ الْمُبَارَكِ قَالَ يَحْيَى الْقَطَّانُ وَرَوَى جَرِيرُ بْنُ حَازِمٍ هَذَا الْحَدِيثَ عَنْ عَبْدِ اللَّهِ بْنِ عُبَيْدِ بْنِ عُمَيْرٍ عَنْ ابْنِ أَبِي عَمَّارٍ عَنْ جَابِرٍ عَنْ عُمَرَ قَوْلَهُ وَحَدِيثُ ابْنِ جُرَيْجٍ أَصَحُّ وَابْنُ أَبِي عَمَّارٍ هُوَ عَبْدُ الرَّحْمَنِ بْنُ عَبْدِ اللَّهِ بْنِ أَبِي عَمَّارٍ الْمَكِّيُّ",43
1744,25,"Telah menceritakan kepada kami [Ahmad bin Mani'], telah menceritakan kepada kami [Sufyan] dari [Abu Ya'fur Al Abdi] dari [Abdullah bin Abu Aufa] bahwa ia pernah ditanya tentang belalang. Maka ia pun menjawab, ""Aku telah berperang bersama-sama dengan Rasulullah shallallahu 'alaihi wasallam sebanyak enam kali peperangan, dan saat itu kami memakan belalang."" Abu Isa berkata; Seperti inilah yang diriwayatkan oleh Sufyan bin Uyainah dari Abu Ya'fur dan ia menyebutkan; Enam kali peperangan. Sufyan Ats Tsauri dan yang lainnya juga meriwayatkan hadits ini dari Abu Ya'fur dan ia menyebutkan; ""Tujuh kali peperangan.""","حَدَّثَنَا أَحْمَدُ بْنُ مَنِيعٍ حَدَّثَنَا سُفْيَانُ عَنْ أَبِي يَعْفُورٍ الْعَبْدِيِّ عَنْ عَبْدِ اللَّهِ بْنِ أَبِي أَوْفَى
أَنَّهُ سُئِلَ عَنْ الْجَرَادِ فَقَالَ غَزَوْتُ مَعَ النَّبِيِّ صَلَّى اللَّهُ عَلَيْهِ وَسَلَّمَ سِتَّ غَزَوَاتٍ نَأْكُلُ الْجَرَادَ
قَالَ أَبُو عِيسَى هَكَذَا رَوَى سُفْيَانُ بْنُ عُيَيْنَةَ عَنْ أَبِي يَعْفُورٍ هَذَا الْحَدِيثَ وَقَالَ سِتَّ غَزَوَاتٍ وَرَوَى سُفْيَانُ الثَّوْرِيُّ وَغَيْرُ وَاحِدٍ هَذَا الْحَدِيثَ عَنْ أَبِي يَعْفُورٍ فَقَالَ سَبْعَ غَزَوَاتٍ",43
1745,25,"Telah menceritakan kepada kami [Mahmud bin Ghailan], telah menceritakan kepada kami [Abu Ahmad] dan [Al Mu`amal] keduanya berkata, Telah menceritakan kepada kami [Sufyan] dari [Abu Ya'fur] dari [Ibnu Abu Aufa] ia berkata; ""Kami telah berperang bersama-sama dengan Rasulullah shallallahu 'alaihi wasallam sebanyak tujuh kali peperangan, maka di saat itu pula kami makan belalang."" Abu Isa berkakta; Syu'bah meriwayatkan hadits ini dari Abu Ya'fur dari Ibnu Abu Aufa, ia berkata; Aku telah berperang bersama-sama dengan Rasulullah shallallahu 'alaihi wasallam dalam beberapa kali peperangan, dan saat itu kami makan belalang. Demikian begitu pula, telah menceritakan kepada kami [Muhammad bin Basysyar] Telah menceritakan kepada kami [Muhammad bin Ja'far], telah menceritakan kepada kami [Syu'bah] dengan ini. Dan di dalam bab juga terdapat riwayat dari Ibnu Umar dan Jabir. Abu Isa berkata; Ini adalah hadits Hasan Shahih. Abu Ya'fur namanya adalah Waqid, dan biasa juga dipanggil Waqdan. Abu Ya'fur yang lain namanya adalah Abdurrahman bin Ubaid bin Nisthas.","حَدَّثَنَا مَحْمُودُ بْنُ غَيْلَانَ حَدَّثَنَا أَبُو أَحْمَدَ وَالْمُؤَمَّلُ قَالَا حَدَّثَنَا سُفْيَانُ عَنْ أَبِي يَعْفُورٍ عَنْ ابْنِ أَبِي أَوْفَى قَالَ
غَزَوْنَا مَعَ رَسُولِ اللَّهِ صَلَّى اللَّهُ عَلَيْهِ وَسَلَّمَ سَبْعَ غَزَوَاتٍ نَأْكُلُ الْجَرَادَ
قَالَ أَبُو عِيسَى وَرَوَى شُعْبَةُ هَذَا الْحَدِيثَ عَنْ أَبِي يَعْفُورٍ عَنْ ابْنِ أَبِي أَوْفَى قَالَ غَزَوْتُ مَعَ رَسُولِ اللَّهِ صَلَّى اللَّهُ عَلَيْهِ وَسَلَّمَ غَزَوَاتٍ نَأْكُلُ الْجَرَادَ حَدَّثَنَا بِذَلِكَ مُحَمَّدُ بْنُ بَشَّارٍ حَدَّثَنَا مُحَمَّدُ بْنُ جَعْفَرٍ حَدَّثَنَا شُعْبَةُ بِهَذَا قَالَ وَفِي الْبَاب عَنْ ابْنِ عُمَرَ وَجَابِرٍ قَالَ أَبُو عِيسَى هَذَا حَدِيثٌ حَسَنٌ صَحِيحٌ وَأَبُو يَعْفُورٍ اسْمُهُ وَاقِدٌ وَيُقَالُ وَقْدَانُ أَيْضًا وَأَبُو يَعْفُورٍ الْآخَرُ اسْمُهُ عَبْدُ الرَّحْمَنِ بْنُ عُبَيْدِ بْنِ نِسْطَاسَ",43
