haditsId,kitabId,indo,arab,label
2150,33,"Telah menceritakan kepada kami [Bundar] telah menceritakan kepada kami [Abu Dawud] telah menceritakan kepada kami [Humaid bin Mihran] dari [Sa'ad bin Aus] dari [Ziyad bin Kusaib Al 'Adawi] berkata: Aku pernah bersama [Abu Bakrah] di bawah mimbar Ibnu 'Amir saat ia berkhotbah, ia mengenakan baju tipis lalu Bilal berkata: Lihatlah pemimpin kita mengenakan baju orang-orang fasik. Abu Bakrah berkata: Diam, aku pernah mendengar Rasulullah Shallallahu 'alaihi wa Salam bersabda: ""Barangsiapa menghina pemimpin Allah di bumi, Allah akan menghinakannya."" Berkata Abu Isa: Hadits ini hasan gharib.","حَدَّثَنَا بُنْدَارٌ حَدَّثَنَا أَبُو دَاوُدَ حَدَّثَنَا حُمَيْدُ بْنُ مِهْرَانَ عَنْ سَعْدِ بْنِ أَوْسٍ عَنْ زِيَادِ بْنِ كُسَيْبٍ الْعَدَوِيِّ قَالَ
كُنْتُ مَعَ أَبِي بَكْرَةَ تَحْتَ مِنْبَرِ ابْنِ عَامِرٍ وَهُوَ يَخْطُبُ وَعَلَيْهِ ثِيَابٌ رِقَاقٌ فَقَالَ أَبُو بِلَالٍ انْظُرُوا إِلَى أَمِيرِنَا يَلْبَسُ ثِيَابَ الْفُسَّاقِ فَقَالَ أَبُو بَكْرَةَ اسْكُتْ سَمِعْتُ رَسُولَ اللَّهِ صَلَّى اللَّهُ عَلَيْهِ وَسَلَّمَ يَقُولُ مَنْ أَهَانَ سُلْطَانَ اللَّهِ فِي الْأَرْضِ أَهَانَهُ اللَّهُ
قَالَ أَبُو عِيسَى هَذَا حَدِيثٌ حَسَنٌ غَرِيبٌ",67
2237,36,"Telah menceritakan kepada kami [Muhammad bin Basyar] telah menceritakan kepada kami [Yahya bin Sa'id] telah menceritakan kepada kami [Bahz bin Hakim] telah menceritakan kepada kami [bapakku] dari [kakekku] dia berkata: Aku mendengar Nabi Shallallahu 'alaihi wa Salam bersabda: ""Celakalah bagi orang yang mengatakan sesuatu agar supaya ditertawakan oleh orang orang kemudian dia berbohong, celakalah baginya dan celakalah baginya."" Berkata Abu Isa: Dan dalam hal ini ada hadits dari Abu Hurairah. Berkata Abu Isa: hadits ini hasan.","حَدَّثَنَا مُحَمَّدُ بْنُ بَشَّارٍ حَدَّثَنَا يَحْيَى بْنُ سَعِيدٍ حَدَّثَنَا بَهْزُ بْنُ حَكِيمٍ حَدَّثَنِي أَبِي عَنْ جَدِّي قَالَ
سَمِعْتُ النَّبِيَّ صَلَّى اللَّهُ عَلَيْهِ وَسَلَّمَ يَقُولُ وَيْلٌ لِلَّذِي يُحَدِّثُ بِالْحَدِيثِ لِيُضْحِكَ بِهِ الْقَوْمَ فَيَكْذِبُ وَيْلٌ لَهُ وَيْلٌ لَهُ
قَالَ وَفِي الْبَاب عَنْ أَبِي هُرَيْرَةَ قَالَ هَذَا حَدِيثٌ حَسَنٌ",67
2434,37,"Telah menceritakan kepada kami [Sufyan bin Waki'] telah menceritakan kepada kami [Abdurrahman bin Mahdi] dari [Harb bin Syaddad] dari [Yahya bin Abu Katsir] dari [Ya'isy bin Al Walid] bahwa [budak Az Zubair] menceritakan padanya bahwa [Az Zubair bin Al 'Awwam] menceritakan padanya bahwa nabi Shallallahu 'alaihi wa Salam bersabda: ""Penyakit ummat-ummat sebelum kalian merayap mendatangi kalian; hasad dan kebencian, itu memangkas. Aku tidak mengatakan memangkas rambut tapi memangkas agama. Demi Dzat yang jiwaku ada ditanganNya, kalian tidak masuk surga hingga kalian beriman dan kalian tidak beriman hingga kalian saling menyintai. Maukah kalian aku beritahu yang menguatkan hal itu pada kalian?; Yaitu sebarkanlah salam diantara kalian."" Berkata Abu Isa: Hadits ini diperselisihkan tentang riwayat Yahya bin Abu Katsir, sebagaiannya meriwayatkan dari Yahya bin Abu Katsir dari Ya'isy bin Al Walid dari budak Az Zubair dari nabi Shallallahu 'alaihi wa Salam, mereka tidak menyebutkan: Dari Az Zubair.","حَدَّثَنَا سُفْيَانُ بْنُ وَكِيعٍ حَدَّثَنَا عَبْدُ الرَّحْمَنِ بْنُ مَهْدِيٍّ عَنْ حَرْبِ بْنِ شَدَّادٍ عَنْ يَحْيَى بْنِ أَبِي كَثِيرٍ عَنْ يَعِيشَ بْنِ الْوَلِيدِ أَنَّ مَوْلَى الزُّبَيْرِ حَدَّثَهُ أَنَّ الزُّبَيْرَ بْنَ الْعَوَّامِ حَدَّثَهُ
أَنَّ النَّبِيَّ صَلَّى اللَّهُ عَلَيْهِ وَسَلَّمَ قَالَ دَبَّ إِلَيْكُمْ دَاءُ الْأُمَمِ قَبْلَكُمْ الْحَسَدُ وَالْبَغْضَاءُ هِيَ الْحَالِقَةُ لَا أَقُولُ تَحْلِقُ الشَّعَرَ وَلَكِنْ تَحْلِقُ الدِّينَ وَالَّذِي نَفْسِي بِيَدِهِ لَا تَدْخُلُوا الْجَنَّةَ حَتَّى تُؤْمِنُوا وَلَا تُؤْمِنُوا حَتَّى تَحَابُّوا أَفَلَا أُنَبِّئُكُمْ بِمَا يُثَبِّتُ ذَاكُمْ لَكُمْ أَفْشُوا السَّلَامَ بَيْنَكُمْ
قَالَ أَبُو عِيسَى هَذَا حَدِيثٌ قَدْ اخْتَلَفُوا فِي رِوَايَتِهِ عَنْ يَحْيَى بْنِ أَبِي كَثِيرٍ فَرَوَى بَعْضُهُمْ عَنْ يَحْيَى بْنِ أَبِي كَثِيرٍ عَنْ يَعِيشَ بْنِ الْوَلِيدِ عَنْ مَوْلَى الزُّبَيْرِ عَنْ النَّبِيِّ صَلَّى اللَّهُ عَلَيْهِ وَسَلَّمَ وَلَمْ يَذْكُرُوا فِيهِ عَنْ الزُّبَيْرِ",67
