haditsId,kitabId,indo,arab,label
185,3,"Telah menceritakan kepadaku dari Malik dari [Abdullah bin Dinar] Bahwasanya ia mendengar, ada seorang laki-laki yang shalat di sisi [Abdullah bin Umar] . Takala laki-laki itu duduk di rakaat ke empat, dia duduk dengan kaki bersilang di bawah paha dan menjongkokkan kedua kakinya. Tatkala Abdullah telah selesai, dia mencela perbuatan laki-laki itu. Orang itu berkata; ""Kamu juga melakukan itu."" Abdullah bin Umar menjawab, ""Karena kakiku sakit.""","و حَدَّثَنِي عَنْ مَالِك عَنْ عَبْدِ اللَّهِ بْنِ دِينَارٍ أَنَّهُ سَمِعَ عَبْدَ اللَّهِ بْنَ عُمَرَ
وَصَلَّى إِلَى جَنْبِهِ رَجُلٌ فَلَمَّا جَلَسَ الرَّجُلُ فِي أَرْبَعٍ تَرَبَّعَ وَثَنَى رِجْلَيْهِ فَلَمَّا انْصَرَفَ عَبْدُ اللَّهِ عَابَ ذَلِكَ عَلَيْهِ فَقَالَ الرَّجُلُ فَإِنَّكَ تَفْعَلُ ذَلِكَ فَقَالَ عَبْدُ اللَّهِ بْنُ عُمَرَ فَإِنِّي أَشْتَكِي",54
186,3,"Telah menceritakan kepadaku dari Malik dari [Shadaqah bin Yasar] dari [Al Mughirah bin Hakim] dia melihat [Abdullah bin Umar] bertopang pada kedua telapak kakinya setiap kali mengangkat kepalanya dari sujud. Tatkala selesai, ada orang yang menanyakan hal itu. Dia menjawab; ""Sesungguhnya itu bukan sunnah dalam shalat. Saya melakukannya karena kakiku sakit.""","و حَدَّثَنِي عَنْ مَالِك عَنْ صَدَقَةَ بْنِ يَسَارٍ عَنْ الْمُغِيرَةِ بْنِ حَكِيمٍ أَنَّهُ رَأَى عَبْدَ اللَّهِ بْنَ عُمَرَ
يَرْجِعُ فِي سَجْدَتَيْنِ فِي الصَّلَاةِ عَلَى صُدُورِ قَدَمَيْهِ فَلَمَّا انْصَرَفَ ذَكَرَ لَهُ ذَلِكَ فَقَالَ إِنَّهَا لَيْسَتْ سُنَّةَ الصَّلَاةِ وَإِنَّمَا أَفْعَلُ هَذَا مِنْ أَجْلِ أَنِّي أَشْتَكِي",54
365,3,"Telah menceritakan kepadaku dari Malik dari [Nafi'] bahwa [Abdullah bin Umar] berkata; ""Apabila orang yang sakit tidak mampu sujud, hendaklah dia berisyarat dengan kepalanya dan tidak mengangkat apapun ke keningnya.""","و حَدَّثَنِي عَنْ مَالِك عَنْ نَافِعٍ أَنَّ عَبْدَ اللَّهِ بْنَ عُمَرَ كَانَ يَقُولُ
إِذَا لَمْ يَسْتَطِعْ الْمَرِيضُ السُّجُودَ أَوْمَأَ بِرَأْسِهِ إِيمَاءً وَلَمْ يَرْفَعْ إِلَى جَبْهَتِهِ شَيْئًا",54
477,4,"Telah menceritakan kepadaku dari Malik dari [Ibnu Syihab] dari [Abu Umamah bin Sahl bin Hunaif] bahwa dia mengabarkan, bahwa ada seorang perempuan miskin sakit. Hal itu lalu dikabarkan kepada Rasulullah shallallahu 'alaihi wasallam. Dan Rasulullah shallallahu 'alaihi wasallam biasa menjenguk orang-orang miskin dan bertanya tentang keadaan mereka. Rasulullah shallallahu 'alaihi wasallam berpesan: ""Jika dia meninggal dunia, panggillah aku"". Jenazah wanita miskin itu diberangkatkan pada malam hari dan mereka tidak sampai hati membangunkan Rasulullah shallallahu 'alaihi wasallam. Pagi harinya, Rasulullah shallallahu 'alaihi wasallam diberitahu tentang apa yang telah terjadi. Beliau bertanya: ""Bukankah aku telah menyuruh kalian untuk memanggilku saat dia meninggal?"" Mereka menjawab; ""Wahai Rasulullah, kami tidak enak hati mengajak anda keluar dan membangunkan anda pada malam hari."" Rasulullah shallallahu 'alaihi wasallam keluar bersama beberapa orang-orang dan di atas kuburnya, beliau lalu bertakbir empat kali.""","و حَدَّثَنِي عَنْ مَالِك عَنْ ابْنِ شِهَابٍ عَنْ أَبِي أُمَامَةَ بْنِ سَهْلِ بْنِ حُنَيْفٍ أَنَّهُ أَخْبَرَهُ
أَنَّ مِسْكِينَةً مَرِضَتْ فَأُخْبِرَ رَسُولُ اللَّهِ صَلَّى اللَّهُ عَلَيْهِ وَسَلَّمَ بِمَرَضِهَا وَكَانَ رَسُولُ اللَّهِ صَلَّى اللَّهُ عَلَيْهِ وَسَلَّمَ يَعُودُ الْمَسَاكِينَ وَيَسْأَلُ عَنْهُمْ فَقَالَ رَسُولُ اللَّهِ صَلَّى اللَّهُ عَلَيْهِ وَسَلَّمَ إِذَا مَاتَتْ فَآذِنُونِي بِهَا فَخُرِجَ بِجَنَازَتِهَا لَيْلًا فَكَرِهُوا أَنْ يُوقِظُوا رَسُولَ اللَّهِ صَلَّى اللَّهُ عَلَيْهِ وَسَلَّمَ فَلَمَّا أَصْبَحَ رَسُولُ اللَّهِ صَلَّى اللَّهُ عَلَيْهِ وَسَلَّمَ أُخْبِرَ بِالَّذِي كَانَ مِنْ شَأْنِهَا فَقَالَ أَلَمْ آمُرْكُمْ أَنْ تُؤْذِنُونِي بِهَا فَقَالُوا يَا رَسُولَ اللَّهِ كَرِهْنَا أَنْ نُخْرِجَكَ لَيْلًا وَنُوقِظَكَ فَخَرَجَ رَسُولُ اللَّهِ صَلَّى اللَّهُ عَلَيْهِ وَسَلَّمَ حَتَّى صَفَّ بِالنَّاسِ عَلَى قَبْرِهَا وَكَبَّرَ أَرْبَعَ تَكْبِيرَاتٍ",54
493,4,"Telah menceritakan kepadaku Yahya dari Malik dari [Abdullah bin Abdullah bin Jabir bin 'Atik] dari ['Atik bin Al Harits] yaitu kakek Abdullah bin Abdullah bin Jabir, bapak dari ibunya, mengabarkan kepadanya bahwa [Jabir bin 'Atik] mengabarkan, bahwa Rasulullah shallallahu 'alaihi wasallam pernah menjenguk Abdullah bin Tsabit. Beliau mendapatinya sedang sekarat. Beliau memanggilnya, namun dia tidak menjawab. Rasulullah shallallahu 'alaihi wasallam membaca istirja' dan bersabda: ""Engkau telah mendahului kami wahai Abu Ar Rabi'."" Para wanita pun berteriak dan menangis, sementara Jabir berusaha mendiamkan mereka. Rasulullah shallallahu 'alaihi wasallam lalu bersabda: ""Biarkan saja mereka. Jika itu harus terjadi, janganlah ada seorangpun yang menangisinya."" Orang-orang bertanya, ""Wahai Rasulullah, yang harus terjadi itu apa?"" beliau menjawab; ""Jika ia meninggal."" Anak perempuannya berkata, ""Demi Allah, aku berharap dia mati syahid. Sekarang engkau telah menyelesaikan tugasmu."" Rasulullah shallallahu 'alaihi wasallam bersabda: ""Allah telah memberikan pahalanya sesuai dengan niatnya. Apa yang kalian sebut sebagai syahid?"" Mereka menjawab; ""Terbunuh di jalan Allah."" Rasulullah shallallahu 'alaihi wasallam bersabda: ""Syahid selain terbunuh di jalan Allah itu ada tujuh macam; yang meninggal karena penyakit tha'un maka dia syahid. Orang yang meninggal karena tenggelam maka dia syahid. Orang yang meninggal karena terkena penyakit cacar atau bisul maka dia syahid. Orang yang meninggal karena sakit perut maka dia syahid. Orang yang mati terbakar adalah syahid. Orang yang meninggal karena terkena reruntuhan, maka dia syahid. Wanita yang meninggal karena karena melahirkan maka dia adalah syahid.""","حَدَّثَنِي يَحْيَى عَنْ مَالِك عَنْ عَبْدِ اللَّهِ بْنِ عَبْدِ اللَّهِ بْنِ جَابِرِ بْنِ عَتِيكٍ عَنْ عَتِيكِ بْنِ الْحَارِثِ وَهُوَ جَدُّ عَبْدِ اللَّهِ بْنِ عَبْدِ اللَّهِ بْنِ جَابِرٍ أَبُو أُمِّهِ أَنَّهُ أَخْبَرَهُ أَنَّ جَابِرَ بْنَ عَتِيكٍ أَخْبَرَهُ
أَنَّ رَسُولَ اللَّهِ صَلَّى اللَّهُ عَلَيْهِ وَسَلَّمَ جَاءَ يَعُودُ عَبْدَ اللَّهِ بْنَ ثَابِتٍ فَوَجَدَهُ قَدْ غُلِبَ عَلَيْهِ فَصَاحَ بِهِ فَلَمْ يُجِبْهُ فَاسْتَرْجَعَ رَسُولُ اللَّهِ صَلَّى اللَّهُ عَلَيْهِ وَسَلَّمَ وَقَالَ غُلِبْنَا عَلَيْكَ يَا أَبَا الرَّبِيعِ فَصَاحَ النِّسْوَةُ وَبَكَيْنَ فَجَعَلَ جَابِرٌ يُسَكِّتُهُنَّ فَقَالَ رَسُولُ اللَّهِ صَلَّى اللَّهُ عَلَيْهِ وَسَلَّمَ دَعْهُنَّ فَإِذَا وَجَبَ فَلَا تَبْكِيَنَّ بَاكِيَةٌ قَالُوا يَا رَسُولَ اللَّهِ وَمَا الْوُجُوبُ قَالَ إِذَا مَاتَ فَقَالَتْ ابْنَتُهُ وَاللَّهِ إِنْ كُنْتُ لَأَرْجُو أَنْ تَكُونَ شَهِيدًا فَإِنَّكَ كُنْتَ قَدْ قَضَيْتَ جِهَازَكَ فَقَالَ رَسُولُ اللَّهِ صَلَّى اللَّهُ عَلَيْهِ وَسَلَّمَ إِنَّ اللَّهَ قَدْ أَوْقَعَ أَجْرَهُ عَلَى قَدْرِ نِيَّتِهِ وَمَا تَعُدُّونَ الشَّهَادَةَ قَالُوا الْقَتْلُ فِي سَبِيلِ اللَّهِ فَقَالَ رَسُولُ اللَّهِ صَلَّى اللَّهُ عَلَيْهِ وَسَلَّمَ الشُّهَدَاءُ سَبْعَةٌ سِوَى الْقَتْلِ فِي سَبِيلِ اللَّهِ الْمَطْعُونُ شَهِيدٌ وَالْغَرِقُ شَهِيدٌ وَصَاحِبُ ذَاتِ الْجَنْبِ شَهِيدٌ وَالْمَبْطُونُ شَهِيدٌ وَالْحَرِقُ شَهِيدٌ وَالَّذِي يَمُوتُ تَحْتَ الْهَدْمِ شَهِيدٌ وَالْمَرْأَةُ تَمُوتُ بِجُمْعٍ شَهِيدٌ",54
497,4,"Telah menceritakan kepadaku Yahya dari Malik dari [Abdurrahman bin Al Qasim bin Muhammad bin Abu Bakar], bahwa Rasulullah shallallahu 'alaihi wasallam bersabda: ""Hendaknya orang-orang muslim menjadi mulia dengan musibah yang menimpa mereka sebagaimana musibah yang menimpaku.""","حَدَّثَنِي يَحْيَى عَنْ مَالِك عَنْ عَبْدِ الرَّحْمَنِ بْنِ الْقَاسِمِ بْنِ مُحَمَّدِ بْنِ أَبِي بَكْرٍ
أَنَّ رَسُولَ اللَّهِ صَلَّى اللَّهُ عَلَيْهِ وَسَلَّمَ قَالَ لِيُعَزِّ الْمُسْلِمِينَ فِي مَصَائِبِهِمْ الْمُصِيبَةُ بِي",54
498,4,"Telah menceritakan kepadaku dari Malik dari [Rabi'ah bin Abu Abdurrahman] dari [Ummu Salamah] isteri Nabi shallallahu 'alaihi wasallam, bahwa Rasulullah shallallahu 'alaihi wasallam bersabda: ""Barangsiapa tertimpa musibah lalu dia membaca sesuai yang diperintahkan Allah: 'INNAA LILLAHI WA INNAA ILAIHI RAAJI'UUN ALLAHUMMA`JURNII FI MUSHIIBATII WA A'QIBNII KHAIRAN MINHAA', (Sesungguhnya kita semua adalah milik Allah, dan akan kembali kepada-Nya. Ya Allah, berilah aku pahala atas musibah yang menimpaku dan gantilah dengan yang lebih baik darinya), ' kecuali Allah benar-benar akan melakukannya."" Ummu Salamah berkata, ""Tatkala Abu Salamah meninggal dunia, aku pun mengucapkan doa tersebut. Lalu aku berkata pada diriku sendiri; 'Siapa yang lebih baik dari Abu Salamah.' Tetapi kemudian Allah menggantikannya dengan Rasulullah shallallahu 'alaihi wasallam. Rasulullah shallallahu 'alaihi wasallam kemudian menikahinya.""","و حَدَّثَنِي عَنْ مَالِك عَنْ رَبِيعَةَ بْنِ أَبِي عَبْدِ الرَّحْمَنِ عَنْ أُمِّ سَلَمَةَ زَوْجِ النَّبِيِّ صَلَّى اللَّهُ عَلَيْهِ وَسَلَّمَ
أَنَّ رَسُولَ اللَّهِ صَلَّى اللَّهُ عَلَيْهِ وَسَلَّمَ قَالَ مَنْ أَصَابَتْهُ مُصِيبَةٌ فَقَالَ كَمَا أَمَرَ اللَّهُ
{ إِنَّا لِلَّهِ وَإِنَّا إِلَيْهِ رَاجِعُونَ }
اللَّهُمَّ أْجُرْنِي فِي مُصِيبَتِي وَأَعْقِبْنِي خَيْرًا مِنْهَا إِلَّا فَعَلَ اللَّهُ ذَلِكَ بِهِ قَالَتْ أُمُّ سَلَمَةَ فَلَمَّا تُوُفِّيَ أَبُو سَلَمَةَ قُلْتُ ذَلِكَ ثُمَّ قُلْتُ وَمَنْ خَيْرٌ مِنْ أَبِي سَلَمَةَ فَأَعْقَبَهَا اللَّهُ رَسُولَهُ صَلَّى اللَّهُ عَلَيْهِ وَسَلَّمَ فَتَزَوَّجَهَا",54
523,5,"Telah menceritakan kepadaku dari Malik dari [Abdurrahman bin Al Qasim] dari [Bapaknya] bahwa dia berkata; "" [Aisyah] mengasuhku bersama dengan seorang saudara laki-lakiku yang yatim. Dan 'Aisyah mengeluarkan zakat dari harta kami.""","و حَدَّثَنِي عَنْ مَالِك عَنْ عَبْدِ الرَّحْمَنِ بْنِ الْقَاسِمِ عَنْ أَبِيهِ أَنَّهُ قَالَ كَانَتْ عَائِشَةُ
تَلِينِي وَأَخًا لِي يَتِيمَيْنِ فِي حَجْرِهَا فَكَانَتْ تُخْرِجُ مِنْ أَمْوَالِنَا الزَّكَاةَ",54
708,8,"Telah menceritakan kepadaku dari Malik dari [Ibnu Syihab] dari [Salim bin Abdullah] dari [Abdullah bin Umar] ia berkata; ""Barangsiapa terhalang sampai ke Ka'bah karena sakit, maka dia tidak boleh bertahallul hingga thawaf di Ka'bah serta melakukan sa'i antara Shafa dan Marwa.""","و حَدَّثَنِي عَنْ مَالِك عَنْ ابْنِ شِهَابٍ عَنْ سَالِمِ بْنِ عَبْدِ اللَّهِ عَنْ عَبْدِ اللَّهِ بْنِ عُمَرَ أَنَّهُ قَالَ
مَنْ حُبِسَ دُونَ الْبَيْتِ بِمَرَضٍ فَإِنَّهُ لَا يَحِلُّ حَتَّى يَطُوفَ بِالْبَيْتِ وَبَيْنَ الصَّفَا وَالْمَرْوَةِ",54
1258,24,"Telah menceritakan kepadaku Malik dari [Ibnu Syihab] dari ['Amir bin Sa'd bin Abu Waqqas] dari [Bapaknya] berkata; ""Rasulullah Shalla Allahu 'alaihi wa sallam mengunjungiku pada peristiwa Haji Wada', karena saat itu saya sakit keras. Saya berkata; 'Wahai Rasulullah, saat ini saya sakit keras dan saya memiliki banyak harta, namun tidak ada yang mewarisiku kecuali seorang anak perempuanku, apakah saya bersedekah dengan dua pertiga hartaku? ' Rasulullah Shalla Allahu 'alaihi wa sallam bersabda; 'Jangan, ' saya bertanya; 'Ataukah setengahnya? ' Beliau bersabda: 'Jangan, ' kemudian Rasulullah Shalla Allahu 'alaihi wa sallam bersabda: 'Sepertiga. Sepertiga itu sudah banyak. Kamu meninggalkan ahli warismu dalam keadaan kaya lebih baik daripada kamu meninggalkan mereka miskin lalu meminta-minta manusia. Tidaklah engkau infaqkan hartamu dengan mengharapkan ridha Allah kecuali engkau akan diberi pahala hingga apa yang kau berikan ke mulut isterimu."" Sa'd bin Abu Waqqas berkata, ""Saya berkata; ""Wahai Rasulullah, apakah saya boleh tinggal di Makkah setelah teman-temanku pergi?"" Rasulullah Shalla Allahu 'alaihi wa sallam menjawab: ""Sekalipun kamu tetap tinggal di Makkah, dan kamu beramal shalih, niscaya akan bertambah kemuliaan dan kehormatanmu. Bisa jadi dengan kamu tinggal di dalamnya akan mendatangkan manfaat bagi suatu kaum dan mencelakakan yang lainnya. Ya Allah, muluskan perjalanan hijrah para sahabatku, jangan Kau surutkan (semangat) mereka."" Tetapi nasib tragis menimpa Sa'd bin Khaulah, ia menemui ajalnya di Makkah. Rasulullah Shalla Allahu 'alaihi wa sallam sempat memintakan rahmat dan ampunan untuknya.""","حَدَّثَنِي مَالِك عَنْ ابْنِ شِهَابٍ عَنْ عَامِرِ بْنِ سَعْدِ بْنِ أَبِي وَقَّاصٍ عَنْ أَبِيهِ أَنَّهُ قَالَ
جَاءَنِي رَسُولُ اللَّهِ صَلَّى اللَّهُ عَلَيْهِ وَسَلَّمَ يَعُودُنِي عَامَ حَجَّةِ الْوَدَاعِ مِنْ وَجَعٍ اشْتَدَّ بِي فَقُلْتُ يَا رَسُولَ اللَّهِ قَدْ بَلَغَ بِي مِنْ الْوَجَعِ مَا تَرَى وَأَنَا ذُو مَالٍ وَلَا يَرِثُنِي إِلَّا ابْنَةٌ لِي أَفَأَتَصَدَّقُ بِثُلُثَيْ مَالِي قَالَ رَسُولُ اللَّهِ صَلَّى اللَّهُ عَلَيْهِ وَسَلَّمَ لَا فَقُلْتُ فَالشَّطْرُ قَالَ لَا ثُمَّ قَالَ رَسُولُ اللَّهِ صَلَّى اللَّهُ عَلَيْهِ وَسَلَّمَ الثُّلُثُ وَالثُّلُثُ كَثِيرٌ إِنَّكَ أَنْ تَذَرَ وَرَثَتَكَ أَغْنِيَاءَ خَيْرٌ مِنْ أَنْ تَذَرَهُمْ عَالَةً يَتَكَفَّفُونَ النَّاسَ وَإِنَّكَ لَنْ تُنْفِقَ نَفَقَةً تَبْتَغِي بِهَا وَجْهَ اللَّهِ إِلَّا أُجِرْتَ حَتَّى مَا تَجْعَلُ فِي فِي امْرَأَتِكَ قَالَ فَقُلْتُ يَا رَسُولَ اللَّهِ أَأُخَلَّفُ بَعْدَ أَصْحَابِي فَقَالَ رَسُولُ اللَّهِ صَلَّى اللَّهُ عَلَيْهِ وَسَلَّمَ إِنَّكَ لَنْ تُخَلَّفَ فَتَعْمَلَ عَمَلًا صَالِحًا إِلَّا ازْدَدْتَ بِهِ دَرَجَةً وَرِفْعَةً وَلَعَلَّكَ أَنْ تُخَلَّفَ حَتَّى يَنْتَفِعَ بِكَ أَقْوَامٌ وَيُضَرَّ بِكَ آخَرُونَ اللَّهُمَّ أَمْضِ لِأَصْحَابِي هِجْرَتَهُمْ وَلَا تَرُدَّهُمْ عَلَى أَعْقَابِهِمْ لَكِنْ الْبَائِسُ سَعْدُ بْنُ خَوْلَةَ يَرْثِي لَهُ رَسُولُ اللَّهِ صَلَّى اللَّهُ عَلَيْهِ وَسَلَّمَ أَنْ مَاتَ بِمَكَّةَ",54
1385,32,"Telah menceritakan kepadaku dari Malik dari [Hisyam bin 'Urwah] dari [Bapaknya] dari [Aisyah] Ummul Mukminin, ia berkata; ""Ketika Rasulullah shallallahu 'alaihi wasallam tiba di Madinah, Abu Bakar dan Bilal diserang panas."" Aisyah berkata; ""Lalu aku menemui keduanya. Aku berkata; 'Wahai ayahku, bagaimana kabarmu? Wahai Bilal bagaimana kabarmu? '"" dia menambahkan; ""Jika Abu Bakar diserang demam, dia selalu berkata; 'Setiap jiwa bangun di pagi hari pada keluarganya, padahal kematian lebih dekat dari tali sandalnya.' Adapun Bilal jika sembuh dari demamnya, dia mengangkat suaranya dan berkata; 'Duhai, seandainya ada yang mendengarkan syairku, akankah aku tinggal malam ini di suatu lembah dan di sekelilingku pohon idkhir dan pohon jalil. Dan akankah aku mendatangi suatu hari, air Majinnah ataukah nampak bagiku Syamah dan Thafil."" Aisyah berkata; ""Aku menemui Rasulullah shallallahu 'alaihi wasallam dan mengabarkan kepada beliau. Beliau lalu berdoa: ""Ya Allah, jadikanlah kami cinta kepada Madinah sebagaimana kecintaan kami kepada Makkah, atau lebihkan cinta kami padanya. Berkahilah kami dalam Sha' kami dan mud kami, dan pindahkanlah demamnya menuju Juhfah, "" Malik berkata; telah menceritakan kepadaku Yahya bin Sa'id bahwa Aisyah isteri Nabi shallallahu 'alaihi wasallam berkata; Amir bin Fuhairah berkata; ""Saya telah melihat kematian sebelum merasakannya, sesungguhnya kematian seorang pengecut adalah dari atasnya.""","و حَدَّثَنِي عَنْ مَالِك عَنْ هِشَامِ بْنِ عُرْوَةَ عَنْ أَبِيهِ عَنْ عَائِشَةَ أُمِّ الْمُؤْمِنِينَ أَنَّهَا قَالَتْ
لَمَّا قَدِمَ رَسُولُ اللَّهِ صَلَّى اللَّهُ عَلَيْهِ وَسَلَّمَ الْمَدِينَةَ وُعِكَ أَبُو بَكْرٍ وَبِلَالٌ قَالَتْ فَدَخَلْتُ عَلَيْهِمَا فَقُلْتُ يَا أَبَتِ كَيْفَ تَجِدُكَ وَيَا بِلَالُ كَيْفَ تَجِدُكَ قَالَتْ فَكَانَ أَبُو بَكْرٍ إِذَا أَخَذَتْهُ الْحُمَّى يَقُولُ كُلُّ امْرِئٍ مُصَبَّحٌ فِي أَهْلِهِ
وَالْمَوْتُ أَدْنَى مِنْ شِرَاكِ نَعْلِهِ
وَكَانَ بِلَالٌ إِذَا أُقْلِعَ عَنْهُ يَرْفَعُ عَقِيرَتَهُ فَيَقُولُ أَلَا لَيْتَ شِعْرِي هَلْ أَبِيتَنَّ لَيْلَةً
بِوَادٍ وَحَوْلِي إِذْخِرٌ وَجَلِيلُ
وَهَلْ أَرِدَنْ يَوْمًا مِيَاهَ مَجِنَّةٍ
وَهَلْ يَبْدُوَنْ لِي شَامَةٌ وَطَفِيلُ
قَالَتْ عَائِشَةُ فَجِئْتُ رَسُولَ اللَّهِ صَلَّى اللَّهُ عَلَيْهِ وَسَلَّمَ فَأَخْبَرْتُهُ فَقَالَ اللَّهُمَّ حَبِّبْ إِلَيْنَا الْمَدِينَةَ كَحُبِّنَا مَكَّةَ أَوْ أَشَدَّ وَصَحِّحْهَا وَبَارِكْ لَنَا فِي صَاعِهَا وَمُدِّهَا وَانْقُلْ حُمَّاهَا فَاجْعَلْهَا بِالْجُحْفَةِ
قَالَ مَالِك و حَدَّثَنِي يَحْيَى بْنُ سَعِيدٍ أَنَّ عَائِشَةَ زَوْجَ النَّبِيِّ صَلَّى اللَّهُ عَلَيْهِ وَسَلَّمَ قَالَتْ وَكَانَ عَامِرُ بْنُ فُهَيْرَةَ يَقُولُ قَدْ رَأَيْتُ الْمَوْتَ قَبْلَ ذَوْقِهِ
إِنَّ الْجَبَانَ حَتْفُهُ مِنْ فَوْقِهِ",54
1476,32,"Telah menceritakan kepadaku dari Malik dari [Yazid bin Khushaifah] dari [Urwah bin Zubair] ia berkata, ""Aku mendengar [Aisyah] isteri Nabi shallallahu 'alaihi wasallam berkata; ""Rasulullah shallallahu 'alaihi wasallam bersabda: 'Tidaklah seorang mukmin mendapatkan musibah sampai duri sekalipun, kecuali akan dikurangi dosa-dosanya, atau 'dihapus darinya kesalahan-kesalahannya'."" Yazid tidak tahu mana di antara keduanya yang dikatakan Urwah.""","و حَدَّثَنِي عَنْ مَالِك عَنْ يَزِيدَ بْنِ خُصَيْفَةَ عَنْ عُرْوَةَ بْنِ الزُّبَيْرِ أَنَّهُ قَالَ سَمِعْتُ عَائِشَةَ زَوْجَ النَّبِيِّ صَلَّى اللَّهُ عَلَيْهِ وَسَلَّمَ تَقُولُ
قَالَ رَسُولُ اللَّهِ صَلَّى اللَّهُ عَلَيْهِ وَسَلَّمَ لَا يُصِيبُ الْمُؤْمِنَ مِنْ مُصِيبَةٍ حَتَّى الشَّوْكَةُ إِلَّا قُصَّ بِهَا أَوْ كُفِّرَ بِهَا مِنْ خَطَايَاهُ
لَا يَدْرِي يَزِيدُ أَيُّهُمَا قَالَ عُرْوَةُ",54
1477,32,"Telah menceritakan kepadaku Malik dari [Muhammad bin Abdullah bin Abu Sha'sha'ah] ia berkata; Aku mendengar [Abu Hubab Sa'id bin Yasar] berkata; Aku mendengar [Abu Hurairah] berkata, ""Rasulullah shallallahu 'alaihi wasallam bersabda: ""Barangsiapa yang Allah inginkan kebaikan baginya, maka Dia akan memberinya musibah.""","و حَدَّثَنِي مَالِك عَنْ مُحَمَّدِ بْنِ عَبْدِ اللَّهِ بْنِ أَبِي صَعْصَعَةَ أَنَّهُ قَالَ سَمِعْتُ أَبَا الْحُبَابِ سَعِيدَ بْنَ يَسَارٍ يَقُولُ سَمِعْتُ أَبَا هُرَيْرَةَ يَقُولُ
قَالَ رَسُولُ اللَّهِ صَلَّى اللَّهُ عَلَيْهِ وَسَلَّمَ مَنْ يُرِدْ اللَّهُ بِهِ خَيْرًا يُصِبْ مِنْهُ",54
1478,32,"Telah menceritakan kepadaku dari Malik dari [Yahya bin Sa'id] berkata, ""Pada masa Rasulullah shallallahu 'alaihi wasallam ada seorang laki-laki didatangi kematian, lalu ada seseorang berkata; ""Selamat untuknya, dia meninggal tanpa diuji dengan penyakit."" Rasulullah shallallahu 'alaihi wasallam bersabda: ""Celaka kamu! Tidakkah kamu tahu, kalau Allah mengujinya dengan penyakit niscaya dengan penyakit itu akan dilebur keburukan-keburukannya! ""","و حَدَّثَنِي عَنْ مَالِك عَنْ يَحْيَى بْنِ سَعِيدٍ
أَنَّ رَجُلًا جَاءَهُ الْمَوْتُ فِي زَمَانِ رَسُولِ اللَّهِ صَلَّى اللَّهُ عَلَيْهِ وَسَلَّمَ فَقَالَ رَجُلٌ هَنِيئًا لَهُ مَاتَ وَلَمْ يُبْتَلَ بِمَرَضٍ فَقَالَ رَسُولُ اللَّهِ صَلَّى اللَّهُ عَلَيْهِ وَسَلَّمَ وَيْحَكَ وَمَا يُدْرِيكَ لَوْ أَنَّ اللَّهَ ابْتَلَاهُ بِمَرَضٍ يُكَفِّرُ بِهِ عَنْهُ مِنْ سَيِّئَاتِهِ",54
