haditsId,kitabId,indo,arab,label
1048,8,"Telah menceritakan kepada kami [Qutaibah], telah menceritakan kepada kami [Ibnu Lahi'ah] dari [Abu Wahab Al Jaisyani] bahwa dia telah mendengar [Abu Fairuz Ad Dailami] menceritakan, dari [Bapaknya] berkata; ""Aku menemui Rasulullah shallallahu 'alaihi wasallam. Saya katakan; 'Wahai Rasulullah, aku masuk Islam dan aku memiliki istri dua orang kakak beradik.' Rasulullah shallallahu 'alaihi wasallam bersabda: 'Pilihlah salah satu (dari keduanya) yang kamu suka'.""","حَدَّثَنَا قُتَيْبَةُ حَدَّثَنَا ابْنُ لَهِيعَةَ عَنْ أَبِي وَهْبٍ الْجَيْشَانِيِّ أَنَّهُ سَمِعَ ابْنَ فَيْرُوزَ الدَّيْلَمِيَّ يُحَدِّثُ عَنْ أَبِيهِ قَالَ
أَتَيْتُ النَّبِيَّ صَلَّى اللَّهُ عَلَيْهِ وَسَلَّمَ فَقُلْتُ يَا رَسُولَ اللَّهِ إِنِّي أَسْلَمْتُ وَتَحْتِي أُخْتَانِ فَقَالَ رَسُولُ اللَّهِ صَلَّى اللَّهُ عَلَيْهِ وَسَلَّمَ اخْتَرْ أَيَّتَهُمَا شِئْتَ",22
1307,13,"Telah menceritakan kepada kami [Ali bin Sa'id Al Kindi Al Kufi], telah mengabarkan kepada kami [Ibnu Abu Za`idah] dari [Al Hajjaj] dari [Zaid bin Jubair] dari [Khasyf bin Malik] ia berkata; Aku mendengar [Ibnu Mas'ud] berkata; Rasulullah shallallahu 'alaihi wasallam menetapkan hukum diyat bagi orang yang salah sebesar dua puluh unta betina berumur dua tahun, dua puluh unta jantan berumur dua tahun, dua puluh unta betina berumur tiga tahun, dua puluh unta betina berumur lima tahun dan dua puluh unta betina berumur empat tahun. Ia mengatakan; Dalam hal ini ada hadits serupa dari Abdullah bin Amr. Telah mengabarkan kepada kami [Abu Hisyam Ar Rifa'i], telah mengabarkan kepada kami [Ibnu Abu Za`idah] dan [Abu Khalid Al Ahmar] dari [Al Hajjaj bin Arthah] seperti itu. Abu Isa berkata; Hadits Ibnu Mas'ud tidak kami ketahui secara marfu' kecuali dari jalur ini dan telah diriwayatkan dari Abdullah secara mauquf. Sebagian ulama berpendapat seperti itu, ini menjadi pendapat Ahmad dan Ishaq, namun sebagian ulama bersepakat bahwa diyat diambil selama tiga tahun, setiap tahun dibayar sepertiga diyat. Mereka berpendapat bahwa diyat bagi orang yang salah dikenakan terhadap anak yang mencapai masa dewasa, sebagian mereka berpendapat bahwa anak yang mencapai masa dewasa menyamai seorang laki-laki dari jalur ayahnya. Ini menjadi pendapat Malik dan Asy Syafi'i. Sebagian mereka berpendapat; Sesungguhnya diyat hanya dikenakan terhadap orang laki-laki, tidak kepada perempuan dan anak-anak dari keturunan. Setiap orang laki-laki dari mereka dikenakan seperempat dinar. Sebagian mereka berpendapat; Setengah dinar, jika telah sempurna diyatnya kecuali dilihat dari kabilah yang paling dekat dari mereka, maka mereka berhak membayarnya.","حَدَّثَنَا عَلِيُّ بْنُ سَعِيدٍ الْكِنْدِيُّ الْكُوفِيُّ أَخْبَرَنَا ابْنُ أَبِي زَائِدَةَ عَنْ الْحَجَّاجِ عَنْ زَيْدِ بْنِ جُبَيْرٍ عَنْ خَشْفِ بْنِ مَالِكٍ قَال سَمِعْتُ ابْنَ مَسْعُودٍ قَالَ
قَضَى رَسُولُ اللَّهِ صَلَّى اللَّهُ عَلَيْهِ وَسَلَّمَ فِي دِيَةِ الْخَطَإِ عِشْرِينَ بِنْتَ مَخَاضٍ وَعِشْرِينَ بَنِي مَخَاضٍ ذُكُورًا وَعِشْرِينَ بِنْتَ لَبُونٍ وَعِشْرِينَ جَذَعَةً وَعِشْرِينَ حِقَّةً
قَالَ وَفِي الْبَاب عَنْ عَبْدِ اللَّهِ بْنِ عَمْرٍو أَخْبَرَنَا أَبُو هِشَامٍ الرِّفَاعِيُّ أَخْبَرَنَا ابْنُ أَبِي زَائِدَةَ وَأَبُو خَالِدٍ الْأَحْمَرُ عَنْ الْحَجَّاجِ بْنِ أَرْطَاةَ نَحْوَهُ قَالَ أَبُو عِيسَى حَدِيثُ ابْنِ مَسْعُودٍ لَا نَعْرِفُهُ مَرْفُوعًا إِلَّا مِنْ هَذَا الْوَجْهِ وَقَدْ رُوِيَ عَنْ عَبْدِ اللَّهِ مَوْقُوفًا وَقَدْ ذَهَبَ بَعْضُ أَهْلِ الْعِلْمِ إِلَى هَذَا وَهُوَ قَوْلُ أَحْمَدَ وَإِسْحَقَ وَقَدْ أَجْمَعَ أَهْلُ الْعِلْمِ عَلَى أَنَّ الدِّيَةَ تُؤْخَذُ فِي ثَلَاثِ سِنِينَ فِي كُلِّ سَنَةٍ ثُلُثُ الدِّيَةِ وَرَأَوْا أَنَّ دِيَةَ الْخَطَإِ عَلَى الْعَاقِلَةِ وَرَأَى بَعْضُهُمْ أَنَّ الْعَاقِلَةَ قَرَابَةُ الرَّجُلِ مِنْ قِبَلِ أَبِيهِ وَهُوَ قَوْلُ مَالِكٍ وَالشَّافِعِيِّ و قَالَ بَعْضُهُمْ إِنَّمَا الدِّيَةُ عَلَى الرِّجَالِ دُونَ النِّسَاءِ وَالصِّبْيَانِ مِنْ الْعَصَبَةِ يُحَمَّلُ كُلُّ رَجُلٍ مِنْهُمْ رُبُعَ دِينَارٍ وَقَدْ قَالَ بَعْضُهُمْ إِلَى نِصْفِ دِينَارٍ فَإِنْ تَمَّتْ الدِّيَةُ وَإِلَّا نُظِرَ إِلَى أَقْرَبِ الْقَبَائِلِ مِنْهُمْ فَأُلْزِمُوا ذَلِكَ",22
1450,20,"Telah menceritakan kepada kami [Qutaibah] dari [Malik bin Anas] dari [Suhail bin Abu Shalih] dari [Bapaknya] dari [Abu Hurairah] dari Nabi shallallahu 'alaihi wasallam, beliau bersabda: ""Barangsiapa bersumpah atas suatu perkara lalu melihat yang lebih baik dari itu, maka hendaklah ia kerjakan yang lebih baik dan membayar kafarah sumpahnya."" Ia berkata, ""Dalam bab ini ada hadits serupa dari Ummu Salamah."" Abu Isa berkata; ""Hadits Abu Hurairah derajatnya hasan shahih. Dan menjadi pedoman amal menurut kebanyakan ulama` dari kalangan sahabat Nabi Sallallahu 'Alaihi Wasallam dan selain mereka, yakni bahwa kafarah yang ditunaikan sebelum terjadinya pelanggaran adalah sah. Ini adalah pendapat yang diambil oleh Malik bin Anas, As Syafi'I, Ahmad dan Ishaq. Sedangkan sebagian ulama` lain berpendapat bahwa kafarah tidak boleh ditunaikan sebelum terjadinya pelanggaran. Sufyan Ats Tsauri berkata; ""Jika seseorang memberikan kafarah setelah terjadinya pelanggaran maka itu lebih aku sukai, jika ia memberikannya sebelum terjadinya pelanggaran maka itu sudah cukup.""","حَدَّثَنَا قُتَيْبَةُ عَنْ مَالِكِ بْنِ أَنَسٍ عَنْ سُهَيْلِ بْنِ أَبِي صَالِحٍ عَنْ أَبِيهِ عَنْ أَبِي هُرَيْرَةَ
عَنْ النَّبِيِّ صَلَّى اللَّهُ عَلَيْهِ وَسَلَّمَ قَالَ مَنْ حَلَفَ عَلَى يَمِينٍ فَرَأَى غَيْرَهَا خَيْرًا مِنْهَا فَلْيُكَفِّرْ عَنْ يَمِينِهِ وَلْيَفْعَلْ
قَالَ وَفِي الْبَاب عَنْ أُمِّ سَلَمَةَ قَالَ أَبُو عِيسَى حَدِيثُ أَبِي هُرَيْرَةَ حَدِيثٌ حَسَنٌ صَحِيحٌ وَالْعَمَلُ عَلَى هَذَا عِنْدَ أَكْثَرِ أَهْلِ الْعِلْمِ مِنْ أَصْحَابِ النَّبِيِّ صَلَّى اللَّهُ عَلَيْهِ وَسَلَّمَ وَغَيْرِهِمْ أَنَّ الْكَفَّارَةَ قَبْلَ الْحِنْثِ تُجْزِئُ وَهُوَ قَوْلُ مَالِكِ بْنِ أَنَسٍ وَالشَّافِعِيِّ وَأَحْمَدَ وَإِسْحَقَ و قَالَ بَعْضُ أَهْلِ الْعِلْمِ لَا يُكَفِّرُ إِلَّا بَعْدَ الْحِنْثِ قَالَ سُفْيَانُ الثَّوْرِيُّ إِنْ كَفَّرَ بَعْدَ الْحِنْثِ أَحَبُّ إِلَيَّ وَإِنْ كَفَّرَ قَبْلَ الْحِنْثِ أَجْزَأَهُ",22
1522,21,"Telah menceritakan kepada kami [Qutaibah] berkata, telah menceritakan kepada kami [Al Laits bin Sa'd] dari [Abu Az Zubair] dari [Jabir] ia berkata, ""Seorang budak datang lalu berbaiat kepada Rasulullah shallallahu 'alaihi wasallam, sementara Nabi shallallahu 'alaihi wasallam tidak menyadari bahwa orang tersebut adalah budak. lalu tuannya datang, maka Nabi shallallahu 'alaihi wasallam bersabda: ""Juallah budak itu kepadaku."" dan Nabi Sallallahu 'alaihi Wasallam membelinya dengan dua orang budak yang hitam, akhirnya Nabi Sallallahu 'Alaihi Wasallam tidak membaiat seorang pun hingga beliau bertanya kepadanya; apakah dia seorang budak (atau bukan)."" Ia berkata, ""Dalam bab ini juga ada hadits dari Ibnu Abbas."" Abu Isa berkata, ""Hadits Jabir ini derajatnya hasan gharib shahih, kami tidak mengetahuinya kecuali dari hadits Abu Az Zubair.""","حَدَّثَنَا قُتَيْبَةُ حَدَّثَنَا اللَّيْثُ بْنُ سَعْدٍ عَنْ أَبِي الزُّبَيْرِ عَنْ جَابِرٍ أَنَّهُ قَالَ
جَاءَ عَبْدٌ فَبَايَعَ رَسُولَ اللَّهِ صَلَّى اللَّهُ عَلَيْهِ وَسَلَّمَ عَلَى الْهِجْرَةِ وَلَا يَشْعُرُ النَّبِيُّ صَلَّى اللَّهُ عَلَيْهِ وَسَلَّمَ أَنَّهُ عَبْدٌ فَجَاءَ سَيِّدُهُ فَقَالَ النَّبِيُّ صَلَّى اللَّهُ عَلَيْهِ وَسَلَّمَ بِعْنِيهِ فَاشْتَرَاهُ بِعَبْدَيْنِ أَسْوَدَيْنِ وَلَمْ يُبَايِعْ أَحَدًا بَعْدُ حَتَّى يَسْأَلَهُ أَعَبْدٌ هُوَ
قَالَ وَفِي الْبَاب عَنْ ابْنِ عَبَّاسٍ قَالَ أَبُو عِيسَى حَدِيثُ جَابِرٍ حَدِيثٌ حَسَنٌ غَرِيبٌ صَحِيحٌ لَا نَعْرِفُهُ إِلَّا مِنْ حَدِيثِ أَبِي الزُّبَيْرِ",22
1532,21,"Telah menceritakan kepada kami [Al Hasan bin Ali Al Khallal] berkata, telah menceritakan kepada kami [Abu Ashim] dan [Abdurrazaq] keduanya berkata; telah mengabarkan kepada kami [Ibnu Juraij] ia berkata; telah mengabarkan kepadaku [Abu Az Zubair] bahwasanya ia mendengar [Jabir bin Abdullah] berkata; telah mengabarkan kepadaku [Umar Ibnul Kthaththab] bahwa ia mendengar Rasulullah shallallahu 'alaihi wasallam bersabda: ""Sungguh, akan aku keluarkan orang-orang Yahudi dan Nashrani dari Jazirah Arab. Aku tidak menyisakan di dalamnya kecuali orang muslim."" Abu Isa berkata, ""Hadits ini derajatnya hasan shahih.""","حَدَّثَنَا الْحَسَنُ بْنُ عَلِيٍّ الْخَلَّالُ حَدَّثَنَا أَبُو عَاصِمٍ وَعَبْدُ الرَّزَّاقِ قَالَا أَخْبَرَنَا ابْنُ جُرَيْجٍ قَالَ أَخْبَرَنِي أَبُو الزُّبَيْرِ أَنَّهُ سَمِعَ جَابِرَ بْنَ عَبْدِ اللَّهِ يَقُولُ أَخْبَرَنِي عُمَرُ بْنُ الْخَطَّابِ
أَنَّهُ سَمِعَ رَسُولَ اللَّهِ صَلَّى اللَّهُ عَلَيْهِ وَسَلَّمَ يَقُولُ لَأُخْرِجَنَّ الْيَهُودَ وَالنَّصَارَى مِنْ جَزِيرَةِ الْعَرَبِ فَلَا أَتْرُكُ فِيهَا إِلَّا مُسْلِمًا
قَالَ أَبُو عِيسَى هَذَا حَدِيثٌ حَسَنٌ صَحِيحٌ",22
2923,47,"Telah menceritakan kepada kami [Ishaq bin Manshur] telah mengabarkan kepada kami [Abdullah bin Bakr As Sahmani] telah menceritakan kepada kami [Humaid] dari [Anas] ia berkata; ""Ketika turun ayat Kamu sekali-kali tidak sampai kepada kebajikan (yang sempurna), sebelum kamu menafkahkan sebahagian harta yang kamu cintai."" QS Ali 'Imran: 92 atau Siapakah yang mau memberi pinjaman kepada Allah, pinjaman yang baik (menafkahkan hartanya di jalan Allah). QS Al-Baqarah: 245, kemudian Abu Thalhah, yang memiliki kebun berkata; ""Wahai Rasulullah, saya (infakkan) kebun saya ini di jalan Allah. Dan sekiranya saya mampu untuk menyembunyikannya tentu saya tidak menyatakannya. lalu beliau mengatakan ""Berikanlah kepada kerabat atau orang yang terdekat denganmu!"" Abu Isa mengatakan bahwa hadits ini hasan shahih. Dan [Malik bin Anas] telah meriwayatkan dari [Ishaq bin Abdullah bin Abu Thalhah] dari [Anas bin Malik] ","حَدَّثَنَا إِسْحَقُ بْنُ مَنْصُورٍ أَخْبَرَنَا عَبْدُ اللَّهِ بْنُ بَكْرٍ السَّهْمِيُّ حَدَّثَنَا حُمَيْدٌ عَنْ أَنَسٍ قَالَ
لَمَّا نَزَلَتْ هَذِهِ الْآيَةَ
{ لَنْ تَنَالُوا الْبِرَّ حَتَّى تُنْفِقُوا مِمَّا تُحِبُّونَ }
أَوْ
{ مَنْ ذَا الَّذِي يُقْرِضُ اللَّهَ قَرْضًا حَسَنًا }
قَالَ أَبُو طَلْحَةَ وَكَانَ لَهُ حَائِطٌ فَقَالَ يَا رَسُولَ اللَّهِ حَائِطِي لِلَّهِ وَلَوْ اسْتَطَعْتُ أَنْ أُسِرَّهُ لَمْ أُعْلِنْهُ فَقَالَ اجْعَلْهُ فِي قَرَابَتِكَ أَوْ أَقْرَبِيكَ
قَالَ أَبُو عِيسَى هَذَا حَدِيثٌ حَسَنٌ صَحِيحٌ وَقَدْ رَوَاهُ مَالِكُ بْنُ أَنَسٍ عَنْ إِسْحَقَ بْنِ عَبْدِ اللَّهِ بْنِ أَبِي طَلْحَةَ عَنْ أَنَسِ بْنِ مَالِكِ",22
3683,49,"Telah menceritakan kepada kami [Ahmad bin Utsman Al Bashri] dan [ishaq bin Ibrahim bin Habib Al Bashri] telah menceritakan kepada kami [Quraisy bin Anas] dari [Muhammad bin 'Amru] dari [Abu Salamah] bahwa [Abdurrahman bin 'Auf] pernah mewasiatkan kebunnya kepada para ummul mukminin (para istri rasul) seharga empat ratus ribu (dirham)."" Abu Isa berkata; ""Hadits ini adalah hadits hasan gharib.""","حَدَّثَنَا أَحْمَدُ بْنُ عُثْمَانَ الْبَصْرِيُّ وَإِسْحَقُ بْنُ إِبْرَاهِيمَ بْنِ حَبِيبٍ الْبَصْرِيُّ حَدَّثَنَا قُرَيْشُ بْنُ أَنَسٍ عَنْ مُحَمَّدِ بْنِ عَمْرٍو عَنْ أَبِي سَلَمَةَ أَنَّ عَبْدَ الرَّحْمَنِ بْنَ عَوْفٍ
أَوْصَى بِحَدِيقَةٍ لِأُمَّهَاتِ الْمُؤْمِنِينَ بِيعَتْ بِأَرْبَعِ مِائَةِ أَلْفٍ
قَالَ هَذَا حَدِيثٌ حَسَنٌ غَرِيبٌ",22
3693,49,"Telah menceritakan kepada kami [Ahmad bin Ibrahim Ad Dauraqi] telah menceritakan kepada kami [Wahb bin Jarir] telah menceritakan kepadaku [ayahku] dia berkata; saya mendengar [Al A'masy] bercerita dari ['Amru bin Murrah] dari [Abu Al Bakhtari] dari [Ali] bahwa Nabi shallallahu 'alaihi wasallam bersabda kepada Umar mengenai diri Abbas: ""Sesungguhnya paman seseorang adalah saudara kandung ayahnya."" sedangkan Umar (ketika itu) mempersoalkan akan shadaqahnya (Abbas). Abu Isa berkata; ""Hadits ini adalah hadits hasan shahih.""","حَدَّثَنَا أَحْمَدُ بْنُ إِبْرَاهِيمَ الدَّوْرَقِيُّ حَدَّثَنَا وَهْبُ بْنُ جَرِيرٍ حَدَّثَنِي أَبِي قَال سَمِعْتُ الْأَعْمَشَ يُحَدِّثُ عَنْ عَمْرِو بْنِ مُرَّةَ عَنْ أَبِي الْبَخْتَرِيِّ عَنْ عَلِيٍّ
أَنَّ النَّبِيَّ صَلَّى اللَّهُ عَلَيْهِ وَسَلَّمَ قَالَ لِعُمَرَ فِي الْعَبَّاسِ إِنَّ عَمَّ الرَّجُلِ صِنْوُ أَبِيهِ وَكَانَ عُمَرُ تَكَلَّمَ فِي صَدَقَتِهِ
قَالَ هَذَا حَدِيثٌ حَسَنٌ صَحِيحٌ",22
