haditsId,kitabId,indo,arab,label
1072,9,"Telah menceritakan kepada kami [Qutaibah], telah menceritakan kepada kami [Abu 'Awanah] dari [Hisyam bin 'Urwah] dari [Bapaknya] dari [Fathimah bin Al Mundzir] dari [Umu Salamah] berkata; Rasulullah shallallahu 'alaihi wasallam bersabda: ""Persusuan tidak bisa menjadikan mahram, kecuali (susuan) yang mengenyangkan dan terjadi sebelum disapih."" Abu Isa berkata; ""Ini merupakan hadits hasan sahih dan diamalkan para ulama dari kalangan sahabat Nabi shallallahu 'alaihi wasallam dan yang lainnya; bahwa persusuan tidak menjadikan mahram kecuali pada bayi di bawah dua tahun. Jika telah berlangsung waktu dua tahun, tidak menjadikan mahram. Fathimah binti Al Mundzir bin Zubair bin 'Awwam adalah istri Hisyam bin 'Urwah.""","حَدَّثَنَا قُتَيْبَةُ حَدَّثَنَا أَبُو عَوَانَةَ عَنْ هِشَامِ بْنِ عُرْوَةَ عَنْ أَبِيهِ عَنْ فَاطِمَةَ بِنْتِ الْمُنْذِرِ عَنْ أُمِّ سَلَمَةَ قَالَتْ
قَالَ رَسُولُ اللَّهِ صَلَّى اللَّهُ عَلَيْهِ وَسَلَّمَ لَا يُحَرِّمُ مِنْ الرِّضَاعَةِ إِلَّا مَا فَتَقَ الْأَمْعَاءَ فِي الثَّدْيِ وَكَانَ قَبْلَ الْفِطَامِ
قَالَ أَبُو عِيسَى هَذَا حَدِيثٌ حَسَنٌ صَحِيحٌ وَالْعَمَلُ عَلَى هَذَا عِنْدَ أَكْثَرِ أَهْلِ الْعِلْمِ مِنْ أَصْحَابِ النَّبِيِّ صَلَّى اللَّهُ عَلَيْهِ وَسَلَّمَ وَغَيْرِهِمْ أَنَّ الرَّضَاعَةَ لَا تُحَرِّمُ إِلَّا مَا كَانَ دُونَ الْحَوْلَيْنِ وَمَا كَانَ بَعْدَ الْحَوْلَيْنِ الْكَامِلَيْنِ فَإِنَّهُ لَا يُحَرِّمُ شَيْئًا وَفَاطِمَةُ بِنْتُ الْمُنْذِرِ بْنِ الزُّبَيْرِ بْنِ الْعَوَّامِ وَهِيَ امْرَأَةُ هِشَامِ بْنِ عُرْوَةَ",27
1210,11,"Telah menceritakan kepada kami [Qutaibah], telah menceritakan kepada kami [Al Laits] dari [Ibnu 'Ajlan] dari [Amr bin Syu'aib] dari [ayahnya] dari [kakeknya] bahwa Nabi shallallahu 'alaihi wasallam pernah ditanya tentang buah kurma yang masih tergantung. Lalu beliau menjawab: ""Bagi siapa saja yang terpaksa karena kebutuhan (untuk dimakan) bukan untuk disembunyikan di dalam bajunya, maka tidak apa-apa."" Abu Isa berkata; Hadits ini hasan.","حَدَّثَنَا قُتَيْبَةُ حَدَّثَنَا اللَّيْثُ عَنْ ابْنِ عَجْلَانَ عَنْ عَمْرِو بْنِ شُعَيْبٍ عَنْ أَبِيهِ عَنْ جَدِّهِ
أَنَّ النَّبِيَّ صَلَّى اللَّهُ عَلَيْهِ وَسَلَّمَ سُئِلَ عَنْ الثَّمَرِ الْمُعَلَّقِ فَقَالَ مَنْ أَصَابَ مِنْهُ مِنْ ذِي حَاجَةٍ غَيْرَ مُتَّخِذٍ خُبْنَةً فَلَا شَيْءَ عَلَيْهِ
قَالَ أَبُو عِيسَى هَذَا حَدِيثٌ حَسَنٌ",27
1293,12,"Telah menceritakan kepada kami [Qutaibah], telah menceritakan kepada kami [Isma'il bin Ja'far] dari [Rabi'ah bin Abu Abdurrahman] dari [Yazid] mantan budak Al Munba'its dari [Zaid bin Khalid Al Juhani] bahwa ada seseorang bertanya kepada Rasulullah shallallahu 'alaihi wasallam tentang barang temuan, beliau pun menjawab: ""Umumkanlah selama satu tahun kemudian umumkanlah tali pengikat, bejana dan isinya. Setelah itu belanjakanlah ia, namun jika datang pemiliknya maka serahkanlah kepadanya."" Lalu ia bertanya kepada beliau; Wahai Rasulullah, ia berupa kambing yang hilang. Maka beliau menjawab: ""Sesungguhnya itu menjadi milikmu, saudaramu atau milik serigala."" Ia bertanya lagi; Wahai Rasulullah, bagaimana dengan unta yang hilang? Ia menceritakan; Lalu Nabi shallallahu 'alaihi wasallam pun marah hingga memerah kedua pipi atasnya atau memerah wajahnya seraya mengatakan: ""Itu bukan milikmu dan baginya apa yang ia bawa berupa sepatu dan tempat minumnya hingga ia bertemu dengan pemiliknya."" Hadits Zaid bin Khalid adalah hadits hasan shahih dan telah diriwayatkan darinya dari jalur lain sedangkan hadits Yazid mantan budak Al Munba'its dari Zaid bin Khalid adalah hadits hasan shahih, dan telah diriwayatkan darinya dari jalur lain.","حَدَّثَنَا قُتَيْبَةُ حَدَّثَنَا إِسْمَعِيلُ بْنُ جَعْفَرٍ عَنْ رَبِيعَةَ بْنِ أَبِي عَبْدِ الرَّحْمَنِ عَنْ يَزِيدَ مَوْلَى الْمُنْبَعِثِ عَنْ زَيْدِ بْنِ خَالِدٍ الْجُهَنِيِّ
أَنَّ رَجُلًا سَأَلَ رَسُولَ اللَّهِ صَلَّى اللَّهُ عَلَيْهِ وَسَلَّمَ عَنْ اللُّقَطَةِ فَقَالَ عَرِّفْهَا سَنَةً ثُمَّ اعْرِفْ وِكَاءَهَا وَوِعَاءَهَا وَعِفَاصَهَا ثُمَّ اسْتَنْفِقْ بِهَا فَإِنْ جَاءَ رَبُّهَا فَأَدِّهَا إِلَيْهِ فَقَالَ لَهُ يَا رَسُولَ اللَّهِ فَضَالَّةُ الْغَنَمِ فَقَالَ خُذْهَا فَإِنَّمَا هِيَ لَكَ أَوْ لِأَخِيكَ أَوْ لِلذِّئْبِ فَقَالَ يَا رَسُولَ اللَّهِ فَضَالَّةُ الْإِبِلِ قَالَ فَغَضِبَ النَّبِيُّ صَلَّى اللَّهُ عَلَيْهِ وَسَلَّمَ حَتَّى احْمَرَّتْ وَجْنَتَاهُ أَوْ احْمَرَّ وَجْهُهُ فَقَالَ مَا لَكَ وَلَهَا مَعَهَا حِذَاؤُهَا وَسِقَاؤُهَا حَتَّى تَلْقَى رَبَّهَا
حَدِيثُ زَيْدِ بْنِ خَالِدٍ حَدِيثٌ حَسَنٌ صَحِيحٌ وَقَدْ رُوِيَ عَنْهُ مِنْ غَيْرِ وَجْهٍ وَحَدِيثُ يَزِيدَ مَوْلَى الْمُنْبَعِثِ عَنْ زَيْدِ بْنِ خَالِدٍ حَدِيثٌ حَسَنٌ صَحِيحٌ وَقَدْ رُوِيَ عَنْهُ مِنْ غَيْرِ وَجْهٍ",27
1295,12,"Telah menceritakan kepada kami [Al Hasan bin Ali Al Khallal], telah menceritakan kepada kami [Abdullah bin Numair] dan [Yazid bin Harun] dari [Sufyan Ats Tsauri] dari [Salamah bin Kuhail] dari [Suwaid bin Ghaflah] ia berkata; Aku pernah keluar bersama Zaid bin Shuhan dan Salamah bin Rabi'ah, lalu aku mendapatkan sebuah cambuk. Ibnu Numair berkata dalam haditsnya; Lalu aku menemukan sebuah cambuk dan aku mengambilnya, keduanya berkata; Biarkan ia. Aku berkata; Aku tidak akan membiarkannya karena binatang buas akan memakannya, sungguh aku akan mengambil dan menggunakannya. Lalu aku datang menemui [Ubay bin Ka'b] bertanya kepadanya tentang hal itu dan aku menceritakan kepadanya sebuah hadits. Ia pun menjawab; Bagus, pada masa Rasulullah shallallahu 'alaihi wasallam aku pernah mendapatkan sebuah kantong berisi seratus dinar. Ia melanjutkan; Lalu aku membawanya kepada beliau, beliau pun mengatakan kepadaku: ""Umumkanlah selama satu tahun."" Lalu aku mengumumkannya selama satu tahun namun tidak ada orang yang mengakuinya, kemudian aku membawanya kembali kepada beliau, beliau pun mengatakan kepadaku: ""Umumkanlah selama satu tahun lagi."" Aku pun mengumumkannya kemudian aku menemuinya lagi. Beliau pun masih mengatakan kepadaku: ""Umumkanlah selama satu tahun lagi."" Dan beliau bersabda: ""Hitunglah jumlah, bejana dan tali ikatannya, jika pemiliknya datang memintanya maka kabarkan jumlah, bejana dan tali ikatannya kepadanya, lalu serahkan kepadanya. Namun jika tidak ada yang mengakuinya maka pergunakanlah ia."" Ia mengatakan; Hadits ini hasan shahih.","حَدَّثَنَا الْحَسَنُ بْنُ عَلِيٍّ الْخَلَّالُ حَدَّثَنَا عَبْدُ اللَّهِ بْنُ نُمَيْرٍ وَيَزِيدُ بْنُ هَارُونَ عَنْ سُفْيَانَ الثَّوْرِيِّ عَنْ سَلَمَةَ بْنِ كُهَيْلٍ عَنْ سُوَيْدِ بْنِ غَفَلَةَ قَالَ
خَرَجْتُ مَعَ زَيْدِ بْنِ صُوحَانَ وَسَلْمَانَ بْنِ رَبِيعَةَ فَوَجَدْتُ سَوْطًا قَالَ ابْنُ نُمَيْرٍ فِي حَدِيثِهِ فَالْتَقَطْتُ سَوْطًا فَأَخَذْتُهُ قَالَا دَعْهُ فَقُلْتُ لَا أَدَعُهُ تَأْكُلْهُ السِّبَاعُ لَآخُذَنَّهُ فَلَأَسْتَمْتِعَنَّ بِهِ فَقَدِمْتُ عَلَى أُبَيِّ بْنِ كَعْبٍ فَسَأَلْتُهُ عَنْ ذَلِكَ وَحَدَّثْتُهُ الْحَدِيثَ فَقَالَ أَحْسَنْتَ وَجَدْتُ عَلَى عَهْدِ رَسُولِ اللَّهِ صَلَّى اللَّهُ عَلَيْهِ وَسَلَّمَ صُرَّةً فِيهَا مِائَةُ دِينَارٍ قَالَ فَأَتَيْتُهُ بِهَا فَقَالَ لِي عَرِّفْهَا حَوْلًا فَعَرَّفْتُهَا حَوْلًا فَمَا أَجِدُ مَنْ يَعْرِفُهَا ثُمَّ أَتَيْتُهُ بِهَا فَقَالَ عَرِّفْهَا حَوْلًا آخَرَ فَعَرَّفْتُهَا ثُمَّ أَتَيْتُهُ بِهَا فَقَالَ عَرِّفْهَا حَوْلًا آخَرَ وَقَالَ أَحْصِ عِدَّتَهَا وَوِعَاءَهَا وَوِكَاءَهَا فَإِنْ جَاءَ طَالِبُهَا فَأَخْبَرَكَ بِعِدَّتِهَا وَوِعَائِهَا وَوِكَائِهَا فَادْفَعْهَا إِلَيْهِ وَإِلَّا فَاسْتَمْتِعْ بِهَا
قَالَ هَذَا حَدِيثٌ حَسَنٌ صَحِيحٌ",27
2344,37,"Telah menceritakan kepada kami [Qutaibah] telah menceritakan kepada kami [Abdul Aziz bin Muhammad] dari [Al 'Alla` bin Abdurrahman] dari [ayahnya] dari [Abu Hurairah] Rasulullah Shallallahu 'alaihi wa salam bersabda: ""Hak-hak akan ditunaikan kepada pemiliknya hingga kambing bertanduk di qisas karena kambing botak."" Dalam hal ini ada hadits serupa dari Abu Hurairah, Abu Dzarr, Abdullah bin Unais. Berkata Abu Isa: Hadits Abu Hurairah hasan shahih.","حَدَّثَنَا قُتَيْبَةُ حَدَّثَنَا عَبْدُ الْعَزِيزِ بْنُ مُحَمَّدٍ عَنْ الْعَلَاءِ بْنِ عَبْدِ الرَّحْمَنِ عَنْ أَبِيهِ عَنْ أَبِي هُرَيْرَةَ
أَنَّ رَسُولَ اللَّهِ صَلَّى اللَّهُ عَلَيْهِ وَسَلَّمَ قَالَ لَتُؤَدُّنَّ الْحُقُوقَ إِلَى أَهْلِهَا حَتَّى يُقَادَ لِلشَّاةِ الْجَلْحَاءِ مِنْ الشَّاةِ الْقَرْنَاءِ
وَفِي الْبَاب عَنْ أَبِي ذَرٍّ وَعَبْدِ اللَّهِ بْنِ أُنَيْسٍ قَالَ أَبُو عِيسَى وَحَدِيثُ أَبِي هُرَيْرَةَ حَدِيثٌ حَسَنٌ صَحِيحٌ",27
