haditsId,kitabId,indo,arab,label
1175,11,"Telah menceritakan kepada kami [Abu Kuraib] dan [Yusuf bin Isa] keduanya berkata; Telah menceritakan kepada kami [Waki'] dari [Zakariya] dari [Amir] dari [Abu Hurairah] ia berkata; Rasulullah shallallahu 'alaihi wasallam bersabda: ""binatang kendaraan boleh dikendarai jika hewan itu digadaikan dan susunya boleh diminum jika ia digadaikan dan bagi orang yang menunggang dan meminumnya wajib memberi nafkah."" Abu Isa berkata; Hadits ini hasan shahih, kami tidak mengetahuinya sebagai hadits marfu' kecuali dari hadits Amir Asy Sya'bi dari Abu Hurairah dan hadits ini telah diriwayatkan oleh banyak perawi dari Al A'masy dari Abu Shalih dari Abu Hurairah secara mauquf, hadits ini dapat dijadikan landasan amal menurut sebagian ulama, ini adalah pendapat Ahmad dan Ishaq. Sedangkan sebagian ulama mengatakan; Seseorang tidak boleh mengambil manfaat dari penggadaian sedikitpun.","حَدَّثَنَا أَبُو كُرَيْبٍ وَيُوسُفُ بْنُ عِيسَى قَالَا حَدَّثَنَا وَكِيعٌ عَنْ زَكَرِيَّا عَنْ عَامِرٍ عَنْ أَبِي هُرَيْرَةَ قَالَ
قَالَ رَسُولُ اللَّهِ صَلَّى اللَّهُ عَلَيْهِ وَسَلَّمَ الظَّهْرُ يُرْكَبُ إِذَا كَانَ مَرْهُونًا وَلَبَنُ الدَّرِّ يُشْرَبُ إِذَا كَانَ مَرْهُونًا وَعَلَى الَّذِي يَرْكَبُ وَيَشْرَبُ نَفَقَتُهُ
قَالَ أَبُو عِيسَى هَذَا حَدِيثٌ حَسَنٌ صَحِيحٌ لَا نَعْرِفُهُ مَرْفُوعًا إِلَّا مِنْ حَدِيثِ عَامِرٍ الشَّعْبِيِّ عَنْ أَبِي هُرَيْرَةَ وَقَدْ رَوَى غَيْرُ وَاحِدٍ هَذَا الْحَدِيثَ عَنْ الْأَعْمَشِ عَنْ أَبِي صَالِحٍ عَنْ أَبِي هُرَيْرَةَ مَوْقُوفًا وَالْعَمَلُ عَلَى هَذَا الْحَدِيثِ عِنْدَ بَعْضِ أَهْلِ الْعِلْمِ وَهُوَ قَوْلُ أَحْمَدَ وَإِسْحَقَ و قَالَ بَعْضُ أَهْلِ الْعِلْمِ لَيْسَ لَهُ أَنْ يَنْتَفِعَ مِنْ الرَّهْنِ بِشَيْءٍ",30
1262,12,"Telah menceritakan kepada kami [Muhammad bin Sahl bin 'Askar Al Baghdadi], telah menceritakan kepada kami [Muhammad bin Yusuf], telah menceritakan kepada kami [Nafi' bin Umar Al Jumahi] dari [Abdullah bin Abu Mulaikah] dari [Ibnu Abbas] bahwa Rasulullah shallallahu 'alaihi wasallam menetapkan sumpah atas orang yang menuntut. Abu Isa berkata; Hadits ini hasan shahih dan menjadi pedoman amal menurut para ulama dari kalangan Nabi shallallahu 'alaihi wasallam dan selain mereka, bahwa menghadirkan bukti itu wajib atas orang tertuduh dan mengucapkan sumpah wajib atas orang yang menuntut.","حَدَّثَنَا مُحَمَّدُ بْنُ سَهْلِ بْنِ عَسْكَرٍ الْبَغْدَادِيُّ حَدَّثَنَا مُحَمَّدُ بْنُ يُوسُفَ حَدَّثَنَا نَافِعُ بْنُ عُمَرَ الْجُمَحِيُّ عَنْ عَبْدِ اللَّهِ بْنِ أَبِي مُلَيْكَةَ عَنْ ابْنِ عَبَّاسٍ
أَنَّ رَسُولَ اللَّهِ صَلَّى اللَّهُ عَلَيْهِ وَسَلَّمَ قَضَى أَنَّ الْيَمِينَ عَلَى الْمُدَّعَى عَلَيْهِ
قَالَ أَبُو عِيسَى هَذَا حَدِيثٌ حَسَنٌ صَحِيحٌ وَالْعَمَلُ عَلَى هَذَا عِنْدَ أَهْلِ الْعِلْمِ مِنْ أَصْحَابِ النَّبِيِّ صَلَّى اللَّهُ عَلَيْهِ وَسَلَّمَ وَغَيْرِهِمْ أَنَّ الْبَيِّنَةَ عَلَى الْمُدَّعِي وَالْيَمِينَ عَلَى الْمُدَّعَى عَلَيْهِ",30
1265,12,"Telah menceritakan kepada kami [Ali bin Hujr], telah mengabarkan kepada kami [Isma'il bin Ja'far] telah menceritakan kepada kami [Ja'far bin Muhammad] dari [ayahnya] bahwa Nabi shallallahu 'alaihi wasallam menetapkan sumpah harus disertai satu orang saksi. Ia melanjutkan; Dan Ali telah melakukannya di antara kalian. Abu Isa berkata; Ini lebih shahih, demikianlah [Sufyan Ats Tsauri] meriwayatkan dari [Ja'far bin Muhammad] dari [ayahnya] dari Nabi shallallahu 'alaihi wasallam secara mursal. Dan [Abdul Aziz bin Abu Salamah] dan [Yahya bin Sulaim] meriwayatkan hadits ini dari [Ja'far bin Muhammad] dari [ayahnya] dari [Ali] dari Nabi shallallahu 'alaihi wasallam. Hadits ini menjadi pedoman amal menurut para ulama dari kalangan sahabat Nabi shallallahu 'alaihi wasallam dan selain mereka, mereka berpendapat bahwa sumpah dengan menyertai satu orang saksi adalah boleh dalam menuntut hak dan harta sementara sebagian ulama dari penduduk Kufah dan selain mereka tidak berpendapat bahwa sumpah ditetapkan beserta satu orang saksi.","حَدَّثَنَا عَلِيُّ بْنُ حُجْرٍ أَخْبَرَنَا إِسْمَعِيلُ بْنُ جَعْفَرٍ حَدَّثَنَا جَعْفَرُ بْنُ مُحَمَّدٍ عَنْ أَبِيهِ
أَنَّ النَّبِيَّ صَلَّى اللَّهُ عَلَيْهِ وَسَلَّمَ قَضَى بِالْيَمِينِ مَعَ الشَّاهِدِ الْوَاحِدِ
قَالَ وَقَضَى بِهَا عَلِيٌّ فِيكُمْ قَالَ أَبُو عِيسَى وَهَذَا أَصَحُّ وَهَكَذَا رَوَى سُفْيَانُ الثَّوْرِيُّ عَنْ جَعْفَرِ بْنِ مُحَمَّدٍ عَنْ أَبِيهِ عَنْ النَّبِيِّ صَلَّى اللَّهُ عَلَيْهِ وَسَلَّمَ مُرْسَلًا وَرَوَى عَبْدُ الْعَزِيزِ بْنُ أَبِي سَلَمَةَ وَيَحْيَى بْنُ سُلَيْمٍ هَذَا الْحَدِيثَ عَنْ جَعْفَرِ بْنِ مُحَمَّدٍ عَنْ أَبِيهِ عَنْ عَلِيٍّ عَنْ النَّبِيِّ صَلَّى اللَّهُ عَلَيْهِ وَسَلَّمَ وَالْعَمَلُ عَلَى هَذَا عِنْدَ بَعْضِ أَهْلِ الْعِلْمِ مِنْ أَصْحَابِ النَّبِيِّ صَلَّى اللَّهُ عَلَيْهِ وَسَلَّمَ وَغَيْرِهِمْ رَأَوْا أَنَّ الْيَمِينَ مَعَ الشَّاهِدِ الْوَاحِدِ جَائِزٌ فِي الْحُقُوقِ وَالْأَمْوَالِ وَهُوَ قَوْلُ مَالِكِ بْنِ أَنَسٍ وَالشَّافِعِيِّ وَأَحْمَدَ وَإِسْحَقَ وَقَالُوا لَا يُقْضَى بِالْيَمِينِ مَعَ الشَّاهِدِ الْوَاحِدِ إِلَّا فِي الْحُقُوقِ وَالْأَمْوَالِ وَلَمْ يَرَ بَعْضُ أَهْلِ الْعِلْمِ مِنْ أَهْلِ الْكُوفَةِ وَغَيْرِهِمْ أَنْ يُقْضَى بِالْيَمِينِ مَعَ الشَّاهِدِ الْوَاحِدِ",30
