haditsId,kitabId,indo,arab,label
2051,31,"Telah menceritakan kepada kami [Bundar]; telah menceritakan kepada kami ['Abdurrahman bin Mahdi]; telah menceritakan kepada kami [Sufyan] dari [Manshur] dari [Ibrahim] dari [Al Aswad] dari ['Aisyah] bahwasanya; Ia ingin membeli Barirah, namun majikannya mempersyaratkan Al Wala` (kepemilikan tetap terhadap mereka), maka Nabi shallallahu 'alaihi wasallam bersabda: ""Sesungguhnya perwalian (hak milik) itu adalah bagi yang membayar, atau bagi waliyun ni'mah (yang merdekakan)."" Abu Isa berkata; Hadits semakna juga diriwayatkan dari Ibnu Umar dan Abu Hurairah. Dan ini adalah hadits Hasan Shahih. Dan menurut Ahlul Ilmi, hadits ini diamalkan.","حَدَّثَنَا بُنْدَارٌ حَدَّثَنَا عَبْدُ الرَّحْمَنِ بْنُ مَهْدِيٍّ حَدَّثَنَا سُفْيَانُ عَنْ مَنْصُورٍ عَنْ إِبْرَاهِيمَ عَنْ الْأَسْوَدِ عَنْ عَائِشَةَ
أَنَّهَا أَرَادَتْ أَنْ تَشْتَرِيَ بَرِيرَةَ فَاشْتَرَطُوا الْوَلَاءَ فَقَالَ النَّبِيُّ صَلَّى اللَّهُ عَلَيْهِ وَسَلَّمَ الْوَلَاءُ لِمَنْ أَعْطَى الثَّمَنَ أَوْ لِمَنْ وَلِيَ النِّعْمَةَ
قَالَ أَبُو عِيسَى وَفِي الْبَاب عَنْ ابْنِ عُمَرَ وَأَبِي هُرَيْرَةَ وَهَذَا حَدِيثٌ حَسَنٌ صَحِيحٌ وَالْعَمَلُ عَلَى هَذَا عِنْدَ أَهْلِ الْعِلْمِ",64
2052,31,"Telah menceritakan kepada kami [Ibnu Abu 'Umar]; telah menceritakan kepada kami [Sufyan bin 'Uyainah]; telah menceritakan kepada kami ['Abdullah bin Dinar] dia mendengar ['Abdullah bin 'Umar] bahwasanya Rasulullah shallallahu 'alaihi wasallam melarang penjualan Al Wala` (kepemilikan) dan juga menghibahkannya. Abu Isa berkata; Ini adalah hadits Hasan Shahih, kami tidak mengetahuinya kecuali dari haditsnya Abdullah bin Dinar dari Ibnu Umar dari Nabi shallallahu 'alaihi wasallam bahwasanya, beliau melarang penjualan Al Wala` atau pun menghibahkannya. Hadits ini juga telah diriwayatkan oleh [Syu'bah], [Sufyan Ats Tsauri] dan [Malik bin Anas] dari [Abdullah bin Dinar]. Dan diriwayatkan pula dari Syu'bah, ia berkata, ""Sungguh, aku berkeinginan bahwa Abdullah bin Dinar ketika meriwayatkan hadits ini untuk mengizinkan kepadaku agar aku mencium kepalanya. [Yahya bin Sulaim] juga meriwayatkan hadits ini dari [Ubaidullah bin Umar], dari [Nafi'] dari [Ibnu Umar] dari Nabi shallallahu 'alaihi wasallam, namun di dalamnya terdapat Wahm. Yang shahih adalah dari Ubaidullah bin Umar dari Abdullah bin Dinar dari Ibnu Umar dari Nabi shallallahu 'alaihi wasallam. Dan seperti ini pula yang diriwayatkan oleh lebih dari satu perawi dari Ubaidullah bin Umar. Abu Isa berkata; Abdullah bin Umar bersendirian dalam meriwayatkan hadits ini.","حَدَّثَنَا ابْنُ أَبِي عُمَرَ حَدَّثَنَا سُفْيَانُ بْنُ عُيَيْنَةَ حَدَّثَنَا عَبْدُ اللَّهِ بْنُ دِينَارٍ سَمِعَ عَبْدَ اللَّهِ بْنَ عُمَرَ
أَنَّ رَسُولَ اللَّهِ صَلَّى اللَّهُ عَلَيْهِ وَسَلَّمَ نَهَى عَنْ بَيْعِ الْوَلَاءِ وَعَنْ هِبَتِهِ
قَالَ أَبُو عِيسَى هَذَا حَدِيثٌ حَسَنٌ صَحِيحٌ لَا نَعْرِفُهُ إِلَّا مِنْ حَدِيثِ عَبْدِ اللَّهِ بْنِ دِينَارٍ عَنْ ابْنِ عُمَرَ عَنْ النَّبِيِّ صَلَّى اللَّهُ عَلَيْهِ وَسَلَّمَ أَنَّهُ نَهَى عَنْ بَيْعِ الْوَلَاءِ وَعَنْ هِبَتِهِ وَقَدْ رَوَاهُ شُعْبَةُ وَسُفْيَانُ الثَّوْرِيُّ وَمَالِكُ بْنُ أَنَسٍ عَنْ عَبْدِ اللَّهِ بْنِ دِينَارٍ وَيُرْوَى عَنْ شُعْبَةَ قَالَ لَوَدِدْتُ أَنَّ عَبْدَ اللَّهِ بْنَ دِينَارٍ حِينَ حَدَّثَ بِهَذَا الْحَدِيثِ أَذِنَ لِي حَتَّى كُنْتُ أَقُومُ إِلَيْهِ فَأُقَبِّلُ رَأْسَهُ وَرَوَى يَحْيَى بْنُ سُلَيْمٍ هَذَا الْحَدِيثَ عَنْ عُبَيْدِ اللَّهِ بْنِ عُمَرَ عَنْ نَافِعٍ عَنْ ابْنِ عُمَرَ عَنْ النَّبِيِّ صَلَّى اللَّهُ عَلَيْهِ وَسَلَّمَ وَهُوَ وَهْمٌ وَهِمَ فِيهِ يَحْيَى بْنُ سُلَيْمٍ وَالصَّحِيحُ عَنْ عُبَيْدِ اللَّهِ بْنِ عُمَرَ عَنْ عَبْدِ اللَّهِ بْنِ دِينَارٍ عَنْ ابْنِ عُمَرَ عَنْ النَّبِيِّ صَلَّى اللَّهُ عَلَيْهِ وَسَلَّمَ هَكَذَا رَوَاهُ غَيْرُ وَاحِدٍ عَنْ عُبَيْدِ اللَّهِ بْنِ عُمَرَ قَالَ أَبُو عِيسَى وَتَفَرَّدَ عَبْدُ اللَّهِ بْنُ دِينَارٍ بِهَذَا الْحَدِيثِ",64
2278,36,"Telah menceritakan kepada kami [Al 'Abbas Ad Duri] telah menceritakan kepada kami ['Abdullah bin Yazid Al Muqri`] telah menceritakan kepada kami [Sa'id bin Abu Ayyub] dari ['Amru bin Jabir Al Hadlrami] dari [Jabir bin 'Abdullah], Rasulullah Shallallahu 'alaihi wa salam bersabda: ""Orang-orang miskin masuk empatpuluh tahun terlebih dahulu sebelum orang-orang kaya."" Berkata Abu Isa: Hadits ini hasan.","حَدَّثَنَا الْعَبَّاسُ الدُّورِيُّ حَدَّثَنَا عَبْدُ اللَّهِ بْنُ يَزِيدَ الْمُقْرِئُ حَدَّثَنَا سَعِيدُ بْنُ أَبِي أَيُّوبَ عَنْ عَمْرِو بْنِ جَابِرٍ الْحَضْرَمِيِّ عَنْ جَابِرِ بْنِ عَبْدِ اللَّهِ
أَنَّ رَسُولَ اللَّهِ صَلَّى اللَّهُ عَلَيْهِ وَسَلَّمَ قَالَ يَدْخُلُ فُقَرَاءُ الْمُسْلِمِينَ الْجَنَّةَ قَبْلَ أَغْنِيَائِهِمْ بِأَرْبَعِينَ خَرِيفًا
هَذَا حَدِيثٌ حَسَنٌ",64
