haditsId,kitabId,indo,arab,label
106,1,"Telah menceritakan kepada kami [Mahmud bin Khalid] dan [Ya'qub bin Ka'ab Al Anthaki] lafazhnya: dia berkata; Telah menceritakan kepada kami [Al-Walid bin Muslim] dari [Hariz bin Utsman] dari [Abdurrahman bin Maisarah] dari [Al-Miqdam bin Ma'diy Karib] dia berkata; Saya pernah melihat Rasulullah shallallahu 'alaihi wasallam berwudhu, tatkala sampai pada gerakan mengusap kepalanya, beliau meletakkan kedua telapak tangannya pada bagian depan kepala, lalu menjalankan keduanya hingga tengkuk, kemudian mengembalikan keduanya ke tempat yang dipergunakannya ketika ia mulai. [Mahmud] berkata; telah mengabarkan kepada saya [Hariz]. Telah menceritakan kepada kami [Mahmud bin Khalid] dan [Hisyam bin Khalid] dengan makna yang sama. Mereka berdua berkata; [Al-Walid] telah menceritakan kepada kami dengan sanad ini, dia berkata; Beliau mengusap dua telinganya; bagian luar dan dalamnya. Hisyam menambahkan; Dan beliau memasukkan jari-jarinya pada lubang kedua telinganya. ","حَدَّثَنَا مَحْمُودُ بْنُ خَالِدٍ وَيَعْقُوبُ بْنُ كَعْبٍ الْأَنْطَاكِيُّ لَفْظُهُ قَالَا حَدَّثَنَا الْوَلِيدُ بْنُ مُسْلِمٍ عَنْ حَرِيزِ بْنِ عُثْمَانَ عَنْ عَبْدِ الرَّحْمَنِ بْنِ مَيْسَرَةَ عَنْ الْمِقْدَامِ بْنِ مَعْدِي كَرِبَ قَالَ
رَأَيْتُ رَسُولَ اللَّهِ صَلَّى اللَّهُ عَلَيْهِ وَسَلَّمَ تَوَضَّأَ فَلَمَّا بَلَغَ مَسْحَ رَأْسِهِ وَضَعَ كَفَّيْهِ عَلَى مُقَدَّمِ رَأْسِهِ فَأَمَرَّهُمَا حَتَّى بَلَغَ الْقَفَا ثُمَّ رَدَّهُمَا إِلَى الْمَكَانِ الَّذِي بَدَأَ مِنْهُ
قَالَ مَحْمُودٌ قَالَ أَخْبَرَنِي حَرِيزٌ حَدَّثَنَا مَحْمُودُ بْنُ خَالِدٍ وَهِشَامُ بْنُ خَالِدٍ الْمَعْنَى قَالَا حَدَّثَنَا الْوَلِيدُ بِهَذَا الْإِسْنَادِ قَالَ وَمَسَحَ بِأُذُنَيْهِ ظَاهِرِهِمَا وَبَاطِنِهِمَا زَادَ هِشَامٌ وَأَدْخَلَ أَصَابِعَهُ فِي صِمَاخِ أُذُنَيْهِ",0
1090,2,"Telah menceritakan kepada kami [Muhammad bin Abdurrahim Al Bazzaz] telah mengabarkan kepada kami [Sa'id bin Sulaiman] telah menceritakan kepada kami [Manshur bin Abu Al Aswad] dari [Al Mukhtar Al Fulful] dari [Anas bin Malik] dia berkata; ""Aku pernah mengerjakan shalat dua raka'at sebelum Maghrib pada masa Rasulullah shallallahu 'alaihi wasallam."" Mukhtar berkata; Lalu tanyaku kepada Anas; ""Apakah Rasulullah shallallahu 'alaihi wasallam pernah melihatmu (melakukan hal itu)?"" Anas menjawab; 'Ya, ketika itu beliau melihat kami, namun beliau tidak memerintahkan kami dan tidak juga melarang kami.""","حَدَّثَنَا مُحَمَّدُ بْنُ عَبْدِ الرَّحِيمِ الْبَزَّازُ أَخْبَرَنَا سَعِيدُ بْنُ سُلَيْمَانَ حَدَّثَنَا مَنْصُورُ بْنُ أَبِي الْأَسْوَدِ عَنْ الْمُخْتَارِ بْنِ فُلْفُلٍ عَنْ أَنَسِ بْنِ مَالِكٍ قَالَ
صَلَّيْتُ الرَّكْعَتَيْنِ قَبْلَ الْمَغْرِبِ عَلَى عَهْدِ رَسُولِ اللَّهِ صَلَّى اللَّهُ عَلَيْهِ وَسَلَّمَ قَالَ قُلْتُ لِأَنَسٍ أَرَآكُمْ رَسُولُ اللَّهِ صَلَّى اللَّهُ عَلَيْهِ وَسَلَّمَ قَالَ نَعَمْ رَآنَا فَلَمْ يَأْمُرْنَا وَلَمْ يَنْهَنَا",0
3702,29,"Telah menceritakan kepada kami [Utsman bin Abu Syaibah] berkata, telah menceritakan kepada kami [Jarir] dari [Al A'masy] dari [Abu Wail] dari [Hudzaifah] ia berkata, ""Rasulullah shallallahu 'alaihi wasallam pernah berdiri di hadapan kami (khutbah), tidak ada sesuatu pun yang bakal terjadi hingga datang hari kiamat kecuali beliau jelaskan saat itu (berdiri). Maka hafallah orang yang hafal dan lupalah orang yang lupa, dan para sahabatnya telah mengetahui hal itu. Sungguh, aku dapat mengingat apa yang disampaikan saat itu, sebagaimana seorang laki-laki yang mengingat wajah orang yang pergi kemudian bertemu lagi.""","حَدَّثَنَا عُثْمَانُ بْنُ أَبِي شَيْبَةَ حَدَّثَنَا جَرِيرٌ عَنْ الْأَعْمَشِ عَنْ أَبِي وَائِلٍ عَنْ حُذَيْفَةَ قَالَ
قَامَ فِينَا رَسُولُ اللَّهِ صَلَّى اللَّهُ عَلَيْهِ وَسَلَّمَ قَائِمًا فَمَا تَرَكَ شَيْئًا يَكُونُ فِي مَقَامِهِ ذَلِكَ إِلَى قِيَامِ السَّاعَةِ إِلَّا حَدَّثَهُ حَفِظَهُ مَنْ حَفِظَهُ وَنَسِيَهُ مَنْ نَسِيَهُ قَدْ عَلِمَهُ أَصْحَابُهُ هَؤُلَاءِ وَإِنَّهُ لَيَكُونُ مِنْهُ الشَّيْءُ فَأَذْكُرُهُ كَمَا يَذْكُرُ الرَّجُلُ وَجْهَ الرَّجُلِ إِذَا غَابَ عَنْهُ ثُمَّ إِذَا رَآهُ عَرَفَهُ",0
