haditsId,kitabId,indo,arab,label
1339,3,"Telah menceritakan kepada Kami [Musa bin Ismail], telah menceritakan kepada Kami [Hammad], ia berkata; aku mengambil sebuah tulisan dari [Tsumamah bin Abdullah bin Anas], ia mengaku bahwa [Abu Bakar] telah menulis [Anas] dan padanya terdapat stempel Rasulullah shallAllahu wa'alaihi wa sallam ketika ia mengutusnya sebagai petugas pengambil zakat, dan ia menulis untuknya, dan ternyata tulisan tersebut berisi: Ini adalah kewajiban zakat yang telah diwajibkan Rasulullah shallAllahu wa'alaihi wa sallam kepada orang-orang muslim yang telah Allah 'azza wajalla perintahkan kepada NabiNya shallallahu 'alaihi wasallam. Maka barangsiapa diantara orang-orang muslim yang diminta zakatnya sesuai dengan ketentuannya, maka hendaknya ia memberikannya. Dan barang siapa yang diminta lebih dari itu maka janganlah ia memberinya. Unta yang kurang dari dua puluh lima zakatnya adalah satu ekor kambing, setiap lima dzaud terdapat zakat satu ekor kambing, kemudian apabila telah mencapai dua puluh lima ekor maka padanya terdapat zakat satu ekor bintu makhadh hingga menjacapai tiga puluh lima, apabila tidak ada bintu makhadh maka ibnu labun (yang memiliki umur dua tahun) jantan, kemudian apabila telah mencapai tiga puluh enam maka padanya zakat bintu labun (yang memiliki umur dua tahun) hingga mencapai empat puluh lima, kemudian apabila telah mencapai empat puluh enam maka padanya hiqqah (yang memiliki umur tiga tahun) yang siap untuk hamil, hingga mencapai enam puluh. Kemudian apabila enam puluh satu maka padanya terdapat zakat tujuh puluh lima. Kemudian apabila telah mencapai tujuh puluh enam maka padanya zakat dua bintu labun (yang memiliki umur dua tahun), hingga mencapai sembilan puluh, kemudian apabila telah mencapai sembilan puluh satu maka padanya zakat dua ekor Hiqqah (yang memiliki umur tiga tahun) yang siap hamil, hingga mencapai seratus dua puluh. Kemudian apabila melebihi seratus dua puluh maka pada setiap empat puluh terdapat zakat satu ekor bintu labun (yang memiliki umur dua tahun), dan pada setiap lima puluh terdapat zakat satu ekor hiqqah (yang memiliki umur tiga tahun). Kemudian apabila telah nampak umur-umur unta dalam zakat-zakat wajib, maka barang siapa yang telah sampai padanya zakat jadza'ah (yang memiliki umur empat tahun) dan ia tidak memiliki jadza'ah (yang memiliki umur empat tahun) akan tetapi memiliki hiqqah (yang memiliki umur tiga tahun) maka diterima darinya, dan bersamanya ia memberikan dua ekor kambing apabila keduanya mudah baginya, uang atau dua puluh dirham. Dan barang siapa yang telah sampai padanya zakat hiqqah (yang memiliki umur tiga tahun) dan ia tidak memiliki hiqqah (yang memiliki umur tiga tahun) akan tetapi memiliki jadza'ah (yang memiliki umur empat tahun) maka diterima darinya dan petugas zakat memberinya uang dua puluh dirham, atau dua ekor kambing. Dan barang siapa yang telah sampai padanya zakat hiqqah (yang memiliki umur tiga tahun) dan ia tidak memiliki hiqqah (yang memiliki umur tiga tahun) akan tetapi memiliki bintu labun (yang memiliki umur dua tahun) maka diterima darinya. -Abu Daud berkata; dari sini aku tidak hafal dari Musa sebagaimana yang aku inginkan. - dan bersamanya ia memberikan dua ekor kambing apabila keduanya mudah baginya, atau dua puluh dirham. Dan barang siapa yang telah sampai padanya zakat bintu labun (yang memiliki umur dua tahun) dan ia hanya memiliki hiqqah (yang memiliki umur tiga tahun) maka diterima darinya -Abu Daud berkata; hingga sini kemudian aku meyakininya ia berkata; dan petugas pengambil zakat memberinya uang dua puluh dirham, atau dua ekor kambing. Dan barang siapa yang sampai padanya zakat bintu labun (yang memiliki umur dua tahun) dan ia hanya memiliki bintu makhadh maka diterima darinya disertai dengan dua ekor kambing atau uang dua dirham. Dna brang siapa yang telah sampai (nishab) zakat bintu makhadh dan ia hanya memiliki ibnu labun (yang memiliki umur dua tahun) jantan, maka diterima darinya dan tidak disertai dengan apapun. Dan barang siapa yang hanya memiliki dua ekor maka tidak ada zakat padanya kecuali pemiliknya menginginkannya. Pada kambing yang digembala di padang rumput apabila berjumlah empat puluh maka padanya zakat satu ekor kambing hingga seratus dua puluh ekor, kemudian apabila melebihi seratus dua puluh maka padanya zakat dua ekor kambing hingga mencapai dua ratus ekor. Kemudian apabila melebihi dua ratus ekor maka padanya terdapat zkaat tiga ekor kambing hingga mencapai tiga ratus, kemudian apabila telah melebihi tiga ratus ekor maka setiap seratus kambing terdapat zakat satu ekor kambing. Dan dalam zakat tidak diambil kambing yang tua dan telah tanggal gigi-giginya, kambing yang memiliki aib, dan kambing pejantan, kecuali petugas pengambil zakat menghendakinya. Tidak boleh digambungkan antara kambing yang dipisahkan dan tidak boleh dipisahkan antara kambing yang digabungkan karena khawatir wajib mengeluarkan zakat. Kambing yang berasal dari gabungan dua orang maka keduanya membagi dengan sama. Kemudian apabila kambing yang digembalakan di padang rumput tidak mencapai empat puluh ekor maka tidak ada zakat padanya kecuali pemiliknya menghendakinya. Pada perak terdapat zakat seperempat puluh, kemudian apabila harta tersebut hanya mencapai seratus sembilan puluh maka tidak ada zakat padanya kecuali pemiliknya menghendakinya. ","حَدَّثَنَا مُوسَى بْنُ إِسْمَعِيلَ حَدَّثَنَا حَمَّادٌ قَالَ
أَخَذْتُ مِنْ ثُمَامَةَ بْنِ عَبْدِ اللَّهِ بْنِ أَنَسٍ كِتَابًا زَعَمَ أَنَّ أَبَا بَكْرٍ كَتَبَهُ لِأَنَسٍ وَعَلَيْهِ خَاتِمُ رَسُولِ اللَّهِ صَلَّى اللَّهُ عَلَيْهِ وَسَلَّمَ حِينَ بَعَثَهُ مُصَدِّقًا وَكَتَبَهُ لَهُ فَإِذَا فِيهِ هَذِهِ فَرِيضَةُ الصَّدَقَةِ الَّتِي فَرَضَهَا رَسُولُ اللَّهِ صَلَّى اللَّهُ عَلَيْهِ وَسَلَّمَ عَلَى الْمُسْلِمِينَ الَّتِي أَمَرَ اللَّهُ عَزَّ وَجَلَّ بِهَا نَبِيَّهُ صَلَّى اللَّهُ عَلَيْهِ وَسَلَّمَ فَمَنْ سُئِلَهَا مِنْ الْمُسْلِمِينَ عَلَى وَجْهِهَا فَلْيُعْطِهَا وَمَنْ سُئِلَ فَوْقَهَا فَلَا يُعْطِهِ فِيمَا دُونَ خَمْسٍ وَعِشْرِينَ مِنْ الْإِبِلِ الْغَنَمُ فِي كُلِّ خَمْسِ ذَوْدٍ شَاةٌ فَإِذَا بَلَغَتْ خَمْسًا وَعِشْرِينَ فَفِيهَا بِنْتُ مَخَاضٍ إِلَى أَنْ تَبْلُغَ خَمْسًا وَثَلَاثِينَ فَإِنْ لَمْ يَكُنْ فِيهَا بِنْتُ مَخَاضٍ فَابْنُ لَبُونٍ ذَكَرٌ فَإِذَا بَلَغَتْ سِتًّا وَثَلَاثِينَ فَفِيهَا بِنْتُ لَبُونٍ إِلَى خَمْسٍ وَأَرْبَعِينَ فَإِذَا بَلَغَتْ سِتًّا وَأَرْبَعِينَ فَفِيهَا حِقَّةٌ طَرُوقَةُ الْفَحْلِ إِلَى سِتِّينَ فَإِذَا بَلَغَتْ إِحْدَى وَسِتِّينَ فَفِيهَا جَذَعَةٌ إِلَى خَمْسٍ وَسَبْعِينَ فَإِذَا بَلَغَتْ سِتًّا وَسَبْعِينَ فَفِيهَا ابْنَتَا لَبُونٍ إِلَى تِسْعِينَ فَإِذَا بَلَغَتْ إِحْدَى وَتِسْعِينَ فَفِيهَا حِقَّتَانِ طَرُوقَتَا الْفَحْلِ إِلَى عِشْرِينَ وَمِائَةٍ فَإِذَا زَادَتْ عَلَى عِشْرِينَ وَمِائَةٍ فَفِي كُلِّ أَرْبَعِينَ بِنْتُ لَبُونٍ وَفِي كُلِّ خَمْسِينَ حِقَّةٌ فَإِذَا تَبَايَنَ أَسْنَانُ الْإِبِلِ فِي فَرَائِضِ الصَّدَقَاتِ فَمَنْ بَلَغَتْ عِنْدَهُ صَدَقَةُ الْجَذَعَةِ وَلَيْسَتْ عِنْدَهُ جَذَعَةٌ وَعِنْدَهُ حِقَّةٌ فَإِنَّهَا تُقْبَلُ مِنْهُ وَأَنْ يَجْعَلَ مَعَهَا شَاتَيْنِ إِنْ اسْتَيْسَرَتَا لَهُ أَوْ عِشْرِينَ دِرْهَمًا وَمَنْ بَلَغَتْ عِنْدَهُ صَدَقَةُ الْحِقَّةِ وَلَيْسَتْ عِنْدَهُ حِقَّةٌ وَعِنْدَهُ جَذَعَةٌ فَإِنَّهَا تُقْبَلُ مِنْهُ وَيُعْطِيهِ الْمُصَدِّقُ عِشْرِينَ دِرْهَمًا أَوْ شَاتَيْنِ وَمَنْ بَلَغَتْ عِنْدَهُ صَدَقَةُ الْحِقَّةِ وَلَيْسَ عِنْدَهُ حِقَّةٌ وَعِنْدَهُ ابْنَةُ لَبُونٍ فَإِنَّهَا تُقْبَلُ
قَالَ أَبُو دَاوُد مِنْ هَاهُنَا لَمْ أَضْبِطْهُ عَنْ مُوسَى كَمَا أُحِبُّ وَيَجْعَلُ مَعَهَا شَاتَيْنِ إِنْ اسْتَيْسَرَتَا لَهُ أَوْ عِشْرِينَ دِرْهَمًا وَمَنْ بَلَغَتْ عِنْدَهُ صَدَقَةُ بِنْتِ لَبُونٍ وَلَيْسَ عِنْدَهُ إِلَّا حِقَّةٌ فَإِنَّهَا تُقْبَلُ مِنْهُ قَالَ أَبُو دَاوُد إِلَى هَاهُنَا ثُمَّ أَتْقَنْتُهُ وَيُعْطِيهِ الْمُصَدِّقُ عِشْرِينَ دِرْهَمًا أَوْ شَاتَيْنِ وَمَنْ بَلَغَتْ عِنْدَهُ صَدَقَةُ ابْنَةِ لَبُونٍ وَلَيْسَ عِنْدَهُ إِلَّا بِنْتُ مَخَاضٍ فَإِنَّهَا تُقْبَلُ مِنْهُ وَشَاتَيْنِ أَوْ عِشْرِينَ دِرْهَمًا وَمَنْ بَلَغَتْ عِنْدَهُ صَدَقَةُ ابْنَةِ مَخَاضٍ وَلَيْسَ عِنْدَهُ إِلَّا ابْنُ لَبُونٍ ذَكَرٌ فَإِنَّهُ يُقْبَلُ مِنْهُ وَلَيْسَ مَعَهُ شَيْءٌ وَمَنْ لَمْ يَكُنْ عِنْدَهُ إِلَّا أَرْبَعٌ فَلَيْسَ فِيهَا شَيْءٌ إِلَّا أَنْ يَشَاءَ رَبُّهَا وَفِي سَائِمَةِ الْغَنَمِ إِذَا كَانَتْ أَرْبَعِينَ فَفِيهَا شَاةٌ إِلَى عِشْرِينَ وَمِائَةٍ فَإِذَا زَادَتْ عَلَى عِشْرِينَ وَمِائَةٍ فَفِيهَا شَاتَانِ إِلَى أَنْ تَبْلُغَ مِائَتَيْنِ فَإِذَا زَادَتْ عَلَى مِائَتَيْنِ فَفِيهَا ثَلَاثُ شِيَاهٍ إِلَى أَنْ تَبْلُغَ ثَلَاثَ مِائَةٍ فَإِذَا زَادَتْ عَلَى ثَلَاثِ مِائَةٍ فَفِي كُلِّ مِائَةِ شَاةٍ شَاةٌ وَلَا يُؤْخَذُ فِي الصَّدَقَةِ هَرِمَةٌ وَلَا ذَاتُ عَوَارٍ مِنْ الْغَنَمِ وَلَا تَيْسُ الْغَنَمِ إِلَّا أَنْ يَشَاءَ الْمُصَدِّقُ وَلَا يُجْمَعُ بَيْنَ مُفْتَرِقٍ وَلَا يُفَرَّقُ بَيْنَ مُجْتَمِعٍ خَشْيَةَ الصَّدَقَةِ وَمَا كَانَ مِنْ خَلِيطَيْنِ فَإِنَّهُمَا يَتَرَاجَعَانِ بَيْنَهُمَا بِالسَّوِيَّةِ فَإِنْ لَمْ تَبْلُغْ سَائِمَةُ الرَّجُلِ أَرْبَعِينَ فَلَيْسَ فِيهَا شَيْءٌ إِلَّا أَنْ يَشَاءَ رَبُّهَا وَفِي الرِّقَةِ رُبْعُ الْعُشْرِ فَإِنْ لَمْ يَكُنْ الْمَالُ إِلَّا تِسْعِينَ وَمِائَةً فَلَيْسَ فِيهَا شَيْءٌ إِلَّا أَنْ يَشَاءَ رَبُّهَا",12
1340,3,"Telah menceritakan kepada Kami [Abdullah bin Muhammad An Nufaili], telah menceritakan kepada Kami ['Abbad bin Al 'Awwam] dari [Sufyan bin Al Husain] dari [Az Zuhri] dari [Salim] dari [ayahnya], ia berkata; Rasulullah shallAllahu wa'alaihi wa sallam telah menulis catatan mengenai zakat dan beliau tidak mengeluarkannya kepada para pegawainya hingga beliau meninggal. Beliau menyertakan pada pedangnya. Kemudian Abu Bakr melaksanakannya hingga ia meninggal, kemudian dilaksanakan oleh Umar hingga ia meninggal. Catatan tersebut berisi: Pada lima ekor unta terdapat zakat satu ekor kambing, dan pada sepuluh ekor terdapat zakat dua ekor kambing, pada lima belas ekor unta terdapat zakat tiga ekor kambing, pada dua puluh ekor unta terdapat empat ekor kambing, pada dua puluh lima ekor unta terdapat zakat satu ekor bintu makhadh hingga tiga puluh lima ekor, kemudian apabila lebih satu maka padanya terdapat zakat satu ekor bintu labun (yang memiliki umur dua tahun) hingga empat puluh lima ekor, kemudian apabila lebih satu maka padanya terdapat zakat satu ekor hiqqah (yang memiliki umur tiga tahun) hingga enam ekor, kemudian apabila lebih satu ekor maka padanya terdapat zakat satu ekor jadza'ah (yang memiliki umur empat tahun) hingga tujuh puluh lima ekor, kemudian apabila lebih satu ekor maka padanya terdapat zakat dua ekor bintu labun (yang memiliki umur dua tahun), hingga sembilan puluh ekor, kemudian apabila lebih satu ekor maka padanya terdapat zakat dua ekor hiqqah (yang memiliki umur tiga tahun), hingga seratus dua puluh ekor. Kemudian apabila lebih banyak dari itu maka pada setiap lima puluh ekor terdapat zakat satu ekor hiqqah (yang memiliki umur tiga tahun), dan pada setiap empat ekor terdapat zakat satu ekor bintu labun (yang memiliki umur dua tahun). Pada kambing setiap empat puluh ekor kambing terdapat zakat satu kambing, hingga seratus dua puluh ekor kambing. Kemudian apabila lebih satu ekor maka padanya terdapat zakat dua ekor kambing, hingga dua ratus ekor. Kemudian apabila satu ekor melebihi dua ratus ekor maka padanya terdapat zakat tiga ekor kambing, hingga tiga ratus ekor, kemudian apabila kambing tersebut lebih dari itu, maka pada setiap seratus ekor terdapat zakat satu ekor kambing, dan padanya tidak terdapat zakat hingga mencapai seratus ekor. Dan tidak dipisahkan antara kambing yang digabungkan dan tidak digabungkan antara kambing yang terpisah karena khawatir wajib zakat. Dan kambing yang berasal dari gabungan dua orang maka keduanya membagi dengan sama. Tidak diambil dalam zakat kambing yang sudah tua dan tanggal giginya, serta kambing yang memiliki aib. 'Abbad bin Al 'Awwam berkata; Az Zuhri berkata; apabila petugas zakat telah datang maka kambing dibagi menjadi tiga, seperti tiga adalah kambing jelek, sepertiga kambing pilihan, dan sepertiga kambing pertengahan. Kemudian petugas zakat mengambil dari kambing yang pertengahan, dan Az Zuhri tidak menyebutkan sapi. Telah menceritakan kepada Kami [Utsman bin Abu Syaibah], telah menceritakan kepada Kami [Muhammad bin Yazid Al Wasithi], telah mengabarkan kepada Kami [Sufyan bin Husain] dengan sanad dan maknanya, ia berkata; apabila tidak ada bintu makhadh, maka dikeluarkan ibnu labun (yang memiliki umur dua tahun). Dan ia tidak menyebutkan perkataan Az Zuhri. Telah menceritakan kepada Kami [Muhammad bin Al 'Ala`], telah mengabarkan kepada Kami [Ibnu Al Mubarak] dari [Yunus bin Yazid] dari [Ibnu Syihab], ia berkata; ini adalah naskah catatan Rasulullah shallAllahu wa'alaihi wa sallam yang beliau tulis mengenai zakat, dan naskah tersebut ada pada keluarga Umar bin Al Khathab. Ibnu Syihab berkata; Salim bin Abdullah bin Umar telah membacakannya kepadaku, kemudian aku menghafalnya sesuai dengan keandaanya, dan naskah itu yang disalin oleh Umar bin Abdul 'Aziz dari Abdullah bin Abdullah bin Umar, serta Salim bin Abdullah bin Umar. Kemudian ia menyebutkan hadits tersebut, ia berkata; apabila berjumlah seratus dua puluh satu maka padanya terdapat zakat tiga bintu labun (yang memiliki umur dua tahun), hingga mencapai seratus dua puluh sembilan. Kemudian apabila berjumlah seratus tiga puluh maka padanya terdapat zakat dua bintu labun (yang memiliki umur dua tahun), dan satu ekor hiqqah (yang memiliki umur tiga tahun), hingga mencapai seratus sembilan puluh sembilan. Kemudian apabila berjumlah seratus empat puluh maka padanya terdapat zakat dua hiqqah (yang memiliki umur tiga tahun) dan satu bintu labun (yang memiliki umur dua tahun), hingga mencapai seratus empat puluh sembilan. Kemudian apabila berjumlah seratus lima puluh maka padanya terdapat zakat tiga hiqqah (yang memiliki umur tiga tahun), hingga mencapai seratus lima puluh sembilan. Kemudian apabila berjumlah seratus sembilan puluh maka padanya terdapat zakat empat bintu labun (yang memiliki umur dua tahun), hingga mencapai seratus enam puluh sembilan. Kemudian apabila berjumlah seratus tujuh puluh maka padanya terdapat zakat tiga bintu labun (yang memiliki umur dua tahun) dan satu hiqqah (yang memiliki umur tiga tahun), hingga mencapai seratus tujuh puluh sembilan. Kemudian apabila berjumlah seratus delapan puluh maka padanya terdapat zakat dua hiqqah (yang memiliki umur tiga tahun), dan dua bintu labun (yang memiliki umur dua tahun), hingga mencapai seratus delapan puluh sembilan. Kemudian apabila berjumlah seratus sembilan puluh maka padanya terdapat zakat tiga hiqqah (yang memiliki umur tiga tahun), dan satu bintu labun (yang memiliki umur dua tahun), hingga mencapai seratus sembilan puluh sembilan. Kemudian apabila berjumlah dua ratus maka padanya terdapat zakat empat hiqqah (yang memiliki umur tiga tahun), atau lima bintu labun (yang memiliki umur dua tahun), kambing manapun yang berumur dua tahun didapat maka diambil. Dan pada hewan yang digembalakan di padang rumput ….. kemudian ia menyebutkan seperti hadits Sufyan bin Husain, dan padanya disebutkan; dan tidak diambil dalam zakat kambing yang tua dan telah tanggal giginya, serta yang memiliki aib, serta kambing pejantan, kecuali petugas zakat menghendakinya. ","حَدَّثَنَا عَبْدُ اللَّهِ بْنُ مُحَمَّدٍ النُّفَيْلِيُّ حَدَّثَنَا عَبَّادُ بْنُ الْعَوَّامِ عَنْ سُفْيَانَ بْنِ الْحُسَيْنِ عَنْ الزُّهْرِيِّ عَنْ سَالِمٍ عَنْ أَبِيهِ قَالَ
كَتَبَ رَسُولُ اللَّهِ صَلَّى اللَّهُ عَلَيْهِ وَسَلَّمَ كِتَابَ الصَّدَقَةِ فَلَمْ يُخْرِجْهُ إِلَى عُمَّالِهِ حَتَّى قُبِضَ فَقَرَنَهُ بِسَيْفِهِ فَعَمِلَ بِهِ أَبُو بَكْرٍ حَتَّى قُبِضَ ثُمَّ عَمِلَ بِهِ عُمَرُ حَتَّى قُبِضَ فَكَانَ فِيهِ فِي خَمْسٍ مِنْ الْإِبِلِ شَاةٌ وَفِي عَشْرٍ شَاتَانِ وَفِي خَمْسَ عَشْرَةَ ثَلَاثُ شِيَاهٍ وَفِي عِشْرِينَ أَرْبَعُ شِيَاهٍ وَفِي خَمْسٍ وَعِشْرِينَ ابْنَةُ مَخَاضٍ إِلَى خَمْسٍ وَثَلَاثِينَ فَإِنْ زَادَتْ وَاحِدَةً فَفِيهَا ابْنَةُ لَبُونٍ إِلَى خَمْسٍ وَأَرْبَعِينَ فَإِذَا زَادَتْ وَاحِدَةً فَفِيهَا حِقَّةٌ إِلَى سِتِّينَ فَإِذَا زَادَتْ وَاحِدَةً فَفِيهَا جَذَعَةٌ إِلَى خَمْسٍ وَسَبْعِينَ فَإِذَا زَادَتْ وَاحِدَةً فَفِيهَا ابْنَتَا لَبُونٍ إِلَى تِسْعِينَ فَإِذَا زَادَتْ وَاحِدَةً فَفِيهَا حِقَّتَانِ إِلَى عِشْرِينَ وَمِائَةٍ فَإِنْ كَانَتْ الْإِبِلُ أَكْثَرَ مِنْ ذَلِكَ فَفِي كُلِّ خَمْسِينَ حِقَّةٌ وَفِي كُلِّ أَرْبَعِينَ ابْنَةُ لَبُونٍ وَفِي الْغَنَمِ فِي كُلِّ أَرْبَعِينَ شَاةً شَاةٌ إِلَى عِشْرِينَ وَمِائَةٍ فَإِنْ زَادَتْ وَاحِدَةً فَشَاتَانِ إِلَى مِائَتَيْنِ فَإِنْ زَادَتْ وَاحِدَةً عَلَى الْمِائَتَيْنِ فَفِيهَا ثَلَاثُ شِيَاهٍ إِلَى ثَلَاثِ مِائَةٍ فَإِنْ كَانَتْ الْغَنَمُ أَكْثَرَ مِنْ ذَلِكَ فَفِي كُلِّ مِائَةِ شَاةٍ شَاةٌ وَلَيْسَ فِيهَا شَيْءٌ حَتَّى تَبْلُغَ الْمِائَةَ وَلَا يُفَرَّقُ بَيْنَ مُجْتَمِعٍ وَلَا يُجْمَعُ بَيْنَ مُتَفَرِّقٍ مَخَافَةَ الصَّدَقَةِ وَمَا كَانَ مِنْ خَلِيطَيْنِ فَإِنَّهُمَا يَتَرَاجَعَانِ بَيْنَهُمَا بِالسَّوِيَّةِ وَلَا يُؤْخَذُ فِي الصَّدَقَةِ هَرِمَةٌ وَلَا ذَاتُ عَيْبٍ
قَالَ و قَالَ الزُّهْرِيُّ إِذَا جَاءَ الْمُصَدِّقُ قُسِّمَتْ الشَّاءُ أَثْلَاثًا ثُلُثًا شِرَارًا وَثُلُثًا خِيَارًا وَثُلُثًا وَسَطًا فَأَخَذَ الْمُصَدِّقُ مِنْ الْوَسَطِ وَلَمْ يَذْكُرْ الزُّهْرِيُّ الْبَقَرَ حَدَّثَنَا عُثْمَانُ بْنُ أَبِي شَيْبَةَ حَدَّثَنَا مُحَمَّدُ بْنُ يَزِيدَ الْوَاسِطِيُّ أَخْبَرَنَا سُفْيَانُ بْنُ حُسَيْنٍ بِإِسْنَادِهِ وَمَعْنَاهُ قَالَ فَإِنْ لَمْ تَكُنْ ابْنَةُ مَخَاضٍ فَابْنُ لَبُونٍ وَلَمْ يَذْكُرْ كَلَامَ الزُّهْرِيِّ حَدَّثَنَا مُحَمَّدُ بْنُ الْعَلَاءِ أَخْبَرَنَا ابْنُ الْمُبَارَكِ عَنْ يُونُسَ بْنِ يَزِيدَ عَنْ ابْنِ شِهَابٍ قَالَ هَذِهِ نُسْخَةُ كِتَابِ رَسُولِ اللَّهِ صَلَّى اللَّهُ عَلَيْهِ وَسَلَّمَ الَّذِي كَتَبَهُ فِي الصَّدَقَةِ وَهِيَ عِنْدَ آلُ عُمَرَ بْنِ الْخَطَّابِ قَالَ ابْنُ شِهَابٍ أَقْرَأَنِيهَا سَالِمُ بْنُ عَبْدِ اللَّهِ بْنِ عُمَرَ فَوَعَيْتُهَا عَلَى وَجْهِهَا وَهِيَ الَّتِي انْتَسَخَ عُمَرُ بْنُ عَبْدِ الْعَزِيزِ مِنْ عَبْدِ اللَّهِ بْنِ عَبْدِ اللَّهِ بْنِ عُمَرَ وَسَالِمِ بْنِ عَبْدِ اللَّهِ بْنِ عُمَرَ فَذَكَرَ الْحَدِيثَ قَالَ فَإِذَا كَانَتْ إِحْدَى وَعِشْرِينَ وَمِائَةً فَفِيهَا ثَلَاثُ بَنَاتِ لَبُونٍ حَتَّى تَبْلُغَ تِسْعًا وَعِشْرِينَ وَمِائَةً فَإِذَا كَانَتْ ثَلَاثِينَ وَمِائَةً فَفِيهَا بِنْتَا لَبُونٍ وَحِقَّةٌ حَتَّى تَبْلُغَ تِسْعًا وَثَلَاثِينَ وَمِائَةً فَإِذَا كَانَتْ أَرْبَعِينَ وَمِائَةً فَفِيهَا حِقَّتَانِ وَبِنْتُ لَبُونٍ حَتَّى تَبْلُغَ تِسْعًا وَأَرْبَعِينَ وَمِائَةً فَإِذَا كَانَتْ خَمْسِينَ وَمِائَةً فَفِيهَا ثَلَاثُ حِقَاقٍ حَتَّى تَبْلُغَ تِسْعًا وَخَمْسِينَ وَمِائَةً فَإِذَا كَانَتْ سِتِّينَ وَمِائَةً فَفِيهَا أَرْبَعُ بَنَاتِ لَبُونٍ حَتَّى تَبْلُغَ تِسْعًا وَسِتِّينَ وَمِائَةً فَإِذَا كَانَتْ سَبْعِينَ وَمِائَةً فَفِيهَا ثَلَاثُ بَنَاتِ لَبُونٍ وَحِقَّةٌ حَتَّى تَبْلُغَ تِسْعًا وَسَبْعِينَ وَمِائَةً فَإِذَا كَانَتْ ثَمَانِينَ وَمِائَةً فَفِيهَا حِقَّتَانِ وَابْنَتَا لَبُونٍ حَتَّى تَبْلُغَ تِسْعًا وَثَمَانِينَ وَمِائَةً فَإِذَا كَانَتْ تِسْعِينَ وَمِائَةً فَفِيهَا ثَلَاثُ حِقَاقٍ وَبِنْتُ لَبُونٍ حَتَّى تَبْلُغَ تِسْعًا وَتِسْعِينَ وَمِائَةً فَإِذَا كَانَتْ مِائَتَيْنِ فَفِيهَا أَرْبَعُ حِقَاقٍ أَوْ خَمْسُ بَنَاتِ لَبُونٍ أَيُّ السِّنَّيْنِ وُجِدَتْ أُخِذَتْ وَفِي سَائِمَةِ الْغَنَمِ فَذَكَرَ نَحْوَ حَدِيثِ سُفْيَانَ بْنِ حُسَيْنٍ وَفِيهِ وَلَا يُؤْخَذُ فِي الصَّدَقَةِ هَرِمَةٌ وَلَا ذَاتُ عَوَارٍ مِنْ الْغَنَمِ وَلَا تَيْسُ الْغَنَمِ إِلَّا أَنْ يَشَاءَ الْمُصَدِّقُ",12
