haditsId,kitabId,indo,arab,label
1341,3,"Telah menceritakan kepada Kami [Abdullah bin Maslamah], ia berkata; [Malik] berkata; dan perkataan Umar bin Al Khathab radliallahu 'anhu; tidak digabungkan antara kambing yang terpisah, dan tidak dipisahkan antara kambing yang digabungkan, artinya bahwa setiap orang memiliki empat puluh kambing, kemudian apabila petugas zakat telah datang kepada mereka maka mereka menggabungkankannya agar mereka hanya mengeluarkan zakat satu ekor kambing. Dan tidak dipisahkan antara kambing yang digabungkan, bahwa dua orang yang menggabungkan kambing milik mereka apabila setiap mereka memiliki seratus satu ekor kambing maka kewajiban mereka berdua adalah zakat tiga ekor kambing. Kemudian apabila petugas zakat telah datang kepada mereka maka mereka memisahkan kambing mereka sehingga setiap orang hanya berkewajiban membayar zakat satu ekor kambing. Inilah yang aku dengar mengenai hal tersebut. ","حَدَّثَنَا عَبْدُ اللَّهِ بْنُ مَسْلَمَةَ قَالَ قَالَ مَالِكٌ
وَقَوْلُ عُمَرَ بْنِ الْخَطَّابِ رَضِيَ اللَّهُ عَنْهُ لَا يُجْمَعُ بَيْنَ مُتَفَرِّقٍ وَلَا يُفَرَّقُ بَيْنَ مُجْتَمِعٍ هُوَ أَنْ يَكُونَ لِكُلِّ رَجُلٍ أَرْبَعُونَ شَاةً فَإِذَا أَظَلَّهُمْ الْمُصَدِّقُ جَمَعُوهَا لِئَلَّا يَكُونَ فِيهَا إِلَّا شَاةٌ وَلَا يُفَرَّقُ بَيْنَ مُجْتَمِعٍ أَنَّ الْخَلِيطَيْنِ إِذَا كَانَ لِكُلِّ وَاحِدٍ مِنْهُمَا مِائَةُ شَاةٍ وَشَاةٌ فَيَكُونُ عَلَيْهِمَا فِيهَا ثَلَاثُ شِيَاهٍ فَإِذَا أَظَلَّهُمَا الْمُصَدِّقُ فَرَّقَا غَنَمَهُمَا فَلَمْ يَكُنْ عَلَى كُلِّ وَاحِدٍ مِنْهُمَا إِلَّا شَاةٌ فَهَذَا الَّذِي سَمِعْتُ فِي ذَلِكَ",12
1342,3,"Telah menceritakan kepada Kami [Abdullah bin Muhammad An Nufaili], telah menceritakan kepada Kami [Zuhair], telah menceritakan kepada Kami [Abu Ishaq] dari ['Ashim bin Dhamrah] dan [Al Harits Al A'war] dari [Ali] radliallahu 'anhu, [Zuhair] berkata; aku mengiranya dari Nabi shallallahu 'alaihi wasallam bahwa beliau bersabda: ""Berikan seperempat puluh, dari setiap empat puluh dirham satu dirham. Dan tidak ada kewajiban sedikitpun atas kalian hingga sempurna seratus dirham. Maka apabila telah berjumlah dua ratus dirham maka padanya terdapat zakat lima dirham, kemudian selebihnya sesuai perhitungan tersebut. Pada kambing, untuk jumlah empat puluh kambing zakat satu kambing, maka apabila hanya berjumlah tiga puluh sembilan maka tidak ada kewajiban sedikitpun atas kalian."" Dan ia menyebutkan zakat kambing seperti yang disebutkan Az Zuhri. Ia berkata; dan mengenai sapi pada setiap tiga puluh ekor terdapat seekor tabi', pada jumlah empat puluh terdapat satu musinnah, sapi yang digunakan untuk kerja tidak ada kewajiban sedikitpun, pada unta …kemudian ia menyebutkan zakatnya seperti yang telah disebutkan Az Zuhri. Ia berkata; dan pada jumlah dua puluh lima terdapat zakat lima kambing, kemudian apabila lebih satu ekor maka padanya terdapat zakat satu ekor bintu makhadh, kemudian apabila tidak ada bintu makhadh maka ibnu labun jantan, hingga tiga puluh lima. Kemudian apabila lebih satu ekor maka padanya zakat satu ekor bintu labun, hingga empat puluh lima. Kemudian apabila lebih satu ekor maka padanya terdapat zakat satu ekor hiqqah yang siap hamil, hingga enam puluh. Kemudian ia menyebutkan seperti hadits Az Zuhri. Ia berkata; kemudian apabila lebih satu ekor yaitu sembilan puluh satu ekor maka padanya terdapat zakat dua hiqqah yang siap untuk hamil, hingga seratus dua puluh. Kemudian apabila unta tersebut lebih banyak dari itu maka pada setiap lima puluh terdapat zakat satu hiqqah, dan tidak dipisahkan antara unta yang digabungkan, dan tidak digabungkan antara unta yang dipisahkan karena khawatir wajib mengeluarkan zakat. Dan tidak diambil dalam zakat unta yang tua dan telah tanggal giginya, serta yang miliki aib, dan unta pejantan, kecuali petugas zakat menghendakinya. Dan dalam tumbuh-tumbuhan yang diairi sungai atau disirami air hujan terdapat zakat sepersepuluh, dan yang disirami dengan ember maka padanya terdapat seperdua puluh. Dan dalam hadits 'Ashim serta Al Harits disebutkan; zakat pada setiap tahun. [Zuhair] berkata; aku mengira ia berkata lagi; dan dalam hadits ['Ashim] disebutkan; apabia diantara unta tersebut tidak ada bintu makhadh dan juga ibnu labun maka diganti sepuluh dirham atau dua ekor kambing. Telah menceritakan kepada Kami [Sulaiman bin Daud Al Mahri], telah mengabarkan kepada Kami [Ibnu Wahb], telah mengabarkan kepadaku [Jarir bin Hazim] dan ia menyebutkan orang yang lain, dari [Abu Ishaq], dari ['Ashim bin Dhamrah] serta [Al Harits Al A'war] dari [Ali] radliallahu 'anhu dari Nabi shallallahu 'alaihi wasallam dengan sebagian permulaan hadits ini berkata; kemudian apabila engkau memiliki dua ratus dirham, dan telah mencapai haul maka padanya terdapat zakat lima dirham, dan engkau tidak berkewajiban apapun yaitu pada emas hingga engkau memiliki dua puluh dinar. Maka apabila engkau memiliki uang dua puluh dinar dan telah mencapai haul maka padanya zakat setengah dinar, kemudian selebihnya sesuai dengan perhitungan tersebut. Zuhair berkata; aku tidak tahu apakah Ali mengatakan; sesuai dengan perhitungan tersebut atau ia merafa'kannya (menisbatkan perkataan kepada Rasulullah shallAllahu wa'alaihi wa sallam) kepada Nabi shallallahu 'alaihi wasallam. Dan tidak ada zakat pada harta hingga masuk satu haul. Hanya saja Jarir berkata; Ibnu Wahb menambahkan dalam hadits tersebut dari Nabi shallallahu 'alaihi wasallam; tidak ada zakat pada harta hingga masuk satu haul.","حَدَّثَنَا عَبْدُ اللَّهِ بْنُ مُحَمَّدٍ النُّفَيْلِيُّ حَدَّثَنَا زُهَيْرٌ حَدَّثَنَا أَبُو إِسْحَقَ عَنْ عَاصِمِ بْنِ ضَمْرَةَ وَعَنْ الْحَارِثِ الْأَعْوَرِ عَنْ عَلِيٍّ رَضِيَ اللَّهُ عَنْهُ قَالَ زُهَيْرٌ أَحْسَبُهُ عَنْ النَّبِيِّ صَلَّى اللَّهُ عَلَيْهِ وَسَلَّمَ
أَنَّه قَالَ هَاتُوا رُبْعَ الْعُشُورِ مِنْ كُلِّ أَرْبَعِينَ دِرْهَمًا دِرْهَمٌ وَلَيْسَ عَلَيْكُمْ شَيْءٌ حَتَّى تَتِمَّ مِائَتَيْ دِرْهَمٍ فَإِذَا كَانَتْ مِائَتَيْ دِرْهَمٍ فَفِيهَا خَمْسَةُ دَرَاهِمَ فَمَا زَادَ فَعَلَى حِسَابِ ذَلِكَ وَفِي الْغَنَمِ فِي أَرْبَعِينَ شَاةً شَاةٌ فَإِنْ لَمْ يَكُنْ إِلَّا تِسْعٌ وَثَلَاثُونَ فَلَيْسَ عَلَيْكَ فِيهَا شَيْءٌ وَسَاقَ صَدَقَةَ الْغَنَمِ مِثْلَ الزُّهْرِيِّ قَالَ وَفِي الْبَقَرِ فِي كُلِّ ثَلَاثِينَ تَبِيعٌ وَفِي الْأَرْبَعِينَ مُسِنَّةٌ وَلَيْسَ عَلَى الْعَوَامِلِ شَيْءٌ وَفِي الْإِبِلِ فَذَكَرَ صَدَقَتَهَا كَمَا ذَكَرَ الزُّهْرِيُّ قَالَ وَفِي خَمْسٍ وَعِشْرِينَ خَمْسَةٌ مِنْ الْغَنَمِ فَإِذَا زَادَتْ وَاحِدَةً فَفِيهَا ابْنَةُ مَخَاضٍ فَإِنْ لَمْ تَكُنْ بِنْتُ مَخَاضٍ فَابْنُ لَبُونٍ ذَكَرٌ إِلَى خَمْسٍ وَثَلَاثِينَ فَإِذَا زَادَتْ وَاحِدَةً فَفِيهَا بِنْتُ لَبُونٍ إِلَى خَمْسٍ وَأَرْبَعِينَ فَإِذَا زَادَتْ وَاحِدَةً فَفِيهَا حِقَّةٌ طَرُوقَةُ الْجَمَلِ إِلَى سِتِّينَ ثُمَّ سَاقَ مِثْلَ حَدِيثِ الزُّهْرِيِّ قَالَ فَإِذَا زَادَتْ وَاحِدَةً يَعْنِي وَاحِدَةً وَتِسْعِينَ فَفِيهَا حِقَّتَانِ طَرُوقَتَا الْجَمَلِ إِلَى عِشْرِينَ وَمِائَةٍ فَإِنْ كَانَتْ الْإِبِلُ أَكْثَرُ مِنْ ذَلِكَ فَفِي كُلِّ خَمْسِينَ حِقَّةٌ وَلَا يُفَرَّقُ بَيْنَ مُجْتَمِعٍ وَلَا يُجْمَعُ بَيْنَ مُفْتَرِقٍ خَشْيَةَ الصَّدَقَةِ وَلَا تُؤْخَذُ فِي الصَّدَقَةِ هَرِمَةٌ وَلَا ذَاتُ عَوَارٍ وَلَا تَيْسٌ إِلَّا أَنْ يَشَاءَ الْمُصَدِّقُ وَفِي النَّبَاتِ مَا سَقَتْهُ الْأَنْهَارُ أَوْ سَقَتْ السَّمَاءُ الْعُشْرُ وَمَا سَقَى الْغَرْبُ فَفِيهِ نِصْفُ الْعُشْرِ وَفِي حَدِيثِ عَاصِمٍ وَالْحَارِثِ الصَّدَقَةُ فِي كُلِّ عَامٍ قَالَ زُهَيْرٌ أَحْسَبُهُ قَالَ مَرَّةً وَفِي حَدِيثِ عَاصِمٍ إِذَا لَمْ يَكُنْ فِي الْإِبِلِ ابْنَةُ مَخَاضٍ وَلَا ابْنُ لَبُونٍ فَعَشَرَةُ دَرَاهِمَ أَوْ شَاتَانِ
حَدَّثَنَا سُلَيْمَانُ بْنُ دَاوُدَ الْمَهْرِيُّ أَخْبَرَنَا ابْنُ وَهْبٍ أَخْبَرَنِي جَرِيرُ بْنُ حَازِمٍ وَسَمَّى آخَرَ عَنْ أَبِي إِسْحَقَ عَنْ عَاصِمِ بْنِ ضَمْرَةَ وَالْحَارِثِ الْأَعْوَرِ عَنْ عَلِيٍّ رَضِيَ اللَّهُ عَنْهُ عَنْ النَّبِيِّ صَلَّى اللَّهُ عَلَيْهِ وَسَلَّمَ بِبَعْضِ أَوَّلِ هَذَا الْحَدِيثِ قَالَ فَإِذَا كَانَتْ لَكَ مِائَتَا دِرْهَمٍ وَحَالَ عَلَيْهَا الْحَوْلُ فَفِيهَا خَمْسَةُ دَرَاهِمَ وَلَيْسَ عَلَيْكَ شَيْءٌ يَعْنِي فِي الذَّهَبِ حَتَّى يَكُونَ لَكَ عِشْرُونَ دِينَارًا فَإِذَا كَانَ لَكَ عِشْرُونَ دِينَارًا وَحَالَ عَلَيْهَا الْحَوْلُ فَفِيهَا نِصْفُ دِينَارٍ فَمَا زَادَ فَبِحِسَابِ ذَلِكَ قَالَ فَلَا أَدْرِي أَعَلِيٌّ يَقُولُ فَبِحِسَابِ ذَلِكَ أَوْ رَفَعَهُ إِلَى النَّبِيِّ صَلَّى اللَّهُ عَلَيْهِ وَسَلَّمَ وَلَيْسَ فِي مَالٍ زَكَاةٌ حَتَّى يَحُولَ عَلَيْهِ الْحَوْلُ إِلَّا أَنَّ جَرِيرًا قَالَ ابْنُ وَهْبٍ يَزِيدُ فِي الْحَدِيثِ عَنْ النَّبِيِّ صَلَّى اللَّهُ عَلَيْهِ وَسَلَّمَ لَيْسَ فِي مَالٍ زَكَاةٌ حَتَّى يَحُولَ عَلَيْهِ الْحَوْلُ",12
1343,3,"Telah menceritakan kepada Kami ['Amr bin 'Aun], telah mengabarkan kepada Kami [Abu 'Awanah] dari [Abu Ishaq] dari ['Ashim bin Dhamrah] dari [Ali] 'alaihis salam, ia berkata; Rasulullah shallAllahu wa'alaihi wa sallam bersabda; Sungguh aku telah memaafkan dari mengambil zakat kuda dan budak, maka berikan zakat perak dari setiap empat puluh dirham, satu dirham. Tidak ada zakat sedikitpun pada jumlah seratus sembilan puluh, kemudian apabila telah mencapai dua ratus maka padanya terdapat zakat lima dirham. Abu Daud berkata; hadits ini telah diriwayatkan oleh [Al A'masy] dari [Abu Ishaq] sebagaimana yang dikatakan Abu 'Awanah, dan telah diriwayatkan oleh [Syaiban Abu Mu'awiyah] dan [Ibrahim bin Thahman] dari [Abu Ishaq] dari [Al Harits] dari [Ali] dari Nabi shallallahu 'alaihi wasallam seperti itu. Abu Daud berkata; dan hadits An Nufaili telah diriwayatkan oleh [Syu'bah] serta [Sufyan] dan yang lainnya dari [Abu Ishaq] dari ['Ashim] dari [Ali]. Mereka tidak merafa'kannya melainkan mereka memauqufkan kepada Ali. ","حَدَّثَنَا عَمْرُو بْنُ عَوْنٍ أَخْبَرَنَا أَبُو عَوَانَةَ عَنْ أَبِي إِسْحَقَ عَنْ عَاصِمِ بْنِ ضَمْرَةَ عَنْ عَلِيٍّ عَلَيْهِ السَّلَام قَالَ
قَالَ رَسُولُ اللَّهِ صَلَّى اللَّهُ عَلَيْهِ وَسَلَّمَ قَدْ عَفَوْتُ عَنْ الْخَيْلِ وَالرَّقِيقِ فَهَاتُوا صَدَقَةَ الرِّقَةِ مِنْ كُلِّ أَرْبَعِينَ دِرْهَمًا دِرْهَمًا وَلَيْسَ فِي تِسْعِينَ وَمِائَةٍ شَيْءٌ فَإِذَا بَلَغَتْ مِائَتَيْنِ فَفِيهَا خَمْسَةُ دَرَاهِمَ
قَالَ أَبُو دَاوُد رَوَى هَذَا الْحَدِيثَ الْأَعْمَشُ عَنْ أَبِي إِسْحَقَ كَمَا قَالَ أَبُو عَوَانَةَ وَرَوَاهُ شَيْبَانُ أَبُو مُعَاوِيَةَ وَإِبْرَاهِيمُ بْنُ طَهْمَانَ عَنْ أَبِي إِسْحَقَ عَنْ الْحَارِثِ عَنْ عَلِيٍّ عَنْ النَّبِيِّ صَلَّى اللَّهُ عَلَيْهِ وَسَلَّمَ مِثْلَهُ قَالَ أَبُو دَاوُد وَرَوَى حَدِيثَ النُّفَيْلِيِّ شُعْبَةُ وَسُفْيَانُ وَغَيْرُهُمَا عَنْ أَبِي إِسْحَقَ عَنْ عَاصِمٍ عَنْ عَلِيٍّ لَمْ يَرْفَعُوهُ أَوْقَفُوهُ عَلَى عَلِيٍّ",12
1344,3,"Telah menceritakan kepada Kami [Musa bin Ismail], telah menceritakan kepada Kami [Hammad], telah mengabarkan kepada Kami [Bahz bin Hakim] dan jalur periwayatan lain telah menceritakan kepada kami [Muhammad bin Al 'Ala'] dan telah mengabarkan kepada kami [Abu Usamah] dari [Bahz bin Hakim] dari [ayahnya] dari [kakeknya] bahwa Rasulullah shallallahu 'alaihi wasallam Bersabda: ""Pada setiap empat puluh unta saimah (yang digembala lebih dari satu tahun) terdapat zakat satu bintu labun (yang memiliki umur dua tahun), dan unta tidak boleh dipisahkan dari hitungannya, barangsiapa yang memberikan zakatnya karena mengharap pahala, maka baginya pahala. Dan barangsiapa yang enggan membayarnya, maka Kami akan mengambilnya dan setengah hartanya; sebagai kewajiban diantara kewajiban-kewajiban Allah Azza wa jalla, dan keluarga Muhammad tidak berhak sedikitpun dari harta tersebut.","حَدَّثَنَا مُوسَى بْنُ إِسْمَعِيلَ حَدَّثَنَا حَمَّادٌ أَخْبَرَنَا بَهْزُ بْنُ حَكِيمٍ ح و حَدَّثَنَا مُحَمَّدُ بْنُ الْعَلَاءِ وَأَخْبَرَنَا أَبُو أُسَامَةَ عَنْ بَهْزِ بْنِ حَكِيمٍ عَنْ أَبِيهِ عَنْ جَدِّهِ
أَنَّ رَسُولَ اللَّهِ صَلَّى اللَّهُ عَلَيْهِ وَسَلَّمَ قَالَ فِي كُلِّ سَائِمَةِ إِبِلٍ فِي أَرْبَعِينَ بِنْتُ لَبُونٍ وَلَا يُفَرَّقُ إِبِلٌ عَنْ حِسَابِهَا مَنْ أَعْطَاهَا مُؤْتَجِرًا قَالَ ابْنُ الْعَلَاءِ مُؤْتَجِرًا بِهَا فَلَهُ أَجْرُهَا وَمَنْ مَنَعَهَا فَإِنَّا آخِذُوهَا وَشَطْرَ مَالِهِ عَزْمَةً مِنْ عَزَمَاتِ رَبِّنَا عَزَّ وَجَلَّ لَيْسَ لِآلِ مُحَمَّدٍ مِنْهَا شَيْءٌ",12
1348,3,"Telah menceritakan kepada Kami [Al Hasan bin Ali], telah menceritakan kepada Kami [Waki'] dari [Zakariya bin Ishaq Al Makki] dari ['Amr bin Abu Sufyan Al Jumahi] dari [Muslim bin Tsafinah Al Yasykuri], [Al Hasan] berkata; [Rauh] berkata; [Muslim bin Syu'bah] berkata; Nafi' bin 'Alqamah mempekerjakan ayahku untuk melakukan urusan kaumnya, ia memerintahkannya agar mengambil zakat mereka. Muslim bin Syu'bah berkata; kemudian ayahku mengutusku pada sekelompok orang diantara mereka, kemudian aku datang kepada seseorang yang sudah tua yang dipanggil [Si'r bin Daisam], lalu aku katakan; sesungguhnya ayahku mengutusku untuk datang kepadamu yaitu agar aku mengambil zakatmu. Ia berkata; wahai anak saudaraku, semisal apakah kalian mengambilnya? Aku katakan; Kami akan memilih hingga Kami mengetahui kantong-kantong susu kambing. Ia berkata; wahai anak saudaraku, aku akan menceritakan kepadamu bahwa aku dahulu berada pada lembah diantara lembah-lembah ini pada zaman Rasulullah shallAllahu wa'alaihi wa sallam diantara kambing-kambingku, kemudian terdapat [dua orang laki-laki datang kepadaku dengan menunggang unta] dan berkata; sesungguhnya Kami adalah utusan Rasulullah shallallahu 'alaihi wasallam kepadamu agar engkau menunaikan zakat kambingmu. Kemudian aku katakan; apa yang harus aku tunaikan diantara kambing-kambingku? Kemudian mereka berkata; ini adalah kambing yang memiliki anak, dan Rasulullah shallAllahu wa'alaihi wa sallam telah melarang Kami untuk mengambil kambing yang memiliki anak. Aku katakan; apakah yang akan kalian ambil? Mereka berkata; kambing yang berumur empat tahun memasuki lima tahun atau yang berumur dua tahun memasuki tiga tahun. Si'r bin Daisam berkata; kemudian aku mengambil kambing yang berumur empat tahun yang mu'tath, mu'tath adalah yang belum melahirkan, dan telah datang waktunya melahirkan. Kemudian aku membawanya kepada mereka. Kemudian mereka berkata; berikan kepada Kami! Kemudian mereka membawanya bersama mereka di atas unta mereka, kemudian mereka pergi. Abu Daud berkata; [Abu 'Ashim] telah meriwayatkannya dari [Zakariya`], [Muslim bin Syu'bah] mengatakan pula sebagaimana yang dikatakan Rauh. Telah menceritakan kepada Kami [Muhammad bin Yunus An Nasai], telah menceritakan kepada Kami [Rauh], telah menceritakan kepada Kami [Zakariya` bin Ishaq] dengan sanadnya dengan hadits ini. [Muslim bin Syu'bah] berkata dalam hadits tersebut; dan syafi' adalah yang di dalam perutnya terdapat anak. ","حَدَّثَنَا الْحَسَنُ بْنُ عَلِيٍّ حَدَّثَنَا وَكِيعٌ عَنْ زَكَرِيَّا بْنِ إِسْحَقَ الْمَكِّيِّ عَنْ عَمْرِو بْنِ أَبِي سُفْيَانَ الْجُمَحِيِّ عَنْ مُسْلِمِ بْنِ ثَفِنَةَ الْيَشْكُرِيِّ قَالَ الْحَسَنُ رَوْحٌ يَقُولُ مُسْلِمُ بْنُ شُعْبَةَ قَالَ
اسْتَعْمَلَ نَافِعُ بْنُ عَلْقَمَةَ أَبِي عَلَى عِرَافَةِ قَوْمِهِ فَأَمَرَهُ أَنْ يُصَدِّقَهُمْ قَالَ فَبَعَثَنِي أَبِي فِي طَائِفَةٍ مِنْهُمْ فَأَتَيْتُ شَيْخًا كَبِيرًا يُقَالُ لَهُ سِعْرُ بْنُ دَيْسَمٍ فَقُلْتُ إِنَّ أَبِي بَعَثَنِي إِلَيْكَ يَعْنِي لِأُصَدِّقَكَ قَالَ ابْنُ أَخِي وَأَيَّ نَحْوٍ تَأْخُذُونَ قُلْتُ نَخْتَارُ حَتَّى إِنَّا نَتَبَيَّنَ ضُرُوعَ الْغَنَمِ قَالَ ابْنُ أَخِي فَإِنِّي أُحَدِّثُكَ أَنِّي كُنْتُ فِي شِعْبٍ مِنْ هَذِهِ الشِّعَابِ عَلَى عَهْدِ رَسُولِ اللَّهِ صَلَّى اللَّهُ عَلَيْهِ وَسَلَّمَ فِي غَنَمٍ لِي فَجَاءَنِي رَجُلَانِ عَلَى بَعِيرٍ فَقَالَا لِي إِنَّا رَسُولَا رَسُولِ اللَّهِ صَلَّى اللَّهُ عَلَيْهِ وَسَلَّمَ إِلَيْكَ لِتُؤَدِّيَ صَدَقَةَ غَنَمِكَ فَقُلْتُ مَا عَلَيَّ فِيهَا فَقَالَا شَاةٌ فَأَعْمَدُ إِلَى شَاةٍ قَدْ عَرَفْتُ مَكَانَهَا مُمْتَلِئَةٍ مَحْضًا وَشَحْمًا فَأَخْرَجْتُهَا إِلَيْهِمَا فَقَالَا هَذِهِ شَاةُ الشَّافِعِ وَقَدْ نَهَانَا رَسُولُ اللَّهِ صَلَّى اللَّهُ عَلَيْهِ وَسَلَّمَ أَنْ نَأْخُذَ شَافِعًا قُلْتُ فَأَيَّ شَيْءٍ تَأْخُذَانِ قَالَا عَنَاقًا جَذَعَةً أَوْ ثَنِيَّةً قَالَ فَأَعْمَدُ إِلَى عَنَاقٍ مُعْتَاطٍ وَالْمُعْتَاطُ الَّتِي لَمْ تَلِدْ وَلَدًا وَقَدْ حَانَ وِلَادُهَا فَأَخْرَجْتُهَا إِلَيْهِمَا فَقَالَا نَاوِلْنَاهَا فَجَعَلَاهَا مَعَهُمَا عَلَى بَعِيرِهِمَا ثُمَّ انْطَلَقَا
قَالَ أَبُو دَاوُد رَوَاهُ أَبُو عَاصِمٍ عَنْ زَكَرِيَّاءَ قَالَ أَيْضًا مُسْلِمُ بْنُ شُعْبَةَ كَمَا قَالَ رَوْحٌ حَدَّثَنَا مُحَمَّدُ بْنُ يُونُسَ النَّسَائِيُّ حَدَّثَنَا رَوْحٌ حَدَّثَنَا زَكَرِيَّاءُ بْنُ إِسْحَقَ بِإِسْنَادِهِ بِهَذَا الْحَدِيثِ قَالَ مُسْلِمُ بْنُ شُعْبَةَ قَالَ فِيهِ وَالشَّافِعُ الَّتِي فِي بَطْنِهَا الْوَلَدُ",12
1355,3,"Telah menceritakan kepada Kami [Abu Kamil] telah menceritakan kepada Kami [Abdul Wahid] yaitu Ibnu Ziyad. Dan telah diriwayatkan dari jalur yang lain: Telah menceritakan kepada Kami [Utsman bin Abu Syaibah], telah menceritakan kepada Kami [Abdurrahim bin Sulaiman] dan ini adalah hadits Abu Kamil, dari [Muhammad bin Abu Isma'il] telah menceritakan kepada kami [Abdurrahman bin Hilal Al 'Absi] dari [Jarir bin Abdullah], ia berkata; telah datang beberapa orang yaitu dari kalangan badui kepada Rasulullah shallAllahu wa'alaihi wa sallam dan berkata; sesungguhnya beberapa orang petugas pengambil zakat datang kepada Kami dan berbuat zhalim kepada Kami. Jarir berkata; kemudian beliau berkata; ""Buatlah para petugas zakat kalian ridha."" Mereka berkata; wahai Rasulullah, walaupun mereka berbuat zhalim kepada Kami? Beliau berkata: ""Buatlah para petugas tersebut zakat kalian ridha."" Utsman menambahkan; walaupun kalian dizhalimi. Abu Kamil berkata dalam haditsnya; Jarir berkata; tidaklah seorangpun petugas zakat pergi dariku setelah aku mendengar hal ini dari Rasulullah shallAllahu wa'alaihi wa sallam melainkan ia ridha kepadaku. ","حَدَّثَنَا أَبُو كَامِلٍ حَدَّثَنَا عَبْدُ الْوَاحِدِ يَعْنِي ابْنَ زِيَادٍ ح و حَدَّثَنَا عُثْمَانُ بْنُ أَبِي شَيْبَةَ حَدَّثَنَا عَبْدُ الرَّحِيمِ بْنُ سُلَيْمَانَ وَهَذَا حَدِيثُ أَبِي كَامِلٍ عَنْ مُحَمَّدِ بْنِ أَبِي إِسْمَعِيلَ حَدَّثَنَا عَبْدُ الرَّحْمَنِ بْنُ هِلَالٍ الْعَبْسِيُّ عَنْ جَرِيرِ بْنِ عَبْدِ اللَّهِ قَالَ
جَاءَ نَاسٌ يَعْنِي مِنْ الْأَعْرَابِ إِلَى رَسُولِ اللَّهِ صَلَّى اللَّهُ عَلَيْهِ وَسَلَّمَ فَقَالُوا إِنَّ نَاسًا مِنْ الْمُصَدِّقِينَ يَأْتُونَا فَيَظْلِمُونَا قَالَ فَقَالَ أَرْضُوا مُصَدِّقِيكُمْ قَالُوا يَا رَسُولَ اللَّهِ وَإِنْ ظَلَمُونَا قَالَ أَرْضُوا مُصَدِّقِيكُمْ زَادَ عُثْمَانُ وَإِنْ ظُلِمْتُمْ
قَالَ أَبُو كَامِلٍ فِي حَدِيثِهِ قَالَ جَرِيرٌ مَا صَدَرَ عَنِّي مُصَدِّقٌ بَعْدَ مَا سَمِعْتُ هَذَا مِنْ رَسُولِ اللَّهِ صَلَّى اللَّهُ عَلَيْهِ وَسَلَّمَ إِلَّا وَهُوَ عَنِّي رَاضٍ",12
1359,3,"Telah menceritakan kepada Kami [Muhammad bin Al Mutsanna] dan [Muhammad bin Yahya bin Fayyadh], mereka berkata; telah menceritakan kepada Kami [Abdul Wahhab], telah menceritakan kepada Kami ['Ubaidullah] dari [seorang laki-laki] dari [Makhul] dari ['Irak bin Malik] dari [Abu Hurairah] dari Nabi shallallahu 'alaihi wasallam, beliau bersabda: ""Tidak ada zakat pada kuda, dan budak, kecuali zakat fithrah pada budak.""","حَدَّثَنَا مُحَمَّدُ بْنُ الْمُثَنَّى وَمُحَمَّدُ بْنُ يَحْيَى بْنِ فَيَّاضٍ قَالَا حَدَّثَنَا عَبْدُ الْوَهَّابِ حَدَّثَنَا عُبَيْدُ اللَّهِ عَنْ رَجُلٍ عَنْ مَكْحُولٍ عَنْ عِرَاكِ بْنِ مَالِكٍ عَنْ أَبِي هُرَيْرَةَ
عَنْ النَّبِيِّ صَلَّى اللَّهُ عَلَيْهِ وَسَلَّمَ قَالَ لَيْسَ فِي الْخَيْلِ وَالرَّقِيقِ زَكَاةٌ إِلَّا زَكَاةُ الْفِطْرِ فِي الرَّقِيقِ",12
